id,institutionCode,specimen_number,coll_number,scientificName,taxonID,eventDate,year,month,day,startDayOfYear,verbatimEventDate,reproductiveCondition,county,locality,decimalLatitude,decimalLongitude,coordinateUncertaintyInMeters,minimumElevationInMeters,verbatimElevation,source,recordId,references
37998,SBBG,SBBG164508,30116,Nemophila menziesii var. menziesii,205103,4/30/1968,1968,4,30,121,4/30/1968,Flowers Present,Kern,Rankin Ranch logging rd up Breckenridge Mtn,35.418,-118.579,1000,,6100 [ft],cch2,urn:uuid:9bbacdba-9351-4418-94f8-f70f3b066285,http://cch2.org/portal/collections/individual/index.php?occid=37998
42672,SBBG,SBBG164507,108619,Nemophila menziesii var. menziesii,205103,4/30/1967,1967,4,30,120,4/30/1967,Flowers Present,Kern,near Tehachapi Loop monument on old Tehachapi Hwy,35.195066,-118.534846,200,,,cch2,urn:uuid:561328b3-a2d4-4823-879f-4a0efdb6cf1d,http://cch2.org/portal/collections/individual/index.php?occid=42672
44681,SBBG,SBBG164522,64775,Nemophila menziesii var. menziesii,205103,4/4/1928,1928,4,4,95,4/4/1928,Flowers Present,Santa Barbara,Solomon Hills: Foxen Cyn,34.778,-120.155,3,,,cch2,urn:uuid:de84c74f-e085-4b06-a42e-672fcaf5dc77,http://cch2.org/portal/collections/individual/index.php?occid=44681
52573,SBBG,SBBG164527,20369,Nemophila menziesii var. menziesii,205103,4/3/1964,1964,4,3,94,4/3/1964,Flowers Present,Santa Barbara,Colson Cyn,34.942,-120.1995,5,,1100 ft,cch2,urn:uuid:78daa20a-b1c6-4c21-b12e-1e5dc8b0f1c9,http://cch2.org/portal/collections/individual/index.php?occid=52573
58338,SBBG,SBBG164512,137391,Nemophila menziesii subsp. menziesii,205100,4/5/2017,2017,4,5,,4/5/2017,Flowers Present,San Benito,"[W of Cedar Flat, Griswold Hills]",36.5567,-120.8108,200,715,,cch2,urn:uuid:2dc3d68e-5130-4311-aaa2-7f97d77564b8,http://cch2.org/portal/collections/individual/index.php?occid=58338
59062,SBBG,SBBG164501,112378,Nemophila menziesii var. menziesii,205103,3/31/1985,1985,3,31,90,3/31/1985,Flowers Present,San Luis Obispo,"St Highway 58, ca. 100 m E of jct with Huerhuero Rd",,,,,,cch2,urn:uuid:d5d9b420-651c-4832-ab66-96b73602b077,http://cch2.org/portal/collections/individual/index.php?occid=59062
63687,SBBG,SBBG164523,6136,Nemophila menziesii var. menziesii,205103,4/25/1938,1938,4,25,115,4/25/1938,Flowers Present,Tulare,jacks Ranch near Posey Post Office,35.805,-118.681,,,,cch2,urn:uuid:5bf13e22-3c44-4c52-b574-36b808dbff43,http://cch2.org/portal/collections/individual/index.php?occid=63687
65199,SBBG,SBBG164521,64773,Nemophila menziesii var. menziesii,205103,1879-00-00,1879,0,0,,1879,Flowers Present,El Dorado,Rose Springs,38.715,-120.939,1000,,,cch2,urn:uuid:5d201160-05c3-4188-883c-09f13cc76a44,http://cch2.org/portal/collections/individual/index.php?occid=65199
70368,SBBG,SBBG164525,64774,Nemophila menziesii var. menziesii,205103,3/25/1928,1928,3,25,85,3/25/1928,Flowers Present,Santa Barbara,Santa Ynez Mtns: Gaviota Pass,34.4895,-120.225,500,,,cch2,urn:uuid:8cb15a9d-312f-4dec-af2d-c2411df396da,http://cch2.org/portal/collections/individual/index.php?occid=70368
70425,SBBG,SBBG164515,49063,Nemophila menziesii var. menziesii,205103,2/17/1974,1974,2,17,48,2/17/1974,Flowers Present,San Luis Obispo,"Grand View Mesa, Nipomo",35.01,-120.48,1000,,,cch2,urn:uuid:e8119bd2-76fa-4161-af81-b5ada4731274,http://cch2.org/portal/collections/individual/index.php?occid=70425
76240,SBBG,SBBG164511,138983,Nemophila menziesii var. menziesii,205103,4/10/2010,2010,4,10,100,10-Apr-10,,Ventura,"Cerro Noreste Rd, vicinity of Valle Vista Campground, W flank of Mt Abel, Los Padres National Forest.",34.87801,-119.34137,200,1469,4821ft,cch2,urn:uuid:550cff16-f876-4f9e-8f83-445b56fbac68,http://cch2.org/portal/collections/individual/index.php?occid=76240
79215,SBBG,SBBG164504,13120,Nemophila menziesii var. menziesii,205103,3/10/1961,1961,3,10,69,3/10/1961,Flowers Present,Fresno,jacalitos Cyn near Coalinga,36.1015,-120.311,2,,,cch2,urn:uuid:9e738d16-d94e-454d-a722-4dc69e547a6f,http://cch2.org/portal/collections/individual/index.php?occid=79215
84545,SBBG,SBBG164514,46841,Nemophila menziesii var. menziesii,205103,4/11/1973,1973,4,11,101,4/11/1973,Flowers Present,San Luis Obispo,St Highway 58 near Shell Crk,35.4585,-120.3335,1000,,,cch2,urn:uuid:ba4b4a65-be1c-46b5-86f3-7602ab279df8,http://cch2.org/portal/collections/individual/index.php?occid=84545
91202,SBBG,SBBG164528,29932,Nemophila menziesii var. menziesii,205103,3/24/1940,1940,3,24,84,3/24/1940,Flowers Present,Fresno,"Curry Mtn, Waltham Cyn [Warthan Cyn]), 9 mi SW of Coalinga",36.0942,-120.4711,1000,,1600 [ft],cch2,urn:uuid:9d07ebf2-0ba3-4dd5-981f-ccb39458489a,http://cch2.org/portal/collections/individual/index.php?occid=91202
93167,SBBG,SBBG164526,22104,Nemophila menziesii var. menziesii,205103,4/17/1965,1965,4,17,107,4/17/1965,Flowers Present,Santa Barbara,Santa Ynez Mtns: Los Padres National Forest; E fork of Cold Spring Cyn,34.465,-119.65,3,,,cch2,urn:uuid:1dee64dc-daf9-4041-8867-2034225c75f3,http://cch2.org/portal/collections/individual/index.php?occid=93167
99519,SBBG,SBBG164499,64781,Nemophila menziesii var. menziesii,205103,1896-00-00,1896,0,0,,1896,Flowers Present,San Luis Obispo,San Luis Obispo County [not specified],,,,,,cch2,urn:uuid:635d2c80-e3c1-4749-90e5-5244e736784c,http://cch2.org/portal/collections/individual/index.php?occid=99519
104876,SBBG,SBBG164506,15981,Nemophila menziesii var. menziesii,205103,4/20/1935,1935,4,20,110,4/20/1935,Flowers Present,Kern,Tehachapi Mtns,,,,,4200 [ft],cch2,urn:uuid:9f09eee5-42ba-403d-8eaf-cffb131ae671,http://cch2.org/portal/collections/individual/index.php?occid=104876
111939,SBBG,SBBG164517,15021,Nemophila menziesii var. menziesii,205103,4/7/1962,1962,4,7,97,4/7/1962,Flowers Present,San Luis Obispo,"Goldtree Hills, 0.5 mi SW of Grant Lake",35.5935,-120.152,1000,,1975 [ft],cch2,urn:uuid:736a32f0-9cd8-49a0-86d6-5692465b3cd8,http://cch2.org/portal/collections/individual/index.php?occid=111939
112404,SBBG,SBBG164505,81949,Nemophila menziesii var. menziesii,205103,3/18/1950,1950,3,18,77,3/18/1950,Flowers Present,Kern,"Soda Lake Rd to Carrizo Plain, ca. 0.8 mi off Hwy 399 near SLO County line",34.971165,-119.455567,500,,,cch2,urn:uuid:2dac38fe-b010-42aa-816e-37b57742d88d,http://cch2.org/portal/collections/individual/index.php?occid=112404
113691,SBBG,SBBG164510,6134,Nemophila menziesii var. menziesii,205103,3/10/1945,1945,3,10,69,3/10/1945,Flowers Present,Madera,Bass Lake,37.324,-119.558,7,,3450 [ft],cch2,urn:uuid:5740d474-7c50-4c6a-9398-95353de2645a,http://cch2.org/portal/collections/individual/index.php?occid=113691
114052,SBBG,SBBG164519,34892,Nemophila menziesii var. menziesii,205103,1889-05-00,1889,5,0,,1889-5,Flowers Present,San Luis Obispo,Morro Valley,,,,,,cch2,urn:uuid:596e97a0-9db2-490e-ad8b-d9e7cfc51b29,http://cch2.org/portal/collections/individual/index.php?occid=114052
125161,SBBG,SBBG164524,48273,Nemophila menziesii var. menziesii,205103,3/14/1973,1973,3,14,73,3/14/1973,,Santa Barbara,"El Mirasol block between Sola and Micheltorena streets, Santa Barbara",34.4293,-119.706,500,,,cch2,urn:uuid:2ee166eb-0407-4ef1-a3a8-774d6381afe4,http://cch2.org/portal/collections/individual/index.php?occid=125161
127054,SBBG,SBBG164520,64770,Nemophila menziesii var. menziesii,205103,1922-03-00,1922,3,0,,1922-3,Flowers Present,Riverside,Murrieta Hot Springs,33.56,-117.157,1000,,1309 [ft],cch2,urn:uuid:fb366217-a9f1-45e6-b782-516d5057f62d,http://cch2.org/portal/collections/individual/index.php?occid=127054
127595,SBBG,SBBG164503,40449,Nemophila menziesii var. menziesii,205103,3/17/1951,1951,3,17,76,3/17/1951,Flowers Present,Contra Costa,W of Orinda,37.88,-122.189,,,,cch2,urn:uuid:fd94928e-7a73-4933-8efa-3e9b8bdecd28,http://cch2.org/portal/collections/individual/index.php?occid=127595
127641,SBBG,SBBG164516,54841,Nemophila menziesii var. menziesii,205103,4/8/1979,1979,4,8,98,4/8/1979,Flowers Present,San Luis Obispo,2 mi S of California Valley along Soda Lake Rd,35.2993,-119.9771,500,,1900 [ft],cch2,urn:uuid:51168e4d-4487-4354-86dd-156b75ed483a,http://cch2.org/portal/collections/individual/index.php?occid=127641
130538,SBBG,SBBG164500,64776,Nemophila menziesii var. menziesii,205103,3/29/1929,1929,3,29,88,3/29/1929,Flowers Present,Santa Barbara,Santa Ynez Valley: Buellton to Lompoc,34.664,-120.333,12,,,cch2,urn:uuid:2dd84f41-ea83-49e0-b630-7bc577535bcd,http://cch2.org/portal/collections/individual/index.php?occid=130538
132327,SBBG,SBBG164498,137525,Nemophila menziesii subsp. menziesii,205100,4/22/2017,2017,4,22,112,4/22/2017,,Monterey,"[Tassajara Rd, near Chews Ridge Rd]",36.3125,-121.5725,200,1475,,cch2,urn:uuid:aebab99c-59e2-4f94-ba4b-35c4406f91e6,http://cch2.org/portal/collections/individual/index.php?occid=132327
133171,SBBG,SBBG164513,107487,Nemophila menziesii var. menziesii,205103,3/22/1961,1961,3,22,81,3/22/1961,Flowers Present,San Luis Obispo,Nacimiento River,,,,,1200 [ft],cch2,urn:uuid:71290cc0-8294-4fd4-9d59-c295aea3a7e1,http://cch2.org/portal/collections/individual/index.php?occid=133171
133513,SBBG,SBBG164502,64771,Nemophila menziesii var. menziesii,205103,1921-04-00,1921,4,0,,1921-4,Flowers Present,Lake,Lakeport,39.045,-122.92,1000,,1350 [ft],cch2,urn:uuid:357b5857-cc4a-47fa-a6e2-dfd67026df1f,http://cch2.org/portal/collections/individual/index.php?occid=133513
141596,SBBG,SBBG164518,96069,Nemophila menziesii var. menziesii,205103,4/8/1971,1971,4,8,98,4/8/1971,Flowers Present,San Luis Obispo,6 mi N of Cayucos,35.473,-120.984,2,,1700 [ft],cch2,urn:uuid:16cd29db-02b8-477d-89a5-905825d86463,http://cch2.org/portal/collections/individual/index.php?occid=141596
149846,SBBG,SBBG164529,127800,Nemophila menziesii var. menziesii,205103,4/5/2003,2003,4,5,95,4/5/2003,Flowers Present,Ventura,"Los Padres National Forest; N border of Sespe Condor Sanctuary, vicinity of Ant Camp on Agua Blanca Crk",34.5767,-118.8861,500,,2900 ft,cch2,urn:uuid:87595bd5-ba28-491a-8e5e-4d7da4c4df65,http://cch2.org/portal/collections/individual/index.php?occid=149846
156099,SBBG,SBBG164509,108888,Nemophila menziesii var. menziesii,205103,4/12/1991,1991,4,12,102,4/12/1991,Flowers Present,San Luis Obispo,"Los Padres National Forest; East Cuesta Ridge, 2 mi up East Cuesta Ridge Rd from La Cuesta Summit",35.339,-120.617,1000,,2000 [ft],cch2,urn:uuid:b9523418-1739-4a4b-9175-73c8f5f62c88,http://cch2.org/portal/collections/individual/index.php?occid=156099
196188,OBI,OBI106045,48661,Nemophila menziesii,205099,1930-00-00,1930,0,0,,"Spring, 1930",,Santa Barbara,,,,,,,cch2,urn:uuid:0207a805-9a9a-45ea-985c-d3dc83c88107,http://cch2.org/portal/collections/individual/index.php?occid=196188
196189,OBI,OBI106038,19531,Nemophila menziesii,205099,5/6/1967,1967,5,6,126,6-May-67,,San Luis Obispo,Avenales Wildlife refuge,35.2055285,-120.1912599,18747,,,cch2,urn:uuid:4e568f6f-415c-4ee3-a8a6-53752aac0521,http://cch2.org/portal/collections/individual/index.php?occid=196189
196190,OBI,OBI106022,77727,Nemophila menziesii,205099,3/1/1978,1978,3,1,60,1-Mar-78,,San Luis Obispo,"Carrizo Plain, 1 mi S of the jctn of hwy 58 and Sim soda lake san diego cr rd",35.351177,-120.005123,596,,,cch2,urn:uuid:ccc2255d-3a3f-4721-94ae-01e65f787a70,http://cch2.org/portal/collections/individual/index.php?occid=196190
196191,OBI,OBI106027,77726,Nemophila Menziesii,205099,3/1/1978,1978,3,1,60,1-Mar-78,,San Luis Obispo,"Carrizo Plain, 1 mi S of the jctn of hwy 58 and Sim. soda lake san diego cr rd",35.351177,-120.005123,596,,,cch2,urn:uuid:4a8b2cd8-977e-411f-9629-c892bf4d2bf5,http://cch2.org/portal/collections/individual/index.php?occid=196191
196192,OBI,OBI106046,13911,Nemophila menziesii,205099,6/19/1937,1937,6,19,170,19-Jun-37,,Humboldt,"North Coast Range, 3 mi W of Little Van Duzen River at summit of grade-Dinsmore to Bridgeville",40.483215,-123.740232,4627,762,2500ft.,cch2,urn:uuid:93b13155-4d19-44ab-875d-452513807429,http://cch2.org/portal/collections/individual/index.php?occid=196192
196193,OBI,OBI106052,40276,Nemophila menziesii,205099,3/18/1950,1950,3,18,77,18-Mar-50,,Kern,"Along Soda Lake Rd to Carrizo Plain, about 0.8 mi off hwy 399. Near San Luis Obispo county line",34.971205,-119.455334,657,,,cch2,urn:uuid:310f25c5-8ebc-46e7-bcd4-ea371e65ec0c,http://cch2.org/portal/collections/individual/index.php?occid=196193
196194,OBI,OBI106056,39146,Nemophila menziesii,205099,3/19/1978,1978,3,19,78,19-Mar-78,,Kern,"Along State hwy 178 in Kern River Cyn area, 8 mi W of jctn with Bodfish Rd",35.570441,-118.568642,4315,701,2300ft.,cch2,urn:uuid:c73f158a-e9b4-471c-bda6-246b4a9c7642,http://cch2.org/portal/collections/individual/index.php?occid=196194
196195,OBI,OBI106040,20178,Nemophila menziesii,205099,4/8/1979,1979,4,8,98,8-Apr-79,,San Luis Obispo,2 mi S of California Valley along Soda Lake Rd,35.2993,-119.9771,500,579,1900ft.,cch2,urn:uuid:f29762a2-fe15-493e-9479-860173be26b4,http://cch2.org/portal/collections/individual/index.php?occid=196195
196196,OBI,OBI106025,28779,Nemophila menziesii,205099,4/24/1981,1981,4,24,114,24-Apr-81,,San Luis Obispo,Jctn of Shell Crk Rd and Calif hwy 58 S of Shandon,35.45983,-120.33394,305,,,cch2,urn:uuid:18f556f7-c6b0-4eeb-a7f6-5de35540bda4,http://cch2.org/portal/collections/individual/index.php?occid=196196
196197,OBI,OBI106061,47389,Nemophila menziesii,205099,3/31/1985,1985,3,31,90,31-Mar-85,,San Luis Obispo,Along hwy 58 ca 100 m E of jctn with Huerhuero Rd,35.438108,-120.493918,148,,,cch2,urn:uuid:ebec7562-19ab-4f95-a908-63ac4debf139,http://cch2.org/portal/collections/individual/index.php?occid=196197
196198,OBI,OBI106063,54165,Nemophila menziesii,205099,4/15/1995,1995,4,15,105,15-Apr-95,,San Luis Obispo,"Shell Crk, ca 1/2 mi N of jctn with Calif rte 58",35.46411,-120.33005,221,450,450-500m,cch2,urn:uuid:0e74fefa-d2d0-4e9e-a1e4-64e20009a018,http://cch2.org/portal/collections/individual/index.php?occid=196198
196199,OBI,OBI106043,58215,Nemophila menziesii var. menziesii,205103,4/20/1998,1998,4,20,110,20-Apr-98,,San Luis Obispo,"North of Nacimiento Lake, .3 miles south from Interlake Road on Bee Rock Road.",,,,,,cch2,urn:uuid:1dd20626-8ac4-4e7a-9084-547fc83daeba,http://cch2.org/portal/collections/individual/index.php?occid=196199
196200,OBI,OBI106023,58342,Nemophila menziesii var. menziesii,205103,5/22/1998,1998,5,22,142,22-May-98,,San Luis Obispo,Caliente Range. Along Caliente Ridge Rd. between wildlife guzzler (35°03.432' N x 119°46.937' W) and Caliente Peak.,35.045615,-119.7714,1000,1554,4200-5100ft.,cch2,urn:uuid:10cbc9ec-6bb8-4fe4-b15d-1f408ba7f5eb,http://cch2.org/portal/collections/individual/index.php?occid=196200
196202,OBI,OBI106037,13914,Nemophila menziesii,205099,3/23/1952,1952,3,23,83,23-Mar-52,,San Luis Obispo,"Shell Crk. 3 mi E 12 mi S, Shandon",35.481179,-120.321879,9224,,,cch2,urn:uuid:4c62e482-beb9-4be7-acaf-99b8df68f02a,http://cch2.org/portal/collections/individual/index.php?occid=196202
196203,OBI,OBI106039,3990,Nemophila menziesii,205099,3/9/1971,1971,3,9,68,9-Mar-71,,San Luis Obispo,3 mi NE of Santa Margarita,35.418043,-120.568649,1486,274,900ft.,cch2,urn:uuid:2e94ae4c-a83c-45e0-a32e-404ea1536c35,http://cch2.org/portal/collections/individual/index.php?occid=196203
196204,OBI,OBI106053,40939,Nemophila menziesii,205099,4/8/1971,1971,4,8,98,8-Apr-71,,San Luis Obispo,Near top of hill in area of sedimentary deposits. 6 mi N of Cayucos,35.543942,-120.896932,800,518,1700ft.,cch2,urn:uuid:f3a42b5e-1ce8-4781-b6d4-99f8985c327f,http://cch2.org/portal/collections/individual/index.php?occid=196204
196205,OBI,OBI106029,39923,Nemophila menziesii,205099,3/14/1973,1973,3,14,73,14-Mar-73,,Santa Barbara,"In ""organic garden"", El Mirasol block between Sola and Micheltorena Sts, Santa Barbara",34.4293,-119.706,1000,,,cch2,urn:uuid:b804f93e-9fe1-4dc4-a927-5824b24e6919,http://cch2.org/portal/collections/individual/index.php?occid=196205
196206,OBI,OBI106020,43248,Nemophila menziesii,205099,4/30/1933,1933,4,30,120,30-Apr-33,,Monterey,"Santa Lucia mts, 6 mi from Carmel; N base of Santa Lucia Mts; 5 mi from ocean",36.527035,-121.835454,9491,30,<100ft.,cch2,urn:uuid:9241fd87-03ff-43cd-b4d2-bfab3190b7a5,http://cch2.org/portal/collections/individual/index.php?occid=196206
196207,OBI,OBI106030,48731,Nemophila menziesii,205099,1930-00-00,1930,0,0,,"Spring, 1930",,Santa Barbara,Santa Barbara,,,,,,cch2,urn:uuid:06fd8da7-696f-4c71-b2f5-10d8705afb4e,http://cch2.org/portal/collections/individual/index.php?occid=196207
196209,OBI,OBI106019,31239,Nemophila menziesii,205099,4/4/1979,1979,4,4,94,4-Apr-79,,San Luis Obispo,Indian Knob Tar Sands,35.197821,-120.66211,800,,,cch2,urn:uuid:ca5db302-e7ee-4f71-8b07-67124c69a6ce,http://cch2.org/portal/collections/individual/index.php?occid=196209
196210,OBI,OBI106060,56258,Nemophila menziesii,205099,3/22/1965,1965,3,22,81,22-Mar-65,,Santa Barbara,"Blue Cyn, N slope, Santa Ynez Mts",34.4916,-119.5865,50,,,cch2,urn:uuid:ca52f906-fb9a-40d3-8c68-422614b6470b,http://cch2.org/portal/collections/individual/index.php?occid=196210
196211,OBI,OBI106034,48732,Nemophila menziesii var. atomaria,205101,4/23/1939,1939,4,23,113,Apr 23 1939,,Marin,Nicasio,38.061745,-122.69831,818,45,150 ft,cch2,urn:uuid:500bcc60-9514-4a5b-9e1c-390e66c00a3e,http://cch2.org/portal/collections/individual/index.php?occid=196211
196212,OBI,OBI106036,3000,Nemophila menziesii,205099,6/1/1968,1968,6,1,153,1-Jun-68,,Mendocino,Pt. Arena light house,,,,15,50ft.,cch2,urn:uuid:717820d5-8913-48c4-ba49-59760445af23,http://cch2.org/portal/collections/individual/index.php?occid=196212
196213,OBI,OBI106024,46188,Nemophila menziesii,205099,5/6/1986,1986,5,6,126,6-May-86,,San Luis Obispo,Santa Margarita Ranch. Estadio field in E part of the ranch where a large stand of blue oaks occur on slopes of decomposed limestone,35.402195,-120.612946,2094,,,cch2,urn:uuid:f7bd0f52-b72d-4040-abb9-fac9b7f67859,http://cch2.org/portal/collections/individual/index.php?occid=196213
196214,OBI,OBI106062,50007,Nemophila menziesii,205099,2/2/1988,1988,2,2,33,2-Feb-88,,Tulare,"Pixley natl Wildlife Refuge, San Joaquin Valley. SESW sec 23",35.918675,-119.374004,4689,61,200ft.,cch2,urn:uuid:76a6b497-0428-4107-90fc-11c9eb5d01f7,http://cch2.org/portal/collections/individual/index.php?occid=196214
196215,OBI,OBI106026,28871,Nemophila menziesii,205099,4/4/1982,1982,4,4,94,4-Apr-82,,San Luis Obispo,"Huasna Rd, 1/2 mi NW of where the Huasna River crosses the rd",35.12639,-120.4025,500,,,cch2,urn:uuid:0d43b601-42d8-4f0b-889f-3aab74e4837d,http://cch2.org/portal/collections/individual/index.php?occid=196215
196217,OBI,OBI106048,54498,Nemophila menziesii,205099,4/5/1997,1997,4,5,95,5-Apr-97,,Kern,Bitter Crk Natl Wildlife Refuge. Near Cerro Noroeste Rd where rd to Red lake intersects,34.861591,-119.213581,14747,,,cch2,urn:uuid:2e5df727-481b-4775-a68c-a0f3c718f1e0,http://cch2.org/portal/collections/individual/index.php?occid=196217
196218,OBI,OBI106033,6323,Nemophila menziesii,205099,4/6/1968,1968,4,6,97,6-Apr-68,,San Luis Obispo,On hill on W side of Carrizo Plain due W of Soda lake's southern end,35.206217,-119.881875,3623,,,cch2,urn:uuid:504105ea-5ea5-4cc0-9740-1970618b5b99,http://cch2.org/portal/collections/individual/index.php?occid=196218
196219,OBI,OBI106055,13915,Nemophila menziesii,205099,4/3/1966,1966,4,3,93,3-Apr-66,,San Luis Obispo,Lopez Cyn near the 15th or 16 crk crossing,35.279519,-120.540786,3205,,,cch2,urn:uuid:e8991025-34d5-4d41-95a7-58f2676e1cce,http://cch2.org/portal/collections/individual/index.php?occid=196219
196220,OBI,OBI106028,13917,Nemophila menziesii,205099,2/29/1964,1964,2,29,60,29-Feb-64,,San Luis Obispo,"Routzahn Park Rd, approx 11 mi from SLO",35.207788,-120.470393,3873,,,cch2,urn:uuid:db8f99ca-b617-41c3-b3f4-aab51f803a7f,http://cch2.org/portal/collections/individual/index.php?occid=196220
196221,OBI,OBI106058,13916,Nemophila menziesii var. integrifolia,205102,5/18/1954,1954,5,18,138,18-May-54,,San Diego,"On grade along State hwy 94, 5.5 mi W of Campo and 3.8 mi E of Potrero",32.5962,-116.545,805,732,2400ft.,cch2,urn:uuid:038cf9c0-d15a-456d-8730-c73fc8665bfc,http://cch2.org/portal/collections/individual/index.php?occid=196221
196222,OBI,OBI106049,13913,Nemophila menziesii,205099,4/8/1952,1952,4,8,99,8-Apr-52,,San Luis Obispo,La Panza District,35.379759,-120.285566,3000,,,cch2,urn:uuid:e8f7be24-e63d-4d3c-94b0-b08f2b32ce40,http://cch2.org/portal/collections/individual/index.php?occid=196222
196223,OBI,OBI106054,2749,Nemophila Menziesii,205099,3/19/1958,1958,3,19,78,19-Mar-58,,San Luis Obispo,"Carrizo Plain, nea N base of Caliente Mt",35.084389,-119.752739,3783,,,cch2,urn:uuid:ee9d0ee0-6028-4e16-b8f3-03c5e82dbad8,http://cch2.org/portal/collections/individual/index.php?occid=196223
196224,OBI,OBI106051,30158,Nemophila menziesii,205099,4/1/1962,1962,4,1,91,1-Apr-62,,San Luis Obispo,About 4 mi E of Cholame,35.724109,-120.225261,3565,,,cch2,urn:uuid:01b6cdee-e192-4960-9f26-d737ca2970c0,http://cch2.org/portal/collections/individual/index.php?occid=196224
196225,OBI,OBI106017,42757,Nemophila Menziesii,205099,4/12/1969,1969,4,12,102,12-Apr-69,,Riverside,"Box Springs mts, NW slope of hill, SE of UCR",33.96621,-117.31939,633,366,1200ft.,cch2,urn:uuid:4588ea70-57fe-4b57-96a6-b921f389f07b,http://cch2.org/portal/collections/individual/index.php?occid=196225
196226,OBI,OBI106035,13912,Nemophila menziesii,205099,4/6/1956,1956,4,6,97,6-Apr-56,,San Luis Obispo,Los Berros Cyn approx 4 mi N of Nipomo,35.09084,-120.46303,3290,,,cch2,urn:uuid:27b9047e-4953-4f09-b4ec-086e0c4465ff,http://cch2.org/portal/collections/individual/index.php?occid=196226
196227,OBI,OBI106059,40889,Nemophila menziesii,205099,3/20/1965,1965,3,20,79,20-Mar-65,,Fresno,"Along the Fresno side of Millerton Lake (above the lake 300 ft), W slope of hill",36.997662,-119.703272,3589,213,700ft.,cch2,urn:uuid:1dd75b3a-86dc-42a5-ad89-30c5c1b2915c,http://cch2.org/portal/collections/individual/index.php?occid=196227
196228,OBI,OBI106032,19838,Nemophila menziesii,205099,4/16/1978,1978,4,16,106,16-Apr-78,,San Luis Obispo,Off hwy 58 near hwy 127 turnoff,35.434689,-120.494125,37721,,,cch2,urn:uuid:80df04dc-6fc6-4df6-8e18-cda2c9ebc2f7,http://cch2.org/portal/collections/individual/index.php?occid=196228
196229,OBI,OBI106042,72620,Nemophila menziesii var. menziesii,205103,3/3/2002,2002,3,3,62,3-Mar-02,,San Luis Obispo,1/2 mi from Little Falls crk trailhead off Upper Lopez cyn Rd,,,,240,,cch2,urn:uuid:efb5d726-f5e8-45db-8a94-b3d7b8cc56c0,http://cch2.org/portal/collections/individual/index.php?occid=196229
196230,OBI,OBI106044,45546,Nemophila menziesii var. menziesii,205103,4/9/1957,1957,4,9,99,9-Apr-57,,Santa Barbara,"Along el Camino Cielo, about 0.75 mi e of San Marcos Pass, Santa Ynez mts",,,,,,cch2,urn:uuid:a9dc4e85-4d4a-4ebd-8864-cc5d93e40d59,http://cch2.org/portal/collections/individual/index.php?occid=196230
196231,OBI,OBI106041,66647,Nemophila menziesii,205099,4/5/1994,1994,4,5,95,5-Apr-94,,San Luis Obispo,"Pine Mt Region. from slope along Ridge Rd between Ridge meadows, Tobacco Crk drainage",,,,914,3000ft.,cch2,urn:uuid:d688f45f-3997-45cd-9264-aa6e31028c2d,http://cch2.org/portal/collections/individual/index.php?occid=196231
196232,OBI,OBI106031,52226,Nemophila menziesii var. menziesii,205103,3/16/1995,1995,3,16,75,16-Mar-95,,Santa Barbara,"Vandenberg AFB. NE part of base, along NW side of Calif hwy 1, 0.7-1.6 mi NE of intersection with San Antonio Rd W",34.7795,-120.4273,1500,,,cch2,urn:uuid:36002f6f-4b47-4f76-8776-bf1ffb8111cb,http://cch2.org/portal/collections/individual/index.php?occid=196232
196233,OBI,OBI106018,64941,Nemophila menziesii,205099,3/24/2005,2005,3,24,83,24-Mar-05,,San Luis Obispo,SE half of the Caliente Range. Approx 1.6 km NNW of Wells Cyn,35.027778,-119.665278,,,,cch2,urn:uuid:b6d2cbf8-a4b8-43c8-934f-a1ee42280c2b,http://cch2.org/portal/collections/individual/index.php?occid=196233
196234,OBI,OBI106021,31240,Nemophila menziesii,205099,4/4/1979,1979,4,4,94,4-Apr-79,,San Luis Obispo,Indian Knob Tar Sands,35.197821,-120.66211,800,,,cch2,urn:uuid:5dbf89c1-8ec7-4264-b1f6-026edef35362,http://cch2.org/portal/collections/individual/index.php?occid=196234
196293,OBI,OBI106050,48660,Nemophila menziesii,205099,1892-03-00,1892,3,0,,"March, 1892",,San Francisco,Lake Merced,37.718031,-122.493049,1370,,,cch2,urn:uuid:2fa3b7e3-7a84-4361-b263-424132514721,http://cch2.org/portal/collections/individual/index.php?occid=196293
213871,OBI,OBI106047,83127,Nemophila menziesii,205099,4/24/1967,1967,4,24,114,4/24/1967,,San Luis Obispo,North-facing rocky slope near entrance to Routzahn park in Arroyo Grande canyon.,,,,122,400 ft,cch2,urn:uuid:6b73ec8c-ee26-4edc-b0e5-a38045729aca,http://cch2.org/portal/collections/individual/index.php?occid=213871
253761,LOB,LOB115754,,Nemophila menziesii var. menziesii,205103,3/11/2016,2016,3,11,71,11-Mar-16,flowers,Riverside,"near San Gorgonio Pass, W of Palm Springs, near town of Snow Creek, UC Natural Reserve Oasis de los Osos.",33.89014,-116.69586,5,515,,cch2,urn:uuid:1dab4c6c-abf0-41dc-a0b5-73c94982783f,http://cch2.org/portal/collections/individual/index.php?occid=253761
295235,UCSB,UCSB039247,71107,Nemophila menziesii,205099,,,,,,,,Kern,Rancheria Rd junction with Poso Flat Rd. Sequoia Nat'l Forest.,,,,,,cch2,urn:uuid:c65da08a-c493-45d3-8f5a-c676b6ad9752,http://cch2.org/portal/collections/individual/index.php?occid=295235
295262,UCSB,UCSB039256,71124,Nemophila menziesii var. integrifolia,205102,,,,,,,,Kern,"Alta Sierra, Greenhorn Mt. 8 miles above Lake Isabella, off of Hwy 155. Private property (L. Theroux) abutting Sequoia Nat'l Forest. Collection include along portion of Ice House Creek on N of property and in Sequoia N.F. to W of property.",35.72694,-118.54583,600,,,cch2,urn:uuid:6169c3d2-f6d6-4d54-92af-742b0422f57f,http://cch2.org/portal/collections/individual/index.php?occid=295262
304795,UCSB,UCSB030094,72228,Nemophila menziesii var. integrifolia,205102,5/29/2003,2003,5,29,149,,,Los Angeles,"Transverse Ranges; Verdugo Mountains region; W end of mtns.; at jct. of Vendugo motorway and Wildwood Fire Road; (Burbank 7.5 Quad.; T2N R14W S26, SW1/4) UTM Zone; 3787689N 0378361E",,,,,,cch2,urn:uuid:66c860b1-cb0b-4361-a235-21d5563b4247,http://cch2.org/portal/collections/individual/index.php?occid=304795
305947,UCSB,UCSB030055,44937,Nemophila menziesii,205099,3/13/1979,1979,3,13,72,,,Santa Barbara,North of Santa Barbara County Health Building,,,,,,cch2,urn:uuid:25389b90-214b-48c0-9d56-413cb5e5e9d4,http://cch2.org/portal/collections/individual/index.php?occid=305947
305948,UCSB,UCSB030054,49531,Nemophila menziesii,205099,4/15/1983,1983,4,15,105,,,San Luis Obispo,East Cuesta Ridge Rd.; 2 miles from junction with Hwy. 101,,,,,,cch2,urn:uuid:9e20a4cd-60d0-4a56-a4ec-c2d895753e05,http://cch2.org/portal/collections/individual/index.php?occid=305948
305949,UCSB,UCSB030053,14717,Nemophila menziesii,205099,2/25/1961,1961,2,25,56,,,Santa Barbara,"Along the Alamo Pintado Creek from 7-8 miles north of Los Olivos; base of Figueroa Mountain, Birabent Canyon, San Rafael Range",34.748,-120.053,1000,,,cch2,urn:uuid:a4d5bf1a-3632-4023-b9ef-968a69ffcd2c,http://cch2.org/portal/collections/individual/index.php?occid=305949
305950,UCSB,UCSB030052,12634,Nemophila menziesii,205099,3/17/1962,1962,3,17,76,,,Riverside,Southwest of U.S. Highway 71; about 300 feet; by the Alberhill brickyard in Alberhill,33.72163,-117.39338,1349,,,cch2,urn:uuid:39476775-1f00-4190-b2e0-244ad12c3e5f,http://cch2.org/portal/collections/individual/index.php?occid=305950
305951,UCSB,UCSB030051,16230,Nemophila menziesii,205099,4/11/1963,1963,4,11,101,,,Santa Clara,In field west of 12179 Hilltop Drive; Los Altos Hills,,,,,,cch2,urn:uuid:e0ae2b03-d76a-4e06-8f90-5b5e374f35fa,http://cch2.org/portal/collections/individual/index.php?occid=305951
305952,UCSB,UCSB030050,16228,Nemophila menziesii,205099,5/4/1963,1963,5,4,124,,,Riverside,In San Jacinto Mountains; 4 miles south og Banning on Banning to Idyllwild Road,33.88068,-116.84681,1000,,,cch2,urn:uuid:cea9e69b-7403-445b-8ca4-08d70c1ccf09,http://cch2.org/portal/collections/individual/index.php?occid=305952
305953,UCSB,UCSB030049,16227,Nemophila menziesii,205099,4/21/1963,1963,4,21,111,,,Santa Barbara,Lower end of Lake Cachuma; 4.7 miles east of Armour Ranch Road on State Highway 150,,,,,,cch2,urn:uuid:1f3b0253-70b5-4d1a-b7a3-f90b50803c24,http://cch2.org/portal/collections/individual/index.php?occid=305953
305954,UCSB,UCSB030048,5328,Nemophila menziesii,205099,2/27/1952,1952,2,27,58,,,Santa Barbara,Above Rattlesnake Dam; on trail,,,,,,cch2,urn:uuid:7f35b802-cea3-458e-9ff8-48d996a06bd9,http://cch2.org/portal/collections/individual/index.php?occid=305954
305955,UCSB,UCSB030047,49773,Nemophila menziesii,205099,3/17/1917,1917,3,17,76,,,,Upland,,,,,,cch2,urn:uuid:fc239fb8-ed43-44b7-9c0d-fe989d5d9d43,http://cch2.org/portal/collections/individual/index.php?occid=305955
305956,UCSB,UCSB030046,52713,Nemophila menziesii,205099,3/18/1950,1950,3,18,77,,,Kern,Along Soda Lake Road to Carrizo Plain; about 0.8 mile off Highway 399; near San Luis Obispo County line,,,,,,cch2,urn:uuid:0419745e-e932-45c3-b0dc-3e90f736997d,http://cch2.org/portal/collections/individual/index.php?occid=305956
305957,UCSB,UCSB030045,46708,Nemophila menziesii,205099,4/15/1977,1977,4,15,105,,,Riverside,1 mile S. Cajalco Rd. on Santa Rosa Rd.,33.82158,-117.36016,521,,,cch2,urn:uuid:827ded62-a8e1-4ff3-94c5-ec53e8261f63,http://cch2.org/portal/collections/individual/index.php?occid=305957
305958,UCSB,UCSB030044,46709,Nemophila menziesii,205099,4/7/1977,1977,4,7,97,,,Riverside,"South of Lake Matthews; southern Riverside Co., CA",33.80996,-117.4308,4179,,,cch2,urn:uuid:4a5c1c39-4e90-4908-9d10-4f4e490886ec,http://cch2.org/portal/collections/individual/index.php?occid=305958
305959,UCSB,UCSB030043,46517,Nemophila menziesii,205099,4/16/1983,1983,4,16,106,,,Monterey,On Hastings Natural History Reservation; 2 miles off of Martin Road; 10 miles southeast of Jamesburg-Arroyo Seco Rd.,,,,,,cch2,urn:uuid:8684e37d-4b5a-429b-95f6-40eab0298b02,http://cch2.org/portal/collections/individual/index.php?occid=305959
305960,UCSB,UCSB030042,46515,Nemophila menziesii,205099,5/8/1983,1983,5,8,128,,,Marin,On the Panoramic Highway; 2.3 miles south of its junction with Ridgecrest Blvd.,,,,,,cch2,urn:uuid:16fced19-092c-42d4-9d21-9eecd8ddfa0d,http://cch2.org/portal/collections/individual/index.php?occid=305960
305961,UCSB,UCSB030041,46514,Nemophila menziesii,205099,5/14/1983,1983,5,14,134,,,Kern,On dirt road; 2.3 miles south of Interstate 202; 8.8 miles west of Mojave,,,,,,cch2,urn:uuid:8aa01813-f7f9-4efa-b59d-6ab5af7f6aab,http://cch2.org/portal/collections/individual/index.php?occid=305961
305962,UCSB,UCSB030040,47645,Nemophila menziesii,205099,4/29/1979,1979,4,29,119,,,San Luis Obispo,At Lunch Meadow; East Cuesta Ridge Rd.; 2 miles from U.S. 101,,,,,,cch2,urn:uuid:8fc86b04-aba4-4683-bfbb-957a219c6e30,http://cch2.org/portal/collections/individual/index.php?occid=305962
305963,UCSB,UCSB030039,45182,Nemophila menziesii,205099,4/1/1977,1977,4,1,91,,,Santa Barbara,1/2 miles up trail on Happy Cyn. Road; 5 miles NE of Highway 154,,,,,,cch2,urn:uuid:9576906d-cda0-4332-82e4-ca9a234f9f13,http://cch2.org/portal/collections/individual/index.php?occid=305963
305964,UCSB,UCSB030038,46030,Nemophila menziesii,205099,2/28/1980,1980,2,28,59,,,Santa Barbara,On top of Little Pine Mtn.; Los Padres National Forest; Santa Inez; 0.2 mi. south of Happy Hollow Campground,,,,,,cch2,urn:uuid:433546f7-6421-4a87-9192-d581bf13a355,http://cch2.org/portal/collections/individual/index.php?occid=305964
305965,UCSB,UCSB030037,50149,Nemophila menziesii,205099,2/18/1984,1984,2,18,49,,,Santa Barbara,1/2 mile from Figueroa Mtn. Rd.; on trail leading away from left side of road; opposite Tunnel Rd. sign,,,,,,cch2,urn:uuid:4b11d11c-2feb-4158-be84-5c61bba8c461,http://cch2.org/portal/collections/individual/index.php?occid=305965
305966,UCSB,UCSB030036,38007,Nemophila menziesii,205099,4/11/1973,1973,4,11,101,,,San Luis Obispo,Growing near Shell Creek on State Highway 58,,,,,,cch2,urn:uuid:c3aae854-9a7e-43b0-b325-59bbf4c713f2,http://cch2.org/portal/collections/individual/index.php?occid=305966
305967,UCSB,UCSB030035,5325,Nemophila menziesii,205099,5/9/1960,1960,5,9,130,,,Santa Barbara,"25 yds. E of road, on Refugio Canyon Rd.; 6.7 mi. N of intersection at Hwy. 101",,,,,,cch2,urn:uuid:3f811bf4-48cb-42ed-901d-bae34dff1f37,http://cch2.org/portal/collections/individual/index.php?occid=305967
305968,UCSB,UCSB030034,5329,Nemophila menziesii,205099,4/13/1954,1954,4,13,103,,,Los Angeles,On Pomona College Campus,34.0968,-117.7012,1200,,,cch2,urn:uuid:c74f3494-ecac-406f-a8ff-004addf02379,http://cch2.org/portal/collections/individual/index.php?occid=305968
305969,UCSB,UCSB030033,16243,Nemophila menziesii,205099,5/3/1963,1963,5,3,123,,,Riverside,7.2 miles south of Banning on Banning to Idyllwild Road,33.85103,-116.82793,1200,,,cch2,urn:uuid:269f85a1-afd6-4b75-a95e-430d414ae9c4,http://cch2.org/portal/collections/individual/index.php?occid=305969
305970,UCSB,UCSB030032,5326,Nemophila menziesii,205099,5/9/1960,1960,5,9,130,,,Santa Barbara,On the exact top of Refugio Pass on the Refugio Pass Rd.; 8 miles from Highway 101,34.5334,-119.061,400,,,cch2,urn:uuid:cc8c348e-6014-43ab-802b-5813ca6cbae6,http://cch2.org/portal/collections/individual/index.php?occid=305970
305971,UCSB,UCSB030031,10525,Nemophila menziesii,205099,1937-04-00,1937,4,0,,1937-04,,Los Angeles,Puddingstone; near San Dimas,,,,,,cch2,urn:uuid:d9fc1d75-9367-4dc1-b872-e699dbdb6b94,http://cch2.org/portal/collections/individual/index.php?occid=305971
305972,UCSB,UCSB030030,14552,Nemophila menziesii,205099,3/18/1962,1962,3,18,77,,,San Luis Obispo,2.0 miles west of La Panza on main road to Santa Margarita,,,,,,cch2,urn:uuid:2be6cb75-cf49-4d6d-bcc9-ce2ac35f8307,http://cch2.org/portal/collections/individual/index.php?occid=305972
305973,UCSB,UCSB030029,17376,Nemophila menziesii,205099,3/18/1962,1962,3,18,77,,,San Luis Obispo,2.0 miles west of La Panza on main road to Santa Margarita,,,,,,cch2,urn:uuid:3a83228b-9f79-45f1-9055-eeec11d6c1bb,http://cch2.org/portal/collections/individual/index.php?occid=305973
305974,UCSB,UCSB030028,39883,Nemophila menziesii,205099,4/12/1982,1982,4,12,102,,,San Luis Obispo,On Pozo Road 2 miles east of the city of Pozo,,,,,,cch2,urn:uuid:b15044d5-cc5e-4040-9be9-783b554fdc69,http://cch2.org/portal/collections/individual/index.php?occid=305974
305975,UCSB,UCSB030056,23988,Nemophila menziesii,205099,2/21/1965,1965,2,21,52,,,Monterey,1 mile west of Lockwood; 15 miles west of Highway 101 near Bradley,,,,,,cch2,urn:uuid:459bfce9-3f68-4073-bf51-1a5132df473e,http://cch2.org/portal/collections/individual/index.php?occid=305975
305976,UCSB,UCSB030026,37852,Nemophila menziesii,205099,4/21/1928,1928,4,21,112,,,San Bernardino,Near Lake Arrowhead; on Rim of the World Drive,34.23496,-117.189624,3000,,,cch2,urn:uuid:11ac4841-48fb-46a4-8b95-f15073897081,http://cch2.org/portal/collections/individual/index.php?occid=305976
305977,UCSB,UCSB030027,49825,Nemophila menziesii,205099,3/20/1975,1975,3,20,79,,,Los Angeles,2 miles east of Stunt Rd.; from Mulholland Hwy.; Santa Monica Mountains,,,,,,cch2,urn:uuid:8f31d272-4d9c-4dfa-8430-c166dc605352,http://cch2.org/portal/collections/individual/index.php?occid=305977
305978,UCSB,UCSB030088,44936,Nemophila menziesii,205099,3/10/1979,1979,3,10,69,,,San Diego,Old Julian Highway; 4 miles southeast of Ramona,,,,,,cch2,urn:uuid:3ce2739f-ff40-47b0-b886-35c2dd49dbc4,http://cch2.org/portal/collections/individual/index.php?occid=305978
305979,UCSB,UCSB030087,55405,Nemophila menziesii,205099,3/7/1978,1978,3,7,66,,,Tulare,Sequoia National Park; Shepherd Saddle Road; 0.8 mi. above Corrals; Ash Mnt.,,,,,,cch2,urn:uuid:be978ace-bc50-4e11-8592-c5511e7ac129,http://cch2.org/portal/collections/individual/index.php?occid=305979
305980,UCSB,UCSB030086,51830,Nemophila menziesii,205099,3/26/1967,1967,3,26,85,,,San Luis Obispo,North shore of Lake Nacimiento; near Bee Rock Campground; access by Interlake and Bee Rock Roads,,,,,,cch2,urn:uuid:dfbb9218-bb60-43df-9470-72ffce3df644,http://cch2.org/portal/collections/individual/index.php?occid=305980
305981,UCSB,UCSB030085,54144,Nemophila menziesii,205099,4/15/1979,1979,4,15,105,,,Fresno,Ellwood Road; Wonder Valley,36.784553,-119.289851,5000,,,cch2,urn:uuid:8717e311-7484-4dc1-ab9d-96d635852a73,http://cch2.org/portal/collections/individual/index.php?occid=305981
305982,UCSB,UCSB030084,23986,Nemophila menziesii,205099,2/12/1967,1967,2,12,43,,,Colusa,Along roadside of Wilber Springs Road; 1.4 miles south of Wilber Springs; in Northern inner Coastal Ranges,,,,,,cch2,urn:uuid:047d1e97-efb2-4a4b-ab33-91aed87b23f4,http://cch2.org/portal/collections/individual/index.php?occid=305982
305983,UCSB,UCSB030083,5331,Nemophila menziesii,205099,3/21/1940,1940,3,21,81,,,Sonoma,At junction of Pleasant Avenue Road and Chalk Hill Road; 2-3 miles southeast of Windsor,,,,,,cch2,urn:uuid:022505ea-5fc4-4e36-a365-7bc9dbc4751c,http://cch2.org/portal/collections/individual/index.php?occid=305983
305984,UCSB,UCSB030082,11394,Nemophila menziesii,205099,3/30/1962,1962,3,30,89,,,Santa Barbara,At summit of San Marcos Pass; 8 miles northwest of Santa Barbara,,,,,,cch2,urn:uuid:b9fb41c6-992e-42d4-b873-772395e13513,http://cch2.org/portal/collections/individual/index.php?occid=305984
305985,UCSB,UCSB030081,10586,Nemophila menziesii,205099,3/22/1957,1957,3,22,81,,,Riverside,"Hwy. 71, near Alberhill",33.7619,-117.4723,,,,cch2,urn:uuid:22b847e1-4951-4bd9-ae76-b0a0df8de7ca,http://cch2.org/portal/collections/individual/index.php?occid=305985
305986,UCSB,UCSB030080,23987,Nemophila menziesii,205099,3/22/1967,1967,3,22,81,,,San Bernardino,Green Canyon Creek; Calif. 38; 1.4 miles west of Thurman Flats Campground; in the San Bernardino Mtns.,,,,,,cch2,urn:uuid:dac7c8c4-6544-4bb1-a425-990a44314ec7,http://cch2.org/portal/collections/individual/index.php?occid=305986
305987,UCSB,UCSB030079,5332,Nemophila menziesii,205099,5/9/1960,1960,5,9,130,,,Santa Barbara,Summit of Refugio Pass; Santa Ynez Mountains; 8 miles north of U.S. 101,,,,,,cch2,urn:uuid:53ee0f6b-95fd-4c90-bd4e-754d0484c6cd,http://cch2.org/portal/collections/individual/index.php?occid=305987
305988,UCSB,UCSB030078,7545,Nemophila menziesii,205099,3/18/1950,1950,3,18,77,,,Contra Costa,Saddle between North and South Peaks of Mount Diablo,,,,,,cch2,urn:uuid:edb2b419-4a45-4888-b52e-9b2371256eae,http://cch2.org/portal/collections/individual/index.php?occid=305988
305989,UCSB,UCSB030077,5327,Nemophila menziesii,205099,1940-00-00,1940,0,0,,,,Fresno,"Near North Fork; T8S, R22E",,,,,,cch2,urn:uuid:ebd451b3-8d72-4218-8b4f-40921067d0d4,http://cch2.org/portal/collections/individual/index.php?occid=305989
305990,UCSB,UCSB030076,33336,Nemophila menziesii,205099,4/11/1968,1968,4,11,102,,,Santa Barbara,100 feet northeast of East Camino Cielo Road; 0.7 mile from its junction with Highway 154; San Marcos Pass; Santa Ynez Mountains,34.5111,-119.8131,500,,,cch2,urn:uuid:f49bc565-9179-4d4a-83a4-874e74d741c1,http://cch2.org/portal/collections/individual/index.php?occid=305990
305991,UCSB,UCSB030075,34150,Nemophila menziesii,205099,5/24/1977,1977,5,24,144,,,Mariposa,On Jersey Valley Rd.; 2 1/2 mi. from Scott Rd.,,,,,,cch2,urn:uuid:b39621a3-7849-4151-a71d-9a3edeae4df0,http://cch2.org/portal/collections/individual/index.php?occid=305991
305992,UCSB,UCSB030074,12159,Nemophila menziesii,205099,3/18/1962,1962,3,18,77,,,Santa Barbara,3.7 miles south of Tepusquet Canyon Road on Foxen Canyon Road,,,,,,cch2,urn:uuid:be82f59e-7310-49d3-81b0-c04be33159c4,http://cch2.org/portal/collections/individual/index.php?occid=305992
305993,UCSB,UCSB030073,5330,Nemophila menziesii,205099,1950-00-00,1950,0,0,,,,Madera,North Fork,37.229669,-119.509581,930,,,cch2,urn:uuid:92d08568-271e-439d-bfc7-ace1d029a08c,http://cch2.org/portal/collections/individual/index.php?occid=305993
305994,UCSB,UCSB030072,5324,Nemophila menziesii,205099,3/28/1959,1959,3,28,87,,,Santa Barbara,500 yds. below Lake Cachuma Look Out Point; 50 yds. from Lake,,,,,,cch2,urn:uuid:128da6af-7b33-42cc-85a8-0c1661022342,http://cch2.org/portal/collections/individual/index.php?occid=305994
305995,UCSB,UCSB030071,5323,Nemophila menziesii,205099,4/5/1954,1954,4,5,95,,,Santa Barbara,Middle Camp; Upper Santa Barbara Ynez Valley,,,,,,cch2,urn:uuid:ffac5acf-bb49-4797-b81e-86dd58e81e4b,http://cch2.org/portal/collections/individual/index.php?occid=305995
305996,UCSB,UCSB030070,5322,Nemophila menziesii,205099,2/27/1952,1952,2,27,58,,,Santa Barbara,Above Rattlesnake Cnyn. Dam; 150 ft. NE of Las Canoas Rd.; Santa Barbara,,,,,,cch2,urn:uuid:a8bd7ddf-08e4-4fe2-9e10-fa361863977b,http://cch2.org/portal/collections/individual/index.php?occid=305996
305997,UCSB,UCSB030069,5320,Nemophila menziesii,205099,3/24/1940,1940,3,24,84,,,Fresno,Curry Mountain; Waltham Canyon; 9 miles southwest of Coalinga,,,,,,cch2,urn:uuid:338d40b8-2a4b-46bd-86c1-a6c5260615d8,http://cch2.org/portal/collections/individual/index.php?occid=305997
305998,UCSB,UCSB030057,16250,Nemophila menziesii,205099,4/10/1963,1963,4,10,100,,,Los Angeles,"5.3 miles north of U.S. Highway 66; on San Dimas Canyon Road, San Dimas",,,,,,cch2,urn:uuid:84dbffcb-45ef-4b2c-9253-3aeffead6e9e,http://cch2.org/portal/collections/individual/index.php?occid=305998
305999,UCSB,UCSB030058,12645,Nemophila menziesii,205099,4/25/1938,1938,4,25,115,,,Tulare,Jack Ranch; near Posey P.O.,35.805,-118.681,5000,,,cch2,urn:uuid:393bfbea-35c9-4ed5-b4a0-8c9067989d99,http://cch2.org/portal/collections/individual/index.php?occid=305999
306000,UCSB,UCSB030059,8456,Nemophila menziesii,205099,3/19/1961,1961,3,19,78,,,Santa Barbara,1 yd. S of W Camino Ciello; 0.6 road mi. E of Refugio Road (=Refugio Beach County Park- Santa Ynez road); Santa Ynez Mountains,,,,,,cch2,urn:uuid:b5c9cbbf-b12b-4636-ab5c-69ed0dcf3279,http://cch2.org/portal/collections/individual/index.php?occid=306000
306001,UCSB,UCSB030060,23880,Nemophila menziesii,205099,3/11/1967,1967,3,11,70,,,Santa Barbara,About 1 mile southeast of Vandenberg Village; 3 miles south of Lompoc,,,,,,cch2,urn:uuid:bb2b8b2c-6db4-4345-8973-c09e952a5d6e,http://cch2.org/portal/collections/individual/index.php?occid=306001
306002,UCSB,UCSB030061,5321,Nemophila menziesii,205099,2/27/1946,1946,2,27,58,,,Santa Barbara,Lower slope of Rattlesnake Canyon; near Santa Ynez Mountains; 4 miles north of Santa Barbara,34.463,-119.6906,500,,,cch2,urn:uuid:a2993884-54be-417f-b0f0-faad4048114a,http://cch2.org/portal/collections/individual/index.php?occid=306002
306003,UCSB,UCSB030062,5333,Nemophila menziesii,205099,4/10/1960,1960,4,10,101,,,San Luis Obispo,.8 mile up Cambria Pines lodge Rd.,,,,,,cch2,urn:uuid:4245aea8-8a48-4442-b678-fe5a7d226497,http://cch2.org/portal/collections/individual/index.php?occid=306003
306004,UCSB,UCSB030063,42688,Nemophila menziesii,205099,4/4/1979,1979,4,4,94,,,Santa Barbara,On east side of bend in Figueroa Mtn. Road; 17.6 miles east from junction with Route 154; San Rafael Mtns.,,,,,,cch2,urn:uuid:44aef31f-9adf-4ef7-8941-0ef705a2b822,http://cch2.org/portal/collections/individual/index.php?occid=306004
306005,UCSB,UCSB030064,33377,Nemophila menziesii,205099,3/16/1978,1978,3,16,75,,,Riverside,At top of hill 3/4 mi. W of orange grove at 3000 McAllister Dr. in Riverside,33.8713,-117.4363,425,,,cch2,urn:uuid:77b3be6c-8e94-4d91-9508-8d1a72e79b74,http://cch2.org/portal/collections/individual/index.php?occid=306005
306006,UCSB,UCSB030065,27796,Nemophila menziesii,205099,3/10/1961,1961,3,10,69,,,Fresno,Jacalitos Canyon; near Coalinga,36.10151,-120.31102,2000,,,cch2,urn:uuid:10c539a2-bd95-411b-b83f-32b37a08acdb,http://cch2.org/portal/collections/individual/index.php?occid=306006
306007,UCSB,UCSB030066,31347,Nemophila menziesii,205099,2/16/1974,1974,2,16,47,,,Santa Barbara,Running Springs Ranch on Happy Canyon Rd.; about 6 mi. from Armour Ranch Rd.; in Santa Ynez Valley,,,,,,cch2,urn:uuid:d3939051-c5d3-4ef3-a4f2-321393f4715f,http://cch2.org/portal/collections/individual/index.php?occid=306007
306008,UCSB,UCSB030067,37485,Nemophila menziesii,205099,4/13/1979,1979,4,13,103,,,San Luis Obispo,2 mi. east of Hwy. 101 on E. Cuesta Ridge Rd.,,,,,,cch2,urn:uuid:5bb3fbef-46ef-4ac5-9001-17ae87e19300,http://cch2.org/portal/collections/individual/index.php?occid=306008
306009,UCSB,UCSB030068,30547,Nemophila menziesii,205099,4/9/1966,1966,4,9,99,,,San Luis Obispo,10 miles S of Shandon,,,,,,cch2,urn:uuid:aa2a7975-8d4e-4509-8699-91de6c48a38b,http://cch2.org/portal/collections/individual/index.php?occid=306009
306010,UCSB,UCSB030091,29347,Nemophila menziesii var. atomaria,205101,3/20/1972,1972,3,20,80,,,Humboldt,0.6 mi. along Black Sands Rd. from Shelter Cove Rd. junction; Shelter Cove,,,,,,cch2,urn:uuid:2e996a14-2c3e-46fc-9766-6c01a3403f28,http://cch2.org/portal/collections/individual/index.php?occid=306010
306011,UCSB,UCSB030090,11504,Nemophila menziesii var. atomaria,205101,4/17/1962,1962,4,17,107,,,Marin,End of road at tip of Point Reyes Peninsula,,,,,,cch2,urn:uuid:6f960a51-a552-426c-a13d-fc97acb61c3e,http://cch2.org/portal/collections/individual/index.php?occid=306011
306012,UCSB,UCSB030089,11673,Nemophila menziesii var. atomaria,205101,4/17/1962,1962,4,17,107,,,Santa Clara,California Highway 9; 1.5 miles west of junction with Highway 5; 14 miles east of Big Basin,,,,,,cch2,urn:uuid:2aeb6e0b-bbea-4b70-8dc6-8942a6e58191,http://cch2.org/portal/collections/individual/index.php?occid=306012
306013,UCSB,UCSB030092,13213,Nemophila menziesii var. atomaria,205101,5/14/1939,1939,5,14,134,,,Sonoma,Bodega State Park,,,,,,cch2,urn:uuid:e07468b1-6693-4833-93f0-6784c6b134e3,http://cch2.org/portal/collections/individual/index.php?occid=306013
306014,UCSB,UCSB030093,10587,Nemophila menziesii var. integrifolia,205102,4/25/1953,1953,4,25,115,,,San Diego,1 mile west of Julian,33.07817,-116.61458,241,,,cch2,urn:uuid:c7a23126-c215-43e5-922a-49c1c82271ba,http://cch2.org/portal/collections/individual/index.php?occid=306014
306015,UCSB,UCSB030409,63597,Nemophila menziesii subsp. menziesii,205100,4/1/1995,1995,4,1,91,,,Lake,"Jct. Hwys. 29 and 175; ca. 3 mi. SE of Kelseyville; Kelseyville U.S.G.S. Quadrangle, 15'; SE 1/4 of SW 1/4 Sect. 30; T18N, R8W",,,,,,cch2,urn:uuid:3c526f29-1a51-4a0e-8702-cfe6aa60eb3e,http://cch2.org/portal/collections/individual/index.php?occid=306015
306016,UCSB,UCSB030408,12894,Nemophila menziesii subsp. menziesii,205100,3/9/1962,1962,3,9,68,,,Orange,4.4 miles east of San Juan Capistrano on State 74,33.517333,-117.595479,500,,,cch2,urn:uuid:6bd19403-a6f7-48fa-b8cb-a8c3adfb4bff,http://cch2.org/portal/collections/individual/index.php?occid=306016
306017,UCSB,UCSB030407,38127,Nemophila menziesii subsp. menziesii,205100,3/23/1975,1975,3,23,82,,,Santa Barbara,E. fork Cold Springs burn; 100 yds. S of Cold Springs- Hot Springs trail saddle; 1 mi. by trail on E. fork of Cold Springs trail; Mountain Dr.; Montecito,,,,,,cch2,urn:uuid:00e0db8c-5160-45a1-8b84-d047acecdd07,http://cch2.org/portal/collections/individual/index.php?occid=306017
306018,UCSB,UCSB030406,5338,Nemophila menziesii subsp. menziesii,205100,2/27/1946,1946,2,27,58,,,Santa Barbara,Rattlesnake Canyon; 4 miles north of Santa Barbara,34.4585,-119.6917,1500,,,cch2,urn:uuid:c213ed60-2719-4555-94e1-03694ce06e5f,http://cch2.org/portal/collections/individual/index.php?occid=306018
306019,UCSB,UCSB030405,12040,Nemophila menziesii subsp. menziesii,205100,4/4/1934,1934,4,4,94,,,San Bernardino,West Mojave Desert; near Hesperia,34.42407,-117.301134,5000,,,cch2,urn:uuid:4d392cad-05c0-4540-a9a0-54bc23e73dbe,http://cch2.org/portal/collections/individual/index.php?occid=306019
306020,UCSB,UCSB030404,5334,Nemophila menziesii subsp. menziesii,205100,5/10/1958,1958,5,10,130,,,Los Angeles,3 miles N of Foothill Blvd. on Angeles Crest Highway,34.230227,-118.181587,500,,,cch2,urn:uuid:55b4125a-15f7-4a82-8e0d-1f5659ce1b34,http://cch2.org/portal/collections/individual/index.php?occid=306020
306021,UCSB,UCSB030403,5339,Nemophila menziesii subsp. menziesii,205100,2/22/1935,1935,2,22,53,,,Los Angeles,"San Dimas Exp. Forest; Bell dams; sec. 1, T 1N, R 9W",34.199248,-117.779642,500,,,cch2,urn:uuid:1fa861b9-61d5-4e5d-a947-6b75dd5a08fe,http://cch2.org/portal/collections/individual/index.php?occid=306021
306022,UCSB,UCSB030402,5340,Nemophila menziesii subsp. menziesii,205100,4/6/1946,1946,4,6,96,,,Kern,Summit of Tehachapi Pass,35.101482,-118.283635,2000,,,cch2,urn:uuid:966d279d-8602-442d-8044-0507e2a78258,http://cch2.org/portal/collections/individual/index.php?occid=306022
306023,UCSB,UCSB030401,41523,Nemophila menziesii subsp. menziesii,205100,4/18/1981,1981,4,18,108,,,San Luis Obispo,Near Shell Creek in Avenales Wildlife Area; 19 miles from Santa Margarita on highway 58,,,,,,cch2,urn:uuid:4326c58f-fa65-4203-bdd8-b52eeeb49a35,http://cch2.org/portal/collections/individual/index.php?occid=306023
306024,UCSB,UCSB030100,11891,Nemophila menziesii subsp. menziesii,205100,3/28/1961,1961,3,28,87,,,El Dorado,By Highway 49; 10 miles south of El Dorado; 15 miles south of Placerville; Sierra Nevada Foothills,,,,,,cch2,urn:uuid:34faad3f-7ff7-48f8-a6fb-d1811512ffb6,http://cch2.org/portal/collections/individual/index.php?occid=306024
306025,UCSB,UCSB030099,45149,Nemophila menziesii subsp. menziesii,205100,4/2/1978,1978,4,2,92,,,Santa Barbara,On Figueroa Mountain Road trail; trailhead 1.5 miles from the Figueroa Mountain Station,,,,,,cch2,urn:uuid:3612bdeb-bda5-4145-861f-b97792bf633a,http://cch2.org/portal/collections/individual/index.php?occid=306025
306026,UCSB,UCSB030098,48119,Nemophila menziesii subsp. menziesii,205100,4/3/1982,1982,4,3,93,,,Orange,Rancho Mission Viejo: Calif. 74; 7.2 km. by road E San Juan Capistrano; 1.3 km. NE Viejo Survey Marker,33.531045,-117.589222,500,,,cch2,urn:uuid:0b806dc6-ba6a-4aa3-9601-27921d45de1f,http://cch2.org/portal/collections/individual/index.php?occid=306026
306027,UCSB,UCSB030097,49250,Nemophila menziesii subsp. menziesii,205100,2/26/1984,1984,2,26,57,,,Santa Barbara,2.5 miles up Figueroa Mtn. Rd. from junction with turn-off for Figueroa Mtn. Campground,34.7219,-119.9544,750,,,cch2,urn:uuid:803365c1-841f-40f9-9dd1-b4fa296c15e7,http://cch2.org/portal/collections/individual/index.php?occid=306027
306028,UCSB,UCSB030096,49069,Nemophila menziesii subsp. menziesii,205100,4/9/1978,1978,4,9,99,,,Santa Barbara,San Marcos Pass Road west right on Figueroa Mountain Road; about 2 miles north of Figueroa Mountain Campground; on east side of road,,,,,,cch2,urn:uuid:6eb9d965-55a6-42a0-a031-a5f058e8b868,http://cch2.org/portal/collections/individual/index.php?occid=306028
306029,UCSB,UCSB030095,48744,Nemophila menziesii subsp. menziesii,205100,2/25/1984,1984,2,25,56,,,Santa Barbara,Figueroa Mountain Road; 4 miles off San Marcus; 2.5 miles past campground while ascending; 10 meters off side of road; San Raphael Mountains,,,,,,cch2,urn:uuid:b878dcd9-cd2b-448c-8a77-fba89c22a5ce,http://cch2.org/portal/collections/individual/index.php?occid=306029
306030,UCSB,UCSB030410,42030,Nemophila menziesii subsp. menziesii,205100,4/8/1979,1979,4,8,98,,,Santa Barbara,"Approximately 1.5 miles east of Ranger Peak, Figueroa Mountain",,,,,,cch2,urn:uuid:9204082d-a11d-4163-b621-ea83b26b6ea9,http://cch2.org/portal/collections/individual/index.php?occid=306030
317277,UCSB,UCSB032711,70901,Nemophila menziesii,205099,5/5/1991,1991,5,5,125,,,Ventura,Sisar Trail. Red Reef Trail to White Ledge Campground.,34.495975,-119.123119,2000,,,cch2,urn:uuid:ffffe6ea-6622-4bec-bdd5-7655dc449fea,http://cch2.org/portal/collections/individual/index.php?occid=317277
330027,UCSB,UCSB040086,33719,Nemophila menziesii,205099,,,,,,,,Kern,"13 miles North of Caliente on Road to Havleah, Piute Mountains",,,,,,cch2,urn:uuid:0312de30-c8e4-437d-9b2e-0a4a3dcda4ee,http://cch2.org/portal/collections/individual/index.php?occid=330027
330255,UCSB,UCSB040304,69908,Nemophila menziesii subsp. menziesii,205100,4/19/1998,1998,4,19,109,,,Santa Barbara,"Sedgwick Ranch, plot 32-SO, Santa Barbara County Oak Restoration Program",,,,,,cch2,urn:uuid:92e636c8-9c87-4419-807d-31d5bda0e3f6,http://cch2.org/portal/collections/individual/index.php?occid=330255
380487,SDSU,SDSU06082,6082,Nemophila menziesii var. menziesii,205103,3/18/1949,1949,3,18,77,3/18/1949,,Los Angeles,,,,,366,1200ft.,cch2,urn:uuid:414f80e0-aae8-426b-a08b-7f35a3bef7b3,http://cch2.org/portal/collections/individual/index.php?occid=380487
380493,SDSU,SDSU06088,6088,Nemophila menziesii var. menziesii,205103,5/1/1934,1934,5,1,121,5/1/1934,,San Bernardino,"Dry shore, E side big bear Lake, San Bernardino Mts.",34.264,-116.8662,2926,,,cch2,urn:uuid:2e8556fa-4b3e-4c21-9c4a-827e94fecd1a,http://cch2.org/portal/collections/individual/index.php?occid=380493
380499,SDSU,SDSU06094,6094,Nemophila menziesii var. menziesii,205103,4/11/1960,1960,4,11,102,4/11/1960,,Santa Barbara,Summit on #166 east of cuyama Valley,,,,,,cch2,urn:uuid:dd975f05-b38c-4b66-853e-7216166f363b,http://cch2.org/portal/collections/individual/index.php?occid=380499
380505,SDSU,SDSU06100,6100,Nemophila menziesii var. menziesii,205103,6/19/1929,1929,6,19,170,6/19/1929,,Mariposa,Camp Wawona,37.547577,-119.678451,800,1219,4000ft.,cch2,urn:uuid:224b5096-a525-4ca0-8ca2-6c162ddd5b2b,http://cch2.org/portal/collections/individual/index.php?occid=380505
380510,SDSU,SDSU06105,6105,Nemophila menziesii var. integrifolia,205102,5/6/1990,1990,5,6,126,5/6/1990,,San Diego,"Found in the Laguna Mountains at 6000 feet, about 10 miles north of Interstate 8 on sunshine Highway, on raodside. Near by associates: Claytonia perfoliata, species of the families Brassicaceae Poaceae and Polemoniaceae, Quercus sp and Pinus sp.",32.86077,-116.4217,806,,,cch2,urn:uuid:777994ec-bd6e-413b-805c-a79a328c30b8,http://cch2.org/portal/collections/individual/index.php?occid=380510
380511,SDSU,SDSU06106,6106,Nemophila menziesii var. atomaria,205101,5/1/1972,1972,5,1,122,5/1/1972,,Sonoma,Duncun Point.,38.394487,-123.095123,200,,,cch2,urn:uuid:d4f73400-a989-44d7-b0c0-a6d0f4bb5386,http://cch2.org/portal/collections/individual/index.php?occid=380511
380516,SDSU,SDSU06111,6111,Nemophila menziesii var. integrifolia,205102,4/24/1988,1988,4,24,115,4/24/1988,,San Diego,"Julian. Go 1/2 mile down Pine Hills Rd. off Hwy. 78. Turn left on private road and proceed for ca. 1/2 mile to small apple orchard on left. Proceed on foot in northerly direction ca. 100 yards; then east, crossing streambed and under barbed wire fence. Collection site is ca. 75 yards east of fence (Private property; permission required)",33.06859,-116.61022,805,,,cch2,urn:uuid:a9778225-ef13-4fd8-9b6e-8196ad5a77b5,http://cch2.org/portal/collections/individual/index.php?occid=380516
380517,SDSU,SDSU06112,6112,Nemophila menziesii var. integrifolia,205102,5/17/1963,1963,5,17,137,5/17/1963,,Santa Barbara,13 miles north of Lompoc on #1.,,,,183,600ft.,cch2,urn:uuid:451c3502-32e5-4a8f-8c92-b7b84125b37d,http://cch2.org/portal/collections/individual/index.php?occid=380517
380522,SDSU,SDSU06117,6117,Nemophila menziesii var. integrifolia,205102,4/1/1938,1938,4,1,91,4/1/1938,,San Diego,Cuyamaca,32.93455,-116.6042,9654,,,cch2,urn:uuid:708d6423-a54c-4ce0-abf1-43af230d9107,http://cch2.org/portal/collections/individual/index.php?occid=380522
380523,SDSU,SDSU06118,6118,Nemophila menziesii var. menziesii,205103,4/28/1951,1951,4,28,118,4/28/1951,,Monterey,"Santa Lucia Mts., Monterey Co.",,,,762,2500ft.,cch2,urn:uuid:5598a0ea-b1ce-4f13-a4af-63d54f2e6ef7,http://cch2.org/portal/collections/individual/index.php?occid=380523
380528,SDSU,SDSU06123,6123,Nemophila menziesii var. integrifolia,205102,5/8/1951,1951,5,8,128,5/8/1951,,San Diego,,,,,,,cch2,urn:uuid:37d9c304-1ec5-40c6-88ad-074945b8fc96,http://cch2.org/portal/collections/individual/index.php?occid=380528
380534,SDSU,SDSU06129,6129,Nemophila menziesii var. integrifolia,205102,5/22/1944,1944,5,22,143,5/22/1944,,San Diego,Palomar,33.36337,-116.83613,3218,,,cch2,urn:uuid:49d45468-a324-4923-bd48-ddd58409a34b,http://cch2.org/portal/collections/individual/index.php?occid=380534
380535,SDSU,SDSU06130,6130,Nemophila menziesii var. menziesii,205103,5/1/1971,1971,5,1,121,5/1/1971,,Kern,"About 3 miles north of Paris-Lorraine, Kern County. Foothill Woodland community neighboring plants; Pinus sabiniana, Gila tricolor, Ganunculus occidentalis.",,,,1250,4100ft.,cch2,urn:uuid:10ee346f-91cc-405d-afc1-ac9806b834b6,http://cch2.org/portal/collections/individual/index.php?occid=380535
380536,SDSU,SDSU06131,6131,Nemophila menziesii var. integrifolia,205102,5/8/1927,1927,5,8,128,5/8/1927,,,,,,,1219,4000ft.,cch2,urn:uuid:5ac09030-b751-4294-9846-e08ee8b78626,http://cch2.org/portal/collections/individual/index.php?occid=380536
380540,SDSU,SDSU06135,6135,Nemophila menziesii var. integrifolia,205102,5/13/1967,1967,5,13,133,5/13/1967,,San Diego,along the trail NE of Guymon Lodge,32.8941,-116.438,402,,,cch2,urn:uuid:dd9966c5-ab9b-4714-b8cd-3ce582fb2e63,http://cch2.org/portal/collections/individual/index.php?occid=380540
380542,SDSU,SDSU06137,6137,Nemophila menziesii var. menziesii,205103,4/1/1952,1952,4,1,92,4/1/1952,,Los Angeles,Azusa Canyon. Angeles Natl. Forest near Coldstream Guard Station.,34.291484,-117.840418,300,1036,3400ft.,cch2,urn:uuid:c64f1b56-a4c7-4dc6-9e73-db464b16ffc1,http://cch2.org/portal/collections/individual/index.php?occid=380542
380547,SDSU,SDSU06143,6143,Nemophila menziesii var. menziesii,205103,4/19/1987,1987,4,19,109,4/19/1987,,Mendocino,Light gaps under canopy and edgge of coastal Redwood foreston southeastern leg of path surrounding Lake Leonard,,,,335,1100ft.,cch2,urn:uuid:bc4e29a1-4d39-4151-8f33-0b16ec77580a,http://cch2.org/portal/collections/individual/index.php?occid=380547
380553,SDSU,SDSU06149,6149,Nemophila menziesii var. menziesii,205103,4/25/1951,1951,4,25,115,4/25/1951,,Mariposa,Wawona rd near Wowona hotel,,,,1219,4000ft.,cch2,urn:uuid:12c121d1-7048-4177-b740-23110455ff3b,http://cch2.org/portal/collections/individual/index.php?occid=380553
386734,SDSU,SDSU12385,12385,Nemophila menziesii var. integrifolia,205102,4/25/1996,1996,4,25,116,4/25/1996,,San Diego,"Ca. 100 yards west of San Luis Rey River Picnic Area, 30 yards south of river, ca. 2 miles west of Lake Henshaw, Cleveland National Forest.",33.25528,-116.79667,,780,2560ft.,cch2,urn:uuid:c11483e9-5260-4199-9469-599a7e2c9ce6,http://cch2.org/portal/collections/individual/index.php?occid=386734
386895,SDSU,SDSU12547,12547,Nemophila menziesii var. menziesii,205103,4/21/1996,1996,4,21,112,4/21/1996,,San Diego,"Southern portion of Lake Cuyamaca, immediately north of Stone wall Mine. Lake Cuyamaca Park and Recreational District.",32.975,-116.55417,,1433,4700ft.,cch2,urn:uuid:42138f15-fe3e-4210-bede-75cb2444a774,http://cch2.org/portal/collections/individual/index.php?occid=386895
388286,SDSU,SDSU13969,13969,Nemophila menziesii var. menziesii,205103,4/2/2002,2002,4,2,92,4/2/2002,,San Diego,"Cuyamaca Mtn. State Park, Lower Descanso Creek Trail, ca. 1/2 mile from parking lot at Hwy 79 (at 3.1 mile marker), toward Oak Zanita Peak trail.",32.89361,-116.5725,,1241,4070ft.,cch2,urn:uuid:19ae4c8c-f9cb-4bfd-a8ba-a88716859ce3,http://cch2.org/portal/collections/individual/index.php?occid=388286
389691,SDSU,SDSU15375,15375,Nemophila menziesii var. integrifolia,205102,3/21/1998,1998,3,21,80,3/21/1998,,San Diego,UTM-Easting: 472886.41; UTM-Northing: 3685540. Training Area: JULIETT RANGE 403. LTETM PLOT: 85. LTETM Unknown code: F04.,33.31028,-117.29139,805,121,397ft.,cch2,urn:uuid:2cbd9238-c48d-478e-865f-92fb28116095,http://cch2.org/portal/collections/individual/index.php?occid=389691
390085,SDSU,SDSU15873,15873,Nemophila menziesii var. integrifolia,205102,3/19/2004,2004,3,19,79,3/19/2004,,San Diego,"El Capitan reservor, just east of dam, above main road.",32.87806,-116.80056,,305,1000ft.,cch2,urn:uuid:04191e35-35a9-4893-94aa-f12302720117,http://cch2.org/portal/collections/individual/index.php?occid=390085
392574,SDSU,SDSU18390,18390,Nemophila menziesii var. menziesii,205103,2/21/2008,2008,2,21,52,2/21/2008,,Riverside,"El Sobrante Landfill preserve area, western Riverside County, east of Interstate 15 off Temescal Canyon Road. Ca. 5 kilometers east off freeway. Access through landfill entrance.",33.79722,-117.46225,,418,1370ft.,cch2,urn:uuid:a1b1db0f-0a68-4029-8d97-bf1036f63240,http://cch2.org/portal/collections/individual/index.php?occid=392574
392587,SDSU,SDSU18403,18403,Nemophila menziesii var. menziesii,205103,2/27/2008,2008,2,27,58,2/27/2008,,Riverside,"El Sobrante Landfill preserve area, western Riverside County, east of Interstate 15 off Temescal Canyon Road. Ca. 5 kilometers east off freeway. Access through landfill entrance.",33.79494,-117.45103,,405,1330ft.,cch2,urn:uuid:9ec1f7ee-ab3a-4c24-a9d8-e4eb73cae369,http://cch2.org/portal/collections/individual/index.php?occid=392587
394070,SDSU,SDSU19900,19900,Nemophila menziesii var. integrifolia,205102,5/24/2002,2002,5,24,144,5/24/2002,,San Diego,"Saddle, just northeast of Cuyamaca Peak.",32.95028,-116.60639,,1868,6130ft.,cch2,urn:uuid:01256c74-84e5-49cc-89aa-df0a33b06bba,http://cch2.org/portal/collections/individual/index.php?occid=394070
394081,SDSU,SDSU19911,19911,Nemophila menziesii var. integrifolia,205102,5/5/2012,2012,5,5,126,5/5/2012,In flower.,San Diego,"Cuyamaca State Park, San Diego. Flat open, grassy area near Azalea Glen hiking trail.",32.96251,-116.58741,,1490,4887ft.,cch2,urn:uuid:0cc63943-b7f4-4e64-b5bc-6e7ea226c8cd,http://cch2.org/portal/collections/individual/index.php?occid=394081
500025,SD,SD00010602,SD4030,Nemophila menziesii var. integrifolia,205102,1895-03-08,1895,3,8,67,"Mar 08, 1895",FL,San Diego,La Jolla,32.8332,-117.25881,3218,,unknownft.,cch2,urn:uuid:88059c01-7fab-47f2-9fad-c993b1ea4800,http://cch2.org/portal/collections/individual/index.php?occid=500025
500027,SD,SD00010603,SD4035,Nemophila menziesii var. integrifolia,205102,,,,,,,FL,San Diego,Laguna Mts.,32.84327,-116.48061,12068,,unknownft.,cch2,urn:uuid:77d2096d-fc01-43db-9ca6-a8eb5cceb20b,http://cch2.org/portal/collections/individual/index.php?occid=500027
500028,SD,SD00010479,SD4038,Nemophila menziesii,205099,1890-04-00,1890,4,0,,Apr 1890,FL,Santa Clara,Gilroy,37.00578,-121.56827,,,unknownft.,cch2,urn:uuid:299db5ad-0034-4f45-bdee-b8c505ddee83,http://cch2.org/portal/collections/individual/index.php?occid=500028
500029,SD,SD00010487,SD4039,Nemophila menziesii,205099,,,,,,,FL,Unknown,,,,,,unknownft.,cch2,urn:uuid:409901f3-8545-4f35-b7e7-a31a73956e4a,http://cch2.org/portal/collections/individual/index.php?occid=500029
500030,SD,SD00010577,SD4041,Nemophila menziesii var. integrifolia,205102,1920-07-00,1920,7,0,,20-Jul,FFL,San Diego,Summit Laguna Mts.,32.87227,-116.41835,805,,unknownft.,cch2,urn:uuid:ba138b84-006f-4944-bb9c-441dcc75c02b,http://cch2.org/portal/collections/individual/index.php?occid=500030
500031,SD,SD00010493,SD4042,Nemophila menziesii,205099,1929-00-00,1929,0,0,,,FL,Kern,Kern County,,,,,unknownft.,cch2,urn:uuid:528dd517-f6f9-46b6-9622-a72cfa4567dc,http://cch2.org/portal/collections/individual/index.php?occid=500031
500032,SD,SD00010542,SD4045,Nemophila menziesii var. integrifolia,205102,5/25/1925,1925,5,25,145,25-May-25,FFL,San Diego,Palomar Mountain.,33.36337,-116.83613,3218,1585,,cch2,urn:uuid:92cf1306-a99e-4947-a652-99bc53c314b3,http://cch2.org/portal/collections/individual/index.php?occid=500032
500033,SD,SD00010505,SD4046,Nemophila menziesii,205099,5/10/1925,1925,5,10,130,10-May-25,FL,Riverside,"Banning-Idyllwild Road, San Jacinto Mountains.",33.8748,-116.842,,1219,,cch2,urn:uuid:bd1f2f3e-4977-457f-9200-e0e2016eb428,http://cch2.org/portal/collections/individual/index.php?occid=500033
500035,SD,SD00010555,SD7207,Nemophila menziesii var. integrifolia,205102,1898-04-00,1898,4,0,,Apr 1898,FFL,San Diego,Sweetwater,,,,,unknownft.,cch2,urn:uuid:6d44aa4f-ad83-4d6a-b726-c77b8016213f,http://cch2.org/portal/collections/individual/index.php?occid=500035
500036,SD,SD00010460,SD7208,Nemophila menziesii,205099,1884-04-00,1884,4,0,,Apr 1884,FL,San Diego,San Diego,32.73409,-117.12945,9654,,unknownft.,cch2,urn:uuid:9742e7e3-0b91-46f7-9149-0757c6ed2d75,http://cch2.org/portal/collections/individual/index.php?occid=500036
500037,SD,SD00010576,SD7209,Nemophila menziesii var. integrifolia,205102,1878-04-01,1878,4,1,91,"Apr 01, 1878",FL,San Diego,Fallbrook,33.37642,-117.25115,4827,,unknownft.,cch2,urn:uuid:3ec10cc0-2c06-457a-a313-f08af6e60a30,http://cch2.org/portal/collections/individual/index.php?occid=500037
500038,SD,SD00010562,SD7210,Nemophila menziesii var. integrifolia,205102,1884-01-23,1884,1,23,23,"Jan 23, 1884",FL,San Diego,San Diego,32.73409,-117.12945,9654,,unknownft.,cch2,urn:uuid:ea1caa5a-2964-46ce-8ec3-663c4e9cbd93,http://cch2.org/portal/collections/individual/index.php?occid=500038
500039,SD,SD00010485,SD7438,Nemophila menziesii,205099,1881-04-00,1881,4,0,,Apr 1881,FL,Riverside,Temecula,33.4956,-117.1493,,,unknownft.,cch2,urn:uuid:9b3b4faa-b928-4fd0-8101-3a7cdefa99b1,http://cch2.org/portal/collections/individual/index.php?occid=500039
500040,SD,SD00010503,SD7439,Nemophila menziesii,205099,1882-04-24,1882,4,24,114,"Apr 24, 1882",FL,Riverside,Temecula,33.4956,-117.1493,,,unknownft.,cch2,urn:uuid:833b66d6-3a91-41ca-8cf4-e4ea8abd28a2,http://cch2.org/portal/collections/individual/index.php?occid=500040
500042,SD,SD00010484,SD7444,Nemophila menziesii,205099,1882-04-24,1882,4,24,114,"Apr 24, 1882",FL,Riverside,Temecula,33.4956,-117.1493,,,unknownft.,cch2,urn:uuid:ca8ae25f-c444-4a57-9654-d02c6ae64afb,http://cch2.org/portal/collections/individual/index.php?occid=500042
500044,SD,SD00010574,SD10341,Nemophila menziesii var. integrifolia,205102,2/20/1935,1935,2,20,51,20-Feb-35,FL,San Diego,"Springhill, near Ramona",33.09021,-116.79119,805,,unknownft.,cch2,urn:uuid:418a7063-ea37-4034-8516-a71e76781733,http://cch2.org/portal/collections/individual/index.php?occid=500044
500045,SD,SD00010616,SD10392,Nemophila menziesii var. integrifolia,205102,2/27/1935,1935,2,27,58,27-Feb-35,FFL,San Diego,North slope of Soledad Mt.,32.8442,-117.2525,644,,unknownft.,cch2,urn:uuid:8686273d-75e4-4f47-8ace-3e06e27313bf,http://cch2.org/portal/collections/individual/index.php?occid=500045
500046,SD,SD00010615,SD10418,Nemophila menziesii var. integrifolia,205102,2/27/1935,1935,2,27,58,27-Feb-35,FL,San Diego,"Bluff on San Marcos Creek, near Green Valley School",33.0857,-117.2639,3218,,unknownft.,cch2,urn:uuid:bb4de817-e817-46bf-997d-49c6da102ae9,http://cch2.org/portal/collections/individual/index.php?occid=500046
500047,SD,SD00010561,SD10588,Nemophila menziesii var. integrifolia,205102,3/13/1935,1935,3,13,72,13-Mar-35,FL,San Diego,"Moosa Canyon, north of Escondido",33.25052,-117.12968,9654,,unknownft.,cch2,urn:uuid:4c97732b-9498-4f43-a0ae-d47f84abad02,http://cch2.org/portal/collections/individual/index.php?occid=500047
500048,SD,SD00010547,SD10785,Nemophila menziesii var. integrifolia,205102,3/23/1935,1935,3,23,82,23-Mar-35,FL,Imperial,"Boulder Park on Highway 80, top of Mountain Springs Grade",32.6589,-116.1008,644,,unknownft.,cch2,urn:uuid:c81a0ad8-2c49-43cd-b2ae-a1283aff6ab8,http://cch2.org/portal/collections/individual/index.php?occid=500048
500049,SD,SD00010556,SD10943,Nemophila menziesii var. integrifolia,205102,4/3/1935,1935,4,3,93,3-Apr-35,FL,San Diego,Near Tecate Junction on Potrero Grade,32.59816,-116.64312,805,,unknownft.,cch2,urn:uuid:040bd7e4-baa2-4873-b0d1-99d62bfd92ec,http://cch2.org/portal/collections/individual/index.php?occid=500049
500050,SD,SD00010504,SD11074,Nemophila menziesii,205099,4/6/1935,1935,4,6,96,6-Apr-35,FL,Kern,Bakersfield,,,,,unknownft.,cch2,urn:uuid:90ff291a-3724-404e-8cd9-377c445a14e7,http://cch2.org/portal/collections/individual/index.php?occid=500050
500051,SD,SD00010465,SD11138,Nemophila menziesii,205099,4/17/1935,1935,4,17,107,17-Apr-35,FFL,San Diego,2 miles east of Banner,33.08232,-116.51855,805,,unknownft.,cch2,urn:uuid:946b98c7-8f04-424f-8f76-7a9aa61977ff,http://cch2.org/portal/collections/individual/index.php?occid=500051
500052,SD,SD00010604,SD11309,Nemophila menziesii var. integrifolia,205102,4/27/1935,1935,4,27,117,27-Apr-35,FL,San Diego,"Picnic Grounds, Cuyamaca Rancho State Park",32.95935,-116.57969,241,,unknownft.,cch2,urn:uuid:b84079bf-e17e-4931-9d34-2a47976967ee,http://cch2.org/portal/collections/individual/index.php?occid=500052
500053,SD,SD00010571,SD11361,Nemophila menziesii var. integrifolia,205102,5/8/1935,1935,5,8,128,8-May-35,FFL,San Diego,5 mi. south of Mesa Grande on Black Cañon Road,33.13604,-116.79118,805,,unknownft.,cch2,urn:uuid:b5f70734-a4c4-4baa-8dba-578eb3e4dd8f,http://cch2.org/portal/collections/individual/index.php?occid=500053
500054,SD,SD00010462,SD11378,Nemophila menziesii,205099,5/8/1935,1935,5,8,128,8-May-35,FFL,San Diego,Chihuahua Valley,33.38516,-116.67809,2011,,unknownft.,cch2,urn:uuid:4e00c895-48af-439b-b418-deadb5f5bdba,http://cch2.org/portal/collections/individual/index.php?occid=500054
500055,SD,SD00010613,SD12002,Nemophila menziesii var. integrifolia,205102,7/10/1935,1935,7,10,191,10-Jul-35,FFL,San Diego,Near Wyss Ranch on Palomar Mt.,33.34371,-116.9104,,,unknownft.,cch2,urn:uuid:fa5123b8-af1f-420a-ae4b-3b181dda228d,http://cch2.org/portal/collections/individual/index.php?occid=500055
500056,SD,SD00010463,SD14452,Nemophila menziesii,205099,4/14/1936,1936,4,14,105,14-Apr-36,FL,San Diego,Montezuma Valley,33.21113,-116.52236,4023,,unknownft.,cch2,urn:uuid:b3a0f271-573e-4cfb-af45-fe721a397bd5,http://cch2.org/portal/collections/individual/index.php?occid=500056
500057,SD,SD00010607,SD14684,Nemophila menziesii var. integrifolia,205102,4/23/1936,1936,4,23,114,23-Apr-36,FFL,San Diego,burn in Habison Canyon,32.81302,-116.83831,2414,,unknownft.,cch2,urn:uuid:f76d2565-5ecf-4b6e-8bd5-fbdf76e68bdc,http://cch2.org/portal/collections/individual/index.php?occid=500057
500058,SD,SD00010554,SD15061,Nemophila menziesii var. integrifolia,205102,4/28/1936,1936,4,28,119,28-Apr-36,FFL,San Diego,Near Monument School,32.54362,-117.08315,402,,unknownft.,cch2,urn:uuid:28c127d8-c673-4aca-bdcf-9f923b2f6106,http://cch2.org/portal/collections/individual/index.php?occid=500058
500059,SD,SD00010569,SD15147,Nemophila menziesii var. integrifolia,205102,5/5/1936,1936,5,5,126,5-May-36,FFL,San Diego,Meadow below Cuyamaca Lake,32.99283,-116.59522,805,,unknownft.,cch2,urn:uuid:61434cf6-f452-4fd8-9344-b547f2cd38da,http://cch2.org/portal/collections/individual/index.php?occid=500059
500060,SD,SD00010570,SD15169,Nemophila menziesii var. integrifolia,205102,5/5/1936,1936,5,5,126,5-May-36,FFL,San Diego,Pine Hills,33.04838,-116.63085,1609,,unknownft.,cch2,urn:uuid:50e81e44-2eab-47ab-91a1-670bc1a6ee8a,http://cch2.org/portal/collections/individual/index.php?occid=500060
500061,SD,SD00010568,SD15885,Nemophila menziesii var. integrifolia,205102,5/30/1936,1936,5,30,151,30-May-36,FFL,San Diego,"Laguna Mts., near Garnet",32.92561,-116.45807,2011,,unknownft.,cch2,urn:uuid:75d42835-584f-4497-b278-572788fd2cbe,http://cch2.org/portal/collections/individual/index.php?occid=500061
500062,SD,SD00010578,SD17297,Nemophila menziesii var. integrifolia,205102,5/9/1937,1937,5,9,129,9-May-37,FFL,San Diego,Lyons Valley,32.71175,-116.75089,1609,,unknownft.,cch2,urn:uuid:23cbf429-9db8-4cdb-95a0-ab7353d1e9d4,http://cch2.org/portal/collections/individual/index.php?occid=500062
500063,SD,SD00010543,SD17537,Nemophila menziesii var. integrifolia,205102,5/15/1937,1937,5,15,135,15-May-37,FFL,San Diego,Palomar.,33.36337,-116.83613,,,unknownft.,cch2,urn:uuid:4d268552-d987-4c15-9de6-4498bce4bff2,http://cch2.org/portal/collections/individual/index.php?occid=500063
500064,SD,SD00010572,SD17761,Nemophila menziesii var. integrifolia,205102,6/10/1937,1937,6,10,161,10-Jun-37,FFL,San Diego,"So. Fork of Featherstone Creek, Barona Valley",32.92704,-116.83838,1207,,unknownft.,cch2,urn:uuid:ba9c2005-775c-4194-9f3c-706c8e391847,http://cch2.org/portal/collections/individual/index.php?occid=500064
500065,SD,SD00010610,SD20458,Nemophila menziesii var. integrifolia,205102,3/21/1938,1938,3,21,80,21-Mar-38,FL,San Diego,near Cañon Road Pt. Loma,32.72802,-117.23979,1126,,unknownft.,cch2,urn:uuid:25d7ef1b-0fcb-47e6-a9bc-99305c1aa878,http://cch2.org/portal/collections/individual/index.php?occid=500065
500066,SD,SD00010557,SD20800,Nemophila menziesii var. integrifolia,205102,4/10/1938,1938,4,10,100,10-Apr-38,FL,San Diego,Whispering Oaks near Sloane Ranch on Sweetwater River,32.77089,-116.7978,1609,,unknownft.,cch2,urn:uuid:aee78a4f-7b1a-4c8c-a3ff-1909167b8813,http://cch2.org/portal/collections/individual/index.php?occid=500066
500067,SD,SD00010575,SD21001,Nemophila menziesii var. integrifolia,205102,4/26/1938,1938,4,26,116,26-Apr-38,FFL,San Diego,Cedar Creek Bridge,33.27763,-116.85549,402,,unknownft.,cch2,urn:uuid:50d4ab7f-e710-40ad-831b-ae75df675f4e,http://cch2.org/portal/collections/individual/index.php?occid=500067
500068,SD,SD00010552,SD21352,Nemophila menziesii var. integrifolia,205102,5/10/1938,1938,5,10,130,10-May-38,FL,San Diego,Laguna Camp Ground,32.88727,-116.44724,805,,unknownft.,cch2,urn:uuid:135d43c4-9125-4eb4-823e-1a4dfbe1754f,http://cch2.org/portal/collections/individual/index.php?occid=500068
500069,SD,SD00010573,SD21381,Nemophila menziesii var. integrifolia,205102,5/10/1938,1938,5,10,130,10-May-38,FFL,San Diego,Pine Hills Junction,33.07822,-116.61748,402,,unknownft.,cch2,urn:uuid:0ba783c5-7767-47d4-b161-89b918d86cbe,http://cch2.org/portal/collections/individual/index.php?occid=500069
500070,SD,SD00010612,SD21418,Nemophila menziesii var. integrifolia,205102,5/18/1938,1938,5,18,138,18-May-38,FFL,San Diego,Burn at Boulevarde,32.66367,-116.27363,1609,,unknownft.,cch2,urn:uuid:46d0893c-d49b-4c69-9e0c-6fa8ed4c496f,http://cch2.org/portal/collections/individual/index.php?occid=500070
500071,SD,SD00010606,SD21647,Nemophila menziesii var. integrifolia,205102,5/27/1938,1938,5,27,147,27-May-38,FFL,San Diego,"Harper Ranch, Rattlesnake Valley",32.94033,-116.51363,1207,,unknownft.,cch2,urn:uuid:8b0989a7-66b4-4fce-86f8-68672e0909fc,http://cch2.org/portal/collections/individual/index.php?occid=500071
500072,SD,SD00010608,SD22175,Nemophila menziesii var. integrifolia,205102,8/6/1938,1938,8,6,218,6-Aug-38,FFL,San Diego,"Chimney Creek, Palomar Mountain.",33.32563,-116.89086,805,,unknownft.,cch2,urn:uuid:9e8d6acc-2689-4f03-b5fb-f21741822707,http://cch2.org/portal/collections/individual/index.php?occid=500072
500073,SD,SD00010560,SD24932,Nemophila menziesii var. integrifolia,205102,5/9/1939,1939,5,9,129,9-May-39,FFL,San Diego,1st year burn in Chaparral near Lilac,33.28781,-117.08392,1609,,unknownft.,cch2,urn:uuid:63456bc6-27a3-4a05-87bd-10a78bdf30a0,http://cch2.org/portal/collections/individual/index.php?occid=500073
500074,SD,SD00010609,SD26586,Nemophila menziesii var. integrifolia,205102,3/30/1940,1940,3,30,90,30-Mar-40,FL,San Diego,Hormiguero Ranch,33.39493,-117.0338,1609,,unknownft.,cch2,urn:uuid:4742eee3-68ea-44a5-b7a9-13e134afff14,http://cch2.org/portal/collections/individual/index.php?occid=500074
500075,SD,SD00010559,SD26910,Nemophila menziesii var. integrifolia,205102,4/18/1940,1940,4,18,109,18-Apr-40,FL,San Diego,Herron Ranch near DeLuz,33.43751,-117.32043,,,unknownft.,cch2,urn:uuid:5a7a9863-5d7c-49e3-a87a-83b3a216edfe,http://cch2.org/portal/collections/individual/index.php?occid=500075
500076,SD,SD00010614,SD27516,Nemophila menziesii var. integrifolia,205102,5/22/1940,1940,5,22,143,22-May-40,FFL,San Diego,Near Eagles' Nest Hot Springs Mt.,33.28809,-116.59418,805,,unknownft.,cch2,urn:uuid:3794ae2d-b041-4d85-803d-27bb288d6a8f,http://cch2.org/portal/collections/individual/index.php?occid=500076
500077,SD,SD00010464,SD28484,Nemophila menziesii,205099,4/29/1941,1941,4,29,119,29-Apr-41,FFL,San Diego,Near junction San Felipe & Montezuma roads,33.22157,-116.60615,402,,unknownft.,cch2,urn:uuid:185347ac-c8de-413f-8db9-0bfeff8c1e11,http://cch2.org/portal/collections/individual/index.php?occid=500077
500078,SD,SD00010467,SD28536,Nemophila menziesii,205099,4/29/1941,1941,4,29,119,29-Apr-41,FFL,San Diego,Fresh burn at Montezuma View Point,33.21145,-116.5124,805,,unknownft.,cch2,urn:uuid:4d750bae-a78e-48c9-9915-55ee9cab908d,http://cch2.org/portal/collections/individual/index.php?occid=500078
500079,SD,SD00010611,SD28747,Nemophila menziesii var. integrifolia,205102,5/22/1941,1941,5,22,142,22-May-41,FFL,San Diego,Burn between Campo and Canyon City,32.5987,-116.50384,3218,,unknownft.,cch2,urn:uuid:15c42a17-22e1-436f-84bc-5e777136ea9b,http://cch2.org/portal/collections/individual/index.php?occid=500079
500081,SD,SD00010540,SD36592,Nemophila menziesii var. integrifolia,205102,6/14/1945,1945,6,14,165,14-Jun-45,FFL,San Diego,Palomar.,33.33502,-116.86051,,,unknownft.,cch2,urn:uuid:3780ae40-6b40-4982-ac4e-9250f2df9d97,http://cch2.org/portal/collections/individual/index.php?occid=500081
500082,SD,SD00010538,SD37187,Nemophila menziesii var. integrifolia,205102,5/16/1941,1941,5,16,136,16-May-41,FFL,San Diego,Campo Boulevard highway,32.65127,-116.38252,11263,,unknownft.,cch2,urn:uuid:f95ad294-456b-4054-90dc-86a68d78034e,http://cch2.org/portal/collections/individual/index.php?occid=500082
500083,SD,SD00010502,SD38531,Nemophila menziesii,205099,3/7/1931,1931,3,7,66,7-Mar-31,FL,Los Angeles,"Other collections same day made at Oakwilde campground, Los Angeles County",,,,,unknownft.,cch2,urn:uuid:d80681bb-d7d1-4419-bc84-f562ea625216,http://cch2.org/portal/collections/individual/index.php?occid=500083
500085,SD,SD00010494,SD38533,Nemophila menziesii,205099,3/23/1935,1935,3,23,82,23-Mar-35,FL,Kern,South of Arvin,35.17997,-118.83301,,,unknownft.,cch2,urn:uuid:fbd7c691-5ecb-4711-b83b-908ec396fba8,http://cch2.org/portal/collections/individual/index.php?occid=500085
500086,SD,SD00010498,SD38534,Nemophila menziesii,205099,1932-03-00,1932,3,0,,Mar-32,FL,Mariposa,Yosemite National Park; in valley.,37.72644,-119.61164,,,unknownft.,cch2,urn:uuid:77b42113-6a4e-468c-aca2-be1251ae8515,http://cch2.org/portal/collections/individual/index.php?occid=500086
500087,SD,SD00010499,SD38535,Nemophila menziesii,205099,3/1/1932,1932,3,1,61,1-Mar-32,FL,Mariposa,Yosemite National Park; in valley.,37.72644,-119.61164,,,unknownft.,cch2,urn:uuid:1c6c3e8e-c806-48bb-a584-f5ca0e957b2d,http://cch2.org/portal/collections/individual/index.php?occid=500087
500088,SD,SD00010500,SD38536,Nemophila menziesii,205099,4/19/1933,1933,4,19,109,19-Apr-33,FL,San Mateo,Above Emerald Lake,37.4634,-122.2613,,,unknownft.,cch2,urn:uuid:8df93685-dbf3-467f-9c9a-f00332a781ba,http://cch2.org/portal/collections/individual/index.php?occid=500088
500089,SD,SD00010553,SD38540,Nemophila menziesii var. integrifolia,205102,5/18/1935,1935,5,18,138,18-May-35,FL,San Diego,"Moist hillside, Cuyamaca Lake area",32.99264,-116.56513,4827,,unknownft.,cch2,urn:uuid:068c4cd3-e6a9-4717-9152-9a0551401404,http://cch2.org/portal/collections/individual/index.php?occid=500089
500090,SD,SD00010601,SD38541,Nemophila menziesii var. integrifolia,205102,4/19/1935,1935,4,19,109,19-Apr-35,FFL,San Diego,Near Banner,33.06883,-116.54613,1207,,unknownft.,cch2,urn:uuid:9b3d77d4-d4d5-499b-8eb1-b8219253afc7,http://cch2.org/portal/collections/individual/index.php?occid=500090
500092,SD,SD00010501,SD40793,Nemophila menziesii,205099,5/14/1933,1933,5,14,134,14-May-33,FL,Tulare,"West slope Sierra Nevada, Balch Park Road, 1.8 mile above the control station.",,,,1006,,cch2,urn:uuid:c9008026-0a33-4deb-8225-ce5bc00818cf,http://cch2.org/portal/collections/individual/index.php?occid=500092
500097,SD,SD00010486,SD40860,Nemophila menziesii,205099,5/19/1933,1933,5,19,139,19-May-33,FL,Madera,West slope of Sierra Nevada; 1.0 mile from Bass Lake on road to Coarse Gold.,,,,1097,,cch2,urn:uuid:79be243e-9135-4fef-96ad-e75211c648c6,http://cch2.org/portal/collections/individual/index.php?occid=500097
500103,SD,SD00010495,SD44504,Nemophila menziesii,205099,5/8/1948,1948,5,8,129,8-May-48,FL,Kern,"Kern River Canyon, 21.3 miles west of Isabella.",,,,,unknownft.,cch2,urn:uuid:988969d3-4ab9-4f20-8f0c-7d0ef3ce3a93,http://cch2.org/portal/collections/individual/index.php?occid=500103
500104,SD,SD00010669,SD44541,Nemophila menziesii var. integrifolia,205102,4/3/1943,1943,4,3,93,3-Apr-43,FL,Los Angeles,San Gabriel Mountains; Tanbark Flat.,,,,823,,cch2,urn:uuid:7221a0df-d019-416d-b776-c2b6e3eb2b73,http://cch2.org/portal/collections/individual/index.php?occid=500104
500106,SD,SD00010430,SD44664,Nemophila menziesii var. atomaria,205101,4/28/1951,1951,4,28,118,28-Apr-51,FFL,Monterey,Santa Lucia Mtns.,,,,762,,cch2,urn:uuid:3876f208-d4c7-45ca-8f29-5f00e2561d00,http://cch2.org/portal/collections/individual/index.php?occid=500106
500107,SD,SD00010565,SD50076,Nemophila menziesii var. integrifolia,205102,5/18/1960,1960,5,18,139,18-May-60,FFL,San Diego,Green Valley,32.91667,-116.56667,402,1250,,cch2,urn:uuid:44967f65-2133-458b-a056-abe0c1693038,http://cch2.org/portal/collections/individual/index.php?occid=500107
500108,SD,SD00010506,SD51051,Nemophila menziesii,205099,4/11/1960,1960,4,11,102,11-Apr-60,FL,Santa Barbara,"Summit on State Highway 166, Cuyama River Road.",,,,853,,cch2,urn:uuid:1db0a5b3-e8eb-4f61-8330-c2844e032741,http://cch2.org/portal/collections/individual/index.php?occid=500108
500109,SD,SD00010489,SD52427,Nemophila menziesii,205099,3/16/1953,1953,3,16,75,16-Mar-53,FL,Los Angeles,"San Jose-Puente Hills, south of Pomona, on the Brea Canyon Road.",,,,244,,cch2,urn:uuid:05440e6a-b09e-4428-b3d9-0af6a6112649,http://cch2.org/portal/collections/individual/index.php?occid=500109
500110,SD,SD00010442,SD52525,Nemophila menziesii var. menziesii,205103,1960-04-00,1960,4,0,,Apr-60,FL,San Diego,"Culp Valley, Anza-Borrego Park",33.20889,-116.4525,644,,unknownft.,cch2,urn:uuid:db8635ad-7416-4a5f-bdfd-a7d173b52af0,http://cch2.org/portal/collections/individual/index.php?occid=500110
500112,SD,SD00010507,SD56836,Nemophila menziesii,205099,5/17/1963,1963,5,17,137,17-May-63,FL,Santa Barbara,13.2 miles north of Lompoc on Highway 1.,,,,183,,cch2,urn:uuid:12ac94a5-d302-48e7-a689-f5b85bbdc678,http://cch2.org/portal/collections/individual/index.php?occid=500112
500113,SD,SD00010461,SD58282,Nemophila menziesii,205099,4/14/1920,1920,4,14,105,14-Apr-20,FL,San Diego,Warner Ranch,33.24254,-116.6653,2414,,unknownft.,cch2,urn:uuid:1c3385ca-635f-485e-ac93-56bf9aa4c992,http://cch2.org/portal/collections/individual/index.php?occid=500113
500114,SD,SD00010671,SD58283,Nemophila menziesii var. integrifolia,205102,5/19/1918,1918,5,19,139,19-May-18,FL,Los Angeles,San Gabriel Mountains; Millards Canyon.,34.2172,-118.1463,,610,,cch2,urn:uuid:aed42b6a-4d9c-4b2a-b2e7-d3436b68e342,http://cch2.org/portal/collections/individual/index.php?occid=500114
500118,SD,SD00010563,SD60451,Nemophila menziesii var. integrifolia,205102,5/19/1963,1963,5,19,139,19-May-63,FL,San Diego,"in grassy spot under oaks, ca. 1 mile W of Monument Peak, Laguna Mountains",32.8941,-116.43781,402,1800,,cch2,urn:uuid:b3d6d8b8-5529-45fa-a862-b815a2c035c5,http://cch2.org/portal/collections/individual/index.php?occid=500118
500120,SD,SD00010472,SD70727,Nemophila menziesii var. menziesii,205103,4/10/1969,1969,4,10,100,10-Apr-69,FL,San Diego,Palomar Mountain State Park. On open slope se workshop reservoir.,33.33027,-116.89894,241,1630,,cch2,urn:uuid:26a41360-916b-4e15-ab60-6c3caf48c867,http://cch2.org/portal/collections/individual/index.php?occid=500120
500121,SD,SD00010551,SD70890,Nemophila menziesii var. integrifolia,205102,6/19/1969,1969,6,19,170,19-Jun-69,FL,San Diego,"West slope of Middle Peak, Cuyamaca",32.98333,-116.6,402,1400,,cch2,urn:uuid:a47634e4-bca2-4918-bd5d-b541af47fa70,http://cch2.org/portal/collections/individual/index.php?occid=500121
500122,SD,SD00010605,SD72123,Nemophila menziesii var. integrifolia,205102,6/18/1967,1967,6,18,169,18-Jun-67,FFL,San Diego,"North Meadow, Middle Cuyamaca Peak",32.98333,-116.60833,402,1524,,cch2,urn:uuid:756b77b8-03bf-4f7e-a1c5-e98719dd3cfb,http://cch2.org/portal/collections/individual/index.php?occid=500122
500123,SD,SD00010673,SD72397,Nemophila menziesii var. integrifolia,205102,5/7/1963,1963,5,7,127,7-May-63,FL,San Bernardino,"Cedar Pines Park, San Bernardino Mountains.",34.25,-117.3259,,1524,,cch2,urn:uuid:03e1a5fb-b444-4f5f-bc98-df9e193bdc48,http://cch2.org/portal/collections/individual/index.php?occid=500123
500124,SD,SD00010566,SD73567,Nemophila menziesii var. integrifolia,205102,5/26/1970,1970,5,26,146,26-May-70,FFL,San Diego,Pot-Hole Creek below Corte Madera Lake. Pine Valley,32.78736,-116.58513,1609,970,,cch2,urn:uuid:ad571e2c-3913-48b1-ad0c-d95b5fe1f507,http://cch2.org/portal/collections/individual/index.php?occid=500124
500125,SD,SD00010490,SD75491,Nemophila menziesii,205099,3/6/1941,1941,3,6,65,6-Mar-41,FL,Los Angeles,Santa Catalina Island; Middle Ranch Canyon.,33.3842,-118.3842,,300,,cch2,urn:uuid:d13b2764-e653-476c-86b8-76d09fd340e1,http://cch2.org/portal/collections/individual/index.php?occid=500125
500126,SD,SD00010564,SD85310,Nemophila menziesii var. integrifolia,205102,4/28/1971,1971,4,28,118,28-Apr-71,FFL,San Diego,"In leaf litter, Echo Dell",32.9,-116.65,402,960,,cch2,urn:uuid:6e21c454-561a-49a0-97e0-213ba755f914,http://cch2.org/portal/collections/individual/index.php?occid=500126
500127,SD,SD00010558,SD85418,Nemophila menziesii var. integrifolia,205102,3/31/1971,1971,3,31,90,31-Mar-71,FL,San Diego,"Shaded area along dirt road east of small pond south of locked gate, Echo Dell 4 miles north of Descanso",32.9,-116.65,402,960,,cch2,urn:uuid:0352cddc-bb74-492d-b41b-19beaf30fe6c,http://cch2.org/portal/collections/individual/index.php?occid=500127
500128,SD,SD00010469,SD85503,Nemophila menziesii var. menziesii,205103,3/27/1971,1971,3,27,86,27-Mar-71,FL,San Diego,"Shade of live oaks along San Vicente Rd. near junction with Wildcat Canyon Rd., western San Vicente Valley.",33,-116.83333,402,390,,cch2,urn:uuid:637859f7-daed-4f8c-8416-e1266b46c81d,http://cch2.org/portal/collections/individual/index.php?occid=500128
500129,SD,SD00010459,SD85506,Nemophila menziesii,205099,4/22/1971,1971,4,22,112,22-Apr-71,FL,San Diego,"In forest leaf litter, Laguna Mountains",32.91667,-116.46667,1609,1590,,cch2,urn:uuid:64a4a136-e6d0-4481-a4b8-7f89423c61b3,http://cch2.org/portal/collections/individual/index.php?occid=500129
500133,SD,SD00010429,SD88406,Nemophila menziesii var. atomaria,205101,5/1/1972,1972,5,1,122,1-May-72,FFL,Sonoma,Duncan Point.,,,,,unknownft.,cch2,urn:uuid:366837fc-29a1-49ad-9048-d0a5cfef2157,http://cch2.org/portal/collections/individual/index.php?occid=500133
500135,SD,SD00010672,SD92977,Nemophila menziesii var. integrifolia,205102,4/30/1954,1954,4,30,120,30-Apr-54,FL,San Bernardino,"Idlewild, San Jacinto River.",33.7503,-116.7152,,1676,,cch2,urn:uuid:cfe1938d-1438-46b9-ad12-c1b95356b65a,http://cch2.org/portal/collections/individual/index.php?occid=500135
500138,SD,SD00010488,SD111947,Nemophila menziesii,205099,5/18/1980,1980,5,18,139,18-May-80,FL,Los Angeles,"South fork Big Rock Creek, ca. 0.5 mile north of South Fork Campground on Forest Road 4N11A.",,,,1372,,cch2,urn:uuid:f0fcada7-dfd0-4e2c-b35a-cc38a1de62af,http://cch2.org/portal/collections/individual/index.php?occid=500138
500143,SD,SD00010670,SD113484,Nemophila menziesii var. integrifolia,205102,,,,,,,FL,Los Angeles,Claremont,,,,,unknownft.,cch2,urn:uuid:b36e8cdf-d48a-4b59-b3da-f95b17e3f355,http://cch2.org/portal/collections/individual/index.php?occid=500143
500144,SD,SD00010468,SD113485,Nemophila menziesii,205099,3/24/1935,1935,3,24,83,24-Mar-35,FL,San Diego,East of Jamul,32.71452,-116.83958,,,unknownft.,cch2,urn:uuid:2d4bb6bd-d9d6-49a1-9164-5304d9f12833,http://cch2.org/portal/collections/individual/index.php?occid=500144
500145,SD,SD00010491,SD113486,Nemophila menziesii,205099,4/1/1915,1915,4,1,91,1-Apr-15,FL,Los Angeles,Claremont,,,,,unknownft.,cch2,urn:uuid:6efc6fda-97aa-4766-a909-276a885a45d9,http://cch2.org/portal/collections/individual/index.php?occid=500145
500146,SD,SD00010549,SD114740,Nemophila menziesii var. integrifolia,205102,4/16/1982,1982,4,16,106,16-Apr-82,FL,San Diego,"Pine Valley, Corte Madera Ranch",32.76409,-116.57253,1609,1200,,cch2,urn:uuid:613de08c-d9de-4784-a5a7-3d325b7f3965,http://cch2.org/portal/collections/individual/index.php?occid=500146
500147,SD,SD00010530,SD114932,Nemophila menziesii var. integrifolia,205102,4/20/1979,1979,4,20,110,20-Apr-79,FL,San Diego,About 5 m east of stream in oak woodland in south end of Fred Canyon,32.77323,-116.43462,402,1340,,cch2,urn:uuid:0dd0e980-70ba-43f2-9a29-a99b051f7cbd,http://cch2.org/portal/collections/individual/index.php?occid=500147
500148,SD,SD00008034,SD115641,Nemophila menziesii var. menziesii,205103,5/14/1983,1983,5,14,134,14-May-83,FL,Imperial,"In-Ko-Pah Mountains, south of I-8. (IPB 10/07)",32.63057,-116.0937,241,1158,,cch2,urn:uuid:caeafa7a-01d4-4f4b-b0d9-38d206c66256,http://cch2.org/portal/collections/individual/index.php?occid=500148
500149,SD,SD00010470,SD118432,Nemophila menziesii var. menziesii,205103,4/26/1985,1985,4,26,116,26-Apr-85,FL,San Diego,"oak woodland, Puerta la Cruz Road, Cleveland Nat. Forest.",33.35759,-116.67206,241,1160,,cch2,urn:uuid:fd7220cd-0d9b-4009-bba4-6fb5b1da93ee,http://cch2.org/portal/collections/individual/index.php?occid=500149
500150,SD,SD00010496,SD124417,Nemophila menziesii,205099,3/18/1950,1950,3,18,77,18-Mar-50,FL,Kern,"Along Soda Lake Road to Carrizo Plain, ca. 0.8 mile off Highway 399. Near San Luis Obispo County line.",,,,,unknownft.,cch2,urn:uuid:4132b7cf-0ad6-40ab-ac4d-5ba123ff2e9c,http://cch2.org/portal/collections/individual/index.php?occid=500150
500152,SD,SD00010492,SD125445,Nemophila menziesii,205099,4/7/1978,1978,4,7,97,7-Apr-78,FL,Los Angeles,West side of Sierra Highway just north of Pearblossom Highway.,,,,914,,cch2,urn:uuid:4a08449e-6fb6-4754-b6a3-5ecf6dfd9b5a,http://cch2.org/portal/collections/individual/index.php?occid=500152
500153,SD,SD00010483,SD125572,Nemophila menziesii,205099,4/9/1957,1957,4,9,99,9-Apr-57,FL,Santa Barbara,"Sata Ynez Mountains; 0.75 mile east of San Marcos Pass, along El Camino Cielo.",,,,,unknownft.,cch2,urn:uuid:f0649024-1832-404f-8d5e-88c11682b850,http://cch2.org/portal/collections/individual/index.php?occid=500153
500155,SD,SD00010617,SD128338,Nemophila menziesii var. integrifolia,205102,4/16/1972,1972,4,16,107,16-Apr-72,FL,San Diego,Cutca Valley,33.39303,-116.91633,805,1050,,cch2,urn:uuid:14c19ccc-cfe2-4acd-bd7f-3580061119a1,http://cch2.org/portal/collections/individual/index.php?occid=500155
500160,SD,SD00010471,SD133999,Nemophila menziesii var. menziesii,205103,4/22/1991,1991,4,22,112,22-Apr-91,FL,San Diego,"NE side of Aguanga Mountain, mouth of Blue Canyon, 6.75 mi. NW of Warner Springs P.O. by way of Calif. Hwy. 79.",33.33144,-116.71249,241,930,,cch2,urn:uuid:d48d5948-e4a3-49a3-b54b-5d70a388d803,http://cch2.org/portal/collections/individual/index.php?occid=500160
500161,SD,SD00010567,SD134246,Nemophila menziesii var. integrifolia,205102,3/16/1971,1971,3,16,75,16-Mar-71,FL,San Diego,½ mile NW of Margarita Peak,33.45129,-117.39809,402,800,,cch2,urn:uuid:231046a5-1475-4f7a-a13f-612e6970102f,http://cch2.org/portal/collections/individual/index.php?occid=500161
500162,SD,SD00010618,SD136823,Nemophila menziesii var. integrifolia,205102,5/6/1992,1992,5,6,127,6-May-92,FFL,San Diego,"So. Santa Ana Mts, San Mateo Cyn Wilderness Area. S side of Miller Mt along 'Miller Canyon', the major drainage on the southern flank of the mountain, from Road 8S02 upstream to the area of contact between lower granitic and higher basaltic rocks.",33.49225,-117.38606,402,640,,cch2,urn:uuid:a02deab9-1853-42fc-90a4-d6bcaab55029,http://cch2.org/portal/collections/individual/index.php?occid=500162
500163,SD,SD00010546,SD137733,Nemophila menziesii var. integrifolia,205102,5/4/1995,1995,5,4,124,4-May-95,FFL,Riverside,"Cleveland Nat'l Forest, Agua Tibia Wilderness Area. N slope of Agua Tibia Mtn., E of Dripping Springs Alcove Area, N of Woodchuck Trail.",33.45,-116.95,,610,,cch2,urn:uuid:83e18076-07e4-480c-a6c7-cbe9a8730706,http://cch2.org/portal/collections/individual/index.php?occid=500163
500166,SD,SD00010497,SD143516,Nemophila menziesii,205099,5/17/1951,1951,5,17,137,17-May-51,FL,Contra Costa,Open hillside west of Orinda.,,,,,unknownft.,cch2,urn:uuid:df8a6e71-51f7-485d-b76b-95b38bdd4e3c,http://cch2.org/portal/collections/individual/index.php?occid=500166
500174,SD,SD00010539,SD155169,Nemophila menziesii var. integrifolia,205102,4/19/2002,2002,4,19,109,19-Apr-02,FFL,San Diego,Kelley/Rebman Ranch at 565 Anderson Truck Trail on northwest side of Viejas Mountain: approx. 2 miles north of Victoria Road in Alpine,32.87278,-116.7475,,818,,cch2,urn:uuid:5c59f857-82cd-44c7-b9ed-4ac44f54767a,http://cch2.org/portal/collections/individual/index.php?occid=500174
500175,SD,SD00010531,SD155607,Nemophila menziesii var. integrifolia,205102,3/15/2003,2003,3,15,74,15-Mar-03,FL,San Diego,"Cuyamaca Lake, Lucky 5 Acquisition, Location 3 - Knoll with grassland on northeast side.",32.995,-116.53667,,1441,,cch2,urn:uuid:3ce974a4-a9d4-4f52-b797-49c6d89ec853,http://cch2.org/portal/collections/individual/index.php?occid=500175
500176,SD,SD00008033,SD155782,Nemophila menziesii var. integrifolia,205102,3/16/2001,2001,3,16,75,16-Mar-01,FL,Imperial,"Jacumba Natural Area, In-Ko-Pah Mountains, near Smuggler's Cove. (IPB 10/07)",32.63482,-116.09537,241,1046,,cch2,urn:uuid:0acb40ff-5f71-47c4-b469-9f3561def192,http://cch2.org/portal/collections/individual/index.php?occid=500176
500177,SD,SD00010473,SD157168,Nemophila menziesii var. menziesii,205103,5/2/2004,2004,5,2,123,2-May-04,FL,San Diego,"Palomar Mountain Divide Truck Trail, South of Highway 79, nearest town is Oak Grove.",33.3167,-116.7353,,1376,,cch2,urn:uuid:96a64f67-8122-4047-b338-a918450db9db,http://cch2.org/portal/collections/individual/index.php?occid=500177
500178,SD,SD00010537,SD157169,Nemophila menziesii var. integrifolia,205102,3/28/2004,2004,3,28,88,28-Mar-04,FL,San Diego,"Descanso, ca. ½ mile north of Hulburd Grove. Drainage running down to Sweetwater river, north-facing slope.",32.873,-116.6255,,1100,,cch2,urn:uuid:f9221c77-6721-4b49-8d98-734c5419fad6,http://cch2.org/portal/collections/individual/index.php?occid=500178
500179,SD,SD00010593,SD157170,Nemophila menziesii var. integrifolia,205102,5/22/2004,2004,5,22,143,22-May-04,FFL,San Diego,"Laguna Mountains, Sunrise Highway, Kitchen Creek Truck Trail.",32.8447,-116.4489,,1562,,cch2,urn:uuid:0b5aae1d-aa7a-4a3e-a4bd-ed3c7141b797,http://cch2.org/portal/collections/individual/index.php?occid=500179
500180,SD,SD00010535,SD158116,Nemophila menziesii var. integrifolia,205102,5/8/2004,2004,5,8,129,8-May-04,FL,San Diego,"Square # 33: Noble Canyon Trail, 0.8 miles west of Sunrise Hwy trailhead; 100' east of Pine Creek Road junction",32.90417,-116.4725,,1661,,cch2,urn:uuid:655c0610-1008-4609-8d4d-9d882f342570,http://cch2.org/portal/collections/individual/index.php?occid=500180
500182,SD,SD00010457,SD158444,Nemophila menziesii var. menziesii,205103,3/19/2004,2004,3,19,79,19-Mar-04,FL,San Diego,"El Capitan Reservoir, just east of dam, above main road.",32.87806,-116.80056,80,305,,cch2,urn:uuid:b422bb66-1166-4945-86fa-36470ea8f1b6,http://cch2.org/portal/collections/individual/index.php?occid=500182
500183,SD,SD00010533,SD158700,Nemophila menziesii var. integrifolia,205102,7/5/2004,2004,7,5,187,5-Jul-04,FFL,San Diego,"in seasonal creek bed in oak woodland, .5 mile E of Inaja picnic area, ca 500 ft South of Hwy. 78/79",33.1022,-116.6607,,940,,cch2,urn:uuid:cc8c4b94-a7fb-4939-aaa3-58cbd4dbd13e,http://cch2.org/portal/collections/individual/index.php?occid=500183
500184,SD,SD00010534,SD158701,Nemophila menziesii var. integrifolia,205102,4/19/2003,2003,4,19,109,19-Apr-03,FL,San Diego,Boulevard - Garza Property near Shasta Lane - Location 1- near graded area at southwestern edge of property.,32.63889,-116.34556,,1123,,cch2,urn:uuid:c151bfbc-3a3a-4079-ad72-54bba2b03405,http://cch2.org/portal/collections/individual/index.php?occid=500184
500185,SD,SD00010536,SD160300,Nemophila menziesii var. integrifolia,205102,3/27/2004,2004,3,27,87,27-Mar-04,UNK,San Diego,"3225 Pine Hills Road, Julian, CA 92036",33.07056,-116.60194,,1290,,cch2,urn:uuid:968e6f06-9ddb-469f-8476-81edfc07cb69,http://cch2.org/portal/collections/individual/index.php?occid=500185
500186,SD,SD00010532,SD160590,Nemophila menziesii var. integrifolia,205102,4/8/2003,2003,4,8,98,8-Apr-03,FFL,San Diego,Laguna Mountains: Lucky 5 Ranch; southern portion of new acquisition by California State Parks: west side of Sunrise Hwy (S-1) between Cuyamaca Lake and Mount Laguna,32.93194,-116.49333,,1600,,cch2,urn:uuid:eb2e6146-626a-431e-9d89-a108bd49045b,http://cch2.org/portal/collections/individual/index.php?occid=500186
500187,SD,SD00010545,SD160591,Nemophila menziesii var. integrifolia,205102,4/29/2003,2003,4,29,119,29-Apr-03,FFL,San Diego,"Walker Canyon Ecological Reserve: between Boulevard and Jacumba on the north side of Interstate 8, along arroyo bottom near stream",32.66361,-116.22167,,870,,cch2,urn:uuid:7a80753f-4321-44d6-8d8e-89662de2514f,http://cch2.org/portal/collections/individual/index.php?occid=500187
500188,SD,SD00010655,SD163313,Nemophila menziesii var. integrifolia,205102,3/21/2002,2002,3,21,80,21-Mar-02,UNK,San Diego,Palomar State Park on west facing slope approximately 300 meters west of Boucher Hill.,33.33556,-116.92194,,1585,,cch2,urn:uuid:d2c0f8e8-6b1e-4edf-bc4f-2a095bf09a88,http://cch2.org/portal/collections/individual/index.php?occid=500188
500189,SD,SD00010550,SD163436,Nemophila menziesii var. integrifolia,205102,5/18/2004,2004,5,18,139,18-May-04,UNK,San Diego,"Rancho Cuyamaca State Park, West Mesa.",32.94222,-116.57278,,1387,,cch2,urn:uuid:b0aa321b-574e-49bc-918b-a5e3bba4d507,http://cch2.org/portal/collections/individual/index.php?occid=500189
500190,SD,SD00010548,SD165197,Nemophila menziesii var. integrifolia,205102,3/25/2004,2004,3,25,85,25-Mar-04,FL,San Diego,"4 miles south of pine valley, bear valley rd. 1 mile east of corte madera rd.",32.79583,-116.55,,1236,,cch2,urn:uuid:fe4b0fcd-ea27-44df-8147-0b274501c2fb,http://cch2.org/portal/collections/individual/index.php?occid=500190
500191,SD,SD00010660,SD165589,Nemophila menziesii var. integrifolia,205102,3/23/2004,2004,3,23,83,23-Mar-04,FL,San Diego,"Los Caballos Horse Camp, Cuyamaca Rancho State Park",32.97222,-116.57167,,451,,cch2,urn:uuid:2506306c-9930-4d11-b2c6-d30f143e37d7,http://cch2.org/portal/collections/individual/index.php?occid=500191
500192,SD,SD00010659,SD165590,Nemophila menziesii var. integrifolia,205102,2/13/2005,2005,2,13,44,13-Feb-05,FL,San Diego,0.5 mile SE of entrance to Inaja picnic area on Highway 78/79 between Santa Isabel and Wynola,33.0971,-116.6592,,1060,,cch2,urn:uuid:608a72c0-6b08-40c1-b890-95f0750c020f,http://cch2.org/portal/collections/individual/index.php?occid=500192
500193,SD,SD00010658,SD165591,Nemophila menziesii var. integrifolia,205102,4/30/2004,2004,4,30,121,30-Apr-04,FL,San Diego,At southern end of Cuyamaca Rancho State Park off Hwy 79 on the South Boundary Fire Road (entrance is directly across from the East Mesa Fire Road entrance).,32.88917,-116.57667,,329,,cch2,urn:uuid:70bc0e3f-d3a9-4c96-97e4-994a3d91b900,http://cch2.org/portal/collections/individual/index.php?occid=500193
500194,SD,SD00010657,SD165592,Nemophila menziesii var. integrifolia,205102,6/12/2003,2003,6,12,163,12-Jun-03,FR,San Diego,Mack Trust property on Hwy 79 in Descanso (pre-acquisition survey),32.86417,-116.59389,,329,,cch2,urn:uuid:a4034c76-6711-436f-994e-e0d04611aa28,http://cch2.org/portal/collections/individual/index.php?occid=500194
500195,SD,SD00010656,SD166472,Nemophila menziesii var. integrifolia,205102,1/20/2005,2005,1,20,20,20-Jan-05,FFL,San Diego,"Rancho Jamul Ecological Reserve (California Dept. of Fish & Game): west of Hwy. 94, south of Jamul & north of Otay Lakes Road; central part of reserve just west of the main buildings, northeast-facing rocky slope",32.67861,-116.86,,270,,cch2,urn:uuid:b18b33ee-321d-4224-930a-59eda2826cfe,http://cch2.org/portal/collections/individual/index.php?occid=500195
500196,SD,SD00010511,SD168874,Nemophila menziesii var. integrifolia,205102,2/1/2005,2005,2,1,32,1-Feb-05,FL,San Diego,"Sycuan Peak Ecological Reserve (California Dept. of Fish & Game): southeast of Dehesa, southwest of Loveland Reservoir; on the lower north side of Sycuan Peak, just southwest of a wet spring area along Sloan Canyon Road",32.76889,-116.81278,,265,,cch2,urn:uuid:b10de43f-10c0-4ae7-844e-d10aaa6f9149,http://cch2.org/portal/collections/individual/index.php?occid=500196
500197,SD,SD00010654,SD169681,Nemophila menziesii var. integrifolia,205102,3/10/2005,2005,3,10,69,10-Mar-05,FL,San Diego,"4 mi SE of Alpine. Lucky Light Ranch (inholding in Cleveland National Forest) off of Bell Bluff Truck Trail, ~1 mi E of Bell Bluff, south of Sweetwater River",32.814,-116.672,,894,,cch2,urn:uuid:4b60ff2f-8791-4e3d-b5aa-efe21561e554,http://cch2.org/portal/collections/individual/index.php?occid=500197
500198,SD,SD00010600,SD171422,Nemophila menziesii var. integrifolia,205102,4/9/2005,2005,4,9,99,9-Apr-05,FFL,San Diego,"Corral Canyon: Cleveland National Forest; south of Los Pinos Mountain and northwest of Lake Morena, near the road for the OHV area",32.71417,-116.58694,,980,,cch2,urn:uuid:020c7dcc-e8f9-4e6a-8ec2-7eb69ae679f1,http://cch2.org/portal/collections/individual/index.php?occid=500198
500199,SD,SD00010599,SD174703,Nemophila menziesii var. integrifolia,205102,6/29/2005,2005,6,29,180,29-Jun-05,FFL,San Diego,"Laguna Mountains: Cleveland National Forest; vicinity of Penny Pines above Storm Canyon, E of Sunrise Highway and W of the Pacific Crest Trail, SW of Garnet Peak",32.91444,-116.45778,,1660,,cch2,urn:uuid:149dbb4b-7dd5-496c-8947-82e265f63fc1,http://cch2.org/portal/collections/individual/index.php?occid=500199
500200,SD,SD00010596,SD175478,Nemophila menziesii var. integrifolia,205102,4/27/2006,2006,4,27,117,27-Apr-06,FFL,San Diego,"Monte Vista Ranch (owned by The Nature Conservancy): S of Ramona, NW of San Vicente Reservoir; S of San Vicente Road along Chuckwagon Road onto the Ranch; along road west of central meadow",32.97389,-116.87111,,338,,cch2,urn:uuid:03014d6f-9951-4fc4-ba84-46fcbe91da9c,http://cch2.org/portal/collections/individual/index.php?occid=500200
500201,SD,SD00010597,SD175479,Nemophila menziesii var. integrifolia,205102,4/21/2006,2006,4,21,111,21-Apr-06,FFL,San Diego,"Loveland Reservoir (land owned by the Sweetwater River Valley Authority): S of Alpine, S of Japatul Valley Road and E of its junction with Dehesa Rd.; extreme NE end of lake, S-side of valley on N-facing slope and along the south shore of the lake",32.79139,-116.75167,,415,,cch2,urn:uuid:f33431c2-75fe-4022-a37f-e10d4b42ed11,http://cch2.org/portal/collections/individual/index.php?occid=500201
500202,SD,SD00010598,SD175480,Nemophila menziesii var. integrifolia,205102,4/27/2006,2006,4,27,117,27-Apr-06,FFL,San Diego,"Monte Vista Ranch (owned by The Nature Conservancy): S of Ramona, NW of San Vicente Reservoir; S of San Vicente Road along Chuckwagon Road onto the Ranch; just east of the electric lines in Longs Gulch",32.96528,-116.87167,,337,,cch2,urn:uuid:34da3f76-fc7a-484a-a316-929bd23c6c83,http://cch2.org/portal/collections/individual/index.php?occid=500202
500203,SD,SD00010448,SD176707,Nemophila menziesii var. menziesii,205103,2/24/1997,1997,2,24,55,24-Feb-97,FL,San Diego,"San Felipe Valley, approx 5.0 air miles NW of intersection of State Hwy 78 and County Hwy S-2 within the San Felipe Valley Wildlife Area, California Dept. of Fish & Game. 200 feet E of S-2 at SW corner of property.",33.1403,-116.5297,,831,,cch2,urn:uuid:9697362e-8e69-4a5a-811d-2822d4c3ed5d,http://cch2.org/portal/collections/individual/index.php?occid=500203
500204,SD,SD00010458,SD176708,Nemophila menziesii var. menziesii,205103,5/4/2006,2006,5,4,124,4-May-06,FFL,San Diego,"Between Warner Springs and Ranchita on Vista Irrigation District land. South of S-2 (San Felipe Road), approx. 2½ mi SE of its junction with SR-79.",33.2299,-116.6437,,980,,cch2,urn:uuid:b729cf9b-733b-4e53-910b-7547b223bca3,http://cch2.org/portal/collections/individual/index.php?occid=500204
500205,SD,SD00010595,SD176709,Nemophila menziesii var. integrifolia,205102,1/22/2005,2005,1,22,22,22-Jan-05,FL,San Diego,"Lake Hodges, S of Escondido. SE section of lake, 0.5 mi SE of summit of Bernardo Mtn, 0.5 mi W of I-15. Very near high-water mark (lake recently filled).",33.0571,-117.0807,,105,,cch2,urn:uuid:3453ec54-682f-49da-b79b-9d753b844e4c,http://cch2.org/portal/collections/individual/index.php?occid=500205
500208,SD,SD00010653,SD177738,Nemophila menziesii var. integrifolia,205102,3/25/2007,2007,3,25,84,25-Mar-07,FFL,San Diego,"Cleveland National Forest: Pine Creek Wilderness; north of Barrett Lake, southeast of Alpine; north of the Horsethief Canyon Trailhead on Lyons Valley Road, along a trail in the bottom of Horsethief Canyon; note that this area was partially burned in 2006",32.75472,-116.66222,,635,,cch2,urn:uuid:8ba9f99a-a6ee-4b56-8b40-735008aeb06f,http://cch2.org/portal/collections/individual/index.php?occid=500208
500209,SD,SD00010652,SD178524,Nemophila menziesii var. integrifolia,205102,4/29/2006,2006,4,29,119,29-Apr-06,FL,San Diego,"City of Lakeside. Silverwood Wildlife Sanctuary. 13003 Wildcat Canyon Road. Observation area, ¼ mi ESE of the intersection of Wildcat Canyon Rd and Old Barona Rd.",32.918,-116.8808,,460,,cch2,urn:uuid:ecc9fc95-caf6-4ec2-8386-bc03bbb0121a,http://cch2.org/portal/collections/individual/index.php?occid=500209
500210,SD,SD00010649,SD180232,Nemophila menziesii var. integrifolia,205102,4/29/2006,2006,4,29,119,29-Apr-06,FL,San Diego,"Palomar Mountain (Birch Hill area), Cleveland National Forest, Observation Pointe Development, 400 feet W of Conifer Rd, 1.5 miles N of its junction with S-7 (East Grade Road).",33.3186,-116.8453,,1693,,cch2,urn:uuid:f29b2800-12d4-4ec5-bd61-a79b037049b6,http://cch2.org/portal/collections/individual/index.php?occid=500210
500211,SD,SD00010650,SD180233,Nemophila menziesii var. integrifolia,205102,3/6/2005,2005,3,6,65,6-Mar-05,FL,San Diego,"Poway. A field at the end of Meadowbrook Lane, W of Meadowbrook Middle School, W of Pomerado Rd.",32.964,-117.0705,,211,,cch2,urn:uuid:e06c13f5-c99f-41af-933e-cd68a36eef7c,http://cch2.org/portal/collections/individual/index.php?occid=500211
500212,SD,SD00010651,SD180234,Nemophila menziesii var. integrifolia,205102,2/25/2005,2005,2,25,56,25-Feb-05,FL,San Diego,"Cleveland National Forest (Noble Canyon), Noble Canyon Trail (south of canyon), ca. 2½ mi from Noble Canyon Trailhead, accessed via Pine Valley, on Pine Creek Road.",32.8627,-116.5106,,1162,,cch2,urn:uuid:e780011f-9755-487c-a2cc-193cab66ae1e,http://cch2.org/portal/collections/individual/index.php?occid=500212
500213,SD,SD00010510,SD181486,Nemophila menziesii,205099,4/12/2000,2000,4,12,103,12-Apr-00,FL,Riverside,"San Jacinto Mountains, Baldy Mountain area; Idyllwild [quad].",33.68333,-116.71667,,1616,,cch2,urn:uuid:faacdaf9-a13d-4870-a2f8-9170dfbde99f,http://cch2.org/portal/collections/individual/index.php?occid=500213
500214,SD,SD00010447,SD182242,Nemophila menziesii var. menziesii,205103,4/24/2005,2005,4,24,114,24-Apr-05,FFL,San Diego,Aguanga Mountain; Palomar Mountain Divide Truck Trail; Maple Lode Mine; 2½ mi SW of Holcomb Village,33.3205,-116.7428,,1250,,cch2,urn:uuid:29e3d200-59ed-4f85-a256-1acbd287d2b7,http://cch2.org/portal/collections/individual/index.php?occid=500214
500215,SD,SD00010647,SD185715,Nemophila menziesii var. integrifolia,205102,5/2/2006,2006,5,2,122,2-May-06,FL,San Diego,"Descanso. Just N of I-8, ca. 1 1/3 mi E of its intersection with SR-79.",32.8242,-116.6039,,1098,,cch2,urn:uuid:d856a485-0b52-4579-9d5f-396995e1346b,http://cch2.org/portal/collections/individual/index.php?occid=500215
500216,SD,SD00010645,SD185716,Nemophila menziesii var. integrifolia,205102,3/1/2002,2002,3,1,60,1-Mar-02,FL,San Diego,"San Diego Wild Animal Park, Conservation Area. In the northeast corner of the grounds near 'Condor Release Pens', approx. 1½ mi NW of the intersection of Rockwood Canyon and San Pasqual Valley Rd.",33.1061,-116.9814,,340,,cch2,urn:uuid:ec3b7d01-85f1-481b-a16a-9c1463f9da9a,http://cch2.org/portal/collections/individual/index.php?occid=500216
500217,SD,SD00010648,SD185717,Nemophila menziesii var. integrifolia,205102,5/27/2005,2005,5,27,147,27-May-05,FFL,San Diego,"Volcan Mountains, San Felipe Valley Wildlife Area, approx. ½ mi E of Ferguson Flat. On steep slope far above outlet of Arkansas Cyn. East facing slope, 25-35 degrees.",33.1233,-116.5725,,1210,,cch2,urn:uuid:dd064898-70d6-4e6f-b10c-b222e9af6daf,http://cch2.org/portal/collections/individual/index.php?occid=500217
500218,SD,,SD185718,Nemophila menziesii var. menziesii,205103,4/7/2002,2002,4,7,97,7-Apr-02,FL,San Diego,"W of Ranchita on S22, 0.3 mi E of its junction with S2 on south side of road. This site is a barrow pit area highly disturbed.",33.22,-116.6,,1135,,cch2,urn:uuid:ed2daaa8-24de-4ea4-9730-7abbedfff393,http://cch2.org/portal/collections/individual/index.php?occid=500218
500219,SD,SD00010509,SD186240,Nemophila menziesii,205099,5/21/1995,1995,5,21,141,21-May-95,FL,San Bernardino,"Head of Grapevine Canyon on Grapevine Canyon Road, south of Apple Valley.",34.37667,-117.05833,,1738,,cch2,urn:uuid:45b3683f-2844-49d4-9811-5cb4bc2b36f6,http://cch2.org/portal/collections/individual/index.php?occid=500219
500220,SD,SD00010646,SD186943,Nemophila menziesii var. integrifolia,205102,4/21/2008,2008,4,21,112,21-Apr-08,FFL,San Diego,"Hauser Wilderness: Cleveland National Forest; W of Morena Reservoir, at Bronco Flats just S of Skye Valley Road",32.69457,-116.56417,,995,,cch2,urn:uuid:30e75633-0d21-427d-a53b-352f4dffc39a,http://cch2.org/portal/collections/individual/index.php?occid=500220
500221,SD,SD00010644,SD189728,Nemophila menziesii var. integrifolia,205102,4/28/2007,2007,4,28,118,28-Apr-07,FFL,San Diego,"Cleveland National Forest, west of Cuyamaca Mtns, about 5 miles south of intersection of Hwy 78 and Hwy 79, .25 mile north of Eagle Peak Road near road to Deadman Flat",33.0274,-116.6713,,1040,,cch2,urn:uuid:02a0773e-8a57-48a6-ae5b-542c2c973b6e,http://cch2.org/portal/collections/individual/index.php?occid=500221
500222,SD,SD00010643,SD191233,Nemophila menziesii var. integrifolia,205102,4/7/2007,2007,4,7,97,7-Apr-07,FL,San Diego,"Cleveland National Forest, Cuyamaca Mountains, 9 mi W of Middle Peak, SE of Sunshine Mountain, Kelly Creek area, W of Boulder Creek Road",32.9913,-116.6662,,884,,cch2,urn:uuid:ab9e6f0b-c160-46e6-90b4-56bca650f2ac,http://cch2.org/portal/collections/individual/index.php?occid=500222
500223,SD,SD00010642,SD193844,Nemophila menziesii var. integrifolia,205102,5/11/2007,2007,5,11,131,11-May-07,FL,San Diego,"Ramona, ca 3.5 mi NW of, NE of San Pasqual Valley Road, on Lower Isabel Creek Rd.",33.08972,-116.89472,,239,,cch2,urn:uuid:2e37c601-6111-48ad-8458-6062476abd7d,http://cch2.org/portal/collections/individual/index.php?occid=500223
500224,SD,SD00010641,SD193845,Nemophila menziesii var. integrifolia,205102,3/18/2007,2007,3,18,77,18-Mar-07,FL,San Diego,"City of Escondido, 750 Feet South of Rockwood and Old Ranch Road intersection, 800 feet east of Rancho San Pasqual Union school, north-west facing, 5% slope",33.10972,-117.00722,,478,,cch2,urn:uuid:3410eb49-7672-4ddd-9660-c75f28a27828,http://cch2.org/portal/collections/individual/index.php?occid=500224
500225,SD,SD00010640,SD193846,Nemophila menziesii var. integrifolia,205102,5/13/2007,2007,5,13,133,13-May-07,FL,San Diego,"Cleveland National Forest, Cuyamaca Mountains, 1 mi W of North Peak, S of Cosmit Indian Reservation, E of Engineers Road, near Grandview Road",33.016,-116.612,,1372,,cch2,urn:uuid:24ce6db4-0a31-476d-8bbb-ac898c96cd2e,http://cch2.org/portal/collections/individual/index.php?occid=500225
500226,SD,SD00010639,SD193847,Nemophila menziesii var. integrifolia,205102,3/20/2007,2007,3,20,79,20-Mar-07,FL,San Diego,"Bratton Valley, land surrounding 18569 Deerhorn Valley Rd, 3 mi N of Dulzura, 2.5 mi SE of Lyons Peak summit, ½ mi. SE of inters of Honey Springs Rd & Deerhorn Valley Rd.",32.67444,-116.74806,,656,,cch2,urn:uuid:1dcdf740-136b-4294-87cc-c121c79d0edd,http://cch2.org/portal/collections/individual/index.php?occid=500226
500227,SD,SD00010446,SD193848,Nemophila menziesii var. menziesii,205103,3/15/2005,2005,3,15,74,15-Mar-05,FL,San Diego,"Ranchita, 1 mi S of junction of Montezuma Valley Rd (S22) and Wilson Rd, 7 mi NW of junction of HWY 78 and San Felipe Rd (S2)",33.19458,-116.50812,,1223,,cch2,urn:uuid:37356132-c027-4e0f-8f7a-65898ce63832,http://cch2.org/portal/collections/individual/index.php?occid=500227
500228,SD,SD00010627,SD194157,Nemophila menziesii var. integrifolia,205102,5/24/2002,2002,5,24,144,24-May-02,n/a,San Diego,"Saddle, just northeast of Cuyamaca Peak.",32.95028,-116.60639,402,1868,,cch2,urn:uuid:0b53d2f8-2335-4eca-a64d-9104705a54fd,http://cch2.org/portal/collections/individual/index.php?occid=500228
500232,SD,SD00010638,SD195188,Nemophila menziesii var. integrifolia,205102,3/1/2007,2007,3,1,60,1-Mar-07,FL,San Diego,"Cleveland National Forest, in Morena Village, W of Lake Morena Drive, E of Lupine Drive, S of Cleveland Forest Drive.",32.67636,-116.51032,,963,,cch2,urn:uuid:cee7bf18-7312-4683-a622-7c7c00642934,http://cch2.org/portal/collections/individual/index.php?occid=500232
500233,SD,SD00010626,SD195189,Nemophila menziesii var. integrifolia,205102,4/2/2007,2007,4,2,92,2-Apr-07,FL,San Diego,"Lake Poway, Poway; entered at intersection of Espola Rd and Lake Poway Roads; collection points on the Lake Poway loop trail.",33.01095,-117.01225,,289,,cch2,urn:uuid:24ce1b68-ed7c-4d1d-8ec1-e55d273fbc4e,http://cch2.org/portal/collections/individual/index.php?occid=500233
500234,SD,SD00010456,SD195190,Nemophila menziesii var. menziesii,205103,4/22/2007,2007,4,22,112,22-Apr-07,FFL,San Diego,"Warner Springs, Cleveland National Forest, Lost Valley Road 3.8 mi N of Warner Springs (Hwy 79), 3 mi S of Chihuahua Valley Road",33.34201,-116.64702,,1168,,cch2,urn:uuid:232e5350-4ac0-442e-98cf-31c4833dc168,http://cch2.org/portal/collections/individual/index.php?occid=500234
500235,SD,SD00010637,SD197367,Nemophila menziesii var. integrifolia,205102,6/2/2009,2009,6,2,153,2-Jun-09,FFL,San Diego,Palomar Mountains: Cleveland National Forest; northeast of Upper Doane Valley; northwest of Fry Creek Campground,33.3472,-116.89388,,1600,,cch2,urn:uuid:06aac44c-1b24-4c24-8a8a-ad0144f4b4d1,http://cch2.org/portal/collections/individual/index.php?occid=500235
500237,SD,SD00010508,SD197798,Nemophila menziesii,205099,3/24/2008,2008,3,24,84,24-Mar-08,FL,San Bernardino,"San Bernardino Mountains: Wye Peak at Cajon Junction, northeast of 215/Highway 138 intersection.",34.31417,-117.43861,,1107,,cch2,urn:uuid:38b6711e-8064-4745-a973-8890942d7874,http://cch2.org/portal/collections/individual/index.php?occid=500237
500239,SD,SD00010636,SD198509,Nemophila menziesii var. integrifolia,205102,3/11/2008,2008,3,11,71,11-Mar-08,FL,San Diego,City of Solana Beach. San Elijo Ecological Reserve. South East section. Santa Helena entrance. 180 meters west of trail intersection north of Santa Helena entrance. 840 meters west of west end of El Camino Real,33.0093,-117.249,,2,,cch2,urn:uuid:b19f5bb4-c6a8-492c-88b9-d240bad63733,http://cch2.org/portal/collections/individual/index.php?occid=500239
500240,SD,,SD199224,Nemophila menziesii var. integrifolia,205102,5/8/2007,2007,5,8,128,8-May-07,FL,San Diego,"Anza-Borrego Desert State Park. West of Lake Cuyamaca,1 mile SW of intersection of State hwy. 79 and County hwy. S-1, and 1.0 air mile SE of North Peak summit. Near old ranch road on the west side of hwy. 79.",32.99873,-116.5696,,1409,,cch2,urn:uuid:5dd79bc6-de09-4ebf-87ee-60e63b696c16,http://cch2.org/portal/collections/individual/index.php?occid=500240
500241,SD,SD00010455,SD199225,Nemophila menziesii var. menziesii,205103,4/15/2007,2007,4,15,105,15-Apr-07,FL,San Diego,"Banner, 3 mi E of Julian, 0.2 mi. east of Banner Recreation Ranch, drainage south of State hwy. 78 south of remnant historic bridge and road.",33.06759,-116.54417,,845,,cch2,urn:uuid:cad390bf-1dd3-4a8b-bef0-70c0b7e978a1,http://cch2.org/portal/collections/individual/index.php?occid=500241
500242,SD,SD00010634,SD201763,Nemophila menziesii var. integrifolia,205102,3/14/2008,2008,3,14,74,14-Mar-08,FL,San Diego,"Border Field State Park, bottom of east facing slope, south towards the border fence, about 1.3 mi east of Pacific Ocean and .15 miles northeast of Border Monument #257",32.5375,-117.10194,,27,,cch2,urn:uuid:5dc907dd-dd3c-4de5-b07a-e0d3a7c09b34,http://cch2.org/portal/collections/individual/index.php?occid=500242
500243,SD,SD00010635,SD201764,Nemophila menziesii var. integrifolia,205102,3/23/2008,2008,3,23,83,23-Mar-08,FL,San Diego,"Cleveland National Forest, Lake Morena area, .9 mi NNW of Morena Village and about 1 mi WNW of intersection of Highway S-1 and Oak Dr.",32.69463,-116.50762,,942,,cch2,urn:uuid:92301088-5595-4b48-a4c4-c5db700d2594,http://cch2.org/portal/collections/individual/index.php?occid=500243
500244,SD,SD00010633,SD203508,Nemophila menziesii var. integrifolia,205102,3/8/2008,2008,3,8,68,8-Mar-08,FL,San Diego,"Poway, behind Pomerado Hospital on Pomerado Rd.",32.99836,-117.04968,,336,,cch2,urn:uuid:592f86ba-ddca-4f27-b95c-b3755c61cc5a,http://cch2.org/portal/collections/individual/index.php?occid=500244
500245,SD,SD00010454,SD204389,Nemophila menziesii var. menziesii,205103,5/3/2009,2009,5,3,123,3-May-09,FL,San Diego,"SW of Oak Grove, Rattlesnake Canyon, Cleveland National Forest, at bottom of canyon",33.36972,-116.78611,,961,,cch2,urn:uuid:500b028d-e622-4fe2-b588-e6a359451c5a,http://cch2.org/portal/collections/individual/index.php?occid=500245
500246,SD,SD00010632,SD204390,Nemophila menziesii var. integrifolia,205102,3/18/2008,2008,3,18,78,18-Mar-08,FFL,San Diego,Northeast of Fallbrook. On the south side of the Santa Margarita River at the Willow Glen and North Stagecoach trailhead. Which is about 1.6 miles northwest (by air) of Red Mountain Lookout,33.41306,-117.21389,,139,,cch2,urn:uuid:862ca081-8a87-4bd6-bc13-c01f7663ce31,http://cch2.org/portal/collections/individual/index.php?occid=500246
500247,SD,SD00010630,SD205872,Nemophila menziesii var. integrifolia,205102,4/12/2008,2008,4,12,103,12-Apr-08,FL,San Diego,"Cleveland National Forest, W of Cuyamaca Mtns, about 1.25 mile west of intersection of Boulder Creek Road and Cedar Creek Road",32.987,-116.7093,,750,,cch2,urn:uuid:73c5fbe1-cab3-4553-9c67-ad4020074887,http://cch2.org/portal/collections/individual/index.php?occid=500247
500248,SD,SD00010631,SD205873,Nemophila menziesii var. integrifolia,205102,4/4/2008,2008,4,4,95,4-Apr-08,FL,San Diego,"Cleveland National Forest, W of Cuyamaca Mtns, about 0.5 miles east of Deadman Flat, about .25 miles north of Eagle Peak Road, about 2.75 milesby road SW of intersection with Boulder Creek Road",33.0344,-116.6609,,1240,,cch2,urn:uuid:d92e7833-8d49-41f5-a457-cb2f1c3184d1,http://cch2.org/portal/collections/individual/index.php?occid=500248
500249,SD,SD00010628,SD206766,Nemophila menziesii var. integrifolia,205102,7/8/2010,2010,7,8,189,8-Jul-10,FFL,San Diego,Cleveland National Forest: Cutca Valley on the lower northern slope of Palomar Mountain; along Cutca Valley Truck Trail,33.39034,-116.91667,,1060,,cch2,urn:uuid:6504bca8-e4e4-4a7a-97e6-7d933816b929,http://cch2.org/portal/collections/individual/index.php?occid=500249
500250,SD,SD00010629,SD206767,Nemophila menziesii var. integrifolia,205102,4/7/2010,2010,4,7,97,7-Apr-10,FFL,San Diego,"Cleveland National Forest: Northeast of El Cajon Mountain, west of the San Diego River and south of Barona Mesa; just west of El Cajon Mountain Truck Trail",32.95557,-116.79091,,670,,cch2,urn:uuid:26e1f268-bbdf-4f12-8169-e11bb19d2980,http://cch2.org/portal/collections/individual/index.php?occid=500250
500251,SD,SD00010453,SD210265,Nemophila menziesii var. menziesii,205103,5/26/2010,2010,5,26,146,26-May-10,FFL,San Diego,Eagles Nest: Fletcher Family Ranch; E of Warner Springs on the SW side of Hot Springs Mountain; at the end on Eagles Nest Road; along dirt road loop ENE of lake,33.28965,-116.58698,,1435,,cch2,urn:uuid:f8323d5d-6b0f-468f-a791-56715d2b72b4,http://cch2.org/portal/collections/individual/index.php?occid=500251
500252,SD,SD00010590,SD211031,Nemophila menziesii var. integrifolia,205102,4/4/2007,2007,4,4,94,4-Apr-07,FL,San Diego,"Cleveland National Forest, Laguna Mountains, 1 mi SW of junction of Sunrise Hwy (S1) and Filaree Flat Rd S, N of Noble Canyon Creek",32.90152,-116.47683,,1577,,cch2,urn:uuid:6f0f89ed-20ee-4687-8db6-3cbf9ae8581d,http://cch2.org/portal/collections/individual/index.php?occid=500252
500255,SD,SD00010623,SD215071,Nemophila menziesii var. integrifolia,205102,3/7/2008,2008,3,7,67,7-Mar-08,FL,San Diego,"Blue Sky Ecological Reserve, Poway. Ca. 0.25 mi SW of the Lake Ramona Dam and 1.5 mi NE of the intersection of Lake Poway Rd and Espola Rd.",33.02106,-117.0006,,339,,cch2,urn:uuid:0bd70305-88f6-481b-813f-803f12a37391,http://cch2.org/portal/collections/individual/index.php?occid=500255
500256,SD,SD00010588,SD215072,Nemophila menziesii var. integrifolia,205102,6/7/2008,2008,6,7,159,7-Jun-08,FL,San Diego,"Warner Springs, northbound Pacific Crest Trail, 6 miles from Lost Valley Rd. trailhead, 200 yards east of trail, along west bank of dry tributary to Agua Caliente Creek",33.35487,-116.60481,,1473,,cch2,urn:uuid:b3838afc-eafe-4dac-94ba-b9226ac4eec4,http://cch2.org/portal/collections/individual/index.php?occid=500256
500257,SD,SD00010589,SD215073,Nemophila menziesii var. integrifolia,205102,3/19/2008,2008,3,19,79,19-Mar-08,FL,San Diego,"East end of Los Penasquitos Canyon Preserve, 1 mi east of intersection I-15 and Poway Rd, S side of Los Penasquitos Canyon Creek",32.9416,-117.0873,,123,,cch2,urn:uuid:a331f81e-021c-4428-8d46-6e6804a0f7e9,http://cch2.org/portal/collections/individual/index.php?occid=500257
500258,SD,SD00010587,SD215561,Nemophila menziesii var. integrifolia,205102,4/8/1997,1997,4,8,98,8-Apr-97,FL,San Diego,Wilderness Gardens Preserve; ca. 3.4 miles east of Pala south of Highway 76 along the San Luis Rey River.,33.35028,-117.03278,241,162,,cch2,urn:uuid:ef10405b-1cbd-49e7-8e2f-8e7e7c1f84e3,http://cch2.org/portal/collections/individual/index.php?occid=500258
500259,SD,SD00010663,SD215562,Nemophila menziesii var. integrifolia,205102,5/15/1967,1967,5,15,135,15-May-67,FL,Los Angeles,"San Gabriel Mountains, east side Elsmere Canyon near mouth.",,,,457,,cch2,urn:uuid:13b10995-7e01-4556-9514-62e683e620b4,http://cch2.org/portal/collections/individual/index.php?occid=500259
500260,SD,SD00010482,SD215563,Nemophila menziesii var. menziesii,205103,3/21/1997,1997,3,21,80,21-Mar-97,FL,Los Angeles,"Portal Ridge, upper Broad Canyon, ca. 1.0 mile east of VABM King and 1.2 mile east of the junction of Forest Service Roads 7N07 and 7N07A, along the ridgeline diving Bleich Canyon and Broad Canyon.",34.70639,-118.48083,,1195,,cch2,urn:uuid:e8e003bd-6309-44b7-badf-e4d536c05534,http://cch2.org/portal/collections/individual/index.php?occid=500260
500261,SD,SD00010622,SD216138,Nemophila menziesii var. integrifolia,205102,4/4/2009,2009,4,4,94,4-Apr-09,FL,San Diego,"Cleveland National Forest, Temescal Valley, ¾ mi N of Esmeralda Mine, 3¾ mi SW of Lake Henshaw Dam, along Lusardi Canyon Truck Trail 1/4 mile S of the divide and bench mark 3041",33.22695,-116.82572,,849,,cch2,urn:uuid:9d82682a-9398-41b9-ac99-8403bfad94db,http://cch2.org/portal/collections/individual/index.php?occid=500261
500262,SD,SD00010621,SD216139,Nemophila menziesii var. integrifolia,205102,4/26/2009,2009,4,26,116,26-Apr-09,FL,San Diego,North of Julian. Volcan Mountain Open Space Preserve. 583 meters north east of intersection of Farmer and Wynola Road.,33.1071,-116.5978,,1350,,cch2,urn:uuid:4e629a77-a93e-45be-b003-3564045193d2,http://cch2.org/portal/collections/individual/index.php?occid=500262
500263,SD,SD00010620,SD216140,Nemophila menziesii var. integrifolia,205102,5/8/2009,2009,5,8,128,8-May-09,FFL,San Diego,"Sunrise Highway, Laguna Mountains, Crouch Valley, north side. 5.49km north east of junction of Sunrise Highway and I-8",32.8536,-116.4803,,1554,,cch2,urn:uuid:b8ccbcef-bbc0-46fa-9799-988b94b6e288,http://cch2.org/portal/collections/individual/index.php?occid=500263
500264,SD,SD00010452,SD216141,Nemophila menziesii var. menziesii,205103,4/6/2008,2008,4,6,97,6-Apr-08,FL,San Diego,"South of Oak Grove. 25249 Oak Grove Truck Trail, ca. 1 mile S of its intersection with Highway 79, east facing slope west of road.",33.3736,-116.784,,915,,cch2,urn:uuid:c5ac512d-bd6e-4257-82cb-3637e2aa1cc5,http://cch2.org/portal/collections/individual/index.php?occid=500264
500265,SD,SD00010450,SD216142,Nemophila menziesii var. menziesii,205103,3/25/2008,2008,3,25,85,25-Mar-08,FL,San Diego,"San Diego, Crest Canyon, ½ mile W of Interstate 5, 225 yds S of Race Track View Drive, northern section off main trail",32.96111,-117.25556,,33,,cch2,urn:uuid:c48f10db-057d-4852-abbc-24cf788e6e34,http://cch2.org/portal/collections/individual/index.php?occid=500265
500266,SD,SD00010451,SD216143,Nemophila menziesii var. menziesii,205103,4/22/2009,2009,4,22,112,22-Apr-09,FL,San Diego,"Warner Springs Ranch, about ½ mi NE of Warner Springs, northeast of horse barn on hiking trail going northeast uphill.",33.2878,-116.6319,,969,,cch2,urn:uuid:83057b55-5079-44ea-bf97-a4612fba2a37,http://cch2.org/portal/collections/individual/index.php?occid=500266
500267,SD,SD00010625,SD217797,Nemophila menziesii var. integrifolia,205102,5/6/2010,2010,5,6,126,6-May-10,FL,San Diego,"Cleveland National Forest, Buckman Springs area; along Pacific Crest Trail, E of Interstate 8, about 1 mi NNW of junction with Kitchen Creek Road",32.7324,-116.4779,,975,,cch2,urn:uuid:608ab69f-0679-4fd7-80c2-ecf545588e8e,http://cch2.org/portal/collections/individual/index.php?occid=500267
500268,SD,SD00010624,SD218736,Nemophila menziesii var. integrifolia,205102,4/29/2009,2009,4,29,119,29-Apr-09,FL,San Diego,"Mesa Grande, Nature Conservancy (Wheatly Property), 2 miles W of Morettis Junction (Pala Road & Hwy 79) E of Mesa Grande Road, 2.5 miles S of dam at Lake Henshaw",33.19901,-116.75103,,1079,,cch2,urn:uuid:e494f245-8827-40cc-90f5-4ac40259ae0e,http://cch2.org/portal/collections/individual/index.php?occid=500268
500269,SD,SD00010586,SD219518,Nemophila menziesii var. integrifolia,205102,2/17/2012,2012,2,17,48,17-Feb-12,FFL,San Diego,Border Field State Park: west of San Ysidro border crossing; south of Monument Road; just north of the USA/Mexico border fence; east-facing lower slope of Bunker Hill,32.5365,-117.10306,,85,,cch2,urn:uuid:b525ded2-6908-4499-8804-d3134c7970c2,http://cch2.org/portal/collections/individual/index.php?occid=500269
500270,SD,SD00010449,SD219886,Nemophila menziesii var. menziesii,205103,4/1/2010,2010,4,1,91,1-Apr-10,FFL,San Diego,"San Felipe Valley Wildlife Area, California Fish & Game property. SW of San Felipe Valley, 1.6 miles ENE of Banner and 3.0 miles WSW of intersection of County Road S-2 and State hwy. 78. S-side of 78.",33.08049,-116.52357,,770,,cch2,urn:uuid:fbc89b8c-b067-4299-a6e9-6e65af83cc84,http://cch2.org/portal/collections/individual/index.php?occid=500270
500271,SD,SD00010443,SD219887,Nemophila menziesii var. menziesii,205103,5/1/2010,2010,5,1,121,1-May-10,FFL,San Diego,"Valle de San Jose, NW-side of San Felipe Hills. Pacific Crest Trail trailhead S-side of County Road S-22 (Montezuma Valley Road)1.1 miles ESE of intersection of S-22 and S-2 near Barrel Spring.",33.2163,-116.58797,,1053,,cch2,urn:uuid:6f2fdc28-b145-4d99-a004-33248b0bb370,http://cch2.org/portal/collections/individual/index.php?occid=500271
500272,SD,SD00010662,SD220069,Nemophila menziesii var. integrifolia,205102,4/1/2006,2006,4,1,91,1-Apr-06,FL,San Bernardino,"Little San Bernardino Mountains; Pipes Canyon Preserve; Sorrel Horse Canyon, south of Pioneertown Road along wash and ridge to the south.",34.16111,-116.51083,,1220,,cch2,urn:uuid:a54f4bf1-f0aa-4066-a7de-a2d85b69b8fb,http://cch2.org/portal/collections/individual/index.php?occid=500272
500273,SD,SD00010444,SD220388,Nemophila menziesii var. menziesii,205103,5/1/2010,2010,5,1,121,1-May-10,FL,San Diego,"Aguanga Mountain, Cleveland National Forest, along Palomar Mountain Divide Truck Trail, near 5.5 air miles WNW of junction with Highway 79.",33.34685,-116.79642,,1629,,cch2,urn:uuid:2b3ef536-c2a6-4c40-922c-8be3ba0d0e7f,http://cch2.org/portal/collections/individual/index.php?occid=500273
500274,SD,SD00010585,SD221134,Nemophila menziesii var. integrifolia,205102,5/31/2010,2010,5,31,151,31-May-10,FL,San Diego,Cleveland National Forest; Puerta La Cruz Road; 2 miles SE Mitchell Camp Road and Chihuahua Valley Road; 5.7 miles N of Warner Springs and Hwy 79,33.36112,-116.67281,,1168,,cch2,urn:uuid:06662787-8a28-4f03-a142-b0878f3ef9da,http://cch2.org/portal/collections/individual/index.php?occid=500274
500275,SD,SD00010584,SD221135,Nemophila menziesii var. integrifolia,205102,5/8/2010,2010,5,8,128,8-May-10,FL,San Diego,Cleveland National Forest; Puerta La Cruz Road; 1.75 miles SE Mitchell Camp Road and Chihuahua Valley Road; 6 miles N of Warner Springs and Hwy 79,33.36474,-116.67411,,1182,,cch2,urn:uuid:62367fa6-e75e-4f7a-9236-fb02f0382874,http://cch2.org/portal/collections/individual/index.php?occid=500275
500276,SD,SD00010583,SD221136,Nemophila menziesii var. integrifolia,205102,6/18/2009,2009,6,18,169,18-Jun-09,FL,San Diego,"Palomar Mountain State Park, Fry Creek campground, 2.7 mi. north of the summit of the south Palomar grade, E of Canfield Road",33.3447,-116.868,,1528,,cch2,urn:uuid:c4351f2c-f215-4e4c-91e9-c725c8c9dbb4,http://cch2.org/portal/collections/individual/index.php?occid=500276
500277,SD,SD00010441,SD221137,Nemophila menziesii var. menziesii,205103,5/8/2010,2010,5,8,128,8-May-10,FL,San Diego,Cleveland National Forest; Puerta La Cruz Road; about 1 mile SE Mitchell Camp Road and Chihuahua Valley Road; south-east of the junction with Puerta La Cruz Trail.,33.3711,-116.68994,,1326,,cch2,urn:uuid:6c887273-6abc-461d-9c34-d0b5929c0967,http://cch2.org/portal/collections/individual/index.php?occid=500277
500278,SD,SD00010440,SD221138,Nemophila menziesii var. menziesii,205103,6/1/2010,2010,6,1,152,1-Jun-10,FL,San Diego,"Chihuahua Valley, Adobe Springs, creekside, ca 1 mile NW of intersection Chihuahua Valley Road and Old Mitchell Camp Road, now under BLM management and slated to be part of the Beauty Mountain Wilderness Area.",33.39556,-116.70111,,1225,,cch2,urn:uuid:eac53c7d-28d7-462d-90d2-b16957905347,http://cch2.org/portal/collections/individual/index.php?occid=500278
500279,SD,SD00010439,SD221139,Nemophila menziesii var. menziesii,205103,5/20/2010,2010,5,20,140,20-May-10,FL,San Diego,Northern San Diego County; along Old Mitchell Camp Road 0.17 mile N of junction with Chihuahua Valley Road,33.38696,-116.68639,,1269,,cch2,urn:uuid:3cd02ad7-f606-4c8a-9936-80f494dac820,http://cch2.org/portal/collections/individual/index.php?occid=500279
500280,SD,SD00010438,SD221140,Nemophila menziesii var. menziesii,205103,4/14/2010,2010,4,14,104,14-Apr-10,FL,San Diego,"Cleveland National Forest; along Chihuahua Valley Road, 1.5 miles SW of junction with Mitchell Camp Road at large pullout area northwest of U-curve in the road.",33.37634,-116.71033,,1216,,cch2,urn:uuid:bde4b802-e0db-48c9-8f22-24505c599569,http://cch2.org/portal/collections/individual/index.php?occid=500280
500281,SD,SD00010437,SD221141,Nemophila menziesii var. menziesii,205103,4/14/2010,2010,4,14,104,14-Apr-10,FL,San Diego,"Cleveland National Forest; Puerta La Cruz Road; 1.4 miles SE Mitchell Camp Road and Chihuahua Valley Road at small, dry riverbed that crosses the road.",33.36631,-116.67929,,1206,,cch2,urn:uuid:f6f4cfd0-c209-42ad-851c-2d0f051c3868,http://cch2.org/portal/collections/individual/index.php?occid=500281
500282,SD,SD00010582,SD221658,Nemophila menziesii var. integrifolia,205102,4/24/2012,2012,4,24,115,24-Apr-12,FFL,San Diego,Mountain Warfare Training Camp Michael Monsoor: La Posta area; east of Morena Reservoir and west of La Posta Road; along a dirt road,32.66724,-116.4419,,970,,cch2,urn:uuid:c36d0a4f-1d4b-40c1-8d41-d8f324aa7255,http://cch2.org/portal/collections/individual/index.php?occid=500282
500284,SD,SD00010445,SD226501,Nemophila menziesii var. menziesii,205103,5/8/2011,2011,5,8,128,8-May-11,FL,San Diego,"Chihuahua Valley Road, 1.1 mile E of intersection with Highway 79.",33.37167,-116.72833,,1048,,cch2,urn:uuid:b92e204d-0dda-4898-a93d-e05ebbc01e53,http://cch2.org/portal/collections/individual/index.php?occid=500284
500285,SD,SD00010591,SD227321,Nemophila menziesii var. integrifolia,205102,3/30/2009,2009,3,30,89,30-Mar-09,FL,San Diego,"Mission Trails Regional Park, .5 mi. southwest of trailhead at Big Rock Park on Mesa Road in Santee, about 1.0 mi W of Hwy 52.",32.8237,-117.0219,,162,,cch2,urn:uuid:1b38501d-5e72-4b41-912d-f70c7c5ed136,http://cch2.org/portal/collections/individual/index.php?occid=500285
500286,SD,SD00010592,SD227322,Nemophila menziesii var. integrifolia,205102,4/11/2008,2008,4,11,102,11-Apr-08,FL,San Diego,"Border Field State Park, at the eastern base of Bunker Hill, south of city of Imperial Beach. South Mesa, flat area just north of US/Mexico Border fence, 1 mi E of Pacific Ocean and about .1 mi NW of Border Monument 257",32.53722,-117.105,,70,,cch2,urn:uuid:4b9bd4b8-edfd-42a4-83a7-493e335ab7ff,http://cch2.org/portal/collections/individual/index.php?occid=500286
500287,SD,SD00010544,SD230568,Nemophila menziesii var. integrifolia,205102,3/26/2013,2013,3,26,85,26-Mar-13,FFL,San Diego,Lake Hodges: south of Escondido; southeast of the intersection of Lake Drive and Beech Lane; along the north side of Lake southeast of the boat ramp; on a northeast-facing slope,33.06329,-117.1004,,130,,cch2,urn:uuid:bb67c609-2476-4958-807f-5a50d253763b,http://cch2.org/portal/collections/individual/index.php?occid=500287
500295,SD,SD00010529,SD238322,Nemophila menziesii var. integrifolia,205102,4/8/2014,2014,4,8,98,8-Apr-14,FFL,San Diego,"Camp Pendleton: northeast portion of Base; Training Area Echo, along a dirt road at the base of the highest ridge of the Santa Margarita Mountains, just northeast of Case Springs Road, west of Margarita Peak & southeast of Case Springs Lake",33.44083,-117.40063,,725,,cch2,urn:uuid:c9f6a506-b180-49a9-9041-11ef2e61866e,http://cch2.org/portal/collections/individual/index.php?occid=500295
500298,SD,SD00010481,SD239783,Nemophila menziesii var. menziesii,205103,4/4/2009,2009,4,4,94,4-Apr-09,FFL,El Dorado,"Northern Sierra Nevada Mountains Foothills: Happy Valley Road, 0.8 mile west of its junction with Happy Valley Cut-off (Camino 7.5')",38.65556,-120.67528,,607,,cch2,urn:uuid:e49302ed-7bdc-4fa4-bcf5-912dc324df71,http://cch2.org/portal/collections/individual/index.php?occid=500298
500301,SD,SD00010480,SD241047,Nemophila menziesii var. menziesii,205103,3/22/2012,2012,3,22,82,22-Mar-12,FL,Amador,"Northern Sierra Nevada Mountains Foothills: Bell Road, 0.2 mile east of its junction with CA-49 (Fiddletown 7.5'Q)",38.54139,-120.84472,,270,,cch2,urn:uuid:e98cb82a-23af-42e5-a05a-48327dd9f903,http://cch2.org/portal/collections/individual/index.php?occid=500301
500306,SD,SD00010478,SD241836,Nemophila menziesii,205099,3/25/2008,2008,3,25,85,25-Mar-08,FL,San Luis Obispo,North of Carrizo Plain National Monument. Along Soda Lake Road between College and Belmont Streets.,35.30722,-119.98611,,591,,cch2,urn:uuid:fb28b4ce-9762-4e85-a25a-dabcaa526d59,http://cch2.org/portal/collections/individual/index.php?occid=500306
500308,SD,SD00010477,SD244167,Nemophila menziesii,205099,4/2/2013,2013,4,2,92,4/2/2013,FL,Riverside,"Peninsular Range: Temescal Canyon between Horsetheif Canyon Road and Hostettler Road, near I-15 Fwy, SE of Corona (Lee) Lake (Albrehill 7.5'Q)",33.73696,-117.42017,,377,,cch2,urn:uuid:359ddcd7-db6b-462e-846d-e3197ef63350,http://cch2.org/portal/collections/individual/index.php?occid=500308
500312,SD,SD00010579,SD244987,Nemophila menziesii var. integrifolia,205102,2/24/2015,2015,2,24,55,24-Feb-15,FL,San Diego,Camp Pendleton: east-central portion of Base; India Training Area; north of Lake O'Neill; east of the Santa Margarita River; on a rocky slope just east of De Luz Road along the Fallbrook Weapons Station border,33.36227,-117.31402,,105,,cch2,urn:uuid:744f21a7-a248-4953-9cc9-f1b4ffd1539a,http://cch2.org/portal/collections/individual/index.php?occid=500312
500313,SD,SD00010475,SD247444,Nemophila menziesii,205099,3/19/2013,2013,3,19,78,19-Mar-13,FFL,Riverside,"Perris-Aguanga Basin: Menifee Valley, Los Alamos Road at its crossing of Warm Springs Creek, and hill west of Jeanette Drive (Murrieta 7.5'Q)",33.59833,-117.14194,,390,,cch2,urn:uuid:40e9ffa5-6b11-43bc-8898-0a9cc0844773,http://cch2.org/portal/collections/individual/index.php?occid=500313
500314,SD,SD00010476,SD247659,Nemophila menziesii var. menziesii,205103,4/4/2014,2014,4,4,94,4-Apr-14,FL,Los Angeles,"Western Mojave Desert, approx 3.3 km northeast of Valyermo along Bob's Gap Road approx. 1.6 km southeast of the aqueduct.",34.46542,-117.82326,,1126,,cch2,urn:uuid:31a3812f-a5de-4d97-81b2-e686ae1c498c,http://cch2.org/portal/collections/individual/index.php?occid=500314
500316,SD,SD00010661,SD248759,Nemophila menziesii var. integrifolia,205102,3/30/2013,2013,3,30,89,30-Mar-13,FL,San Bernardino,"HAD83; Granite Mountains; Mohave National Preserve, 0.8 mile north of Gate into UC reserve campground near mouth of Cottoonwood Basin.",34.83282,-115.64653,,1160,,cch2,urn:uuid:fa9cde7b-b485-4745-8e07-bbc5a547433c,http://cch2.org/portal/collections/individual/index.php?occid=500316
500319,SD,SD00010436,SD251033,Nemophila menziesii var. menziesii,205103,5/9/2011,2011,5,9,129,9-May-11,FL,San Diego,Chihuahua Valley; along Old Mitchell Camp Road; 0.70 mile N of Chihuahua Valley Road,33.39447,-116.68579,,1275,,cch2,urn:uuid:770544e9-02b7-4dff-9f48-27c7081caf0f,http://cch2.org/portal/collections/individual/index.php?occid=500319
500323,SD,SD00010474,SD254634,Nemophila menziesii var. menziesii,205103,3/26/2013,2013,3,26,85,26-Mar-13,FL,Amador,"Northern Sierra Nevada Foothills: Along CA-49, 1.5 miles south of its junction with Sand Ridge Road, between Plymouth and El Dorado (Fiddletown 7.5'Q)",38.56861,-120.84611,,262,,cch2,urn:uuid:5c1525eb-89c0-4e79-8bf3-a976594c1f9f,http://cch2.org/portal/collections/individual/index.php?occid=500323
500325,SD,SD00010619,SD256195,Nemophila menziesii var. integrifolia,205102,4/24/2010,2010,4,24,114,24-Apr-10,FFL,San Diego,Rancho San Diego; US Fish & Wildlife Refuge; N side of San Miguel Mountain; W of Millar Ranch Road; 0.37 miles SSW of junction with Highway 94 (Campo Road),32.72604,-116.94038,,125,,cch2,urn:uuid:9f695ae7-e738-47e0-b816-1cf495cad806,http://cch2.org/portal/collections/individual/index.php?occid=500325
500327,SD,SD00010515,SD257290,Nemophila menziesii var. integrifolia,205102,5/28/2015,2015,5,28,148,28-May-15,FFL,San Diego,Cleveland National Forest. Mount Laguna.,32.85686,-116.42813,,1831,,cch2,urn:uuid:360cac9c-6721-49f3-be12-19e51ff71532,http://cch2.org/portal/collections/individual/index.php?occid=500327
500328,SD,SD00010528,SD259281,Nemophila menziesii var. integrifolia,205102,3/31/1990,1990,3,31,90,31-Mar-90,FFL,San Diego,"San Elijo Lagoon Ecological Reserve; South of trail near junction with N. Rios Ave, Solana Beach. West of I-5, east of Hwy 101. South side of Reserve.",33.00366,-117.27198,,15,,cch2,urn:uuid:226952c7-acbf-41c9-abcd-b7db0659b872,http://cch2.org/portal/collections/individual/index.php?occid=500328
500329,SD,SD00010527,SD259282,Nemophila menziesii var. menziesii,205103,3/9/2008,2008,3,9,69,9-Mar-08,FFL,San Diego,"San Elijo Lagoon Ecological Reserve; South side of trail approx ½ way between trailheads, Santa Carina and Santa Helena. Solana Beach.",33.00921,-117.24916,,6,,cch2,urn:uuid:aa731917-4d41-495b-bcd9-d1eb09ae1b40,http://cch2.org/portal/collections/individual/index.php?occid=500329
500330,SD,SD00010526,SD261570,Nemophila menziesii var. integrifolia,205102,5/12/2017,2017,5,12,132,12-May-17,FFL,San Diego,Cleveland National Forest: Barber Mountain area: west of Barrett Lake and southeast of the junction of Honey Springs Road and Lyons Valley Road; along Forest Rte. 17S10/Barber Mountain Road; along stream in rocky canyon,32.68267,-116.69306,,700,,cch2,urn:uuid:ad06abd2-7102-477e-b5d2-a1ef469155e5,http://cch2.org/portal/collections/individual/index.php?occid=500330
500331,SD,SD00010524,SD261730,Nemophila menziesii var. integrifolia,205102,5/2/1994,1994,5,2,122,2-May-94,FFL,San Diego,"Meadow north of small reservoir, south-east of Corte Madera Valley. North-west of Pine Valley",32.80635,-116.54912,,1151,,cch2,urn:uuid:4a5c4eb8-3455-492d-87a6-9c7b727c238f,http://cch2.org/portal/collections/individual/index.php?occid=500331
500332,SD,SD00010525,SD261731,nemophila menziesii var. integrifolia,205102,5/5/1994,1994,5,5,125,5-May-94,FFL,San Diego,"Corte Madera Ranch, west of Pine Valley. West of reservoir, along road edge in Long Valley, approx 1½ mi south of Bear Valley Rd.",32.76818,-116.54245,,1185,,cch2,urn:uuid:3260c106-832c-4a3f-ab96-ac3651daa884,http://cch2.org/portal/collections/individual/index.php?occid=500332
500333,SD,SD00010523,SD261732,Nemophila menziesii var. integrifolia,205102,6/1/1993,1993,6,1,152,1-Jun-93,FFL,San Diego,"Volcan Mountains, north of Julian. Near road fork between Ferguson and Simmons Flats.",33.1151,-116.58333,,1606,,cch2,urn:uuid:239e8536-8469-4dbb-9781-ca98db113b4d,http://cch2.org/portal/collections/individual/index.php?occid=500333
500334,SD,SD00010522,SD261733,Nemophila menziesii var. integrifolia,205102,5/25/1993,1993,5,25,145,25-May-93,FFL,San Diego,"Volcan Mountains, north of Julian. Near road, extension of Farmer (Volcan) Road, Rutherford Ranch.",33.13311,-116.58407,,1603,,cch2,urn:uuid:6253605f-3a46-448a-add2-e7cfe2d3a978,http://cch2.org/portal/collections/individual/index.php?occid=500334
500335,SD,SD00010521,SD262013,Nemophila menziesii var. integrifolia,205102,3/14/2017,2017,3,14,73,14-Mar-17,FFL,San Diego,"Fallbrook Naval Weapons Station: west of Fallbrook; North Magazine, north of Ammunition Road; northwestern part of station; on the northwestern slope of the highest peak on the station",33.38229,-117.28723,,245,,cch2,urn:uuid:f0ab703b-c06a-4e9c-b777-202b8fda80f5,http://cch2.org/portal/collections/individual/index.php?occid=500335
500337,SD,SD00010520,SD262509,Nemophila menziesii var. integrifolia,205102,5/6/2011,2011,5,6,126,6-May-11,FL,San Diego,Laguna Mountains; near Sunrise Highway about 1/4 miles S of junction with Kitchen Creek Road,32.8447,-116.4486,,1785,,cch2,urn:uuid:b5a8ff0a-4e6f-40b4-be63-c4147d04c081,http://cch2.org/portal/collections/individual/index.php?occid=500337
500338,SD,SD00010519,SD262510,Nemophila menziesii var. integrifolia,205102,3/20/2010,2010,3,20,79,20-Mar-10,FL,San Diego,Rancho San Diego; N side of San Miguel Mountain; along Millar Ranch Road; 0.8 miles SE of intersection with Highway 94 (Campo Road); 45 yds W of Millar Ranch Road on rock bench in seasonal creek,32.72141,-116.93084,,203,,cch2,urn:uuid:4a50c23a-eba8-452e-9048-8ae68d69d6f0,http://cch2.org/portal/collections/individual/index.php?occid=500338
500339,SD,SD00010518,SD262511,Nemophila menziesii var. integrifolia,205102,4/29/2012,2012,4,29,120,29-Apr-12,FFL,San Diego,"Cleveland National Forest, Pamo Valley, Santa Ysabel Creek, along Forest route 12504 1/4 mile west of intersection with Pamo Valley Rd.",33.105,-116.86028,,280,,cch2,urn:uuid:f7bb8657-24a1-44f8-bbcc-f2dbcae39750,http://cch2.org/portal/collections/individual/index.php?occid=500339
500340,SD,SD00010517,SD262512,Nemophila menziesii var. integrifolia,205102,4/16/2010,2010,4,16,106,16-Apr-10,FFL,San Diego,"Cleveland National Forest, west side of Mesa Grande Road, North slope of the ridge above the Patton lode mine along the fence line of private property east of National Forest land.",33.20222,-116.81806,,860,,cch2,urn:uuid:1ff4f3cc-d351-4aec-b72b-b8cdb6295ab8,http://cch2.org/portal/collections/individual/index.php?occid=500340
500341,SD,SD00010516,SD262513,Nemophila menziesii var. integrifolia,205102,4/11/2010,2010,4,11,101,11-Apr-10,FFL,San Diego,"Cleveland National Forest near Cameron Fire Station, just north of 1-8 and Kitchen Creek Road. 300meters WNW of fire station",32.722,-116.4687,,1005,,cch2,urn:uuid:36b7e441-cb59-4e83-8182-1c82c9e2f4fc,http://cch2.org/portal/collections/individual/index.php?occid=500341
500342,SD,SD00010435,SD262514,Nemophila menziesii var. menziesii,205103,4/11/2014,2014,4,11,101,11-Apr-14,FFL,San Diego,"Anza-Borrego Desert State Park, Chimney Spring Drainage, 6.14 air miles SW of Borrego Springs and .75 air mile NW of intersection of Old Culp Valley Road and County Hwy. S-22.",33.21246,-116.46545,,1021,,cch2,urn:uuid:5fbee1ab-81b2-4be2-bbd8-34bd531ca310,http://cch2.org/portal/collections/individual/index.php?occid=500342
500343,SD,SD00010434,SD262515,Nemophila menziesii var. menziesii,205103,4/4/2009,2009,4,4,94,4-Apr-09,FL,San Diego,Cleveland National Forest; Warner Springs; N facing shoulder of Lost Creek Road; vicinity of 2 miles NNE of junction Lost Creek Road and Highway 79,33.3111,-116.6421,,1094,,cch2,urn:uuid:909c956d-d48b-495f-b24d-879bde70b20e,http://cch2.org/portal/collections/individual/index.php?occid=500343
500344,SD,SD00010433,SD262516,Nemophila menziesii var. menziesii,205103,4/18/2012,2012,4,18,109,18-Apr-12,FFL,San Diego,"Arkansas Canyon, NE-flank of Volcan Mountain. San Felipe Valley Wildlife Area, California Fish & Game property. 5.7 air miles NW of intersection of State hwy. 78 and County Road S-2.",33.12596,-116.5638,,980,,cch2,urn:uuid:213edef6-855b-4411-85cb-aba280c3fa9b,http://cch2.org/portal/collections/individual/index.php?occid=500344
500345,SD,SD00010432,SD262517,Nemophila menziesii var. menziesii,205103,3/23/2015,2015,3,23,82,23-Mar-15,FL,San Diego,Anza-Borrego Desert State Park; head of South Fork Hellhole Canyon; 6.16 air miles SW of Borrego Springs; 0.91 air mile NW of intersection of County Hwy. S-22 and Culp Valley Campground/Pena Spring Primitive Road.,33.22449,-116.47383,,1109,,cch2,urn:uuid:146c162b-fede-46d5-8889-3ee31aaf4e27,http://cch2.org/portal/collections/individual/index.php?occid=500345
500346,SD,SD00010431,SD262518,Nemophila menziesii var. menziesii,205103,4/4/2009,2009,4,4,94,4-Apr-09,FL,San Diego,Warner Springs; Northeast facing slope along Pacific Crest Trail; 0.38 mile SE of Barrel Spring trailhead off of Montezuma Rd.,33.2131,-116.583,,1097,,cch2,urn:uuid:a6fe7f84-c27b-4e3e-8b35-dd7114424e65,http://cch2.org/portal/collections/individual/index.php?occid=500346
500348,SD,SD00010513,SD263870,Nemophila menziesii var. integrifolia,205102,3/15/2008,2008,3,15,75,15-Mar-08,FFL,San Diego,"City of Escondido, San Pasqual Valley, Rancho San Pasqual, 200 m north east of Orchard View and Old Ranch Road Intersection, 300 m north west of Ranchview Place and Rosewood Intersection, top of hill",33.12421,-117.0055,,217,,cch2,urn:uuid:29b9e706-c6b4-4674-af30-5224dc0c0f42,http://cch2.org/portal/collections/individual/index.php?occid=500348
500349,SD,SD00010512,SD263871,Nemophila menziesii var. integrifolia,205102,5/12/2009,2009,5,12,132,12-May-09,FFL,San Diego,Julian; Rutherford Ranch; Volcan Mtns.; 2.71 miles N of junction Farmer Rd. & Wynola Road; Hunter's Camp area; near Santa Ysabel Crk.,33.14194,-116.6025,,1549,,cch2,urn:uuid:3c180021-df7a-4dc8-ba0e-0107be2ab96b,http://cch2.org/portal/collections/individual/index.php?occid=500349
500351,SD,SD00010514,SD264494,Nemophila menziesii subsp. integrifolia,210481,2/28/1994,1994,2,28,59,28-Feb-94,FFL,San Diego,"San Felipe Valley, east of S-2, north of Sissors Crossing. Grid I-21.",33.12723,-116.51955,,764,,cch2,urn:uuid:3129e9bc-da78-4e9c-ab57-237f3eb05d79,http://cch2.org/portal/collections/individual/index.php?occid=500351
607801,SFV,SFV112659,SFV-16101,Nemophila menziesii,205099,4/9/1995,1995,4,9,99,9-Apr-95,Flowering,Los Angeles,"San Gabriel Mountains; Angeles Forest Highway, 3.5 miles north of junction with Angeles Crest Highway. 100 m off highway.",34.3,-118.15,1000,915,3001 ft.,cch2,urn:uuid:1b97497f-43fe-4d6f-859e-1795e0b44ef7,http://cch2.org/portal/collections/individual/index.php?occid=607801
611352,SFV,SFV112672,SFV-20805,Nemophila menziesii var. integrifolia,205102,4/4/2002,2002,4,4,94,4-Apr-02,Flowering,Los Angeles,Verdugo Mountains; Southwest side. From saddle along main crest where the dirt roads of Verdugo Mountain Way and Chandler Fire Road meet (Thomas Guide 1998 street guide and directory) head north down Wildwood Fire Road (closed road and plants growing back onto road) to old home site near La Tuna Canyon Road.,34.22769444,-118.322,1000,532,1746 ft.,cch2,urn:uuid:c232ef37-e693-492b-807d-ad51abcf7141,http://cch2.org/portal/collections/individual/index.php?occid=611352
611803,SFV,SFV112679,SFV-21021,Nemophila menziesii var. menziesii,205103,2/10/2003,2003,2,10,41,10-Feb-03,Flowering,Los Angeles,Verdugo Mountains; South side of Verdugo Mountains along dirt road (Brand Park Motorway) to top of crest at Verdugo Motorway. South side of slope at saddle of Verdugo Motorway and Brand Park Motorway on the crest of mountains.,34.20333333,-118.2647222,1000,823,2700 ft.,cch2,urn:uuid:44f69e8b-7f76-4b2b-a131-175bf9187524,http://cch2.org/portal/collections/individual/index.php?occid=611803
611843,SFV,SFV112654,SFV-20974,Nemophila menziesii var. integrifolia,205102,5/29/2003,2003,5,29,149,29-May-03,Flowering,Los Angeles,"Verdugo Mountains; West end of Verdugo Mountains at junction (saddle) of Verdugo Motorway and Wildwood Fire Road (abandoned road, as the ranch north of here at mouth of canyon down at La Tuna Canyon burned down a long time ago). Went down into a small draw northeast of saddle, then came back up another canyon to the east of the main fire road on the crest of the ridge (Verdugo Motorway).",34.225,-118.321,1000,564,1850 ft.,cch2,urn:uuid:48d5c6f1-c609-47ea-951a-c16a094c0d9c,http://cch2.org/portal/collections/individual/index.php?occid=611843
613394,SFV,SFV112664,SFV-18486,Nemophila menziesii,205099,3/17/2002,2002,3,17,76,17-Mar-02,Flowering,Lake,Highland Springs Dam. Dry hillside above reservoir on northeast side of road.,38.94,-122.91,1000,460,1509 ft.,cch2,urn:uuid:6ee88504-84ba-408e-ba7d-457991f9316d,http://cch2.org/portal/collections/individual/index.php?occid=613394
613395,SFV,SFV112665,SFV-2986,Nemophila menziesii,205099,3/29/1958,1958,3,29,88,29-Mar-58,Flowering,Los Angeles,Santa Susana Mountains; Phil Gentile Ranch.,34.32,-118.51,1000,450,1476 ft.,cch2,urn:uuid:f4970aec-c1ee-401c-b991-a1e0069f9397,http://cch2.org/portal/collections/individual/index.php?occid=613395
613396,SFV,SFV112666,SFV-5408,Nemophila menziesii,205099,6/2/1962,1962,6,2,153,2-Jun-62,Flowering,Los Angeles,San Gabriel Mountains; Roadside along Route 2 (Angeles Crest Highway) about 5 miles north of La Canada.,34.25,-118.19,1000,793,2600 ft.,cch2,urn:uuid:7a12e1a1-a867-4d98-b605-a498b68d2171,http://cch2.org/portal/collections/individual/index.php?occid=613396
613397,SFV,SFV112667,SFV-2988,Nemophila menziesii,205099,5/20/1961,1961,5,20,140,20-May-61,Flowering,Los Angeles,"Santa Monica Mountains; Old Topanga Canyon Road, 0.5 miles west of New Topanga Canyon Road, south of highway.",34.09,-118.61,1000,245,804 ft.,cch2,urn:uuid:0cbf3ea3-4d1d-49e5-b07a-945b6a1fb82d,http://cch2.org/portal/collections/individual/index.php?occid=613397
613398,SFV,SFV112660,SFV-7367,Nemophila menziesii,205099,4/3/1975,1975,4,3,93,3-Apr-75,Flowering,Los Angeles,San Gabriel Mountains; Placerita Canyon near Los Pinetos Canyon.,34.37,-118.44,1000,564,1850 ft.,cch2,urn:uuid:da153d07-68dd-46e1-b5b9-5d7b70422a38,http://cch2.org/portal/collections/individual/index.php?occid=613398
613399,SFV,SFV112678,SFV-17366,Nemophila menziesii var. menziesii,205103,5/28/1998,1998,5,28,148,28-May-98,Flowering,Los Angeles,San Gabriel Mountains; Arroyo Seco near Switzer Picnic Area.,34.26666667,-118.1416667,1000,976,3200 ft.,cch2,urn:uuid:5b6a38fd-c43f-46af-ba7b-f2ac77bab884,http://cch2.org/portal/collections/individual/index.php?occid=613399
613400,SFV,SFV112652,SFV-12280,Nemophila menziesii,205099,3/19/1965,1965,3,19,78,19-Mar-65,Flowering,Napa,"Field beside Dollarhide Road, about 3-4 miles east of Pope Valley.",38.63,-122.35,1000,150,492 ft.,cch2,urn:uuid:bd4edd34-57a5-4174-b93f-0d73e409af90,http://cch2.org/portal/collections/individual/index.php?occid=613400
613401,SFV,SFV112653,SFV-8490,Nemophila menziesii,205099,4/13/1974,1974,4,13,103,13-Apr-74,Flowering,Napa,"1 air mile southwest of Pope Valley, just west of Chiles-Pope Valley Road.",38.61,-122.41,1000,207,680 ft.,cch2,urn:uuid:669f6878-e254-4205-953c-7e97565f5303,http://cch2.org/portal/collections/individual/index.php?occid=613401
613402,SFV,SFV112662,SFV-16182,Nemophila menziesii,205099,4/30/1995,1995,4,30,120,30-Apr-95,Flowering,Kern,"Ventura Mountains; Southeast of Maricopa on Cerro Noroeste Road, 9.7 miles southeast of CA Highway 33.",34.89,-119.36,1000,1400,4592 ft.,cch2,urn:uuid:93c14ff8-087c-4650-88e6-d817e9f20579,http://cch2.org/portal/collections/individual/index.php?occid=613402
613403,SFV,SFV112663,SFV-17465,Nemophila menziesii,205099,6/12/1998,1998,6,12,163,12-Jun-98,Flowering,Kern,Ventura Mountains; Roadcut adjacent to Cerro Noroeste Road a few miles from Bitter Creek National Wildlife Refuge.,34.91,-119.4,1000,1300,4264 ft.,cch2,urn:uuid:05e9e10c-9106-427a-af35-a7875a6bcda3,http://cch2.org/portal/collections/individual/index.php?occid=613403
613404,SFV,SFV112677,SFV-17937,Nemophila menziesii var. menziesii,205103,4/17/1999,1999,4,17,107,17-Apr-99,Flowering,Kern,"Ventura Mountains; San Emigdio Mountains. Cerro Noroeste Road, 4 km south of Cienega Canyon.",35.91666667,-119.4083333,1000,800,2624 ft.,cch2,urn:uuid:686b021b-3afb-443a-a851-548c1bb059bb,http://cch2.org/portal/collections/individual/index.php?occid=613404
613405,SFV,SFV112658,SFV-6664,Nemophila menziesii,205099,5/24/1974,1974,5,24,144,24-May-74,Flowering,Los Angeles,San Gabriel Mountains; Gold Creek Canyon. Side canyon of Little Tujunga Canyon. Watts Ranch.,34.32,-118.31,1000,660,2165 ft.,cch2,urn:uuid:e6b25caa-1508-41e6-96f2-1bfd5752bc7d,http://cch2.org/portal/collections/individual/index.php?occid=613405
613406,SFV,SFV112671,SFV-2985,Nemophila menziesii,205099,4/11/1958,1958,4,11,101,11-Apr-58,Flowering,Los Angeles,"Santa Susana Mountains; Oat Mountain, north slope ravine. Roadside.",34.32,-118.57,1000,945,3100 ft.,cch2,urn:uuid:1267be1c-4df2-45bd-a80f-9f7e4e8c3dc4,http://cch2.org/portal/collections/individual/index.php?occid=613406
613407,SFV,SFV112668,SFV-16164,Nemophila menziesii,205099,5/14/1994,1994,5,14,134,14-May-94,Flowering,Los Angeles,San Gabriel Mountains; 1 miles west on 2N23 from Newcomb's Saddle.,34.24,-118.02,1000,950,3116 ft.,cch2,urn:uuid:0912ca24-78ba-4a94-8aaa-b4c18540ec9f,http://cch2.org/portal/collections/individual/index.php?occid=613407
613408,SFV,SFV112669,SFV-2984,Nemophila menziesii,205099,3/25/1962,1962,3,25,84,25-Mar-62,Flowering,Los Angeles,"San Gabriel Mountains; Soledad Canyon. Small, burnt over canyon west of Bee Canyon, north of River's End Ranch.",34.44,-118.37,1000,610,2001 ft.,cch2,urn:uuid:0d06f2a7-2f2c-421e-94f8-98e4bd0a18f9,http://cch2.org/portal/collections/individual/index.php?occid=613408
613409,SFV,SFV112661,SFV-12282,Nemophila menziesii,205099,4/8/1962,1962,4,8,98,8-Apr-62,Flowering,Butte,"Lave outcropping on Table Mountain, north of Oroville.",39.6,-121.5,10000,,,cch2,urn:uuid:44e5efb3-550f-40de-99d5-ba34de21d759,http://cch2.org/portal/collections/individual/index.php?occid=613409
613410,SFV,SFV112670,SFV-10208,Nemophila menziesii var. integrifolia,205102,4/19/1978,1978,4,19,109,19-Apr-78,Flowering,Los Angeles,Verdugo Mountains; About 2 miles from end of Walnut Ave. on Stough Canyon fire road.,34.22,-118.31,1000,610,2000 ft.,cch2,urn:uuid:aa12eed6-8ac1-4ec0-a701-c1113333df0d,http://cch2.org/portal/collections/individual/index.php?occid=613410
613411,SFV,SFV112674,SFV-2983,Nemophila menziesii var. integrifolia,205102,6/23/1961,1961,6,23,174,23-Jun-61,Flowering,Mendocino,North Coast Ranges; 5 miles west of Willits on CA-Highway 20.,39.4,-123.4,1000,525,1722 ft.,cch2,urn:uuid:f4d6abf6-d9f8-43e4-bffe-0444b13cdaea,http://cch2.org/portal/collections/individual/index.php?occid=613411
613412,SFV,SFV112655,SFV-11583,Nemophila menziesii,205099,4/11/1965,1965,4,11,101,11-Apr-65,Flowering,Sutter,Sacramento Valley; 1 mile north of Marysville on Highway 99E. Roadside.,39.18,-121.63,1000,20,66 ft.,cch2,urn:uuid:53ede572-5fc6-4d7f-bf02-40d8f625cfbe,http://cch2.org/portal/collections/individual/index.php?occid=613412
613413,SFV,SFV112656,SFV-2989,Nemophila menziesii,205099,3/24/1962,1962,3,24,83,24-Mar-62,Flowering,Sacramento,"Sacramento Valley; CA Highway 16 at Eagle's Nest Road, southeast of Sacramento.",38.51,-121.26,1000,38,125 ft.,cch2,urn:uuid:0fe44066-46d3-4b6a-ae35-b6d46851e6e1,http://cch2.org/portal/collections/individual/index.php?occid=613413
613414,SFV,SFV112675,SFV-2990,Nemophila menziesii var. integrifolia,205102,3/10/1961,1961,3,10,69,10-Mar-61,Flowering,Los Angeles,"Santa Monica Mountains; Old Topanga Canyon Road, about 0.25 miles west of Topanga Canyon Blvd.",34.09,-118.61,1000,245,804 ft.,cch2,urn:uuid:90653282-86f9-4625-9396-d2f76d96b9f7,http://cch2.org/portal/collections/individual/index.php?occid=613414
613415,SFV,SFV112676,SFV-5378,Nemophila menziesii var. integrifolia,205102,6/3/1962,1962,6,3,154,3-Jun-62,Flowering,San Bernardino,"San Bernardino Mountains; North Shore, Lake Arrowhead. Near Lake Arrowhead Hospital.",34.26,-117.17,1000,1585,5200 ft.,cch2,urn:uuid:2c97494e-e2de-4a51-9590-0135e124ddd3,http://cch2.org/portal/collections/individual/index.php?occid=613415
613416,SFV,SFV112657,SFV-16341,Nemophila menziesii,205099,3/19/1993,1993,3,19,78,19-Mar-93,Flowering,San Luis Obispo,"Carrizo Plain; Carrizo Plain Natural Area. Along Soda Lake Road, 2.3 miles northwest of intersection with dirt road leading to Painted Rock and Education Center.",35.23,-119.9,1000,585,1919 ft.,cch2,urn:uuid:dc61dfbf-5403-4952-b956-78b8069072a4,http://cch2.org/portal/collections/individual/index.php?occid=613416
613417,SFV,SFV112651,SFV-16183,Nemophila menziesii,205099,3/26/1995,1995,3,26,85,26-Mar-95,Flowering,San Luis Obispo,"Carrizo Plain; Carrizo Plain Natural Area. On ridge west of Soda Lake, about 5 miles north of Painted Rock.",35.19,-119.91,1000,800,2624 ft.,cch2,urn:uuid:fdd6092a-7bb5-405e-810b-8b966ec2948e,http://cch2.org/portal/collections/individual/index.php?occid=613417
616273,SFV,SFV112673,SFV-22598,Nemophila menziesii var. integrifolia,205102,5/16/2001,2001,5,16,136,16-May-01,Flowering,Los Angeles,San Rafael Hills; San Rafael Hills. Ridgetop along trailside on Liz's Loop (Edison Road) to Cherry Canyon Fire Road.,34.19525,-118.2065833,1000,457,1500 ft.,cch2,urn:uuid:c6a5e5d3-4426-4f7f-a42f-79400f2d47bf,http://cch2.org/portal/collections/individual/index.php?occid=616273
623189,IRVC,IRVC100599,IRVC29323,Nemophila menziesii subsp. integrifolia,210481,4/1/2006,2006,4,1,91,1-Apr-06,,San Bernardino,Dry Morrongo Wash at County line btween Riverside and San Bernardino at bridge of Hwy 62.,,,,732,,cch2,urn:uuid:861e8478-a21b-425d-965a-a259133cd2dc,http://cch2.org/portal/collections/individual/index.php?occid=623189
630648,IRVC,IRVC100601,IRVC26663,Nemophila menziesii,205099,4/9/2004,2004,4,9,100,9-Apr-04,Flowering & Fruiting,San Bernardino,"Ca. 1.5 miles E of Pioneertown, UC Burns Pinyon Ridge Reserve, SW portion in South Railroad Canyon.",34.13917,-116.45278,,1113,,cch2,urn:uuid:cd08eeaf-09be-436d-8f2a-ac4a2592ce49,http://cch2.org/portal/collections/individual/index.php?occid=630648
634612,IRVC,IRVC100598,IRVC26762,Nemophila menziesii var. integrifolia,205102,4/9/2004,2004,4,9,100,9-Apr-04,Flowering & Fruiting,San Bernardino,"Ca. 1.5 miles E of Pioneertown, UC Burns Pinyon Ridge Reserve, NW portion near camping area.",34.14722,-116.45694,,1256,,cch2,urn:uuid:bd54d1ae-6bc4-4322-ae6c-532559d4b167,http://cch2.org/portal/collections/individual/index.php?occid=634612
634908,IRVC,IRVC100600,IRVC27167,Nemophila menziesii,205099,2/13/2005,2005,2,13,44,13-Feb-05,Flowering & Fruiting,San Bernardino,"Ca. 1.5 miles E of Pioneertown, UC Burns Pinyon Ridge Reserve; middle part of the Resere on ridge between Boo"" and Jean"" canyons (tribs. to N Railroad Canyon). Decomposed granite soils with granite boulders",34.14472,-116.45222,1000,1250,,cch2,urn:uuid:1953e8aa-9beb-4cd5-9b9c-3a60be35aeed,http://cch2.org/portal/collections/individual/index.php?occid=634908
638053,RSA,RSA0010691,803627,Nemophila menziesii,205099,4/11/1976,1976,4,11,102,4/11/1976,,Tulare County,2 miles east of Mt. Lumreau,,,,793,,cch2,urn:uuid:9027513b-c99b-4f25-b36a-a3ffceadbe2f,http://cch2.org/portal/collections/individual/index.php?occid=638053
639517,RSA,RSA0036056,421358,Nemophila menziesii,205099,3/3/1935,1935,3,3,62,3/3/1935,,Orange County,San Juan Canyon.,,,,762,,cch2,urn:uuid:ec8c9829-6197-43af-8cd5-1b1ab0e0eada,http://cch2.org/portal/collections/individual/index.php?occid=639517
660621,RSA,RSA0093734,847495,Nemophila menziesii,205099,4/14/2010,2010,4,14,104,4/14/2010,,Kern County,"Tehachapi Mountains. head of Canyon del Gato Montes, near foot of road over ridge toward Canyon de la Lecheria.",34.91889,-118.64028,,1613,,cch2,urn:uuid:1199e90d-1e0e-404e-b359-de44b8de120c,http://cch2.org/portal/collections/individual/index.php?occid=660621
661691,RSA,RSA0037197,820704,Nemophila menziesii,205099,5/12/1991,1991,5,12,132,5/12/1991,,Riverside County,"Area of High Country Ranches. From Tamatea Road approx. 100 ft. to dry stream bed, walking northeasterly direction.",,,,1280,,cch2,urn:uuid:3b0f9d33-9fad-4096-bb34-48f412b74bac,http://cch2.org/portal/collections/individual/index.php?occid=661691
677043,RSA,RSA0028793,421332,Nemophila menziesii,205099,5/20/1944,1944,5,20,141,5/20/1944,,Riverside County,"Palms to Pines Highway [Hwy. 74], San Jacinto Mountains.",,,,1372,,cch2,urn:uuid:4473db0d-c624-4609-bcc7-a9a38fbdf2d3,http://cch2.org/portal/collections/individual/index.php?occid=677043
698481,RSA,RSA0073978,837693,Nemophila menziesii,205099,4/24/2010,2010,4,24,114,4/24/2010,,San Diego County,Rancho San Diego; US Fish & Wildlife Refuge; N side of San Miguel Mountains; W of Millar Ranch Road; 0.37 miles SSW of junction with highway 94 (Campo Road).,32.726,-116.9404,,125,,cch2,urn:uuid:046b6958-edd5-4a5f-a8a0-7f6f3e2bad23,http://cch2.org/portal/collections/individual/index.php?occid=698481
712818,RSA,RSA0070947,421306,Nemophila menziesii,205099,5/28/1973,1973,5,28,148,5/28/1973,,Los Angeles County,"Angeles National Forest, San Gabriel Mts.: Trail Canyon.",,,,610,,cch2,urn:uuid:53c5abea-42cb-4c1f-83e8-8d6c4427d72c,http://cch2.org/portal/collections/individual/index.php?occid=712818
749475,RSA,RSA0068234,834742,Nemophila menziesii,205099,3/22/2012,2012,3,22,82,3/22/2012,,Amador County,"Bell Road, 0.2 mile east of its junction with CA-49.",38.54139,-120.84472,,270,,cch2,urn:uuid:8297593f-daf1-470f-b70f-f3b5b15082d5,http://cch2.org/portal/collections/individual/index.php?occid=749475
751360,RSA,RSA0028725,204477,Nemophila menziesii,205099,4/9/1933,1933,4,9,99,4/9/1933,,Santa Cruz County,Ano Nuevo Pines,,,,,,cch2,urn:uuid:09d451cd-e200-4bbd-bf48-8e92ff087d31,http://cch2.org/portal/collections/individual/index.php?occid=751360
840117,RSA,RSA0057838,829640,Nemophila menziesii,205099,5/14/1976,1976,5,14,135,5/14/1976,,San Bernardino County,"San Antonio Canyon. Two miles south of Mt. Baldy Village, one quarter mile off Mt. Baldy Road on the dirt road.",,,,1158,,cch2,urn:uuid:ccf06eac-fe62-4d8e-92dc-51da60014132,http://cch2.org/portal/collections/individual/index.php?occid=840117
902970,RSA,RSA0073849,837561,Nemophila menziesii,205099,3/21/2015,2015,3,21,80,3/21/2015,,Kern County,"Near Rocky Point, small canyon south of Cane Canyon. East of Kelso Valley Road. South of old mining road.",35.57886,-118.23388,,1028,,cch2,urn:uuid:089428bd-8926-4d19-9244-791afd9da27b,http://cch2.org/portal/collections/individual/index.php?occid=902970
905376,RSA,RSA0036743,819260,Nemophila menziesii,205099,4/11/1998,1998,4,11,101,4/11/1998,,San Bernardino County,Burns Pinon Ridge Reserve.,34.17,-116.43,,1250,,cch2,urn:uuid:bc860d52-4883-46f3-9ffe-957df2dabf1a,http://cch2.org/portal/collections/individual/index.php?occid=905376
937567,RSA,RSA0017032,754001,Nemophila menziesii,205099,,,,,,,,Los Angeles County,Angeles National Forest Upper Big Tujunga Wash Streamside.,,,,1067,,cch2,urn:uuid:c3121eb7-c327-40f7-b39e-4cee804017e7,http://cch2.org/portal/collections/individual/index.php?occid=937567
953555,RSA,RSA0035444,819287,Nemophila menziesii subsp. menziesii,205100,5/15/1982,1982,5,15,135,5/15/1982,,San Diego County,"CA Hwy S6, 4 mi. N of Palomar Mtn.",,,,1524,,cch2,urn:uuid:7acbc6ce-bd80-4fdc-befb-6b58d970d358,http://cch2.org/portal/collections/individual/index.php?occid=953555
962363,RSA,RSA0043195,766863,Nemophila menziesii,205099,7/2/2010,2010,7,2,183,7/2/2010,,San Bernardino County,Upper Santa Ana River Watershed: Middle Control Road between Highway 38 and Santa Ana River.,34.1619444,-116.9633333,,1571,,cch2,urn:uuid:7b37b309-c72f-4226-8e7b-f768c8b045d2,http://cch2.org/portal/collections/individual/index.php?occid=962363
967280,RSA,RSA0043194,756030,Nemophila menziesii,205099,4/25/1995,1995,4,25,115,4/25/1995,,San Bernardino County,"East of hwy. I-15 and Cajon Pass, via hwy. 138, Elliott's Ranch area.",34.325,-117.4227778,,1067,,cch2,urn:uuid:c9602f91-1cc8-4471-b2fc-e22ee0738973,http://cch2.org/portal/collections/individual/index.php?occid=967280
990724,RSA,RSA0043192,421278,Nemophila menziesii,205099,3/1/1931,1931,3,1,60,3/1/1931,,Los Angeles County,Oak Wilde.,,,,,,cch2,urn:uuid:9c47810a-7cd1-4074-9a82-863c75513d4f,http://cch2.org/portal/collections/individual/index.php?occid=990724
1003738,RSA,RSA0073853,837557,Nemophila menziesii,205099,3/7/2015,2015,3,7,66,3/7/2015,,Kern County,"Horse Canyon. West side of canyon, near the mouth of the canyon. Near primitive campsite.",35.54837,-118.04398,,1203,,cch2,urn:uuid:e0a1f825-8b4b-43c8-87d3-437bdc5d1cde,http://cch2.org/portal/collections/individual/index.php?occid=1003738
1009213,RSA,RSA0070948,571534,Nemophila menziesii,205099,4/29/1994,1994,4,29,119,4/29/1994,,Los Angeles County,"Northern slope of the San Gabriel Mountains, Angeles National Forest: side draw on southeastern side of Mt. Emma, Santiago Canyon drainage.",,,,1159,,cch2,urn:uuid:05067ac4-37d1-41b9-b893-f7ef3b3ca21e,http://cch2.org/portal/collections/individual/index.php?occid=1009213
1011501,RSA,RSA0003802,65543,Nemophila menziesii,205099,1903-06-00,1903,6,0,,1903-6,,Santa Clara County,Loma Prieta Peak.,,,,,,cch2,urn:uuid:f2cc950f-d784-44ef-b002-72a0bdfe5681,http://cch2.org/portal/collections/individual/index.php?occid=1011501
1021779,RSA,RSA0036099,230158,Nemophila menziesii subsp. integrifolia,210481,6/5/1935,1935,6,5,156,6/5/1935,,San Bernardino County,"Saw pit canyon. [Sawpit Canyon, San Bernardino Mountains]",34.264,-117.3371,2500,1270,,cch2,urn:uuid:3a426bc8-afa6-483a-9107-81292bb60ba2,http://cch2.org/portal/collections/individual/index.php?occid=1021779
1021903,RSA,RSA0059738,421333,Nemophila menziesii,205099,5/5/1945,1945,5,5,125,5/5/1945,,Riverside County,San Gorgonio Mountains above Banning.,,,,914,,cch2,urn:uuid:6ccb0be4-66c8-42fd-957f-0ac8112fd39e,http://cch2.org/portal/collections/individual/index.php?occid=1021903
1037057,RSA,RSA0014176,804749,Nemophila menziesii,205099,1993-03-00,1993,3,0,,1993-3,,Tulare County,"Along Hwy 190, above bridge",,,,,,cch2,urn:uuid:c7165655-caac-4c13-b864-56b35ac5fb30,http://cch2.org/portal/collections/individual/index.php?occid=1037057
1037233,RSA,RSA0043165,459248,Nemophila menziesii,205099,4/19/1933,1933,4,19,109,4/19/1933,,Los Angeles County,Palos Verdes Hills.,,,,,,cch2,urn:uuid:d0b6046b-d386-40a6-8a7d-3ece4e9a313a,http://cch2.org/portal/collections/individual/index.php?occid=1037233
1038115,RSA,RSA0067586,834225,Nemophila menziesii,205099,4/26/2014,2014,4,26,116,4/26/2014,,Kern County,Scodie Canyon. At the end of the U.S. Fish and Wildlife Ecological Reserve.,35.64018,-118.18436,,1222,,cch2,urn:uuid:75cee6d9-9868-415b-8eab-08769ca25d28,http://cch2.org/portal/collections/individual/index.php?occid=1038115
1061786,RSA,RSA0043162,459290,Nemophila menziesii,205099,,,,,,,,San Diego County,Laguna Mountains.,32.84327,-116.48061,12070,,,cch2,urn:uuid:b1965743-ac55-4e0c-a947-66cc8ff474b8,http://cch2.org/portal/collections/individual/index.php?occid=1061786
1081945,RSA,RSA0043164,787680,Nemophila menziesii,205099,5/21/2012,2012,5,21,142,5/21/2012,,San Bernardino County,"Yucaipa Ridge; approximately 4 air miles northeast of the San Gorgonio Ranger station, or approximately 0.6 air mile northeast of Allen Peak.",34.08484,-116.97716,,1616,,cch2,urn:uuid:635de141-ac3a-45cd-bb5f-21c05dc8db54,http://cch2.org/portal/collections/individual/index.php?occid=1081945
1094910,RSA,RSA0043193,772346,Nemophila menziesii,205099,5/6/2010,2010,5,6,126,5/6/2010,,San Bernardino County,San Bernardino National Forest: the upper Santa Ana River watershed; along the Santa Ana River Trail approximately 0.25 air mile east of Mill Creek road.,34.16404,-116.94995,,1553,,cch2,urn:uuid:5021a7b5-f40c-4aa7-aeac-dd88772b4b31,http://cch2.org/portal/collections/individual/index.php?occid=1094910
1110758,RSA,RSA0094763,848229,Nemophila menziesii,205099,3/31/2015,2015,3,31,90,3/31/2015,,San Bernardino County,"Little San Bernardino Mountains; along dirt road in Water Canyon, 1.3 mi west of Pioneertown Rd, approx 5 mi. NW of Yucca Valley.",34.1309667,-116.4915,,1148,,cch2,urn:uuid:9d256ffe-60b5-40fb-b86a-e614f10fab68,http://cch2.org/portal/collections/individual/index.php?occid=1110758
1117617,RSA,RSA0049807,826905,Nemophila menziesii,205099,3/28/2014,2014,3,28,87,3/28/2014,,San Bernardino County,"Granite Mountains; to the east of Apple Valley, approximately 3.5 air miles northwest of Rabbit Dry Lake, and about 1 air mile south of Amaral Spring.",34.50565,-117.06247,,1225,,cch2,urn:uuid:2f0c3770-8daa-4d5f-8044-9bd6d71a8c7e,http://cch2.org/portal/collections/individual/index.php?occid=1117617
1125058,RSA,RSA0059611,421342,Nemophila menziesii,205099,4/4/1917,1917,4,4,94,4/4/1917,,Riverside County,Palm Canyon,33.6698,-116.5157,1000,762,,cch2,urn:uuid:11ce8d9b-9860-4d3e-b476-6d62f2ef55b4,http://cch2.org/portal/collections/individual/index.php?occid=1125058
1127422,RSA,RSA0060576,831067,Nemophila menziesii subsp. menziesii,205100,4/28/1984,1984,4,28,119,4/28/1984,,Riverside County,"Collected on North-facing slope adjacent ot and on the South side of Highway 74, 3.6 miles from Strawberry Creek going towards Mountain Center.",33.6982,-116.7528,1000,1219,,cch2,urn:uuid:ccb6463e-e38d-4459-b227-8ab296c571c0,http://cch2.org/portal/collections/individual/index.php?occid=1127422
1146614,RSA,RSA0003798,73116,Nemophila menziesii,205099,4/29/1906,1906,4,29,119,4/29/1906,,San Bernardino County,"Dead Man's Point, near Victorville, alt. 925 m.",34.473101,-117.124596,2000,,,cch2,urn:uuid:daf29bb0-9090-4ea9-abf3-7ea4251e4cf2,http://cch2.org/portal/collections/individual/index.php?occid=1146614
1164503,RSA,RSA0011052,65281,Nemophila menziesii,205099,1900-02-00,1900,2,0,,1900-2,,Kern County,Rosedale.,35.38361,-119.14444,2500,,,cch2,urn:uuid:7968a501-d12a-4af2-9af2-16b627e822f5,http://cch2.org/portal/collections/individual/index.php?occid=1164503
1184076,RSA,RSA0046820,822954,Nemophila menziesii,205099,5/22/1994,1994,5,22,142,5/22/1994,,Los Angeles County,USFS trail 7W12 Baldy Tr.,,,,1500,,cch2,urn:uuid:e70b481a-83bf-40b2-a50f-329ff49b84fb,http://cch2.org/portal/collections/individual/index.php?occid=1184076
1191656,RSA,RSA0077591,838810,Nemophila menziesii,205099,4/24/2011,2011,4,24,114,4/24/2011,,Kern County,Bitter Creek National Wildlife Refuge; about 5.2 air miles SE of the junction of Hwy 33 and Hudson Ranch Road (formerly Cerro Noroeste Rd.); SW side of Hudson Ranch Road.,34.9021,-119.3897,,1372,,cch2,urn:uuid:c0e37c34-9588-4bbe-80de-6865ae7d75ee,http://cch2.org/portal/collections/individual/index.php?occid=1191656
1193429,RSA,RSA0056306,303815,Nemophila menziesii,205099,4/4/1970,1970,4,4,94,4/4/1970,,Santa Barbara County,San Marcos Pass.,,,,678,,cch2,urn:uuid:c7bd439d-f36d-4f0a-96eb-a31c19d95e0b,http://cch2.org/portal/collections/individual/index.php?occid=1193429
1202835,RSA,RSA0003800,73826,Nemophila menziesii subsp. australis,,1882-02-25,1882,2,25,56,1882-2-25,,Los Angeles County,Pasadena.,34.152867,-118.121454,6700,,,cch2,urn:uuid:2ce45f81-e224-4371-a70d-269799f63dec,http://cch2.org/portal/collections/individual/index.php?occid=1202835
1203074,RSA,RSA0051320,830320,Nemophila menziesii,205099,3/28/1932,1932,3,28,88,3/28/1932,,Orange County,2 miles NW of H.B.,,,,,,cch2,urn:uuid:c0209375-a726-4770-a5a8-6bf18eaacc5b,http://cch2.org/portal/collections/individual/index.php?occid=1203074
1205796,RSA,RSA0022321,809792,Nemophila menziesii,205099,4/23/2011,2011,4,23,113,4/23/2011,,San Bernardino County,Sawtooth Mountains; collecting in rugged boulder piles about a mile south of Pioneertown and about 0.75 air mile east of Chaparrosa Spring.,34.14308,-116.50302,,1338,,cch2,urn:uuid:56e13839-56e8-40e6-84a3-1a7e3353d8ce,http://cch2.org/portal/collections/individual/index.php?occid=1205796
1218006,RSA,RSA0028724,231317,Nemophila menziesii,205099,4/1/1933,1933,4,1,91,4/1/1933,,Lake County,Mt. St. Helena.,,,,,,cch2,urn:uuid:0d3bbf3b-f348-4e16-b229-4708b8e05c3d,http://cch2.org/portal/collections/individual/index.php?occid=1218006
1224214,RSA,RSA0037196,820705,Nemophila menziesii,205099,5/12/1991,1991,5,12,132,5/12/1991,,Riverside County,"Area of High Country Ranches. From Tamatea Road approx. 100 ft. to dry stream bed, walking northeasterly direction.",,,,1280,,cch2,urn:uuid:4d454b21-4ebc-494d-9467-0d5fd19344d3,http://cch2.org/portal/collections/individual/index.php?occid=1224214
1224670,RSA,RSA0093736,847493,Nemophila menziesii,205099,4/14/2010,2010,4,14,104,4/14/2010,,Kern County,"Tehachapi Mountains. Canyon del Gato Montes, above confluence with Canyon del Agua Escondida.",34.91,-118.63167,,1442,,cch2,urn:uuid:040811bb-e42f-481a-a95b-72142752ee93,http://cch2.org/portal/collections/individual/index.php?occid=1224670
1226468,RSA,RSA0042499,821805,Nemophila menziesii,205099,4/4/2014,2014,4,4,94,4/4/2014,,Los Angeles County,"Western Mojave Desert, approx. 3.3 km northeast of Valyermo along Bob's Gap Road approx. 1.6 km southeast of the aqueduct",34.46542,-117.82326,,1126,,cch2,urn:uuid:2d4f4ddd-d605-4355-835a-8adf0bfbc917,http://cch2.org/portal/collections/individual/index.php?occid=1226468
1231699,RSA,RSA0011369,801775,Nemophila menziesii,205099,3/16/2013,2013,3,16,75,3/16/2013,,San Diego County,The Jacumba Mountains; north side of Table Mountain.,32.6639,-116.14568,,1033,,cch2,urn:uuid:a9315794-af85-4a64-9090-d9aeb1cd5839,http://cch2.org/portal/collections/individual/index.php?occid=1231699
1236301,RSA,RSA0065634,833817,Nemophila menziesii,205099,3/19/2015,2015,3,19,78,3/19/2015,,Los Angeles County,"San Gabriel Mountains: Arrastre Canyon, south of Acton.",34.42758,-118.18402,,846,,cch2,urn:uuid:21a6dc31-d23d-49ba-9f4d-9822e20e4335,http://cch2.org/portal/collections/individual/index.php?occid=1236301
1238749,RSA,RSA0003801,65301,Nemophila menziesii,205099,4/25/1903,1903,4,25,115,4/25/1903,,San Joaquin County,Tracy.,,,,,,cch2,urn:uuid:608c9aea-647b-4440-8b69-7b9328c66dbb,http://cch2.org/portal/collections/individual/index.php?occid=1238749
1294884,CSUSB,CSUSB91438,CSUSB-117,Nemophila menziesii,205099,5/4/1966,1966,5,4,124,4-May-66,,Los Angeles,Foothills below Mount Baldy.,34.18466667,-117.5817778,18000,,,cch2,urn:uuid:6fa6d39e-162c-49a5-9b9a-70e9849180de,http://cch2.org/portal/collections/individual/index.php?occid=1294884
1294885,CSUSB,CSUSB91439,CSUSB-118,Nemophila menziesii,205099,4/8/1966,1966,4,8,98,8-Apr-66,,San Diego,"Highway 78, 2.5 miles west of Julian.",33.08,-116.64139,1000,1159,3800,cch2,urn:uuid:87e2852d-56a7-4d49-accc-a974cb1d4f0c,http://cch2.org/portal/collections/individual/index.php?occid=1294885
1294886,CSUSB,CSUSB91440,CSUSB-119,Nemophila menziesii,205099,3/14/1966,1966,3,14,73,14-Mar-66,,Los Angeles,"500 yards along a path, end of 14th Street in the Puente Hills; found in a rocky, grassy slope.",34.02444444,-117.93875,3000,213,700,cch2,urn:uuid:f19e3d36-e88c-4b79-8e02-426771b46cfa,http://cch2.org/portal/collections/individual/index.php?occid=1294886
1294887,CSUSB,CSUSB91441,CSUSB-120,Nemophila menziesii var. menziesii,205103,4/21/1965,1965,4,21,111,21-Apr-65,,Riverside,About 1 mile southwest of Lake Matthews Dam; near roadside on steep slope; Riverside.,33.83022222,-117.478,1000,324,,cch2,urn:uuid:6a2aecb9-2437-4ecf-9612-913f061acd93,http://cch2.org/portal/collections/individual/index.php?occid=1294887
1294888,CSUSB,CSUSB91442,CSUSB-121,Nemophila menziesii var. menziesii,205103,3/3/1966,1966,3,3,62,3-Mar-66,,Riverside,"Bottom of canyon at east end of Blain Street, in the Box Springs Mountains in Riverside (city).",33.98319444,-117.3068056,1000,274,900,cch2,urn:uuid:2fcdb375-a706-45e1-85e3-93a6125fd0bd,http://cch2.org/portal/collections/individual/index.php?occid=1294888
1294889,CSUSB,CSUSB91443,CSUSB-122,Nemophila menziesii var. menziesii,205103,2/20/1966,1966,2,20,51,20-Feb-66,,Riverside,"Arlington Ave., 1 mile east of Victoria Street, 100 yards south of road. City of Riverside.",33.94616667,-117.3796389,300,305,1000,cch2,urn:uuid:1b237d18-a4d8-445c-a0e8-fa89c820e760,http://cch2.org/portal/collections/individual/index.php?occid=1294889
1294890,CSUSB,CSUSB91444,CSUSB-123,Nemophila menziesii,205099,4/27/1975,1975,4,27,117,27-Apr-75,,Riverside,Juniper Flats Rd. and Highway 74 at Homeland.,33.74366667,-117.1144722,200,543,1780,cch2,urn:uuid:c529f00b-e72a-4b63-b977-1a40ca319319,http://cch2.org/portal/collections/individual/index.php?occid=1294890
1295906,CSUSB,CSUSB91437,CSUSB-2020,Nemophila menziesii subsp. integrifolia,210481,6/4/1979,1979,6,4,155,4-Jun-79,Flowering,San Bernardino,"San Bernardino Mts., Crestline, Darfo Dr. NE-facing roadside of bank growing in shade from shrubs",34.24738889,-117.2643889,200,1433,4700,cch2,urn:uuid:f5bb67e9-41a5-4755-ad35-1386ce392f02,http://cch2.org/portal/collections/individual/index.php?occid=1295906
1297110,CSUSB,CSUSB90239,CSUSB-3251,Nemophila menziesii subsp. integrifolia,210481,3/29/1977,1977,3,29,88,29-Mar-77,Flowering,San Bernardino,Lytle Creek,34.23988889,-117.5268889,4000,,,cch2,urn:uuid:3048274e-8eb5-457d-a5cf-b977b0e00ae2,http://cch2.org/portal/collections/individual/index.php?occid=1297110
1297198,CSUSB,CSUSB90327,CSUSB-3341,Nemophila menziesii subsp. integrifolia,210481,5/20/1978,1978,5,20,140,20-May-78,Flowering & Fruiting,San Bernardino,Lytle Creek,34.23988889,-117.5268889,4000,,,cch2,urn:uuid:f24ed196-e3d4-4bd9-93af-d8ff6c7439cc,http://cch2.org/portal/collections/individual/index.php?occid=1297198
1297338,CSUSB,CSUSB90466,CSUSB-3481,Nemophila menziesii var. menziesii,205103,4/18/1976,1976,4,18,109,18-Apr-76,Flowering,San Bernardino,Lytle Creek,34.23988889,-117.5268889,4000,,,cch2,urn:uuid:b84d63bd-c6a2-42f2-9ed8-3e16d76bddb3,http://cch2.org/portal/collections/individual/index.php?occid=1297338
1298941,DAV,DAV300345,DAV134660; UCD13104,Nemophila menziesii,205099,5/10/1973,1973,5,10,130,10-May-73,,Sonoma,"CALIFORNIA: Sonoma County, Bodega Bay Head.",38.312739,-123.064749,1765,,,cch2,urn:uuid:62ddfa6f-ab86-4605-bee3-482abb7c7dfa,http://cch2.org/portal/collections/individual/index.php?occid=1298941
1298980,DAV,DAV300342,DAV134477; UCD13145,Nemophila menziesii,205099,4/11/1981,1981,4,11,101,11-Apr-81,,Lake County,"CALIFORNIA: Lake CO. Northside of highway 20, 1 mile northwest of Glenhaven. Elev. 1800'.",39.03859,-122.74535,500,,,cch2,urn:uuid:d5f01257-c5a7-4172-abf1-f1d7d0a72543,http://cch2.org/portal/collections/individual/index.php?occid=1298980
1299846,DAV,DAV300343,DAV140807; UCD15305,Nemophila menziesii,205099,4/6/1985,1985,4,6,96,6-Apr-85,,Sutter County,"Sutter County: Sutter Buttes, Dean Place;",,,,213,700ft,cch2,urn:uuid:74838afb-a4d6-4ecb-bbbc-db44665afda0,http://cch2.org/portal/collections/individual/index.php?occid=1299846
1299939,DAV,DAV300327,DAV141551; UCD15536,Nemophila menziesii,205099,5/6/1989,1989,5,6,126,6-May-89,,Amador County,Amador County: Town of Volcano.,,,,107,350ft,cch2,urn:uuid:4a686dc7-a43d-4cef-9029-af3fa409edcf,http://cch2.org/portal/collections/individual/index.php?occid=1299939
1301674,DAV,DAV300406,DAV157886; UCD19423,Nemophila menziesii var. menziesii,205103,2/7/2000,2000,2,7,38,7-Feb-00,,Yolo County,"Grasslands Regional Park. East of Davis, from intersection of I-80 and Mace Blvd., 3.5 mi. south on Mace Blvd.(County Road 104), thence east 1/4 mi along unpaved entrance road, then south about 200 yd.",38.492222,-121.686667,,12,40ft,cch2,urn:uuid:c8b1a3d6-1189-4364-b8d1-315a43ea48ce,http://cch2.org/portal/collections/individual/index.php?occid=1301674
1304479,DAV,AHUC100007,AHUC038435; UCD32468,Nemophila menziesii,205099,2/24/1952,1952,2,24,55,24-Feb-52,,Fresno County,"Fresno County, 0.5 mile southwest of Navalencia.",,,,122,400ft,cch2,urn:uuid:46816f8a-c36c-4afb-93db-117d70d46190,http://cch2.org/portal/collections/individual/index.php?occid=1304479
1306702,DAV,AHUC100004,AHUC038262; UCD35080,Nemophila menziesii,205099,4/11/1941,1941,4,11,101,11-Apr-41,,Mariposa County,"Mariposa County: Near Agua Frio Creek along State Highway 140, about 6 miles west of Mariposa.",,,,610,2000ft,cch2,urn:uuid:4d92aa9e-a116-41f9-bd61-4909e6a648d9,http://cch2.org/portal/collections/individual/index.php?occid=1306702
1307535,DAV,AHUC100006,AHUC038786; UCD35998,Nemophila menziesii,205099,4/24/1949,1949,4,24,114,24-Apr-49,,Tuolumne County,"Tuolumne County, Columbia, sloping towards Vallecito, at Stanislaus River.",38.038573,-120.456538,1000,305,1000ft,cch2,urn:uuid:ade19c93-45aa-4913-a5cf-b327bc03ba1d,http://cch2.org/portal/collections/individual/index.php?occid=1307535
1308975,DAV,AHUC100008,AHUC039326; UCD37530,Nemophila menziesii,205099,3/15/1955,1955,3,15,74,15-Mar-55,,Mendocino County,"Mendocino County, Hopland Field Station, Little Buck Pasture.",,,,,,cch2,urn:uuid:d50a776c-4d0b-4879-a2dd-8f80c1c538af,http://cch2.org/portal/collections/individual/index.php?occid=1308975
1310851,DAV,DAV300398,DAV186631; UCD40102,Nemophila menziesii var. menziesii,205103,5/23/1970,1970,5,23,143,23-May-70,,Calaveras County,"Stanislaus River Canyon. Along Hunter's Road, between Hathaway Pines and NF Stanislaus River.",,,,732,2400ft,cch2,urn:uuid:322ec8ff-bdf5-4ca9-a6e5-055d151f4a0f,http://cch2.org/portal/collections/individual/index.php?occid=1310851
1322837,DAV,DAV300374,DAV176093; UCD56723,Nemophila menziesii,205099,3/23/2007,2007,3,23,82,23-Mar-07,,Yolo County,"Yolo Co.: Tuleyome Ireland Ranch. In inner coast range northwest of the City of Winters between Salt Creek and Enos Creek, just north of Wild Cow Mountain. SW portion of ranch.",38.588833,-122.124167,,703,2307ft,cch2,urn:uuid:e7b88e51-02ab-4e4a-9a5f-84272d546c87,http://cch2.org/portal/collections/individual/index.php?occid=1322837
1335471,DAV,DAV300375,DAV182527; UCD78281,Nemophila menziesii,205099,3/25/2008,2008,3,25,85,25-Mar-08,,San Luis Obispo County,San Luis Obispo Co.: North of Carrizo Plain National Monument. Along Soda Lake Road between College and Belmont Streets.,35.30720986,-119.9862307,,591,1940ft,cch2,urn:uuid:04c99d85-3edb-4649-ba23-d34d7349dd35,http://cch2.org/portal/collections/individual/index.php?occid=1335471
1337092,DAV,DAV300335,DAV185928; UCD82053,Nemophila menziesii,205099,4/22/1972,1972,4,22,113,22-Apr-72,,Napa County,Napa Co.: Pope Valley.,38.6151,-122.4282,5200,,,cch2,urn:uuid:bb0e4f66-f768-462e-a59e-a4defb72df4b,http://cch2.org/portal/collections/individual/index.php?occid=1337092
1343797,DAV,DAV300324,DAV190667; UCD89680,Nemophila menziesii,205099,4/24/2006,2006,4,24,114,24-Apr-06,,Yolo County,"Yolo County: McLaughlin Reserve; Davis Creek Reservoir, Hobbit Hill.",38.8625,-122.358639,,467,1531ft,cch2,urn:uuid:8c6b9849-0f1f-45be-af0e-4a0969805a24,http://cch2.org/portal/collections/individual/index.php?occid=1343797
1348771,DAV,DAV300401,DAV192052; UCD95081,Nemophila menziesii var. menziesii,205103,4/30/2011,2011,4,30,120,30-Apr-11,,El Dorado County,El Dorado County: North of Cameron Park. Pine Hill Preserve. Kanaka Valley Unit. Kanaka Valley near main dirt road.,38.749444,-121.024444,,305,1000ft,cch2,urn:uuid:637e1d4d-1fbd-4b12-be83-0ac0e814dc6b,http://cch2.org/portal/collections/individual/index.php?occid=1348771
1355580,DAV,DAV300397,DAV193293; UCD102389,Nemophila menziesii var. menziesii,205103,4/24/2002,2002,4,24,114,24-Apr-02,,Contra Costa County,Contra Costa County: Mount Diablo State Park. North Peak Road to North Peak.,37.866667,-121.883333,,890,,cch2,urn:uuid:4380fea4-bef8-4520-a4f4-56411b0fdc13,http://cch2.org/portal/collections/individual/index.php?occid=1355580
1371106,DAV,DAV300400,DAV195905; UCD118354,Nemophila menziesii var. menziesii,205103,5/5/2012,2012,5,5,126,5-May-12,,Napa County,"Napa County: Las Posadas State Experimental Forest. Northeastern part of property, on Recreation flat.",38.561667,-122.403333,,388,1272ft,cch2,urn:uuid:1f5d4497-9b5f-4bd0-869b-64b6194046f1,http://cch2.org/portal/collections/individual/index.php?occid=1371106
1372670,DAV,DAV300325,DAV42689; UCD120212,Nemophila menziesii,205099,3/24/1962,1962,3,24,83,24-Mar-62,,Placer County,Placer County: 6 miles west of Roseville.,38.72944444,-121.3972222,,,,cch2,urn:uuid:690aad90-b222-487a-a5d5-44fbe9e15105,http://cch2.org/portal/collections/individual/index.php?occid=1372670
1372671,DAV,DAV300326,DAV4543; UCD120213,Nemophila menziesii,205099,2/21/1942,1942,2,21,52,21-Feb-42,,Lake County,"Lake County: At the west bank of Clear Lake, 3 mi. south of Lucerne along Calif. #20.",,,,,,cch2,urn:uuid:02bfdf11-06c8-403f-b430-7c07bbc849e3,http://cch2.org/portal/collections/individual/index.php?occid=1372671
1372672,DAV,DAV300328,DAV128240; UCD120214,Nemophila menziesii,205099,4/10/1995,1995,4,10,100,10-Apr-95,,Napa County,Napa County: Along Chiles Valley/Pope Valley Rd. approx. 2 m. S of Pope Canyon Rd. intersection. North Coast Biodiversity Arena.,38.616667,-122.383333,,175,,cch2,urn:uuid:7a1bde19-39bc-4de2-8571-605f00712b06,http://cch2.org/portal/collections/individual/index.php?occid=1372672
1372673,DAV,DAV300329,DAV83325; UCD120215,Nemophila menziesii,205099,4/7/1978,1978,4,7,97,7-Apr-78,,Los Angeles County,Los Angeles County: West side of Sierra Highway just north of Pearblossom Highway.,,,,914,3000ft,cch2,urn:uuid:93cfdf22-0931-4fc8-bf5e-86da116612b0,http://cch2.org/portal/collections/individual/index.php?occid=1372673
1372674,DAV,DAV300330,DAV82950; UCD120216,Nemophila menziesii,205099,4/19/1978,1978,4,19,109,19-Apr-78,,Los Angeles County,Los Angeles County: Verdugo Mountains on fireroad from Stough Canyon to La Crescenta.,,,,549,1800ft,cch2,urn:uuid:8dfe3135-f360-48af-bfa3-03abe1524694,http://cch2.org/portal/collections/individual/index.php?occid=1372674
1372675,DAV,DAV300331,DAV79117; UCD120217,Nemophila menziesii,205099,4/26/1975,1975,4,26,116,26-Apr-75,,Riverside County,Riverside County: Mayhew Canyon 1.5 mi. southeast of Glen Ivy on Highway 71.,33.7627,-117.4655,700,335,1100ft,cch2,urn:uuid:1ca372bc-4956-45ab-8218-0e54911acf93,http://cch2.org/portal/collections/individual/index.php?occid=1372675
1372842,DAV,DAV300366,DAV51338; UCD120074,Nemophila menziesii,205099,3/17/1958,1958,3,17,76,17-Mar-58,,Stanislaus County,Stanislaus County: In vicinity of La Grange.,37.66423,-120.46039,806,,,cch2,urn:uuid:22e9ee3b-00cd-47a7-8695-4a832b2c0dd9,http://cch2.org/portal/collections/individual/index.php?occid=1372842
1372843,DAV,DAV300367,DAV42687; UCD120075,Nemophila menziesii,205099,4/8/1962,1962,4,8,98,8-Apr-62,,Butte County,"Butte County: On Table Mountain, north of Oroville.",39.598253,-121.557489,3100,,,cch2,urn:uuid:d5213fa6-0513-4a68-9ace-c11836f75dba,http://cch2.org/portal/collections/individual/index.php?occid=1372843
1372844,DAV,DAV300368,DAV11776; UCD120076,Nemophila menziesii,205099,3/28/1952,1952,3,28,88,28-Mar-52,,Riverside County,Riverside County: Perris.,33.78999,-117.22652,5504,443,1455ft,cch2,urn:uuid:49a8296d-9fe9-4dc4-aa1e-6385c98b2a5a,http://cch2.org/portal/collections/individual/index.php?occid=1372844
1372845,DAV,DAV300369,DAV19650; UCD120077,Nemophila menziesii,205099,2/15/1945,1945,2,15,46,15-Feb-45,,Yolo County,"Yolo County: Putah Creek Canyon, west of Winters.",38.5017,-122.02626,804,,,cch2,urn:uuid:0c5bcc7d-779d-4949-a0c5-498fd2be7242,http://cch2.org/portal/collections/individual/index.php?occid=1372845
1372846,DAV,DAV300370,DAV20164; UCD120078,Nemophila menziesii,205099,3/5/1932,1932,3,5,65,5-Mar-32,,Madera County,Madera County: 5 mi. W. Coarsegold.,,,,549,1800ft,cch2,urn:uuid:0cd5ad6a-a2a8-4136-af06-bc2b20967432,http://cch2.org/portal/collections/individual/index.php?occid=1372846
1372847,DAV,DAV300371,DAV36112; UCD120079,Nemophila menziesii,205099,3/26/1964,1964,3,26,86,26-Mar-64,,San Bernardino County,San Bernardino County: Dry Morongo Valley.,34.0457,-116.6202,2000,,,cch2,urn:uuid:95926375-cffa-42ae-b2ce-487f3f42f76a,http://cch2.org/portal/collections/individual/index.php?occid=1372847
1372848,DAV,DAV300372,DAV156069; UCD120080,Nemophila menziesii,205099,4/25/1993,1993,4,25,115,25-Apr-93,,Kern County,"Kern County: Tehachapi Mountains., 1 mile N of Tehachapi Loop.",35.212387,-118.545448,5000,1676,5500ft,cch2,urn:uuid:97ce0319-7dbb-41a8-8472-14135d240a97,http://cch2.org/portal/collections/individual/index.php?occid=1372848
1372849,DAV,DAV300373,DAV42690; UCD120081,Nemophila menziesii,205099,4/6/1966,1966,4,6,96,6-Apr-66,,Trinity County,"Trinity County: Slattery Pond, just off U.S. Highway 299, 7 miles west of Weaverville.",,,,640,2100ft,cch2,urn:uuid:6bb34b5b-17b5-4b15-8837-59544f654943,http://cch2.org/portal/collections/individual/index.php?occid=1372849
1372850,DAV,AHUC100005,AHUC35549; UCD120082,Nemophila menziesii,205099,4/11/1941,1941,4,11,101,11-Apr-41,,Mariposa County,"Mariposa County: 9 miles from Mariposa, along State Hwy. 140.",,,,610,2000ft,cch2,urn:uuid:dd91da32-e966-4c98-b9bb-1902197a4f9a,http://cch2.org/portal/collections/individual/index.php?occid=1372850
1372851,DAV,AHUC100009,AHUC37245; UCD120083,Nemophila menziesii,205099,5/2/1977,1977,5,2,122,2-May-77,,Mendocino County,"Mendocino County: 3/4 mile n.w. Cleone, north of Fort Bragg.",,,,,,cch2,urn:uuid:1dc7e2a5-38fc-483d-85c3-48e9efcfc308,http://cch2.org/portal/collections/individual/index.php?occid=1372851
1372852,DAV,DAV300376,DAV42691; UCD120084,Nemophila menziesii,205099,4/2/1962,1962,4,2,92,2-Apr-62,,Solano County,"Solano County: East side of Pleasants Valley Road, 0.6 mile south of State Highway 128.",,,,244,700 - 800ft,cch2,urn:uuid:4c8c82c5-4739-4f1b-a434-021b397d8084,http://cch2.org/portal/collections/individual/index.php?occid=1372852
1372853,DAV,DAV300377,DAV11775; UCD120085,Nemophila menziesii,205099,4/8/1951,1951,4,8,98,8-Apr-51,,Napa County,"Napa County: 6.1 miles southwest of Monticello, on Napa Road.",,,,,,cch2,urn:uuid:ac768d52-fc4d-41de-a2b3-5a6834281a11,http://cch2.org/portal/collections/individual/index.php?occid=1372853
1372966,DAV,DAV300333,DAV98522; UCD120218,Nemophila menziesii,205099,5/8/1973,1973,5,8,128,8-May-73,,Fresno County,Fresno County: 1.1 mi. past Trimmer Ranger Station on Trimmer Springs Rd. coming from Trimmer.,,,,,,cch2,urn:uuid:3c93e9b2-3149-43b3-ab4f-c959d100fe97,http://cch2.org/portal/collections/individual/index.php?occid=1372966
1372967,DAV,DAV300334,DAV96916; UCD120219,Nemophila menziesii,205099,4/22/1974,1974,4,22,112,22-Apr-74,,San Luis Obispo County,"San Luis Obispo County: In Commatti Canyon (aka Camatta Canyon), 1.1 miles N of CA 58.",35.440416,-120.287907,1000,,,cch2,urn:uuid:f27fe768-c4af-4f51-b742-b83dc0dd47b0,http://cch2.org/portal/collections/individual/index.php?occid=1372967
1372968,DAV,DAV300336,DAV29274; UCD120220,Nemophila menziesii,205099,3/29/1959,1959,3,29,88,29-Mar-59,,El Dorado County,"El Dorado County: State Highway 49, 2 1/2 miles southeast of Pilot Hill.",,,,,,cch2,urn:uuid:3e927f84-fa49-4283-8cd1-1713a1f83d9d,http://cch2.org/portal/collections/individual/index.php?occid=1372968
1372969,DAV,DAV300337,DAV42686; UCD120221,Nemophila menziesii,205099,5/7/1963,1963,5,7,127,7-May-63,,Amador County,"Amador County: Near Cook's Station, State Highway 88.",,,,914,3000ft,cch2,urn:uuid:f98e7ecd-8d46-4682-8c3a-750bf371eb90,http://cch2.org/portal/collections/individual/index.php?occid=1372969
1372970,DAV,DAV300339,DAV34824; UCD120222,Nemophila menziesii,205099,4/7/1922,1922,4,7,97,7-Apr-22,,San Bernardino County,"San Bernardino County: Three miles southwest of Hesperia, Mojave Desert.",34.37064,-117.31236,2683,,,cch2,urn:uuid:c3aca77e-4728-4f10-ac09-a2b11c7f2203,http://cch2.org/portal/collections/individual/index.php?occid=1372970
1372971,DAV,DAV300338,DAV33533; UCD120223,Nemophila menziesii,205099,3/24/1961,1961,3,24,83,24-Mar-61,,San Bernardino County,San Bernardino County: Barett Canyon one mile north of Ranger Station in San Antonio Canyon on Old Road. San Bernardino Mt. Range.,34.193742,-117.676792,1700,762,2500ft,cch2,urn:uuid:ce569366-249d-41ff-909e-c72d6886bcc7,http://cch2.org/portal/collections/individual/index.php?occid=1372971
1372972,DAV,DAV300340,DAV4545; UCD120224,Nemophila menziesii,205099,4/2/1933,1933,4,2,92,2-Apr-33,,Riverside County,Riverside County: Box Springs Hills.,33.98152,-117.29485,3072,,,cch2,urn:uuid:96ab1da0-dc3e-476b-a5a0-653891438927,http://cch2.org/portal/collections/individual/index.php?occid=1372972
1372973,DAV,DAV300341,DAV42692; UCD120225,Nemophila menziesii,205099,4/12/1965,1965,4,12,102,12-Apr-65,,Tulare County,Tulare County: 1 mile northeast of gravel pit on Nigger Creek Road.,,,,160,525ft,cch2,urn:uuid:fc7724bf-1967-4aa8-8bab-a4f3d39c5855,http://cch2.org/portal/collections/individual/index.php?occid=1372973
1372974,DAV,DAV300344,DAV131608; UCD120226,Nemophila menziesii,205099,3/19/1993,1993,3,19,78,19-Mar-93,,San Luis Obispo County,"San Luis Obispo County: Carrizo Plain Natural Area, grassland along Soda Lake Rd., 2.3 miles NW of intersection with dirt road leading to Painted Rock and Education Center.",35.207474,-119.866929,1000,,,cch2,urn:uuid:0e6d9ec4-5479-49d2-86c0-b4f3ff0702ae,http://cch2.org/portal/collections/individual/index.php?occid=1372974
1372975,DAV,AHUC100010,AHUC19422; UCD120227,Nemophila menziesii,205099,3/23/1940,1940,3,23,83,23-Mar-40,,Fresno County,Fresno County: Piedra.,,,,,,cch2,urn:uuid:17729722-bed4-4404-a8a1-2c131977a937,http://cch2.org/portal/collections/individual/index.php?occid=1372975
1372976,DAV,DAV300346,DAV16008; UCD120228,Nemophila menziesii,205099,4/7/1945,1945,4,7,97,7-Apr-45,,Santa Barbara County,"Santa Barbara County: Woodland of Rattlesnake Canyon, Santa Barbara.",34.4575,-119.6915,1500,305,1000ft,cch2,urn:uuid:6d941f3b-e72a-4a6d-8b52-b2635eaca987,http://cch2.org/portal/collections/individual/index.php?occid=1372976
1372977,DAV,DAV300347,DAV104736; UCD120229,Nemophila menziesii,205099,3/18/1950,1950,3,18,77,18-Mar-50,,Kern County,"Kern County: Along Soda Lake Road to Carrizo Plain, about 0.8 mile off Highway 399. Near San Luis Obispo County line.",34.9712,-119.4556,500,,,cch2,urn:uuid:c64a28e4-f08a-43a0-8a83-7a7fa1f973e1,http://cch2.org/portal/collections/individual/index.php?occid=1372977
1372978,DAV,DAV300348,DAV90859; UCD120230,Nemophila menziesii,205099,4/19/1980,1980,4,19,110,19-Apr-80,,Lake County,"Lake County: Coldsprings Campground, along access road to Indian Valley Dam. In lower part of campground.",39.1,-122.4955556,805,,,cch2,urn:uuid:8c6e9000-1ff7-4390-99b5-494578518103,http://cch2.org/portal/collections/individual/index.php?occid=1372978
1372979,DAV,AHUC100011,AHUC19508; UCD120231,Nemophila menziesii,205099,4/1/1940,1940,4,1,92,1-Apr-40,,Yolo County,Yolo County: Putah.,,,,,,cch2,urn:uuid:35d4a46a-5886-4ee9-95ad-e848b98926a0,http://cch2.org/portal/collections/individual/index.php?occid=1372979
1372980,DAV,DAV300349,DAV38751; UCD120232,Nemophila menziesii,205099,3/9/1967,1967,3,9,68,9-Mar-67,,Alameda County,Alameda County: One mile southeast of Verona.,37.619072,-121.864916,1500,,,cch2,urn:uuid:f7add521-2bf7-4f10-8035-4628703f5c0e,http://cch2.org/portal/collections/individual/index.php?occid=1372980
1372981,DAV,DAV300350,DAV89114; UCD120233,Nemophila menziesii,205099,4/11/1965,1965,4,11,101,11-Apr-65,,Placer County,Placer County: 1 mile N. of Marysville on Hwy. 99 E.,39.156849,-121.635633,3726,,,cch2,urn:uuid:da3a86af-5868-4587-8544-e8eab7bd4efa,http://cch2.org/portal/collections/individual/index.php?occid=1372981
1372982,DAV,DAV300351,DAV139949; UCD120234,Nemophila menziesii,205099,4/7/1998,1998,4,7,97,7-Apr-98,,Napa County,Napa County: Along Rt. 128 at road marker 24/80.,,,,,,cch2,urn:uuid:da0c9321-8e35-4dd8-9bad-1b0fa9237ad4,http://cch2.org/portal/collections/individual/index.php?occid=1372982
1372983,DAV,DAV300353,DAV4544; UCD120235,Nemophila menziesii,205099,4/5/1928,1928,4,5,96,5-Apr-28,,Napa County,Napa County: Monticello.,,,,,,cch2,urn:uuid:255d8fde-8b5e-4d8c-bb46-d1d94aaa4962,http://cch2.org/portal/collections/individual/index.php?occid=1372983
1372984,DAV,DAV300352,DAV42688; UCD120236,Nemophila menziesii,205099,3/29/1961,1961,3,29,88,29-Mar-61,,Colusa County,Colusa County: South of Bear Valley; 3 miles north of junction of State Highways 16 and 20.,,,,,,cch2,urn:uuid:6934ccfd-58f0-4846-853f-849af28b8930,http://cch2.org/portal/collections/individual/index.php?occid=1372984
1372985,DAV,DAV300354,DAV69279; UCD120237,Nemophila menziesii,205099,3/23/1967,1967,3,23,82,23-Mar-67,,Napa County,Napa County: c. 1 mi S of Spanish Flat.,38.52235,-122.21685,400,168,550ft,cch2,urn:uuid:f36d77a5-d561-45eb-9cc6-05787d560f7d,http://cch2.org/portal/collections/individual/index.php?occid=1372985
1372986,DAV,DAV300383,DAV157277; UCD120238,Nemophila menziesii var. atomaria,205101,5/8/1993,1993,5,8,128,8-May-93,,Sonoma County,Sonoma County: About 40 air miles N of San Francisco; about 11 air miles E of Santa Rosa and 2.5 air miles NE of Kenwood. In Adobe Canyon N of Sugarloaf Ridge and S of Red Mtn 1 mile.,38.436744,-122.514134,1000,,,cch2,urn:uuid:02d0598c-f0c5-4204-be0a-983a1f3a92fe,http://cch2.org/portal/collections/individual/index.php?occid=1372986
1372987,DAV,DAV300382,DAV9629; UCD120239,Nemophila menziesii var. atomaria,205101,2/18/1947,1947,2,18,49,18-Feb-47,,Napa County,Napa County: 14 miles north of Napa.,,,,,,cch2,urn:uuid:83d8f005-4ae1-476a-8056-0df59e92f648,http://cch2.org/portal/collections/individual/index.php?occid=1372987
1372988,DAV,DAV300390,DAV91824; UCD120240,Nemophila menziesii var. atomaria,205101,8/30/1975,1975,8,30,242,30-Aug-75,,Sonoma County,"Sonoma County: Property of Oceanic Properties, Unit 7 Owners' Map, Sea Ranch, near State Highway 1.",38.71519,-123.454453,1500,,,cch2,urn:uuid:4a719c6d-11f0-4e0a-8127-bda67b24eaf7,http://cch2.org/portal/collections/individual/index.php?occid=1372988
1372989,DAV,DAV300389,DAV117012; UCD120241,Nemophila menziesii var. atomaria,205101,2/21/1988,1988,2,21,52,21-Feb-88,,Sonoma County,Sonoma County: South of Mt. St. Helena. Near Kenwood.,38.426644,-122.558797,2500,,,cch2,urn:uuid:a8eb0117-2598-4755-9f12-8029fdb698bd,http://cch2.org/portal/collections/individual/index.php?occid=1372989
1372990,DAV,DAV300388,DAV149312; UCD120242,Nemophila menziesii var. atomaria,205101,3/14/1998,1998,3,14,73,14-Mar-98,,Sonoma County,"Sonoma County: Foote Ranch, NW base of Mt. St. Helena, corner of Ida Clayton Rd. and Hwy 128. Near 2nd pond on Foote Creek. North Coast Biodiversity Arena.",38.638058,-122.681057,500,110,,cch2,urn:uuid:977b7225-b80d-4577-94ea-5ea0877e4928,http://cch2.org/portal/collections/individual/index.php?occid=1372990
1372991,DAV,DAV300387,DAV150356; UCD120243,Nemophila menziesii var. atomaria,205101,4/17/1993,1993,4,17,107,17-Apr-93,,Sonoma County,"Sonoma County: About 40 air miles N of San Francisco, 11 air miles E of Santa Rosa, and 2.5 air miles NE of Kenwood. In Adobe Canyon N of Sugarloaf Ridge and S of Red Mtn. 1 mile. Near visitor center.",38.442184,-122.527836,1000,366,1200ft,cch2,urn:uuid:843bbbd5-790a-4568-b9fd-39b07f95cec6,http://cch2.org/portal/collections/individual/index.php?occid=1372991
1372992,DAV,DAV300396,DAV29220; UCD120244,Nemophila menziesii var. atomaria,205101,3/22/1957,1957,3,22,81,22-Mar-57,,Solano County,"Solano County: North side of road to Green Valley Falls, 1 mile west of Rockville.",,,,,,cch2,urn:uuid:84189b08-b33c-447b-9de5-613245aba033,http://cch2.org/portal/collections/individual/index.php?occid=1372992
1372993,DAV,DAV300395,DAV88470; UCD120245,Nemophila menziesii var. integrefolia,,6/3/1962,1962,6,3,154,3-Jun-62,,San Bernardino County,"San Bernardino County: Near Lake Arrowhead Hospital, N shore.",34.27027,-117.18365,1479,1585,5200ft,cch2,urn:uuid:46607841-aef5-4079-946e-96b350853d32,http://cch2.org/portal/collections/individual/index.php?occid=1372993
1372994,DAV,DAV300394,DAV83103; UCD120246,Nemophila menziesii var. integrefolia,,4/1/1978,1978,4,1,91,1-Apr-78,,Los Angeles County,Los Angeles County: West side of Sierra Hwy. and 1 mile north of State Hwy. 14.,34.512875,-118.236764,500,988,3240ft,cch2,urn:uuid:0c68f560-de7f-4763-97cb-af58692ab019,http://cch2.org/portal/collections/individual/index.php?occid=1372994
1372995,DAV,DAV300393,DAV160599; UCD120247,Nemophila menziesii var. integrefolia,,3/28/1993,1993,3,28,87,28-Mar-93,,San Bernardino County,"San Bernardino County: San Bernardino Mtns.: Waterman Canyon, 1 km W of Arrowhead Hot Spr. Hotel, at and below the 1st stream Xing of Old Waterman C. Rd. Along E cyn wall.",34.188765,-117.273261,400,600,,cch2,urn:uuid:bc4d29c9-bf24-4ee4-aef3-7b064d173d99,http://cch2.org/portal/collections/individual/index.php?occid=1372995
1372996,DAV,DAV300392,DAV79116; UCD120248,Nemophila menziesii var. integrefolia,,4/27/1974,1974,4,27,117,27-Apr-74,,Los Angeles County,"Los Angeles County: Evey Canyon, a side canyon of San Antonio Canyon. San Gabriel Mts. Mt. Range.",34.167795,-117.68615,700,732,2400ft,cch2,urn:uuid:339de8d0-757a-4ab1-8aab-e84fbffc1140,http://cch2.org/portal/collections/individual/index.php?occid=1372996
1372997,DAV,DAV300391,DAV172683; UCD120249,Nemophila menziesii var. integrefolia,,4/15/1990,1990,4,15,105,15-Apr-90,,Placer County,Placer County: 22587 Sunset Ridge Dr. Lake of the Pines.,39.049172,-121.065829,32,366,1200ft,cch2,urn:uuid:ac56736b-dc4f-4860-8706-8f9fbcde907f,http://cch2.org/portal/collections/individual/index.php?occid=1372997
1372998,DAV,DAV300404,DAV61122; UCD120250,Nemophila menziesii var. menziesii,205103,4/2/1971,1971,4,2,92,2-Apr-71,,San Bernardino County,"San Bernardino County: Day Canyon, San Bernardino National Forest.",34.201929,-117.5519,3500,,,cch2,urn:uuid:0c94e00a-03e0-45af-81ff-0554f73a6abb,http://cch2.org/portal/collections/individual/index.php?occid=1372998
1372999,DAV,DAV300402,DAV171386; UCD120251,Nemophila menziesii var. menziesii,205103,4/20/2006,2006,4,20,110,20-Apr-06,,El Dorado County,"El Dorado County: Northern Sierra Nevada: Between N and Middle forks of Cosumnes River; junction of Sand Ridge Road and Cutaway Lane, 2.1 mi SW of Somerset.",38.631944,-120.722222,,665,,cch2,urn:uuid:021bc7e5-7aab-49a6-a9d3-472f8b0e588b,http://cch2.org/portal/collections/individual/index.php?occid=1372999
1373000,DAV,DAV300403,DAV176595; UCD120252,Nemophila menziesii var. menziesii,205103,4/23/2007,2007,4,23,113,23-Apr-07,,Amador County,Amador County: Northern Sierra Nevada Mountains: along Bell Road beside Plymouth Creek just east of CA-49 in the vicinity of Enterprise.,38.540278,-120.840833,,302,,cch2,urn:uuid:93d01389-0213-4f15-a713-91323a9fe287,http://cch2.org/portal/collections/individual/index.php?occid=1373000
1373001,DAV,DAV300399,DAV150026; UCD120253,Nemophila menziesii var. menziesii,205103,4/24/1993,1993,4,24,114,24-Apr-93,,Sonoma County,"Sonoma County: Sugarloaf Ridge State Park. About 50 air miles N of San Francisco, 10 air miles E of Santa Rosa, 2.5 air miles NE of Kenwood and 18 air miles NW of Napa. Along Hillside Trail.",38.437955,-122.498336,1000,381,1250ft,cch2,urn:uuid:0a37c3be-5608-468a-9c3c-1f89900b25ed,http://cch2.org/portal/collections/individual/index.php?occid=1373001
1373002,DAV,DAV300405,DAV153370; UCD120254,Nemophila menziesii var. menziesii,205103,5/21/1995,1995,5,21,141,21-May-95,,Napa County,Napa County: South side of Highway 128 about 3 mi. west of Wragg Canyon Rd.,38.433333,-122.166667,,250,,cch2,urn:uuid:83a275d9-9798-42c4-8ed4-f3d4585b5659,http://cch2.org/portal/collections/individual/index.php?occid=1373002
1373003,DAV,DAV300407,DAV140305; UCD120255,Nemophila menziesii var. menziesii,205103,5/19/1995,1995,5,19,139,19-May-95,,Placer County,"Placer County: Near a road cut about 1 km from the trailhead of the Steven's Trail that descends the north fork of the American River Canyon outside of Colfax, south of I-80.",39.083333,-120.883333,,400,,cch2,urn:uuid:e1227e85-3058-437d-bc29-4ceada5f9528,http://cch2.org/portal/collections/individual/index.php?occid=1373003
1378925,DAV,DAV300365,DAV40076; UCD126443,Nemophila menziesii,205099,3/9/1961,1961,3,9,68,9-Mar-61,,Stanislaus County,Stanislaus County: Vicinity of La Grange. Between Lower and Upper Dominici Creeks.,,,,,,cch2,urn:uuid:4883ebb0-dfb6-4609-85e1-a6a7c47f2944,http://cch2.org/portal/collections/individual/index.php?occid=1378925
1384122,DAV,DAV300384,DAV200214; UCD131927,Nemophila menziesii var. menziesii,205103,4/14/2013,2013,4,14,104,14-Apr-13,,Lake County,"Lake County: Clear Lake State Park. NE of Kelseyville. Lower northern slope of Mount Konocti. South side of park, south of Soda Bay Road. South of undeveloped road that goes southeast from Glebe Road past the gate.",38.999722,-122.803333,,562,1844ft,cch2,urn:uuid:aa00a77c-a6ad-4277-89a7-d3f8b9eea5d8,http://cch2.org/portal/collections/individual/index.php?occid=1384122
1392515,DAV,DAV300364,DAV201265; UCD140571,Nemophila menziesii,205099,4/6/2013,2013,4,6,96,6-Apr-13,,Sutter County,Sutter County; Sutter Buttes. Dean Ranch. South of North Butte. Western slope of Sunrise Ridge.,39.228333,-121.776667,,272,891ft,cch2,urn:uuid:32313a88-6e18-4c7c-80ee-408f4b6b77cf,http://cch2.org/portal/collections/individual/index.php?occid=1392515
1396957,DAV,DAV300385,DAV211331; UCD158879,Nemophila menziesii var. atomaria,205101,3/27/1975,1975,3,27,86,27-Mar-75,,Sonoma County,Sonoma County: Mayacmas Mountains. The Geysers. Site A-8. (Elevation estimated using Google Earth by label maker.),38.799444,-122.830833,960,701,1400 - 2300ft,cch2,urn:uuid:aa0e7f79-2fdc-49a1-a2a2-2165980b9bf5,http://cch2.org/portal/collections/individual/index.php?occid=1396957
1396964,DAV,DAV300361,DAV211346; UCD158890,Nemophila menziesii,205099,4/15/1975,1975,4,15,105,15-Apr-75,,Lake County,"Lake County: Mayacmas Mountains, Francisco Property. High Valley Creek. (Elevation estimated using Google Earth by label maker.)",38.830833,-122.768889,250,945,2800 - 3100ft,cch2,urn:uuid:523570dd-01b7-4531-9063-34fefb8bbe0b,http://cch2.org/portal/collections/individual/index.php?occid=1396964
1397330,DAV,DAV300363,DAV208017; UCD149685,Nemophila menziesii,205099,4/25/2006,2006,4,25,115,25-Apr-06,,Napa County,"Napa County: Howell Mountain Plateau, about 1 km west of Angwin. McCrane property. Vineyard conversion.",38.578333,-122.460556,50,526,1726ft,cch2,urn:uuid:bb0bf497-2af3-43b0-b09e-dde91d879262,http://cch2.org/portal/collections/individual/index.php?occid=1397330
1398684,DAV,DAV300360,DAV211352; UCD159735,Nemophila menziesii,205099,3/26/1975,1975,3,26,85,26-Mar-75,,Lake County,"Lake County: Mayacmas Mountains, Childers Peak area. Barceloux Ranch, east of Big Canyon Road. (Elevation estimated using Google Earth by label maker.)",38.840278,-122.627222,700,579,1900ft,cch2,urn:uuid:7ba75d20-d294-4bd1-835d-ac7dbeb838de,http://cch2.org/portal/collections/individual/index.php?occid=1398684
1399061,DAV,DAV300386,DAV210630; UCD159790,Nemophila menziesii var. atomaria,205101,4/13/1975,1975,4,13,103,13-Apr-75,,Napa County,"Napa County: Soda Canyon Road, near outlet of canyon.",38.374167,-122.281111,1807,61,200ft,cch2,urn:uuid:e3272514-aa55-489d-8929-b4e6d49634c4,http://cch2.org/portal/collections/individual/index.php?occid=1399061
1399282,DAV,DAV300378,DAV211972; UCD160061,Nemophila menziesii var. atomaria,205101,4/9/1975,1975,4,9,99,9-Apr-75,,Sonoma County,"Sonoma County: Mayacmas Mountains, Hilary Farms. (Exact location unknown. Elevation and coordinates estimated by label maker.)",38.845556,-122.938889,500,610,2000ft,cch2,urn:uuid:8067ace7-2ae5-4aed-b628-a9741e038f8c,http://cch2.org/portal/collections/individual/index.php?occid=1399282
1399350,DAV,DAV300359,DAV212113; UCD160137,Nemophila menziesii,205099,3/27/1974,1974,3,27,86,27-Mar-74,,Sonoma County,Sonoma County: Mayacmas Mountains. The Geysers. Site A-8. (Elevation estimated using Google Earth by label maker.),38.799444,-122.830833,960,701,1400 - 2300ft,cch2,urn:uuid:78d93d2e-8491-4b2a-9a79-6b87e09def6d,http://cch2.org/portal/collections/individual/index.php?occid=1399350
1399500,DAV,DAV300362,DAV212249; UCD160359,Nemophila menziesii,205099,3/29/1931,1931,3,29,88,29-Mar-31,,Marin County,Marin County: Point Reyes.,38.073889,-122.926944,11236,,,cch2,urn:uuid:110cd932-348b-44f0-bbb4-ee066a440862,http://cch2.org/portal/collections/individual/index.php?occid=1399500
1399540,DAV,DAV300358,DAV212519; UCD160445,Nemophila menziesii,205099,5/22/1975,1975,5,22,142,22-May-75,,Lake County,"Lake County: Mayacmas Mountains, Francisco Property. High Valley Creek. (Coordinates, location, and elevation estimated by label maker.)",38.838333,-122.769722,500,792,2600ft,cch2,urn:uuid:f9b5578b-ea26-4e16-9c6c-bb69b7da9698,http://cch2.org/portal/collections/individual/index.php?occid=1399540
1400962,DAV,DAV300357,DAV214517; UCD162873,Nemophila menziesii,205099,4/7/1954,1954,4,7,97,7-Apr-54,,Mendocino County,"Mendocino County: Hopland, Hopland Field Station, in pasture northwest of station headquarters. (Exact location unknown. Coordinates estimated by label maker).",39.003333,-123.0875,541,240,,cch2,urn:uuid:58014ee5-8622-4d21-bf8e-cf68d6e9d91c,http://cch2.org/portal/collections/individual/index.php?occid=1400962
1403922,DAV,DAV300379,DAV218308; UCD166682,Nemophila menziesii var. atomaria,205101,3/14/1977,1977,3,14,73,14-Mar-77,,Napa County,"Napa County: Soda Canyon Road, 2.2 miles north of Silverado Trail.",38.75949316,-122.2648256,,137,450ft,cch2,urn:uuid:c4109198-89d9-4464-bf9e-a42d7bdcd066,http://cch2.org/portal/collections/individual/index.php?occid=1403922
1403923,DAV,DAV300380,DAV218307; UCD166683,Nemophila menziesii var. atomaria,205101,3/21/1998,1998,3,21,80,21-Mar-98,,Napa County,"Napa County: west of Pope Canyon Road, north side of Burton Creek.",,,,187,615ft,cch2,urn:uuid:1c9ea39c-0658-40b3-998f-1b65a7098f47,http://cch2.org/portal/collections/individual/index.php?occid=1403923
1404681,DAV,DAV300356,DAV219874; UCD168352,Nemophila menziesii,205099,4/1/1980,1980,4,1,92,Apr-80,,Los Angeles County,"Los Angeles County: Hungry Valley SVRA. (Exact location unknown. This park is mostly in Los Angeles county, but also includes parts of Ventura and Kern counties. Coordinates estimated by the label maker.)",34.766905,-118.857918,8759,,,cch2,urn:uuid:ebfabe67-576d-4419-afb7-3b3bff5335ad,http://cch2.org/portal/collections/individual/index.php?occid=1404681
1405860,DAV,DAV300355,DAV224197; UCD170201,Nemophila menziesii,205099,3/14/2015,2015,3,14,73,14-Mar-15,,Napa County,"Napa County: Knoxville Wildlife Area, west of Zim Zim Creek.",38.754721,-122.294593,,242,,cch2,urn:uuid:0b2a7060-428b-4fc8-b3d9-99eb4af3f740,http://cch2.org/portal/collections/individual/index.php?occid=1405860
1406410,DAV,DAV300381,DAV225288; UCD170754,Nemophila menziesii var. atomaria,205101,5/12/1997,1997,5,12,132,12-May-97,,Sonoma County,"Sonoma County: Bodega Bay, in front of University of California Marina Laboratory.",38.33333333,-123.1666667,,24,80ft,cch2,urn:uuid:22fc6a46-5e8a-45f0-a1b5-65599685531c,http://cch2.org/portal/collections/individual/index.php?occid=1406410
1432190,BSCA,BSCA0946,1749,Nemophila menziesii,205099,4/10/1969,1969,4,10,100,10-Apr-69,FL,San Diego County,On open slope SE of workshop reservoir. Also nature trail between #17 and 18.,33.33027,-116.89894,,,1630,cch2,urn:uuid:162b2892-8a5b-4213-9e4e-f9377e18a254,http://cch2.org/portal/collections/individual/index.php?occid=1432190
1432366,BSCA,BSCA4977,1562,Nemophila menziesii,205099,5/18/2004,2004,5,18,139,18-May-04,unk,San Diego County,"Rancho Cuyamaca State Park, West Mesa. NE-facing slope.",32.94222,-116.57278,,,1387,cch2,urn:uuid:e46a4130-1c9c-4440-ab6d-52b05d901dc8,http://cch2.org/portal/collections/individual/index.php?occid=1432366
1432416,BSCA,BSCA0944,1510,Nemophila menziesii,205099,5/18/2004,2004,5,18,139,18-May-04,,San Diego County,"West Mesa, moderate, NE-facing slope.",32.942222,-116.57278,,,1387,cch2,urn:uuid:b184b87f-74f0-4bfe-be8e-0cdd268e67fe,http://cch2.org/portal/collections/individual/index.php?occid=1432416
1432538,BSCA,BSCA0942,1384,Nemophila menziesii,205099,4/8/2003,2003,4,8,98,8-Apr-03,FFL,San Diego County,Laguna Mountains: Lucky 5 Ranch; southern portion of new acquisition by California State Parks: west side of Sunrise Hwy (S-1) between Cuyamaca Lake and Mount Laguna,32.93194,-116.49333,,,1600,cch2,urn:uuid:499f7cdc-4f62-4dd6-8d54-60ee98b5303e,http://cch2.org/portal/collections/individual/index.php?occid=1432538
1432665,BSCA,BSCA0941,1254,Nemophila menziesii,205099,3/15/2003,2003,3,15,74,15-Mar-03,FL,San Diego County,"Cuyamaca Lake, Lucky 5 Acquisition, Location 3 - Knoll with grassland on northeast side.",32.995,-116.53667,,,1441,cch2,urn:uuid:ce117b9b-ad82-4d64-9a5f-e237a27df133,http://cch2.org/portal/collections/individual/index.php?occid=1432665
1433514,BSCA,BSCA0940,367,Nemophila menziesii,205099,1962-04-00,1962,4,0,,Apr. 1962,,San Diego County,Culp Valley area.,,,,,,cch2,urn:uuid:e03b3cd6-22fe-4290-b9dd-2c1f16f1cf60,http://cch2.org/portal/collections/individual/index.php?occid=1433514
1433515,BSCA,BSCA0945,366,Nemophila menziesii,205099,5/19/1985,1985,5,19,139,19-May-85,,San Diego County,Jeep Trail to Lost Valley from Los Coyotes Indian Reservation.,33.35175,-116.55051,,,1460,cch2,urn:uuid:ca9de949-302a-4fd2-97f5-79f970d57956,http://cch2.org/portal/collections/individual/index.php?occid=1433515
1447218,UCR,UCR0077031,UCR-16821,Nemophila menziesii var. integrifolia,205102,5/30/1973,1973,5,30,150,5/30/1973,,Los Angeles,"c. 1 mi west from Baldy Village, 1/2 mi southwest of Cow Canyon Saddle on [Sunset Ridge Fire Road], Sunset Peak",34.22333,-117.67972,,1463,,cch2,urn:uuid:9826dde3-7eb0-4a97-9851-0ac1757f1b98,http://cch2.org/portal/collections/individual/index.php?occid=1447218
1447219,UCR,UCR0077033,UCR-4141,Nemophila menziesii,205099,3/27/1965,1965,3,27,86,3/27/1965,,Los Angeles,"road from Devils Canyon Wild Area to Azusa, 8-12 mi north of where the road crosses the west fork of the San Gabriel River",34.31222,-117.84139,,762,,cch2,urn:uuid:0f103d08-6a4a-4f1b-8272-90143ca027a7,http://cch2.org/portal/collections/individual/index.php?occid=1447219
1447220,UCR,UCR0077089,UCR-889,Nemophila menziesii,205099,4/21/1973,1973,4,21,111,4/21/1973,,Riverside,"Cajalco Road, 3 miles west of Mockingbird Canyon Road, south of Lake Mathews",33.825,-117.41667,,244,,cch2,urn:uuid:0391f631-50af-4feb-b84e-d37164e3c576,http://cch2.org/portal/collections/individual/index.php?occid=1447220
1447221,UCR,UCR0077088,UCR-3428,Nemophila menziesii var. integrifolia,205102,5/17/1964,1964,5,17,138,5/17/1964,,Riverside,c. 1 mile from junction of Hurley Flats Rd and Idyllwild-Banning Rd,33.84528,-116.8175,,1372,,cch2,urn:uuid:bca32b9e-f250-4d21-a4b0-06b05a455852,http://cch2.org/portal/collections/individual/index.php?occid=1447221
1447222,UCR,UCR0077106,UCR-16823,Nemophila menziesii var. integrifolia,205102,5/2/1974,1974,5,2,122,5/2/1974,,Riverside,Banning Canyon,34.03333,-116.86056,,1524,,cch2,urn:uuid:365b0639-35c4-48ad-bad3-1c70cd1ba39a,http://cch2.org/portal/collections/individual/index.php?occid=1447222
1447223,UCR,UCR0077086,UCR-543,Nemophila menziesii,205099,4/25/1976,1976,4,25,116,4/25/1976,,Riverside,"Idyllwild - Banning Road, c. 1 mi from junction with Hurley Flats Road.",33.98333,-116.8,,1372,,cch2,urn:uuid:0c946e4a-1cb4-47d6-9d47-7b4a1daf8d35,http://cch2.org/portal/collections/individual/index.php?occid=1447223
1447224,UCR,UCR0077082,UCR-20808,Nemophila menziesii,205099,4/17/1980,1980,4,17,108,4/17/1980,,Riverside,Pine Meadow in upper Garner Valley,33.57944,-116.59583,,1433,,cch2,urn:uuid:8a2f353c-8a9c-4da1-b322-c912bd60752b,http://cch2.org/portal/collections/individual/index.php?occid=1447224
1447225,UCR,UCR0077083,UCR-35348,Nemophila menziesii,205099,4/25/1967,1967,4,25,115,4/25/1967,,Riverside,"Pauba Ranch [SE of Temecula in Pauba Valley, off Hwy 79]",33.48333,-117.05,,381,,cch2,urn:uuid:1febad7b-3d08-4426-bc3a-2eda7fdea1bc,http://cch2.org/portal/collections/individual/index.php?occid=1447225
1447226,UCR,UCR0070268,UCR-35124,Nemophila menziesii var. integrifolia,205102,5/1/1968,1968,5,1,122,5/1/1968,,Riverside,at Chimney Flats on the old control road to Idyllwild,33.73722,-116.77194,,1463,,cch2,urn:uuid:468b055f-60a6-4232-990e-593bea904db6,http://cch2.org/portal/collections/individual/index.php?occid=1447226
1447227,UCR,UCR0077081,UCR-16820,Nemophila menziesii,205099,5/9/1970,1970,5,9,129,5/9/1970,,Riverside,"State Hwy 74 [Palms to Pines Hwy], 1 mile west of Santa Rosa Mountain Road",33.56833,-116.5275,,1220,,cch2,urn:uuid:c5ab0222-620d-4bfc-b3bd-4d75a3e2da59,http://cch2.org/portal/collections/individual/index.php?occid=1447227
1447228,UCR,UCR0077098,UCR-21912,Nemophila menziesii,205099,5/8/1980,1980,5,8,129,5/8/1980,,Riverside,"Harford Springs County Park, NW corner of the Gavilan plateau",33.80361,-117.355,,625,,cch2,urn:uuid:a0c424b6-8f21-451e-a32a-6c39e75eb832,http://cch2.org/portal/collections/individual/index.php?occid=1447228
1447229,UCR,UCR0077107,UCR-199,Nemophila menziesii,205099,4/5/1976,1976,4,5,96,4/5/1976,,Riverside,"Riverside, University of California campus, 1/8 mi. south of Perimeter Road [South Campus Drive]",33.96667,-117.325,,274,,cch2,urn:uuid:577e8f79-bba1-486a-9ae2-909296c9a338,http://cch2.org/portal/collections/individual/index.php?occid=1447229
1447230,UCR,UCR0077145,UCR-16819,Nemophila menziesii subsp. integrifolia,210481,5/27/1976,1976,5,27,148,5/27/1976,,San Bernardino,"San Sevaine Cow Camp, [west of] Lytle Creek Canyon",34.20222,-117.48611,,1433,,cch2,urn:uuid:72da1a59-362c-4458-a780-51df9fb542a4,http://cch2.org/portal/collections/individual/index.php?occid=1447230
1447231,UCR,UCR0077148,UCR-301,Nemophila menziesii var. integrifolia,205102,5/20/1971,1971,5,20,140,5/20/1971,,San Bernardino,hillside above Mill Creek near Thurman Flats,34.10167,-117.01083,,1037,,cch2,urn:uuid:0cb0825e-0b54-41ad-9b64-d7d63ed98ee6,http://cch2.org/portal/collections/individual/index.php?occid=1447231
1447232,UCR,UCR0077149,UCR-3164,Nemophila menziesii var. integrifolia,205102,5/21/1970,1970,5,21,141,5/21/1970,,San Bernardino,"Lytle Creek Road, 2.8 mi. north of Devore Road, Cajon Pass area",34.2175,-117.46139,,884,,cch2,urn:uuid:661ce2fb-fe1a-47cf-9387-f8916776df37,http://cch2.org/portal/collections/individual/index.php?occid=1447232
1447233,UCR,UCR0077159,UCR-16818,Nemophila menziesii,205099,5/5/1968,1968,5,5,126,5/5/1968,,San Bernardino,"Wildwood Canyon, east end, Camp Wiwoca",34.01167,-116.985,,1098,,cch2,urn:uuid:a6d62b2e-69df-4dc0-b7a3-b4b32bfa9a45,http://cch2.org/portal/collections/individual/index.php?occid=1447233
1447234,UCR,UCR0077160,UCR-16817,Nemophila menziesii,205099,4/27/1968,1968,4,27,118,4/27/1968,,San Bernardino,"Lytle Creek, c. 0.5 mile SE of Ranger Station",34.23278,-117.47333,,915,,cch2,urn:uuid:c9c7b7f9-6b30-4148-9537-93413a4c9251,http://cch2.org/portal/collections/individual/index.php?occid=1447234
1447235,UCR,UCR0077165,UCR-16822,Nemophila menziesii,205099,4/22/1973,1973,4,22,112,4/22/1973,,San Bernardino,"opposite 24680 Lake Drive, east shore of Lake Gregory",34.24333,-117.26333,,1829,,cch2,urn:uuid:8ffc5ae6-ca06-4097-8220-8d5cd9aed731,http://cch2.org/portal/collections/individual/index.php?occid=1447235
1447236,UCR,UCR0077184,UCR-28996,Nemophila menziesii,205099,4/24/1981,1981,4,24,114,4/24/1981,,San Luis Obispo,"south of Shandon, at junction of Shell Creek Road and CA Hwy 58",35.45889,-120.335,,423,,cch2,urn:uuid:3d89cd22-a630-4968-b4a5-bf8eec939191,http://cch2.org/portal/collections/individual/index.php?occid=1447236
1447237,UCR,UCR0077190,UCR-28995,Nemophila menziesii,205099,3/10/1983,1983,3,10,69,3/10/1983,,San Luis Obispo,1.8 mi. south of American Canyon Campground,35.26389,-120.28417,,506,,cch2,urn:uuid:beb361b5-47a6-4cea-80fc-3c6c15129420,http://cch2.org/portal/collections/individual/index.php?occid=1447237
1447238,UCR,UCR0077193,UCR-26109,Nemophila menziesii var. menziesii,205103,3/23/1975,1975,3,23,82,3/23/1975,,Santa Barbara,"Montecito, E fork of Cold Springs burn, 100 yards south of Cold Springs - Hot Springs trail saddle, 1 mi. by trail on E fork of Cold Springs trail, Mountain Drive",34.45878,-119.64953,,412,,cch2,urn:uuid:ae32ce2b-244b-40f8-8e81-34fc200d6867,http://cch2.org/portal/collections/individual/index.php?occid=1447238
1447239,UCR,UCR0077192,UCR-16616,Nemophila menziesii,205099,3/19/1967,1967,3,19,78,3/19/1967,,Santa Barbara,"Lake Cachuma County Park. Lake shore, south of boat ramp",34.57806,-119.95667,,229,,cch2,urn:uuid:9ec1a83f-ace0-46cc-b9d9-019a209efc73,http://cch2.org/portal/collections/individual/index.php?occid=1447239
1447240,UCR,UCR0077214,UCR-16707,Nemophila menziesii var. atomaria,205101,1970-03-00,1970,3,0,,1970-3,,Santa Clara,"Hicks Road, 0.2 mi. from Alamitos Road, near New Almaden",37.1625,-121.84556,,107,,cch2,urn:uuid:79563da4-627e-424e-aad7-4ce7c64ed37f,http://cch2.org/portal/collections/individual/index.php?occid=1447240
1447241,UCR,UCR0077211,UCR-12042,Nemophila menziesii var. atomaria,205101,1970-03-00,1970,3,0,,1970-3,,Napa,"Chiles to Pope Valley Road, 3.3 miles south of Pope Valley",38.56722,-122.38667,,198,,cch2,urn:uuid:980fd9bc-e6d1-43e0-a7c1-05e5c79777fc,http://cch2.org/portal/collections/individual/index.php?occid=1447241
1447242,UCR,UCR0077205,UCR-4128,Nemophila menziesii,205099,3/27/1967,1967,3,27,86,3/27/1967,,Fresno,"Watts Valley Rd., 4 miles north of junction with Trimmer Springs [=Maxson] Rd",36.96722,-119.35361,,412,,cch2,urn:uuid:99c47e8d-5c4e-45b7-b0bc-7319ce2f1f79,http://cch2.org/portal/collections/individual/index.php?occid=1447242
1447243,UCR,UCR0077206,UCR-37590,Nemophila menziesii var. atomaria,205101,4/16/1983,1983,4,16,106,4/16/1983,,Humboldt,Near the old Hwy 299 on W side of Berry Summit,40.89553,-123.77347,,823,,cch2,urn:uuid:5fa420bb-0a53-47d7-a303-6983f8870ad4,http://cch2.org/portal/collections/individual/index.php?occid=1447243
1462111,UCR,UCR0077034,UCR-48865,Nemophila menziesii,205099,5/17/1974,1974,5,17,137,5/17/1974,,Los Angeles,"8.9 mi east of Big Tujunga Canyon Road, on dirt road 300 yards north of Monte Cristo Ranger Station",34.32861,-118.12167,,976,,cch2,urn:uuid:b0948ff2-8d95-404d-9847-ca4d08991739,http://cch2.org/portal/collections/individual/index.php?occid=1462111
1462112,UCR,UCR0077087,UCR-41360,Nemophila menziesii,205099,3/3/1985,1985,3,3,62,3/3/1985,,Riverside,"Oasis de los Osos Preserve of the Nature Conservancy, off Snow Creek Canyon at the north foot of San Jacinto Mountain, l mile west of Snow Creek Village",33.89167,-116.69167,,489,,cch2,urn:uuid:7b2c3228-1714-4174-a587-550a5b8d3654,http://cch2.org/portal/collections/individual/index.php?occid=1462112
1462113,UCR,UCR0077074,UCR-51025,Nemophila menziesii,205099,2/24/1988,1988,2,24,55,2/24/1988,,Riverside,"Temescal Canyon, about 0.25 mi west of intersection of Hwy I-15 and Indian Truck Trail",33.75083,-117.45611,,381,,cch2,urn:uuid:447b5278-d2fd-4179-8696-ab75a7f1397b,http://cch2.org/portal/collections/individual/index.php?occid=1462113
1462114,UCR,UCR0077050,UCR-49231,Nemophila menziesii,205099,5/8/1980,1980,5,8,129,5/8/1980,,Riverside,"Harford Springs County Park, NW corner of the Gavilan plateau",33.80361,-117.355,,625,,cch2,urn:uuid:a6366a0b-1af8-4d16-9e83-69fa022f1e53,http://cch2.org/portal/collections/individual/index.php?occid=1462114
1462115,UCR,UCR0077150,UCR-75502,Nemophila menziesii,205099,4/7/1993,1993,4,7,97,4/7/1993,,San Bernardino,"E side Water Cyn, trib of Wildwood Cyn from N; SW foot Pisgah Pk",34.025,-116.98333,,979,,cch2,urn:uuid:ffdea880-1ca7-40e7-94f6-a98ee2109cc1,http://cch2.org/portal/collections/individual/index.php?occid=1462115
1462116,UCR,UCR0077151,UCR-71852,Nemophila menziesii var. integrifolia,205102,4/8/1992,1992,4,8,99,4/8/1992,,San Bernardino,"east of Yucaipa, Water Canyon, a tributary of Wildwood Canyon from the north. E-facing hillside below the stables (old Hunt Ranch), west of Water Canyon Rd",34.025,-116.99167,,1009,,cch2,urn:uuid:7237113f-3a2a-4543-b952-df61e38de7ed,http://cch2.org/portal/collections/individual/index.php?occid=1462116
1462117,UCR,UCR0077162,UCR-76212,Nemophila menziesii,205099,6/20/1993,1993,6,20,171,6/20/1993,,San Bernardino,"Near USFS Rock Camp fire station, c. 2 air miles NNW of Lake Arrowhead North Bay",34.3,-117.21667,,1524,,cch2,urn:uuid:2be0ace1-df79-45ee-906c-a11e6eb1e84e,http://cch2.org/portal/collections/individual/index.php?occid=1462117
1462118,UCR,UCR0077163,UCR-50783,Nemophila menziesii,205099,4/12/1988,1988,4,12,103,4/12/1988,,San Bernardino,"Las Flores Ranch area, c. 2 mi. north of intersection of Grass Valley Creek and Hwy 173, c. 2.5 mi. east of the California Aqueduct",34.34639,-117.27639,,976,,cch2,urn:uuid:8eb4313f-5fab-414a-93a3-3b4147f9892f,http://cch2.org/portal/collections/individual/index.php?occid=1462118
1462119,UCR,UCR0077164,UCR-56169,Nemophila menziesii var. integrifolia,205102,6/20/1965,1965,6,20,171,6/20/1965,,San Bernardino,Cedar Springs Campground on road to Crestline,34.28278,-117.33139,,1524,,cch2,urn:uuid:93d78ebd-356d-49ad-89d0-b910b28103ef,http://cch2.org/portal/collections/individual/index.php?occid=1462119
1462120,UCR,UCR0077137,UCR-42473,Nemophila menziesii var. annulata,218999,4/28/1975,1975,4,28,118,4/28/1975,,San Bernardino,"near Black Rock Spring, Joshua Tree National Monument",34.05667,-116.395,,1341,,cch2,urn:uuid:3f17a7e6-103a-4c86-8c91-f4033171b9ed,http://cch2.org/portal/collections/individual/index.php?occid=1462120
1462121,UCR,UCR0077166,UCR-50799,Nemophila menziesii,205099,3/17/1988,1988,3,17,77,3/17/1988,,San Bernardino,"[Yucca Valley] along Hwy 247, c. 2.25 mi NW of El Cortez Road",34.18611,-116.43167,,1128,,cch2,urn:uuid:5cdbb87e-0911-42c3-9836-0d4f5ef69368,http://cch2.org/portal/collections/individual/index.php?occid=1462121
1462122,UCR,UCR0077177,UCR-44645,Nemophila menziesii var. integrifolia,205102,5/21/1951,1951,5,21,141,5/21/1951,,San Diego,Cuyamaca,32.97722,-116.57917,,,,cch2,urn:uuid:915411a8-ea12-42e9-b913-bd73eaf18828,http://cch2.org/portal/collections/individual/index.php?occid=1462122
1462123,UCR,UCR0077004,UCR-41111,Nemophila menziesii,205099,3/18/1950,1950,3,18,77,3/18/1950,,San Luis Obispo,"Soda Lake Road to Carrizo Plain, c. 0.8 mi. off Hwy 399 [=SR33], near San Luis Obispo County line",34.97139,-119.45583,,823,,cch2,urn:uuid:ec0eee4e-65e2-40cb-87c0-c8d774e1472f,http://cch2.org/portal/collections/individual/index.php?occid=1462123
1462124,UCR,UCR0077202,UCR-55536,Nemophila menziesii,205099,4/29/1967,1967,4,29,119,4/29/1967,,Colusa,Bear Valley.,39.15,-122.43,,396,,cch2,urn:uuid:d812847a-54e9-41ce-8ba6-1237b3b7be36,http://cch2.org/portal/collections/individual/index.php?occid=1462124
1465836,UCR,UCR0077038,UCR-96143,Nemophila menziesii,205099,4/21/1996,1996,4,21,112,4/21/1996,,Los Angeles,"Antelope Valley. north side of State Hwy 138 (= Ave. D), c. 2 mi. west of Country Store, at town of Neenach (c. 30 mi. west of Hwy I-14).",34.78567,-118.63333,,915,,cch2,urn:uuid:0e567c2f-1db1-4906-99cb-738cd8319df8,http://cch2.org/portal/collections/individual/index.php?occid=1465836
1465881,UCR,UCR0077169,UCR-96194,Nemophila menziesii,205099,5/11/1996,1996,5,11,132,5/11/1996,,San Bernardino,"San Bernardino Nat. Forest, Audubon Societys Bearpaw Ranch Sanctuary, below Forest Falls. Just off Calif. Hwy 38 turnoff to Forest Falls, south of Mill Creek, in vicinity of University Creek",34.09167,-116.95833,,1341,,cch2,urn:uuid:488b0ed2-9967-40b3-9843-01f8d3bcc394,http://cch2.org/portal/collections/individual/index.php?occid=1465881
1466476,UCR,UCR0077093,UCR-96702,Nemophila menziesii,205099,3/1/1997,1997,3,1,60,3/1/1997,,Riverside,"Box Springs Mtns.: Coyote Hill (Bench Mark Versity, 1386 ft.) and ridge S and SE of the UCR Botanic Garden",33.96667,-117.32222,,427,,cch2,urn:uuid:6eca2e78-3093-401e-adf5-6c155fbc733c,http://cch2.org/portal/collections/individual/index.php?occid=1466476
1466516,UCR,UCR0077002,UCR-97045,Nemophila menziesii,205099,3/7/1997,1997,3,7,66,3/7/1997,,Kern,"San Emigdio Ranch, 4 km NE of Eagle Rest Peak (near bench mark 4070), along a dirt road 6.5 km north of Antimony Peak",34.9355,-119.11933,,1220,,cch2,urn:uuid:a4d9c1a1-0bfc-46ee-a0d3-b6c72e3364b8,http://cch2.org/portal/collections/individual/index.php?occid=1466516
1466624,UCR,UCR0077189,UCR-97579,Nemophila menziesii,205099,3/8/1997,1997,3,8,67,3/8/1997,,San Luis Obispo,c. 6 mi. west of Soda Lake Rd along Calif. Hwy 58,35.38,-120.10667,,549,,cch2,urn:uuid:11e43f33-d92b-4145-af62-54fcc0e6d9e9,http://cch2.org/portal/collections/individual/index.php?occid=1466624
1466626,UCR,UCR0077188,UCR-97578,Nemophila menziesii,205099,3/8/1997,1997,3,8,67,3/8/1997,,San Luis Obispo,"Carrizo Plain; 30.1 mi. NW of Calif. Hwy 166 on Soda Lake Rd., at San Diego Creek Rd near edge of Soda Lake",35.14667,-119.77167,,610,,cch2,urn:uuid:522ab847-fcfb-4296-b967-2bc1451e835a,http://cch2.org/portal/collections/individual/index.php?occid=1466626
1467104,UCR,UCR0077094,UCR-97676,Nemophila menziesii,205099,3/15/1997,1997,3,15,74,3/15/1997,,Riverside,Lake Skinner area: hill (1864) east of Skinner Lake at NW end of Tucalota Hills,33.59,-117.02333,,488,,cch2,urn:uuid:466abd8a-0b1a-4c4e-884e-e4436dc4c4eb,http://cch2.org/portal/collections/individual/index.php?occid=1467104
1467367,UCR,UCR0077041,UCR-99077,Nemophila menziesii,205099,2/28/1993,1993,2,28,59,2/28/1993,,Monterey,"Garrapata State Park, off State Hwy 1 (=Pacific Coast Hwy), north of lighthouse at Point Sur and south of Carmel Highlands",36.42417,-121.88833,,300,,cch2,urn:uuid:fac51501-70b4-4101-a0bb-92722ea42101,http://cch2.org/portal/collections/individual/index.php?occid=1467367
1476983,UCR,UCR0077035,UCR-88704,Nemophila menziesii,205099,5/9/1995,1995,5,9,129,5/9/1995,,Los Angeles,"just west of San Gabriel Mtns: Sunshine Canyon (name not shown on topo): west of San Fernando Road and Hwy I-5 Fwy, just SW of interchange with State Route 14. Sunshine Canyon Landfill property, site proposed for landfill expansion",34.33333,-118.51667,,457,,cch2,urn:uuid:a82cc1ac-ee72-4924-b4ea-d925c988826d,http://cch2.org/portal/collections/individual/index.php?occid=1476983
1476984,UCR,UCR0077036,UCR-95303,Nemophila menziesii,205099,5/2/1967,1967,5,2,122,5/2/1967,,Los Angeles,"Liebre Mtns, north side of northwesternmost end of foothills (of San Gabriel Mtns) between Bouquet Junction and Bonelli Ranch",34.42111,-118.53167,,366,,cch2,urn:uuid:15cb28e4-2bff-4c11-9b5d-71969af71539,http://cch2.org/portal/collections/individual/index.php?occid=1476984
1476985,UCR,UCR0077085,UCR-91858,Nemophila menziesii,205099,4/24/1996,1996,4,24,115,4/24/1996,,Riverside,"Morongo Indian Reservation, along dirt road in Hathaway Canyon, near Burro Flats",33.98333,-116.85833,,915,,cch2,urn:uuid:58ce434f-8e27-4f8a-8ff5-61bd46181bf5,http://cch2.org/portal/collections/individual/index.php?occid=1476985
1476986,UCR,UCR0077084,UCR-86880,Nemophila menziesii,205099,3/29/1995,1995,3,29,88,3/29/1995,,Riverside,"San Gorgonio Pass; alluvial fan at the mouth of Snow Creek, between Hwy 111 and Snow Creek Village",33.9,-116.66667,,335,,cch2,urn:uuid:b5cf1402-46ed-4a2d-9a10-2cfeb0274f64,http://cch2.org/portal/collections/individual/index.php?occid=1476986
1476987,UCR,UCR0077080,UCR-91423,Nemophila menziesii,205099,3/30/1995,1995,3,30,89,3/30/1995,,Riverside,Moreno Valley; hills c. 0.7 air mi directly south of 60 Fwy and west of bend in Moreno Beach Drive. Topo Q. shows Moreno BM 2067 at top of hill,33.93222,-117.18028,,579,,cch2,urn:uuid:28bc13fd-4878-4926-ad16-9eab5f904e27,http://cch2.org/portal/collections/individual/index.php?occid=1476987
1476988,UCR,UCR0077079,UCR-91222,Nemophila menziesii,205099,3/31/1996,1996,3,31,91,3/31/1996,,Riverside,"Bundy Canyon, SE of Lake Elsinore; c. 1 road mile (± 0.2 mi) east of Bundy Canyon Road exit from Hwy I-15. About 40 ft. south of road along mapped intermittent blueline stream",33.625,-117.25,,439,,cch2,urn:uuid:e79b8622-7df3-4787-b22d-9462bb1757bd,http://cch2.org/portal/collections/individual/index.php?occid=1476988
1476989,UCR,UCR0077077,UCR-98180,Nemophila menziesii,205099,2/9/1997,1997,2,9,40,2/9/1997,,Riverside,"Elsinore Basin; Temescal Valley: SW of Hwy I-15 between Indian Truck Trail and Lake Street exits, c. 0.5 mi east of Glen Eden",33.74167,-117.44167,,370,,cch2,urn:uuid:d25fb25d-e284-4159-a42b-0d4211e5dbd2,http://cch2.org/portal/collections/individual/index.php?occid=1476989
1476990,UCR,UCR0077078,UCR-96816,Nemophila menziesii,205099,3/12/1993,1993,3,12,71,3/12/1993,,Riverside,near Winchester,33.71667,-117.10417,,466,,cch2,urn:uuid:6a5be261-868f-4ba3-b896-5d68bab75c09,http://cch2.org/portal/collections/individual/index.php?occid=1476990
1476991,UCR,UCR0077076,UCR-90743,Nemophila menziesii,205099,4/5/1995,1995,4,5,95,4/5/1995,,Riverside,Lakeview Mountains; SW of Juniper Flat Road,33.8,-117.1,,579,,cch2,urn:uuid:89880936-b6d9-4504-bc45-502e79d66fd5,http://cch2.org/portal/collections/individual/index.php?occid=1476991
1476992,UCR,UCR0077075,UCR-93029,Nemophila menziesii,205099,4/7/1994,1994,4,7,97,4/7/1994,,Riverside,Big Springs Canyon and north on the crest to Two Trees Canyon (S side),33.975,-117.29167,,,,cch2,urn:uuid:4fdd07f2-4d05-4d9b-bd4a-624f0791e208,http://cch2.org/portal/collections/individual/index.php?occid=1476992
1476993,UCR,UCR0077144,UCR-103861,Nemophila menziesii var. menziesii,205103,2/25/1997,1997,2,25,56,2/25/1997,,San Bernardino,"Jurupa Hills: Mary Vagl Museum and Nature Center, Cypress St., Fontana",34.04167,-117.45,,,,cch2,urn:uuid:6caa9dc4-b837-4ee6-8e98-f1ecf6a233c1,http://cch2.org/portal/collections/individual/index.php?occid=1476993
1476994,UCR,UCR0077146,UCR-91995,Nemophila menziesii,205099,4/20/1994,1994,4,20,110,4/20/1994,,San Bernardino,Foothills; mouth of Day Canyon at N end of Etiwanda Ave. Oak Summit project,34.17611,-117.53694,,610,,cch2,urn:uuid:9b588951-d625-429f-986e-cdac0fd7d5da,http://cch2.org/portal/collections/individual/index.php?occid=1476994
1476995,UCR,UCR0077153,UCR-92450,Nemophila menziesii,205099,5/5/1996,1996,5,5,126,5/5/1996,,San Bernardino,Cleghorn Road c. 0.25 mi SE of Cleghorn Pass,34.28444,-117.40389,,1341,,cch2,urn:uuid:23e95473-29c3-45d5-aed7-5fa13f3b5a23,http://cch2.org/portal/collections/individual/index.php?occid=1476995
1476996,UCR,UCR0077152,UCR-86166,Nemophila menziesii,205099,4/22/1995,1995,4,22,112,4/22/1995,,San Bernardino,"upper Horsethief Canyon along the Pacific Crest Trail, below crossing of Forest Service road to Cleghorn Ridge",34.31917,-117.42278,,1150,,cch2,urn:uuid:5c511bb6-912e-4677-8e80-a6453aac0bf6,http://cch2.org/portal/collections/individual/index.php?occid=1476996
1476997,UCR,UCR0077154,UCR-87892,Nemophila menziesii,205099,6/6/1994,1994,6,6,157,6/6/1994,,San Bernardino,"Waters Road near Fernwood Drive, Seeley Creek drainage between Valley of Enchantment and Cedarpines Park",34.24778,-117.31778,,1525,,cch2,urn:uuid:77c786c5-090c-4870-a5f4-0cf2be945e30,http://cch2.org/portal/collections/individual/index.php?occid=1476997
1476998,UCR,UCR0077155,UCR-86167,Nemophila menziesii,205099,4/22/1995,1995,4,22,112,4/22/1995,,San Bernardino,"upper Horsethief Canyon along the Pacific Crest Trail, below crossing of Forest Service road to Cleghorn Ridge",34.31917,-117.42278,,1150,,cch2,urn:uuid:b2b6c3cf-d1ce-48a0-8ea9-1fa5e09f5615,http://cch2.org/portal/collections/individual/index.php?occid=1476998
1476999,UCR,UCR0077157,UCR-88867,Nemophila menziesii,205099,4/15/1995,1995,4,15,105,4/15/1995,,San Bernardino,"Fontana, east slopes of the Jurupa Hills, south of Jurupa Hills Regional Park, west of Sierra Ave, NE of Mt. Jurupa",34.03917,-117.44028,,366,,cch2,urn:uuid:1703476c-882c-4d47-82d5-2b5e20899071,http://cch2.org/portal/collections/individual/index.php?occid=1476999
1477000,UCR,UCR0077158,UCR-91094,Nemophila menziesii,205099,5/6/1995,1995,5,6,126,5/6/1995,,San Bernardino,"North slope Baldy Mesa area; large wash just north of Manzanita Wash, off Baldy Mesa Road",34.42167,-117.45139,,1134,,cch2,urn:uuid:f382cd0d-32a9-4538-a316-0ec7278c70f0,http://cch2.org/portal/collections/individual/index.php?occid=1477000
1477001,UCR,UCR0077161,UCR-84656,Nemophila menziesii,205099,4/21/1994,1994,4,21,111,4/21/1994,,Riverside,"Millard Canyon, near stream crossing of Forest Service Road 2S05, c. 4 miles south of Bear Wallow Spring",33.96667,-116.8,,917,,cch2,urn:uuid:9664e8f3-9cc7-4909-9690-1f65aeaf5690,http://cch2.org/portal/collections/individual/index.php?occid=1477001
1477002,UCR,UCR0077116,UCR-99617,Nemophila menziesii var. menziesii,205103,4/8/1994,1994,4,8,98,4/8/1994,,San Bernardino,"junction of Lone Pine Canyon & Cajon Canyon, c. 100 m west of Cajon Wash",34.26917,-117.4625,,823,,cch2,urn:uuid:41cb455a-2bc6-45da-b769-2fad50ae79f4,http://cch2.org/portal/collections/individual/index.php?occid=1477002
1477003,UCR,UCR0077115,UCR-98614,Nemophila menziesii var. menziesii,205103,4/5/1994,1994,4,5,95,4/5/1994,,San Bernardino,1.1 mi west of Glen Helen Road on FS Road 3N31/Applewhite Road,34.20833,-117.41583,,707,,cch2,urn:uuid:34be8e5a-2771-4492-a034-0bd4f1cd01b4,http://cch2.org/portal/collections/individual/index.php?occid=1477003
1477004,UCR,UCR0077181,UCR-91635,Nemophila menziesii var. integrifolia,205102,4/6/1995,1995,4,6,96,4/6/1995,,San Diego,"Agua Tibia Wilderness Area, NE flank of Agua Tibia Mtn, Arroyo Seco tributary at N base of Eagle Crag, from the Wildhorse Trail E to the main trunk of Arroyo Seco",33.41028,-116.95833,,976,,cch2,urn:uuid:98ec14c6-1228-4841-b302-47e5ebe5e076,http://cch2.org/portal/collections/individual/index.php?occid=1477004
1477005,UCR,UCR0077183,UCR-95839,Nemophila menziesii var. menziesii,205103,3/27/1971,1971,3,27,86,3/27/1971,,San Diego,"San Vicente Road near junction with Wildcat Canyon Road, western San Vicente Valley.",33,-116.83333,,390,,cch2,urn:uuid:74123d01-3e57-40eb-a97f-e35dd5508eaa,http://cch2.org/portal/collections/individual/index.php?occid=1477005
1477006,UCR,UCR0077003,UCR-99003,Nemophila menziesii var. integrifolia,205102,6/27/1982,1982,6,27,178,6/27/1982,,Kern,"Alta Sierra, 8 miles north of Lake Isabella off Hwy 155, Greenhorn Mtns, Sequoia National Forest",35.72917,-118.54944,,1768,,cch2,urn:uuid:78601977-d17a-4f2f-bd19-1bc99d4cbc5f,http://cch2.org/portal/collections/individual/index.php?occid=1477006
1477007,UCR,UCR0077039,UCR-90892,Nemophila menziesii,205099,5/8/1989,1989,5,8,128,5/8/1989,,Monterey,Los Padres National Forest: Arroyo Seco Rd. between Arroyo Seco Campground and G16,36.23181,-121.48528,,,,cch2,urn:uuid:28ed11be-c581-4111-90c8-468da07178c0,http://cch2.org/portal/collections/individual/index.php?occid=1477007
1478440,UCR,UCR0077096,UCR-107894,Nemophila menziesii,205099,3/8/1997,1997,3,8,67,3/8/1997,,Riverside,"Box Springs Mtns, S-facing slopes near highest peak, right around radio towers.",33.96,-117.28333,,915,,cch2,urn:uuid:90efb53d-aeed-402a-961f-ed76ec6469fc,http://cch2.org/portal/collections/individual/index.php?occid=1478440
1478504,UCR,UCR0077090,UCR-107385,Nemophila menziesii,205099,3/23/1997,1997,3,23,82,3/23/1997,,Riverside,"Lakeview Mtns, c. 1 air mile SSW of Mt. Rudolph, along powerline road 0.3 mi. east of Contour (Juniper Flats) Rd.",33.80944,-117.08583,,610,,cch2,urn:uuid:565f97a4-80a5-4cbc-babb-7cd7b2c13601,http://cch2.org/portal/collections/individual/index.php?occid=1478504
1478810,UCR,UCR0077097,UCR-106420,Nemophila menziesii var. menziesii,205103,3/15/1997,1997,3,15,74,3/15/1997,,Riverside,Grassland at base of Bachelor Mtn. and adjoining chapararal.,33.6,-117.045,,488,,cch2,urn:uuid:93fa8661-8fce-4061-b97e-10c8eb7f28e0,http://cch2.org/portal/collections/individual/index.php?occid=1478810
1480773,UCR,UCR0077167,UCR-112346,Nemophila menziesii,205099,5/12/1998,1998,5,12,132,5/12/1998,,San Bernardino,"Baldy Mesa, Lugo-Vincent Powerline (S Cal. Edison), c. 1 mi. west of I-15 and north of Cajon Summit",34.37472,-117.45,,1250,,cch2,urn:uuid:d2e186a0-1bd9-43cd-9bfe-195cd0a29362,http://cch2.org/portal/collections/individual/index.php?occid=1480773
1481033,UCR,UCR0077168,UCR-111797,Nemophila menziesii var. integrifolia,205102,5/7/1999,1999,5,7,127,5/7/1999,,San Bernardino,0.25 to 0.75 miles NE of the Riverside Ave. crossing,34.03333,-117.38333,,244,,cch2,urn:uuid:71637a28-7bcb-4b66-8dd3-a1c4051d5839,http://cch2.org/portal/collections/individual/index.php?occid=1481033
1484037,UCR,UCR0077092,UCR-113165,Nemophila menziesii,205099,3/11/1998,1998,3,11,70,3/11/1998,,Riverside,"North Domenigoni Hills, north of Diamond Valley, near old mine site above San Jacinto Valley, south of end of Warren Rd.",33.69167,-117.03333,,610,,cch2,urn:uuid:78317f5a-bfe1-44c8-8df5-914caf151bb0,http://cch2.org/portal/collections/individual/index.php?occid=1484037
1486350,UCR,UCR0077095,UCR-116966,Nemophila menziesii,205099,5/3/2001,2001,5,3,123,5/3/2001,,Riverside,"Hemet, SE corner of State Street at Gibbel, 1712 ft. hill at east end of Diamond Valley",33.7,-116.96667,,494,,cch2,urn:uuid:ac57c25c-5181-4f2f-861b-7ba68707ac19,http://cch2.org/portal/collections/individual/index.php?occid=1486350
1486397,UCR,UCR0077091,UCR-116909,Nemophila menziesii,205099,4/6/2001,2001,4,6,96,4/6/2001,,Riverside,"Temecula, Long Canyon area west of Del Rey Rd., hills on both sides of gas pipeline route",33.52528,-117.12389,,366,,cch2,urn:uuid:4dc08f9b-26f8-4b40-9162-012cb47a0f61,http://cch2.org/portal/collections/individual/index.php?occid=1486397
1487087,UCR,UCR0077051,UCR-117424,Nemophila menziesii var. integrifolia,205102,5/29/1994,1994,5,29,149,5/29/1994,,Riverside,"East Branch Millard Canyon, along Forest Service Road 4S45",33.98639,-116.78333,,1200,,cch2,urn:uuid:27b2944f-bcbd-4fec-92cf-6b8896bc0320,http://cch2.org/portal/collections/individual/index.php?occid=1487087
1487088,UCR,UCR0077156,UCR-117423,Nemophila menziesii var. integrifolia,205102,3/28/1993,1993,3,28,87,3/28/1993,,San Bernardino,"Waterman Canyon, l km west of Arrowhead Hot Spring Hotel, at and below the first stream crossing of Old Waterman Canyon Road",34.18917,-117.27139,,600,,cch2,urn:uuid:1d06e35a-c79c-40ec-ae7a-ac173da27a0f,http://cch2.org/portal/collections/individual/index.php?occid=1487088
1488006,UCR,UCR0077037,UCR-108649,Nemophila menziesii var. integrifolia,205102,5/18/1967,1967,5,18,138,5/18/1967,,Los Angeles,Placerita Canyon,34.37861,-118.45833,,518,,cch2,urn:uuid:6f622dc9-8e4a-47e4-848c-1415d62f71a6,http://cch2.org/portal/collections/individual/index.php?occid=1488006
1488007,UCR,UCR0077147,UCR-105770,Nemophila menziesii var. integrifolia,205102,5/9/1968,1968,5,9,130,5/9/1968,,San Bernardino,[Glen Helen Regional Park] NW end of Muscupiabe,34.20389,-117.40667,,622,,cch2,urn:uuid:cfba4de9-9da8-4604-962a-b64c6de180ea,http://cch2.org/portal/collections/individual/index.php?occid=1488007
1494676,UCR,UCR0077141,UCR-120366,Nemophila menziesii,205099,4/4/1998,1998,4,4,94,4/4/1998,,San Bernardino,"Colton: c. 0.3 km north of Little Highgrove (pk 1478), c. 0.8 km west of the corner of Barton Rd. and La Cadena Dr.",34.032,-117.342,,412,,cch2,urn:uuid:076bc083-be73-45d1-a56b-ee89c1c217cf,http://cch2.org/portal/collections/individual/index.php?occid=1494676
1494698,UCR,UCR0077138,UCR-120383,Nemophila menziesii,205099,4/4/1998,1998,4,4,94,4/4/1998,,San Bernardino,"City of Grand Terrace, east of corner of Van Buren St. and Observation Dr.",34.02056,-117.30389,,396,,cch2,urn:uuid:73bd1497-01fb-4a9a-8f45-f53bc428556b,http://cch2.org/portal/collections/individual/index.php?occid=1494698
1495662,UCR,UCR0077143,UCR-119662,Nemophila menziesii var. integrifolia,205102,5/28/1995,1995,5,28,148,5/28/1995,,San Bernardino,"Upper Lytle Creek Ridge above Lone Pine Canyon, 1.4 mi. south of Lone Pine Rd. on 3N31, at first switchback, c. 50-1500 m north of road",34.31472,-117.57917,,1695,,cch2,urn:uuid:3a6766e8-d709-454d-9ff8-dbb663c2e983,http://cch2.org/portal/collections/individual/index.php?occid=1495662
1495930,UCR,UCR0077099,UCR-121196,Nemophila menziesii,205099,4/5/1989,1989,4,5,95,4/5/1989,,Riverside,"Shipley Multi-species Reserve, blue-line stream on the southeastern flank of Bachelor Mtn.",33.60833,-117.04167,,470,,cch2,urn:uuid:cd90d5e7-8354-495c-85af-7f9afdf6c2a1,http://cch2.org/portal/collections/individual/index.php?occid=1495930
1503943,UCR,UCR0077139,UCR-123721,Nemophila menziesii,205099,4/30/2001,2001,4,30,120,4/30/2001,,San Bernardino,"Redlands, east side of Sand Canyon Road, near Crafton Hills College",34.04444,-117.115,,633,,cch2,urn:uuid:5a60b732-eb58-401d-b4ff-da24683e0444,http://cch2.org/portal/collections/individual/index.php?occid=1503943
1509631,UCR,UCR0077005,UCR-121714,Nemophila menziesii var. menziesii,205103,4/26/2001,2001,4,26,116,4/26/2001,,Kern,"Tehachapi to Willow Springs Rd., 2.2 miles south of Highline Rd.",35.08617,-118.394,,1372,,cch2,urn:uuid:998be067-dd96-4e67-87af-0fa1d2a0687b,http://cch2.org/portal/collections/individual/index.php?occid=1509631
1509716,UCR,UCR0079815,UCR-122527,Nemophila menziesii,205099,5/20/2001,2001,5,20,140,5/20/2001,,Riverside,0.3 mile NW of Keen Camp Summit along CA-74,33.69056,-116.70806,,1494,,cch2,urn:uuid:a8949ac4-45b4-4232-82bc-710bb0e6850f,http://cch2.org/portal/collections/individual/index.php?occid=1509716
1509727,UCR,UCR0077100,UCR-122524,Nemophila menziesii,205099,5/20/2001,2001,5,20,140,5/20/2001,,Riverside,"Apple Canyon Rd, 1.5 mi NE of CA-74",33.68833,-116.66333,,1463,,cch2,urn:uuid:bbdc9701-44c7-4763-a17e-d0c46c9c3611,http://cch2.org/portal/collections/individual/index.php?occid=1509727
1510938,UCR,UCR0077194,UCR-122288,Nemophila menziesii var. menziesii,205103,4/15/2002,2002,4,15,105,4/15/2002,,Santa Barbara,"Sierra Madre Mountains, Miranda Pine Road, 1.0 mile southeast of CA Hwy 166",35.09694,-120.07833,,549,,cch2,urn:uuid:2f27c77c-0103-4b7a-8a6c-fdcaf0274a35,http://cch2.org/portal/collections/individual/index.php?occid=1510938
1511053,UCR,UCR0077208,UCR-122440,Nemophila menziesii var. menziesii,205103,4/23/2002,2002,4,23,113,4/23/2002,,Madera,"Bass Lake Road, 2.2 miles southeast of the junction with CA Hwy 41",37.33889,-119.58639,,976,,cch2,urn:uuid:c73eb456-ce87-4629-a06f-af5273c6a846,http://cch2.org/portal/collections/individual/index.php?occid=1511053
1519008,UCR,UCR0077032,UCR-124610,Nemophila menziesii var. integrifolia,205102,1929-04-00,1929,4,0,,1929-4,,Los Angeles,Mandeville Canyon,34.10556,-118.50278,,200,,cch2,urn:uuid:83e3d404-bbcb-4e14-a115-0f99f3f2d8c6,http://cch2.org/portal/collections/individual/index.php?occid=1519008
1537376,UCR,UCR0077140,UCR-126071,Nemophila menziesii,205099,4/5/2003,2003,4,5,95,4/5/2003,,San Bernardino,"UC Burns Pinyon Ridge Reserve, off Skyline Ranch Rd. c. 2 miles (air) ESE of Pioneertown, 1.5 mi. (air) NW of Yucca Valley, between front gate and reserve headquarters at old Burns home",34.14917,-116.45583,,1250,,cch2,urn:uuid:b16a8409-40ec-475d-8ff1-12fd2921836a,http://cch2.org/portal/collections/individual/index.php?occid=1537376
1541573,UCR,UCR0077030,UCR-128013,Nemophila menziesii var. menziesii,205103,5/1/2003,2003,5,1,121,5/1/2003,,Los Angeles,"Newhall Ranch, Castaic Mesas. c. 1 mi SW of Castaic Lagoon at the W edge of a mesa, north of Charlie Canyon",34.4925,-118.6025,,366,,cch2,urn:uuid:fc39829d-f8b9-4d00-87a0-2c623fc72dfa,http://cch2.org/portal/collections/individual/index.php?occid=1541573
1541579,UCR,UCR0077217,UCR-128023,Nemophila menziesii var. integrifolia,205102,5/13/2003,2003,5,13,133,5/13/2003,,Ventura,"Newhall Ranch, Salt Creek",34.37111,-118.68778,,457,,cch2,urn:uuid:104386ce-c836-4f36-9513-644f8913d384,http://cch2.org/portal/collections/individual/index.php?occid=1541579
1544469,UCR,UCR0077042,UCR-130085,Nemophila menziesii var. menziesii,205103,4/24/2000,2000,4,24,115,4/24/2000,,Monterey,8.4 miles S of King City along G-14,36.06333,-121.185,,381,,cch2,urn:uuid:bd8b61f7-f82b-4d1b-b7a3-dce3fd0d06b8,http://cch2.org/portal/collections/individual/index.php?occid=1544469
1546296,UCR,UCR0077040,UCR-131465,Nemophila menziesii var. menziesii,205103,3/30/1973,1973,3,30,89,3/30/1973,,Monterey,Jolon Road cutoff,35.96917,-121.18361,,305,,cch2,urn:uuid:d9daac30-ca32-48c2-af4d-e1529c0f911f,http://cch2.org/portal/collections/individual/index.php?occid=1546296
1548414,UCR,UCR0077136,UCR-132817,Nemophila menziesii,205099,5/21/1995,1995,5,21,141,5/21/1995,,San Bernardino,"head of Grapevine Canyon on Grapevine Canyon Road, south of Apple Valley, 4.6 mi. above Santa Fe RR, at and above a new Forest Service gate",34.37667,-117.05833,,1738,,cch2,urn:uuid:5b811fd0-e9f9-4df6-a887-836e0fac2a34,http://cch2.org/portal/collections/individual/index.php?occid=1548414
1549113,UCR,UCR0077101,UCR-133409,Nemophila menziesii,205099,6/9/1998,1998,6,9,160,6/9/1998,,Riverside,"Morongo Indian Reservation, Lion Canyon, c. 3.5 miles NNW of Cabazon",33.9625,-116.75194,,854,,cch2,urn:uuid:1e42bea3-d61f-4dc1-9691-ea65f8b8d049,http://cch2.org/portal/collections/individual/index.php?occid=1549113
1549436,UCR,UCR0077006,UCR-133342,Nemophila menziesii,205099,4/22/1998,1998,4,22,112,4/22/1998,,Kern,Oak Creek Pass on the Tehachapi to Willow Springs Road,35.06056,-118.38806,,1341,,cch2,urn:uuid:13b1a106-07a6-45ab-9fb0-88ca46ca261d,http://cch2.org/portal/collections/individual/index.php?occid=1549436
1549557,UCR,UCR0077043,UCR-133547,Nemophila menziesii var. atomaria,205101,2/27/1948,1948,2,27,58,2/27/1948,,Monterey,"Carmel Highlands, above Yankee Point",36.49028,-121.93056,,213,,cch2,urn:uuid:d437d67d-25c2-4749-b82c-793d1c3dba56,http://cch2.org/portal/collections/individual/index.php?occid=1549557
1554125,UCR,UCR0077102,UCR-135994,Nemophila menziesii var. menziesii,205103,3/26/2003,2003,3,26,85,3/26/2003,,Riverside,"Wilson Valley Mitigation Bank (Center for Natural Lands Management), NE of Wilson Valley Road and west of Wilson Creek",33.53417,-116.8675,,854,,cch2,urn:uuid:5740ffc0-9743-4e23-aab6-931f49c71ead,http://cch2.org/portal/collections/individual/index.php?occid=1554125
1555324,UCR,UCR0077209,UCR-136433,Nemophila menziesii,205099,3/15/1955,1955,3,15,74,3/15/1955,,Mendocino,"4 miles east of Hopland, Hopland Field Station, Little Buck Pasture",39.00167,-123.08472,,244,,cch2,urn:uuid:ceb423d0-6612-4d38-9985-d73c744f6e72,http://cch2.org/portal/collections/individual/index.php?occid=1555324
1555662,UCR,UCR0077001,UCR-136685,Nemophila menziesii,205099,4/12/1958,1958,4,12,102,4/12/1958,,Kern,"Lake Isabella, Calif. Hwy 178, 2 miles west of Weldon",35.6575,-118.33028,,799,,cch2,urn:uuid:810e985e-70ce-4b64-88f5-9b6b49483a24,http://cch2.org/portal/collections/individual/index.php?occid=1555662
1555717,UCR,UCR0077218,UCR-137090,Nemophila menziesii,205099,3/22/1958,1958,3,22,81,3/22/1958,,Ventura,Hwy 399 [=SR33] near Casitas Dam,34.35278,-119.30528,,61,,cch2,urn:uuid:6158ebd6-b873-4635-b02b-607f496bd265,http://cch2.org/portal/collections/individual/index.php?occid=1555717
1556447,UCR,UCR0077179,UCR-138152,Nemophila menziesii var. integrifolia,205102,4/8/1997,1997,4,8,98,4/8/1997,,San Diego,"Wilderness Gardens Preserve c. 3.4 miles east of Pala, south of Hwy 76 along the San Luis Rey River",33.34889,-117.0375,,162,,cch2,urn:uuid:51d1935e-2e33-4567-a5cb-7b64eaa3e85c,http://cch2.org/portal/collections/individual/index.php?occid=1556447
1557317,UCR,UCR0077103,UCR-138642,Nemophila menziesii var. menziesii,205103,2/17/1997,1997,2,17,48,2/17/1997,,Riverside,"NW Palomar Mountains: burned areas in the Temecula community of Redhawk, south of the intersection of Redhawk Parkway and Tehachapi Pass Road",33.46667,-117.06667,,396,,cch2,urn:uuid:3a2bd245-56f9-4538-a465-32007f6899ad,http://cch2.org/portal/collections/individual/index.php?occid=1557317
1557500,UCR,UCR0077216,UCR-138752,Nemophila menziesii,205099,3/8/1997,1997,3,8,67,3/8/1997,,Trinity,"Southfork Rd., 12 mi south of Hwy 299",40.78878,-123.5585,,252,,cch2,urn:uuid:d5cec6b3-acac-4047-ac75-0618fe3f4502,http://cch2.org/portal/collections/individual/index.php?occid=1557500
1557903,UCR,UCR0077207,UCR-139073,Nemophila menziesii var. menziesii,205103,3/30/1997,1997,3,30,89,3/30/1997,,Lake,"Blue Oak Campground, Indian Valley Reservoir. 2.5 mi past intersection of access road and Walker Ridge Road",39.07,-122.50861,,274,,cch2,urn:uuid:06005aed-c444-44c0-bae4-d16feeaec935,http://cch2.org/portal/collections/individual/index.php?occid=1557903
1557955,UCR,UCR0077104,UCR-139032,Nemophila menziesii var. menziesii,205103,3/13/1997,1997,3,13,72,3/13/1997,,Riverside,"Agua Tibia Mtns: Redhawk Housing Development, north of the Pechanga Indian Reservation in the hills south of the intersection of Marge Place and Tehachapi Pass (S of Redhawk Parkway)",33.46806,-117.075,,378,,cch2,urn:uuid:df4c32ab-9050-4d14-9a0a-c394fb1169c2,http://cch2.org/portal/collections/individual/index.php?occid=1557955
1558114,UCR,UCR0077197,UCR-139467,Nemophila menziesii,205099,3/4/1902,1902,3,4,63,3/4/1902,,Alameda,San Leandro Creek,37.75361,-122.08667,,3,,cch2,urn:uuid:26a77ee7-edd5-4ad3-88c3-6fd82a928af9,http://cch2.org/portal/collections/individual/index.php?occid=1558114
1560136,UCR,UCR0077105,UCR-140301,Nemophila menziesii var. menziesii,205103,4/9/2004,2004,4,9,100,4/9/2004,,Riverside,"Tres Cerritos, c. 3 miles WNW of Hemet, east of the Lakeview Mtns., in central valley among the three peaks",33.76111,-117.02694,,488,,cch2,urn:uuid:e635c8b2-eede-429b-b151-437069b67d7f,http://cch2.org/portal/collections/individual/index.php?occid=1560136
1561245,UCR,UCR0077000,UCR-140952,Nemophila menziesii,205099,4/28/1973,1973,4,28,118,4/28/1973,,Kern,"Tehachapi Loop, near Keene",35.2,-118.54111,,915,,cch2,urn:uuid:63889033-72c8-4388-9c13-621f1edc7fcc,http://cch2.org/portal/collections/individual/index.php?occid=1561245
1564809,UCR,UCR0077180,UCR-144553,Nemophila menziesii var. integrifolia,205102,4/29/2003,2003,4,29,119,4/29/2003,,San Diego,"Walker Canyon Ecological Reserve: between Boulevard and Jacumba on the north side of Interstate 8, along arroyo bottom near stream",32.66361,-116.22167,,870,,cch2,urn:uuid:0ce1fa78-fdb2-4f75-8d66-13ffab12f4cd,http://cch2.org/portal/collections/individual/index.php?occid=1564809
1567120,UCR,UCR0077134,UCR-146547,Nemophila menziesii var. integrifolia,205102,4/9/2004,2004,4,9,100,4/9/2004,,San Bernardino,"UC Burns Pinyon Ridge Reserve, c. 1.5 mi east of Pioneertown, NW portion near camping area",34.14722,-116.45694,,1256,,cch2,urn:uuid:c2a01960-468a-4059-aa2c-46532df5e90d,http://cch2.org/portal/collections/individual/index.php?occid=1567120
1567122,UCR,UCR0077135,UCR-146942,Nemophila menziesii,205099,4/9/2004,2004,4,9,100,4/9/2004,,San Bernardino,"UC Burns Pinyon Ridge Reserve, c. 1.5 miles east of Pioneertown, SW portion in South Railroad Canyon",34.13917,-116.45278,,1113,,cch2,urn:uuid:b5f4b507-f99f-4df2-aacd-d4803d7c5b87,http://cch2.org/portal/collections/individual/index.php?occid=1567122
1568044,UCR,UCR0077178,UCR-148179,Nemophila menziesii,205099,4/27/2004,2004,4,27,118,4/27/2004,,San Diego,"Warner Springs area, rolling terrain near the Pacific Crest Trail, south of Hwy 79 and west of the Warner Springs Resort",33.27083,-116.64167,,898,,cch2,urn:uuid:e06556b5-ff0e-44a4-b9aa-c4ae5b67ef3e,http://cch2.org/portal/collections/individual/index.php?occid=1568044
1569463,UCR,UCR0077133,UCR-150697,Nemophila menziesii,205099,4/4/1998,1998,4,4,94,4/4/1998,,San Bernardino,"Stoddard Canyon off San Antonio Canyon, north of Upland",34.175,-117.67222,,747,,cch2,urn:uuid:cffc3c93-7950-4a93-b8ab-270bd02779b8,http://cch2.org/portal/collections/individual/index.php?occid=1569463
1570996,UCR,UCR0077176,UCR-151714,Nemophila menziesii,205099,4/5/2004,2004,4,5,96,4/5/2004,,San Diego,"Pine Hills area, between Magee Flat and Deadman Flat along Eagle Peak Road",33.03111,-116.66056,,,,cch2,urn:uuid:f0ff2a7a-f60a-4928-bf61-7e85ef8c0e1d,http://cch2.org/portal/collections/individual/index.php?occid=1570996
1574113,UCR,UCR0077131,UCR-153645,Nemophila menziesii var. integrifolia,205102,5/1/1985,1985,5,1,121,5/1/1985,,San Bernardino,"c. 12 air mi NW of San Bernardino in lower Lytle Creek Wash, c. 2-4 mi north of Interstate 15",34.22222,-117.46611,,732,,cch2,urn:uuid:1a9fe8c1-aaff-439f-b877-df2736fe3e95,http://cch2.org/portal/collections/individual/index.php?occid=1574113
1575759,UCR,UCR0077132,UCR-154316,Nemophila menziesii,205099,2/13/2005,2005,2,13,44,2/13/2005,,San Bernardino,"c. 1.5 mi east of Pioneertown, UC Burns Pinyon Ridge Reserve; middle part of the Reserve on ridge between Boo and Jean canyons (tribs. to N Railroad Canyon)",34.14472,-116.45222,,1250,,cch2,urn:uuid:e68223e4-58ec-45ad-8931-ef574811ae6b,http://cch2.org/portal/collections/individual/index.php?occid=1575759
1576875,UCR,UCR0077182,UCR-157569,Nemophila menziesii var. integrifolia,205102,2/1/2005,2005,2,1,32,2/1/2005,,San Diego,"Sycuan Peak Ecological Reserve (California Dept. of Fish & Game): southeast of Dehesa, southwest of Loveland Reservoir; on the lower north side of Sycuan Peak, just southwest of a wet spring area along Sloan Canyon Road",32.76889,-116.81278,,265,,cch2,urn:uuid:7ea93919-c306-4898-87cb-8d2be276957f,http://cch2.org/portal/collections/individual/index.php?occid=1576875
1578113,UCR,UCR0077191,UCR-158597,Nemophila menziesii var. integrifolia,205102,4/16/2005,2005,4,16,106,4/16/2005,,Santa Barbara,"Sierra Madre Mountains, 1.1 mi south of Calif. Hwy 166 on Miranda Pines Road",35.1,-120.07833,,526,,cch2,urn:uuid:12ae6a3c-d014-47b8-8bfc-4b7d58d1efb0,http://cch2.org/portal/collections/individual/index.php?occid=1578113
1578918,UCR,UCR0077175,UCR-159630,Nemophila menziesii var. integrifolia,205102,1/20/2005,2005,1,20,20,1/20/2005,,San Diego,"Rancho Jamul Ecological Reserve (California Dept. of Fish & Game): west of Hwy. 94, south of Jamul & north of Otay Lakes Road; central part of reserve just west of the main buildings, northeast-facing rocky slope",32.67861,-116.86,,270,,cch2,urn:uuid:b90d0107-7d72-425d-9fc0-f485bfbad826,http://cch2.org/portal/collections/individual/index.php?occid=1578918
1581063,UCR,UCR0077187,UCR-161935,Nemophila menziesii var. menziesii,205103,3/1/2005,2005,3,1,60,3/1/2005,,San Luis Obispo,Santa Lucia Range NE of Lopez Lake; 4.8 mi. N of Hi Mountain Road along Upper Lopez Lake Road. Vicinity of Wittenberg and Huffs Hole Creeks,35.215,-120.44333,,232,,cch2,urn:uuid:2b5dff14-eb64-41fd-9d1a-812bb4b3ffc3,http://cch2.org/portal/collections/individual/index.php?occid=1581063
1581640,UCR,UCR0077069,UCR-162413,Nemophila menziesii,205099,4/7/2003,2003,4,7,97,4/7/2003,,Riverside,"powerline trail west of Juan Diego Flats toward Reed Valley, NW of Cahuilla Mountain",33.59278,-116.82611,,1037,,cch2,urn:uuid:f777a02f-fc9c-4291-80d8-2f9e6e26520d,http://cch2.org/portal/collections/individual/index.php?occid=1581640
1583530,UCR,UCR0077070,UCR-163358,Nemophila menziesii,205099,3/15/2002,2002,3,15,74,3/15/2002,,Riverside,"Brown Creek drainage just above the confluence with Twin Pines Creek, near the old Cabazon-Idyllwild Rd.",33.89778,-116.79361,,915,,cch2,urn:uuid:50251227-035b-4bf2-9b3b-aae31daf4c5b,http://cch2.org/portal/collections/individual/index.php?occid=1583530
1583932,UCR,UCR0077186,UCR-163896,Nemophila menziesii var. menziesii,205103,3/30/2005,2005,3,30,89,3/30/2005,,San Luis Obispo,"Pozo Road, 0.9 mi east of Hi Mountain Road, north side of Garcia Mountains",35.305,-120.36833,,460,,cch2,urn:uuid:3f2c4902-3d49-4f6d-905c-e6f990e4e73a,http://cch2.org/portal/collections/individual/index.php?occid=1583932
1584432,UCR,UCR0077071,UCR-164572,Nemophila menziesii,205099,4/18/2001,2001,4,18,108,4/18/2001,,Riverside,Bautista Canyon near Tripp Flats Rd.,33.60833,-116.74167,,1143,,cch2,urn:uuid:8b4fd2b1-a9af-430d-800e-5380aebfeeae,http://cch2.org/portal/collections/individual/index.php?occid=1584432
1585711,UCR,UCR0077073,UCR-165916,Nemophila menziesii,205099,5/27/2004,2004,5,27,148,5/27/2004,,Riverside,"head of Banning (San Gorgonio River) Canyon close to the San Bernardino Co. line, 1 mi SE of Oak Glen Conservation Camp",34.02375,-116.89231,,1341,,cch2,urn:uuid:22c62ba0-eb2b-438e-a825-a6ddd5f91092,http://cch2.org/portal/collections/individual/index.php?occid=1585711
1586180,UCR,UCR0077072,UCR-166174,Nemophila menziesii,205099,2/10/2005,2005,2,10,41,2/10/2005,,Riverside,"E of Temecula, Rancho California, SE of intersection of Mesa Verdugo and Calle Vista, N of Pauba Valley and south of Buck Mesa",33.51103,-117.06725,,393,,cch2,urn:uuid:812e5912-5904-4665-9702-2a61e1fab45d,http://cch2.org/portal/collections/individual/index.php?occid=1586180
1590660,UCR,UCR0077174,UCR-170954,Nemophila menziesii var. integrifolia,205102,4/16/1982,1982,4,16,106,4/16/1982,,San Diego,"Pine Valley, Corte Madera Ranch",32.77917,-116.56444,,1200,,cch2,urn:uuid:014848f3-e154-4519-82d6-38f068534d23,http://cch2.org/portal/collections/individual/index.php?occid=1590660
1592339,UCR,UCR0077028,UCR-172782,Nemophila menziesii,205099,4/30/2000,2000,4,30,121,4/30/2000,,Los Angeles,"Millard Canyon, campground 2 mi N of Altadena, up the stream immediately after Millard campground.",34.21611,-118.14639,,518,,cch2,urn:uuid:c3a5f9f1-d66c-408b-810d-18def9d77aad,http://cch2.org/portal/collections/individual/index.php?occid=1592339
1592402,UCR,UCR0077029,UCR-172709,Nemophila menziesii,205099,4/22/2000,2000,4,22,113,4/22/2000,,Los Angeles,"Millard Canyon, 2 mi N of Altadena. First trail on the right immediately before Millard Campground",34.21611,-118.14639,,549,,cch2,urn:uuid:38cbdf10-7439-492a-a2a2-60d189684756,http://cch2.org/portal/collections/individual/index.php?occid=1592402
1592416,UCR,UCR0077130,UCR-172794,Nemophila menziesii,205099,5/20/2000,2000,5,20,141,5/20/2000,,San Bernardino,Miller Canyon next to East fork of West fork Mojave River. east of Silverwood lake.,34.27056,-117.29139,,1098,,cch2,urn:uuid:88d051a2-3f65-4aa7-9780-76e4f7e06f62,http://cch2.org/portal/collections/individual/index.php?occid=1592416
1592486,UCR,UCR0077204,UCR-172643,Nemophila menziesii var. menziesii,205103,4/20/2006,2006,4,20,110,4/20/2006,,El Dorado,"Between N and Middle forks of Cosumnes River; Junction of Sand Ridge Road and Cutaway Lane, 2.1 mi SW of Somerset",38.63194,-120.72222,,665,,cch2,urn:uuid:969ea554-eaf2-4d03-9322-96c6cbcebc20,http://cch2.org/portal/collections/individual/index.php?occid=1592486
1592979,UCR,UCR0077068,UCR-172809,Nemophila menziesii,205099,4/13/2000,2000,4,13,104,4/13/2000,,Riverside,"Southwestern Riverside County Multispecies Reserve, c. 3 mi NE of Skinner Reservoir",33.6,-117.01667,,457,,cch2,urn:uuid:1f096411-7c29-48a3-a91c-2aa47c8357fa,http://cch2.org/portal/collections/individual/index.php?occid=1592979
1593356,UCR,UCR0077200,UCR-173607,Nemophila menziesii var. menziesii,205103,4/7/2006,2006,4,7,97,4/7/2006,,Amador,"E of Sacramento, SW of Shenandoah Valley; along Calif. Hwy 49, c. 4.5 mi north of Plymouth",38.50778,-120.84861,,341,,cch2,urn:uuid:9e3b09c9-0e9e-495f-8312-b3caf4d2618a,http://cch2.org/portal/collections/individual/index.php?occid=1593356
1595370,UCR,UCR0077129,UCR-175540,Nemophila menziesii subsp. integrifolia,210481,4/1/2006,2006,4,1,91,4/1/2006,,San Bernardino,"Little San Bernardino Mtns: Pipes Canyon Preserve; Sorrel Horse Canyon south of Pioneertown Road, along wash and ridge to the south",34.16114,-116.51094,,1220,,cch2,urn:uuid:b790eb91-eb57-4a93-ae85-1ec31f0adfb7,http://cch2.org/portal/collections/individual/index.php?occid=1595370
1595970,UCR,UCR0077128,UCR-176103,Nemophila menziesii,205099,5/3/2005,2005,5,3,123,5/3/2005,,San Bernardino,"Miller Canyon below Hwy 138, SE of Silverwood Lake, East Fork of West Fork of the Mojave River",34.27194,-117.29417,,1098,,cch2,urn:uuid:8aea9342-3eb7-4a84-b828-ced48230fc8d,http://cch2.org/portal/collections/individual/index.php?occid=1595970
1597208,UCR,UCR0077213,UCR-177440,Nemophila menziesii,205099,3/27/2003,2003,3,27,86,3/27/2003,,Orange,Canyon bottom and W-facing slopes above Canada Gobernadora,33.53333,-117.58333,,91,,cch2,urn:uuid:c8af4030-712e-4e46-858a-79dc8606544f,http://cch2.org/portal/collections/individual/index.php?occid=1597208
1597546,UCR,UCR0077067,UCR-177946,Nemophila menziesii,205099,4/30/1998,1998,4,30,120,4/30/1998,,Riverside,"Morongo Indian Reservation, side canyon east of Hathaway Canyon, tree stand F-06",33.97222,-116.86056,,915,,cch2,urn:uuid:1eb475de-6833-4146-a213-ff4c1a3a141f,http://cch2.org/portal/collections/individual/index.php?occid=1597546
1597686,UCR,UCR0077027,UCR-178170,Nemophila menziesii var. menziesii,205103,2/10/2003,2003,2,10,41,2/10/2003,,Los Angeles,"North side of slope at saddle of Verdugo Motorway and Brand Park Motorway, on the crest of the Verdugo Mtns",34.20333,-118.26472,,823,,cch2,urn:uuid:be23fd9b-2cf0-4aa1-b952-af4473ae8344,http://cch2.org/portal/collections/individual/index.php?occid=1597686
1597758,UCR,UCR0077066,UCR-178142,Nemophila menziesii,205099,4/23/1998,1998,4,23,113,4/23/1998,,Riverside,"Morongo Indian Reservation, seep in Wood Canyon, tree stand W-07",33.99722,-116.83,,1220,,cch2,urn:uuid:fcc0fe35-08b5-4218-b925-23f7d3ad6313,http://cch2.org/portal/collections/individual/index.php?occid=1597758
1598399,UCR,UCR0077065,UCR-178843,Nemophila menziesii,205099,5/14/1998,1998,5,14,134,5/14/1998,,Riverside,"Morongo Indian Reservation, flat area cut by small wash, south and west of dirt road to Kitching Peak near junction with East Branch Millard Canyon, tree stand M-04",33.98528,-116.78056,,1128,,cch2,urn:uuid:d9610556-1dc4-489e-bde3-3c69f5ad7fc1,http://cch2.org/portal/collections/individual/index.php?occid=1598399
1598556,UCR,UCR0077026,UCR-178885,Nemophila menziesii var. integrifolia,205102,5/20/1989,1989,5,20,140,5/20/1989,,Los Angeles,"Glendora Wilderness Park, Water Pipe Canyon [=Pavil Cyn] a tributary of Big Dalton Canyon",34.16389,-117.81639,,442,,cch2,urn:uuid:a08d276c-8b69-43e2-b6c1-21858e92d5d5,http://cch2.org/portal/collections/individual/index.php?occid=1598556
1599719,UCR,UCR0077125,UCR-180280,Nemophila menziesii var. integrifolia,205102,6/21/1995,1995,6,21,172,6/21/1995,,San Bernardino,"side canyon on W side of Cajon Wash, 0.5 mi. SW of Cajon, 2.1 mi south of jct. of 3N49 and 3N53; 2.9 mi SE of Lone Pine Road and Hwy 138 at Road 3N53; W side of far W railroad",34.29083,-117.46028,,890,,cch2,urn:uuid:76c18275-acdd-4554-9ff5-0bec488e5923,http://cch2.org/portal/collections/individual/index.php?occid=1599719
1599897,UCR,UCR0077127,UCR-180741,Nemophila menziesii,205099,3/25/1995,1995,3,25,84,3/25/1995,,San Bernardino,"Piñon Hills area at Sheep Creek, 0.9 mi. south of Hwy 138 at Scrub Oak Rd.",34.40639,-117.60583,,1378,,cch2,urn:uuid:a764aca6-fea5-423c-b855-9370eded7aeb,http://cch2.org/portal/collections/individual/index.php?occid=1599897
1599930,UCR,UCR0077126,UCR-180765,Nemophila menziesii,205099,4/3/1995,1995,4,3,93,4/3/1995,,San Bernardino,"Lower Lytle Creek Divide, 0.7 mi. NE of junction of Applewhite Rd. and FS Rd. 3N31",34.25694,-117.47583,,1037,,cch2,urn:uuid:3363c365-771f-4400-a79b-6efcb826cba5,http://cch2.org/portal/collections/individual/index.php?occid=1599930
1599966,UCR,UCR0077117,UCR-180809,Nemophila menziesii var. menziesii,205103,4/15/1995,1995,4,15,105,4/15/1995,,San Bernardino,"Glen Helen Regional Park, c. 600 m south of Blockbuster Pavilion parking area, between motorcycle racetrack and north parking area",34.20361,-117.39444,,610,,cch2,urn:uuid:a22a7767-4935-4100-adfa-7acafe10ff60,http://cch2.org/portal/collections/individual/index.php?occid=1599966
1600369,UCR,UCR0077122,UCR-181294,Nemophila menziesii,205099,4/29/1995,1995,4,29,119,4/29/1995,,San Bernardino,"west of Cajon Wash and south of Hwy 138, c. 1 mile SSW of Cajon Junction, off FS road 3N49",34.29972,-117.48028,,945,,cch2,urn:uuid:63963297-1874-42c2-8dd8-fe567d884284,http://cch2.org/portal/collections/individual/index.php?occid=1600369
1600370,UCR,UCR0077121,UCR-181295,Nemophila menziesii,205099,4/29/1995,1995,4,29,119,4/29/1995,,San Bernardino,"west of Cajon Wash and south of Hwy 138, c. 1 mile SSW of Cajon Junction, off FS road 3N49",34.29972,-117.48028,,945,,cch2,urn:uuid:2cb4808d-956f-4109-ad89-3e3ebaa5e4a7,http://cch2.org/portal/collections/individual/index.php?occid=1600370
1600701,UCR,UCR0077124,UCR-181563,Nemophila menziesii,205099,4/1/1995,1995,4,1,91,4/1/1995,,San Bernardino,"flats immediately south of Spring Hill, west of FS Rd 2N04 (Barrett-Stoddard Truck Rd.), north of Stoddard Peak",34.20722,-117.66528,,1220,,cch2,urn:uuid:b60fbaef-6304-4a2d-be2f-2ba5b5d50a26,http://cch2.org/portal/collections/individual/index.php?occid=1600701
1600727,UCR,UCR0077123,UCR-181556,Nemophila menziesii,205099,4/29/1995,1995,4,29,119,4/29/1995,,San Bernardino,"west of Cajon Wash and south of Hwy 138, c. 1 mile SSW of Cajon Junction, off FS road 3N49",34.29972,-117.48028,,945,,cch2,urn:uuid:3ea948ba-7be2-40b5-98d7-77e6e95ad476,http://cch2.org/portal/collections/individual/index.php?occid=1600727
1600886,UCR,UCR0077120,UCR-181673,Nemophila menziesii,205099,4/22/1995,1995,4,22,112,4/22/1995,,San Bernardino,"near Cucamonga, Day Canyon, 0.9 miles NW of gauging station at mouth of canyon, at small westerly tributary",34.19556,-117.54583,,1043,,cch2,urn:uuid:a6ede6fd-9a9d-4d30-9657-dbc5f646eec4,http://cch2.org/portal/collections/individual/index.php?occid=1600886
1600887,UCR,UCR0077119,UCR-181684,Nemophila menziesii,205099,4/22/1995,1995,4,22,112,4/22/1995,,San Bernardino,"near Cucamonga, Day Canyon, 0.6 miles NW of gauging station at mouth of canyon",34.19222,-117.5425,,976,,cch2,urn:uuid:ab662328-6de2-4b9b-a671-430b814ae343,http://cch2.org/portal/collections/individual/index.php?occid=1600887
1601557,UCR,UCR0077025,UCR-182260,Nemophila menziesii,205099,4/14/1998,1998,4,14,104,4/14/1998,,Los Angeles,"100 m east of mouth of Mescal Canyon, in Mescal Heights area, 50 m east of 237th St. East",34.42333,-117.71444,,1512,,cch2,urn:uuid:ca56ad64-7854-4414-ad66-5a9099b9fc6b,http://cch2.org/portal/collections/individual/index.php?occid=1601557
1601564,UCR,UCR0077024,UCR-182265,Nemophila menziesii var. integrifolia,205102,4/26/1998,1998,4,26,116,4/26/1998,,Los Angeles,"Browns Flat, San Dimas Experimental Forest",34.18778,-117.72111,,1317,,cch2,urn:uuid:cdb52a83-9422-40e0-8776-4cc0fb72cdcf,http://cch2.org/portal/collections/individual/index.php?occid=1601564
1602734,UCR,UCR0076995,UCR-183680,Nemophila menziesii,205099,5/11/2007,2007,5,11,131,5/11/2007,,Kern,"hills c. 3/4 mile east of Castac Lake, east of the pipeline road and west of Dry Field Canyon",34.84194,-118.81889,,1280,,cch2,urn:uuid:5426cd4b-dbe8-40cd-8d9b-7d0fc4ef1709,http://cch2.org/portal/collections/individual/index.php?occid=1602734
1603706,UCR,UCR0105267,UCR-184221,Nemophila menziesii,205099,4/19/2007,2007,4,19,109,4/19/2007,,Los Angeles,hills north of Oso Canyon and south of the National Cement Plant,34.80417,-118.74917,,1006,,cch2,urn:uuid:43587b48-533f-40c2-b13b-caf4124f9023,http://cch2.org/portal/collections/individual/index.php?occid=1603706
1604749,UCR,UCR0077199,UCR-185229,Nemophila menziesii var. menziesii,205103,4/23/2007,2007,4,23,113,4/23/2007,,Amador,along Bell Road beside Plymouth Creek just east of Calif. Hwy 49 in the vicinity of Enterprise,38.54028,-120.84083,,302,,cch2,urn:uuid:ae6681fb-d4a8-4936-b557-4122f272c6d2,http://cch2.org/portal/collections/individual/index.php?occid=1604749
1604922,UCR,UCR0105260,UCR-185608,Nemophila menziesii,205099,4/25/2007,2007,4,25,115,4/25/2007,,Los Angeles,"Oso Canyon, 0.5 mi. SE of Kern Co. line, on Oso Canyon Rd.",34.81417,-118.78472,,1128,,cch2,urn:uuid:e70d8856-eb04-42cd-a22f-74abd17e3185,http://cch2.org/portal/collections/individual/index.php?occid=1604922
1605852,UCR,UCR0105261,UCR-186487,Nemophila menziesii,205099,4/27/2007,2007,4,27,117,4/27/2007,,Los Angeles,"Bronco Canyon, c. 0.5 mi above confluence with Pescado Creek",34.8675,-118.67594,,1067,,cch2,urn:uuid:21df5a1b-c14c-4302-bfd6-74b7817ee248,http://cch2.org/portal/collections/individual/index.php?occid=1605852
1606204,UCR,UCR0105263,UCR-187019,Nemophila menziesii,205099,4/25/2006,2006,4,25,115,4/25/2006,,Los Angeles,"1/2 mi. NW of La Liebre Ranch on the south side of Hwy 138, west of the mouth of Tentrock Canyon",34.77028,-118.67833,,960,,cch2,urn:uuid:19d92095-07b3-4f86-a513-5a1ff796cc6d,http://cch2.org/portal/collections/individual/index.php?occid=1606204
1606323,UCR,UCR0105262,UCR-186955,Nemophila menziesii,205099,3/22/2006,2006,3,22,81,3/22/2006,,Los Angeles,"south side of Oso Canyon, 1/2 mile above the National Cement Plant Rd., 1.2 mi. north of Quail Lake",34.78889,-118.7375,,1006,,cch2,urn:uuid:873c3338-75bd-4d05-9a37-061ea4d10279,http://cch2.org/portal/collections/individual/index.php?occid=1606323
1606605,UCR,UCR0105266,UCR-187271,Nemophila menziesii,205099,4/18/2006,2006,4,18,108,4/18/2006,,Los Angeles,"Oso Canyon, c. 2 miles due north of the west end of Quail Lake",34.79944,-118.75833,,1037,,cch2,urn:uuid:a94a2d05-e129-4858-8d04-9239e8c7c44b,http://cch2.org/portal/collections/individual/index.php?occid=1606605
1608420,UCR,UCR0077023,UCR-189255,Nemophila menziesii,205099,5/16/1998,1998,5,16,136,5/16/1998,,Los Angeles,"near Pinon Hills, Mescal Highlands, 0.9 mile west of 237th St. East at Panorama Way, 2.3 mi. S of Ft. Tejon Rd.",34.43333,-117.71667,,1402,,cch2,urn:uuid:eac5c374-6589-4bb6-af1c-4a9077aa94d0,http://cch2.org/portal/collections/individual/index.php?occid=1608420
1608646,UCR,UCR0105227,UCR-189392,Nemophila menziesii,205099,5/30/1998,1998,5,30,150,5/30/1998,,Los Angeles,"San Dimas Experimental Forest, Fern Canyon",34.19333,-117.73028,,890,,cch2,urn:uuid:3346ad9f-6178-49ed-9958-4546575f6eb3,http://cch2.org/portal/collections/individual/index.php?occid=1608646
1608910,UCR,UCR0077118,UCR-189693,Nemophila menziesii,205099,5/23/1998,1998,5,23,143,5/23/1998,,San Bernardino,"Ralston Peak, on southern ridge",34.30139,-117.49583,,1335,,cch2,urn:uuid:4b1aece3-ce8d-4068-b2f0-87554f6cee79,http://cch2.org/portal/collections/individual/index.php?occid=1608910
1609654,UCR,UCR0077021,UCR-190388,Nemophila menziesii,205099,4/18/2001,2001,4,18,108,4/18/2001,,Los Angeles,"Valyermo area, Bobs Gap, east of Bobs Gap Road at base of ridge",34.45167,-117.81139,,1223,,cch2,urn:uuid:c511ed1f-2989-4fcb-a0b7-5143508a626d,http://cch2.org/portal/collections/individual/index.php?occid=1609654
1609666,UCR,UCR0077020,UCR-190419,Nemophila menziesii,205099,4/18/2001,2001,4,18,108,4/18/2001,,Los Angeles,"Valyermo area, ridge top c. 500 m east of south end of Bobs Gap",34.45306,-117.80694,,1311,,cch2,urn:uuid:45707c60-9cb3-4774-bdbd-5e64bd7ed7be,http://cch2.org/portal/collections/individual/index.php?occid=1609666
1611252,UCR,UCR0105264,UCR-192038,Nemophila menziesii,205099,4/11/2008,2008,4,11,102,4/11/2008,,Los Angeles,"hills south of Hwy 138, c. 1 mile SW of Neenach School, NW of VABM Pine",34.77222,-118.61667,,970,,cch2,urn:uuid:e4686722-2228-48cc-8edf-adfed82ff8f2,http://cch2.org/portal/collections/individual/index.php?occid=1611252
1611827,UCR,UCR0105265,UCR-192569,Nemophila menziesii,205099,4/10/2008,2008,4,10,101,4/10/2008,,Los Angeles,"hills south of Hwy 138, c. 1 mile south of Neenach School, slopes N & E of VABM Pine",34.76667,-118.60833,,915,,cch2,urn:uuid:9440621f-bd4e-46bb-a275-16a577ef864f,http://cch2.org/portal/collections/individual/index.php?occid=1611827
1612662,UCR,UCR0077019,UCR-193674,Nemophila menziesii,205099,6/25/1999,1999,6,25,176,6/25/1999,,Los Angeles,"Fern Canyon, c. 1.75 mi. east of confluence with upper East Fork San Dimas Canyon",34.19583,-117.71667,,1171,,cch2,urn:uuid:fc4460af-047b-49ea-b905-c66e41d62a63,http://cch2.org/portal/collections/individual/index.php?occid=1612662
1612777,UCR,UCR0077064,UCR-193524,Nemophila menziesii,205099,6/24/2008,2008,6,24,176,6/24/2008,,Riverside,"May Valley c. 1.25 mi SW of Fleming Ranch, slope below May Valley Rd. toward meadow on nameless tributary NW of Hurkey Crk., north of Bonita Vista Rd.",33.71168,-116.69023,,1555,,cch2,urn:uuid:167d9d3d-70a3-48e6-930a-4f4f851fc73a,http://cch2.org/portal/collections/individual/index.php?occid=1612777
1615620,UCR,UCR0077201,UCR-197394,Nemophila menziesii var. menziesii,205103,3/18/2008,2008,3,18,78,3/18/2008,,Calaveras,"Jesus Maria Road, 2.4 miles southeast of its junction with CA-26; beside Jesus Maria Creek",38.28639,-120.66,,305,,cch2,urn:uuid:15dae941-d8c0-4cd3-8461-4d7febb1bf22,http://cch2.org/portal/collections/individual/index.php?occid=1615620
1617788,UCR,UCR0077018,UCR-199978,Nemophila menziesii var. integrifolia,205102,5/16/2001,2001,5,16,136,5/16/2001,,Los Angeles,"Northern San Rafael Hills, Lizs Loop (Edison Road) to Cherry Canyon Fire Road",34.19525,-118.20658,,442,,cch2,urn:uuid:06d93813-b33d-426e-a87d-580a5ff7d020,http://cch2.org/portal/collections/individual/index.php?occid=1617788
1618597,UCR,UCR0077173,UCR-200725,Nemophila menziesii var. integrifolia,205102,5/4/2004,2004,5,4,125,5/4/2004,,San Diego,"hills north of Warner Springs, north Indian Flats Campground of Cleveland National Forest along Road 9S05",33.35981,-116.67292,,899,,cch2,urn:uuid:c204f3f0-cbb6-4ff5-812b-6d07852846b5,http://cch2.org/portal/collections/individual/index.php?occid=1618597
1622367,UCR,UCR0077114,UCR-204865,Nemophila menziesii,205099,3/24/2008,2008,3,24,84,3/24/2008,,San Bernardino,"Wye Peak at Cajon Junction, NE of 215/Hwy 138 intersection",34.31417,-117.43861,,1107,,cch2,urn:uuid:274f00ca-6d50-4e6f-bd7e-38ca8b8a03ed,http://cch2.org/portal/collections/individual/index.php?occid=1622367
1622506,UCR,UCR0077017,UCR-205094,Nemophila menziesii,205099,4/11/2008,2008,4,11,102,4/11/2008,,Los Angeles,"San Dimas Experimental Forest, Lewis Paul Canyon, above waterfall at junction of Big Dalton Cyn. Rd.",34.17028,-117.81278,,549,,cch2,urn:uuid:10215c46-088d-40fb-a432-2986b94f5fe3,http://cch2.org/portal/collections/individual/index.php?occid=1622506
1624538,UCR,UCR0077203,UCR-207145,Nemophila menziesii var. menziesii,205103,4/4/2009,2009,4,4,94,4/4/2009,,El Dorado,"Happy Valley Road, 0.8 mile west of its junction with Happy Valley Cut-off",38.65556,-120.67528,,607,,cch2,urn:uuid:b6505be6-9d31-4ce0-a883-95595d16cc52,http://cch2.org/portal/collections/individual/index.php?occid=1624538
1624857,UCR,UCR0077063,UCR-207548,Nemophila menziesii,205099,3/27/2004,2004,3,27,87,3/27/2004,,Riverside,Riverside; UCR Botanical Garden,33.96667,-117.31944,,424,,cch2,urn:uuid:f3e7db00-0b03-4c65-8042-d74a1a7271ba,http://cch2.org/portal/collections/individual/index.php?occid=1624857
1626404,UCR,UCR0077113,UCR-204322,Nemophila menziesii var. integrifolia,205102,5/21/2008,2008,5,21,142,5/21/2008,,San Bernardino,"east of Rock Camp Station, north of Lake Arrowhead",34.28903,-117.20592,,1469,,cch2,urn:uuid:b73d0da7-4356-44b5-b31e-76f6d6e4c59e,http://cch2.org/portal/collections/individual/index.php?occid=1626404
1630104,UCR,UCR0076998,UCR-213288,Nemophila menziesii,205099,3/30/2010,2010,3,30,89,3/30/2010,,Kern,"hills between Big Sycamore and Little Sycamore canyons, north of reservoir on Calif. Aqueduct",34.84278,-118.69528,,998,,cch2,urn:uuid:e191cba4-5291-4705-bd52-3fb5e13133a4,http://cch2.org/portal/collections/individual/index.php?occid=1630104
1630107,UCR,UCR0077062,UCR-213310,Nemophila menziesii,205099,3/31/2010,2010,3,31,90,3/31/2010,,Riverside,"Temescal Canyon at Alberhill, c. 1/2 mi. west of Lake St. on north side of I-15, near Temescal Canyon Rd. undercrossing, at north edge of Concordia Ranch Rd.",33.73444,-117.41083,,363,,cch2,urn:uuid:33523120-5c38-4d51-8d77-bc442c613eda,http://cch2.org/portal/collections/individual/index.php?occid=1630107
1630197,UCR,UCR0077061,UCR-213512,Nemophila menziesii,205099,4/7/2010,2010,4,7,97,4/7/2010,,Riverside,"southeastern Gavilan Hills north of Alberhill, ridge west of dirt extension of Lake St., 0.9 mi. north (358°) of intersection of I-15 and Lake St.",33.74306,-117.39417,,488,,cch2,urn:uuid:0ec692d0-3e3a-4189-8ace-9096e8a58200,http://cch2.org/portal/collections/individual/index.php?occid=1630197
1631642,UCR,UCR0077060,UCR-214009,Nemophila menziesii,205099,4/5/2004,2004,4,5,96,4/5/2004,,Riverside,"Foothills, north of Valle Vista. Indian Creek Watershed",33.76667,-116.86667,,518,,cch2,urn:uuid:ba0dcea4-00c0-45ae-b823-2b07f75241e1,http://cch2.org/portal/collections/individual/index.php?occid=1631642
1631982,UCR,UCR0076994,UCR-214403,Nemophila menziesii,205099,4/14/2010,2010,4,14,104,4/14/2010,,Kern,"head of Canyon del Gato Montes, near foot of road over ridge toward Canyon de la Lecheria",34.91889,-118.64028,,1613,,cch2,urn:uuid:f13d0d0a-5659-409d-95d2-2f7497762d0c,http://cch2.org/portal/collections/individual/index.php?occid=1631982
1631989,UCR,UCR0076997,UCR-214078,Nemophila menziesii,205099,4/14/2010,2010,4,14,104,4/14/2010,,Kern,"Canyon del Gato Montes, above confluence with Canyon del Agua Escondida",34.91,-118.63167,,1442,,cch2,urn:uuid:9e6f8a1d-4874-4d7f-9db5-74900079132c,http://cch2.org/portal/collections/individual/index.php?occid=1631989
1632057,UCR,UCR0105259,UCR-214103,Nemophila menziesii,205099,4/20/2010,2010,4,20,110,4/20/2010,,Los Angeles,"Crane Canyon, 1.0 mi. SE (144°) of Castac Lake, 1.7 mi. NE (43°) of Gorman, just S of Kern Co. line",34.81389,-118.83194,,1141,,cch2,urn:uuid:c0e85e77-b53c-4224-a164-a50a6b0baf31,http://cch2.org/portal/collections/individual/index.php?occid=1632057
1632120,UCR,UCR0076996,UCR-214056,Nemophila menziesii,205099,4/6/2010,2010,4,6,96,4/6/2010,,Kern,"Little Sycamore Canyon, 0.65 km NE (33°) of VABM Cow on rounded ridge between east and west forks of canyon",34.84622,-118.70036,,1009,,cch2,urn:uuid:b9611a13-57dd-4e18-93a0-b25b064fcc94,http://cch2.org/portal/collections/individual/index.php?occid=1632120
1633083,UCR,UCR0076999,UCR-214729,Nemophila menziesii,205099,4/26/2010,2010,4,26,116,4/26/2010,,Kern,"mouth of Canyon de la Lecheria, north of the end of 290th St. West, head of Pescado Creek",34.88731,-118.65233,,1259,,cch2,urn:uuid:fbb3f88b-67e3-4c15-bb17-344b642d6e20,http://cch2.org/portal/collections/individual/index.php?occid=1633083
1634688,UCR,UCR0105244,UCR-216785,Nemophila menziesii var. integrifolia,205102,4/20/2010,2010,4,20,110,4/20/2010,,San Bernardino,"eastern end of Granite Mountains, UC Granite Mountains Desert Research Center, upper Granite Cove in Granite Cove Spring area",34.78444,-115.65972,,1322,,cch2,urn:uuid:93937007-4bc5-4589-85e4-565b0c288776,http://cch2.org/portal/collections/individual/index.php?occid=1634688
1635471,UCR,UCR0077196,UCR-217922,Nemophila menziesii var. menziesii,205103,5/22/2010,2010,5,22,142,5/22/2010,,El Dorado,"Perry Creek Road, 0.1 mile south of its junction with Slug Gulch Road, 0.4 mi. northeast of Fairplay",38.59528,-120.65361,,677,,cch2,urn:uuid:72f9deee-46f3-41ff-98cf-c76041bc5472,http://cch2.org/portal/collections/individual/index.php?occid=1635471
1638293,UCR,UCR0077059,UCR-215511,Nemophila menziesii var. menziesii,205103,4/4/2003,2003,4,4,94,4/4/2003,,Riverside,"UC Riverside Motte Rimrock Reserve, off Sage Road",33.80822,-117.26033,,536,,cch2,urn:uuid:78a8168e-aba4-4835-b1ad-7c7c4f036384,http://cch2.org/portal/collections/individual/index.php?occid=1638293
1642294,UCR,UCR0077057,UCR-225212,Nemophila menziesii,205099,4/19/2011,2011,4,19,109,4/19/2011,,Riverside,"Alberhill, unpaved extension of Lake Street, 1.5 km NNE of the intersection of Lake Street and Hwy 15",33.73889,-117.38889,,463,,cch2,urn:uuid:f43107c3-d7fe-4841-9b0d-df839e5631df,http://cch2.org/portal/collections/individual/index.php?occid=1642294
1642592,UCR,UCR0077058,UCR-225595,Nemophila menziesii,205099,3/29/2011,2011,3,29,88,3/29/2011,,Riverside,"hills between Sun City and Perris, low hilltop along powerline corridor c. 1/2 mile west of Goetz Rd., west of Alabaster Loop, above the San Jacinto River upstream of Railroad Canyon Lake",33.73644,-117.23564,,451,,cch2,urn:uuid:6c0861e1-aef1-4dd2-9197-d336c512165f,http://cch2.org/portal/collections/individual/index.php?occid=1642592
1643513,UCR,UCR0077111,UCR-227171,Nemophila menziesii,205099,4/9/2011,2011,4,9,99,4/9/2011,,San Bernardino,"southeast end of Marble Mountains, 4.0 mi north northeast of Chambliss at US Hwy 66, in rugged canyon at end of 4WD dirt road at historic mine site",34.59158,-115.50897,,496,,cch2,urn:uuid:d52fcdf7-b24f-4713-b5e0-1a6b6958ed8b,http://cch2.org/portal/collections/individual/index.php?occid=1643513
1646462,UCR,UCR0077056,UCR-230212,Nemophila menziesii,205099,4/6/2011,2011,4,6,96,4/6/2011,,Riverside,"Temescal Canyon, along Temescal Canyon Rd. 1.5 mi. NE (73°) of Glen Ivy Hot Springs, 0-0.4 mi. NE of I-15 crossing",33.76306,-117.46639,,311,,cch2,urn:uuid:1e58a6df-3130-4dfa-8613-ef28bc39e8d7,http://cch2.org/portal/collections/individual/index.php?occid=1646462
1650692,UCR,UCR0077185,UCR-224679,Nemophila menziesii,205099,3/25/2008,2008,3,25,85,3/25/2008,,San Luis Obispo,"north of Carrizo Plain National Monument, along Soda Lake Road between College and Belmont Streets",35.30728,-119.98622,,591,,cch2,urn:uuid:af5f6ca3-ec1f-404c-b840-89e171adb68b,http://cch2.org/portal/collections/individual/index.php?occid=1650692
1650892,UCR,UCR0077110,UCR-233611,Nemophila menziesii var. integrifolia,205102,4/21/2005,2005,4,21,111,4/21/2005,,San Bernardino,"Granite Mountains; Cottonwood Basin, UC Granite Mountains Desert Research Center",34.8192,-115.64787,,1348,,cch2,urn:uuid:80286927-4f21-4721-bc77-7b4404f63729,http://cch2.org/portal/collections/individual/index.php?occid=1650892
1652132,UCR,UCR0077109,UCR-235103,Nemophila menziesii,205099,5/8/2012,2012,5,8,129,5/8/2012,,San Bernardino,"Cajon Pass area, Cleghorn Road (dirt), 2 miles airline east (92°) of Cajon Junction",34.31102,-117.43883,,1198,,cch2,urn:uuid:c2b42d9c-d536-408b-a188-dfa448578290,http://cch2.org/portal/collections/individual/index.php?occid=1652132
1653886,UCR,UCR0077170,UCR-236927,Nemophila menziesii var. integrifolia,205102,4/29/2009,2009,4,29,119,4/29/2009,,San Diego,"Mesa Grande, Nature Conservancy (Wheatly Property), 2 miles W of Morettis Junction (Pala Road & Hwy 79) E of Mesa Grande Road, 2.5 miles south of dam at Lake Henshaw. Square H17",33.199,-116.751,,1079,,cch2,urn:uuid:913c48e5-b37b-4f64-82a0-c79c9b8fbf8f,http://cch2.org/portal/collections/individual/index.php?occid=1653886
1654005,UCR,UCR0077055,UCR-236902,Nemophila menziesii var. integrifolia,205102,5/10/2010,2010,5,10,130,5/10/2010,,Riverside,"San Bernardino National Forest, Garner Valley, c. 1.1 air mi southeast of junction of FS Road 6S13 and FS Road 6S04",33.64497,-116.65589,,1349,,cch2,urn:uuid:b6fe6303-c882-4bde-bf2f-05275d014fcb,http://cch2.org/portal/collections/individual/index.php?occid=1654005
1655702,UCR,UCR0077198,UCR-238602,Nemophila menziesii var. menziesii,205103,3/22/2012,2012,3,22,82,3/22/2012,,Amador,"Bell Road, 0.2 mile east of its junction with CA-49",38.54139,-120.84472,,270,,cch2,urn:uuid:3cbe858d-2b14-499b-af87-6bcdaa4304e5,http://cch2.org/portal/collections/individual/index.php?occid=1655702
1655775,UCR,UCR0077172,UCR-238971,Nemophila menziesii var. integrifolia,205102,4/24/2012,2012,4,24,115,4/24/2012,,San Diego,Mountain Warfare Training Camp Michael Monsoor: La Posta area; east of Morena Reservoir and west of La Posta Road; along a dirt road. Atlas Square: T23,32.66719,-116.44189,,970,,cch2,urn:uuid:9689077f-0943-4844-a2b1-b6076a9f4760,http://cch2.org/portal/collections/individual/index.php?occid=1655775
1656367,UCR,UCR0077016,UCR-238644,Nemophila menziesii var. integrifolia,205102,6/18/2010,2010,6,18,169,6/18/2010,,Los Angeles,"upper Big Tujunga Canyon, 1.2 km north of State Hwy 2 (Angeles Crest Hwy) 0.4 km west of Upper Big Tujunga Canyon Road",34.28419,-118.04531,,1220,,cch2,urn:uuid:44859722-56e2-46f2-8379-bf9c6b684b17,http://cch2.org/portal/collections/individual/index.php?occid=1656367
1658662,UCR,UCR0077108,UCR-241867,Nemophila menziesii,205099,4/26/1998,1998,4,26,116,4/26/1998,,San Bernardino,"1.9 mi. south on dirt road from Glen Helen Parkway South, east side of Lytle Creek Wash",34.18278,-117.40861,,549,,cch2,urn:uuid:e85a9014-9ac5-4b15-93fd-2d31932d0a7b,http://cch2.org/portal/collections/individual/index.php?occid=1658662
1658723,UCR,UCR0077054,UCR-241479,Nemophila menziesii,205099,4/9/1998,1998,4,9,99,4/9/1998,,Riverside,"Morongo Indian Reservation, Wood Canyon, east of upper Potrero Canyon",33.99253,-116.82772,,1305,,cch2,urn:uuid:375cd9c0-fe22-48b5-8af5-69534b9bcef1,http://cch2.org/portal/collections/individual/index.php?occid=1658723
1658740,UCR,UCR0077053,UCR-241489,Nemophila menziesii,205099,5/21/1998,1998,5,21,141,5/21/1998,,Riverside,"Morongo Indian Reservation, Hathaway Creek Canyon, NW of Cabazon",33.98592,-116.86969,,976,,cch2,urn:uuid:e3d1b5f2-6e69-407d-bdac-f26d0123b00e,http://cch2.org/portal/collections/individual/index.php?occid=1658740
1658989,UCR,UCR0077052,UCR-241581,Nemophila menziesii,205099,4/2/2013,2013,4,2,92,4/2/2013,,Riverside,"Temescal Canyon between Horsethief Canyon Rd. and Hostettler Rd., near I-15 Fwy, SE of Corona (Lee) Lake",33.73335,-117.41962,,377,,cch2,urn:uuid:c76faada-cfc0-4d00-9d9e-61411523a8bc,http://cch2.org/portal/collections/individual/index.php?occid=1658989
1659237,UCR,UCR0077049,UCR-241688,Nemophila menziesii var. integrifolia,205102,3/22/2013,2013,3,22,81,3/22/2013,,Riverside,"southern end of Menifee Valley, between Hwy 215 and Winchester Rd (Hwy 79), south of Los Alamos Rd, rocky slopes flanking Warm Springs Creek",33.59806,-117.14194,,396,,cch2,urn:uuid:fb44121a-3fc7-4e53-a3fe-4ebfc8575262,http://cch2.org/portal/collections/individual/index.php?occid=1659237
1666513,UCR,UCR0077047,UCR-249816,Nemophila menziesii,205099,3/19/2013,2013,3,19,78,3/19/2013,,Riverside,"Menifee Valley, Los Alamos Road at its crossing of Warm Springs Creek, and hill west of Jeanette Drive",33.59833,-117.14194,,390,,cch2,urn:uuid:f3a1a7ce-a6b5-4119-ab1e-e821c4396ac3,http://cch2.org/portal/collections/individual/index.php?occid=1666513
1667318,UCR,UCR0077195,UCR-249971,Nemophila menziesii var. menziesii,205103,3/26/2013,2013,3,26,85,3/26/2013,,Amador,"Along CA-49, 1.5 miles south of its junction with Sand Ridge Road, between Plymouth and El Dorado",38.56861,-120.84611,,262,,cch2,urn:uuid:c165949b-9d71-41e7-bb93-ee7adcad7688,http://cch2.org/portal/collections/individual/index.php?occid=1667318
1667330,UCR,UCR0077212,UCR-249955,Nemophila menziesii var. menziesii,205103,4/13/2013,2013,4,13,103,4/13/2013,,Nevada,"Magnolia Road, 3.0 miles east of its junction with CA-49",39.04944,-121.04611,,495,,cch2,urn:uuid:f178cc9f-7c4f-434b-be82-ec66f0e6ea50,http://cch2.org/portal/collections/individual/index.php?occid=1667330
1667801,UCR,UCR0077046,UCR-250193,Nemophila menziesii,205099,4/8/2014,2014,4,8,98,4/8/2014,,Riverside,"Temescal Canyon, along Temescal Canyon Rd. c. 0.35 km NW of El Hermano Rd., c. 0.95 km SE of I-15 crossing",33.76111,-117.4625,,315,,cch2,urn:uuid:405808b6-f48a-4d78-9dbd-1d61015c5c95,http://cch2.org/portal/collections/individual/index.php?occid=1667801
1668839,UCR,UCR0077048,UCR-251693,Nemophila menziesii,205099,4/9/2014,2014,4,9,99,4/9/2014,,Riverside,"Menifee, c. 4 mi southeast of Canyon Lake, northeast corner of Bundy Canyon Road and Sunset Avenue",33.64194,-117.2225,,534,,cch2,urn:uuid:91a91785-50d2-4574-80ec-9f78bf2c5a6b,http://cch2.org/portal/collections/individual/index.php?occid=1668839
1671329,UCR,UCR0076993,UCR-254086,Nemophila menziesii var. menziesii,205103,4/23/2009,2009,4,23,113,4/23/2009,,Kern,"Tejon Ranch, Los Alamos Creek, c. 5 miles NNE of Quail Lake",34.84767,-118.72403,,1012,,cch2,urn:uuid:2f3906dc-1ff7-408d-8590-8788f6acfc33,http://cch2.org/portal/collections/individual/index.php?occid=1671329
1676202,UCR,UCR0077015,UCR-259347,Nemophila menziesii var. menziesii,205103,4/28/2009,2009,4,28,118,4/28/2009,,Los Angeles,"Tejon Ranch, SE of Lebec, ridge overlooking Interstate 5, about 1.3 miles ENE of Gorman; site PO1086",34.8,-118.83014,,1371,,cch2,urn:uuid:29282075-4b8c-444d-bdd0-294c45ef349f,http://cch2.org/portal/collections/individual/index.php?occid=1676202
1677995,UCR,UCR0077045,UCR-261187,Nemophila menziesii,205099,3/25/2015,2015,3,25,84,3/25/2015,,Riverside,"Woodcrest area of Riverside, wet canyon 0.25 km ENE of Evening Star Rd., 0.25 km north of Ridge Canyon Dr., above Woodcrest Dam",33.8983,-117.36452,,372,,cch2,urn:uuid:65a24445-e28e-44ba-a12b-a70dade87dd9,http://cch2.org/portal/collections/individual/index.php?occid=1677995
1679405,UCR,UCR0077014,UCR-263214,Nemophila menziesii var. menziesii,205103,4/4/2014,2014,4,4,94,4/4/2014,,Los Angeles,c. 3.3 km northeast of vAlyermo along bobs Gap road c. 1.6 km southeast of the aqueduct,34.46542,-117.82325,,1126,,cch2,urn:uuid:6f3362c0-a547-46f3-a659-52999d492676,http://cch2.org/portal/collections/individual/index.php?occid=1679405
1681139,UCR,UCR0077044,UCR-263735,Nemophila menziesii,205099,6/5/2013,2013,6,5,156,6/5/2013,,Riverside,"Strawberry Creek below Strawberry Valley, c. 2.25 air mi southwest of Idyllwild",33.72958,-116.74578,,1540,,cch2,urn:uuid:9d91d9d1-f704-4209-b2d4-1317c09048de,http://cch2.org/portal/collections/individual/index.php?occid=1681139
1681815,UCR,UCR0077215,UCR-265132,Nemophila menziesii var. menziesii,205103,4/1/2015,2015,4,1,91,4/1/2015,,Sonoma,"Stewarts Point-Skaggs Springs Rd, 16.7 miles west of intersection with Rockpile Rd, Wolf Creek drainage",38.67225,-123.18592,,294,,cch2,urn:uuid:6b449e9d-7b16-47ce-a9f5-6c19cb64113d,http://cch2.org/portal/collections/individual/index.php?occid=1681815
1681907,UCR,UCR0077171,UCR-265328,Nemophila menziesii,205099,2/24/2015,2015,2,24,55,2/24/2015,,San Diego,"Camp Pendleton, central portion of Base, India Training Area, north of Basilone Road and east of Roblar Road, along a trail in a canyon bottom. Square: D5",33.35719,-117.35039,,140,,cch2,urn:uuid:6451e2fc-c3cc-41a6-bcb7-5319a87976ba,http://cch2.org/portal/collections/individual/index.php?occid=1681907
1684421,UCR,UCR0076992,UCR-266592,Nemophila menziesii,205099,4/20/2009,2009,4,20,110,4/20/2009,,Kern,"Tejon Ranch, Bronco Canyon (upper), about 4.5 miles N of the Tehachapi Afterbay",34.88981,-118.69111,,1340,,cch2,urn:uuid:cd0ed4dd-0aef-4334-be8c-41455da00bcc,http://cch2.org/portal/collections/individual/index.php?occid=1684421
1685062,UCR,UCR0077210,UCR-267439,Nemophila menziesii,205099,4/25/2006,2006,4,25,115,4/25/2006,,Napa,"Howell Mountain Plateau, c. 1 km west of Anguin; McCrane property",38.57833,-122.46056,,526,,cch2,urn:uuid:1d40069a-7377-4f36-b8f0-1d9b6b23745e,http://cch2.org/portal/collections/individual/index.php?occid=1685062
1686300,UCR,UCR0077013,UCR-270644,Nemophila menziesii var. menziesii,205103,3/22/2011,2011,3,22,81,3/22/2011,,Los Angeles,"mouth of Keril Canyon, tributary from east of Big Dalton Cyn., just below Big Dalton Cyn. Dam",34.16889,-117.80861,,509,,cch2,urn:uuid:37c77c1f-6903-4897-80a7-61f895d23693,http://cch2.org/portal/collections/individual/index.php?occid=1686300
1686420,UCR,UCR0077010,UCR-270532,Nemophila menziesii,205099,5/12/2011,2011,5,12,132,5/12/2011,,Los Angeles,along Cabin Canyon Creek near the confluence with Aliso Canyon,34.41806,-118.09389,,1195,,cch2,urn:uuid:80022974-8823-400d-8b4d-f4bb5ab6d6df,http://cch2.org/portal/collections/individual/index.php?occid=1686420
1686850,UCR,UCR0076990,UCR-270788,Nemophila menziesii,205099,4/20/2016,2016,4,20,111,4/20/2016,,Kern,"Cummings Valley, along W side of W Valley Blvd. (Rt. 202). between Bear Vally Road and Administration Drive",35.12489,-118.57481,,1187,,cch2,urn:uuid:44062849-7b91-47af-9191-9658a477b07d,http://cch2.org/portal/collections/individual/index.php?occid=1686850
1686855,UCR,UCR0076991,UCR-270781,Nemophila menziesii,205099,4/14/2016,2016,4,14,105,4/14/2016,,Kern,"Cummings Valley, N side of W Valley Blvd. near west intersection with Bertram Circle",35.13411,-118.55461,,1300,,cch2,urn:uuid:4cc38603-e5eb-44c3-b97c-6343709718b2,http://cch2.org/portal/collections/individual/index.php?occid=1686855
1686994,UCR,UCR0105226,UCR-270987,Nemophila menziesii subsp. integrifolia,210481,4/28/2011,2011,4,28,118,4/28/2011,,Los Angeles,"north of Glendora, ridge with old firebreak south of Persinger Cyn., from Glendora Mt. Road 0.7 mi. west to San Gabriel Cyn. Dam",34.205,-117.83583,,878,,cch2,urn:uuid:610b1a49-62ec-4a34-b623-f427cef14dc6,http://cch2.org/portal/collections/individual/index.php?occid=1686994
1687083,UCR,UCR0077009,UCR-271192,Nemophila menziesii subsp. integrifolia,210481,6/6/2011,2011,6,6,157,6/6/2011,,Los Angeles,"Charlton Flats (= Pine Flats), 13.8 miles east of jct. of Angeles Crest and Angeles Forest highways",34.29667,-118.01278,,1616,,cch2,urn:uuid:4bc86a7c-3981-4285-960f-9ee634c65a15,http://cch2.org/portal/collections/individual/index.php?occid=1687083
1687882,UCR,UCR0077008,UCR-271730,Nemophila menziesii var. menziesii,205103,3/26/2011,2011,3,26,85,3/26/2011,,Los Angeles,"San Dimas Experimental Forest, West Fork San Dimas Canyon, 0.1 to 0.6 mile upstream from confluence with San Dimas Cyn.",34.16861,-117.77222,,476,,cch2,urn:uuid:76aff360-2fb1-4a37-8cc0-fa31043e3fe6,http://cch2.org/portal/collections/individual/index.php?occid=1687882
1699640,UCR,UCR0077007,UCR-282720,Nemophila menziesii,205099,4/14/2008,2008,4,14,105,4/14/2008,,Los Angeles,"southeastern foothills, 1.6 mi N of Lancaster Rd/Hwy 138, 1.5 mi S of L.A./Kern Co. border, 1.2 mi E of the CA Aqueduct and 2.14 mi W of 300th St W",34.7955,-118.69864,,948,,cch2,urn:uuid:6ea6aede-9a06-4964-b43e-8234f1d08da0,http://cch2.org/portal/collections/individual/index.php?occid=1699640
1701807,UCR,UCR0076988,UCR-285042,Nemophila menziesii,205099,4/11/2005,2005,4,11,101,4/11/2005,,Kern,"San Emigdio Ranch, Tecuya Ridge",34.88889,-118.95139,,1500,,cch2,urn:uuid:abad5f6d-a955-4153-91fd-c3826b313f38,http://cch2.org/portal/collections/individual/index.php?occid=1701807
1701855,UCR,UCR0076989,UCR-284823,Nemophila menziesii,205099,5/13/1998,1998,5,13,133,5/13/1998,,Kern,"San Emigdio Ranch, Tecuya Ridge at end of Digier Road",34.88231,-118.94681,,1433,,cch2,urn:uuid:cfe929fe-4b93-4fbd-8e1f-cf39954048fb,http://cch2.org/portal/collections/individual/index.php?occid=1701855
1767219,HSC,HSC201463,HSC-12240,Nemophila menziesii,205099,3/28/1970,1970,3,28,87,28-Mar-70,,Calaveras,Along Whiskey Slide Rd. .2 mi. S of Jesus Maria Creek,,,,488,1600 ft,cch2,urn:uuid:25ed8a7c-4f1e-4c5c-9782-efd6d96da075,http://cch2.org/portal/collections/individual/index.php?occid=1767219
1767946,HSC,HSC201485,HSC-13577,Nemophila menziesii var. atomaria,205101,3/13/1962,1962,3,13,72,13-Mar-62,,Humboldt,2 mi. S of Trinidad along old Hwy. 101,,,,,,cch2,urn:uuid:c44c20f0-c815-446d-872a-8b48ee7afe0e,http://cch2.org/portal/collections/individual/index.php?occid=1767946
1767947,HSC,HSC201499,HSC-13578,Nemophila menziesii var. atomaria,205101,3/4/1962,1962,3,4,63,4-Mar-62,,Humboldt,About 2 mi. S of Trinidad,,,,,,cch2,urn:uuid:25705a6c-28f2-4544-bd0c-cbe7ab8c8765,http://cch2.org/portal/collections/individual/index.php?occid=1767947
1767948,HSC,HSC201517,HSC-13579,Nemophila menziesii,205099,5/6/1928,1928,5,6,127,6-May-28,,Lake,Morrison,,,,,,cch2,urn:uuid:777fb8c7-df7d-443c-86b2-cbf7fa45fc7e,http://cch2.org/portal/collections/individual/index.php?occid=1767948
1767950,HSC,HSC201515,HSC-13580,Nemophila menziesii,205099,3/27/1966,1966,3,27,86,27-Mar-66,,Trinity,2 mi. S of Burnt Ranch on the Spellenberg property,,,,,,cch2,urn:uuid:8e22486b-580a-4c3f-b0f1-69e1d24e99c4,http://cch2.org/portal/collections/individual/index.php?occid=1767950
1767951,HSC,HSC201486,HSC-13581,Nemophila menziesii var. atomaria,205101,3/22/1962,1962,3,22,81,22-Mar-62,,Humboldt,2 mi. S of Trinidad along old Hwy. 101,,,,122,400 ft,cch2,urn:uuid:5b24c858-a8d9-4e50-8825-0000121d5ffe,http://cch2.org/portal/collections/individual/index.php?occid=1767951
1767952,HSC,HSC201483,HSC-13582,Nemophila menziesii var. atomaria,205101,2/27/1926,1926,2,27,58,27-Feb-26,,Humboldt,Big Rock at Little River,,,,,,cch2,urn:uuid:c896e495-d09a-4c27-9339-6032c75654b3,http://cch2.org/portal/collections/individual/index.php?occid=1767952
1767953,HSC,HSC201491,HSC-13583,Nemophila menziesii var. atomaria,205101,1939-05-00,1939,5,0,,May-39,,Del Norte,"Darlingtonia, Smith River",,,,122,400 ft,cch2,urn:uuid:30fe8bc6-cad4-4bed-9d1a-d362ea2d1520,http://cch2.org/portal/collections/individual/index.php?occid=1767953
1767954,HSC,HSC201521,HSC-13584,Nemophila menziesii,205099,5/25/1930,1930,5,25,145,25-May-30,,Humboldt,Laribee Valley,,,,793,2600 ft,cch2,urn:uuid:f9edb9be-0b10-4463-919e-a07d33995cfe,http://cch2.org/portal/collections/individual/index.php?occid=1767954
1767955,HSC,HSC201490,HSC-13585,Nemophila menziesii var. atomaria,205101,1965-05-00,1965,5,0,,May-65,,Humboldt,W of Fairhaven Dr. intersection with Hwy. 101,,,,,,cch2,urn:uuid:4b0c51f3-2aac-47be-b170-fba4c9e08287,http://cch2.org/portal/collections/individual/index.php?occid=1767955
1767956,HSC,HSC201465,HSC-13586,Nemophila menziesii,205099,4/11/1926,1926,4,11,101,11-Apr-26,,Humboldt,Buck Mtn.,,,,,,cch2,urn:uuid:b29a621f-5b9c-4971-8653-f84d64ce8f9c,http://cch2.org/portal/collections/individual/index.php?occid=1767956
1767957,HSC,HSC201507,HSC-13587,Nemophila menziesii,205099,5/7/1960,1960,5,7,128,7-May-60,,Humboldt,E end Arbor Camp Ridge,,,,915,3000 ft,cch2,urn:uuid:51799665-ec45-4008-943c-16e83bb90ddd,http://cch2.org/portal/collections/individual/index.php?occid=1767957
1767958,HSC,HSC201516,HSC-13588,Nemophila menziesii,205099,3/30/1968,1968,3,30,90,30-Mar-68,,Trinity,"Along Trinity River, Hwy. 299, 3.5 mi. E of Humboldt Co. line",,,,,,cch2,urn:uuid:cd406278-82fc-4619-8e64-6fc50cc0368d,http://cch2.org/portal/collections/individual/index.php?occid=1767958
1767959,HSC,HSC201541,HSC-13589,Nemophila menziesii,205099,4/24/1965,1965,4,24,114,24-Apr-65,,Humboldt,Along Titlow Hill Rd.,,,,,,cch2,urn:uuid:8e91856a-69c2-44a3-a87c-11ecb11bd025,http://cch2.org/portal/collections/individual/index.php?occid=1767959
1767961,HSC,HSC201509,HSC-13590,Nemophila menziesii,205099,5/15/1948,1948,5,15,136,15-May-48,,Humboldt,Horse Mtn.,,,,,,cch2,urn:uuid:e5c64e1a-b420-4070-b098-8f8cd047760a,http://cch2.org/portal/collections/individual/index.php?occid=1767961
1767962,HSC,HSC201476,HSC-13591,Nemophila menziesii,205099,3/17/1964,1964,3,17,77,17-Mar-64,,Riverside,"8 mi. SE of Corona, along road to Elsinore",,,,,,cch2,urn:uuid:540c7d73-599c-403a-902f-7d6d3f93d1db,http://cch2.org/portal/collections/individual/index.php?occid=1767962
1767963,HSC,HSC201513,HSC-13592,Nemophila menziesii,205099,3/30/1963,1963,3,30,89,30-Mar-63,,Napa,27 mi. S of Middletown on Butts Canyon Rd.,,,,305,1000 ft,cch2,urn:uuid:5b8ff19c-bbfd-4a2f-b652-3e0eb82e66f5,http://cch2.org/portal/collections/individual/index.php?occid=1767963
1767964,HSC,HSC201464,HSC-13593,Nemophila menziesii,205099,3/18/1967,1967,3,18,77,18-Mar-67,,Fresno,Near Auberry Rd. at crossing of Friant-Kern Canal,,,,152,500 ft,cch2,urn:uuid:ee9b14cc-c1ad-4653-aa3b-e4cf81e2b70b,http://cch2.org/portal/collections/individual/index.php?occid=1767964
1767965,HSC,HSC201502,HSC-13594,Nemophila menziesii,205099,3/26/1964,1964,3,26,86,26-Mar-64,,Lake,7 mi. NW of Lakeport on Hidden Lake Rd.,,,,427,1400 ft,cch2,urn:uuid:cbae7b0d-a6a1-4e59-aa8b-9893e48485f3,http://cch2.org/portal/collections/individual/index.php?occid=1767965
1767966,HSC,HSC201523,HSC-13595,Nemophila menziesii,205099,5/15/1930,1930,5,15,135,15-May-30,,Lake,Mirabel Mine,,,,762,2500 ft,cch2,urn:uuid:e2ed9bbf-14d9-4c90-99a5-ab27c4b5f75e,http://cch2.org/portal/collections/individual/index.php?occid=1767966
1767967,HSC,HSC201508,HSC-13596,Nemophila menziesii,205099,8/30/1937,1937,8,30,242,30-Aug-37,,Lake,[no information],,,,,,cch2,urn:uuid:b0a5a79a-2456-4e91-9676-a71af49a9319,http://cch2.org/portal/collections/individual/index.php?occid=1767967
1767968,HSC,HSC201518,HSC-13597,Nemophila menziesii,205099,5/6/1928,1928,5,6,127,6-May-28,,Lake,1.5 mi. W of Bartlett Springs on the rd. to Clear Lake,,,,,,cch2,urn:uuid:33c73c51-5fc7-41e6-840f-47b654c669d8,http://cch2.org/portal/collections/individual/index.php?occid=1767968
1767969,HSC,HSC201522,HSC-13598,Nemophila menziesii,205099,1930-04-00,1930,4,0,,30-Apr,,Fresno,Above Dunlap,,,,,,cch2,urn:uuid:d7d1453d-b11c-447d-a566-8c17494ecef6,http://cch2.org/portal/collections/individual/index.php?occid=1767969
1767971,HSC,HSC201467,HSC-13600,Nemophila menziesii,205099,4/7/1963,1963,4,7,97,7-Apr-63,,San Luis Obispo,"Atascadero, E of Portola Rd., N end",,,,,,cch2,urn:uuid:2869547d-7ee3-4563-9a15-47a977072193,http://cch2.org/portal/collections/individual/index.php?occid=1767971
1767972,HSC,HSC201466,HSC-13601,Nemophila menziesii,205099,3/20/1968,1968,3,20,80,20-Mar-68,,Santa Barbara,Upper Oso Campground off the Santa Ynez River above Cachuma Dam,,,,335,1100 ft,cch2,urn:uuid:ac34cf04-0030-47ab-9981-82bc58c0c985,http://cch2.org/portal/collections/individual/index.php?occid=1767972
1767973,HSC,HSC201474,HSC-13602,Nemophila menziesii,205099,4/15/1963,1963,4,15,105,15-Apr-63,,Monterey,Laguna Seca (halfway between Salinas and Monterey),,,,,,cch2,urn:uuid:e6f79c50-fb18-4788-87c1-3d51d69a9d61,http://cch2.org/portal/collections/individual/index.php?occid=1767973
1767974,HSC,HSC201498,HSC-13603,Nemophila menziesii var. atomaria,205101,2/10/1962,1962,2,10,41,10-Feb-62,,Humboldt,1 mi. S of Trinidad,,,,,,cch2,urn:uuid:04281313-dcb1-4df6-b394-cc15ba228f1a,http://cch2.org/portal/collections/individual/index.php?occid=1767974
1767975,HSC,HSC201488,HSC-13604,Nemophila menziesii var. atomaria,205101,4/15/1965,1965,4,15,105,15-Apr-65,,Mendocino,"2 mi. S of Talmage along Mill Creek Rd., above upper reservoir",,,,335,1100 ft,cch2,urn:uuid:d5b3c39d-389f-462d-8faf-3c7f10fb1d19,http://cch2.org/portal/collections/individual/index.php?occid=1767975
1767980,HSC,HSC201481,HSC-13610,Nemophila menziesii,205099,4/18/1962,1962,4,18,108,18-Apr-62,,Sonoma,About 5 mi. N of Geurneville on the Old Cazadero Rd.,,,,,,cch2,urn:uuid:bff42bd1-458a-4462-b82c-cde4c7b9c55d,http://cch2.org/portal/collections/individual/index.php?occid=1767980
1774510,HSC,HSC201478,HSC-23559,Nemophila menziesii,205099,4/18/1970,1970,4,18,108,18-Apr-70,,Trinity,Above New River.,,,,244,800 ft,cch2,urn:uuid:0d21d032-897a-43f0-9fce-657961e90bf5,http://cch2.org/portal/collections/individual/index.php?occid=1774510
1776368,HSC,HSC201539,HSC-26644,Nemophila menziesii,205099,2/17/1973,1973,2,17,48,17-Feb-73,,Mendocino,"Manchester, near Davis Lake",,,,,,cch2,urn:uuid:b5dac827-c702-4e44-8ae9-cd251abd3a9a,http://cch2.org/portal/collections/individual/index.php?occid=1776368
1776544,HSC,HSC201540,HSC-26853,Nemophila menziesii,205099,3/21/1971,1971,3,21,80,21-Mar-71,,Mendocino,Beside Hwy. 128 about 1 mi. E of Yorkville,,,,,,cch2,urn:uuid:0a5e6cd5-5aec-469e-abb5-09359e424737,http://cch2.org/portal/collections/individual/index.php?occid=1776544
1776753,HSC,HSC201532,HSC-27131,Nemophila menziesii,205099,2/10/1973,1973,2,10,41,10-Feb-73,,Trinity,New River Trail from Gray Falls Campground on N side of Trinity River and W side of New River,,,,244,800 ft,cch2,urn:uuid:23212242-f2bb-4ecd-9b69-db96406e75e6,http://cch2.org/portal/collections/individual/index.php?occid=1776753
1776767,HSC,HSC201531,HSC-27146,Nemophila menziesii,205099,4/30/1972,1972,4,30,121,30-Apr-72,,Trinity,5 mi. from junction with Hwy. 299 along Hennessy Rd.,,,,,,cch2,urn:uuid:b5a02450-f48a-4c60-9d99-233fddf56405,http://cch2.org/portal/collections/individual/index.php?occid=1776767
1777080,HSC,HSC201461,HSC-27545,Nemophila menziesii,205099,4/7/1973,1973,4,7,97,7-Apr-73,,Trinity,New River trail from Grays Falls Campground on the N side of the Trinity River and W side of the New River,,,,244,800 ft,cch2,urn:uuid:8cae87a8-444c-4c43-a64d-f223c1e1124b,http://cch2.org/portal/collections/individual/index.php?occid=1777080
1779928,HSC,HSC201468,HSC-31994,Nemophila menziesii,205099,5/4/1974,1974,5,4,124,4-May-74,,Lake,,,,,427,1400 ft,cch2,urn:uuid:f5f060d4-00f3-48e0-b8cf-14c2df03234c,http://cch2.org/portal/collections/individual/index.php?occid=1779928
1780239,HSC,HSC201487,HSC-32387,Nemophila menziesii var. atomaria,205101,5/11/1974,1974,5,11,131,11-May-74,,Humboldt,"Redwood National Park, Bald Hills Rd., Gans Prairie",,,,549,1800 ft,cch2,urn:uuid:15133e3e-7a1c-4acc-9ba0-1da5d31600f3,http://cch2.org/portal/collections/individual/index.php?occid=1780239
1780580,HSC,HSC201538,HSC-32730,Nemophila menziesii,205099,4/23/1973,1973,4,23,113,23-Apr-73,,Mendocino,E of Eden Valley Ranch along Toney Creek,,,,640,2100 ft,cch2,urn:uuid:37ddc0e2-2be4-4fcd-aadc-ff46028b319a,http://cch2.org/portal/collections/individual/index.php?occid=1780580
1780701,HSC,HSC201535,HSC-32847,Nemophila menziesii,205099,5/6/1973,1973,5,6,126,6-May-73,,Mendocino,SE end of Eden Valley,,,,,,cch2,urn:uuid:8faa0df3-e547-48c9-990b-16002f2f151c,http://cch2.org/portal/collections/individual/index.php?occid=1780701
1781669,HSC,HSC201525,HSC-34570,Nemophila menziesii,205099,5/3/1975,1975,5,3,123,3-May-75,,Lake,2.1 mi. N of junction of Bottle Rd. and Hwy. 175,,,,762,2500 ft,cch2,urn:uuid:15c4c45e-f2b3-4854-aafb-43c505156df8,http://cch2.org/portal/collections/individual/index.php?occid=1781669
1782006,HSC,HSC201480,HSC-34933,Nemophila menziesii,205099,3/25/1975,1975,3,25,84,25-Mar-75,,Sonoma,Beside Hwy. 128 E of Geyserville,,,,,,cch2,urn:uuid:c2141abd-af2f-4724-bb19-0fb1874b19b3,http://cch2.org/portal/collections/individual/index.php?occid=1782006
1782016,HSC,HSC201489,HSC-34946,Nemophila menziesii var. atomaria,205101,4/9/1975,1975,4,9,99,9-Apr-75,,Humboldt,2 3/4 mi. N of Trinidad at Scotty Point,,,,30,100 ft,cch2,urn:uuid:12c97648-6544-4505-b9a0-4422e100edee,http://cch2.org/portal/collections/individual/index.php?occid=1782016
1782028,HSC,HSC201496,HSC-34960,Nemophila menziesii var. atomaria,205101,5/24/1975,1975,5,24,144,24-May-75,,Humboldt,"McKeown Ranch, N of Dinsmore.",,,,,,cch2,urn:uuid:ddf0e7f1-1f8e-49c8-8181-4b4189247ffe,http://cch2.org/portal/collections/individual/index.php?occid=1782028
1782090,HSC,HSC201536,HSC-35029,Nemophila menziesii,205099,5/24/1975,1975,5,24,144,24-May-75,,Humboldt,"McKeown Ranch, N of Dinsmore.",,,,,,cch2,urn:uuid:5e83fe66-0225-4856-a490-23eda862286b,http://cch2.org/portal/collections/individual/index.php?occid=1782090
1782284,HSC,HSC201514,HSC-35256,Nemophila menziesii,205099,5/3/1975,1975,5,3,123,3-May-75,,Lake,5.8 mi. W of jct. with Rte. 29 on Scott,,,,915,3000 ft,cch2,urn:uuid:d9fd789c-d0f0-470e-8b1b-947538ba50ef,http://cch2.org/portal/collections/individual/index.php?occid=1782284
1782287,HSC,HSC201477,HSC-35261,Nemophila menziesii,205099,5/17/1975,1975,5,17,137,17-May-75,,Trinity,"Humboldt Meridian, SE facing slope on the trail to Denny at the confluence of the New River and Trinity River",,,,310,1017 ft,cch2,urn:uuid:2a5b0e06-698a-498b-bee0-a15d4ef53e92,http://cch2.org/portal/collections/individual/index.php?occid=1782287
1782352,HSC,HSC201510,HSC-35360,Nemophila menziesii,205099,5/3/1975,1975,5,3,123,3-May-75,,Lake,3.6 mi. W of junction with Hwy. 29 on Scott,,,,534,1750 ft,cch2,urn:uuid:08668615-5938-4df0-864c-99a3b73385d2,http://cch2.org/portal/collections/individual/index.php?occid=1782352
1782374,HSC,HSC201511,HSC-35381,Nemophila menziesii,205099,5/3/1975,1975,5,3,123,3-May-75,,Lake,2.1 mi. N of junction of Bottle Rd. and Hwy. 175,,,,762,2500 ft,cch2,urn:uuid:904135cc-e8bf-4bfb-be6e-ad8d8f909ef2,http://cch2.org/portal/collections/individual/index.php?occid=1782374
1783122,HSC,HSC201472,HSC-36378,Nemophila menziesii,205099,5/11/1975,1975,5,11,131,11-May-75,,Mendocino,Lower Wilderness Meadow,,,,415,1360 ft,cch2,urn:uuid:a8e0a03f-0a32-4d2f-9749-4f81c70cc400,http://cch2.org/portal/collections/individual/index.php?occid=1783122
1783563,HSC,HSC201530,HSC-36876,Nemophila menziesii,205099,4/18/1976,1976,4,18,109,18-Apr-76,,Humboldt,"Bald Hills Rd., 17 mi. from its jct. with Hwy. 101",,,,854,2800 ft,cch2,urn:uuid:7e24549d-9924-42fd-93a9-4dc6c45ced28,http://cch2.org/portal/collections/individual/index.php?occid=1783563
1783878,HSC,HSC201524,HSC-37202,Nemophila menziesii,205099,5/3/1975,1975,5,3,123,3-May-75,,Lake,3.6 mi. W of junction with Hwy. 29 on Scott,,,,534,1750 ft,cch2,urn:uuid:3580ae73-7f69-472c-9502-a8152b64a5a5,http://cch2.org/portal/collections/individual/index.php?occid=1783878
1784474,HSC,HSC201529,HSC-37991,Nemophila menziesii,205099,4/12/1976,1976,4,12,103,12-Apr-76,,Lake,"Along Morgan Valley Rd., 1.5 mi. from Napa County line",,,,671,2200 ft,cch2,urn:uuid:f8344c29-024f-44d2-8bcf-0712f7a5de60,http://cch2.org/portal/collections/individual/index.php?occid=1784474
1784722,HSC,HSC201494,HSC-38261,Nemophila menziesii var. atomaria,205101,3/11/1976,1976,3,11,71,11-Mar-76,,Humboldt,Beside Bridgeville-Kneeland Rd. at jct. with Redwood House Rd.,,,,,,cch2,urn:uuid:2d110602-9f3b-4b06-8554-fde940ef1364,http://cch2.org/portal/collections/individual/index.php?occid=1784722
1784938,HSC,HSC201462,HSC-38506,Nemophila menziesii,205099,4/19/1975,1975,4,19,109,19-Apr-75,,Monterey,15-20 mi. E on Nacimento Rd. from Hwy. 1,,,,183,600 ft,cch2,urn:uuid:e70ecff7-92ab-489d-a0c0-b009a7564ea2,http://cch2.org/portal/collections/individual/index.php?occid=1784938
1785537,HSC,HSC201497,HSC-39198,Nemophila menziesii var. atomaria,205101,7/6/1971,1971,7,6,187,6-Jul-71,,Humboldt,"1.0 mi. W of Pine Ridge Summit, 6 mi. E of junction with Redwood Valley Rd.",,,,,,cch2,urn:uuid:96bdab20-94da-4d2f-a654-0d195308fab6,http://cch2.org/portal/collections/individual/index.php?occid=1785537
1788609,HSC,HSC201503,HSC-43113,Nemophila menziesii var. menziesii,205103,5/14/1974,1974,5,14,134,14-May-74,,Humboldt,"Beside Hwy. 299, 14.2 mi. E of Bridgeville",,,,,,cch2,urn:uuid:ba89af87-5482-4a9c-a458-fde94c4f605f,http://cch2.org/portal/collections/individual/index.php?occid=1788609
1790909,HSC,HSC201475,HSC-45444,Nemophila menziesii,205099,4/16/1978,1978,4,16,106,16-Apr-78,,Lake,Bachelor Valley Rd. 50 yds. off N entrance from Hwy. 20,,,,396,1300 ft,cch2,urn:uuid:6ce760ed-d5f2-40e9-a131-1f14c5d3b94b,http://cch2.org/portal/collections/individual/index.php?occid=1790909
1791061,HSC,HSC201469,HSC-45622,Nemophila menziesii,205099,4/22/1978,1978,4,22,112,22-Apr-78,,Humboldt,"Tish Tang Campground, 5 miles north of Willow Creek on State Hwy. 96.",,,,,,cch2,urn:uuid:ec622a7e-58dd-4d8c-b6d6-590d04db4ade,http://cch2.org/portal/collections/individual/index.php?occid=1791061
1793151,HSC,HSC201479,HSC-48300,Nemophila menziesii,205099,3/31/1979,1979,3,31,90,31-Mar-79,,Mendocino,"MacKericker State Park, N of Fort Bragg",,,,,,cch2,urn:uuid:4e1c1e8c-c120-4e7e-b03c-2b43bc43b6a8,http://cch2.org/portal/collections/individual/index.php?occid=1793151
1794218,HSC,HSC201519,HSC-49363,Nemophila menziesii,205099,4/8/1979,1979,4,8,98,8-Apr-79,,Sonoma,Along Hwy. 128,,,,305,1000 ft,cch2,urn:uuid:7c8d0217-9988-4210-b47e-2608a6d1e58a,http://cch2.org/portal/collections/individual/index.php?occid=1794218
1795528,HSC,HSC201528,HSC-51156,Nemophila menziesii,205099,6/4/1979,1979,6,4,155,4-Jun-79,,Trinity,"Near Van Duzen River, close to the town of Alderpoint.",40.3341111,-123.385722,,853,2799 ft,cch2,urn:uuid:9ca37c85-f638-4a0b-bdb3-57111b340313,http://cch2.org/portal/collections/individual/index.php?occid=1795528
1800697,HSC,HSC201470,HSC-59333,Nemophila menziesii,205099,4/29/1979,1979,4,29,119,29-Apr-79,,Trinity,Gray,,,,305,1000 ft,cch2,urn:uuid:49fe41cc-0e4a-4842-ae3a-59a384858b97,http://cch2.org/portal/collections/individual/index.php?occid=1800697
1805499,HSC,HSC201533,HSC-65237,Nemophila menziesii,205099,3/20/1973,1973,3,20,79,20-Mar-73,,San Luis Obispo,"Price Canyon Rd., 3.5 mi. from Pismo Beach",,,,61,200 ft,cch2,urn:uuid:a843a0ba-e3b1-4269-a1aa-1808f95a59e1,http://cch2.org/portal/collections/individual/index.php?occid=1805499
1805878,HSC,HSC201534,HSC-65622,Nemophila menziesii,205099,4/5/1976,1976,4,5,96,5-Apr-76,,Mendocino,W of Lake-Mendocino Co. line on Co. Rd. 240,,,,549,1800 ft,cch2,urn:uuid:bb120be7-73c7-4261-9ee7-a619d909fb40,http://cch2.org/portal/collections/individual/index.php?occid=1805878
1806259,HSC,HSC201512,HSC-66012,Nemophila menziesii,205099,4/19/1980,1980,4,19,110,19-Apr-80,,Lake,"Coldsprings Campground, along access road to Indian Valley Dam.",,,,,,cch2,urn:uuid:86ff75aa-6f3f-4cd4-b519-244d08c09ce0,http://cch2.org/portal/collections/individual/index.php?occid=1806259
1811101,HSC,HSC201495,HSC-71028,Nemophila menziesii var. atomaria,205101,4/20/1977,1977,4,20,110,20-Apr-77,,Humboldt,Along FS 1N15 between Hwy. 36 and summit,,,,915,3000 ft,cch2,urn:uuid:a086b303-28af-45f9-bc3b-33f692c6747c,http://cch2.org/portal/collections/individual/index.php?occid=1811101
1811136,HSC,HSC201537,HSC-71063,Nemophila menziesii,205099,5/30/1977,1977,5,30,150,30-May-77,,Humboldt,McKeown Ranch; along road to Anderson,,,,854,2800 ft,cch2,urn:uuid:10cd63e3-0470-4f83-a0d5-19f2f70230df,http://cch2.org/portal/collections/individual/index.php?occid=1811136
1813138,HSC,HSC201520,HSC-73222,Nemophila menziesii,205099,5/25/1980,1980,5,25,146,25-May-80,,Trinity,Near Shannon Butte,40.1708333,-123.377222,,701,2299 ft,cch2,urn:uuid:08e98f2e-c115-4822-8cc1-a4f07a1f4322,http://cch2.org/portal/collections/individual/index.php?occid=1813138
1813707,HSC,HSC201471,HSC-73815,Nemophila menziesii,205099,6/7/1980,1980,6,7,159,7-Jun-80,,Humboldt,Near Brush Mtn.,40.9122222,-123.666667,,1128,3699 ft,cch2,urn:uuid:48b7e6f9-67c7-4c37-ba74-fc96579c322f,http://cch2.org/portal/collections/individual/index.php?occid=1813707
1816997,HSC,HSC201493,HSC-77392,Nemophila menziesii var. atomaria,205101,4/16/1983,1983,4,16,106,16-Apr-83,,Humboldt,Near the old Hwy. 299 on W side of Berry Summit.,,,,823,2700 ft,cch2,urn:uuid:2638cce4-f639-4d55-b704-08ce216ed89d,http://cch2.org/portal/collections/individual/index.php?occid=1816997
1824568,HSC,HSC201505,HSC-85866,Nemophila menziesii var. menziesii,205103,3/7/1987,1987,3,7,66,7-Mar-87,,Trinity,"End of South Fork Rd. ( F.S. 5N03), trail to Hell",,,,400,1312 ft,cch2,urn:uuid:92f86f33-31c0-4ce6-8d0b-76485df1c43b,http://cch2.org/portal/collections/individual/index.php?occid=1824568
1826208,HSC,HSC201473,HSC-87763,Nemophila menziesii,205099,4/29/1967,1967,4,29,119,29-Apr-67,,Colusa,"Bear Valley, 5 mi. N of Hwy. 20",,,,91,300 ft,cch2,urn:uuid:8419882e-6fc2-47f8-afd8-e8ae0fda1677,http://cch2.org/portal/collections/individual/index.php?occid=1826208
1826334,HSC,HSC201526,HSC-87900,Nemophila menziesii var. menziesii,205103,4/28/1980,1980,4,28,119,28-Apr-80,,Mendocino,"End of Hwy. 162, 3 mi. E of Covelo",,,,427,1400 ft,cch2,urn:uuid:8b5e5862-1a40-49cc-b53e-1711b516fb8a,http://cch2.org/portal/collections/individual/index.php?occid=1826334
1826335,HSC,HSC201527,HSC-87901,Nemophila menziesii var. menziesii,205103,4/24/1980,1980,4,24,115,24-Apr-80,,Mendocino,"Wheeler Ranch, 6 mi. SW of Yorkville",,,,335,1100 ft,cch2,urn:uuid:9f94202d-1bf9-4953-a2cd-5db46aef6a1a,http://cch2.org/portal/collections/individual/index.php?occid=1826335
1826336,HSC,HSC201482,HSC-87902,Nemophila menziesii var. atomaria,205101,3/25/1983,1983,3,25,84,25-Mar-83,,Mendocino,"Rte. 111, Mt. house Rd., 4 mi. N of Rte. 128",,,,274,900 ft,cch2,urn:uuid:1c2614a1-8b4a-461a-ae63-5cc43cf0c282,http://cch2.org/portal/collections/individual/index.php?occid=1826336
1826590,HSC,HSC201504,HSC-89473,Nemophila menziesii var. menziesii,205103,3/12/1986,1986,3,12,71,12-Mar-86,,Humboldt,"Trinidad Head, along trail",,,,61,200 ft,cch2,urn:uuid:b4a1a51b-e5b5-48ad-a271-6e8c0a360ad9,http://cch2.org/portal/collections/individual/index.php?occid=1826590
1831953,HSC,HSC201492,HSC-96266,Nemophila menziesii var. atomaria,205101,6/10/2005,2005,6,10,161,10-Jun-05,,Humboldt,"Cold Spring Camp, 7.4 mi. S of Hwy. 299 on NF 1",,,,1375,4510 ft,cch2,urn:uuid:a0780ec0-2d15-4c40-ae43-0a74196edbf5,http://cch2.org/portal/collections/individual/index.php?occid=1831953
1833033,HSC,HSC201484,HSC-97503,Nemophila menziesii var. atomaria,205101,5/8/2007,2007,5,8,128,8-May-07,,Humboldt,Cold Spring. 1/2 mile south of Titlow Hill.,,,,1410,4625 ft,cch2,urn:uuid:b982e925-01a7-4a3d-83b7-0505f2985b52,http://cch2.org/portal/collections/individual/index.php?occid=1833033
1833313,HSC,HSC201506,HSC-97903,Nemophila menziesii,205099,3/11/1995,1995,3,11,70,11-Mar-95,,Trinity,"12 mi. S on S Fork Rd from its intersection with Hwy. 299, 1.5 mi. on S Fork Trail 6E23",,,,,,cch2,urn:uuid:bee88c02-c9fc-4357-b895-5815a6b8570d,http://cch2.org/portal/collections/individual/index.php?occid=1833313
1893507,LOB,LOB100072,,Nemophila menziesii,205099,5/23/2018,2018,5,23,143,,flowers,Orange,"Santa Ana Mountains, Cleveland National Forest, Trabuco District, Main Divide Truck Trail, just East of Pleasants Peak.",33.7969,-117.607,,1130,,cch2,urn:uuid:3fc7c508-6871-4ea7-b8ab-f43eb7a7639f,http://cch2.org/portal/collections/individual/index.php?occid=1893507
1894958,UCSB,UCSB039252,71113,Nemophila menziesii subsp. integrifolia,210481,6/28/1982,1982,6,28,179,6/28/1982,,Kern,"Alta Sierra, Greenhorn Mt. 8 miles above Lake Isabella, off Hwy 155. Private Property (L. Theroux) abutting Sequuoia Nat'l Forest.; 35.738698 -118.555895; 35.738698 -118.555895",35.738698,-118.555895,500,1768,5800 ft.,cch2,urn:uuid:f26e920f-a771-495c-bc63-d1192b615010,http://cch2.org/portal/collections/individual/index.php?occid=1894958
2261809,LOB,LOB115763,13938,Nemophila menziesii subsp. menziesii,205100,3/10/1975,1975,3,10,69,,,Orange,San Juan Loop Trail,33.61255,-117.430611,725,,,cch2,urn:uuid:92cc906b-4bee-4bfe-9fb9-78a4e5da4759,http://cch2.org/portal/collections/individual/index.php?occid=2261809
2261810,LOB,LOB115764,4353,Nemophila menziesii subsp. integrifolia,210481,3/14/1970,1970,3,14,73,,,Orange,"Lion Canyon 2.25 miles east of San Juan Guard Station on state highway 74, western side of Santa Ana Mountains",33.602245,-117.460321,1506,366,1200ft,cch2,urn:uuid:8ae39229-191d-4be1-be83-8db331ede576,http://cch2.org/portal/collections/individual/index.php?occid=2261810
2261811,LOB,LOB115765,4344,Nemophila menziesii,205099,3/10/1972,1972,3,10,70,,,Orange,"1.5 miles east of San Juan Station, near Ortega Highway",33.594332,-117.487955,722,305,1000ft,cch2,urn:uuid:9b3f8107-7e04-4af3-96d0-ad677db2f83c,http://cch2.org/portal/collections/individual/index.php?occid=2261811
2261835,LOB,LOB115789,4338,Nemophila rotata,252839,4/27/1952,1952,4,27,118,,,Orange,Lower San Juan Camp; 33.607058 -117.43227,33.607058,-117.43227,1562,,,cch2,urn:uuid:fd5c51a2-025f-45d9-a6ef-5fd27b50828b,http://cch2.org/portal/collections/individual/index.php?occid=2261835
2273301,CAS,CAS-BOT-34776,7221,Nemophila menziesii var. umbrosa,,1903-06-00,1903,6,0,,3-Jun,,Santa Clara County,Loma Prieta Peak,,,,,,cch2,urn:uuid:76adce06-6de9-4c4d-84e8-9166ee938792,http://cch2.org/portal/collections/individual/index.php?occid=2273301
2280564,CAS,CAS-DS-24652,7216,Nemophila menziesii var. annulata,218999,1906-04-00,1906,4,0,,"Apr. 29, 1906",,San Bernardino County,"Dead Man's Point, near Victorville, on the Mohave Desert",,,,925,925 m,cch2,urn:uuid:2db71045-ac1c-4d65-aef5-e52f0d011b85,http://cch2.org/portal/collections/individual/index.php?occid=2280564
2314261,CAS,CAS-DS-135678,7217,Nemophila menziesii var. incana,252837,1902-05-00,1902,5,0,,"May 1--3, 1902",,Los Angeles County,"Antelope Valley, vicinity of Elizabeth Lake, Pine Canyon.",,,,1219,4000 ft,cch2,urn:uuid:4a14a479-2b72-485a-a280-0f8ee60187de,http://cch2.org/portal/collections/individual/index.php?occid=2314261
2331142,CAS,CAS-DS-135673,7220,Nemophila menziesii var. integrifolia,205102,1889-06-00,1889,6,0,,11 June 1889,,San Bernardino County,Near Summit of Waterman's Canyon,34.2281,-117.301,1200,1219,4000 ft,cch2,urn:uuid:06ae002e-67c8-4cae-8ad0-924fe757ac16,http://cch2.org/portal/collections/individual/index.php?occid=2331142
2359021,CAS,CAS-BOT-852,7233,Nemophila rotata,252839,1891-02-00,1891,2,0,,"2-28, 1891",,San Diego County,San Diego,,,,,,cch2,urn:uuid:321d2a8d-850f-44a9-b522-89d98d030456,http://cch2.org/portal/collections/individual/index.php?occid=2359021
2386904,CAS,CAS-DS-135662,7219,Nemophila menziesii acaulis,,1897-04-00,1897,4,0,,"Apr. 15--30, 1897",,Butte County,Near Clear Creek,,,,53,175 ft,cch2,urn:uuid:7669b3a5-fe86-4a5a-a5a5-7c60f5a20b17,http://cch2.org/portal/collections/individual/index.php?occid=2386904
2399229,CAS,CAS-DS-24619,7218,Nemophila menziesii var. minima,,1882-04-00,1882,4,0,,Apr 1882,,Los Angeles County,Pasadena,,,,,,cch2,urn:uuid:f7efe759-b025-48a5-884d-40f2d96d9925,http://cch2.org/portal/collections/individual/index.php?occid=2399229
2546637,CAS,CAS-DS-135657,213909,Nemophila menziesii var. annulata,218999,1906-04-00,1906,4,0,,"Apr. 29, 1906",,San Bernardino County,"Dead Man's Point, near Victorville, on the Mohave Desert, Lower Sonoran Zone.",,,,925,925 m,cch2,urn:uuid:c809fe58-800c-4e2e-88e9-ebd06c59fbdd,http://cch2.org/portal/collections/individual/index.php?occid=2546637
2889635,SDSU,SDSU06141,6141,Nemophila menziesii var. menziesii,205103,3/14/1971,1971,3,14,73,3/14/1971,,San Diego,"El Capitan Reservoir, south side of Chocolate Arm.",32.86654,-116.79655,2414,229,750ft.,cch2,urn:uuid:bfbf39bf-4ff8-4808-83c3-2c0a22f7d56e,http://cch2.org/portal/collections/individual/index.php?occid=2889635
3137227,UCR,UCR0077142,UCR-120179,Nemophila menziesii,205099,2/28/1998,1998,2,28,59,2/28/1998,,San Bernardino,"Wilders Canyon Pass, Fontana city limits, c. 0.5 miles SE of corner of Citrus Ave. and Poplar Ave.",34.03556,-117.4575,,427,,cch2,urn:uuid:1a675672-3e48-43d0-8771-ce96786aee0a,http://cch2.org/portal/collections/individual/index.php?occid=3137227
3142704,CSUSB,CSUSB93838,CSUSB-4284,Nemophila menziesii,205099,4/30/2014,2014,4,30,120,30-Apr-14,,San Bernardino,"Pacific Crest Trail, in the Cajon Pass, North of San Bernardino City.",34.31168,-117.4626,,1200,,cch2,urn:uuid:16c859c9-fe57-480e-9bc7-24d8443aa7a8,http://cch2.org/portal/collections/individual/index.php?occid=3142704
3143333,UCR,UCR0105292,UCR-288786,Nemophila menziesii var. menziesii,205103,5/7/2005,2005,5,7,127,5/7/2005,,Kern,Ft. Tejon State Park,34.8725,-118.89639,,1067,,cch2,urn:uuid:912c6ff2-be5f-4202-8766-8d6c659ad005,http://cch2.org/portal/collections/individual/index.php?occid=3143333
3146662,UCJEPS,UC767670,,Nemophila menziesii,205099,3/19/1938,1938,3,19,78,Mar 19 1938,Flowering/Fruiting,San Joaquin,"1 mi n Corral Hollow (near Alameda Co. line, San Joaquin); n of Corral Hollow",37.65059,-121.55563,3875,,,cch2,urn:uuid:3f808d1a-bbd1-44a7-b5a9-3f510219d7cc,http://cch2.org/portal/collections/individual/index.php?occid=3146662
3146786,UCJEPS,UC1069197,,Nemophila menziesii var. atomaria,205101,3/18/1934,1934,3,18,77,Mar 18 1934,Flowering/Fruiting,Marin,"Point Reyes Point Reyes Quad., Point Reyes",37.9965,-123.0162,100,182,600 ft,cch2,urn:uuid:c9478a4a-890f-47d8-985d-4cb6526315b8,http://cch2.org/portal/collections/individual/index.php?occid=3146786
3146789,UCJEPS,UC1069180,,Nemophila menziesii,205099,4/9/1936,1936,4,9,100,Apr 9 1936,Flowering/Fruiting,Tuolumne,"2 1/2 mi se Standard; Sonora Quad., se of Standard",37.9372,-120.2759,805,822,2700 ft,cch2,urn:uuid:a83489b2-b66f-400d-8140-d154d5cc26d5,http://cch2.org/portal/collections/individual/index.php?occid=3146789
3146854,UCJEPS,UC1784147,,Nemophila menziesii var. atomaria,205101,1/1/1930,1930,1,1,1,1930,Flowering/Fruiting,Marin,Point Reyes,,,13564,,,cch2,urn:uuid:7cb3187b-70a6-4e13-8ba3-06419d02abc5,http://cch2.org/portal/collections/individual/index.php?occid=3146854
3146870,UCJEPS,UC24251,,Nemophila menziesii var. atomaria,205101,1894-04-01,1894,4,1,91,"April 1-7, 1894",Flowering/Fruiting,Santa Clara,eastern slope Loma Prieta,37.11083,-121.84361,135,,,cch2,urn:uuid:b36bdc5c-6baa-4d6f-84c1-3651b7a7b6cb,http://cch2.org/portal/collections/individual/index.php?occid=3146870
3146931,UCJEPS,UC64757,,Nemophila menziesii,205099,1891-01-01,1891,1,1,1,1891,Flowering/Fruiting,Mariposa,Yosemite,37.745907,-119.594701,25255,,,cch2,urn:uuid:a465b53f-c804-40c6-8e2b-32143dcd2e22,http://cch2.org/portal/collections/individual/index.php?occid=3146931
3147306,UCJEPS,UC1019608,,Nemophila menziesii var. integrifolia,205102,4/10/1927,1927,4,10,100,Apr 10 1927,Flowering/Fruiting,San Diego,"3 mi below Dulzura (above Dulzura Creek); , below Dulzura",32.66879,-116.82444,402,,,cch2,urn:uuid:3aa7826b-4f8a-4f6f-9c39-0afe65eb823d,http://cch2.org/portal/collections/individual/index.php?occid=3147306
3147315,UCJEPS,UC1069189,,Nemophila menziesii var. integrifolia,205102,5/3/1935,1935,5,3,123,May 3 1935,Flowering/Fruiting,San Bernardino,"1 1/2 mi nne of n end Grass Valley; Deep Creek Quad., San Bernardino NF, nne of Grass Valley",34.287,-117.2157,805,1463,4800 ft,cch2,urn:uuid:925826e2-855b-49ef-bf0d-df4204d19b89,http://cch2.org/portal/collections/individual/index.php?occid=3147315
3147427,UCJEPS,UC24245,,Nemophila menziesii var. atomaria,205101,1864-04-01,1864,4,1,92,"April, 1864",Flowering/Fruiting,Sonoma,Cloverdale,38.80556,-123.01611,,,,cch2,urn:uuid:a43aeb68-2c28-441b-9110-f914edb9fc2c,http://cch2.org/portal/collections/individual/index.php?occid=3147427
3147457,UCJEPS,UC535387,,Nemophila menziesii var. integrifolia,205102,4/1/1929,1929,4,1,91,Apr. 1929,Flowering/Fruiting,Los Angeles,"Mandeville Canyon Santa Monica Mountains, Mandeville Canyon",34.09394,-118.50264,4265,350,350 m,cch2,urn:uuid:956ce21a-1dc9-4311-b88a-145a429e5f30,http://cch2.org/portal/collections/individual/index.php?occid=3147457
3147767,UCJEPS,UC24225,,Nemophila menziesii,205099,1897-03-31,1897,3,31,90,Mar 31 1897,Flowering/Fruiting,Tulare,Tulare,36.207886,-119.34564,8060,,,cch2,urn:uuid:f5d3ed72-5ed8-4757-bf9d-07df8ccac712,http://cch2.org/portal/collections/individual/index.php?occid=3147767
3147768,UCJEPS,UC562587,,Nemophila menziesii var. atomaria,205101,4/22/1933,1933,4,22,112,Apr 22 1933,Flowering/Fruiting,Del Norte,Coast Bluffs 5 mi s Crescent City; Coast Bluffs 5 mi s of Crescent City,41.749508,-124.194595,1622,152,500 ft,cch2,urn:uuid:50837c32-d39c-4f75-a008-65f58d98e33c,http://cch2.org/portal/collections/individual/index.php?occid=3147768
3147998,UCJEPS,UC284100,,Nemophila menziesii var. integrifolia,205102,4/1/1904,1904,4,1,92,4-Apr,Flowering/Fruiting,Los Angeles,Monrovia,,,,,,cch2,urn:uuid:bf7b9a49-3b7d-4849-9110-f6f5e0f70416,http://cch2.org/portal/collections/individual/index.php?occid=3147998
3148026,UCJEPS,UC56874,,Nemophila menziesii var. integrifolia,205102,5/1/1902,1902,5,1,121,May 1 1902-May 3 1902,Flowering/Fruiting,Los Angeles,"vicinity Elizabeth Lake; Antelope Valley, Pine Canyon; vicinity of Elizabeth Lake, Antelope Valley",34.667088,-118.400085,2393,1219,4000 ft,cch2,urn:uuid:ba14cca5-6ef2-4944-9108-c49f0e98a5e5,http://cch2.org/portal/collections/individual/index.php?occid=3148026
3148042,UCJEPS,UC606910,,Nemophila menziesii,205099,4/17/1938,1938,4,17,107,Apr 17 1938,Flowering/Fruiting,Mariposa,"13 mi w Mormon Bar (near Mariposa Creek); Sierra Nevada foothills, nr Mariposa Creek, w of Mormon Bar",37.39305556,-120.0077778,8047,457,1500 ft,cch2,urn:uuid:b2fc08e7-4228-4a84-a6cc-2184392a920f,http://cch2.org/portal/collections/individual/index.php?occid=3148042
3148320,UCJEPS,UC24257,,Nemophila menziesii var. atomaria,205101,1862-05-19,1862,5,19,139,May 19 1862,Flowering/Fruiting,San Francisco,between Mission Dolores and sea; San Francisoc,37.7745,-122.4591,3000,,,cch2,urn:uuid:4ba684bd-40f6-4610-9417-ce4422ff7b9e,http://cch2.org/portal/collections/individual/index.php?occid=3148320
3148321,UCJEPS,UC797643,,Nemophila menziesii var. integrifolia,205102,5/8/1935,1935,5,8,128,May 8 1935,Flowering/Fruiting,San Diego,on Black Canyon Rd 5 mi s Mesa Grande; s of Mesa Grande,33.136,-116.791,805,,,cch2,urn:uuid:3d8eecea-b3a8-43de-980c-9953f78e72b1,http://cch2.org/portal/collections/individual/index.php?occid=3148321
3148469,UCJEPS,UC111549,,Nemophila menziesii var. integrifolia,205102,7/15/1906,1906,7,15,196,Jul 15 1906,Flowering/Fruiting,San Bernardino,"Upper Santa Ana Canyon San Bernardino Mountains, Upper Santa Ana Canyon",,,,1402,4600 ft,cch2,urn:uuid:416e8d45-7fab-497c-9d42-bb698faca12b,http://cch2.org/portal/collections/individual/index.php?occid=3148469
3148497,UCJEPS,UC1375274,,Nemophila menziesii var. integrifolia,205102,6/5/1971,1971,6,5,156,Jun 5 1971,Flowering/Fruiting,San Bernardino,"San Sevaine Cow Camp San Bernardino National Forest, San Gabriel Mts. (San Gabriel Mts.)",34.2023,-117.4873,500,1417,4650 ft,cch2,urn:uuid:17be8cf3-597c-4457-8064-429a898d14f0,http://cch2.org/portal/collections/individual/index.php?occid=3148497
3148507,UCJEPS,UC1518672,,Nemophila menziesii var. integrifolia,205102,5/10/1979,1979,5,10,130,May 10 1979,Flowering/Fruiting,San Bernardino,"on road to Silverwood Lake above stream in Horsethief Canyon (s of junction with road to Hesperia); above stream Horsethief Canyon, rd to Hesperia",34.30317,-117.337528,900,1097,3600 ft,cch2,urn:uuid:2b250e8e-4836-4bb5-b6c2-6591508a2761,http://cch2.org/portal/collections/individual/index.php?occid=3148507
3148545,UCJEPS,UC24266,,Nemophila menziesii var. integrifolia,205102,1897-03-15,1897,3,15,74,Mar 15 1897,Flowering/Fruiting,Los Angeles,Santa Monica,34.01944,-118.49028,,,,cch2,urn:uuid:07ed8959-5d16-44d8-a2af-d231d811da4f,http://cch2.org/portal/collections/individual/index.php?occid=3148545
3148557,UCJEPS,UC284097,,Nemophila menziesii var. integrifolia,205102,4/1/1917,1917,4,1,91,Apr 01 1917,Flowering/Fruiting,San Bernardino,Cucamonga Canyon,34.1859,-117.6217,3000,914,3000 ft,cch2,urn:uuid:728beb2c-afc3-4c59-a41f-a1856b612b44,http://cch2.org/portal/collections/individual/index.php?occid=3148557
3148622,UCJEPS,UC67155,,Nemophila menziesii var. integrifolia,205102,1895-03-23,1895,3,23,82,Mar 23 1895,Flowering/Fruiting,San Diego,Point Loma,32.6948,-117.245,3219,,,cch2,urn:uuid:9fc3fc5a-b2f6-4a9b-9d4c-d03e143ae4b5,http://cch2.org/portal/collections/individual/index.php?occid=3148622
3148880,UCJEPS,UC1069181,,Nemophila menziesii,205099,4/26/1935,1935,4,26,116,Apr 26 1935,Flowering/Fruiting,Mariposa,"Wawona Yosemite Quad., Wawona",37.545,-119.6514,805,1219,4000 ft,cch2,urn:uuid:7e2d8845-d76c-4e8f-acb3-0e32abff99c3,http://cch2.org/portal/collections/individual/index.php?occid=3148880
3148996,UCJEPS,UC1069182,,Nemophila menziesii,205099,5/6/1935,1935,5,6,126,May 6 1935,Flowering/Fruiting,Mariposa,"Bull Run Valley Indian Gulch Quad., Bull Run Valley",37.3962,-120.0587,805,487,1600 ft,cch2,urn:uuid:f103f79d-d968-47b3-ba96-c551750553fc,http://cch2.org/portal/collections/individual/index.php?occid=3148996
3149030,UCJEPS,UC1301147,,Nemophila menziesii var. atomaria,205101,3/9/1963,1963,3,9,68,Mar 9 1963,Flowering/Fruiting,Marin,"Alpine Dam Road above Fairfax; San Francisco Bay Region, above Fairfax",37.969215,-122.62434,3891,243,800 ft,cch2,urn:uuid:3f86a064-ea5d-4ef2-9e6a-a2d1fd6fe0e0,http://cch2.org/portal/collections/individual/index.php?occid=3149030
3149043,UCJEPS,UC1518667,,Nemophila menziesii var. integrifolia,205102,5/10/1979,1979,5,10,130,May 10 1979,Flowering/Fruiting,San Bernardino,near junction of Grass Valley Creek and Mojave River; near junction of Grass Valley Creek and Mojave River,34.338878,-117.270458,1200,975,3200 ft,cch2,urn:uuid:69459f69-3ae4-487a-8443-39c89c1b4fc2,http://cch2.org/portal/collections/individual/index.php?occid=3149043
3149086,UCJEPS,UC24217,,Nemophila menziesii,205099,1897-04-01,1897,4,1,91,Apr. 1897,Flowering/Fruiting,Tulare,"Tulare head of the San Joaquin Valley, Tulare",36.207886,-119.34564,8060,,,cch2,urn:uuid:bab27b5a-d597-45a2-a1da-795b0c163810,http://cch2.org/portal/collections/individual/index.php?occid=3149086
3149088,UCJEPS,UC24273,,Nemophila menziesii var. integrifolia,205102,1896-05-20,1896,5,20,141,May 20 1896,Flowering/Fruiting,Los Angeles,Leonis Valley,34.62475,-118.30813,7000,,,cch2,urn:uuid:a56715da-e663-4e99-9674-a400dba5e887,http://cch2.org/portal/collections/individual/index.php?occid=3149088
3149091,UCJEPS,UC284098,,Nemophila menziesii var. integrifolia,205102,6/8/1917,1917,6,8,159,Jun 8 1917,Flowering/Fruiting,San Bernardino,"Canyon Diablo San Bernardino Mts., Canyon Diablo",34.2147,-117.3343,3500,609,2000 ft,cch2,urn:uuid:ce2d23bd-e086-4af4-87a0-3f15446f2e4b,http://cch2.org/portal/collections/individual/index.php?occid=3149091
3149130,UCJEPS,UC606911,,Nemophila menziesii,205099,5/7/1938,1938,5,7,127,May 7 1938,Flowering/Fruiting,Madera,"11 mi sw Coarse Gold (3 mi sw of Kelshaw Corners, Sierra Nevada foothills); Sierra Nevada foothills, sw of Coarse Gold",37.121006,-119.77128,2836,762,2500 ft,cch2,urn:uuid:d588dd0a-aaf6-4d1f-96b7-ec047a79e360,http://cch2.org/portal/collections/individual/index.php?occid=3149130
3149133,UCJEPS,UC606915,,Nemophila menziesii,205099,5/9/1938,1938,5,9,129,May 9 1938,Flowering/Fruiting,Fresno,"1.3 mi e Pinehurst (road to General Grant Park, Sierra Nevada foothills); Sierra Nevada foothills, e of Pinehurst",36.695316,-119.003845,2025,1219,4000 ft,cch2,urn:uuid:eadfc0cb-2c71-491b-9984-b13b58a3d6c2,http://cch2.org/portal/collections/individual/index.php?occid=3149133
3149139,UCJEPS,UC67154,,Nemophila menziesii var. integrifolia,205102,4/4/1904,1904,4,4,95,Apr 4 1904,Flowering/Fruiting,San Diego,Witch Creek,33.08272,-116.71691,3621,792,2600 ft,cch2,urn:uuid:6f21c8d7-bae3-4b47-a54d-5925fe1697d4,http://cch2.org/portal/collections/individual/index.php?occid=3149139
3149419,UCJEPS,UC24270,,Nemophila menziesii var. integrifolia,205102,1894-04-01,1894,4,1,91,Apr 1894,Flowering/Fruiting,San Diego,Witch Creek,33.08272,-116.71691,3621,,,cch2,urn:uuid:c27bff27-a008-4faa-b51a-83ed09516b57,http://cch2.org/portal/collections/individual/index.php?occid=3149419
3149587,UCJEPS,UC131457,,Nemophila menziesii var. integrifolia,205102,4/22/1904,1904,4,22,113,Apr 22 1904,Flowering/Fruiting,Los Angeles,Monrovia,,,,,,cch2,urn:uuid:09a74293-31bb-4058-a4fc-c67e7fb6f770,http://cch2.org/portal/collections/individual/index.php?occid=3149587
3149631,UCJEPS,UC204178,,Nemophila menziesii var. atomaria,205101,6/1/1903,1903,6,1,152,3-Jun,Flowering/Fruiting,Santa Clara,"Loma Prieta Peak; ; Loma Prieta Peak, Santa Clara Co.",37.10851,-121.83946,658,,,cch2,urn:uuid:246a5138-558a-4e14-9824-ebc23dd12ee4,http://cch2.org/portal/collections/individual/index.php?occid=3149631
3149639,UCJEPS,UC24226,,Nemophila menziesii,205099,1898-03-01,1898,3,1,60,"Mar, 1898",Flowering/Fruiting,Tulare,"35 mi e Visalia (near Grapevine Spring); San Joaquin Valley, , e of Visalia",36.49682,-118.81639,11681,,,cch2,urn:uuid:b3621d30-96ba-4af2-8c6b-319218ba12c3,http://cch2.org/portal/collections/individual/index.php?occid=3149639
3149640,UCJEPS,UC24271,,Nemophila menziesii var. integrifolia,205102,1896-05-15,1896,5,15,136,May 15 1896,Flowering/Fruiting,San Bernardino,vicinity San Bernardino; vicinity of San Bernardino,34.113067,-117.291902,10000,304,1000-1500 ft,cch2,urn:uuid:eac42d43-2d38-4985-a456-414a1ca196f7,http://cch2.org/portal/collections/individual/index.php?occid=3149640
3149649,UCJEPS,UC314574,,Nemophila menziesii var. integrifolia,205102,5/7/1926,1926,5,7,127,May 7 1926,Flowering/Fruiting,San Bernardino,Waterman Canyon,34.204324,-117.281563,3200,,,cch2,urn:uuid:e35cf632-dbe9-43cf-a4c8-d8ad8027609d,http://cch2.org/portal/collections/individual/index.php?occid=3149649
3149658,UCJEPS,UC373304,,Nemophila menziesii var. integrifolia,205102,1882-05-01,1882,5,1,121,"May, 1882",Flowering/Fruiting,Los Angeles,Pasadena,34.152867,-118.121454,6700,,,cch2,urn:uuid:8d3bf388-68f6-49c0-bc77-1b244d5afc46,http://cch2.org/portal/collections/individual/index.php?occid=3149658
3149744,UCJEPS,UC880914,,Nemophila menziesii,205099,4/20/1915,1915,4,20,110,Apr 20 1915,Flowering/Fruiting,Mariposa,Blochman's Ranch,37.4291,-120.0923,2500,,,cch2,urn:uuid:eb676dcf-a747-4de9-a84d-5495b0eb53bb,http://cch2.org/portal/collections/individual/index.php?occid=3149744
3150188,UCJEPS,UC457221,,Nemophila menziesii var. integrifolia,205102,5/16/1931,1931,5,16,136,May 16 1931,Flowering/Fruiting,Los Angeles,"Swartout Valley San Gabriel Mts., Swartout Valley",34.365782,-117.652957,3600,,,cch2,urn:uuid:6f25e1c2-e308-4ba1-aad4-945e9024a8aa,http://cch2.org/portal/collections/individual/index.php?occid=3150188
3150192,UCJEPS,UC495319,,Nemophila menziesii var. integrifolia,205102,5/15/1932,1932,5,15,136,May 15 1932,Flowering/Fruiting,San Diego,10 mi w Campo; w of Campo,32.60806,-116.62917,1609,914,3000 ft,cch2,urn:uuid:87f9fd91-18a9-442c-b4cb-f1d9b2117d23,http://cch2.org/portal/collections/individual/index.php?occid=3150192
3150222,UCJEPS,UC618484,,Nemophila menziesii,205099,5/4/1938,1938,5,4,124,May 4 1938,Flowering/Fruiting,Madera,near Bass Lake; near Bass Lake,37.31176,-119.547646,3232,,,cch2,urn:uuid:792302dc-7b63-4ed9-a708-288d602429b3,http://cch2.org/portal/collections/individual/index.php?occid=3150222
3150240,UCJEPS,UC67160,,Nemophila menziesii var. integrifolia,205102,4/10/1904,1904,4,10,101,Apr 10 1904,Flowering/Fruiting,San Diego,Mission Hills,32.75388,-117.18642,805,60,200 ft,cch2,urn:uuid:266e5312-82c4-4fe9-893c-8c6e7b62dfe0,http://cch2.org/portal/collections/individual/index.php?occid=3150240
3150290,UCJEPS,UC880907,,Nemophila menziesii var. integrifolia,205102,4/9/1940,1940,4,9,100,Apr 9 1940,Flowering/Fruiting,San Diego,"se about 20 mi Cuyamaca Lake (Laguna Mts.); , se of Cuyamaca Lake",32.85186,-116.45182,3219,1828,6000 ft,cch2,urn:uuid:e2551284-44f8-48ae-bd52-85a0d807cae8,http://cch2.org/portal/collections/individual/index.php?occid=3150290
3150616,UCJEPS,UC1069179,,Nemophila menziesii,205099,3/26/1936,1936,3,26,86,Mar 26 1936,Flowering/Fruiting,Tuolumne,"1 mi s Don Pedro Bar; Sonora Quad., s of Don Pedro Bar",37.7178,-120.3792,805,243,800 ft,cch2,urn:uuid:1a17ef62-a8d7-4ae3-b2b3-4ced50f910a9,http://cch2.org/portal/collections/individual/index.php?occid=3150616
3150629,UCJEPS,UC1103811,,Nemophila menziesii var. atomaria,205101,5/29/1922,1922,5,29,149,May 29 1922,Flowering/Fruiting,Humboldt,"South Yager Creek Valley Northern Coast Ranges, South Yager Creek Valley",,,,762,2500 ft,cch2,urn:uuid:2aba40b9-86d3-4c98-a876-ec4ca086ae6c,http://cch2.org/portal/collections/individual/index.php?occid=3150629
3150714,UCJEPS,UC24227,,Nemophila menziesii,205099,1890-01-01,1890,1,1,1,1890,Flowering/Fruiting,Riverside,San Jacinto,33.7883,-116.9604,20700,,,cch2,urn:uuid:be434c90-9775-451f-be37-aa77ef3a9065,http://cch2.org/portal/collections/individual/index.php?occid=3150714
3150725,UCJEPS,UC410629,,Nemophila menziesii var. atomaria,205101,3/29/1928,1928,3,29,89,Mar 29 1928,Flowering/Fruiting,Del Norte,flats near Adams Station; near Adams Station,41.84278,-123.99139,,,,cch2,urn:uuid:8ae1481c-321b-4f41-a541-e8adbec621bd,http://cch2.org/portal/collections/individual/index.php?occid=3150725
3150774,UCJEPS,UC72018,,Nemophila menziesii,205099,1890-01-01,1890,1,1,1,1890,Flowering/Fruiting,Stanislaus,La Grange,37.66361,-120.4625,,,,cch2,urn:uuid:a7246cb5-8f7a-4dcc-b043-af19e2ea2643,http://cch2.org/portal/collections/individual/index.php?occid=3150774
3151231,UCJEPS,UC131507,,Nemophila menziesii var. integrifolia,205102,4/1/1905,1905,4,1,91,Apr. 1905,Flowering/Fruiting,San Diego,Jacumba and Campo,32.64497,-116.33352,14481,,,cch2,urn:uuid:b3bc6e70-efe8-4d33-ae2b-877b74cb4c40,http://cch2.org/portal/collections/individual/index.php?occid=3151231
3151236,UCJEPS,UC1400331,,Nemophila menziesii var. integrifolia,205102,6/9/1971,1971,6,9,160,Jun 9 1971,Flowering/Fruiting,San Bernardino,"Cucamonga Canyon along truck trail San Bernardino National Forest, San Gabriel Mts.",34.18067,-117.63038,2000,792,2600 ft,cch2,urn:uuid:d44cfa6c-8418-4bad-8cb9-5ce306581146,http://cch2.org/portal/collections/individual/index.php?occid=3151236
3151291,UCJEPS,UC24268,,Nemophila menziesii var. integrifolia,205102,5/17/1901,1901,5,17,137,May 17 1901-Jun 1 1901,Flowering/Fruiting,San Diego,"Palomar French Valley (Smith Mt.), Palomar ((Smith Mt.) French Valley)",33.36033,-116.88417,2414,1828,6000 ft,cch2,urn:uuid:68decae9-9ace-460d-bd82-7fa0bb0951f4,http://cch2.org/portal/collections/individual/index.php?occid=3151291
3151293,UCJEPS,UC24247,,Nemophila menziesii var. atomaria,205101,1891-03-29,1891,3,29,88,Mar 29 1891,Flowering/Fruiting,Marin,Mill Valley,37.90611,-122.54389,2171,,,cch2,urn:uuid:01d4df88-21e4-4055-9597-43c75aa88051,http://cch2.org/portal/collections/individual/index.php?occid=3151293
3151294,UCJEPS,UC24261,,Nemophila menziesii var. atomaria,205101,,,,,,,Flowering/Fruiting,Humboldt,Hupa,41.0504,-123.6742,3350,,,cch2,urn:uuid:d204d9c8-a8e6-4001-a471-310ddd338a26,http://cch2.org/portal/collections/individual/index.php?occid=3151294
3151296,UCJEPS,UC24263,,Nemophila menziesii var. atomaria,205101,3/31/1902,1902,3,31,90,Mar 31 1902,Flowering/Fruiting,Sonoma,Kenwood,38.41389,-122.545,,,,cch2,urn:uuid:0b7e4e40-c73a-4f5a-b7a3-a593c2123e0e,http://cch2.org/portal/collections/individual/index.php?occid=3151296
3151342,UCJEPS,UC67157,,Nemophila menziesii var. integrifolia,205102,4/15/1903,1903,4,15,105,Apr 15 1903,Flowering/Fruiting,Los Angeles,,,,,,,cch2,urn:uuid:a56a9567-ed1d-4d63-83b5-331255999a0c,http://cch2.org/portal/collections/individual/index.php?occid=3151342
3151378,UCJEPS,UC880908,,Nemophila menziesii var. integrifolia,205102,6/5/1935,1935,6,5,156,Jun 5 1935,Flowering/Fruiting,San Bernardino,"Sawpit Canyon San Bernardino Mts., Sawpit Canyon",34.264,-117.3371,2500,1270,1270 m,cch2,urn:uuid:cca2fe18-3852-46c2-bac5-c7fd1fb3de5d,http://cch2.org/portal/collections/individual/index.php?occid=3151378
3151384,UCJEPS,UC923127,,Nemophila menziesii var. integrifolia,205102,4/23/1950,1950,4,23,113,Apr 23 1950,Flowering/Fruiting,San Bernardino,"one mi from Miller Canyon Public Camp (on road to Cajon from Big Bear); <nr> Miller Canyon Public Camp, rd to Cajon from Big Bear",,,,,,cch2,urn:uuid:1f8b302c-d937-4b18-a9eb-e7936d60630a,http://cch2.org/portal/collections/individual/index.php?occid=3151384
3151618,UCJEPS,UC24250,,Nemophila menziesii var. atomaria,205101,1894-04-01,1894,4,1,91,"April 1-7, 1894",Flowering/Fruiting,Santa Clara,eastern slope Loma Prieta,37.11083,-121.84361,135,,,cch2,urn:uuid:4efca179-d5ab-46f7-a0bc-b35b79adcf38,http://cch2.org/portal/collections/individual/index.php?occid=3151618
3151835,UCJEPS,UC168372,,Nemophila menziesii var. integrifolia,205102,1894-06-16,1894,6,16,167,Jun 16 1894,Flowering/Fruiting,San Diego,El Volcan,33.10202,-116.57905,403,,,cch2,urn:uuid:8773a35a-c199-4d8c-894d-ad949424d635,http://cch2.org/portal/collections/individual/index.php?occid=3151835
3151854,UCJEPS,UC24272,,Nemophila menziesii var. integrifolia,205102,1896-05-01,1896,5,1,122,"May, 1896",Flowering/Fruiting,Kern,Antelope Valley Antelope Valley (S. California),,,,,,cch2,urn:uuid:8f6caff8-abe4-472c-96f3-e8cd5727f609,http://cch2.org/portal/collections/individual/index.php?occid=3151854
3151872,UCJEPS,UC449909,,Nemophila menziesii var. integrifolia,205102,1884-04-05,1884,4,5,96,Apr 5 1884,Flowering/Fruiting,San Diego,,,,,,,cch2,urn:uuid:a244ac42-2f4c-4dd5-a66e-cc61bdd4432e,http://cch2.org/portal/collections/individual/index.php?occid=3151872
3151891,UCJEPS,UC562584,,Nemophila menziesii var. atomaria,205101,5/1/1932,1932,5,1,122,1-May-32,Flowering/Fruiting,Humboldt,Redway,40.12076,-123.82117,2427,182,600 ft,cch2,urn:uuid:ff34c26e-c4de-412e-9db3-7272a7d5bbd1,http://cch2.org/portal/collections/individual/index.php?occid=3151891
3151913,UCJEPS,UC666595,,Nemophila menziesii var. integrifolia,205102,4/19/1942,1942,4,19,109,Apr 19 1942,Flowering/Fruiting,San Diego,road to Palomar Mt. 2 1/2 mi from summit; road to Palomar Mt.,33.3436,-116.8804,401,,,cch2,urn:uuid:f027fc0d-794f-4167-9fe8-c39b6e052ff9,http://cch2.org/portal/collections/individual/index.php?occid=3151913
3151918,UCJEPS,UC67069,,Nemophila menziesii var. atomaria,205101,,,,,,,Flowering/Fruiting,Humboldt,Hupa Mts.,41.0963,-123.7028,5000,,,cch2,urn:uuid:5b047a75-a5c0-4087-9b13-3c7863730b0b,http://cch2.org/portal/collections/individual/index.php?occid=3151918
3151922,UCJEPS,UC697772,,Nemophila menziesii var. integrifolia,205102,4/3/1943,1943,4,3,93,Apr 3 1943,Flowering/Fruiting,Los Angeles,"Tanbark Flat San Gabriel Mts., Tanbark Flat",,,,822,2700 ft,cch2,urn:uuid:04c076d8-a35b-40d2-a26e-d2b26e2a9485,http://cch2.org/portal/collections/individual/index.php?occid=3151922
3152186,UCJEPS,UC24249,,Nemophila menziesii var. atomaria,205101,1894-03-31,1894,3,31,90,Mar 31 1894,Flowering/Fruiting,Marin,Olema,38.040913,-122.78589,1622,,,cch2,urn:uuid:69c020f2-b7c7-4c09-a36f-390fc606cc44,http://cch2.org/portal/collections/individual/index.php?occid=3152186
3152227,UCJEPS,UC64756,,Nemophila menziesii var. atomaria,205101,4/1/1902,1902,4,1,91,2-Apr,,Del Norte,Smith River,,,,,,cch2,urn:uuid:af30c08f-3a0a-4397-b58c-0e5b6c920413,http://cch2.org/portal/collections/individual/index.php?occid=3152227
3152434,UCJEPS,UC24267,,Nemophila menziesii var. integrifolia,205102,5/11/1902,1902,5,11,131,May 11 1902,Flowering/Fruiting,Los Angeles,Sierra Santa Monica,,,,,,cch2,urn:uuid:7fff1af9-0706-40cf-a84f-50ca5a63a32a,http://cch2.org/portal/collections/individual/index.php?occid=3152434
3152480,UCJEPS,UC630489,,Nemophila menziesii var. atomaria,205101,5/1/1938,1938,5,1,121,"May, 1938",Flowering/Fruiting,Del Norte,"Darlingtonia , Darlingtonia (Smith River)",41.836933,-123.94048,9669,121,400 ft,cch2,urn:uuid:2d85a9de-c1fb-4b0f-a6d1-9f7cb5a6c2d2,http://cch2.org/portal/collections/individual/index.php?occid=3152480
3152490,UCJEPS,UC67068,,Nemophila menziesii var. atomaria,205101,,,,,,,Flowering/Fruiting,Mendocino,,,,,,,cch2,urn:uuid:d5fb08a9-0e45-4a76-b584-45379dc96fd1,http://cch2.org/portal/collections/individual/index.php?occid=3152490
3152712,UCJEPS,UC59717,,Nemophila menziesii var. atomaria,205101,1875-01-01,1875,1,1,1,1875,Flowering/Fruiting,,[uncertain],,,,,,cch2,urn:uuid:4999b3c5-5ac9-48d7-9dac-029ed00e0630,http://cch2.org/portal/collections/individual/index.php?occid=3152712
3152966,UCJEPS,UC1602053,,Nemophila menziesii var. integrifolia,205102,,,,,,,Flowering/Fruiting,San Diego,San Diego,32.73409,-117.12945,9654,,,cch2,urn:uuid:364d2d66-2cfe-4de8-9033-d4bba23114e9,http://cch2.org/portal/collections/individual/index.php?occid=3152966
3152982,UCJEPS,UC197349,,Nemophila menziesii var. integrifolia,205102,1885-04-01,1885,4,1,91,Apr. 1885,Flowering/Fruiting,San Bernardino,East Twin Creek,34.1861,-117.2557,2000,609,2000 ft,cch2,urn:uuid:9f9b5e6d-510c-4f34-a56d-762a6741ad04,http://cch2.org/portal/collections/individual/index.php?occid=3152982
3153005,UCJEPS,UC404764,,Nemophila menziesii var. atomaria,205101,4/10/1930,1930,4,10,100,Apr 10 1930,Flowering/Fruiting,Marin,Corte Madera Corte Madera (in fields near highway),37.92556,-122.52639,,3,10 ft,cch2,urn:uuid:20c9625e-ccb6-4ec3-89c2-b2713d68ed0a,http://cch2.org/portal/collections/individual/index.php?occid=3153005
3153009,UCJEPS,UC486458,,Nemophila menziesii var. integrifolia,205102,6/1/1932,1932,6,1,153,Jun-32,Flowering/Fruiting,San Diego,Banner Grade,33.0782,-116.565,2575,,,cch2,urn:uuid:9c312d29-4124-4537-b51a-96c971b18c55,http://cch2.org/portal/collections/individual/index.php?occid=3153009
3153055,UCJEPS,UC67151,,Nemophila menziesii var. atomaria,205101,1899-03-01,1899,3,1,60,Mar-Apr 1899,Flowering/Fruiting,Sonoma,"near Kenwood (Dr. Turk Canyon); Dr Turk Canyon, near Kenwood",,,,,,cch2,urn:uuid:3be03cd6-5552-4132-a880-22a3df3eba71,http://cch2.org/portal/collections/individual/index.php?occid=3153055
3153076,UCJEPS,UC765438,,Nemophila menziesii,205099,2/9/1935,1935,2,9,40,Feb 9 1935,Flowering/Fruiting,Madera,8 mi w Chowchilla; w of Chowchilla,37.118904,-120.409256,11246,,,cch2,urn:uuid:cd8ec0ac-7b1e-4ef0-8aac-2574908855b9,http://cch2.org/portal/collections/individual/index.php?occid=3153076
3153445,UCJEPS,UC1237966,,Nemophila menziesii var. atomaria,205101,2/17/1961,1961,2,17,48,Feb 17 1961,Flowering/Fruiting,Napa,2.6 mi s Napa State Hospital (in a pasture beside State Highway 12); s of Napa State Hospital,,,,,,cch2,urn:uuid:c98fd5e1-a495-4a06-ab1b-fb7cf0b379dc,http://cch2.org/portal/collections/individual/index.php?occid=3153445
3153495,UCJEPS,UC1787811,,Nemophila menziesii var. integrifolia,205102,4/19/2002,2002,4,19,109,4/19/2002,,San Diego,Kelley/Rebman Ranch at 565 Anderson Truck Trail on northwest side of Viejas Mountain: approx. 2 miles north of Victoria Road in Alpine,32.87278,-116.7475,,818,818 m,cch2,urn:uuid:b9940028-12aa-4fe6-8704-611ecf3c31bb,http://cch2.org/portal/collections/individual/index.php?occid=3153495
3153511,UCJEPS,UC24256,,Nemophila menziesii var. atomaria,205101,1898-03-01,1898,3,1,60,"March, 1898",Flowering/Fruiting,Sonoma,Cloverdale,,,,,,cch2,urn:uuid:e7b41ddc-1be5-4cf9-b07c-4feed97a76e3,http://cch2.org/portal/collections/individual/index.php?occid=3153511
3153547,UCJEPS,UC562582,,Nemophila menziesii var. atomaria,205101,4/15/1923,1923,4,15,105,Apr 15 1923,Flowering/Fruiting,Humboldt,"at Berry's North Coast Ranges, , Berry's (Redwood Creek)",,,,274,900 ft,cch2,urn:uuid:d93d87a7-4c0e-4846-a72a-06168f1e39c6,http://cch2.org/portal/collections/individual/index.php?occid=3153547
3153568,UCJEPS,UC63800,,Nemophila menziesii var. integrifolia,205102,6/1/1901,1901,6,1,152,"June, 1901",Flowering/Fruiting,Riverside,"wooded slopes and benches of the s side San Jacinto Mts. San Jacinto Mountains, Shingle Val. (Shingle Val.)",33.6784,-116.648,7250,1371,4500 ft,cch2,urn:uuid:ca2c133e-b4e5-422e-82a7-c9b8c6d45527,http://cch2.org/portal/collections/individual/index.php?occid=3153568
3153849,UCJEPS,UC63799,,Nemophila menziesii var. integrifolia,205102,5/17/1901,1901,5,17,137,May 17 1901-Jun 1 1901,Flowering/Fruiting,Riverside,Strawberry Valley fide Herb. Jepson! according to L. Constance 1938 Strawberry Valley fide Herb. Jepson! according to L. Constan,33.74553,-116.71441,8047,,,cch2,urn:uuid:155f0a19-ed9d-438e-b867-d5eb4bd2adf8,http://cch2.org/portal/collections/individual/index.php?occid=3153849
3154000,UCJEPS,UC1190350,,Nemophila menziesii,205099,4/12/1958,1958,4,12,102,Apr 12 1958,Flowering/Fruiting,Tuolumne,4.9 mi sw Tuolumne (along road to Groveland); sw of Tuolumne along road to Groveland,37.912895,-120.28319,325,,,cch2,urn:uuid:ca7d0fce-ac5d-409f-8b1c-5963a167d11a,http://cch2.org/portal/collections/individual/index.php?occid=3154000
3154047,UCJEPS,UC177171,,Nemophila menziesii var. atomaria,205101,5/4/1913,1913,5,4,124,May 4 1913,Flowering/Fruiting,Humboldt,"Kneeland Prairie Northern Coast Ranges, Kneeland Prairie",40.76145935,-123.9930191,1622,762,2500 ft,cch2,urn:uuid:2d6b2d5a-f5da-4be2-898d-459e813b2ace,http://cch2.org/portal/collections/individual/index.php?occid=3154047
3154060,UCJEPS,UC203959,,Nemophila menziesii var. atomaria,205101,4/7/1918,1918,4,7,97,Apr 7 1918,Flowering/Fruiting,Humboldt,"Moonstone Beach Northern Coast Ranges, Little River, Moonstone Beach (mouth of Little River, grassy slopes facing ocean)",,,,15,50 ft,cch2,urn:uuid:b221a56d-e914-4bee-a131-4b6adf0d2924,http://cch2.org/portal/collections/individual/index.php?occid=3154060
3154072,UCJEPS,UC24253,,Nemophila menziesii var. atomaria,205101,1891-03-01,1891,3,1,60,Mar 1891,Flowering/Fruiting,Sonoma,Sonoma,38.29194,-122.45694,,,,cch2,urn:uuid:a207c2b1-55a7-4003-b816-947580307ba3,http://cch2.org/portal/collections/individual/index.php?occid=3154072
3154085,UCJEPS,UC449913,,Nemophila menziesii,205099,1891-04-01,1891,4,1,91,Apr. 1891,Flowering/Fruiting,Fresno,Alcalde,,,,,,cch2,urn:uuid:08a9209c-6477-4d8d-8512-29888fc3c66e,http://cch2.org/portal/collections/individual/index.php?occid=3154085
3154118,UCJEPS,UC66829,,Nemophila menziesii var. integrifolia,205102,1/4/1904,1904,1,4,4,Jan 4 1904,Flowering/Fruiting,Monterey,Highland Sand Canyon,,,,,,cch2,urn:uuid:6faf3597-94d0-49fc-b9d6-4f2292ec9c4b,http://cch2.org/portal/collections/individual/index.php?occid=3154118
3154158,UCJEPS,UC880904,,Nemophila menziesii var. atomaria,205101,5/7/1938,1938,5,7,127,May 7 1938,Flowering/Fruiting,Marin,"Point Reyes near the lighthouse grounds (on western slope of coastal bluff); Point Reyes, nar the lighthouse grounds",37.99583,-123.02222,2427,121,400 ft,cch2,urn:uuid:a3c7d5d3-3d20-4861-a8a4-53fe70427686,http://cch2.org/portal/collections/individual/index.php?occid=3154158
3154161,UCJEPS,UC880895,,Nemophila menziesii var. atomaria,205101,5/13/1941,1941,5,13,133,May 13 1941,Flowering/Fruiting,Marin,"6 mi w Novato (Hicks Valley); , w of Novato",38.119377,-122.66563,7041,60,200 ft,cch2,urn:uuid:b131fcff-0391-483d-825c-da8dba07c7cc,http://cch2.org/portal/collections/individual/index.php?occid=3154161
3154326,UCJEPS,UC1979852,,Nemophila menziesii var. integrifolia,205102,5/21/2008,2008,5,21,142,21-May-08,Flowering/Fruiting,San Bernardino,Transverse Ranges; San Bernadino Mountains region: East of Rock Camp Station. North of Lake Arrowhead.,34.28903,-117.20592,,1469,1469,cch2,urn:uuid:2a9e6cde-2381-44a0-9db9-0cea2bd3a1c2,http://cch2.org/portal/collections/individual/index.php?occid=3154326
3154339,UCJEPS,UC58514,,Nemophila menziesii var. atomaria,205101,4/23/1903,1903,4,23,113,Apr 23 1903,Flowering/Fruiting,Sonoma,Fort Ross,38.51417,-123.2425,,,,cch2,urn:uuid:4d7a9312-3474-4c2c-9512-d9144df7b8fa,http://cch2.org/portal/collections/individual/index.php?occid=3154339
3154366,UCJEPS,UC24213,,Nemophila menziesii,205099,4/10/1901,1901,4,10,100,Apr 10 1901,Flowering/Fruiting,Tulare,Kaweah,36.469776,-118.91665,3634,,,cch2,urn:uuid:767ceffe-477d-406c-9a6f-fbb6255989cc,http://cch2.org/portal/collections/individual/index.php?occid=3154366
3154525,UCJEPS,UC126906,,Nemophila menziesii var. integrifolia,205102,4/10/1906,1906,4,10,100,Apr 10 1906,Flowering/Fruiting,San Diego,Point Loma,32.6948,-117.245,3219,,,cch2,urn:uuid:51f96489-b3a5-4244-961c-5c462f77b502,http://cch2.org/portal/collections/individual/index.php?occid=3154525
3154564,UCJEPS,UC1745872,,Nemophila menziesii var. integrifolia,205102,5/18/1947,1947,5,18,138,5/18/1947,Flowering/Fruiting,San Diego,Summit of Hot Springs Mtn.,33.31375,-116.57718,403,,,cch2,urn:uuid:8bfba6fa-623d-4951-88a5-eae34d2df7ca,http://cch2.org/portal/collections/individual/index.php?occid=3154564
3154572,UCJEPS,UC1927593,,Nemophila menziesii var. integrifolia,205102,2/22/2003,2003,2,22,53,02 22 2003,,Kern,Sierra Nevada; Southern Sierra Nevada region; THE OWENS PEAK EASTERN WATERSHED. Upper reaches of Short Canyon. SW side of canyn.,35.7156,-117.9286,,1372,1372 m,cch2,urn:uuid:6e4cb75a-7d8f-4eac-a10d-50d88071d574,http://cch2.org/portal/collections/individual/index.php?occid=3154572
3154598,UCJEPS,UC501494,,Nemophila menziesii var. integrifolia,205102,5/29/1932,1932,5,29,150,May 29 1932,Flowering/Fruiting,Los Angeles,"head Arrastre Canyon; San Gabriel Mts., head of Arrastre Canyon",34.390608,-118.16492,2000,1524,5000 ft,cch2,urn:uuid:95a37a87-e68d-4e66-9e9a-ff3bbf249e2a,http://cch2.org/portal/collections/individual/index.php?occid=3154598
3154626,UCJEPS,UC64044,,Nemophila menziesii var. integrifolia,205102,1895-04-20,1895,4,20,110,Apr 20 1895,Flowering/Fruiting,San Bernardino,Edgar Canyon San Bernardino Mts. Edgar Canyon (San Bernardino Mts.),33.9975,-116.9604,3000,,,cch2,urn:uuid:b9c2c542-c337-4267-a8c7-4b741017b373,http://cch2.org/portal/collections/individual/index.php?occid=3154626
3154663,UCJEPS,UC765437,,Nemophila menziesii,205099,3/25/1937,1937,3,25,84,Mar 25 1937,Flowering/Fruiting,Madera,8 mi w Chowchilla; w of Chowchilla,37.118904,-120.409256,11246,,,cch2,urn:uuid:7f033ed4-7266-46ec-a51e-58827572dae1,http://cch2.org/portal/collections/individual/index.php?occid=3154663
3155164,UCJEPS,UC249525,,Nemophila menziesii var. atomaria,205101,4/30/1922,1922,4,30,120,Apr 30 1922,Flowering/Fruiting,Humboldt,"near Willow Creek (Trinity River Valley); Northern Coast Ranges, , nr Willow Creek",,,,152,500 ft,cch2,urn:uuid:b682bc3f-e8aa-4a21-8440-07bfcaed3b3f,http://cch2.org/portal/collections/individual/index.php?occid=3155164
3155182,UCJEPS,UC489143,,Nemophila menziesii var. integrifolia,205102,4/1/1927,1927,4,1,91,27-Apr,Flowering/Fruiting,San Diego,Escondido,33.12177,-117.06739,4828,,,cch2,urn:uuid:f0f64e66-3fb7-41e0-bb5f-ed76ae2bd9bf,http://cch2.org/portal/collections/individual/index.php?occid=3155182
3155209,UCJEPS,UC606952,,Nemophila menziesii var. atomaria,205101,4/24/1938,1938,4,24,114,Apr 24 1938,Flowering/Fruiting,Sonoma,mouth of small canyon 0.5 mi s Fort Ross; s of Fort Ross,38.51387,-123.23447,1695,91,300 ft,cch2,urn:uuid:e19ee23c-8b75-4630-a3c1-f56367c905e1,http://cch2.org/portal/collections/individual/index.php?occid=3155209
3155210,UCJEPS,UC596364,,Nemophila menziesii,205099,5/29/1938,1938,5,29,149,May 29 1938,Flowering/Fruiting,Madera,Coarsegold,37.26346,-119.693054,818,,,cch2,urn:uuid:71bfa45f-da80-4b58-a558-3d9d285da5e0,http://cch2.org/portal/collections/individual/index.php?occid=3155210
3155222,UCJEPS,UC67153,,Nemophila menziesii var. integrifolia,205102,1894-03-28,1894,3,28,87,Mar 28 1894,Flowering/Fruiting,San Diego,Encinitas,33.0435,-117.2639,3218,,,cch2,urn:uuid:86b4d055-e90f-41be-b573-809e75d6b657,http://cch2.org/portal/collections/individual/index.php?occid=3155222
3155269,UCJEPS,UC880919,,Nemophila menziesii,205099,4/11/1919,1919,4,11,101,Apr 11 1919-Apr 16 1919,Flowering/Fruiting,Tuolumne,near French Flat; near French Flat,37.97222,-120.47028,,365,1200 ft,cch2,urn:uuid:df1ed2f7-79bd-437e-b1c4-68f87dd7797c,http://cch2.org/portal/collections/individual/index.php?occid=3155269
3155706,UCJEPS,UC1541385,,Nemophila menziesii var. atomaria,205101,5/1/1934,1934,5,1,121,May-34,Flowering/Fruiting,Del Norte,"Darlingtonia , Darlingtonia (Smith River)",41.836933,-123.94048,9669,,,cch2,urn:uuid:5d417465-5d2c-4afa-b4b3-7c8c4e6e9fe8,http://cch2.org/portal/collections/individual/index.php?occid=3155706
3155782,UCJEPS,UC562586,,Nemophila menziesii var. atomaria,205101,4/17/1927,1927,4,17,107,Apr 17 1927,Flowering/Fruiting,Humboldt,,,,,274,900 ft,cch2,urn:uuid:97b80b94-a248-4033-813d-378717e5cef8,http://cch2.org/portal/collections/individual/index.php?occid=3155782
3155791,UCJEPS,UC592134,,Nemophila menziesii var. atomaria,205101,3/24/1928,1928,3,24,84,Mar 24 1928,Flowering/Fruiting,Marin,"Millerton , Millerton (Tomales Bay)",38.109177,-122.84334,3053,,,cch2,urn:uuid:a93d8522-2208-4b7d-88b5-021409c590b2,http://cch2.org/portal/collections/individual/index.php?occid=3155791
3155837,UCJEPS,UC75479,,Nemophila menziesii var. integrifolia,205102,4/29/1906,1906,4,29,119,Apr 29 1906,Flowering/Fruiting,San Bernardino,"near Victorville; Mohave Desert, Dead Man's Point; Dead Man's Point, near Victorville, San Bernardino Co., Mohave Desert",34.473101,-117.124596,2000,925,925 m,cch2,urn:uuid:d6275efe-cbd2-4496-a960-b5ab36c62f75,http://cch2.org/portal/collections/individual/index.php?occid=3155837
3156233,UCJEPS,UC1239752,,Nemophila menziesii var. atomaria,205101,4/1/1923,1923,4,1,91,1-Apr-23,Flowering/Fruiting,Humboldt,"3 mi e Blue Lake (Mankin Place); e of Blue Lake, Mankin Place",,,,274,900 ft,cch2,urn:uuid:58eca219-49e2-4bff-a0d6-e11ba7c3de62,http://cch2.org/portal/collections/individual/index.php?occid=3156233
3156239,UCJEPS,UC126907,,Nemophila menziesii var. integrifolia,205102,4/10/1906,1906,4,10,100,Apr 10 1906,Flowering/Fruiting,San Diego,Point Loma,32.6948,-117.245,3219,,,cch2,urn:uuid:8b7dc3b4-c7a3-4e21-a4ff-5724bc23ad65,http://cch2.org/portal/collections/individual/index.php?occid=3156239
3156313,UCJEPS,UC449915,,Nemophila menziesii var. atomaria,205101,5/15/1914,1914,5,15,135,May 15 1914,Flowering/Fruiting,Trinity,near Weaverville; near Weaverville,40.73111,-122.94083,,624,2050 ft,cch2,urn:uuid:bbb9d954-c8c2-4492-a702-11c738cb55be,http://cch2.org/portal/collections/individual/index.php?occid=3156313
3156362,UCJEPS,UC67150,,Nemophila menziesii var. atomaria,205101,3/15/1901,1901,3,15,74,Mar 15 1901,Flowering/Fruiting,San Mateo,"cliffs w Colma; Region of San Francisco Bay, w of Colma",37.673225,-122.474915,2025,,,cch2,urn:uuid:2b066024-9e3f-44d6-bc8c-d919a1f85b69,http://cch2.org/portal/collections/individual/index.php?occid=3156362
3156374,UCJEPS,UC72013,,Nemophila menziesii var. atomaria,205101,1898-03-26,1898,3,26,85,Mar 26 1898,Flowering/Fruiting,Sonoma,near Melita; near Melita,38.45667,-122.63583,,,,cch2,urn:uuid:0fea0e16-4fca-479a-b74b-3feec708eee0,http://cch2.org/portal/collections/individual/index.php?occid=3156374
3156648,UCJEPS,UC1611538,,Nemophila menziesii,205099,4/15/1993,1993,4,15,105,Apr 15 1993,Flowering/Fruiting,Los Angeles,"Los Pinetos Spring wester San Gabriel Mtns., San Fernando 7.5' USGS quad, Los P (at head of canyon)",34.3594,-118.4386,805,893,2930 ft,cch2,urn:uuid:2b0958cb-a679-46db-81df-33a2c7250370,http://cch2.org/portal/collections/individual/index.php?occid=3156648
3156649,UCJEPS,UC67070,,Nemophila menziesii var. atomaria,205101,,,,,,,Flowering/Fruiting,Alameda,Redwood Region,,,,,,cch2,urn:uuid:bc37608a-d32f-4036-87d1-1da60abd89e4,http://cch2.org/portal/collections/individual/index.php?occid=3156649
3156650,UCJEPS,UC1602052,,Nemophila menziesii var. atomaria,205101,1891-04-01,1891,4,1,91,Apr 1891,Flowering/Fruiting,Marin,Fairfax,37.98722,-122.58778,2564,,,cch2,urn:uuid:5536ac18-986d-4f59-b918-c211617e1355,http://cch2.org/portal/collections/individual/index.php?occid=3156650
3156765,UCJEPS,UC1019585,,Nemophila menziesii var. integrifolia,205102,4/10/1927,1927,4,10,100,Apr 10 1927,Flowering/Fruiting,San Diego,"3 mi below Dulzura (above Dulzura Creek); , below Dulzura",32.66879,-116.82444,402,,,cch2,urn:uuid:b80dd792-cf57-40f0-9611-ed7427b66344,http://cch2.org/portal/collections/individual/index.php?occid=3156765
3156774,UCJEPS,UC107234,,Nemophila menziesii var. integrifolia,205102,1888-01-01,1888,1,1,1,1888,Flowering/Fruiting,Santa Barbara,"near Santa Barbara (Santa Inez Mountains); near Santa Barbara, Santa Inez Mountains",34.51071,-119.75318,11265,,,cch2,urn:uuid:94ee51b9-5cde-4445-9a0a-57f205c96f70,http://cch2.org/portal/collections/individual/index.php?occid=3156774
3156818,UCJEPS,UC126909,,Nemophila menziesii var. integrifolia,205102,4/10/1906,1906,4,10,100,Apr 10 1906,Flowering/Fruiting,San Diego,"near San Diego (Point Loma); , near San Diego",32.6948,-117.245,3219,,,cch2,urn:uuid:25d58890-03fb-4704-a30e-1c3150deaa0b,http://cch2.org/portal/collections/individual/index.php?occid=3156818
3156819,UCJEPS,UC126908,,Nemophila menziesii var. integrifolia,205102,4/10/1906,1906,4,10,100,Apr 10 1906,Flowering/Fruiting,San Diego,"near San Diego (Point Loma); , near San Diego",32.6948,-117.245,3219,,,cch2,urn:uuid:a8acddef-05b8-4138-9eb4-78804cbc58f5,http://cch2.org/portal/collections/individual/index.php?occid=3156819
3156824,UCJEPS,UC131504,,Nemophila menziesii var. integrifolia,205102,4/4/1903,1903,4,4,94,Apr 4 1903,Flowering/Fruiting,Riverside,Elsinore,33.6814,-117.3608,4000,,,cch2,urn:uuid:5eb3015b-79f6-41b8-9396-e92972fb64c8,http://cch2.org/portal/collections/individual/index.php?occid=3156824
3156855,UCJEPS,UC163963,,Nemophila menziesii var. atomaria,205101,5/6/1906,1906,5,6,126,May 6 1906,Flowering/Fruiting,Humboldt,near Hydesville; near Hydesville,40.5432,-124.1006,2000,60,60 m,cch2,urn:uuid:c8700cf7-7f11-4535-9aad-aaad383a93ea,http://cch2.org/portal/collections/individual/index.php?occid=3156855
3156890,UCJEPS,UC403372,,Nemophila menziesii var. atomaria,205101,4/10/1930,1930,4,10,100,Apr 10 1930,Flowering/Fruiting,Marin,"Ross district , Ross district (Lake Phoenix)",37.959026,-122.569466,818,30,100 ft,cch2,urn:uuid:17e7e492-bf99-439b-8115-4b153cf6721c,http://cch2.org/portal/collections/individual/index.php?occid=3156890
3156962,UCJEPS,UC774697,,Nemophila menziesii var. integrifolia,205102,4/29/1941,1941,4,29,119,Apr 29 1941,Flowering/Fruiting,San Bernardino,"s sides Old Dad-Granite Mt. Range Mojave Desert, s sides Old Dad-Granite Mt., Willow Spring Ca (East Fork Willow Spring Canyon (Upper Portion) Willow Spring Canyon)",34.771618,-115.70569,900,1371,4500 ft,cch2,urn:uuid:a215e813-ae88-42de-8848-8569c0062599,http://cch2.org/portal/collections/individual/index.php?occid=3156962
3157327,UCJEPS,UC107229,,Nemophila menziesii var. atomaria,205101,1889-04-22,1889,4,22,112,Apr 22 1889,Flowering/Fruiting,Santa Clara,Alma,37.18087,-121.98446,1062,,,cch2,urn:uuid:17869c03-ff96-493a-b788-693fb629e735,http://cch2.org/portal/collections/individual/index.php?occid=3157327
3157372,UCJEPS,UC131445,,Nemophila menziesii,205099,4/25/1903,1903,4,25,115,Apr 25 1903,Flowering/Fruiting,San Joaquin,"Tracy; ; Tracy, San Joaquin Co.",37.745274,-121.426834,1624,,,cch2,urn:uuid:e3b7a6bf-be9b-43f6-b40c-30148f2deba2,http://cch2.org/portal/collections/individual/index.php?occid=3157372
3157399,UCJEPS,UC168373,,Nemophila menziesii var. integrifolia,205102,1889-06-11,1889,6,11,162,Jun 11 1889,Flowering/Fruiting,San Bernardino,near summit Waterman's Canyon; near Summit Waterman's Canyon,34.2281,-117.301,1200,1219,4000 ft,cch2,urn:uuid:bb75a2b5-0c98-4370-bd0b-c038abe8e759,http://cch2.org/portal/collections/individual/index.php?occid=3157399
3157400,UCJEPS,UC168378,,Nemophila menziesii,205099,1891-05-14,1891,5,14,134,May 14 1891,Flowering/Fruiting,Kern,Kernville,35.75524,-118.42399,2910,,,cch2,urn:uuid:d1234a96-c13f-4fe6-b05b-1406f1d65b4e,http://cch2.org/portal/collections/individual/index.php?occid=3157400
3157404,UCJEPS,UC1745798,,Nemophila menziesii var. atomaria,205101,5/18/1938,1938,5,18,138,5/18/1938,Flowering/Fruiting,Marin,Marsh at summit of road 2.5 mi. W of Inverness. Pt. Reyes.,,,,,,cch2,urn:uuid:b9a93c47-2eb6-481b-9167-f7f4f4a77a26,http://cch2.org/portal/collections/individual/index.php?occid=3157404
3157415,UCJEPS,UC1871057,,Nemophila menziesii var. integrifolia,205102,4/29/1991,1991,4,29,119,04 29 1991,,Los Angeles,"Transverse Ranges; Liebre Mountains region; Parker mountain and ridge to SW: SW of Acton and NNE of Ravenna. T4N R13W; W edge section 2, E and SE edge section 3, NNE edge section 10. Collected between 3670-4131 (summit) feet elevation.",34.456389,-118.219444,,1119,1119 - 1259 m,cch2,urn:uuid:18e96499-205e-4e4e-bcf5-fa109ac0feda,http://cch2.org/portal/collections/individual/index.php?occid=3157415
3157448,UCJEPS,UC494164,,Nemophila menziesii var. atomaria,205101,5/25/1930,1930,5,25,145,May 25 1930,Flowering/Fruiting,Humboldt,Laribee Valley,40.4433,-123.6821,744,762,2500 ft,cch2,urn:uuid:2c654304-86d7-47d1-abe2-cd7593bb3e52,http://cch2.org/portal/collections/individual/index.php?occid=3157448
3157468,UCJEPS,UC596369,,Nemophila menziesii,205099,3/25/1937,1937,3,25,84,Mar 25 1937,Flowering/Fruiting,Madera,8 mi w Chowchilla; w of Chowchilla,37.118904,-120.409256,11246,,,cch2,urn:uuid:861275fc-bc8c-4804-8b24-051183b367e9,http://cch2.org/portal/collections/individual/index.php?occid=3157468
3157473,UCJEPS,UC606902,,Nemophila menziesii,205099,5/8/1938,1938,5,8,128,May 8 1938,Flowering/Fruiting,Fresno,"0.6 mi sw of Tollhouse Tollhouse Creek (e bank of Tollhouse Creek, Sierra Nevada foothills); Sierra Nevada foothills, Tollhouse Creek",37.009594,-119.40307,2025,609,2000 ft,cch2,urn:uuid:49c612f4-ce48-4ed3-a73f-9c93fe19e98c,http://cch2.org/portal/collections/individual/index.php?occid=3157473
3157549,UCJEPS,UC1979638,,Nemophila menziesii var. integrifolia,205102,4/6/1995,1995,4,6,96,6-Apr-95,Flowering,San Diego,"Palomar Range, Agua Tibia Wilderness Area, northeastern flank of Agua Tibia Mountain, Arroyo Seco tributary at the north base of Eagle Crag, from the Wildhorse Trail east to the main trunk of Arroyo Seco.",33.410278,-116.958333,,975,3200,cch2,urn:uuid:0f9ee1a0-1c42-4660-a7d4-b3f2461efe23,http://cch2.org/portal/collections/individual/index.php?occid=3157549
3157891,UCJEPS,UC146182,,Nemophila menziesii var. atomaria,205101,5/6/1906,1906,5,6,126,May 6 1906,Flowering/Fruiting,Humboldt,"near Hydesville; Northern Coast Region, near Hydesville",40.5432,-124.1006,2000,60,200 ft,cch2,urn:uuid:54cb0ea2-a336-4d86-bea8-0ad8b9dd9c41,http://cch2.org/portal/collections/individual/index.php?occid=3157891
3157911,UCJEPS,UC168377,,Nemophila menziesii,205099,1888-01-01,1888,1,1,1,1888,Flowering/Fruiting,Fresno,near Fresno,,,,,,cch2,urn:uuid:2d830011-cad2-4743-8158-3d9e2b99572b,http://cch2.org/portal/collections/individual/index.php?occid=3157911
3157927,UCJEPS,UC1927520,,Nemophila menziesii var. integrifolia,205102,3/20/2003,2003,3,20,79,Mar 20 2003,,Kern,Sierra Nevada; Southern Sierra Nevada region; Owens Peak Eastern Watershed. Indian Wells Canyon.,35.7133,-117.9633,,1494,1494 m,cch2,urn:uuid:4312db98-cfd3-46e7-a98b-44be4dd9abcb,http://cch2.org/portal/collections/individual/index.php?occid=3157927
3157946,UCJEPS,UC335440,,Nemophila menziesii var. integrifolia,205102,,,,,,,Flowering/Fruiting,Marin,San Rafael,,,,,,cch2,urn:uuid:71f1c7cd-abf8-4f32-912d-bebc367468c2,http://cch2.org/portal/collections/individual/index.php?occid=3157946
3157950,UCJEPS,UC403299,,Nemophila menziesii var. atomaria,205101,4/10/1930,1930,4,10,100,Apr 10 1930,Flowering/Fruiting,Marin,Corte Madera,37.925564,-122.52539,2237,3,10 ft,cch2,urn:uuid:c4fc3e15-e652-49d6-b5bf-11587a3e3d3c,http://cch2.org/portal/collections/individual/index.php?occid=3157950
3157989,UCJEPS,UC63801,,Nemophila menziesii var. integrifolia,205102,7/1/1901,1901,7,1,182,"July, 1901",Flowering/Fruiting,Riverside,"Fuller's Mills Mountains San Jacinto Mountains, Fuller's Mills Mountains",33.8139,-116.7394,1000,1554,5100 ft,cch2,urn:uuid:1729ad4d-a2d9-4fcc-9f8e-1821526adaeb,http://cch2.org/portal/collections/individual/index.php?occid=3157989
3158274,UCJEPS,UC668349,,Nemophila menziesii var. integrifolia,205102,4/19/1941,1941,4,19,109,Apr 19 1941,Flowering/Fruiting,San Bernardino,8 mi sw Victorville; sw of Victorville,34.500665,-117.167628,800,1036,3400 ft,cch2,urn:uuid:55b5fa49-a661-45e8-8ba5-79659c364593,http://cch2.org/portal/collections/individual/index.php?occid=3158274
3158407,UCJEPS,UC1069190,,Nemophila menziesii,205099,4/9/1936,1936,4,9,100,Apr 9 1936,Flowering/Fruiting,Mariposa,"1.4 mi se Cathay School; Indian Gulch Quad., se of Cathay School",37.4107,-120.0769,805,381,1250 ft,cch2,urn:uuid:a0328182-ffd5-4e45-9e43-45a31f0eb433,http://cch2.org/portal/collections/individual/index.php?occid=3158407
3158457,UCJEPS,UC126808,,Nemophila menziesii var. integrifolia,205102,5/29/1906,1906,5,29,149,May 29 1906,Flowering/Fruiting,San Bernardino,southern slope San Bernardino Mts.,34.2092,-117.2866,4000,1066,3500 ft,cch2,urn:uuid:b20b7a50-e550-4ac7-8c84-ad7e878dcc39,http://cch2.org/portal/collections/individual/index.php?occid=3158457
3158504,UCJEPS,UC24246,,Nemophila menziesii var. atomaria,205101,2/26/1900,1900,2,26,57,Feb 26 1900,Flowering/Fruiting,Marin,s slope Mt. Tamalpais,37.914948,-122.589615,2910,,,cch2,urn:uuid:bb8896bd-caf4-47f7-a33a-6c2f22d37fbb,http://cch2.org/portal/collections/individual/index.php?occid=3158504
3158546,UCJEPS,UC572487,,Nemophila menziesii var. integrifolia,205102,4/27/1935,1935,4,27,117,Apr 27 1935,Flowering/Fruiting,San Bernardino,"3/4 mi n Lake Arrowhead (San Bernardino National Forest); Deep Creek Quad., San Bernardino National For, n Lake Arrowh",34.316,-117.1982,805,1386,4550 ft,cch2,urn:uuid:e824d8e3-44fd-4831-a22f-1721da5134b0,http://cch2.org/portal/collections/individual/index.php?occid=3158546
3158998,UCJEPS,UC146183,,Nemophila menziesii var. atomaria,205101,6/9/1908,1908,6,9,161,Jun 9 1908,Flowering/Fruiting,Humboldt,"Kneeland Prairie Northern Coast Ranges, Kneeland Prairie",40.76145935,-123.9930191,1622,762,2500 ft,cch2,urn:uuid:4f5e8ceb-527d-42e3-bd0a-61b044b7b23a,http://cch2.org/portal/collections/individual/index.php?occid=3158998
3159019,UCJEPS,UC173769,,Nemophila menziesii var. integrifolia,205102,1894-04-03,1894,4,3,93,Apr 3 1894,Flowering/Fruiting,San Diego,Ramona,33.04179,-116.86803,4828,,,cch2,urn:uuid:76c586a1-254b-4a44-a2c9-027d44cdfd50,http://cch2.org/portal/collections/individual/index.php?occid=3159019
3159026,UCJEPS,UC1787762,,Nemophila menziesii var. integrifolia,205102,3/16/2001,2001,3,16,75,3/16/2001,,Imperial,"Jacumba Natural Area, In-Ko-Pah Mountains, near Smuggler's Cove.",32.628334,-116.11,,1046,1046 m,cch2,urn:uuid:3c0bcab1-2adb-4faf-9acb-ca48c6b6fe77,http://cch2.org/portal/collections/individual/index.php?occid=3159026
3159045,UCJEPS,UC310398,,Nemophila menziesii,205099,3/23/1925,1925,3,23,82,Mar 23 1925,Flowering/Fruiting,Fresno,15 mi sw Coalinga; sw of Coalinga,35.98567,-120.54853,,,,cch2,urn:uuid:82fcb85a-b6c6-4924-ac19-d879485f547d,http://cch2.org/portal/collections/individual/index.php?occid=3159045
3159069,UCJEPS,UC562583,,Nemophila menziesii var. atomaria,205101,5/9/1926,1926,5,9,129,May 9 1926,Flowering/Fruiting,Humboldt,Valley of South Yager Creek,,,,762,2500 ft,cch2,urn:uuid:e0a8d30a-0d0b-4e5b-885c-6b29a078842d,http://cch2.org/portal/collections/individual/index.php?occid=3159069
3159339,UCJEPS,UC249523,,Nemophila menziesii var. atomaria,205101,5/28/1922,1922,5,28,148,May 28 1922,Flowering/Fruiting,Humboldt,Little River Beach Northern Coast Ranges,,,,6,20 ft,cch2,urn:uuid:49ff7351-3cda-40d2-97be-ffe9a380f3c1,http://cch2.org/portal/collections/individual/index.php?occid=3159339
3159549,UCJEPS,UC24255,,Nemophila menziesii var. atomaria,205101,1892-04-01,1892,4,1,92,April 1892,Flowering/Fruiting,Marin,Fairfax,37.98722,-122.58778,2564,,,cch2,urn:uuid:128c1a91-7536-4307-8156-72b5cac689dd,http://cch2.org/portal/collections/individual/index.php?occid=3159549
3159558,UCJEPS,UC310898,,Nemophila menziesii var. integrifolia,205102,5/15/1925,1925,5,15,135,May 15 1925,Flowering/Fruiting,San Diego,4 mi se Buckman's Springs; se of Buckman's Springs,32.71833,-116.46917,805,914,3000 ft,cch2,urn:uuid:99c20bbc-8477-44e6-83f8-262ebcb64e22,http://cch2.org/portal/collections/individual/index.php?occid=3159558
3159563,UCJEPS,UC35549,,Nemophila menziesii var. atomaria,205101,,,,,,,Flowering/Fruiting,Humboldt,Hupa,41.0504,-123.6742,3350,,,cch2,urn:uuid:91542af9-8bbc-4be4-bd9e-a83b7e919fc1,http://cch2.org/portal/collections/individual/index.php?occid=3159563
3160010,UCJEPS,UC1103815,,Nemophila menziesii var. atomaria,205101,5/15/1926,1926,5,15,135,May 15 1926,Flowering/Fruiting,Humboldt,Kneeland Prairie,40.76145935,-123.9930191,1622,762,2500 ft,cch2,urn:uuid:6d533754-e92e-4cd9-962b-d3a97f8164b2,http://cch2.org/portal/collections/individual/index.php?occid=3160010
3160039,UCJEPS,UC1278733,,Nemophila menziesii,205099,4/13/1947,1947,4,13,103,Apr 13 1947,Flowering/Fruiting,Tuolumne,"4 mi n Big Oak Flat (Deer Flat); , n of Big Oak Flat",37.88392,-120.25508,6153,,,cch2,urn:uuid:d2d8ca7e-3f11-4129-9867-3ee1a72c3f0d,http://cch2.org/portal/collections/individual/index.php?occid=3160039
3160046,UCJEPS,UC131450,,Nemophila menziesii var. integrifolia,205102,4/10/1906,1906,4,10,100,Apr 10 1906,Flowering/Fruiting,San Diego,Point Loma,32.6948,-117.245,3219,,,cch2,urn:uuid:eed28f2d-dbc3-4f8d-b840-08826e92e60b,http://cch2.org/portal/collections/individual/index.php?occid=3160046
3160117,UCJEPS,UC407074,,Nemophila menziesii,205099,4/1/1923,1923,4,1,91,"Apr. 1, 1923",Flowering/Fruiting,Tuolumne,1 mi w Keystone; w of Keystone,37.83528,-120.52496,,,,cch2,urn:uuid:bcef2de4-45ec-4055-b06f-57f46df7e7a5,http://cch2.org/portal/collections/individual/index.php?occid=3160117
3160145,UCJEPS,UC579895,,Nemophila menziesii var. atomaria,205101,4/29/1934,1934,4,29,119,Apr 29 1934,Flowering/Fruiting,Marin,1.6 mi w Estero District School (roadside swale 10 mi nw of Tomales); nw of Tomales,38.291855,-122.96805,254,,,cch2,urn:uuid:fccfe463-0dad-417f-8bd6-7e46aa814daf,http://cch2.org/portal/collections/individual/index.php?occid=3160145
3160156,UCJEPS,UC643396,,Nemophila menziesii var. integrifolia,205102,4/1/1929,1929,4,1,91,Apr 1 1929,Flowering/Fruiting,Los Angeles,"Mandeville Canyon Santa Monica Mountains, Mandeville Canyon",34.09394,-118.50264,4265,350,350 m,cch2,urn:uuid:ab264a64-740e-404a-b016-71f288299a31,http://cch2.org/portal/collections/individual/index.php?occid=3160156
3160190,UCJEPS,UC75665,,Nemophila menziesii var. atomaria,205101,1/1/1906,1906,1,1,1,1906,Flowering/Fruiting,Sonoma,Valley Ford,38.31806,-122.92306,,,,cch2,urn:uuid:f7b96e69-6b9f-444f-a193-1a75720cdb5e,http://cch2.org/portal/collections/individual/index.php?occid=3160190
3160213,UCJEPS,UC880923,,Nemophila menziesii var. integrifolia,205102,4/6/1913,1913,4,6,96,Apr 6 1913,Flowering/Fruiting,San Diego,Point Loma,32.69483,-117.24517,3219,,,cch2,urn:uuid:f1175997-3ee1-4639-a1ab-6c98fb31a9a1,http://cch2.org/portal/collections/individual/index.php?occid=3160213
3160619,UCJEPS,UC1562873,,Nemophila menziesii var. integrifolia,205102,5/24/1987,1987,5,24,144,May 24 1987,Flowering/Fruiting,San Bernardino,"on Hwy 18 ca 1 mi w Rim Forest ((Rim of the World Dr), head of Strawberry Creek in San Bernardino Mts.); San Bernardino Mts., w of Rim Forest, Strawberry Creek",34.2291,-117.2331,805,1676,5500 ft,cch2,urn:uuid:601bab8e-1b9c-41e3-a69d-de5d72ac3239,http://cch2.org/portal/collections/individual/index.php?occid=3160619
3160627,UCJEPS,UC168376,,Nemophila menziesii,205099,1891-04-01,1891,4,1,91,Apr. 1891,Flowering/Fruiting,Fresno,Alcalde,,,,,,cch2,urn:uuid:e7035de0-831d-4065-9aeb-a2d552d2aece,http://cch2.org/portal/collections/individual/index.php?occid=3160627
3160669,UCJEPS,UC24259,,Nemophila menziesii var. integrifolia,205102,5/6/1902,1902,5,6,126,May 6 1902,Flowering/Fruiting,Ventura,Casitas Pass,,,,182,600 ft,cch2,urn:uuid:0fa395b5-41df-406c-8573-8040e3fef5de,http://cch2.org/portal/collections/individual/index.php?occid=3160669
3160768,UCJEPS,UC880912,,Nemophila menziesii,205099,4/1/1923,1923,4,1,91,"Apr. 1, 1923",Flowering/Fruiting,Tuolumne,1 mi w Keystone; w of Keystone,37.83528,-120.52496,,,,cch2,urn:uuid:20aa209c-af77-4e27-8f91-65e951d303f4,http://cch2.org/portal/collections/individual/index.php?occid=3160768
3160774,UCJEPS,UC973661,,Nemophila menziesii var. integrifolia,205102,,,,,,,Flowering/Fruiting,,,,,,,,cch2,urn:uuid:f3a15ff5-8d97-476c-9ad8-81d39c2971a8,http://cch2.org/portal/collections/individual/index.php?occid=3160774
3161125,UCJEPS,UC1057251,,Nemophila menziesii var. integrifolia,205102,4/3/1957,1957,4,3,93,Apr 3 1957,Flowering/Fruiting,San Diego,"ne La Jolla (flat summit of first low hill across canyon ne of Soledad Mountain); ne of Soledad Mountain, ne of La Jolla",32.86361,-117.22359,1610,124,410 ft,cch2,urn:uuid:ee5dc317-608f-4702-8d96-9a05af97998f,http://cch2.org/portal/collections/individual/index.php?occid=3161125
3161177,UCJEPS,UC1239754,,Nemophila menziesii var. atomaria,205101,4/23/1927,1927,4,23,113,Apr 23 1927,Flowering/Fruiting,Humboldt,Trinidad Trinidad (on coast bluffs),,,,3,10-200 ft,cch2,urn:uuid:378cddc2-5f8f-4a62-97fc-08c10b5fcde0,http://cch2.org/portal/collections/individual/index.php?occid=3161177
3161244,UCJEPS,UC24269,,Nemophila menziesii var. integrifolia,205102,,,,,,,Flowering/Fruiting,Los Angeles,"Elizabeth Lake, Los Angeles Co.",,,,,,cch2,urn:uuid:fd359320-dd6a-4850-afde-67c4534deb8e,http://cch2.org/portal/collections/individual/index.php?occid=3161244
3161250,UCJEPS,UC284102,,Nemophila menziesii var. integrifolia,205102,5/30/1918,1918,5,30,150,May 30 1918,Flowering/Fruiting,San Bernardino,Cajon Pass,34.325158,-117.428354,2000,,,cch2,urn:uuid:c3567a42-b97a-440c-82e9-c96129461b4b,http://cch2.org/portal/collections/individual/index.php?occid=3161250
3161283,UCJEPS,UC592188,,Nemophila menziesii,205099,3/24/1929,1929,3,24,83,Mar 24 1929,Flowering/Fruiting,Madera,at junction of Yosemite Road eighteen mi e Madera; e of Madera at junction of Yosemite Road,36.986427,-119.7463,25350,,,cch2,urn:uuid:8a9dd13a-48e8-4282-9f3e-ecb9e269a29a,http://cch2.org/portal/collections/individual/index.php?occid=3161283
3161331,UCJEPS,UC767672,,Nemophila menziesii var. atomaria,205101,2/15/1938,1938,2,15,46,Feb 15 1938,Flowering/Fruiting,Marin,Tiburon,37.87361,-122.45556,1559,,,cch2,urn:uuid:dc89b623-0d95-447a-8e1a-a1da18807bab,http://cch2.org/portal/collections/individual/index.php?occid=3161331
3161332,UCJEPS,UC767673,,Nemophila menziesii,205099,5/29/1938,1938,5,29,149,May 29 1938,Flowering/Fruiting,Madera,Coarsegold,37.26346,-119.693054,818,,,cch2,urn:uuid:b95ea61a-389f-4af5-ba98-5dd3b302a4d9,http://cch2.org/portal/collections/individual/index.php?occid=3161332
3161354,UCJEPS,UC880911,,Nemophila menziesii var. integrifolia,205102,7/8/1920,1920,7,8,190,Jul 8 1920,Flowering/Fruiting,Los Angeles,Mt. Wilson,34.22639,-118.06528,,609,2000 ft,cch2,urn:uuid:f2382cfc-6623-4978-a7ed-f7c36650b4a3,http://cch2.org/portal/collections/individual/index.php?occid=3161354
3161680,UCJEPS,UC1019607,,Nemophila menziesii var. integrifolia,205102,4/14/1927,1927,4,14,104,Apr 14 1927,Flowering/Fruiting,San Diego,Moreno Dam,32.6851,-116.546,402,,,cch2,urn:uuid:6e5019ad-5198-4caf-b4a3-ae3f618053b5,http://cch2.org/portal/collections/individual/index.php?occid=3161680
3161694,UCJEPS,UC1069198,,Nemophila menziesii var. atomaria,205101,4/12/1936,1936,4,12,103,Apr 12 1936,Flowering/Fruiting,Marin,".2 mi e Pierce's Ranch; Point Reyes Quad., e of Pierce's Ranch",38.193435,-122.95136,545,76,250 ft,cch2,urn:uuid:7eb9b742-3ee3-4ad9-8e14-bde19da17344,http://cch2.org/portal/collections/individual/index.php?occid=3161694
3161701,UCJEPS,UC1069199,,Nemophila menziesii var. integrifolia,205102,5/8/1935,1935,5,8,128,May 8 1935,Flowering/Fruiting,Los Angeles,"4 3/4 mi ene Warm Springs; Tejon Quad., ene of Warm Springs",34.6383,-118.4896,805,822,2700 ft,cch2,urn:uuid:0dd002e3-765a-4194-8a9f-d6be888ee034,http://cch2.org/portal/collections/individual/index.php?occid=3161701
3161745,UCJEPS,UC131451,,Nemophila menziesii var. integrifolia,205102,4/25/1904,1904,4,25,116,Apr 25 1904-Apr 28 1904,Flowering/Fruiting,San Diego,along Santa Margarita R.; along Santa Margarita R,,,,,,cch2,urn:uuid:083e1e81-459b-47f6-a2c8-73e7d895ab79,http://cch2.org/portal/collections/individual/index.php?occid=3161745
3161809,UCJEPS,UC24258,,Nemophila menziesii var. atomaria,205101,1894-03-22,1894,3,22,81,Mar 22 1894,Flowering/Fruiting,San Mateo,,,,,,,cch2,urn:uuid:4051c56e-79c3-4ffb-8900-34cf44196f44,http://cch2.org/portal/collections/individual/index.php?occid=3161809
3161918,UCJEPS,UC880918,,Nemophila menziesii,205099,5/14/1933,1933,5,14,134,May 14 1933,Flowering/Fruiting,Tulare,"1 8/10 mi above Control Station (Balch Park Road, w slope Sierra Nevada); w slope Sierra Nevada, above Control Station",,,,1005,3300 ft,cch2,urn:uuid:d2aee519-5db1-422d-a62b-886493e41efc,http://cch2.org/portal/collections/individual/index.php?occid=3161918
3162112,UCJEPS,JEPS2664,,Nemophila venosa,366648,1898-03-11,1898,3,11,70,Mar 11 1898,Flowering/Fruiting,Napa,"near (e of) Yountville; foothills of Napa Range; Napa Range, near Yountville",,,,,,cch2,urn:uuid:0eaa0e2b-6d4d-4b43-bb78-a5f3c6cca487,http://cch2.org/portal/collections/individual/index.php?occid=3162112
3162138,UCJEPS,UC1922890,,Nemophila menziesii var. integrifolia,205102,5/16/2001,2001,5,16,136,05 16 2001,,Los Angeles,Transverse Ranges; Verdugo Mountains region; Northern San Rafael Hills: Liz's Loop (Edison Road) to Cherry Canyon Fire Road.,34.195278,-118.206667,,457,457 m,cch2,urn:uuid:02b44eeb-78bb-4b2c-95b9-c871402ef2cf,http://cch2.org/portal/collections/individual/index.php?occid=3162138
3162223,UCJEPS,UC1019606,,Nemophila menziesii var. integrifolia,205102,4/15/1927,1927,4,15,105,Apr 15 1927,Flowering/Fruiting,San Diego,"near Carab Acres (between Alpine and San Diego); , near Carab Acres",32.86952,-116.84145,1609,,,cch2,urn:uuid:1e194461-ec47-4463-959a-996820244a16,http://cch2.org/portal/collections/individual/index.php?occid=3162223
3162231,UCJEPS,UC107227,,Nemophila menziesii,205099,1897-03-03,1897,3,3,62,Mar 3 1897-Mar 23 1897,Flowering/Fruiting,Butte,"near Clear Creek; ; near Clear Creek, Butte Co.",39.605797,-121.68332,415,53,175 ft,cch2,urn:uuid:c0b2734f-d9f3-4b1b-b4b7-50fac823a8a9,http://cch2.org/portal/collections/individual/index.php?occid=3162231
3162309,UCJEPS,UC168379,,Nemophila menziesii,205099,1891-04-03,1891,4,3,93,Apr 3 1891,Flowering/Fruiting,Kern,Lerdo,35.490215,-119.15081,1622,,,cch2,urn:uuid:3d18332f-1a25-43ce-8a1e-88548ff9a12e,http://cch2.org/portal/collections/individual/index.php?occid=3162309
3162318,UCJEPS,UC1789991,,Nemophila menziesii var. integrifolia,205102,5/22/2004,2004,5,22,143,22-May-04,,San Diego,"Laguna Mountains, Sunrise Highway, Kitchen Creek Truck Trail.",32.8447,-116.449,,1562,5125 ft,cch2,urn:uuid:9ec5be93-e103-46ca-b213-5cea2661295c,http://cch2.org/portal/collections/individual/index.php?occid=3162318
3162326,UCJEPS,UC24264,,Nemophila menziesii var. integrifolia,205102,1882-04-01,1882,4,1,91,Apr 1882,Flowering/Fruiting,Los Angeles,Pasadena,34.14778,-118.14361,,,,cch2,urn:uuid:9b93a22a-3c1f-4cc4-be99-568808a8b5fe,http://cch2.org/portal/collections/individual/index.php?occid=3162326
3162365,UCJEPS,UC618586,,Nemophila menziesii,205099,5/3/1938,1938,5,3,123,May 3 1938,Flowering/Fruiting,Mariposa,near Granite Springs; near Granite Springs,37.700974,-120.29435,1622,,,cch2,urn:uuid:e2bf0360-f8d8-48bc-a374-8a447cdf672b,http://cch2.org/portal/collections/individual/index.php?occid=3162365
3162629,UCJEPS,UC562585,,Nemophila menziesii var. atomaria,205101,5/10/1932,1932,5,10,131,May 10 1932,Flowering/Fruiting,Humboldt,"Bear River Ridge , Bear River Ridge (Northern Coast Ranges)",40.4599,-124.2052,1468,609,2000 ft,cch2,urn:uuid:07630981-b423-40a5-9180-5f1898b4a35c,http://cch2.org/portal/collections/individual/index.php?occid=3162629
3162757,UCJEPS,UC1073323,,Nemophila menziesii var. atomaria,205101,3/5/1955,1955,3,5,64,Mar 5 1955,Flowering/Fruiting,Marin,open pinnacles just e lighthouse (seaward end Pt. Reyes); seasward end Pt. Reyes,,,,167,550 ft,cch2,urn:uuid:39812fc3-9501-4e0d-bcf9-f8043ad25d6e,http://cch2.org/portal/collections/individual/index.php?occid=3162757
3162800,UCJEPS,UC126922,,Nemophila menziesii var. integrifolia,205102,4/20/1906,1906,4,20,110,Apr 20 1906,Flowering/Fruiting,San Bernardino,San Bernardino Valley,34.113067,-117.291902,10000,300,300 m,cch2,urn:uuid:472aae4d-3d3d-4a55-94e3-5b108eefaa54,http://cch2.org/portal/collections/individual/index.php?occid=3162800
3162813,UCJEPS,UC131454,,Nemophila menziesii var. integrifolia,205102,1894-03-28,1894,3,28,87,Mar 28 1894,Flowering/Fruiting,San Diego,Encinitas,33.0435,-117.2639,3218,,,cch2,urn:uuid:22be3a37-a4cf-4bdf-ac7a-16660e548367,http://cch2.org/portal/collections/individual/index.php?occid=3162813
3162844,UCJEPS,UC177199,,Nemophila menziesii var. atomaria,205101,6/13/1913,1913,6,13,164,Jun 13 1913,Flowering/Fruiting,Humboldt,"opposite Buck Mountain (in valley of Van Duzen River); Northern Coast Ranges, in valley Van Duzen River, Buck Mt",,,,762,2500 ft,cch2,urn:uuid:f5eb198e-6c09-4db4-8a64-2f797ad5fb76,http://cch2.org/portal/collections/individual/index.php?occid=3162844
3163179,UCJEPS,UC1608275,,Nemophila menziesii var. integrifolia,205102,5/6/1992,1992,5,6,127,May 6 1992,Flowering/Fruiting,San Diego,"s side Miller Mountain along Miller Canyon maj drainage on s flank mt fr Rd 8S02 upstream, Southern Santa Ana Mountains, San Mateo Canyon Wilderness Area, Southern Santa Ana Mountains, San Mateo Canyon Wilderness",33.4811,-117.3898,805,640,2100-2300 ft,cch2,urn:uuid:363698db-a59e-44dd-a7c8-aeef4df6cfc6,http://cch2.org/portal/collections/individual/index.php?occid=3163179
3163285,UCJEPS,UC1021927,,Nemophila menziesii var. atomaria,205101,4/5/1955,1955,4,5,95,Apr 5 1955,Flowering/Fruiting,Marin,Bolinas-Fairfax road between Golf Course and Alpine Lake Dam; between Golf Course and Alpine Lake Dam,37.959053,-122.628586,2115,,,cch2,urn:uuid:193b27d2-564b-47f4-b713-4121dc2c7ee8,http://cch2.org/portal/collections/individual/index.php?occid=3163285
3163294,UCJEPS,UC1069176,,Nemophila menziesii,205099,3/3/1932,1932,3,3,63,Mar 3 1932,Flowering/Fruiting,Fresno,"Canoas Creek Cholame Quad., Canoas Creek",35.9856,-120.2298,805,335,1100 ft,cch2,urn:uuid:df8d1d72-3343-4fe4-afe0-4f2081ede638,http://cch2.org/portal/collections/individual/index.php?occid=3163294
3163295,UCJEPS,UC1069178,,Nemophila menziesii,205099,4/7/1936,1936,4,7,98,Apr 7 1936,Flowering/Fruiting,Tuolumne,"2.5 mi ene Greene Springs Mine; Copperopolis Quad., ene of Greene Springs Mine",37.8076,-120.5144,805,384,1260 ft,cch2,urn:uuid:6888dbdf-c643-42ab-b817-d77f82bd23ab,http://cch2.org/portal/collections/individual/index.php?occid=3163295
3163397,UCJEPS,UC24262,,Nemophila menziesii var. atomaria,205101,1899-05-01,1899,5,1,121,"May 1899-August, 1899",Flowering/Fruiting,Humboldt,"Hoopa Valley North-Western California, Hoopa Valley",,,,,,cch2,urn:uuid:4f33ab6f-ab73-41c6-9b1f-3b473bd8460a,http://cch2.org/portal/collections/individual/index.php?occid=3163397
3163416,UCJEPS,UC449910,,Nemophila menziesii var. integrifolia,205102,3/1/1903,1903,3,1,60,3-Mar,Flowering/Fruiting,Los Angeles,Pasadena,34.14778,-118.14361,,,,cch2,urn:uuid:539fa54a-739e-4e9b-9a6c-ce495b610d07,http://cch2.org/portal/collections/individual/index.php?occid=3163416
3163729,UCJEPS,UC1562706,,Nemophila menziesii var. integrifolia,205102,5/24/1987,1987,5,24,144,May 24 1987,Flowering/Fruiting,San Bernardino,"on Hwy 18 ca 1 mi w Rim Forest ((Rim of the World Dr), head of Strawberry Creek in San Bernardino Mts.); San Bernardino Mts., w of Rim Forest, Strawberry Creek",34.2291,-117.2331,805,1676,5500 ft,cch2,urn:uuid:ec20ea41-fc26-4164-8f66-23d31548599f,http://cch2.org/portal/collections/individual/index.php?occid=3163729
3163730,UCJEPS,UC1237990,,Nemophila menziesii var. integrifolia,205102,5/12/1961,1961,5,12,132,May 12 1961-May 15 1961,Flowering/Fruiting,Riverside,"1.6 mi se Poppet Flat Road (along road from Banning to Idylwild, San Jacinto Mountains); San Jacinto Mountains, rd fr Banning to Idylvild",33.84547,-116.81934,420,,,cch2,urn:uuid:eeb5c54a-cc56-4e72-9a28-1563da26afa2,http://cch2.org/portal/collections/individual/index.php?occid=3163730
3163847,UCJEPS,UC1021935,,Nemophila menziesii,205099,4/24/1955,1955,4,24,114,Apr 24 1955,Flowering/Fruiting,Fresno,Highway 180 above Clingan's junction; above Clingan's junction,36.75444,-119.16944,,914,3000 ft,cch2,urn:uuid:4585f6aa-1d36-416b-9c4c-30a79ed0d949,http://cch2.org/portal/collections/individual/index.php?occid=3163847
3163942,UCJEPS,UC1871236,,Nemophila menziesii var. integrifolia,205102,4/30/1991,1991,4,30,120,04 30 1991,,Los Angeles,"Transverse Ranges; Liebre Mountains region; Soledad Canyon Wash: about half mile E of Acton; T5N R13W, W1/2 SE1/4 SE1/4 section 36; elevation 2720 feet.",34.468889,-118.188333,,829,829 m,cch2,urn:uuid:02d66b7f-cfcb-430d-8637-1424f7a3af0d,http://cch2.org/portal/collections/individual/index.php?occid=3163942
3163955,UCJEPS,UC24254,,Nemophila menziesii var. atomaria,205101,1898-01-01,1898,1,1,1,Jan 1 1898,Flowering/Fruiting,Mendocino,Round Valley,39.78802,-123.238846,6647,,,cch2,urn:uuid:eeef02a3-1093-4b58-90d2-69361b537767,http://cch2.org/portal/collections/individual/index.php?occid=3163955
3163959,UCJEPS,UC284099,,Nemophila menziesii var. integrifolia,205102,4/1/1903,1903,4,1,91,3-Apr,Flowering/Fruiting,Los Angeles,near Pasadena; near Pasadena,34.14778,-118.14361,,,,cch2,urn:uuid:a53f6128-e253-4257-af11-551bc94b1324,http://cch2.org/portal/collections/individual/index.php?occid=3163959
3164002,UCJEPS,UC659438,,Nemophila menziesii,205099,3/24/1940,1940,3,24,84,Mar 24 1940,Flowering/Fruiting,Fresno,"9 mi sw Coalinga (Curry Mountain, Waltham Canyon, western Fresno County); Inner Coast Ranges, Curry Mountain, Waltham Canyon",36.08272,-120.457664,1622,487,1600 ft,cch2,urn:uuid:8ae5fb34-ce8b-4b82-9218-f1eef5f14c0e,http://cch2.org/portal/collections/individual/index.php?occid=3164002
3164004,UCJEPS,UC64755,,Nemophila menziesii var. atomaria,205101,6/1/1902,1902,6,1,152,2-Jun,Flowering/Fruiting,Lake,Lakeport,39.04306,-122.91472,,,,cch2,urn:uuid:8f15fcd0-b575-4ec4-82b9-d3d4ed54c847,http://cch2.org/portal/collections/individual/index.php?occid=3164004
3164021,UCJEPS,UC735053,,Nemophila menziesii var. atomaria,205101,3/22/1946,1946,3,22,81,Mar 22 1946,Flowering/Fruiting,Marin,"2 mi sw Fairfax (junction of Alpine Lake Road with Pine Mountain fire trail); sw of Fairfax, jct Alpine Lake rd w Pine Mountain fire trail",37.962894,-122.60368,2739,167,550 ft,cch2,urn:uuid:7f6bdf03-45f1-4597-9e44-99ca3519a922,http://cch2.org/portal/collections/individual/index.php?occid=3164021
3164064,UCJEPS,UC126807,,Nemophila menziesii var. integrifolia,205102,5/19/1906,1906,5,19,139,May 19 1906,Flowering/Fruiting,San Bernardino,"Crow Canyon, hills between Redlands and Yucaipa",34.03652,-117.12173,1876,,,cch2,urn:uuid:31f18952-68ae-4d4a-8495-6cc38fdddd24,http://cch2.org/portal/collections/individual/index.php?occid=3164064
3180184,UCJEPS,JEPS3129,,Nemophila menziesii,205099,3/31/1917,1917,3,31,90,Mar 31 1917,Flowering/Fruiting,Marin,Mill Valley,37.90611,-122.54389,2171,,,cch2,urn:uuid:75527309-1cfe-4200-84ee-db8b71eac578,http://cch2.org/portal/collections/individual/index.php?occid=3180184
3180242,UCJEPS,JEPS110841,,Nemophila menziesii,205099,3/14/1977,1977,3,14,73,14-Mar-77,,Napa,.2 mile north of Silverado Trail on Soda Canyon Rd.,38.3801,-122.2904,805,121,400 ft.,cch2,urn:uuid:53db33fc-a9aa-411b-a936-e49cca117f6b,http://cch2.org/portal/collections/individual/index.php?occid=3180242
3181627,UCJEPS,JEPS3136,,Nemophila menziesii,205099,4/6/1915,1915,4,6,96,Apr 6 1915,Flowering/Fruiting,Colusa,College City,39.006634,-122.00778,1024,,,cch2,urn:uuid:86588888-9c4e-4dd6-bdb4-b298ee10e0fd,http://cch2.org/portal/collections/individual/index.php?occid=3181627
3182148,UCJEPS,JEPS77206,,Nemophila menziesii var. atomaria,205101,4/24/1963,1963,4,24,114,Apr 24 1963,Flowering/Fruiting,Marin,on Bolinas Road 5 mi s Fairfax,37.961857,-122.62954,4188,274,900 ft,cch2,urn:uuid:7e8b8614-3688-4231-b6c0-120e2f285be8,http://cch2.org/portal/collections/individual/index.php?occid=3182148
3182639,UCJEPS,JEPS1795,,Nemophila menziesii,205099,1/1/1908,1908,1,1,1,1908,Flowering/Fruiting,Sacramento,Sacramento,,,,,,cch2,urn:uuid:4ef63d31-2da7-4acf-8485-e37c81dbeeb9,http://cch2.org/portal/collections/individual/index.php?occid=3182639
3185266,UCJEPS,UC1541101,,Nemophila menziesii,205099,3/18/1950,1950,3,18,77,Mar 18 1950,Flowering/Fruiting,Kern,"about 0.8 mi off Highway 399 (along Soda Lake Road to Carrizo Plain, near San Luis Obispo County line); along Soda Lake Road to Carrizo Plain",,,,,,cch2,urn:uuid:6294cb16-b569-4e57-8f3c-d9f50a7af640,http://cch2.org/portal/collections/individual/index.php?occid=3185266
3186619,UCJEPS,UC310223,,Nemophila menziesii,205099,4/8/1926,1926,4,8,98,Apr 8 1926,Flowering/Fruiting,San Luis Obispo,Paso Robles,35.630681,-120.675571,4500,,,cch2,urn:uuid:04feec5c-fa4a-42c4-b95c-bb3bd857bcc6,http://cch2.org/portal/collections/individual/index.php?occid=3186619
3187621,UCJEPS,UC572488,,Nemophila menziesii,205099,4/27/1935,1935,4,27,117,Apr 27 1935,Flowering/Fruiting,San Bernardino,"3 mi se of mouth Deep Creek (eight mi se of Hesperia); Deep Creek Quad., San Bernardino NF, se of Deep Creek",34.316,-117.1982,805,1386,4550 ft,cch2,urn:uuid:efe8f226-3616-4248-8466-5d90a56647f1,http://cch2.org/portal/collections/individual/index.php?occid=3187621
3187814,UCJEPS,UC606901,,Nemophila menziesii,205099,3/24/1938,1938,3,24,83,Mar 24 1938,Flowering/Fruiting,Alameda,"head Claremont Creek , head Claremont Creek (s slope Berkeley Hills)",37.86369,-122.234085,1971,335,1100 ft,cch2,urn:uuid:9bfd0582-1159-4b91-a45e-f8182852e67d,http://cch2.org/portal/collections/individual/index.php?occid=3187814
3187817,UCJEPS,UC606905,,Nemophila menziesii,205099,4/2/1938,1938,4,2,92,Apr 2 1938,Flowering/Fruiting,Monterey,"5 mi n Jamesburg (Hastings Reservation, Carmel Valley); South Coast Ranges, Carmel Valley, Hastings Reservation",,,,548,1800 ft,cch2,urn:uuid:337711af-0cce-4503-bc3d-c00f75a25613,http://cch2.org/portal/collections/individual/index.php?occid=3187817
3188037,UCJEPS,UC660076,,Nemophila menziesii,205099,4/4/1940,1940,4,4,95,Apr 4 1940,Flowering/Fruiting,Sacramento,ne Sacramento; ne of Sacramento,,,,,,cch2,urn:uuid:da5bb37e-cbda-4efd-9d25-94364b562e51,http://cch2.org/portal/collections/individual/index.php?occid=3188037
3188164,UCJEPS,UC67067,,Nemophila menziesii,205099,,,,,,,Flowering/Fruiting,Mendocino,,,,,,,cch2,urn:uuid:28e359b4-121e-4205-9b30-ce7b4f30fa7a,http://cch2.org/portal/collections/individual/index.php?occid=3188164
3189129,UCJEPS,UC880916,,Nemophila menziesii,205099,5/1/1915,1915,5,1,121,1-May-15,Flowering/Fruiting,Sonoma,Mt. St. Helena,,,,,,cch2,urn:uuid:26f6fe6b-0a27-4db7-889c-877955a90b45,http://cch2.org/portal/collections/individual/index.php?occid=3189129
3189169,UCJEPS,UC880870,,Nemophila menziesii,205099,4/19/1938,1938,4,19,109,Apr 19 1938,Flowering/Fruiting,San Benito,"8 mi s Panoche (Griswold Canyon); , s of Panoche",36.50766,-120.82507,1783,487,1600 ft,cch2,urn:uuid:22b13ac6-3d9f-42b6-8ab1-cd9d64bcf78d,http://cch2.org/portal/collections/individual/index.php?occid=3189169
3190580,UCJEPS,UC1239740,,Nemophila menziesii,205099,4/16/1938,1938,4,16,106,Apr 16 1938,Flowering/Fruiting,Mendocino,"6 mi n Calpella (Redwood Valley); n of Calpella, Redwood Valley",39.313034,-123.215904,3232,213,700 ft,cch2,urn:uuid:dc2a47bf-addf-4c9f-841c-c3fdb4fa2583,http://cch2.org/portal/collections/individual/index.php?occid=3190580
3193559,UCJEPS,JEPS3131,,Nemophila menziesii,205099,3/8/1931,1931,3,8,67,Mar 8 1931,Flowering/Fruiting,Contra Costa,"w bank Mitchell Canyon, Mount Diablo Mount Diablo, Mitchell Canyon",37.900337,-121.9519,2229,304,1000 ft,cch2,urn:uuid:8a0feb06-ae94-4e35-8b0c-fcc6de5d0c57,http://cch2.org/portal/collections/individual/index.php?occid=3193559
3195136,UCJEPS,JEPS1886,,Nemophila menziesii var. atomaria,205101,4/17/1938,1938,4,17,107,Apr 17 1938,Flowering/Fruiting,Del Norte,"Bonner Flat , Bonner Flat (Gasquet-Low Divide Trail)",41.880707,-123.995575,8060,152,500 ft,cch2,urn:uuid:ed9c54dd-8605-43d0-94eb-70f8da900d5e,http://cch2.org/portal/collections/individual/index.php?occid=3195136
3195175,UCJEPS,JEPS1498,,Nemophila menziesii,205099,4/1/1933,1933,4,1,91,Apr 01 1933,Flowering/Fruiting,Santa Clara,Robertsville,37.26333,-121.87528,,106,350 ft,cch2,urn:uuid:f131a258-06dc-4c38-8306-6afbd9a69b05,http://cch2.org/portal/collections/individual/index.php?occid=3195175
3198711,UCJEPS,UC24215,,Nemophila menziesii,205099,1890-01-01,1890,1,1,1,1890s,Flowering/Fruiting,Marin,Angel Is.,37.86278,-122.43083,1658,,,cch2,urn:uuid:f94712f1-05f8-41ba-b20e-501d8a111300,http://cch2.org/portal/collections/individual/index.php?occid=3198711
3199808,UCJEPS,UC56413,,Nemophila menziesii,205099,3/1/1903,1903,3,1,60,3-Mar,Flowering/Fruiting,Los Angeles,Elysian Park,34.07944,-118.23667,,,,cch2,urn:uuid:a72d855f-84fb-4068-93cf-1756709d3682,http://cch2.org/portal/collections/individual/index.php?occid=3199808
3200544,UCJEPS,UC67147,,Nemophila menziesii,205099,3/23/1900,1900,3,23,82,Mar 23 1900,Flowering/Fruiting,Contra Costa,"Briones Hills San Francisco Bay Region, Briones Hills",37.94306,-122.14556,,,,cch2,urn:uuid:3fddf843-424a-48ff-870e-e20c05210d35,http://cch2.org/portal/collections/individual/index.php?occid=3200544
3204854,UCJEPS,JEPS60186,,Nemophila menziesii,205099,4/24/1969,1969,4,24,114,Apr 24 1969,Flowering/Fruiting,Riverside,along highway 79 about 2 1/2 mi s Sage; s of Sage,,,,,,cch2,urn:uuid:1f6f8920-f704-45fa-8bf8-a0c1cbe55d95,http://cch2.org/portal/collections/individual/index.php?occid=3204854
3205205,UCJEPS,JEPS18372,,Nemophila menziesii var. integrifolia,205102,4/3/1957,1957,4,3,93,Apr 3 1957,Flowering/Fruiting,San Diego,"ne La Jolla (top of first low hill across canyon ne of Soledad Mountain); ne of Soledad Mountain, ne of La Jolla",,,,124,410 ft,cch2,urn:uuid:cfa146d3-e92b-4962-9947-85aa6b56af8b,http://cch2.org/portal/collections/individual/index.php?occid=3205205
3208026,UCJEPS,UC1069173,,Nemophila menziesii,205099,3/27/1935,1935,3,27,86,Mar 27 1935,Flowering/Fruiting,Los Angeles,"2 3/4 mi nne Sawmill Peak; Tejon Quad., nne of Sawmill Peak",34.7257,-118.5443,805,1219,4000 ft,cch2,urn:uuid:fe004fc9-2679-4b83-966d-35f7590240c3,http://cch2.org/portal/collections/individual/index.php?occid=3208026
3210919,UCJEPS,UC197341,,Nemophila menziesii,205099,1887-04-01,1887,4,1,91,April 1887,Flowering/Fruiting,Marin,Ross Valley,37.94889,-122.54389,,,,cch2,urn:uuid:89d70e0d-3ff7-4023-bacf-4563a1a8874f,http://cch2.org/portal/collections/individual/index.php?occid=3210919
3211143,UCJEPS,UC24205,,Nemophila menziesii,205099,1800-01-01,1800,1,1,1,1800s,Flowering/Fruiting,Alameda,Oakland,37.80444,-122.26972,,,,cch2,urn:uuid:38e1ce70-a18b-4204-8f74-02cdba72fce3,http://cch2.org/portal/collections/individual/index.php?occid=3211143
3211193,UCJEPS,UC24233,,Nemophila menziesii,205099,1821-01-01,1821,1,1,1,before 1897,Flowering/Fruiting,Mendocino,near Ukiah; near Ukiah,39.15028,-123.20667,,,,cch2,urn:uuid:421ed9e4-d190-4836-a727-c58e43422284,http://cch2.org/portal/collections/individual/index.php?occid=3211193
3212257,UCJEPS,UC571711,,Nemophila menziesii,205099,3/30/1933,1933,3,30,89,Mar 30 1933,Flowering/Fruiting,Santa Clara,"Arroyo Mocho near headwaters (Mount Hamilton Range); , Arroyo Mocho",,,,,,cch2,urn:uuid:a1d0389e-fe07-43ea-bafe-e6ad54fe131f,http://cch2.org/portal/collections/individual/index.php?occid=3212257
3212540,UCJEPS,UC606954,,Nemophila menziesii,205099,5/7/1938,1938,5,7,127,May 7 1938,Flowering/Fruiting,Kern,6 mi n Caliente; n of Caliente,35.331085,-118.58599,3232,,,cch2,urn:uuid:3a3c45e6-eaf8-4f3f-ad41-5772f4ac8b18,http://cch2.org/portal/collections/individual/index.php?occid=3212540
3217133,UCJEPS,JEPS21153,,Nemophila menziesii,205099,3/20/1936,1936,3,20,80,Mar 20 1936,Flowering/Fruiting,Santa Barbara,"two and one half mi sw Spanish Ranch; McKittrick Quad., Santa Barbara Natl For, sw Spanish Ranch",35.0238,-120.0327,4828,762,2500 ft,cch2,urn:uuid:32f0da7f-6eee-464f-99b6-98110e66c76c,http://cch2.org/portal/collections/individual/index.php?occid=3217133
3218609,UCJEPS,JEPS1793,,Nemophila menziesii,205099,4/7/1922,1922,4,7,97,Apr 7 1922,Flowering/Fruiting,San Bernardino,"3 mi sw Hesperia (Mohave Desert); , sw of Hesperia",,,,,,cch2,urn:uuid:9ad5211c-1928-471b-9abe-c2f16eef29b7,http://cch2.org/portal/collections/individual/index.php?occid=3218609
3218819,UCJEPS,JEPS1884,,Nemophila menziesii,205099,4/22/1933,1933,4,22,112,Apr 22 1933,Flowering/Fruiting,Del Norte,Coast Bluffs 5 mi s Crescent City; Coast Bluffs 5 mi s of Crescent City,41.749508,-124.194595,1622,152,500 ft,cch2,urn:uuid:ff5276c0-1f4b-4ffc-a056-d72e94084e5e,http://cch2.org/portal/collections/individual/index.php?occid=3218819
3219940,UCJEPS,UC1021938,,Nemophila menziesii,205099,4/15/1954,1954,4,15,105,Apr 15 1954,Flowering/Fruiting,Placer,Auburn-Folsom Road eight mi s Auburn; s of Auburn,,,,,,cch2,urn:uuid:7df2c93d-46cb-4aa4-be69-52e21e1f1f5c,http://cch2.org/portal/collections/individual/index.php?occid=3219940
3223198,UCJEPS,UC24208,,Nemophila menziesii,205099,3/4/1902,1902,3,4,63,Mar 4 1902,Flowering/Fruiting,Alameda,"San Leandro Creek San Francisco Bay Region, San Leandro Creek",37.74299,-122.07432,17020,,,cch2,urn:uuid:231439cc-02a5-4c16-9719-cb5ac934e1f6,http://cch2.org/portal/collections/individual/index.php?occid=3223198
3223700,UCJEPS,UC444997,,Nemophila menziesii,205099,4/1/1931,1931,4,1,91,Apr-31,Flowering/Fruiting,Kern,Greenhorn Mts.--foot. toward Porterville,,,,,,cch2,urn:uuid:342a9a75-2603-424a-863f-8a5d86233c7e,http://cch2.org/portal/collections/individual/index.php?occid=3223700
3228819,UCJEPS,UC2028828,,Nemophila menziesii var. menziesii,205103,3/19/2013,2013,3,19,78,19-Mar-13,,Kern,"North of Comanche Creek, Tejon Ranch.",35.098277,-118.759768,1000,343,343,cch2,urn:uuid:402aded2-8ff1-4888-808d-70d3b6d270f0,http://cch2.org/portal/collections/individual/index.php?occid=3228819
3229172,UCJEPS,JEPS1883,,Nemophila menziesii var. atomaria,205101,5/10/1932,1932,5,10,131,May 10 1932,Flowering/Fruiting,Humboldt,"Bear River Ridge , Bear River Ridge (Northern Coast Ranges)",,,,609,2000 ft,cch2,urn:uuid:b0894ee7-1ff4-4150-b496-77391a5ed44b,http://cch2.org/portal/collections/individual/index.php?occid=3229172
3230205,UCJEPS,JEPS110847,,Nemophila menziesii var. menziesii,205103,2/16/1982,1982,2,16,47,16-Feb-82,,Napa,.3 mile north of Chimney Golf Course on Silverado Trail,38.3801,-122.3087,805,20,67 ft.,cch2,urn:uuid:7e3e5f8e-a685-46ed-beeb-4a1bf71707bc,http://cch2.org/portal/collections/individual/index.php?occid=3230205
3230631,UCJEPS,JEPS3134,,Nemophila menziesii,205099,3/28/1915,1915,3,28,87,Mar 28 1915,Flowering/Fruiting,Tulare,"Shepherd Cove , Shepherd Cove (Sequoia National Park)",36.47714,-118.85665,673,396,1300 ft,cch2,urn:uuid:be2b7da9-093b-4388-8d51-5d71d5e8d2db,http://cch2.org/portal/collections/individual/index.php?occid=3230631
3231802,UCJEPS,JEPS30298,,Nemophila menziesii,205099,4/8/1961,1961,4,8,98,Apr 8 1961,Flowering/Fruiting,Fresno,"Kerckhoff Lake Bridge 1.5 mi s toward Auberry (and 0.6 mi e on fire road); Kerckhoff Lake Bridge, toward Auberry",37.130318,-119.49819,1783,,,cch2,urn:uuid:9cdb9106-f609-4328-86fb-00179e48b7b6,http://cch2.org/portal/collections/individual/index.php?occid=3231802
3232283,UCJEPS,UC1069183,,Nemophila menziesii,205099,4/6/1935,1935,4,6,96,Apr 6 1935,Flowering/Fruiting,Santa Barbara,"6 mi wsw Cuyama Ranch; Santa Ynez Quad., wsw of Cuyama Ranch",34.9374,-119.6822,805,746,2450 ft,cch2,urn:uuid:f055e948-b5ee-433a-a820-96c88c0a8571,http://cch2.org/portal/collections/individual/index.php?occid=3232283
3232294,UCJEPS,UC107228,,Nemophila menziesii,205099,4/1/1901,1901,4,1,91,1-Apr,Flowering/Fruiting,Sonoma,Bodega,38.345707,-122.97271,370,,,cch2,urn:uuid:ea049d68-ba31-456d-9076-5cbfa4810b69,http://cch2.org/portal/collections/individual/index.php?occid=3232294
3233426,UCJEPS,UC1239751,,Nemophila menziesii,205099,3/17/1923,1923,3,17,76,Mar 17 1923,Flowering/Fruiting,Humboldt,vicinity Garberville; vicinity of Garberville,40.0899,-123.797,150,121,400 ft,cch2,urn:uuid:4f69b853-7959-488e-ab58-7b4844689c45,http://cch2.org/portal/collections/individual/index.php?occid=3233426
3233710,UCJEPS,UC131658,,Nemophila menziesii,205099,3/25/1904,1904,3,25,85,Mar 25 1904,Flowering/Fruiting,Santa Clara,w Los Gatos; w of Los Gatos,37.209385,-122.05352,1622,,,cch2,urn:uuid:d32a4738-d28e-4635-b3ce-ea08fab1ab32,http://cch2.org/portal/collections/individual/index.php?occid=3233710
3236174,UCJEPS,UC511238,,Nemophila menziesii,205099,2/27/1932,1932,2,27,58,Feb 27 1932,Flowering/Fruiting,Kern,"Kern River Park , Kern River Park (Kern River Watershed)",35.434701,-118.883573,4000,182,600 ft,cch2,urn:uuid:8900b3d5-6a3a-40cf-bdef-ef0b3a699aa8,http://cch2.org/portal/collections/individual/index.php?occid=3236174
3236371,UCJEPS,UC545848,,Nemophila menziesii,205099,3/15/1936,1936,3,15,75,Mar 15 1936,Flowering/Fruiting,Napa,Chiles Valley Road 3.2 mi from Pope Valley Store; Chiles Valley Road <nr> Pope Valley Store,38.5885,-122.40074,750,,,cch2,urn:uuid:d94bb662-1463-437a-9266-78a2ceaea1b0,http://cch2.org/portal/collections/individual/index.php?occid=3236371
3237634,UCJEPS,UC75480,,Nemophila menziesii var. integrifolia,205102,4/29/1906,1906,4,29,119,Apr 29 1906,Flowering/Fruiting,San Bernardino,"near Victorville; Mohave Desert, Dead Man's Point; Dead Man's Point, near Victorville, San Bernardino Co., Mohave Desert",34.473101,-117.124596,2000,925,925 m,cch2,urn:uuid:6f50de5e-e7a4-4db5-a93b-473bebb05e22,http://cch2.org/portal/collections/individual/index.php?occid=3237634
3241438,UCJEPS,JEPS1916,,Nemophila menziesii,205099,1891-03-22,1891,3,22,81,Mar 22 1891,Flowering/Fruiting,San Francisco,Lake Merced,37.7198,-122.49132,2456,,,cch2,urn:uuid:d0cae6db-cf8b-4745-b8fa-c4a7976c4dc2,http://cch2.org/portal/collections/individual/index.php?occid=3241438
3242610,UCJEPS,JEPS83176,,Nemophila menziesii,205099,5/12/1982,1982,5,12,132,May 12 1982,Flowering/Fruiting,Monterey,"Poison Oak Hill Carmel Valley, Hastings Natural History Reservation (Hastings Natural History Reservation)",,,,,,cch2,urn:uuid:c1764285-cee0-424b-9911-b28f0068c85d,http://cch2.org/portal/collections/individual/index.php?occid=3242610
3243069,UCJEPS,JEPS1794,,Nemophila menziesii,205099,4/23/1920,1920,4,23,114,Apr 23 1920,Flowering/Fruiting,San Diego,head of Grapevine Canyon,,,,,,cch2,urn:uuid:617599a7-05b6-4494-82c9-b5e249bffbc6,http://cch2.org/portal/collections/individual/index.php?occid=3243069
3243110,UCJEPS,JEPS1878,,Nemophila menziesii var. atomaria,205101,1893-04-25,1893,4,25,115,Apr 25 1893,Flowering/Fruiting,Napa,"trail to Caux's Cabin Napa River Basin, = Mts. n of St. Helena (Napa River Basin, = Mts. n of St. Helena)",,,,,,cch2,urn:uuid:84411039-d883-4d15-86e0-1d70e4f94813,http://cch2.org/portal/collections/individual/index.php?occid=3243110
3243827,UCJEPS,JEPS1894,,Nemophila menziesii var. integrifolia,205102,5/17/1901,1901,5,17,137,"May 17 1901-June 1, 1901",Flowering/Fruiting,San Diego,"French Valley Palomar Mtn., French Valley (Palomar Mtn. (note in packet reads ""Smith Mts.""))",33.36033,-116.88417,2414,,,cch2,urn:uuid:f7b4bd35-7c52-4fbe-b968-6ea540396779,http://cch2.org/portal/collections/individual/index.php?occid=3243827
3244509,UCJEPS,UC1057474,,Nemophila menziesii,205099,3/21/1940,1940,3,21,81,Mar 21 1940,Flowering/Fruiting,Sonoma,2-3 mi se Windsor (Pleasant Avenue Road and Chalk Hill Road); se of Windsor,38.540382,-122.77343,341,91,300 ft,cch2,urn:uuid:846fed53-c2a1-4d75-9921-c16d98547300,http://cch2.org/portal/collections/individual/index.php?occid=3244509
3245601,UCJEPS,UC1223596,,Nemophila menziesii,205099,,,,,,,Flowering/Fruiting,,,,,,,,cch2,urn:uuid:6f413f57-7d85-4945-9342-ef37305847ff,http://cch2.org/portal/collections/individual/index.php?occid=3245601
3246164,UCJEPS,UC144182,,Nemophila menziesii,205099,4/18/1905,1905,4,18,108,Apr 18 1905,Flowering/Fruiting,Kern,Girard Station,35.190178,-118.51551,1220,,,cch2,urn:uuid:48a5dbff-5371-4fc0-a08b-39e7a299d88a,http://cch2.org/portal/collections/individual/index.php?occid=3246164
3246403,UCJEPS,UC1537401,,Nemophila menziesii,205099,2/22/1935,1935,2,22,53,Feb 22 1935,Flowering/Fruiting,Riverside,Mockingbird Canyon,33.8701,-117.3882,4300,457,1500 ft,cch2,urn:uuid:7ca93986-31d3-4e36-8e14-8063d2fc63e2,http://cch2.org/portal/collections/individual/index.php?occid=3246403
3247160,UCJEPS,UC184397,,Nemophila menziesii,205099,4/1/1902,1902,4,1,91,"April, 1902",Flowering/Fruiting,Monterey,Del Monte,,,,,,cch2,urn:uuid:e799ae35-ad06-4104-bbe3-55b4bdadf8a0,http://cch2.org/portal/collections/individual/index.php?occid=3247160
3247653,UCJEPS,UC24235,,Nemophila menziesii,205099,1896-03-15,1896,3,15,75,Mar 15 1896,Flowering/Fruiting,Sonoma,near Fort Ross; near Fort Ross,38.51417,-123.2425,,,,cch2,urn:uuid:d1843064-d44e-4246-bba9-58b2df5ec410,http://cch2.org/portal/collections/individual/index.php?occid=3247653
3247802,UCJEPS,UC306572,,Nemophila menziesii,205099,4/1/1903,1903,4,1,91,"April, 1903",Flowering/Fruiting,Monterey,Bardino,,,,,,cch2,urn:uuid:0dd6fc82-a668-4dd0-8fea-bdca717c5185,http://cch2.org/portal/collections/individual/index.php?occid=3247802
3248934,UCJEPS,UC606906,,Nemophila menziesii,205099,4/3/1938,1938,4,3,93,Apr 3 1938,Flowering/Fruiting,San Benito,"on Tres Pinos Creek 7 mi nw Llanada (San Carlos Range, Inner South Coast Ranges); Inner South Coast Ranges, San Carlos Range",36.68138,-121.00466,5057,609,2000 ft,cch2,urn:uuid:a2c9cc82-3d01-4ca5-8991-bb0ce3ead18f,http://cch2.org/portal/collections/individual/index.php?occid=3248934
3253508,UCJEPS,UC1245395,,Nemophila menziesii,205099,6/17/1932,1932,6,17,169,Jun 17 1932,Flowering/Fruiting,Trinity,Three Forks Mad River,40.1657,-123.226006,1204,,,cch2,urn:uuid:4cf0d7fa-6d99-425d-a4ce-c88f6188f21c,http://cch2.org/portal/collections/individual/index.php?occid=3253508
3253946,UCJEPS,JEPS1885,,Nemophila menziesii var. atomaria,205101,4/13/1919,1919,4,13,103,Apr 13 1919,Flowering/Fruiting,Napa,near Atlas; near Atlas,,,,,,cch2,urn:uuid:eb7ec36c-85d1-4e2f-a947-046de309659b,http://cch2.org/portal/collections/individual/index.php?occid=3253946
3257807,UCJEPS,UC1211139,,Nemophila menziesii,205099,4/30/1912,1912,4,30,121,Apr 30 1912,Flowering/Fruiting,Los Angeles,Mt. Wilson; creek,,,,1219,4000 ft,cch2,urn:uuid:ced72a65-1a9e-49b3-bfbd-b3bd16cb67ad,http://cch2.org/portal/collections/individual/index.php?occid=3257807
3257905,UCJEPS,UC1245392,,Nemophila menziesii,205099,6/13/1933,1933,6,13,164,Jun 13 1933,Flowering/Fruiting,Humboldt,summit Bear's-Hoopa Road,,,,1066,3500 ft,cch2,urn:uuid:178b02f5-b3ce-4d54-a3f2-523e34528a31,http://cch2.org/portal/collections/individual/index.php?occid=3257905
3257956,UCJEPS,UC1282735,,Nemophila menziesii,205099,5/2/1952,1952,5,2,123,May 2 1952,Flowering/Fruiting,Lake,"0.4 mi se Black Oak Villa (in Butts Canyon, 1.1 mi from Lake-Napa County Line on Pope Valley Road); se of Black Oak Villa in Butts Canyon",38.71233,-122.47852,254,243,800 ft,cch2,urn:uuid:e8c1e35a-33a0-48c2-886e-9e20bdf52c5a,http://cch2.org/portal/collections/individual/index.php?occid=3257956
3260018,UCJEPS,UC310216,,Nemophila menziesii,205099,5/1/1926,1926,5,1,121,May 1 1926,Flowering/Fruiting,San Diego,Oak Grove trail to Palomar Mt.; Oak Grove trail to Palomar Mt.,33.37773,-116.82082,3219,1524,5000 ft,cch2,urn:uuid:b45da506-92c2-4dd9-bd90-534c856beece,http://cch2.org/portal/collections/individual/index.php?occid=3260018
3260561,UCJEPS,UC489037,,Nemophila menziesii,205099,6/1/1927,1927,6,1,152,27-Jun,Flowering/Fruiting,Riverside,"Saunder's Meadow , Saunder's Meadow (San Jacinto Mts.)",33.7327,-116.7118,300,1676,5500 ft,cch2,urn:uuid:91815d1a-e5c4-4778-ac72-b131042bb293,http://cch2.org/portal/collections/individual/index.php?occid=3260561
3261145,UCJEPS,UC592189,,Nemophila menziesii,205099,3/7/1925,1925,3,7,66,Mar 7 1925,Flowering/Fruiting,Alameda,bluff above stream junction one-half mi sw Sunol; sw of Sunol,37.579037,-121.90704,2803,,,cch2,urn:uuid:793c9833-a34d-4170-bf5e-1e2c39425bd6,http://cch2.org/portal/collections/individual/index.php?occid=3261145
3261247,UCJEPS,UC606904,,Nemophila menziesii,205099,4/1/1938,1938,4,1,91,1-Apr-38,Flowering/Fruiting,Santa Clara,"near Morgan Hill (se base of El Toro, Santa Cruz Mountains); South Coast Ranges, Santa Cruz Mountains, El Toro",,,,243,800 ft,cch2,urn:uuid:4ec8eade-38f4-4bae-8957-0ef6db745bbe,http://cch2.org/portal/collections/individual/index.php?occid=3261247
3263926,UCJEPS,UC1980035,,Nemophila menziesii var. menziesii,205103,3/30/2009,2009,3,30,89,30-Mar-09,Flowering/Fruiting,Kern,"Coast Ranges; Temblor Mountains region: West end of the San Emigdio Mountains: Bitter Creek National Wildlife Refuge; Cienaga Canyon, off of Klipstein Canyon Road. Northeast of Cerro Noroeste Road.",34.94695,-119.40093,,973,973,cch2,urn:uuid:0fd63c8c-4ca3-411b-8e29-376f866af8ad,http://cch2.org/portal/collections/individual/index.php?occid=3263926
3266352,UCJEPS,JEPS1517,,Nemophila menziesii var. integrifolia,205102,4/18/1928,1928,4,18,109,Apr 18 1928,Flowering/Fruiting,Los Angeles,"Griffith Park Los Angeles, Griffith Park",34.134533,-118.30477,3384,,,cch2,urn:uuid:c17e9eaa-2d72-4020-8b00-744e4f61f730,http://cch2.org/portal/collections/individual/index.php?occid=3266352
3266831,UCJEPS,JEPS1490,,Nemophila menziesii,205099,4/16/1938,1938,4,16,106,Apr 16 1938,Flowering/Fruiting,Kern,"small hill w Isabella (Kern River Canyon); , w of Isabella",,,,762,2500 ft,cch2,urn:uuid:537451bd-517a-472a-abe4-4b18d61a5427,http://cch2.org/portal/collections/individual/index.php?occid=3266831
3268936,UCJEPS,UC1069200,,Nemophila menziesii,205099,3/11/1934,1934,3,11,70,Mar 11 1934,Flowering/Fruiting,Sutter,"1 mi sw Union School; Marysville Buttes Quad., sw of Union School",39.2011,-121.7344,805,22,75 ft,cch2,urn:uuid:251f3f3a-1797-40bd-8203-e4d5dfd02b36,http://cch2.org/portal/collections/individual/index.php?occid=3268936
3272449,UCJEPS,UC450875,,Nemophila menziesii,205099,3/7/1931,1931,3,7,66,Mar 7 1931,Flowering/Fruiting,Los Angeles,"Vineland Ave. , Vineland Ave. (Roscoe)",34.220536,-118.370733,1600,,,cch2,urn:uuid:0a0695d6-37ad-4ae6-8b08-b3e765b87526,http://cch2.org/portal/collections/individual/index.php?occid=3272449
3273089,UCJEPS,UC571709,,Nemophila menziesii,205099,3/31/1935,1935,3,31,90,Mar 31 1935,Flowering/Fruiting,Santa Clara,between Hall's Valley and Grand View (western side of Mount Hamilton); western side of Mount Hamilton,37.342384,-121.64059,520,548,1800 ft,cch2,urn:uuid:e6e8090f-6e48-4c7c-8a72-fd5f3cb60731,http://cch2.org/portal/collections/individual/index.php?occid=3273089
3273332,UCJEPS,UC606914,,Nemophila menziesii,205099,5/25/1938,1938,5,25,145,May 25 1938,Flowering/Fruiting,San Benito,"1 mi s Idria (San Carlos Range); Inner South Coast Ranges, , s of Idria",36.403248,-120.672295,2995,914,3000 ft,cch2,urn:uuid:9b21deb3-6b51-4189-b5d7-62ec350f9623,http://cch2.org/portal/collections/individual/index.php?occid=3273332
3273996,UCJEPS,UC72017,,Nemophila menziesii,205099,1891-01-01,1891,1,1,1,1891,Flowering/Fruiting,San Luis Obispo,Huasna,,,,,,cch2,urn:uuid:4920f8bd-abc3-43ac-8c8a-ab64d2e2d532,http://cch2.org/portal/collections/individual/index.php?occid=3273996
3274137,UCJEPS,UC75161,,Nemophila menziesii,205099,4/6/1903,1903,4,6,96,Apr 6 1903,Flowering/Fruiting,San Francisco,"San Bruno hills , San Bruno hills (San Francisco)",,,,,,cch2,urn:uuid:40909169-df09-4b4e-8e68-c7cc72cfe49b,http://cch2.org/portal/collections/individual/index.php?occid=3274137
3277859,UCJEPS,JEPS1889,,Nemophila menziesii var. integrifolia,205102,5/29/1917,1917,5,29,149,May 29 1917,Flowering/Fruiting,San Diego,Mesa Grande,,,,1021,3350 ft,cch2,urn:uuid:f878ce65-4e8b-439b-a95b-0b89d3d000f8,http://cch2.org/portal/collections/individual/index.php?occid=3277859
3279415,UCJEPS,JEPS25353,,Nemophila menziesii,205099,3/19/1959,1959,3,19,78,Mar 19 1959,Flowering/Fruiting,Contra Costa,"2.4 mi w Byron (s-facing low hill along Camino Diablo, 0.3 mi e of junction with Vasco Road); along Camino Diablo, w of Byron",37.86474,-121.679,851,60,200 ft,cch2,urn:uuid:e5859230-ca17-4462-ab20-21c687330bf9,http://cch2.org/portal/collections/individual/index.php?occid=3279415
3279548,UCJEPS,JEPS3067,,Nemophila menziesii,205099,3/12/1916,1916,3,12,72,Mar 12 1916,Flowering/Fruiting,Tuolumne,near Jamestown; nr Jamestown,37.95333,-120.42167,,457,1500 ft,cch2,urn:uuid:355f222f-67b7-4f72-b3db-50616fca728c,http://cch2.org/portal/collections/individual/index.php?occid=3279548
3280147,UCJEPS,JEPS1891,,Nemophila menziesii var. integrifolia,205102,5/17/1901,1901,5,17,137,"May 17 1901-June 1, 1901",Flowering/Fruiting,Riverside,Strawberry Valley,33.74553,-116.71441,8047,1828,6000 ft,cch2,urn:uuid:5ce6fc17-132d-4f29-a36d-366ec6b79534,http://cch2.org/portal/collections/individual/index.php?occid=3280147
3281079,UCJEPS,UC1069195,,Nemophila menziesii,205099,3/30/1938,1938,3,30,89,Mar 30 1938,Flowering/Fruiting,Monterey,"3 1/2 mi ese Pleyto Well; Bradley Quad., ese Pleyto Well",35.7981,-120.8033,805,289,950 ft,cch2,urn:uuid:fe08b746-57c1-41fa-a524-6b756e89b54d,http://cch2.org/portal/collections/individual/index.php?occid=3281079
3281090,UCJEPS,UC1069166,,Nemophila menziesii,205099,4/24/1935,1935,4,24,114,Apr 24 1935,Flowering/Fruiting,Calaveras,"3 1/2 mi sw Hodson; Copperopolis Quad., sw of Hodson",37.96648,-120.713326,1189,304,1000 ft,cch2,urn:uuid:0d22023f-7843-4f7c-a71a-9c566143a5b5,http://cch2.org/portal/collections/individual/index.php?occid=3281090
3282758,UCJEPS,UC1426018,,Nemophila menziesii,205099,3/29/1973,1973,3,29,88,Mar 29 1973,Flowering/Fruiting,Los Angeles,"Evey Canyon San Gabriel Mountains, Evey Canyon (0.3 mi from mouth canyon, San Gabriel Mountains)",34.166069,-117.683611,150,713,2340 ft,cch2,urn:uuid:5013d198-62de-4aa2-ade1-fab31ebc3645,http://cch2.org/portal/collections/individual/index.php?occid=3282758
3283308,UCJEPS,UC1614472,,Nemophila menziesii,205099,2/24/1935,1935,2,24,55,Feb 24 1935,Flowering/Fruiting,Alameda,"above Monument Hill Strawberry Canyon (Berkeley); , , above Monument Hill",37.873528,-122.23781,1120,,,cch2,urn:uuid:b58bf4a0-fb7d-4f8e-b488-f9cd5ccd640f,http://cch2.org/portal/collections/individual/index.php?occid=3283308
3283366,UCJEPS,UC1614293,,Nemophila menziesii,205099,3/17/1935,1935,3,17,76,Mar 17 1935,Flowering/Fruiting,Alameda,"along w fence of Botanical Gardens Strawberry Canyon (Strawberry Canyon, Berkeley); Berkeley, Strawberry Canyon",37.873528,-122.23781,1120,,,cch2,urn:uuid:5c4a6624-8907-4222-81b1-a75f31591740,http://cch2.org/portal/collections/individual/index.php?occid=3283366
3284205,UCJEPS,UC24230,,Nemophila menziesii,205099,1800-01-01,1800,1,1,1,1800s,Flowering/Fruiting,,,,,,,,cch2,urn:uuid:d9733d3d-89d7-4a71-b09b-46275ae06d04,http://cch2.org/portal/collections/individual/index.php?occid=3284205
3284882,UCJEPS,UC496087,,Nemophila menziesii,205099,7/2/1907,1907,7,2,183,Jul 2 1907,Flowering/Fruiting,Monterey,"near Carmel Highlands (San Jose Canyon); , near Carmel Highlands",36.519,-121.9178,850,,,cch2,urn:uuid:273eb2a8-7388-425f-8fd6-ba002c2cde6f,http://cch2.org/portal/collections/individual/index.php?occid=3284882
3284947,UCJEPS,UC495298,,Nemophila menziesii,205099,3/24/1932,1932,3,24,84,Mar 24 1932,Flowering/Fruiting,Riverside,n Elsinore; n of Elsinore,33.70889,-117.36083,,304,1000 ft,cch2,urn:uuid:d1a6473f-3020-4de1-af50-5574c30179ef,http://cch2.org/portal/collections/individual/index.php?occid=3284947
3285052,UCJEPS,UC501547,,Nemophila menziesii,205099,3/19/1925,1925,3,19,78,Mar 19 1925,Flowering/Fruiting,Kern,n slope Tehachapi North slope Tehachapi,,,,609,2000 ft,cch2,urn:uuid:a35d4b09-33f3-4b76-a5e1-6d66221960f8,http://cch2.org/portal/collections/individual/index.php?occid=3285052
3285356,UCJEPS,UC564183,,Nemophila menziesii,205099,3/29/1935,1935,3,29,88,Mar 29 1935,Flowering/Fruiting,San Luis Obispo,"two mi s Simmler; Carriso Plain, s of Simmler",,,,,,cch2,urn:uuid:3482ab38-409e-43d6-bd44-19b94a11ef1d,http://cch2.org/portal/collections/individual/index.php?occid=3285356
3286534,UCJEPS,UC753438,,Nemophila menziesii,205099,4/23/1946,1946,4,23,113,Apr 23 1946,Flowering/Fruiting,Santa Barbara,n side Figueroa Mountain,,,,1219,4000 ft,cch2,urn:uuid:9a312a36-5302-4a1d-aac0-69cf3f8e79a9,http://cch2.org/portal/collections/individual/index.php?occid=3286534
3291661,UCJEPS,JEPS1488,,Nemophila menziesii,205099,5/7/1938,1938,5,7,127,May 7 1938,Flowering/Fruiting,Madera,"11 mi sw Coarse Gold (3 mi sw of Kelshaw Corners, Sierra Nevada foothills); Sierra Nevada foothills, sw of Coarse Gold, sw Kelshaw Corne",37.121006,-119.77128,2836,762,2500 ft,cch2,urn:uuid:127f952f-3aed-4fcc-96e5-e66cca90f75b,http://cch2.org/portal/collections/individual/index.php?occid=3291661
3292491,UCJEPS,JEPS111846,,Nemophila menziesii var. menziesii,205103,3/25/2005,2005,3,25,84,25-Mar-05,,Contra Costa,Pinole Peak Fernandez Ranch. West of Christie Road. South of I-4 (behind golf course) and North of Pinole Peak,37.984165,-122.202774,100,250,250 m,cch2,urn:uuid:915649a0-c64d-49b0-a98c-97c104c59281,http://cch2.org/portal/collections/individual/index.php?occid=3292491
3293194,UCJEPS,UC1019605,,Nemophila menziesii,205099,3/19/1926,1926,3,19,78,Mar 19 1926,Flowering/Fruiting,San Diego,near gate to entrance San Felipe Ranch (between Julian and Colorado Desert); between Julian and Colorado Desert,33.1125,-116.523,1609,,,cch2,urn:uuid:a9635555-c5af-4c67-b90f-475b3972b983,http://cch2.org/portal/collections/individual/index.php?occid=3293194
3293464,UCJEPS,UC1069188,,Nemophila menziesii,205099,3/14/1936,1936,3,14,74,Mar 14 1936,Flowering/Fruiting,San Luis Obispo,"1 mi ese Sycamore Springs; Arroyo Grande Quad., San Luis Obispo NF, ese Sycamore Spring",35.1874,-120.691,805,76,250 ft,cch2,urn:uuid:f96acbf5-40e9-4d55-88c9-4cc1c711beb6,http://cch2.org/portal/collections/individual/index.php?occid=3293464
3296490,UCJEPS,UC24238,,Nemophila menziesii,205099,1899-02-22,1899,2,22,53,Feb 22 1899,Flowering/Fruiting,Alameda,"Baldy Peak Berkeley, Baldy Peak (Berkeley, north-western Alameda County)",,,,,,cch2,urn:uuid:3c8c8098-5f1a-405f-81a3-a690b4ef51ed,http://cch2.org/portal/collections/individual/index.php?occid=3296490
3296505,UCJEPS,UC24224,,Nemophila menziesii,205099,1896-05-20,1896,5,20,141,May 20 1896,Flowering/Fruiting,Los Angeles,Leonis Valley,34.62475,-118.30813,7000,,,cch2,urn:uuid:fd0a7bcf-2a88-4f7e-969a-8e6583d97cee,http://cch2.org/portal/collections/individual/index.php?occid=3296505
3297802,UCJEPS,UC592190,,Nemophila menziesii,205099,3/20/1932,1932,3,20,80,Mar 20 1932,Flowering/Fruiting,Contra Costa,Antioch sand hills,38.015244,-121.78886,890,,,cch2,urn:uuid:fe5fa247-0b09-4b44-965a-4882685d3731,http://cch2.org/portal/collections/individual/index.php?occid=3297802
3302527,UCJEPS,JEPS1906,,Nemophila menziesii var. atomaria,205101,7/4/1937,1937,7,4,185,Jul 4 1937,Flowering/Fruiting,Del Norte,Gasquet,41.84556,-123.96833,,152,500 ft,cch2,urn:uuid:088ba6f7-78bb-4249-be39-90d527c47a9e,http://cch2.org/portal/collections/individual/index.php?occid=3302527
3303326,UCJEPS,JEPS3204,,Nemophila menziesii,205099,,,,,,,Flowering/Fruiting,Santa Cruz,"watershed of San Gregorio Creek Santa Cruz Mountains, Kings Mt., San Gregorio Creek (Sierra Morena (Kings Mountain) Santa Cruz Mountains)",,,,,,cch2,urn:uuid:71bd9f09-80e4-413e-b931-4ee8cfe7180f,http://cch2.org/portal/collections/individual/index.php?occid=3303326
3303659,UCJEPS,JEPS1493,,Nemophila menziesii,205099,5/25/1938,1938,5,25,145,May 25 1938,Flowering/Fruiting,San Benito,"1 mi s Idria; Inner South Coast Ranges, San Carlos Range",36.403248,-120.672295,2995,914,3000 ft,cch2,urn:uuid:08680523-0a4e-4430-aa91-294dcf02744f,http://cch2.org/portal/collections/individual/index.php?occid=3303659
3304477,UCJEPS,JEPS3135,,Nemophila menziesii,205099,6/1/1927,1927,6,1,152,27-Jun,Flowering/Fruiting,Riverside,"Saunder's Meadow San Jacinto Mts., Saunder's Meadow (San Jacinto Mountains)",33.7327,-116.7118,300,1676,5500 ft,cch2,urn:uuid:7951a232-35c4-41aa-bbc7-cad8d9e282c7,http://cch2.org/portal/collections/individual/index.php?occid=3304477
3305663,UCJEPS,UC1039812,,Nemophila menziesii,205099,4/16/1956,1956,4,16,107,Apr 16 1956,Flowering/Fruiting,Fresno,"e side Kerckhoff Lake; Sierra National Forest, Quad. 89-D1, e side Kerckhoff Lake",37.1484,-119.5052,805,396,1300 ft,cch2,urn:uuid:d3218898-c4f5-4889-8eac-bc6632f8163b,http://cch2.org/portal/collections/individual/index.php?occid=3305663
3305784,UCJEPS,UC1069170,,Nemophila menziesii,205099,3/21/1935,1935,3,21,80,Mar 21 1935,Flowering/Fruiting,San Bernardino,"2 mi w Hesperia; Hesperia Quad., w of Hesperia",34.4173,-117.3205,805,1021,3350 ft,cch2,urn:uuid:aa03fc28-9da5-4d88-bbbf-7b24fd01d1ec,http://cch2.org/portal/collections/individual/index.php?occid=3305784
3306845,UCJEPS,UC1222905,,Nemophila menziesii,205099,4/20/1950,1950,4,20,110,Apr 20 1950,Flowering/Fruiting,Humboldt,1/2 mi w Dinsmore's; w of Dinsmore's,,,,,,cch2,urn:uuid:db6acca9-b631-4208-b477-7fad0a6769d2,http://cch2.org/portal/collections/individual/index.php?occid=3306845
3306958,UCJEPS,UC1239755,,Nemophila menziesii,205099,6/3/1923,1923,6,3,154,Jun 3 1923,Flowering/Fruiting,Humboldt,"near Dsn McBride Place (Kneeland Prairie); , near Dan McBride Place",,,,762,2500 ft,cch2,urn:uuid:6bfe993d-6874-4052-a46e-0f0c560fb037,http://cch2.org/portal/collections/individual/index.php?occid=3306958
3308872,UCJEPS,UC24240,,Nemophila menziesii,205099,1898-04-13,1898,4,13,103,Apr 13 1898,Flowering/Fruiting,Mendocino,Ukiah,39.144787,-123.2056,3238,,,cch2,urn:uuid:620792f7-121a-409c-9b1d-7dfab13b458f,http://cch2.org/portal/collections/individual/index.php?occid=3308872
3308895,UCJEPS,UC24248,,Nemophila menziesii,205099,1893-04-26,1893,4,26,116,Apr 26 1893,Flowering/Fruiting,Napa,"Yountville , Yountville (Napa River Basin)",,,,,,cch2,urn:uuid:251708a6-6117-47ee-b4a9-9b684fa13f98,http://cch2.org/portal/collections/individual/index.php?occid=3308895
3308943,UCJEPS,UC24231,,Nemophila menziesii,205099,1899-06-01,1899,6,1,152,"June-July, 1899",Flowering/Fruiting,Monterey,Pajaro Hills,,,,,,cch2,urn:uuid:3453fbd9-456f-44ba-868e-f14e9a86cc0c,http://cch2.org/portal/collections/individual/index.php?occid=3308943
3308950,UCJEPS,UC24203,,Nemophila menziesii,205099,1898-03-24,1898,3,24,83,Mar 24 1898,Flowering/Fruiting,Alameda,"below Little Grizzly (Wild Cat Canyon); South Coast Ranges, below Little Grizzly, Wild Cat Canyon",,,,,,cch2,urn:uuid:71c8dea7-06aa-4c55-900a-85cee146f351,http://cch2.org/portal/collections/individual/index.php?occid=3308950
3309511,UCJEPS,UC480616,,Nemophila menziesii,205099,3/4/1928,1928,3,4,64,Mar 4 1928,Flowering/Fruiting,Monterey,"near Watsonville (Aromas); near Watsonville, Aromas",36.88841,-121.63942,789,,,cch2,urn:uuid:7d6b10ce-aaf9-43ed-9e48-798772ecf74c,http://cch2.org/portal/collections/individual/index.php?occid=3309511
3310329,UCJEPS,UC596583,,Nemophila menziesii,205099,5/1/1908,1908,5,1,122,8-May,Flowering/Fruiting,Santa Clara,Mt. Day,37.421104,-121.69879,1622,,,cch2,urn:uuid:28bbb3fe-dd5f-4fb8-85cb-175e226ad386,http://cch2.org/portal/collections/individual/index.php?occid=3310329
3310480,UCJEPS,UC63943,,Nemophila menziesii,205099,4/26/1903,1903,4,26,116,Apr 26 1903,Flowering/Fruiting,Alameda,Berkeley Hills,37.88306,-122.2375,,,,cch2,urn:uuid:ab41896f-e5f7-4374-bc51-7ad3b763f52a,http://cch2.org/portal/collections/individual/index.php?occid=3310480
3311644,UCJEPS,UC880909,,Nemophila menziesii,205099,4/9/1937,1937,4,9,99,Apr 9 1937,Flowering/Fruiting,Riverside,Riverside-Hemet Road near Winchester turnoff; Riverside-Hemet Road,33.74,-117.0847,5000,,,cch2,urn:uuid:2e78666c-6f21-4f02-94e5-2d5db6c65488,http://cch2.org/portal/collections/individual/index.php?occid=3311644
3312937,UCJEPS,JEPS127095,,Nemophila menziesii var. menziesii,205103,4/19/2016,2016,4,19,110,19-Apr-16,Flowering/Fruiting,Contra Costa,"2.3 miles (air) southwest of Los Vaqueros Reservoir Dam, approximately 25 miles (air) southwest of Stockton. Undesignated section of Canada de Los Vaqueros Land Grant, Byron Hot Spring USGS 7.5' Quad.",37.807453,-121.746961,,160,525,cch2,urn:uuid:ed605e6a-495d-4916-b6de-577be8b21e71,http://cch2.org/portal/collections/individual/index.php?occid=3312937
3314766,UCJEPS,JEPS1912,,Nemophila menziesii,205099,5/23/1907,1907,5,23,143,May 23 1907,Flowering/Fruiting,Tulare,Limekiln Creek,36.704,-118.957,3219,,,cch2,urn:uuid:63629845-0c33-4bf5-952f-725d5795b649,http://cch2.org/portal/collections/individual/index.php?occid=3314766
3315444,UCJEPS,JEPS82018,,Nemophila menziesii,205099,3/15/1983,1983,3,15,74,Mar 15 1983,Flowering/Fruiting,Santa Cruz,"ca 17 mi nw Santa Cruz (nw-facing slope of Haybarn Gulch, H-H Ranch, btw CA 1 and Swanton Rd, se of Greyhound Rock, w and nw of Old Seaside School, Swanton); nw of Santa Cruz, H-H Ranch, Haybarn Gulch",37.083332,-122.25,,85,280 ft,cch2,urn:uuid:3af09bb0-61f7-4083-bd8e-8202b318a415,http://cch2.org/portal/collections/individual/index.php?occid=3315444
3315690,UCJEPS,JEPS1803,,Nemophila menziesii,205099,4/29/1941,1941,4,29,119,Apr 29 1941,Flowering/Fruiting,San Bernardino,"Willow Springs Canyon Mohave Desert, Old Dad Mountains, Willow Springs Canyon (Old Dad Mountains, Mohave Desert)",34.77,-115.683,393,1371,4500 ft,cch2,urn:uuid:c8090bbc-462a-428c-b8f4-bc6672cff872,http://cch2.org/portal/collections/individual/index.php?occid=3315690
3319081,UCJEPS,UC1239741,,Nemophila menziesii,205099,5/1/1938,1938,5,1,121,1-May-38,Flowering/Fruiting,Humboldt,Trinity River Valley at Willow Creek; Trinity River Valley at Willow Creek,,,,152,500 ft,cch2,urn:uuid:fb6b114a-bdaa-40fd-a5db-2814ffbcfecd,http://cch2.org/portal/collections/individual/index.php?occid=3319081
3320902,UCJEPS,UC24211,,Nemophila menziesii,205099,,,,,,,Flowering/Fruiting,Los Angeles,Sta. Susanna Mts.,,,,,,cch2,urn:uuid:2fb14ee5-977e-4129-ac6a-d82fc1923ccb,http://cch2.org/portal/collections/individual/index.php?occid=3320902
3320930,UCJEPS,UC24207,,Nemophila menziesii,205099,4/12/1902,1902,4,12,102,Apr 12 1902,Flowering/Fruiting,Alameda,"Berkeley Hills San Francisco Bay Region, Berkeley Hills",37.8931,-122.2717,2500,,,cch2,urn:uuid:748ddcac-db25-4871-add3-e6b0cc054750,http://cch2.org/portal/collections/individual/index.php?occid=3320930
3321052,UCJEPS,UC310899,,Nemophila menziesii,205099,3/20/1925,1925,3,20,79,Mar 20 1925,Flowering/Fruiting,Tulare,1 mi n Richgrove (open plain); n of Richgrove,35.809273,-119.10217,3634,,,cch2,urn:uuid:edb46b1b-f801-4704-b9cb-97dfffbb4b94,http://cch2.org/portal/collections/individual/index.php?occid=3321052
3321386,UCJEPS,UC455932,,Nemophila menziesii,205099,3/29/1910,1910,3,29,88,Mar 29 1910,Flowering/Fruiting,San Luis Obispo,Carisa Plains,35.144588,-119.740544,16993,,,cch2,urn:uuid:7e2c7c7a-aef3-4ce5-9c0d-8fdf78d4fc8c,http://cch2.org/portal/collections/individual/index.php?occid=3321386
3322177,UCJEPS,UC596582,,Nemophila menziesii,205099,4/1/1909,1909,4,1,91,Apr 1 1909,Flowering/Fruiting,Santa Clara,Milpitas,37.427773,-121.90488,3232,,,cch2,urn:uuid:0ddea190-5274-4ae8-940f-70f09031113e,http://cch2.org/portal/collections/individual/index.php?occid=3322177
3322212,UCJEPS,UC606956,,Nemophila menziesii,205099,3/31/1938,1938,3,31,90,Mar 31 1938,Flowering/Fruiting,Kern,"about 20 mi sw Bakersfields (near the Kern River, Ten Section Field); near the Kern River, sw of Bakersfield",,,,,,cch2,urn:uuid:ac2b05ca-756f-4f94-9e25-cb50bf9ea88d,http://cch2.org/portal/collections/individual/index.php?occid=3322212
3322685,UCJEPS,UC691704,,Nemophila menziesii,205099,3/8/1931,1931,3,8,67,Mar 8 1931,Flowering/Fruiting,Contra Costa,"Mitchell Canyon , Mitchell Canyon (Mount Diablo)",37.94111,-121.93472,,304,1000 ft,cch2,urn:uuid:4ef1cd11-efa1-499d-9c77-163803215c99,http://cch2.org/portal/collections/individual/index.php?occid=3322685
3327150,UCJEPS,JEPS3116,,Nemophila menziesii,205099,4/13/1919,1919,4,13,103,Apr 13 1919,Flowering/Fruiting,Napa,near Atlas; near Atlas,,,,,,cch2,urn:uuid:ba1c4d81-9e45-4e4c-a34d-a91dbfafaaa7,http://cch2.org/portal/collections/individual/index.php?occid=3327150
3328709,UCJEPS,JEPS21152,,Nemophila menziesii var. integrifolia,205102,4/27/1935,1935,4,27,117,Apr 27 1935,Flowering/Fruiting,San Bernardino,"3 1/2 mi n of nw corner Lake Arrowhead; San Bernardino National Forest, Deep Creek Quad.",34.316,-117.1982,805,1386,4550 ft,cch2,urn:uuid:bb3f7e11-430f-4299-a5b0-6308b6b63162,http://cch2.org/portal/collections/individual/index.php?occid=3328709
3329236,UCJEPS,JEPS81922,,Nemophila menziesii,205099,4/10/1983,1983,4,10,100,Apr 10 1983,Flowering/Fruiting,Santa Cruz,"ca 17 mi nw Santa Cruz (central Buckeye Grove Gulch, H-H Ranch: located between California 1 and Swanton Rd, se of Greyhound Rock, w and nw of Old Seaside School, Swanton); nw of Santa Cruz, H-H Ranch, Buckeye Grove Gulch",37.083332,-122.25,,76,250 ft,cch2,urn:uuid:3acf2b5c-0faf-466d-8602-714104c67b48,http://cch2.org/portal/collections/individual/index.php?occid=3329236
3329817,UCJEPS,UC1031220,,Nemophila menziesii,205099,4/8/1954,1954,4,8,98,Apr 8 1954,Flowering/Fruiting,Napa,Highway 128 two mi s of e Monticello; s of e of Monticello,,,,,,cch2,urn:uuid:04b49bff-2547-4f42-b947-b95099518cc5,http://cch2.org/portal/collections/individual/index.php?occid=3329817
3330026,UCJEPS,UC1069187,,Nemophila menziesii,205099,3/27/1936,1936,3,27,87,Mar 27 1936,Flowering/Fruiting,San Luis Obispo,"4.3 mi ne Black Butte; San Luis Obispo Quad., ne of Black Butte",35.351067,-120.547444,2200,342,1125 ft,cch2,urn:uuid:31f668c0-cb4e-4be4-9378-0cff8850836a,http://cch2.org/portal/collections/individual/index.php?occid=3330026
3333056,UCJEPS,UC24243,,Nemophila menziesii,205099,5/1/1902,1902,5,1,121,"May, 1902",Flowering/Fruiting,Los Angeles,Elizabeth Lake,34.66583,-118.40167,,,,cch2,urn:uuid:5e2a7edc-c82d-4dac-ba85-62658458cf5f,http://cch2.org/portal/collections/individual/index.php?occid=3333056
3333057,UCJEPS,UC24265,,Nemophila menziesii,205099,5/1/1902,1902,5,1,121,"May, 1902",Flowering/Fruiting,Los Angeles,Elizabeth Lake,34.66583,-118.40167,,,,cch2,urn:uuid:bae7bad4-a602-4901-9180-8fa9b33bda34,http://cch2.org/portal/collections/individual/index.php?occid=3333057
3333803,UCJEPS,UC501545,,Nemophila menziesii,205099,3/31/1929,1929,3,31,90,Mar 31 1929,Flowering/Fruiting,San Diego,"e Julian (Foster Grade, just below Banner); Foster Grade, e of Julian, just below Banner",33.0828,-116.572,2575,,,cch2,urn:uuid:d5735f85-f26b-4971-915b-5f420389dc9a,http://cch2.org/portal/collections/individual/index.php?occid=3333803
3334007,UCJEPS,UC55254,,Nemophila menziesii,205099,2/25/1900,1900,2,25,56,Feb 25 1900,Flowering/Fruiting,Sacramento,2 mi se Sacramento; se of Sacramento,38.45,-121.47,5230,,,cch2,urn:uuid:9cc36371-6c00-4346-921f-f99421bef05c,http://cch2.org/portal/collections/individual/index.php?occid=3334007
3334198,UCJEPS,UC56876,,Nemophila menziesii,205099,4/30/1902,1902,4,30,120,Apr 30 1902,Flowering/Fruiting,Los Angeles,North Pomona,34.09,-117.74944,,,,cch2,urn:uuid:397a45bf-0925-4dee-826b-8ba0928fe8ad,http://cch2.org/portal/collections/individual/index.php?occid=3334198
3334199,UCJEPS,UC566277,,Nemophila menziesii,205099,3/26/1932,1932,3,26,86,Mar 26 1932,Flowering/Fruiting,San Luis Obispo,"2 mi e San Miguel; San Miguel Quad., e of San Miguel",35.7554,-120.6662,4828,243,800 ft,cch2,urn:uuid:3a83fd83-2ac7-4cb8-a2af-51f98779f56e,http://cch2.org/portal/collections/individual/index.php?occid=3334199
3334771,UCJEPS,UC663110,,Nemophila menziesii,205099,4/5/1938,1938,4,5,95,Apr 5 1938,Flowering/Fruiting,Lake,along the ne side Clear Lake ne side of Clearlake (Clear Lake),38.971554,-122.610886,1622,,,cch2,urn:uuid:c7b53fb9-07dc-46ad-a5e3-d6790fe0d997,http://cch2.org/portal/collections/individual/index.php?occid=3334771
3334917,UCJEPS,UC67148,,Nemophila menziesii,205099,4/5/1901,1901,4,5,95,Apr 5 1901,Flowering/Fruiting,Contra Costa,Mt. Diablo,37.88178,-121.91309,5414,,,cch2,urn:uuid:bb193c7e-52b3-459d-b298-82232a6e0d75,http://cch2.org/portal/collections/individual/index.php?occid=3334917
3335234,UCJEPS,UC747507,,Nemophila menziesii,205099,5/2/1943,1943,5,2,122,May 2 1943,Flowering/Fruiting,El Dorado,"ca 3 mi e Camino (along North Fork Webber Creek); North Fork Webber Creek, e of Camino",38.74626,-120.622345,1783,914,3000 ft,cch2,urn:uuid:9f730255-5c84-4cab-b164-5677242700de,http://cch2.org/portal/collections/individual/index.php?occid=3335234
3335295,UCJEPS,UC73660,,Nemophila menziesii,205099,4/3/1906,1906,4,3,93,Apr 3 1906,Flowering/Fruiting,Kern,w slope Mt. Hamilton w slope of Mt. Hamilton,,,,,,cch2,urn:uuid:444eee1a-a561-489a-b158-83b5bc0b9f72,http://cch2.org/portal/collections/individual/index.php?occid=3335295
3340493,UCJEPS,JEPS110845,,Nemophila menziesii var. menziesii,205103,4/16/1994,1994,4,16,106,16-Apr-94,,Napa,North end of Chiles Valley near Chiles- Pope Valley Road.,38.5824,-122.4002,805,228,750 ft,cch2,urn:uuid:04292186-37d4-43fa-9039-1f32843afc84,http://cch2.org/portal/collections/individual/index.php?occid=3340493
3340573,UCJEPS,JEPS110844,,Nemophila menziesii var. menziesii,205103,3/23/1996,1996,3,23,83,23-Mar-96,,Napa,".3 mile from Pope Canyon Road on Hardin Road, near airstrip.",38.6113,-122.3819,805,184,605 ft,cch2,urn:uuid:0c4fa95f-6a80-408c-b596-1b36ae4e15ba,http://cch2.org/portal/collections/individual/index.php?occid=3340573
3340619,UCJEPS,JEPS1893,,Nemophila menziesii var. integrifolia,205102,4/1/1908,1908,4,1,92,"April, 1908",Flowering/Fruiting,Orange,Santa Ana Mountains,33.74,-117.53,16093,,,cch2,urn:uuid:24106b48-3a8e-4f40-be5f-3ee7ea397a3d,http://cch2.org/portal/collections/individual/index.php?occid=3340619
3343332,UCJEPS,UC1239736,,Nemophila menziesii,205099,5/26/1935,1935,5,26,146,May 26 1935,Flowering/Fruiting,Humboldt,"Lone Star Creek , Lone Star Creek (Iaqua Region)",,,,609,2000 ft,cch2,urn:uuid:2bc4f279-138a-4131-a4a3-86c01769fa36,http://cch2.org/portal/collections/individual/index.php?occid=3343332
3343355,UCJEPS,UC1239742,,Nemophila menziesii,205099,3/28/1949,1949,3,28,87,Mar 28 1949,Flowering/Fruiting,Mendocino,halfway between Ukiah and Hopland; between Ukiah and Hopland,39.051235,-123.15399,9830,182,600 ft,cch2,urn:uuid:8d0d95e3-f261-488c-b0e0-8a90d34bcfd1,http://cch2.org/portal/collections/individual/index.php?occid=3343355
3345264,UCJEPS,UC24237,,Nemophila menziesii,205099,1896-04-04,1896,4,4,95,Apr 4 1896,Flowering/Fruiting,San Francisco,Lake Merced,37.7198,-122.49132,2456,,,cch2,urn:uuid:326f56f6-75db-4b8a-9b9c-2b184a6c7e76,http://cch2.org/portal/collections/individual/index.php?occid=3345264
3346340,UCJEPS,UC545857,,Nemophila menziesii,205099,3/15/1936,1936,3,15,75,Mar 15 1936,Flowering/Fruiting,Napa,Chiles Valley Road 3.2 mi from Pope Valley Store; Chiles Valley Road <nr> Pope Valley Store,38.5885,-122.40074,750,,,cch2,urn:uuid:04744685-0642-427f-9260-36c44abc4f9b,http://cch2.org/portal/collections/individual/index.php?occid=3346340
3346967,UCJEPS,UC660028,,Nemophila menziesii,205099,2/26/1925,1925,2,26,57,Feb 26 1925,Flowering/Fruiting,Monterey,near Monterey; near Monterey,,,,,,cch2,urn:uuid:8bf7aeae-5330-4cbe-8d5c-8bfcc741143b,http://cch2.org/portal/collections/individual/index.php?occid=3346967
3347073,UCJEPS,UC67156,,Nemophila menziesii,205099,2/1/1903,1903,2,1,32,Feb. 1903,Flowering/Fruiting,Los Angeles,Griffith Park,34.134533,-118.30477,3384,,,cch2,urn:uuid:b8ac8b82-2209-403e-b551-c3e28266c7a9,http://cch2.org/portal/collections/individual/index.php?occid=3347073
3348015,UCJEPS,UC880915,,Nemophila menziesii,205099,4/9/1913,1913,4,9,99,Apr 9 1913,Flowering/Fruiting,San Diego,Warner's Hot Springs,33.2842,-116.63113,2414,,,cch2,urn:uuid:fe836532-b7db-4f25-8003-3543c205c830,http://cch2.org/portal/collections/individual/index.php?occid=3348015
3351224,UCJEPS,JEPS2990,,Nemophila menziesii,205099,3/1/1908,1908,3,1,61,"March, 1908",Flowering/Fruiting,Orange,Anaheim Plains,,,,,,cch2,urn:uuid:0f1a9cdf-3d92-44b8-be84-7c44a060e432,http://cch2.org/portal/collections/individual/index.php?occid=3351224
3351280,UCJEPS,JEPS1480,,Nemophila menziesii,205099,2/29/1940,1940,2,29,60,Feb 29 1940,Flowering/Fruiting,Napa,"Yount School Vicin San Francisco Bay, e side Napa Valley, Yount School (e side Napa Valley, vicinity of San Francisco Bay)",,,,,,cch2,urn:uuid:e42fec7a-8522-43a3-9215-3baeca0f4ff4,http://cch2.org/portal/collections/individual/index.php?occid=3351280
3352023,UCJEPS,JEPS1518,,Nemophila menziesii var. integrifolia,205102,5/4/1928,1928,5,4,125,May 4 1928,Flowering/Fruiting,Los Angeles,"Monrovia Canyon , Monrovia Canyon (San Gabriel Mts.)",,,,,,cch2,urn:uuid:fe24c8f5-45e9-4136-ad18-20456ddcb1f4,http://cch2.org/portal/collections/individual/index.php?occid=3352023
3352293,UCJEPS,JEPS3118,,Nemophila menziesii,205099,1892-04-16,1892,4,16,107,Apr 16 1892,Flowering/Fruiting,Nevada,Penn Valley,39.20333,-121.18417,,,,cch2,urn:uuid:55473719-a1e2-4444-94f8-1aac24d3c36c,http://cch2.org/portal/collections/individual/index.php?occid=3352293
3352374,UCJEPS,JEPS1494,,Nemophila menziesii,205099,4/8/1938,1938,4,8,98,Apr 8 1938,Flowering/Fruiting,Santa Clara,"above Guadalupe Creek (opposite Guadalupe Mine, near New Almaden, e foothills of the Santa Cruz Mountains); e foothills Santa Cruz Mountains, above Guadalupe Creek",,,,152,500 ft,cch2,urn:uuid:1209e652-bde2-4b78-ab97-7199e2925bc4,http://cch2.org/portal/collections/individual/index.php?occid=3352374
3352511,UCJEPS,JEPS1892,,Nemophila menziesii var. integrifolia,205102,1888-05-29,1888,5,29,150,May 29 1888,Flowering/Fruiting,San Bernardino,,,,,,,cch2,urn:uuid:1644437f-9737-4563-82f9-e88419366b53,http://cch2.org/portal/collections/individual/index.php?occid=3352511
3353368,UCJEPS,JEPS76985,,Nemophila menziesii,205099,3/10/1963,1963,3,10,69,Mar 10 1963,Flowering/Fruiting,Marin,Pt. Reyes,,,,,,cch2,urn:uuid:9541a7fa-190a-406c-b06a-680f3f4d1643,http://cch2.org/portal/collections/individual/index.php?occid=3353368
3353470,UCJEPS,JEPS107354,,Nemophila menziesii var. menziesii,205103,3/17/2005,2005,3,17,76,03 17 2005,,Butte,"Big Chico Creek Ecological Reserve. On the east side of Chico Canyon Road, about 1 mile (air) west of Highway 32, about 7 miles (air) northeast of Chico",39.833054,-121.7175,,236,775 ft,cch2,urn:uuid:eb565501-d46e-4e5f-8a84-2c73665d0557,http://cch2.org/portal/collections/individual/index.php?occid=3353470
3353552,UCJEPS,JEPS1888,,Nemophila menziesii var. integrifolia,205102,4/1/1927,1927,4,1,91,"Apr., 1927",Flowering/Fruiting,San Diego,Escondido,33.12177,-117.06739,4828,,,cch2,urn:uuid:ab5fe39d-eed7-4b23-921f-c14f90a8fd19,http://cch2.org/portal/collections/individual/index.php?occid=3353552
3354212,UCJEPS,UC1019584,,Nemophila menziesii,205099,3/19/1926,1926,3,19,78,Mar 19 1926,Flowering/Fruiting,San Diego,near gate to entrance San Felipe Ranch (between Julian and Colorado Desert); between Julian and Colorado Desert,33.1125,-116.523,1609,,,cch2,urn:uuid:1fb4351b-5de9-4f57-97b1-597b81751e71,http://cch2.org/portal/collections/individual/index.php?occid=3354212
3354366,UCJEPS,UC1057439,,Nemophila menziesii,205099,3/26/1937,1937,3,26,85,Mar 26 1937,Flowering/Fruiting,Sonoma,along the Guernville Highway near Village; near Village,,,,,,cch2,urn:uuid:27d4a527-cd16-490c-a59e-0fd34b807ba5,http://cch2.org/portal/collections/individual/index.php?occid=3354366
3354437,UCJEPS,UC107233,,Nemophila menziesii,205099,1895-04-16,1895,4,16,106,Apr 16 1895,Flowering/Fruiting,San Diego,San Felipe,33.1992,-116.5986,1609,,,cch2,urn:uuid:46253c54-71a4-4c3d-9995-d44bf754d88f,http://cch2.org/portal/collections/individual/index.php?occid=3354437
3357432,UCJEPS,UC24236,,Nemophila menziesii,205099,1899-04-08,1899,4,8,98,Apr 8 1899,Flowering/Fruiting,Marin,n slope Mt. Tamalpais,37.9273,-122.59169,2910,,,cch2,urn:uuid:1d23d076-1eae-4f9d-912c-99a949c2ba6b,http://cch2.org/portal/collections/individual/index.php?occid=3357432
3357574,UCJEPS,UC303377,,Nemophila menziesii,205099,1882-03-17,1882,3,17,76,Mar 17 1882,Flowering/Fruiting,San Diego,San Diego,32.73409,-117.12945,9654,,,cch2,urn:uuid:16c41e34-0453-4239-b58f-1478cd97bdf0,http://cch2.org/portal/collections/individual/index.php?occid=3357574
3358816,UCJEPS,UC606953,,Nemophila menziesii,205099,5/7/1938,1938,5,7,127,May 7 1938,Flowering/Fruiting,Kern,6 mi n Caliente; n of Caliente,35.331085,-118.58599,3232,,,cch2,urn:uuid:e3151036-c7e3-4738-b42e-13db8db91f44,http://cch2.org/portal/collections/individual/index.php?occid=3358816
3360303,UCJEPS,UC916528,,Nemophila menziesii,205099,6/3/1948,1948,6,3,155,Jun 3 1948,Flowering/Fruiting,Monterey,"n slope of Watertank Hill Hastings Reservation (Hastings Reservation, Jamesburg Quadrangle); Jamesburg Quadrangle, , Watertank Hill",,,,,,cch2,urn:uuid:c01859f8-a8de-4288-b7ab-71992830d584,http://cch2.org/portal/collections/individual/index.php?occid=3360303
3363476,UCJEPS,JEPS110846,,Nemophila menziesii var. menziesii,205103,4/18/1998,1998,4,18,108,18-Apr-98,,Napa,"Pope Valley, N of intersection of Pope Canyon Rd X Hardin Rd",38.6113,-122.4002,805,182,600 ft,cch2,urn:uuid:bd2babbf-13e7-4b2a-b089-e1cf54b15d16,http://cch2.org/portal/collections/individual/index.php?occid=3363476
3365543,UCJEPS,JEPS3127,,Nemophila menziesii,205099,5/1/1920,1920,5,1,122,"May, 1920",Flowering/Fruiting,Monterey,"San Jose Canyon , San Jose Canyon (n end Santa Lucia Mts.)",,,,,,cch2,urn:uuid:7f939135-9b81-4d4e-868b-2db61232147e,http://cch2.org/portal/collections/individual/index.php?occid=3365543
3366075,UCJEPS,JEPS1887,,Nemophila menziesii var. atomaria,205101,4/24/1938,1938,4,24,114,Apr 24 1938,Flowering/Fruiting,Sonoma,mouth of small canyon 0.5 mi s Fort Ross; s of Fort Ross,38.51387,-123.23447,1695,91,300 ft,cch2,urn:uuid:372f1904-00d8-4a2c-bf20-e06c642b0611,http://cch2.org/portal/collections/individual/index.php?occid=3366075
3367801,UCJEPS,UC126911,,Nemophila menziesii,205099,4/27/1906,1906,4,27,117,Apr 27 1906,Flowering/Fruiting,San Bernardino,Cajon Pass,34.3252,-117.4287,1138,1250,1250 m,cch2,urn:uuid:defb8b34-972e-46dd-b4d5-2cf8216ceec0,http://cch2.org/portal/collections/individual/index.php?occid=3367801
3367836,UCJEPS,UC1299130,,Nemophila menziesii,205099,3/31/1947,1947,3,31,90,Mar 31 1947,Flowering/Fruiting,Sonoma,"Chimney Rock near Monte Rio; near Monte Rio, Chimney Rock",38.502407,-123.05071,3616,,,cch2,urn:uuid:993e9efb-3084-42cc-a4b4-46627ff24a77,http://cch2.org/portal/collections/individual/index.php?occid=3367836
3368570,UCJEPS,UC1561952,,Nemophila menziesii,205099,4/10/1987,1987,4,10,100,Apr 10 1987,Flowering/Fruiting,Monterey,ca 15 airmi se King City (crest of Pine Valley Rd ca 1 mi s of jct Hwy 198); se of King City,,,,,,cch2,urn:uuid:f96ccd9f-73fb-4d42-b3bb-d184b82788a9,http://cch2.org/portal/collections/individual/index.php?occid=3368570
3369802,UCJEPS,UC366857,,Nemophila menziesii,205099,1876-04-01,1876,4,1,92,"April, 1876",Flowering/Fruiting,,Crafton to Reading (in fields); Crafton to Reading,,,,,,cch2,urn:uuid:67fbbf86-8891-4cb7-bcf0-5fe0d618b256,http://cch2.org/portal/collections/individual/index.php?occid=3369802
3370850,UCJEPS,UC592140,,Nemophila menziesii,205099,4/12/1935,1935,4,12,102,Apr 12 1935,Flowering/Fruiting,San Bernardino,Mohave Desert,34.84988,-116.41113,108447,,,cch2,urn:uuid:7fa02939-37a4-47b8-ad54-b40b8e2ec451,http://cch2.org/portal/collections/individual/index.php?occid=3370850
3372248,UCJEPS,UC880913,,Nemophila menziesii,205099,4/1/1911,1911,4,1,91,Spring 1911,Flowering/Fruiting,San Diego,Warners Springs,33.2817,-116.6336,3698,,,cch2,urn:uuid:77330722-f891-498e-801d-299873cd27fe,http://cch2.org/portal/collections/individual/index.php?occid=3372248
3376120,UCJEPS,JEPS82019,,Nemophila menziesii,205099,3/15/1983,1983,3,15,74,Mar 15 1983,Flowering/Fruiting,Santa Cruz,"ca 17 mi nw Santa Cruz (nw-facing slope of Haybarn Gulch, H-H Ranch, btw CA 1 and Swanton Rd, se of Greyhound Rock, w and nw of Old Seaside School, Swanton); nw of Santa Cruz, H-H Ranch, Haybarn Gulch",37.083332,-122.25,,85,280 ft,cch2,urn:uuid:43bd8c17-f417-4e5d-8587-cac523512782,http://cch2.org/portal/collections/individual/index.php?occid=3376120
3376340,UCJEPS,JEPS1491,,Nemophila menziesii,205099,4/17/1938,1938,4,17,107,Apr 17 1938,Flowering/Fruiting,Mariposa,"13 mi w Mormon Bar (near Mariposa Creek, Sierra Nevada foothills); Sierra Nevada foothills, nr Mariposa Creek, w of Mormon Bar",,,,457,1500 ft,cch2,urn:uuid:2c07264f-186e-4193-a297-5b083347f29a,http://cch2.org/portal/collections/individual/index.php?occid=3376340
3376953,UCJEPS,JEPS3965,,Nemophila menziesii,205099,,,,,,,Flowering/Fruiting,El Dorado,"near Pilot Hill (Hastings Creek); , near Pilot Hill",38.828278,-120.9689,2107,,,cch2,urn:uuid:14d5f74d-0ae4-4be0-b4af-7c37c185b34b,http://cch2.org/portal/collections/individual/index.php?occid=3376953
3378713,UCJEPS,UC1069194,,Nemophila menziesii,205099,3/12/1934,1934,3,12,71,Mar 12 1934,Flowering/Fruiting,Alameda,"1/2 mi n extreme e end Lake Chabot; Hayward, n of extreme e end Lake Chabot",37.736881,-122.09288,1200,137,450 ft,cch2,urn:uuid:f2f848f1-11ac-4a7e-a405-1e20523311c7,http://cch2.org/portal/collections/individual/index.php?occid=3378713
3378893,UCJEPS,UC1116246,,Nemophila menziesii,205099,5/31/1948,1948,5,31,152,May 31 1948,Flowering/Fruiting,Humboldt,Harris,40.0844,-123.6593,500,609,2000 ft,cch2,urn:uuid:116dfc1e-d04a-4c7b-b4cf-d24849843cd3,http://cch2.org/portal/collections/individual/index.php?occid=3378893
3379903,UCJEPS,UC126912,,Nemophila menziesii,205099,4/27/1906,1906,4,27,117,Apr 27 1906,Flowering/Fruiting,San Bernardino,Cajon Pass,34.3252,-117.4287,1138,1250,1250 m,cch2,urn:uuid:db9c7f5d-cc3a-4055-93df-1085101ab0cc,http://cch2.org/portal/collections/individual/index.php?occid=3379903
3381826,UCJEPS,UC24210,,Nemophila menziesii,205099,1861-04-09,1861,4,9,99,Apr 9 1861,Flowering/Fruiting,Santa Barbara,in valley below Foxin's Ranch below Foxin's Ranch,,,,,,cch2,urn:uuid:dd3f849e-0820-4d80-b82c-daade83381c1,http://cch2.org/portal/collections/individual/index.php?occid=3381826
3382759,UCJEPS,UC54858,,Nemophila menziesii,205099,1882-04-01,1882,4,1,91,"Apr.-May, 1882",Flowering/Fruiting,San Luis Obispo,Morro Bay,35.34247,-120.83321,6437,,,cch2,urn:uuid:7b13446f-81c5-4d03-97ff-62db9546ab41,http://cch2.org/portal/collections/individual/index.php?occid=3382759
3383101,UCJEPS,UC606957,,Nemophila menziesii,205099,3/30/1938,1938,3,30,89,Mar 30 1938,Flowering/Fruiting,Kern,7 mi above mouth Kern River Canyon (s side of Kern River Canyon),,,,,,cch2,urn:uuid:01813cc9-9027-4b9e-9e37-3e672f9ea82d,http://cch2.org/portal/collections/individual/index.php?occid=3383101
3384637,UCJEPS,UC914286,,Nemophila menziesii,205099,4/6/1947,1947,4,6,96,Apr 6 1947,Flowering/Fruiting,Marin,"12 mi from Inverness (Point Reyes Peninsula); , 12 mi from Inverness",38.02368,-122.98726,5668,,,cch2,urn:uuid:9235568d-e6d2-4b8d-a5a0-d3d5b616651a,http://cch2.org/portal/collections/individual/index.php?occid=3384637
3388844,UCJEPS,JEPS1804,,Nemophila menziesii var. integrifolia,205102,4/16/1919,1919,4,16,106,Apr 16 1919,Flowering/Fruiting,San Bernardino,"Cajon Pass , Cajon Pass (San Gabriel Mountains)",,,,685,2250 ft,cch2,urn:uuid:9fce8928-7afd-482b-85a1-66d2d4d01b4e,http://cch2.org/portal/collections/individual/index.php?occid=3388844
3389525,UCJEPS,JEPS1911,,Nemophila menziesii,205099,3/20/1901,1901,3,20,79,Mar 20 1901,Flowering/Fruiting,Solano,Vacaville,,,,,,cch2,urn:uuid:aca3cab8-36fd-405c-9ec7-8b08ea783861,http://cch2.org/portal/collections/individual/index.php?occid=3389525
3390932,UCJEPS,UC1069169,,Nemophila menziesii,205099,2/1/1938,1938,2,1,32,Feb 1 1938,Flowering/Fruiting,Santa Clara,"1.4 mi n Mt. Sizer; Morgan Hill Quad., n of Mt. Sizer",37.2384,-121.5034,805,822,2700 ft,cch2,urn:uuid:e6ce3dc3-3698-400e-9f91-12f2b2419db7,http://cch2.org/portal/collections/individual/index.php?occid=3390932
3392075,UCJEPS,UC1242705,,Nemophila menziesii,205099,3/16/1962,1962,3,16,75,Mar 16 1962,Flowering/Fruiting,Riverside,"8 mi se Corona (Temescal Canyon); se of Corona, Temescal Canyon",33.76088,-117.48075,894,,,cch2,urn:uuid:93ac9df8-a043-4d5c-af03-329f33902f42,http://cch2.org/portal/collections/individual/index.php?occid=3392075
3392774,UCJEPS,UC1537400,,Nemophila menziesii,205099,3/1/1935,1935,3,1,60,1-Mar-35,Flowering/Fruiting,Riverside,Box Springs,33.9456,-117.2921,2000,365,1200 ft,cch2,urn:uuid:89b4857f-f55c-46bf-bf9f-ee846df549f3,http://cch2.org/portal/collections/individual/index.php?occid=3392774
3394071,UCJEPS,UC24223,,Nemophila menziesii,205099,1897-03-20,1897,3,20,79,Mar 20 1897,Flowering/Fruiting,Riverside,Temescal Mine,33.7866,-117.4363,7400,,,cch2,urn:uuid:a6d8c3d8-e788-44dd-a29f-e3c15351046e,http://cch2.org/portal/collections/individual/index.php?occid=3394071
3394094,UCJEPS,UC24239,,Nemophila menziesii,205099,1899-05-26,1899,5,26,146,May 26 1899,Flowering/Fruiting,Mendocino,"3 mi s Willits (near the schoolhouse); North Coast Ranges, s of Willits",39.37227,-123.32038,3772,,,cch2,urn:uuid:7c7c09b8-4a81-48ec-90ec-8f0ea14d92c4,http://cch2.org/portal/collections/individual/index.php?occid=3394094
3395284,UCJEPS,UC571712,,Nemophila menziesii,205099,3/30/1934,1934,3,30,89,Mar 30 1934,Flowering/Fruiting,Santa Clara,"Bonito Creek near Kincaid Road (Mount Hamilton Range); , Bonito Creek",37.38329,-121.69044,14497,731,2400 ft,cch2,urn:uuid:934b8258-c710-4ad5-a001-900f4463dd36,http://cch2.org/portal/collections/individual/index.php?occid=3395284
3396794,UCJEPS,UC880865,,Nemophila menziesii var. atomaria,205101,4/23/1939,1939,4,23,113,Apr 23 1939,Flowering/Fruiting,Marin,Nicasio,38.061745,-122.69831,818,45,150 ft,cch2,urn:uuid:152d92a6-e12e-414d-8c08-2501543efabf,http://cch2.org/portal/collections/individual/index.php?occid=3396794
3402660,UCJEPS,JEPS77207,,Nemophila menziesii var. atomaria,205101,4/24/1963,1963,4,24,114,Apr 24 1963,Flowering/Fruiting,Marin,on Bolinas Road 5 mi s Fairfax,37.961857,-122.62954,4188,274,900 ft,cch2,urn:uuid:b5cdbe9f-ea60-4cf7-8c2f-d331eb20a509,http://cch2.org/portal/collections/individual/index.php?occid=3402660
3404359,UCJEPS,UC1239737,,Nemophila menziesii,205099,6/13/1938,1938,6,13,164,Jun 13 1938,Flowering/Fruiting,Humboldt,"at Cold Springs , at Cold Springs (Grouse Mountain)",,,,1432,4700 ft,cch2,urn:uuid:3d9e42b1-0dd0-45a9-a9f1-0d3e96da9864,http://cch2.org/portal/collections/individual/index.php?occid=3404359
3405578,UCJEPS,UC173615,,Nemophila menziesii,205099,1886-01-01,1886,1,1,1,1886,Flowering/Fruiting,Monterey,,32.6,-117.5,,,,cch2,urn:uuid:5a54dc82-8e49-4624-8a77-c0fddb0c8c45,http://cch2.org/portal/collections/individual/index.php?occid=3405578
3406227,UCJEPS,UC24229,,Nemophila menziesii,205099,1879-01-01,1879,1,1,1,1879,Flowering/Fruiting,El Dorado,Rose Springs,38.715,-120.939,8047,,,cch2,urn:uuid:a30f5f07-3fa6-4121-894b-5c382c9d4b86,http://cch2.org/portal/collections/individual/index.php?occid=3406227
3406288,UCJEPS,UC24241,,Nemophila menziesii,205099,1894-03-31,1894,3,31,90,Mar 31 1894,Flowering/Fruiting,Marin,Olema,38.040913,-122.78589,1622,,,cch2,urn:uuid:b6cb75a2-19f9-4503-ac11-b328daf5d80f,http://cch2.org/portal/collections/individual/index.php?occid=3406288
3406299,UCJEPS,UC24218,,Nemophila menziesii,205099,1800-01-01,1800,1,1,1,1800s,Flowering/Fruiting,,,,,,,,cch2,urn:uuid:64b920e0-fc08-4537-8d92-c97bcf3f6dba,http://cch2.org/portal/collections/individual/index.php?occid=3406299
3407643,UCJEPS,UC596584,,Nemophila menziesii,205099,4/2/1907,1907,4,2,92,Apr 2 1907,Flowering/Fruiting,Santa Clara,hills w Los Gatos (West Central California); w of Los Gatos,37.2202,-122.0344,3500,274,900 ft,cch2,urn:uuid:efa7994f-1342-4b2b-aa10-3669d79db551,http://cch2.org/portal/collections/individual/index.php?occid=3407643
3407644,UCJEPS,UC606955,,Nemophila menziesii,205099,3/31/1938,1938,3,31,90,Mar 31 1938,Flowering/Fruiting,Kern,"two mi w Famosa (Kimberlina Field, s of road to Wasco); w of Famosa, Kimberlina Field",35.558296,-119.233215,6128,,,cch2,urn:uuid:f72882f6-6e49-4af4-8699-6bee5321ad91,http://cch2.org/portal/collections/individual/index.php?occid=3407644
3408935,UCJEPS,UC880917,,Nemophila menziesii,205099,4/1/1915,1915,4,1,91,1-Apr-15,Flowering/Fruiting,Monterey,"Mansfield's Ranch , Mansfield's Ranch (King City)",36.1147,-121.1145,5000,,,cch2,urn:uuid:0c3cafe2-3849-45d8-9de1-172c7d877350,http://cch2.org/portal/collections/individual/index.php?occid=3408935
3413925,UCJEPS,JEPS1486,,Nemophila menziesii,205099,1884-03-20,1884,3,20,80,Mar 20 1884,Flowering/Fruiting,Solano,"e Rocky Peak (Vacaville); e of Rocky Peak, Vacaville",,,,,,cch2,urn:uuid:0238b9b4-61c4-4268-8cd5-3fe82d648989,http://cch2.org/portal/collections/individual/index.php?occid=3413925
3415469,UCJEPS,UC1069192,,Nemophila menziesii,205099,4/30/1936,1936,4,30,121,Apr 30 1936,Flowering/Fruiting,Santa Cruz,"2 1/2 mi w Bonnie Doon; Santa Cruz Quad., w of Bonnie Doon",37.060026,-122.194944,2125,121,400 ft,cch2,urn:uuid:881c914c-38b0-471c-9ac8-fc0ebb1a28f5,http://cch2.org/portal/collections/individual/index.php?occid=3415469
3415506,UCJEPS,UC1069196,,Nemophila menziesii,205099,4/6/1938,1938,4,6,96,Apr 6 1938,Flowering/Fruiting,Santa Clara,"4 8/10 mi ene Rucker; Morgan Hill Quad., ene of Rucker",37.0763,-121.5182,805,289,950 ft,cch2,urn:uuid:5c309056-20eb-4511-855e-7b82d3b51249,http://cch2.org/portal/collections/individual/index.php?occid=3415506
3416576,UCJEPS,UC1228850,,Nemophila menziesii,205099,3/24/1962,1962,3,24,83,Mar 24 1962,Flowering/Fruiting,San Luis Obispo,on road to Shandon 6.8 mi e Templeton; e of Templeton,,,,304,1000 ft,cch2,urn:uuid:4a509874-8d69-42ca-bd73-ca7bacbdc932,http://cch2.org/portal/collections/individual/index.php?occid=3416576
3419340,UCJEPS,UC524068,,Nemophila menziesii,205099,3/21/1932,1932,3,21,81,Mar 21 1932,Flowering/Fruiting,San Luis Obispo,hillsides between Bitterwater Valley and Carisa Plains; between Bitterwater Valley and Carisa Plians,,,,,,cch2,urn:uuid:94cbe965-851c-4716-a48c-c8a4f13396eb,http://cch2.org/portal/collections/individual/index.php?occid=3419340
3419459,UCJEPS,UC545381,,Nemophila menziesii,205099,4/1/1926,1926,4,1,91,"April, 1926",Flowering/Fruiting,Alameda,Berkeley Hills,37.88306,-122.2375,,,,cch2,urn:uuid:f4a4e877-89c9-49a6-89b7-2e0341fab62b,http://cch2.org/portal/collections/individual/index.php?occid=3419459
3419800,UCJEPS,UC606912,,Nemophila menziesii,205099,5/1/1938,1938,5,1,121,May 1 1938,Flowering/Fruiting,Tehama,"low hills at Paskenta (Inner North Coast Ranges); , Paskenta",39.8468,-122.5944,1350,304,1000 ft,cch2,urn:uuid:f2736de6-43bd-41db-8f49-a80eb7d37f74,http://cch2.org/portal/collections/individual/index.php?occid=3419800
3419933,UCJEPS,UC618397,,Nemophila menziesii,205099,5/3/1937,1937,5,3,123,May 3 1937,Flowering/Fruiting,San Benito,"se Panoche (Griswold Creek); se of Panoche, Griswold Creek",36.583206,-120.80852,415,,,cch2,urn:uuid:50d8cca3-dd29-4c08-a5cd-f34a9b3b4ebf,http://cch2.org/portal/collections/individual/index.php?occid=3419933
3424402,UCJEPS,JEPS1879,,Nemophila menziesii var. atomaria,205101,4/17/1938,1938,4,17,107,Apr 17 1938,Flowering/Fruiting,Del Norte,"Gasquet , Gasquet (Bonnar Flat)",41.84556,-123.96833,1622,45,150 ft,cch2,urn:uuid:7e879c6a-e30f-4ed6-8ea6-06d86fce29ed,http://cch2.org/portal/collections/individual/index.php?occid=3424402
3425097,UCJEPS,JEPS111831,,Nemophila menziesii var. menziesii,205103,3/25/2005,2005,3,25,84,25-Mar-05,,Contra Costa,Fernandez Ranch Fernandez Ranch. West of Christie Road. South of I-4 (behind golf course) and North of Pinole Peak,37.996113,-122.2025,100,115,115 m,cch2,urn:uuid:05a62e2a-f5b7-43b6-9100-e265e0be9f73,http://cch2.org/portal/collections/individual/index.php?occid=3425097
3426033,UCJEPS,JEPS82016,,Nemophila menziesii,205099,1/23/1983,1983,1,23,23,Jan 23 1983,Flowering/Fruiting,Santa Cruz,"ca 17 mi nw Santa Cruz (nw-facing slope of Haybarn Gulch, H-H Ranch, btw CA 1 and Swanton Rd, se of Greyhound Rock, w and nw of Old Seaside School, Swanton); nw of Santa Cruz, H-H Ranch, Haybarn Gulch",37.083332,-122.25,,85,280 ft,cch2,urn:uuid:6d23dddd-8d2b-4a39-b78e-cd8d8a2a676d,http://cch2.org/portal/collections/individual/index.php?occid=3426033
3426056,UCJEPS,JEPS1482,,Nemophila menziesii,205099,1879-01-01,1879,1,1,1,1879,Flowering/Fruiting,Placer,Auburn,38.8953,-121.0686,5000,,,cch2,urn:uuid:f3869e46-8ee8-4c9c-9d8f-8b797000ba89,http://cch2.org/portal/collections/individual/index.php?occid=3426056
3428645,UCJEPS,UC1239744,,Nemophila menziesii,205099,5/30/1902,1902,5,30,150,May 30 1902,Flowering/Fruiting,Lake,"6 mi nw Lakeport (in hills about Scotts Valley); hills about Scotts Valley, nw of Lakeport",39.099266,-122.95915,4358,426,1400-2000 ft,cch2,urn:uuid:14535bb3-e60d-43fe-bf7a-3aba69e27eb5,http://cch2.org/portal/collections/individual/index.php?occid=3428645
3430388,UCJEPS,UC202791,,Nemophila menziesii,205099,4/1/1903,1903,4,1,91,"April, 1903",Flowering/Fruiting,San Mateo,Cemeteries,37.680893,-122.448395,818,,,cch2,urn:uuid:156213cc-b517-4078-93cf-cac117b05be1,http://cch2.org/portal/collections/individual/index.php?occid=3430388
3430525,UCJEPS,UC24219,,Nemophila menziesii,205099,1800-01-01,1800,1,1,1,1800s,Flowering/Fruiting,,,,,,,,cch2,urn:uuid:98b5a573-06c6-42c2-a3e3-6449bac09b64,http://cch2.org/portal/collections/individual/index.php?occid=3430525
3430613,UCJEPS,UC24244,,Nemophila menziesii,205099,1821-01-01,1821,1,1,1,before 1897,Flowering/Fruiting,Mendocino,near Ukiah; near Ukiah,39.144787,-123.2056,11278,,,cch2,urn:uuid:1e746c9f-7187-453f-af15-4391cceebbbe,http://cch2.org/portal/collections/individual/index.php?occid=3430613
3431429,UCJEPS,UC536816,,Nemophila menziesii,205099,3/23/1934,1934,3,23,82,Mar 23 1934,Flowering/Fruiting,San Bernardino,Upland,34.094533,-117.648592,2400,,,cch2,urn:uuid:3a5a868b-8cd4-4671-a7ec-c2b243568966,http://cch2.org/portal/collections/individual/index.php?occid=3431429
3432554,UCJEPS,UC718104,,Nemophila menziesii,205099,3/30/1937,1937,3,30,89,Mar 30 1937,Flowering/Fruiting,Placer,"on Penryn Road 3 4/10 mi e Lincoln; Sacramento Valley, e of Lincoln",,,,76,250 ft,cch2,urn:uuid:80084cc7-5fa0-48d0-b60c-a26638b634d0,http://cch2.org/portal/collections/individual/index.php?occid=3432554
3434241,UCJEPS,UC2027804,,Nemophila menziesii var. menziesii,205103,4/20/1997,1997,4,20,110,20-Apr-97,Flowering/Fruiting,Contra Costa,"North base of Mount Diablo, trail to Back Creek from Mitchell Canyon trailhead.",,,,,,cch2,urn:uuid:72d0ff62-7b0b-4f7e-bbd5-51b9b78cf399,http://cch2.org/portal/collections/individual/index.php?occid=3434241
3437872,UCJEPS,JEPS1915,,Nemophila menziesii,205099,5/17/1901,1901,5,17,137,"May 17 1901-June 1, 1901",Flowering/Fruiting,Riverside,"Strawberry Valley Mt. San Jacinto, Strawberry Valley",33.74553,-116.71441,8047,,,cch2,urn:uuid:c7d14869-ba6d-4bc3-9531-14e73c81ee3a,http://cch2.org/portal/collections/individual/index.php?occid=3437872
3438470,UCJEPS,JEPS45200,,Nemophila menziesii,205099,3/9/1961,1961,3,9,68,Mar 9 1961,Flowering/Fruiting,Stanislaus,vicinity La Grange; vicinity of La Grange,,,,,,cch2,urn:uuid:61896aa5-6e42-47f3-80c9-f44c8c8ba90a,http://cch2.org/portal/collections/individual/index.php?occid=3438470
3438900,UCJEPS,JEPS3966,,Nemophila menziesii,205099,1885-01-01,1885,1,1,1,1885,Flowering/Fruiting,Solano,"Jepson Fields , Jepson Fields (Vaca Valley)",,,,,,cch2,urn:uuid:20360bf7-4f99-46d7-b805-6afd1926a47a,http://cch2.org/portal/collections/individual/index.php?occid=3438900
3441543,UCJEPS,UC1537399,,Nemophila menziesii,205099,3/6/1935,1935,3,6,65,Mar 6 1935,Flowering/Fruiting,Los Angeles,4 mi w Palmdale; w of Palmdale,34.57942,-118.18575,,944,3100 ft,cch2,urn:uuid:4918a0ab-a83b-4adc-a911-ec483d6b903a,http://cch2.org/portal/collections/individual/index.php?occid=3441543
3442887,UCJEPS,UC24222,,Nemophila menziesii,205099,1897-02-10,1897,2,10,41,Feb 10 1897,Flowering/Fruiting,Los Angeles,Claremont,,,,365,1200 ft,cch2,urn:uuid:e70a8c28-d665-42e6-9927-9e0128881af6,http://cch2.org/portal/collections/individual/index.php?occid=3442887
3444251,UCJEPS,UC598440,,Nemophila menziesii,205099,4/14/1938,1938,4,14,104,Apr 14 1938,Flowering/Fruiting,San Bernardino,summit Cajon Pass,,,,1310,4300 ft,cch2,urn:uuid:d077ce90-9cb3-4299-916f-c51bf41ff71b,http://cch2.org/portal/collections/individual/index.php?occid=3444251
3444259,UCJEPS,UC596368,,Nemophila menziesii,205099,3/19/1938,1938,3,19,78,Mar 19 1938,Flowering/Fruiting,San Joaquin,"1 mi n Corral Hollow (near Alameda Co. line, San Joaquin Co.); n of Corral Hollow",37.65059,-121.55563,3875,,,cch2,urn:uuid:8560f856-63d9-4d29-8e49-8608c6a1de69,http://cch2.org/portal/collections/individual/index.php?occid=3444259
3444498,UCJEPS,UC666593,,Nemophila menziesii,205099,4/19/1942,1942,4,19,109,Apr 19 1942,Flowering/Fruiting,San Diego,2 1/2 mi from Palomar Mt. Summit (on road to Palomar Mt.); road to Palomar Mt.,33.3436,-116.8804,401,,,cch2,urn:uuid:39e709a2-80d1-4b77-8c02-eb9294c42a16,http://cch2.org/portal/collections/individual/index.php?occid=3444498
3446855,UCJEPS,UC643397,,Nemophila menziesii,205099,4/9/1930,1930,4,9,99,Apr 9 1930,Flowering/Fruiting,Riverside,n Banning; n of Banning,33.933,-116.9,5000,,,cch2,urn:uuid:d5d9d61a-024e-4fa5-8cf0-3d6948967ec2,http://cch2.org/portal/collections/individual/index.php?occid=3446855
3449167,UCJEPS,UC606908,,Nemophila menziesii,205099,4/10/1938,1938,4,10,100,Apr 10 1938,Flowering/Fruiting,San Luis Obispo,"in ravine at n edge Paso Robles , n edge Paso Robles (Salinas River Valley)",,,,198,650 ft,cch2,urn:uuid:0ad62a0c-9280-4a74-aaf7-6ff940510161,http://cch2.org/portal/collections/individual/index.php?occid=3449167
3450175,UCJEPS,JEPS1797,,Nemophila menziesii,205099,4/21/1922,1922,4,21,111,Apr 21 1922,Flowering/Fruiting,Solano,"near Allendale (Peaceful Glen); near Allendale, Peaceful Glen",,,,60,200 ft,cch2,urn:uuid:0e631272-3eec-4483-a63b-ed33b2b1ac0a,http://cch2.org/portal/collections/individual/index.php?occid=3450175
3451474,UCJEPS,JEPS1478,,Nemophila menziesii,205099,4/17/1939,1939,4,17,107,Apr 17 1939,Flowering/Fruiting,Riverside,Corona,,,,,,cch2,urn:uuid:9d549488-d07e-48a0-8571-fd2ab9cc3e84,http://cch2.org/portal/collections/individual/index.php?occid=3451474
3453090,UCJEPS,UC1245408,,Nemophila menziesii,205099,3/29/1936,1936,3,29,89,Mar 29 1936,Flowering/Fruiting,Mendocino,nr top hill between Ukiah and Willits (sw side); nr top hill between Ukiah and Willits,39.328804,-123.3016,4841,,,cch2,urn:uuid:3ddf8d5c-f16c-4403-a096-8760954f2ca6,http://cch2.org/portal/collections/individual/index.php?occid=3453090
3453200,UCJEPS,UC1285314,,Nemophila menziesii,205099,4/8/1952,1952,4,8,99,Apr 8 1952,Flowering/Fruiting,San Luis Obispo,La Panza district La Panza district (on open hillside),,,,,,cch2,urn:uuid:87d729ad-1422-4fd1-812d-d0b90a841839,http://cch2.org/portal/collections/individual/index.php?occid=3453200
3453470,UCJEPS,UC131456,,Nemophila menziesii,205099,4/12/1902,1902,4,12,102,Apr 12 1902,Flowering/Fruiting,San Mateo,La Honda,37.317913,-122.269394,908,,,cch2,urn:uuid:d40816a4-defc-47e9-af77-3741830db019,http://cch2.org/portal/collections/individual/index.php?occid=3453470
3454303,UCJEPS,UC1607998,,Nemophila menziesii,205099,3/16/1935,1935,3,16,75,Mar 16 1935,Flowering/Fruiting,Orange,n Fullerton; n of Fullerton,33.87,-117.94,4828,60,200 ft,cch2,urn:uuid:7804d6fe-b867-420c-a8c6-f39098129704,http://cch2.org/portal/collections/individual/index.php?occid=3454303
3455074,UCJEPS,UC24206,,Nemophila menziesii,205099,3/29/1902,1902,3,29,88,Mar 29 1902,Flowering/Fruiting,Butte,Chico,,,,,,cch2,urn:uuid:d29cebe0-5825-4d54-aa4b-3a6d4919af06,http://cch2.org/portal/collections/individual/index.php?occid=3455074
3455119,UCJEPS,UC24212,,Nemophila menziesii,205099,4/9/1921,1921,4,9,99,9-Apr-21,Flowering/Fruiting,San Diego,Santa Ysabel,33.10921,-116.67308,1609,,,cch2,urn:uuid:6a3f19cd-1078-4b72-960f-e17dfc59865d,http://cch2.org/portal/collections/individual/index.php?occid=3455119
3455122,UCJEPS,UC24242,,Nemophila menziesii,205099,3/31/1902,1902,3,31,90,Mar 31 1902,Flowering/Fruiting,Sonoma,Kenwood,38.41389,-122.545,,,,cch2,urn:uuid:9ef5d397-88ce-4a7e-b084-a2370b5d5a7c,http://cch2.org/portal/collections/individual/index.php?occid=3455122
3455161,UCJEPS,UC24260,,Nemophila menziesii,205099,1892-05-01,1892,5,1,122,May 1892,Flowering/Fruiting,Santa Cruz,Glenwood,37.10833,-121.98556,,,,cch2,urn:uuid:1e1275d6-4bf1-449c-a510-7813921702b1,http://cch2.org/portal/collections/individual/index.php?occid=3455161
3455270,UCJEPS,UC310947,,Nemophila menziesii,205099,3/18/1925,1925,3,18,77,Mar 18 1925,Flowering/Fruiting,Kern,n Tehachapi; n of Tehachapi,,,,1219,4000 ft,cch2,urn:uuid:29543bec-3ba7-4b37-ab66-61254fcecb01,http://cch2.org/portal/collections/individual/index.php?occid=3455270
3456911,UCJEPS,UC67145,,Nemophila menziesii,205099,1882-04-24,1882,4,24,114,Apr 24 1882,Flowering/Fruiting,Riverside,Temecula,33.4956,-117.1493,5000,,,cch2,urn:uuid:96cfb449-5e61-4df8-a01c-042dac4202f7,http://cch2.org/portal/collections/individual/index.php?occid=3456911
3457870,UCJEPS,UC880920,,Nemophila menziesii,205099,3/16/1913,1913,3,16,75,Mar 16 1913,Flowering/Fruiting,Marin,Mt. Tamalpais,37.9273,-122.59169,2910,,,cch2,urn:uuid:3561d455-e0d8-42ef-9f88-1f9953b225ce,http://cch2.org/portal/collections/individual/index.php?occid=3457870
3457909,UCJEPS,UC880906,,Nemophila menziesii,205099,4/12/1940,1940,4,12,103,Apr 12 1940,Flowering/Fruiting,San Diego,10 mi s Warner's Hot Springs; s of Warner's Hot Springs,33.13577,-116.67753,4828,,,cch2,urn:uuid:25ba4b44-b4f8-4e16-b63c-6b7e9a8e5b5f,http://cch2.org/portal/collections/individual/index.php?occid=3457909
3462047,UCJEPS,JEPS1495,,Nemophila menziesii,205099,5/7/1933,1933,5,7,127,May 7 1933,Flowering/Fruiting,Riverside,"about ten mi s Kenworthy (Santa Rosa Mountains, Colorado Desert); Colorado Desert, Santa Rosa Mountains, s of Kenworthy",33.5691,-116.5055,1500,,,cch2,urn:uuid:2c1b0369-1646-4f14-9fe1-11d1255757ac,http://cch2.org/portal/collections/individual/index.php?occid=3462047
3462160,UCJEPS,JEPS1791,,Nemophila menziesii var. atomaria,205101,6/15/1934,1934,6,15,166,Jun 15 1934,Flowering/Fruiting,Humboldt,"summit of Grasshopper Peak; Bull Creek Region, South Fork Eel River, Grasshopper Peak",,,,975,3200 ft,cch2,urn:uuid:362a36c8-cd81-4317-8ea8-5d5999a7feea,http://cch2.org/portal/collections/individual/index.php?occid=3462160
3463887,UCJEPS,JEPS1918,,Nemophila menziesii,205099,4/7/1911,1911,4,7,97,Apr 7 1911,Flowering/Fruiting,Tehama,Corning,39.92731,-122.17976,2416,,,cch2,urn:uuid:cbffb371-45b3-4144-adec-426cfde61d23,http://cch2.org/portal/collections/individual/index.php?occid=3463887
3464409,UCJEPS,UC1069171,,Nemophila menziesii,205099,3/4/1935,1935,3,4,63,Mar 4 1935,Flowering/Fruiting,Kern,"near mouth of Grapevine Tejon Quad., San Joaquin Valley, nr Grapevine (San Joaquin V)",34.9798,-118.8973,805,365,1200 ft,cch2,urn:uuid:92e87e90-c124-4b44-83f9-3f228988bf7c,http://cch2.org/portal/collections/individual/index.php?occid=3464409
3467616,UCJEPS,UC24204,,Nemophila menziesii,205099,1864-03-09,1864,3,9,69,Mar 9 1864,Flowering/Fruiting,Alameda,Oakland,37.80444,-122.26972,,,,cch2,urn:uuid:d0678090-c17d-4962-b1f9-6e6b7d477c57,http://cch2.org/portal/collections/individual/index.php?occid=3467616
3468353,UCJEPS,UC484259,,Nemophila menziesii,205099,3/6/1931,1931,3,6,65,Mar 6 1931,Flowering/Fruiting,Orange,"1 mi below Trabuco Camp Ground (Trabuco Canyon, w slope Santa Ana Mts.); w slope Santa Ana Mts., Trabuco Canyon",33.67,-117.53,2736,609,2000 ft,cch2,urn:uuid:22d9073c-55a2-40f3-a3bd-3f2c840a89e9,http://cch2.org/portal/collections/individual/index.php?occid=3468353
3468970,UCJEPS,UC592135,,Nemophila menziesii,205099,3/21/1932,1932,3,21,81,Mar 21 1932,Flowering/Fruiting,Los Angeles,"20 mi n Saugus (Vasquez Rocks, Soledad Canyon); n of Saugus, Soledad Canyon, Vasquez Rocks",,,,,,cch2,urn:uuid:b5b047d3-ee00-4d28-a869-07ad956e2442,http://cch2.org/portal/collections/individual/index.php?occid=3468970
3469715,UCJEPS,UC72015,,Nemophila menziesii,205099,1895-04-01,1895,4,1,91,"April, 1895",Flowering/Fruiting,San Luis Obispo,Arroyo Grande,35.12187,-120.58559,2740,,,cch2,urn:uuid:80d1361b-802f-4db5-9fb0-9e2cee62ce34,http://cch2.org/portal/collections/individual/index.php?occid=3469715
3474276,UCJEPS,JEPS1496,,Nemophila menziesii,205099,5/6/1934,1934,5,6,126,May 6 1934,Flowering/Fruiting,Trinity,South Fork Mt.,40.50722,-123.49611,,,,cch2,urn:uuid:cf559db7-bc4a-4bdb-af1c-c2531aafc647,http://cch2.org/portal/collections/individual/index.php?occid=3474276
3474655,UCJEPS,JEPS110862,,Nemophila menziesii var. atomaria,205101,3/21/1995,1995,3,21,80,Mar 21 1995,Flowering/Fruiting,Napa,In small meadow on floodplain of creek; igneous rock; Mixed Evergreen Forest,,,,108,355 ft,cch2,urn:uuid:a3324e0a-cc99-4cb3-8ded-d433bfe2f53d,http://cch2.org/portal/collections/individual/index.php?occid=3474655
3474940,UCJEPS,JEPS110848,,Nemophila menziesii var. atomaria,205101,4/11/1998,1998,4,11,101,11-Apr-98,,Napa,Langtry Road at Napa/Sonoma County line.,38.4957,-122.5283,805,579,1900 ft,cch2,urn:uuid:0ad01db9-9b9e-437e-b5bc-183bc02aca1a,http://cch2.org/portal/collections/individual/index.php?occid=3474940
3475111,UCJEPS,JEPS1914,,Nemophila menziesii,205099,4/9/1927,1927,4,9,99,Apr 9 1927,Flowering/Fruiting,Kern,Tehachapi Valley,35.1125,-118.43611,,,,cch2,urn:uuid:612c2a31-3766-4923-beff-2b670ea321ae,http://cch2.org/portal/collections/individual/index.php?occid=3475111
3475130,UCJEPS,JEPS94183,,Nemophila menziesii var. menziesii,205103,4/21/1998,1998,4,21,111,Apr 21 1998,Flowering/Fruiting,Colusa,Rd. 401 1.8 mi. n. Grapevine Pass (on the Sites-Lodoga Rd.),39.3743,-122.46,805,472,1550 ft,cch2,urn:uuid:4969a748-d49a-4143-b3d1-c2b8aad3f535,http://cch2.org/portal/collections/individual/index.php?occid=3475130
3475154,UCJEPS,JEPS1477,,Nemophila menziesii var. atomaria,205101,4/15/1933,1933,4,15,105,Apr 15 1933,Flowering/Fruiting,Sonoma,Bodega Hill,,,,6,20 ft,cch2,urn:uuid:9194e25d-8695-4648-92b8-a56744bfbcfd,http://cch2.org/portal/collections/individual/index.php?occid=3475154
3475552,UCJEPS,JEPS1880,,Nemophila menziesii var. atomaria,205101,4/13/1919,1919,4,13,103,Apr 13 1919,Flowering/Fruiting,Napa,near Atlas; near Atlas,,,,,,cch2,urn:uuid:c3676152-58cf-4e7c-b3c8-5ee7b2e81da9,http://cch2.org/portal/collections/individual/index.php?occid=3475552
3475999,UCJEPS,JEPS82020,,Nemophila menziesii,205099,3/15/1983,1983,3,15,74,Mar 15 1983,Flowering/Fruiting,Santa Cruz,"ca 17 mi nw Santa Cruz (Buckeye Grove Ridge overlooking central Buckeye Grove Gulch, H-H Ranch btw CA 1 & Swanton Rd, se Greyhound Rock, w & nw Old Seaside School, Swanton); nw of Santa Cruz, H-H Ranch, Buckeye Grove Gulch",37.083332,-122.25,,97,320 ft,cch2,urn:uuid:15340320-6ecf-43f3-813a-c47aa939b69e,http://cch2.org/portal/collections/individual/index.php?occid=3475999
3476730,UCJEPS,UC1069174,,Nemophila menziesii,205099,4/1/1934,1934,4,1,91,Apr 01 1934,Flowering/Fruiting,Ventura,"5 mi nw Ozena; Mt. Pinos Quad., nw of Ozena",34.757,-119.4104,805,1066,3500 ft,cch2,urn:uuid:19d083a1-f008-480d-8afd-d63040a3a70f,http://cch2.org/portal/collections/individual/index.php?occid=3476730
3477884,UCJEPS,UC1285256,,Nemophila menziesii,205099,3/19/1958,1958,3,19,78,Mar 19 1958,Flowering/Fruiting,San Luis Obispo,"near n base Caliente Mountain (Carrizo Plain); , near n base Caliente Mountain",35.084389,-119.752739,3783,,,cch2,urn:uuid:e6aa0f30-cb49-44e2-a103-f91dee4d36e5,http://cch2.org/portal/collections/individual/index.php?occid=3477884
3477887,UCJEPS,UC126919,,Nemophila menziesii,205099,4/17/1906,1906,4,17,107,Apr 17 1906,Flowering/Fruiting,Napa,,38.52,-122.3119,37375,,,cch2,urn:uuid:72e7abde-9be9-4bcf-8946-9f0fe9f263a4,http://cch2.org/portal/collections/individual/index.php?occid=3477887
3478292,UCJEPS,UC144187,,Nemophila menziesii,205099,4/4/1904,1904,4,4,95,Apr 4 1904,Flowering/Fruiting,Riverside,Elsinore,33.6814,-117.3608,4000,,,cch2,urn:uuid:dee79c38-327f-4a01-ad0b-ff08e0272e22,http://cch2.org/portal/collections/individual/index.php?occid=3478292
3478426,UCJEPS,UC146215,,Nemophila menziesii,205099,5/16/1903,1903,5,16,136,May 16 1903,Flowering/Fruiting,Napa,"near Calistoga (Napa Valley); Northern Coast Ranges, , near Calistoga",,,,91,300 ft,cch2,urn:uuid:245c7ef5-489c-4d4c-bf45-d74bae736299,http://cch2.org/portal/collections/individual/index.php?occid=3478426
3479690,UCJEPS,UC206197,,Nemophila menziesii,205099,,,,,,,Flowering/Fruiting,San Francisco,San Francisco,37.775,-122.41833,,,,cch2,urn:uuid:e53be9fc-f602-496c-9615-2a9b3112df55,http://cch2.org/portal/collections/individual/index.php?occid=3479690
3481199,UCJEPS,UC606903,,Nemophila menziesii,205099,3/27/1938,1938,3,27,86,Mar 27 1938,Flowering/Fruiting,Napa,"5 mi e Napa (n slope in Howell Mountains, North Coast Ranges); North Coast Ranges, Howell Mountains, e of Napa",,,,457,1500 ft,cch2,urn:uuid:84f81fc9-0566-4fd5-8289-11730e7b1b6c,http://cch2.org/portal/collections/individual/index.php?occid=3481199
3483889,UCJEPS,UC1562894,,Nemophila menziesii subsp. integrifolia,210481,4/20/1986,1986,4,20,110,20-Apr-86,Flowering/Fruiting,Kern,"Scodie Mts. E of Isabelle Lake, ca 4 air miles NW of Walker Pass, canyon on N side Pinyon Peak, shoulder of SE hill ca 1/2 mi from end of dirt road.",35.697,-118.0852,805,1524,5000 ft,cch2,urn:uuid:66ac9dd9-4540-448d-b9e6-9dc833eb9e66,http://cch2.org/portal/collections/individual/index.php?occid=3483889
3485635,UCJEPS,JEPS1487,,Nemophila menziesii,205099,3/19/1939,1939,3,19,78,Mar 19 1939,Flowering/Fruiting,Marin,"w side Mt. Tamalpais , Cataract Canyon (Cataract Canyon)",37.920685,-122.62479,1622,,,cch2,urn:uuid:fde5c49b-9834-4345-89af-cddbcdb36ae7,http://cch2.org/portal/collections/individual/index.php?occid=3485635
3485737,UCJEPS,JEPS1913,,Nemophila menziesii,205099,3/23/1919,1919,3,23,82,Mar 23 1919,Flowering/Fruiting,,,,,,,,cch2,urn:uuid:0feef4d0-9cb2-4d85-b1f3-626700ce0c8d,http://cch2.org/portal/collections/individual/index.php?occid=3485737
3485861,UCJEPS,JEPS3962,,Nemophila menziesii,205099,4/14/1938,1938,4,14,104,Apr 14 1938,Flowering/Fruiting,El Dorado,Nashville,38.57889,-120.84417,,,,cch2,urn:uuid:78c6a398-8342-4209-b114-df6df0e31521,http://cch2.org/portal/collections/individual/index.php?occid=3485861
3487141,UCJEPS,JEPS3130,,Nemophila menziesii,205099,1891-04-20,1891,4,20,110,Apr 20 1891,Flowering/Fruiting,Sutter,"Valley of the Butte Pass , Valley of the Butte Pass (Marysville Buttes)",39.2251,-121.81401,4038,,,cch2,urn:uuid:9ac572ff-7e0f-4608-b4bb-f4fd9fbd4dd4,http://cch2.org/portal/collections/individual/index.php?occid=3487141
3487876,UCJEPS,JEPS3117,,Nemophila menziesii,205099,5/14/1915,1915,5,14,134,May 14 1915,Flowering/Fruiting,Tuolumne,"near Italian Bar (French Camp, South Fork Stanislaus River); South Fork Stanislaus River, near Italian Bar",38.07775,-120.367325,174,1005,3300 ft,cch2,urn:uuid:a70d3fff-5c7c-4e20-a381-3490e6af7619,http://cch2.org/portal/collections/individual/index.php?occid=3487876
3488185,UCJEPS,JEPS1890,,Nemophila menziesii var. integrifolia,205102,4/7/1932,1932,4,7,98,Apr 7 1932,Flowering/Fruiting,San Bernardino,"6 mi sw Warren's Well (Morongo Valley, Colorado Desert); Colorado Desert, Morongo Valley, sw of Warren's Well",,,,1524,5000 ft,cch2,urn:uuid:e1380ea0-b76d-4b48-9a87-15575ad9236f,http://cch2.org/portal/collections/individual/index.php?occid=3488185
3488486,UCJEPS,UC1005677,,Nemophila menziesii,205099,5/30/1939,1939,5,30,150,May 30 1939,Flowering/Fruiting,Humboldt,"about 25 mi due e Eureka (near top Horse Mountain, near ski-hut); near top Horse Mountain, e of Eureka",,,,1100,1100 m,cch2,urn:uuid:b01a9565-3b2b-4988-b804-acba091037f2,http://cch2.org/portal/collections/individual/index.php?occid=3488486
3490020,UCJEPS,UC126918,,Nemophila menziesii,205099,4/17/1906,1906,4,17,107,Apr 17 1906,Flowering/Fruiting,Alameda,hills near Berkeley; hills near Berkeley,37.8931,-122.2717,2500,,,cch2,urn:uuid:5b479731-9f9a-494d-8a2d-2f353a924fd0,http://cch2.org/portal/collections/individual/index.php?occid=3490020
3490354,UCJEPS,UC1377696,,Nemophila menziesii,205099,3/17/1951,1951,3,17,76,Mar 17 1951,Flowering/Fruiting,Contra Costa,w Orinda; w of Orinda,37.877434,-122.20395,2266,,,cch2,urn:uuid:2219070b-74d1-4f38-bcef-d1716a189607,http://cch2.org/portal/collections/individual/index.php?occid=3490354
3493308,UCJEPS,UC63798,,Nemophila menziesii,205099,1897-03-20,1897,3,20,79,Mar 20 1897,Flowering/Fruiting,Riverside,Temescal Mts.,33.7866,-117.4363,7400,457,1500 ft,cch2,urn:uuid:59f0bba1-b827-4a0f-b3bf-c19bfdb938c1,http://cch2.org/portal/collections/individual/index.php?occid=3493308
3493378,UCJEPS,UC63802,,Nemophila menziesii,205099,5/17/1901,1901,5,17,137,"May 17, 1901-Jun 1, 1901",Flowering/Fruiting,Riverside,Strawberry Valley,33.74553,-116.71441,8047,1600,5250 ft,cch2,urn:uuid:b985442b-3598-454d-9b20-028a57af07dd,http://cch2.org/portal/collections/individual/index.php?occid=3493378
3493538,UCJEPS,UC66822,,Nemophila menziesii,205099,4/3/1904,1904,4,3,94,Apr 3 1904,Flowering/Fruiting,Monterey,Pacific Grove,36.617738,-121.916622,2752,,,cch2,urn:uuid:ae930e17-1f8c-4002-a04f-9a3316486766,http://cch2.org/portal/collections/individual/index.php?occid=3493538
3493555,UCJEPS,UC67144,,Nemophila menziesii,205099,1898-04-23,1898,4,23,113,Apr 23 1898,Flowering/Fruiting,Sonoma,Santa Rosa Creek Canyon,,,,,,cch2,urn:uuid:511c5cda-9676-43b2-94fb-8a31a13c9930,http://cch2.org/portal/collections/individual/index.php?occid=3493555
3497176,UCJEPS,UC2027001,,Nemophila menziesii,205099,3/24/2005,2005,3,24,83,24-Mar-05,Flowering/Fruiting,San Luis Obispo,Southeast Half of the Caliente Range. Approx. 1.6km NNW of Wells Canyon,35.027778,-119.665278,50,939,939,cch2,urn:uuid:341af6dd-d14e-473f-96ce-811343dd82d7,http://cch2.org/portal/collections/individual/index.php?occid=3497176
3497731,UCJEPS,JEPS1476,,Nemophila menziesii var. integrifolia,205102,3/27/1922,1922,3,27,86,Mar 27 1922,Flowering/Fruiting,San Diego,Pt. Soma,,,,,,cch2,urn:uuid:48ae80f3-485b-4546-9234-80082c5dfb61,http://cch2.org/portal/collections/individual/index.php?occid=3497731
3497912,UCJEPS,JEPS3132,,Nemophila menziesii,205099,4/20/1919,1919,4,20,110,Apr 20 1919,Flowering/Fruiting,Santa Clara,"Hall's Valley , Hall's Valley (Mt. Hamilton Range)",,,,,,cch2,urn:uuid:0e6536df-5669-4b25-9e2d-f7b4caa5d60d,http://cch2.org/portal/collections/individual/index.php?occid=3497912
3498432,UCJEPS,JEPS82021,,Nemophila menziesii,205099,3/15/1983,1983,3,15,74,Mar 15 1983,Flowering/Fruiting,Santa Cruz,"ca 17 mi nw Santa Cruz (se-fcg slope Buckeye Grove Ridge, H-H Ranch, btw CA 1 and Swanton Rd, se of Greyhound Rock, w and nw Old Seaside School, Swanton); nw of Santa Cruz, H-H Ranch, Buckeye Grove Ridge",37.083332,-122.25,,97,320 ft,cch2,urn:uuid:d876a6ff-b712-4056-a21e-7e737fd80c52,http://cch2.org/portal/collections/individual/index.php?occid=3498432
3500104,UCJEPS,JEPS1881,,Nemophila menziesii var. atomaria,205101,4/10/1938,1938,4,10,100,Apr 10 1938,Flowering/Fruiting,Del Norte,Smith River Indian Reservation,41.95361,-124.20139,,7,25 ft,cch2,urn:uuid:ffefb2ec-1167-4d97-89f4-0ccfed0aa693,http://cch2.org/portal/collections/individual/index.php?occid=3500104
3500940,UCJEPS,UC1069168,,Nemophila menziesii,205099,4/15/1937,1937,4,15,105,Apr 15 1937,Flowering/Fruiting,Kern,"2 1/2 mi n Crocker Spring; McKittrick Quad., n of Crocker Spring",35.259804,-119.65086,1130,609,2000 ft,cch2,urn:uuid:ab877db4-f0a6-40e2-91b3-f21945bbcfa5,http://cch2.org/portal/collections/individual/index.php?occid=3500940
3500946,UCJEPS,UC1069191,,Nemophila menziesii,205099,4/9/1935,1935,4,9,99,Apr 9 1935,Flowering/Fruiting,Santa Cruz,"1 1/2 mi n Santa Cruz; Santa Cruz Quad., n of Santa Cruz",37.0619,-121.9534,4828,91,300 ft,cch2,urn:uuid:8bb0c849-65e5-4a25-abfb-cf51883a8830,http://cch2.org/portal/collections/individual/index.php?occid=3500946
3502749,UCJEPS,UC1501861,,Nemophila menziesii,205099,3/10/1951,1951,3,10,69,Mar 10 1951,Flowering/Fruiting,San Luis Obispo,"Wreden Ranch overlooking San Joaquin Valley, Wreden Ranch (San Joaquin Valley, junction of San Luis Obispo and Kern Counties)",,,,762,2500 ft,cch2,urn:uuid:2168c2ec-cb36-4037-85b2-760f94475086,http://cch2.org/portal/collections/individual/index.php?occid=3502749
3503768,UCJEPS,UC196340,,Nemophila menziesii,205099,2/16/1914,1914,2,16,47,Feb 16 1914,Flowering/Fruiting,Butte,8 mi n Oroville; n of Oroville,39.612827,-121.60595,6450,,,cch2,urn:uuid:3a087d9e-ccc8-4f38-a8e0-7024ac8d308f,http://cch2.org/portal/collections/individual/index.php?occid=3503768
3503926,UCJEPS,UC24192,,Nemophila menziesii,205099,,,,,,,Flowering/Fruiting,,Colon Ross,,,,,,cch2,urn:uuid:11865140-d046-4dfe-ac91-31b949382163,http://cch2.org/portal/collections/individual/index.php?occid=3503926
3503943,UCJEPS,UC24234,,Nemophila menziesii,205099,1895-04-07,1895,4,7,97,Apr 7 1895,Flowering/Fruiting,Contra Costa,Antioch,38.005,-121.80472,,,,cch2,urn:uuid:6c5e7938-ff77-4f6a-8ad5-bc8454a90eb3,http://cch2.org/portal/collections/individual/index.php?occid=3503943
3504488,UCJEPS,UC480617,,Nemophila menziesii,205099,2/22/1928,1928,2,22,53,Feb 22 1928,Flowering/Fruiting,Contra Costa,Mt. Diablo,37.88178,-121.91309,5414,,,cch2,urn:uuid:fb96fbcc-d1b8-4c58-a54e-2307b5e592e7,http://cch2.org/portal/collections/individual/index.php?occid=3504488
3505198,UCJEPS,UC593306,,Nemophila menziesii,205099,5/8/1938,1938,5,8,128,May 8 1938,Flowering/Fruiting,Santa Barbara,"e Zaca Peak (near summit Figueroa Mountain, San Rafael Mountains); San Rafael Mountains, Figueroa Mountain, e of Zaca Peak",34.7432,-119.9848,1000,1371,4500 ft,cch2,urn:uuid:58d1b76c-fb9a-4c20-98aa-e1f6df784ddc,http://cch2.org/portal/collections/individual/index.php?occid=3505198
3505253,UCJEPS,UC595056,,Nemophila menziesii,205099,5/1/1938,1938,5,1,121,1-May-38,Flowering/Fruiting,Lake,Bartlett Springs,39.18314,-122.70256,93,,,cch2,urn:uuid:6f92d282-0882-4fd4-8518-44fc3cd89fe1,http://cch2.org/portal/collections/individual/index.php?occid=3505253
3505309,UCJEPS,UC606913,,Nemophila menziesii,205099,4/22/1938,1938,4,22,112,Apr 22 1938,Flowering/Fruiting,Lake,"4 mi sw Lower Lake (on a branch of Cache Creek, North Coast Ranges); North Coast Ranges, sw of Lower Lake, Cache Creek branch",38.885494,-122.66307,2766,457,1500 ft,cch2,urn:uuid:5ce32392-0250-4f75-9b9a-c54d6a934e24,http://cch2.org/portal/collections/individual/index.php?occid=3505309
3505748,UCJEPS,UC67143,,Nemophila menziesii,205099,3/21/1902,1902,3,21,80,Mar 21 1902,Flowering/Fruiting,Solano,Vacaville,38.36104,-121.97021,8808,,,cch2,urn:uuid:36f37919-6aff-40cf-8d48-72af8cf97785,http://cch2.org/portal/collections/individual/index.php?occid=3505748
3509321,UCJEPS,JEPS8961,,Nemophila menziesii var. integrifolia,205102,5/18/1954,1954,5,18,138,May 18 1954,Flowering/Fruiting,San Diego,"3.8 mi e Potrero (5-1/2 mi w of Campo, on grade along State Highway 94); w of Campo, e of Potrero",32.5962,-116.545,805,731,2400 ft,cch2,urn:uuid:a97e0e19-c334-471f-bc14-19a1105655aa,http://cch2.org/portal/collections/individual/index.php?occid=3509321
3510235,UCJEPS,JEPS1805,,Nemophila menziesii var. integrifolia,205102,5/19/1918,1918,5,19,139,May 19 1918,Flowering/Fruiting,Los Angeles,"Millards Canyon , Millards Canyon (San Gabriel Mountains)",,,,609,2000 ft,cch2,urn:uuid:24b63dea-ecc3-41ac-9655-2f6367ed7473,http://cch2.org/portal/collections/individual/index.php?occid=3510235
3510862,UCJEPS,JEPS1796,,Nemophila menziesii,205099,3/28/1929,1929,3,28,87,Mar 28 1929,Flowering/Fruiting,Fresno,Little Dry Creek near Sparkville; Little Dry Creek near Sparkville,36.968315,-119.61253,818,198,650 ft,cch2,urn:uuid:daa37c74-14a0-46c7-9508-b95cbe81f55a,http://cch2.org/portal/collections/individual/index.php?occid=3510862
3510864,UCJEPS,JEPS3115,,Nemophila menziesii,205099,1895-05-01,1895,5,1,121,May 1895,Flowering/Fruiting,San Bernardino,vicinity San Bernardino; vicinity San Bernardino,,,,304,1000-1500 ft,cch2,urn:uuid:7d8b9d0a-3dda-4385-b090-1db88f01842b,http://cch2.org/portal/collections/individual/index.php?occid=3510864
3511084,UCJEPS,JEPS1489,,Nemophila menziesii,205099,5/1/1938,1938,5,1,121,1-May-38,Flowering/Fruiting,Tehama,"low hills at Paskenta , Paskenta (Inner North Coast Ranges)",39.8468,-122.5944,1350,304,1000 ft,cch2,urn:uuid:63161c15-103b-4b30-a820-83a2af92288d,http://cch2.org/portal/collections/individual/index.php?occid=3511084
3511608,UCJEPS,JEPS85033,,Nemophila menziesii,205099,5/3/1969,1969,5,3,123,May 3 1969,Flowering/Fruiting,Napa,"ca 7 mi ne Napa (Mead Ranch, off the Atlas Peak Rd.); ne of Napa, off Atlas Peak Rd., Mead Ranch",,,,457,1500 ft,cch2,urn:uuid:e7c367b2-222a-4aca-aeb5-1a01de043df4,http://cch2.org/portal/collections/individual/index.php?occid=3511608
3511692,UCJEPS,JEPS35787,,Nemophila menziesii var. atomaria,205101,3/25/1964,1964,3,25,85,Mar 25 1964,Flowering/Fruiting,Sonoma,plowed field just off Arnold Drive at its junction with Fowler Creek Road (Sonoma Valley); Sonoma Valley,38.28706,-122.49319,678,35,115 ft,cch2,urn:uuid:088f8a7d-da61-454a-a494-5d121b915a58,http://cch2.org/portal/collections/individual/index.php?occid=3511692
3511924,UCJEPS,JEPS1497,,Nemophila menziesii,205099,2/9/1928,1928,2,9,40,Feb 9 1928,Flowering/Fruiting,Los Angeles,"Santa Anita Canyon , Santa Anita Canyon (San Gabriel Mts.)",,,,,,cch2,urn:uuid:ff0d5042-3ba6-46ef-b608-f9166518a911,http://cch2.org/portal/collections/individual/index.php?occid=3511924
3512118,UCJEPS,JEPS1910,,Nemophila menziesii,205099,4/2/1938,1938,4,2,92,Apr 2 1938,Flowering/Fruiting,Monterey,"5 mi n Jamesburg (Carmel Valley, Hastings Reservation, South Coast Ranges); South Coast Ranges, Hastings Reservation, Carmel Valley",,,,548,1800 ft,cch2,urn:uuid:658158e8-9edf-436c-a2a2-8dea66332c30,http://cch2.org/portal/collections/individual/index.php?occid=3512118
3512932,UCJEPS,UC1069184,,Nemophila menziesii,205099,4/26/1935,1935,4,26,116,Apr 26 1935,Flowering/Fruiting,Santa Barbara,"ridge 3 mi s Los Alamos; Lompoc Quad., Santa Barbara Natl For, s of Los Alamos",34.704265,-120.286189,865,457,1500 ft,cch2,urn:uuid:6779e802-0dce-4a79-b351-d5febeb3ec3c,http://cch2.org/portal/collections/individual/index.php?occid=3512932
3512982,UCJEPS,UC1069172,,Nemophila menziesii,205099,4/27/1935,1935,4,27,117,Apr 27 1935,Flowering/Fruiting,San Bernardino,"3 mi se of mouth Deep Creek; Deep Creek Quad., San Bernardino NF, se of Deep Creek",34.316,-117.1982,805,1386,4550 ft,cch2,urn:uuid:ddf7c0c5-d926-40ac-a047-d5aa5ccacf23,http://cch2.org/portal/collections/individual/index.php?occid=3512982
3513535,UCJEPS,UC1137832,,Nemophila menziesii,205099,3/3/1935,1935,3,3,62,Mar 3 1935,Flowering/Fruiting,Kern,"4 mi n Arvin (near Sequoia N.F.); Caliente Quad., , n of Arvin",35.2741,-118.8158,805,167,550 ft,cch2,urn:uuid:792d9590-59a9-42f9-b1e6-e4c04b251c56,http://cch2.org/portal/collections/individual/index.php?occid=3513535
3515978,UCJEPS,UC24221,,Nemophila menziesii,205099,1888-05-01,1888,5,1,122,"May, 1888",Flowering/Fruiting,San Bernardino,San Bernardino,34.113067,-117.291902,10000,,,cch2,urn:uuid:7a53b660-614f-454d-9f89-a93321814c8d,http://cch2.org/portal/collections/individual/index.php?occid=3515978
3515989,UCJEPS,UC24220,,Nemophila menziesii,205099,1898-04-02,1898,4,2,92,Apr 2 1898,Flowering/Fruiting,San Bernardino,San Bernardino,34.1131,-117.2919,10000,,,cch2,urn:uuid:9ca4b221-2cf9-4cf3-8863-3a71b83d9c98,http://cch2.org/portal/collections/individual/index.php?occid=3515989
3517344,UCJEPS,UC606909,,Nemophila menziesii,205099,4/16/1938,1938,4,16,106,Apr 16 1938,Flowering/Fruiting,Kern,w of Isabella (Kern River Canyon); Kern River Canyon,,,,762,2500 ft,cch2,urn:uuid:8fa0c7ed-b234-4c4c-8d06-7ab42877d3ca,http://cch2.org/portal/collections/individual/index.php?occid=3517344
3522055,UCJEPS,JEPS2989,,Nemophila menziesii,205099,5/1/1908,1908,5,1,122,"May, 1908",Flowering/Fruiting,Colusa,College City,39.006634,-122.00778,1024,,,cch2,urn:uuid:4e895489-316b-41b2-ac21-aa720eb81755,http://cch2.org/portal/collections/individual/index.php?occid=3522055
3523835,UCJEPS,JEPS1882,,Nemophila menziesii var. atomaria,205101,4/17/1927,1927,4,17,107,Apr 17 1927,Flowering/Fruiting,Humboldt,,,,,274,900 ft,cch2,urn:uuid:5b08e071-a960-4b37-a939-50081794c17d,http://cch2.org/portal/collections/individual/index.php?occid=3523835
3523996,UCJEPS,JEPS21154,,Nemophila menziesii,205099,3/26/1932,1932,3,26,86,Mar 26 1932,Flowering/Fruiting,San Luis Obispo,"2 mi e San Miguel; San Miguel Quad., e of San Miguel",35.7554,-120.6662,4828,243,800 ft,cch2,urn:uuid:96fced1c-e95c-441c-ba44-c983361d8fc9,http://cch2.org/portal/collections/individual/index.php?occid=3523996
3525088,UCJEPS,UC1069186,,Nemophila menziesii,205099,4/14/1937,1937,4,14,104,Apr 14 1937,Flowering/Fruiting,San Luis Obispo,"3 3/4 mi nne Pozo; Pozo Quad., Los Padres Natl Forest, nnw of Pozo",35.3607,-120.3516,805,548,1800 ft,cch2,urn:uuid:dd17f647-152f-48b6-8efb-1c62889268ed,http://cch2.org/portal/collections/individual/index.php?occid=3525088
3525126,UCJEPS,UC1069177,,Nemophila menziesii,205099,4/27/1936,1936,4,27,118,Apr 27 1936,Flowering/Fruiting,Amador,"1/2 mi sw Sugar Loaf; Jackson Quad., sw of Sugar Loaf",38.4456,-120.8816,805,243,800 ft,cch2,urn:uuid:90b66905-0e8a-495e-b332-16b4691d2f5e,http://cch2.org/portal/collections/individual/index.php?occid=3525126
3530819,UCJEPS,UC880924,,Nemophila menziesii,205099,6/19/1906,1906,6,19,170,Jun 19 1906-Jun 30 1906,Flowering/Fruiting,Santa Barbara,Zaca Lake Forest Reserve Zaca Lake Forest Reserve (hills near lake),34.778,-120.036,1000,,,cch2,urn:uuid:2e33c4b2-b1b9-4ec5-abc3-17e8255a33a1,http://cch2.org/portal/collections/individual/index.php?occid=3530819
3531106,UCJEPS,UC973557,,Nemophila menziesii,205099,,,,,,,Flowering/Fruiting,,,,,,,,cch2,urn:uuid:cbcc6321-d68b-49d3-936f-e22e8bbdb236,http://cch2.org/portal/collections/individual/index.php?occid=3531106
3538907,UCJEPS,UC131446,,Nemophila menziesii,205099,4/6/1903,1903,4,6,96,Apr 6 1903,Flowering/Fruiting,San Francisco,"San Bruno hills; San Francisco, San Bruno hills",,,,,,cch2,urn:uuid:48c6e84b-5593-4143-9880-6f81eb6ff190,http://cch2.org/portal/collections/individual/index.php?occid=3538907
3539754,UCJEPS,UC1614660,,Nemophila menziesii,205099,3/11/1934,1934,3,11,70,Mar 11 1934,Flowering/Fruiting,Marin,"coast road to Ft. Baker Sausalito (Sausalito, near San Francisco Bay); near San Francisco Bay",37.848286,-122.479706,2427,15,50 ft,cch2,urn:uuid:d9a3503b-5a70-427e-a43b-31d8ae5ac562,http://cch2.org/portal/collections/individual/index.php?occid=3539754
3540511,UCJEPS,UC24232,,Nemophila menziesii,205099,1898-04-13,1898,4,13,103,Apr 13 1898,Flowering/Fruiting,Mendocino,Ukiah,39.144787,-123.2056,3238,,,cch2,urn:uuid:eada0368-1ec3-478e-bf14-050655a49a5f,http://cch2.org/portal/collections/individual/index.php?occid=3540511
3540512,UCJEPS,UC24216,,Nemophila menziesii,205099,4/21/1902,1902,4,21,111,Apr 21 1902,Flowering/Fruiting,Riverside,Gavilan,33.8037,-117.3779,2500,,,cch2,urn:uuid:b51359c1-86fb-445a-8b43-c6747491918a,http://cch2.org/portal/collections/individual/index.php?occid=3540512
3540557,UCJEPS,UC24214,,Nemophila menziesii,205099,4/13/1901,1901,4,13,103,Apr 13 1901,Flowering/Fruiting,Marin,Angel Island,37.86278,-122.43083,1658,,,cch2,urn:uuid:4e95d3c4-ecfd-4d88-8aaf-d3a203e8e37f,http://cch2.org/portal/collections/individual/index.php?occid=3540557
3540993,UCJEPS,UC449911,,Nemophila menziesii,205099,4/14/1917,1917,4,14,104,Apr 14 1917,Flowering/Fruiting,Placer,Lincoln,,,,,,cch2,urn:uuid:cf163034-e3fd-4266-bebf-a7f217f06f59,http://cch2.org/portal/collections/individual/index.php?occid=3540993
3542472,UCJEPS,UC702011,,Nemophila menziesii,205099,4/17/1943,1943,4,17,107,Apr 17 1943,Flowering/Fruiting,Riverside,on road to Elsinore 12 mi s Corona; s of Corona,33.7415,-117.4298,755,,,cch2,urn:uuid:56c6c0e4-bb98-4f92-952e-d10e9cc17a7c,http://cch2.org/portal/collections/individual/index.php?occid=3542472
3546389,UCJEPS,JEPS1481,,Nemophila menziesii,205099,4/21/1935,1935,4,21,111,Apr 21 1935,Flowering/Fruiting,San Diego,Oak Grove Valley Oak Grove Valley (e San Diego Co.),,,,838,2750 ft,cch2,urn:uuid:cc624a74-f744-4eab-b2fb-fe1db4ce9548,http://cch2.org/portal/collections/individual/index.php?occid=3546389
3547555,UCJEPS,JEPS110843,,Nemophila menziesii var. menziesii,205103,3/18/1997,1997,3,18,77,Mar 18 1997,Flowering/Fruiting,Napa,"Conn Valley Road, 4 mi E from Silverado Trail",,,,103,340 ft,cch2,urn:uuid:e276c782-2c90-421a-bff7-38ed6e817dfb,http://cch2.org/portal/collections/individual/index.php?occid=3547555
3548326,UCJEPS,JEPS104716,,Nemophila menziesii,205099,3/6/1938,1938,3,6,65,Mar 6 1938,Flowering/Fruiting,San Joaquin,"steep slope NE of Castle Rock, Corral Hollow, Mount Hamilton Range",,,,350,1150 ft,cch2,urn:uuid:36c163d3-a5f2-4cd7-8adc-74b3f8e3b4f0,http://cch2.org/portal/collections/individual/index.php?occid=3548326
3548538,UCJEPS,JEPS21155,,Nemophila menziesii,205099,4/27/1936,1936,4,27,118,Apr 27 1936,Flowering/Fruiting,Amador,"1/2 mi sw Sugar Loaf (sw of Plymouth); Jackson Quad., sw of Sugar, sw of Plymouth",38.4456,-120.8816,805,243,800 ft,cch2,urn:uuid:d0928b1f-08df-4a69-9919-a58c240afc3d,http://cch2.org/portal/collections/individual/index.php?occid=3548538
