specimen_number,date_new,year,month,day,DOY,sub_sp,county,locality,elev_m,lat,long,error_dist_m,georef_by,georef_notes,datum,source,id,repro,habitat,references,scored_by,notes,plant,Total,buds_1,flowers_2,spent_3,immature_4,mature_5,open_flr_present,frt_present,plant_PI
SD00010586,2/17/2012,2012,2,17,48,integrifolia,San Diego,Border Field State Park: west of San Ysidro border crossing; south of Monument Road; just north of the USA/Mexico border fence; east-facing lower slope of Bunker Hill,85,32.5365,-117.10306,,,,WGS84,cch2,500269,FFL,some clay soils,http://cch2.org/portal/collections/individual/index.php?occid=500269,"CPA, DC",Third plant from left on top row; first two not included,1,Total,1,1,0,0,0,,,1.5
SD00010586,2/17/2012,2012,2,17,48,integrifolia,San Diego,Border Field State Park: west of San Ysidro border crossing; south of Monument Road; just north of the USA/Mexico border fence; east-facing lower slope of Bunker Hill,85,32.5365,-117.10306,,,,WGS84,cch2,500269,FFL,some clay soils,http://cch2.org/portal/collections/individual/index.php?occid=500269,"CPA, DC",,2,Total,1,2,1,1,0,,,2.4
SD00010586,2/17/2012,2012,2,17,48,integrifolia,San Diego,Border Field State Park: west of San Ysidro border crossing; south of Monument Road; just north of the USA/Mexico border fence; east-facing lower slope of Bunker Hill,85,32.5365,-117.10306,,,,WGS84,cch2,500269,FFL,some clay soils,http://cch2.org/portal/collections/individual/index.php?occid=500269,"CPA, DC",,3,Total,0,1,0,0,0,,,2
SD00010586,2/17/2012,2012,2,17,48,integrifolia,San Diego,Border Field State Park: west of San Ysidro border crossing; south of Monument Road; just north of the USA/Mexico border fence; east-facing lower slope of Bunker Hill,85,32.5365,-117.10306,,,,WGS84,cch2,500269,FFL,some clay soils,http://cch2.org/portal/collections/individual/index.php?occid=500269,"CPA, DC",partially covered by label,4,Total,2,3,1,0,0,,,1.833333333
SD00010586,2/17/2012,2012,2,17,48,integrifolia,San Diego,Border Field State Park: west of San Ysidro border crossing; south of Monument Road; just north of the USA/Mexico border fence; east-facing lower slope of Bunker Hill,85,32.5365,-117.10306,,,,WGS84,cch2,500269,FFL,some clay soils,http://cch2.org/portal/collections/individual/index.php?occid=500269,"CPA, DC",,5,Total,3,2,1,0,0,,,1.666666667
SD00010586,2/17/2012,2012,2,17,48,integrifolia,San Diego,Border Field State Park: west of San Ysidro border crossing; south of Monument Road; just north of the USA/Mexico border fence; east-facing lower slope of Bunker Hill,85,32.5365,-117.10306,,,,WGS84,cch2,500269,FFL,some clay soils,http://cch2.org/portal/collections/individual/index.php?occid=500269,"CPA, DC",,6,Total,2,2,0,1,0,,,2
SD00010586,2/17/2012,2012,2,17,48,integrifolia,San Diego,Border Field State Park: west of San Ysidro border crossing; south of Monument Road; just north of the USA/Mexico border fence; east-facing lower slope of Bunker Hill,85,32.5365,-117.10306,,,,WGS84,cch2,500269,FFL,some clay soils,http://cch2.org/portal/collections/individual/index.php?occid=500269,"CPA, DC",Rightmost plant on second row; plant on very bottom not included,7,Total,4,3,1,0,0,,,1.625
SD00010592,4/11/2008,2008,4,11,102,integrifolia,San Diego,"Border Field State Park, at the eastern base of Bunker Hill, south of city of Imperial Beach. South Mesa, flat area just north of US/Mexico Border fence, 1 mi E of Pacific Ocean and about .1 mi NW of Border Monument 257",70,32.53722,-117.105,,,,WGS84,cch2,500286,FL,marine sediment,http://cch2.org/portal/collections/individual/index.php?occid=500286,"CPA, DC",,1,Total,3,0,4,2,2,,,3
SD00010634,3/14/2008,2008,3,14,74,integrifolia,San Diego,"Border Field State Park, bottom of east facing slope, south towards the border fence, about 1.3 mi east of Pacific Ocean and .15 miles northeast of Border Monument #257",27,32.5375,-117.10194,,,,WGS84,cch2,500242,FL,marine sediment,http://cch2.org/portal/collections/individual/index.php?occid=500242,"CPA, DC",No full plants,NA,,,,,,,,,#DIV/0!
SD00010554,4/28/1936,1936,4,28,119,integrifolia,San Diego,Near Monument School,9.07,32.54362,-117.08315,402,,,WGS84,cch2,500058,FFL,,http://cch2.org/portal/collections/individual/index.php?occid=500058,"CPA, DC",,1,Total,16,7,4,5,0,,,1.9375
SD00010554,4/28/1936,1936,4,28,119,integrifolia,San Diego,Near Monument School,9.07,32.54362,-117.08315,402,,,WGS84,cch2,500058,FFL,,http://cch2.org/portal/collections/individual/index.php?occid=500058,"CPA, DC",,2,Total,15,25,6,4,3,,,2.150943396
OBI106058,5/18/1954,1954,5,18,138,integrifolia,San Diego,"On grade along State hwy 94, 5.5 mi W of Campo and 3.8 mi E of Potrero",732,32.5962,-116.545,805,,,WGS84,cch2,196221,,One year old burn,http://cch2.org/portal/collections/individual/index.php?occid=196221,"CPA, DC",See image file for plant numbers,1,Total,12,8,5,6,7,,,2.684210526
OBI106058,5/18/1954,1954,5,18,138,integrifolia,San Diego,"On grade along State hwy 94, 5.5 mi W of Campo and 3.8 mi E of Potrero",732,32.5962,-116.545,805,,,WGS84,cch2,196221,,One year old burn,http://cch2.org/portal/collections/individual/index.php?occid=196221,"CPA, DC",,2,Total,0,0,0,0,9,,,5
OBI106058,5/18/1954,1954,5,18,138,integrifolia,San Diego,"On grade along State hwy 94, 5.5 mi W of Campo and 3.8 mi E of Potrero",732,32.5962,-116.545,805,,,WGS84,cch2,196221,,One year old burn,http://cch2.org/portal/collections/individual/index.php?occid=196221,"CPA, DC",,3,Total,3,6,3,4,17,,,3.787878788
OBI106058,5/18/1954,1954,5,18,138,integrifolia,San Diego,"On grade along State hwy 94, 5.5 mi W of Campo and 3.8 mi E of Potrero",732,32.5962,-116.545,805,,,WGS84,cch2,196221,,One year old burn,http://cch2.org/portal/collections/individual/index.php?occid=196221,"CPA, DC",,4,Total,2,5,9,10,27,,,4.037735849
OBI106058,5/18/1954,1954,5,18,138,integrifolia,San Diego,"On grade along State hwy 94, 5.5 mi W of Campo and 3.8 mi E of Potrero",732,32.5962,-116.545,805,,,WGS84,cch2,196221,,One year old burn,http://cch2.org/portal/collections/individual/index.php?occid=196221,"CPA, DC",,5,Total,5,4,0,2,0,,,1.909090909
SD00010556,4/3/1935,1935,4,3,93,integrifolia,San Diego,Near Tecate Junction on Potrero Grade,564.12,32.59816,-116.64312,805,,,WGS84,cch2,500049,FL,,http://cch2.org/portal/collections/individual/index.php?occid=500049,"CPA, DC","Very blurry, too blurry to score; low-res image",NA,,,,,,,,,#DIV/0!
SD00010611,5/22/1941,1941,5,22,142,integrifolia,San Diego,Burn between Campo and Canyon City,708.61,32.5987,-116.50384,3218,,,WGS84,cch2,500079,FFL,,http://cch2.org/portal/collections/individual/index.php?occid=500079,"CPA, DC",,1,Total,1,0,11,20,28,,,4.233333333
SD00008034,5/14/1983,1983,5,14,134,menziesii,Imperial,"In-Ko-Pah Mountains, south of I-8. (IPB 10/07)",1158,32.63057,-116.0937,241,,,WGS84,cch2,500148,FL,"Damp, sandy d.g.",http://cch2.org/portal/collections/individual/index.php?occid=500148,"CPA, DC",,1,Total,2,2,4,6,0,,,3
SD00008034,5/14/1983,1983,5,14,134,menziesii,Imperial,"In-Ko-Pah Mountains, south of I-8. (IPB 10/07)",1158,32.63057,-116.0937,241,,,WGS84,cch2,500148,FL,"Damp, sandy d.g.",http://cch2.org/portal/collections/individual/index.php?occid=500148,"CPA, DC",,2,Total,0,1,1,0,0,,,2.5
SD00008034,5/14/1983,1983,5,14,134,menziesii,Imperial,"In-Ko-Pah Mountains, south of I-8. (IPB 10/07)",1158,32.63057,-116.0937,241,,,WGS84,cch2,500148,FL,"Damp, sandy d.g.",http://cch2.org/portal/collections/individual/index.php?occid=500148,"CPA, DC",,3,Total,0,1,1,0,0,,,2.5
SD00008034,5/14/1983,1983,5,14,134,menziesii,Imperial,"In-Ko-Pah Mountains, south of I-8. (IPB 10/07)",1158,32.63057,-116.0937,241,,,WGS84,cch2,500148,FL,"Damp, sandy d.g.",http://cch2.org/portal/collections/individual/index.php?occid=500148,"CPA, DC",,4,Total,0,1,1,1,0,,,3
SD00008033,3/16/2001,2001,3,16,75,integrifolia,Imperial,"Jacumba Natural Area, In-Ko-Pah Mountains, near Smuggler's Cove. (IPB 10/07)",1046,32.63482,-116.09537,241,,,WGS84,cch2,500176,FL,,http://cch2.org/portal/collections/individual/index.php?occid=500176,"CPA, DC",,1,Total,2,0,0,1,0,,,2
SD00008033,3/16/2001,2001,3,16,75,integrifolia,Imperial,"Jacumba Natural Area, In-Ko-Pah Mountains, near Smuggler's Cove. (IPB 10/07)",1046,32.63482,-116.09537,241,,,WGS84,cch2,500176,FL,,http://cch2.org/portal/collections/individual/index.php?occid=500176,"CPA, DC",,2,Total,3,1,2,0,0,,,1.833333333
SD00008033,3/16/2001,2001,3,16,75,integrifolia,Imperial,"Jacumba Natural Area, In-Ko-Pah Mountains, near Smuggler's Cove. (IPB 10/07)",1046,32.63482,-116.09537,241,,,WGS84,cch2,500176,FL,,http://cch2.org/portal/collections/individual/index.php?occid=500176,"CPA, DC",second from right (rightmost is a clipping),3,Total,2,1,0,0,0,,,1.333333333
SD00010534,4/19/2003,2003,4,19,109,integrifolia,San Diego,Boulevard - Garza Property near Shasta Lane - Location 1- near graded area at southwestern edge of property.,1123,32.63889,-116.34556,,,,WGS84,cch2,500184,FL,Granitic,http://cch2.org/portal/collections/individual/index.php?occid=500184,"CPA, DC",Plants labelled on image,1,Total,6,8,3,0,8,,,2.84
SD00010534,4/19/2003,2003,4,19,109,integrifolia,San Diego,Boulevard - Garza Property near Shasta Lane - Location 1- near graded area at southwestern edge of property.,1123,32.63889,-116.34556,,,,WGS84,cch2,500184,FL,Granitic,http://cch2.org/portal/collections/individual/index.php?occid=500184,"CPA, DC",,2,Total,3,4,2,1,3,,,2.769230769
SD00010534,4/19/2003,2003,4,19,109,integrifolia,San Diego,Boulevard - Garza Property near Shasta Lane - Location 1- near graded area at southwestern edge of property.,1123,32.63889,-116.34556,,,,WGS84,cch2,500184,FL,Granitic,http://cch2.org/portal/collections/individual/index.php?occid=500184,"CPA, DC",,3,Total,2,6,3,0,2,,,2.538461538
SD00010534,4/19/2003,2003,4,19,109,integrifolia,San Diego,Boulevard - Garza Property near Shasta Lane - Location 1- near graded area at southwestern edge of property.,1123,32.63889,-116.34556,,,,WGS84,cch2,500184,FL,Granitic,http://cch2.org/portal/collections/individual/index.php?occid=500184,"CPA, DC",,4,Total,0,6,1,1,2,,,2.9
SD00010534,4/19/2003,2003,4,19,109,integrifolia,San Diego,Boulevard - Garza Property near Shasta Lane - Location 1- near graded area at southwestern edge of property.,1123,32.63889,-116.34556,,,,WGS84,cch2,500184,FL,Granitic,http://cch2.org/portal/collections/individual/index.php?occid=500184,"CPA, DC",,5,Total,4,2,2,2,1,,,2.454545455
SD00010538,5/16/1941,1941,5,16,136,integrifolia,San Diego,Campo Boulevard highway,976.99,32.65127,-116.38252,11263,,,WGS84,cch2,500082,FFL,,http://cch2.org/portal/collections/individual/index.php?occid=500082,"CPA, DC","Extremely dense; could be multiple plants. Good job scoring this one, but can skip super dense plants like this in future",1,Total,28,32,21,34,48,,,3.257668712
SD00010547,3/23/1935,1935,3,23,82,integrifolia,Imperial,"Boulder Park on Highway 80, top of Mountain Springs Grade",892.39,32.6589,-116.1008,644,,,WGS84,cch2,500048,FL,,http://cch2.org/portal/collections/individual/index.php?occid=500048,"CPA, DC",,1,Total,4,1,1,1,1,,,2.25
SD00010545,4/29/2003,2003,4,29,119,integrifolia,San Diego,"Walker Canyon Ecological Reserve: between Boulevard and Jacumba on the north side of Interstate 8, along arroyo bottom near stream",870,32.66361,-116.22167,,,,WGS84,cch2,500187,FFL,granitic substrates,http://cch2.org/portal/collections/individual/index.php?occid=500187,"CPA, DC",Larger on left side,1,Total,3,0,0,3,13,,,4.210526316
SD00010612,5/18/1938,1938,5,18,138,integrifolia,San Diego,Burn at Boulevarde,1019.72,32.66367,-116.27363,1609,,,WGS84,cch2,500070,FFL,,http://cch2.org/portal/collections/individual/index.php?occid=500070,"CPA, DC",Top,1,Total,11,20,2,7,3,,,2.325581395
SD00010612,5/18/1938,1938,5,18,138,integrifolia,San Diego,Burn at Boulevarde,1019.72,32.66367,-116.27363,1609,,,WGS84,cch2,500070,FFL,,http://cch2.org/portal/collections/individual/index.php?occid=500070,"CPA, DC",Bottom,2,Total,2,5,3,10,19,,,4
RSA0011369,3/16/2013,2013,3,16,75,,San Diego County,The Jacumba Mountains; north side of Table Mountain.,1033,32.6639,-116.14568,,,,NAD83,cch2,1231699,,"Open valley floor with granitic boulder piles with Juniperus, Yucca whipplei, Ericameria cooperi, Rhus ilicifolia, Rhus ovata, Eriogonum fasciculatum, Simmondsia chinensis, Salvia apiana, Opuntia wolfii, Opuntia chlorotica, Atriplex canescens, Lotus haydonii, Mimulus aridus, ect.",http://cch2.org/portal/collections/individual/index.php?occid=1231699,"CPA, DC",Plants labelled on image,1,Total,3,0,0,1,0,,,1.75
RSA0011369,3/16/2013,2013,3,16,75,,San Diego County,The Jacumba Mountains; north side of Table Mountain.,1033,32.6639,-116.14568,,,,NAD83,cch2,1231699,,"Open valley floor with granitic boulder piles with Juniperus, Yucca whipplei, Ericameria cooperi, Rhus ilicifolia, Rhus ovata, Eriogonum fasciculatum, Simmondsia chinensis, Salvia apiana, Opuntia wolfii, Opuntia chlorotica, Atriplex canescens, Lotus haydonii, Mimulus aridus, ect.",http://cch2.org/portal/collections/individual/index.php?occid=1231699,"CPA, DC",Plants labelled on image,2,Total,2,0,0,1,0,,,2
RSA0011369,3/16/2013,2013,3,16,75,,San Diego County,The Jacumba Mountains; north side of Table Mountain.,1033,32.6639,-116.14568,,,,NAD83,cch2,1231699,,"Open valley floor with granitic boulder piles with Juniperus, Yucca whipplei, Ericameria cooperi, Rhus ilicifolia, Rhus ovata, Eriogonum fasciculatum, Simmondsia chinensis, Salvia apiana, Opuntia wolfii, Opuntia chlorotica, Atriplex canescens, Lotus haydonii, Mimulus aridus, ect.",http://cch2.org/portal/collections/individual/index.php?occid=1231699,"CPA, DC",Plants labelled on image,3,Total,1,1,1,0,1,,,2.75
RSA0011369,3/16/2013,2013,3,16,75,,San Diego County,The Jacumba Mountains; north side of Table Mountain.,1033,32.6639,-116.14568,,,,NAD83,cch2,1231699,,"Open valley floor with granitic boulder piles with Juniperus, Yucca whipplei, Ericameria cooperi, Rhus ilicifolia, Rhus ovata, Eriogonum fasciculatum, Simmondsia chinensis, Salvia apiana, Opuntia wolfii, Opuntia chlorotica, Atriplex canescens, Lotus haydonii, Mimulus aridus, ect.",http://cch2.org/portal/collections/individual/index.php?occid=1231699,"CPA, DC",Plants labelled on image,4,Total,0,0,0,0,0,,,#DIV/0!
RSA0011369,3/16/2013,2013,3,16,75,,San Diego County,The Jacumba Mountains; north side of Table Mountain.,1033,32.6639,-116.14568,,,,NAD83,cch2,1231699,,"Open valley floor with granitic boulder piles with Juniperus, Yucca whipplei, Ericameria cooperi, Rhus ilicifolia, Rhus ovata, Eriogonum fasciculatum, Simmondsia chinensis, Salvia apiana, Opuntia wolfii, Opuntia chlorotica, Atriplex canescens, Lotus haydonii, Mimulus aridus, ect.",http://cch2.org/portal/collections/individual/index.php?occid=1231699,"CPA, DC",Plants labelled on image,5,Total,0,1,0,0,1,,,3.5
SD00010582,4/24/2012,2012,4,24,115,integrifolia,San Diego,Mountain Warfare Training Camp Michael Monsoor: La Posta area; east of Morena Reservoir and west of La Posta Road; along a dirt road,970,32.66724,-116.4419,,,,WGS84,cch2,500282,FFL,granitic substrates,http://cch2.org/portal/collections/individual/index.php?occid=500282,"CPA, DC",Top,1,Total,16,17,21,12,22,,,3.079545455
SD00010582,4/24/2012,2012,4,24,115,integrifolia,San Diego,Mountain Warfare Training Camp Michael Monsoor: La Posta area; east of Morena Reservoir and west of La Posta Road; along a dirt road,970,32.66724,-116.4419,,,,WGS84,cch2,500282,FFL,granitic substrates,http://cch2.org/portal/collections/individual/index.php?occid=500282,"CPA, DC",Bottom left,2,Total,3,4,1,3,1,,,2.583333333
SD00010582,4/24/2012,2012,4,24,115,integrifolia,San Diego,Mountain Warfare Training Camp Michael Monsoor: La Posta area; east of Morena Reservoir and west of La Posta Road; along a dirt road,970,32.66724,-116.4419,,,,WGS84,cch2,500282,FFL,granitic substrates,http://cch2.org/portal/collections/individual/index.php?occid=500282,"CPA, DC",Bottom right,3,Total,4,7,5,4,2,,,2.681818182
SD00010639,3/20/2007,2007,3,20,79,integrifolia,San Diego,"Bratton Valley, land surrounding 18569 Deerhorn Valley Rd, 3 mi N of Dulzura, 2.5 mi SE of Lyons Peak summit, ½ mi. SE of inters of Honey Springs Rd & Deerhorn Valley Rd.",656,32.67444,-116.74806,,,,WGS84,cch2,500226,FL,Decomposed granite soil. Afternoon shade.,http://cch2.org/portal/collections/individual/index.php?occid=500226,"CPA, DC",Top left,1,Total,5,1,1,0,0,,,1.428571429
SD00010639,3/20/2007,2007,3,20,79,integrifolia,San Diego,"Bratton Valley, land surrounding 18569 Deerhorn Valley Rd, 3 mi N of Dulzura, 2.5 mi SE of Lyons Peak summit, ½ mi. SE of inters of Honey Springs Rd & Deerhorn Valley Rd.",656,32.67444,-116.74806,,,,WGS84,cch2,500226,FL,Decomposed granite soil. Afternoon shade.,http://cch2.org/portal/collections/individual/index.php?occid=500226,"CPA, DC",Top right,2,Total,6,3,0,0,0,,,1.333333333
SD00010639,3/20/2007,2007,3,20,79,integrifolia,San Diego,"Bratton Valley, land surrounding 18569 Deerhorn Valley Rd, 3 mi N of Dulzura, 2.5 mi SE of Lyons Peak summit, ½ mi. SE of inters of Honey Springs Rd & Deerhorn Valley Rd.",656,32.67444,-116.74806,,,,WGS84,cch2,500226,FL,Decomposed granite soil. Afternoon shade.,http://cch2.org/portal/collections/individual/index.php?occid=500226,"CPA, DC",bottom left,3,Total,4,0,1,0,0,,,1.4
SD00010638,3/1/2007,2007,3,1,60,integrifolia,San Diego,"Cleveland National Forest, in Morena Village, W of Lake Morena Drive, E of Lupine Drive, S of Cleveland Forest Drive.",963,32.67636,-116.51032,,,,WGS84,cch2,500232,FL,"Fine loose sand, no rocks.",http://cch2.org/portal/collections/individual/index.php?occid=500232,"CPA, DC",Left,1,Total,7,3,2,0,1,,,1.846153846
SD00010638,3/1/2007,2007,3,1,60,integrifolia,San Diego,"Cleveland National Forest, in Morena Village, W of Lake Morena Drive, E of Lupine Drive, S of Cleveland Forest Drive.",963,32.67636,-116.51032,,,,WGS84,cch2,500232,FL,"Fine loose sand, no rocks.",http://cch2.org/portal/collections/individual/index.php?occid=500232,"CPA, DC",Center,2,Total,5,9,5,1,0,,,2.1
SD00010638,3/1/2007,2007,3,1,60,integrifolia,San Diego,"Cleveland National Forest, in Morena Village, W of Lake Morena Drive, E of Lupine Drive, S of Cleveland Forest Drive.",963,32.67636,-116.51032,,,,WGS84,cch2,500232,FL,"Fine loose sand, no rocks.",http://cch2.org/portal/collections/individual/index.php?occid=500232,"CPA, DC",Right,3,Total,4,3,0,1,0,,,1.75
SD00010656,1/20/2005,2005,1,20,20,integrifolia,San Diego,"Rancho Jamul Ecological Reserve (California Dept. of Fish & Game): west of Hwy. 94, south of Jamul & north of Otay Lakes Road; central part of reserve just west of the main buildings, northeast-facing rocky slope",270,32.67861,-116.86,,,,WGS84,cch2,500195,FFL,some clay soils with granite boulders,http://cch2.org/portal/collections/individual/index.php?occid=500195,"CPA, DC",top left; blurry image,1,Total,3,6,1,0,0,,,1.8
SD00010656,1/20/2005,2005,1,20,20,integrifolia,San Diego,"Rancho Jamul Ecological Reserve (California Dept. of Fish & Game): west of Hwy. 94, south of Jamul & north of Otay Lakes Road; central part of reserve just west of the main buildings, northeast-facing rocky slope",270,32.67861,-116.86,,,,WGS84,cch2,500195,FFL,some clay soils with granite boulders,http://cch2.org/portal/collections/individual/index.php?occid=500195,"CPA, DC",bottom left; largest plant; blurry image,2,Total,9,8,5,0,0,,,1.818181818
SD00010526,5/12/2017,2017,5,12,132,integrifolia,San Diego,Cleveland National Forest: Barber Mountain area: west of Barrett Lake and southeast of the junction of Honey Springs Road and Lyons Valley Road; along Forest Rte. 17S10/Barber Mountain Road; along stream in rocky canyon,700,32.68267,-116.69306,,,,WGS84,cch2,500330,FFL,granite substrates,http://cch2.org/portal/collections/individual/index.php?occid=500330,"DG, SA",top-right; specimens on this sheet dark,1,Total,5,8,3,7,10,,,3.272727273
SD00010526,5/12/2017,2017,5,12,132,integrifolia,San Diego,Cleveland National Forest: Barber Mountain area: west of Barrett Lake and southeast of the junction of Honey Springs Road and Lyons Valley Road; along Forest Rte. 17S10/Barber Mountain Road; along stream in rocky canyon,700,32.68267,-116.69306,,,,WGS84,cch2,500330,FFL,granite substrates,http://cch2.org/portal/collections/individual/index.php?occid=500330,"DG, SA",large plant bottom left,2,Total,14,20,6,17,12,,,2.898550725
SD00010646,4/21/2008,2008,4,21,112,integrifolia,San Diego,"Hauser Wilderness: Cleveland National Forest; W of Morena Reservoir, at Bronco Flats just S of Skye Valley Road",995,32.69457,-116.56417,,,,WGS84,cch2,500220,FFL,mostly granitic substrates,http://cch2.org/portal/collections/individual/index.php?occid=500220,"DG, SA","EXCLUDE. specimen blurry, may underestimate actual number of buds. Left plant appears to be one whole specimen, but it's possible there are loose branches within. Plant on left has multiple plants, did not score",NA,,,,,,,,,#DIV/0!
SD00010635,3/23/2008,2008,3,23,83,integrifolia,San Diego,"Cleveland National Forest, Lake Morena area, .9 mi NNW of Morena Village and about 1 mi WNW of intersection of Highway S-1 and Oak Dr.",942,32.69463,-116.50762,,,,WGS84,cch2,500243,FL,Decomposed granite & scattered boulders.,http://cch2.org/portal/collections/individual/index.php?occid=500243,"DG, SA",top left,1,Total,2,2,0,0,0,,,1.5
SD00010635,3/23/2008,2008,3,23,83,integrifolia,San Diego,"Cleveland National Forest, Lake Morena area, .9 mi NNW of Morena Village and about 1 mi WNW of intersection of Highway S-1 and Oak Dr.",942,32.69463,-116.50762,,,,WGS84,cch2,500243,FL,Decomposed granite & scattered boulders.,http://cch2.org/portal/collections/individual/index.php?occid=500243,"DG, SA",top right,2,Total,1,2,1,0,0,,,2
SD00010635,3/23/2008,2008,3,23,83,integrifolia,San Diego,"Cleveland National Forest, Lake Morena area, .9 mi NNW of Morena Village and about 1 mi WNW of intersection of Highway S-1 and Oak Dr.",942,32.69463,-116.50762,,,,WGS84,cch2,500243,FL,Decomposed granite & scattered boulders.,http://cch2.org/portal/collections/individual/index.php?occid=500243,"DG, SA",bottom left,3,Total,2,3,0,0,0,,,1.6
SD00010635,3/23/2008,2008,3,23,83,integrifolia,San Diego,"Cleveland National Forest, Lake Morena area, .9 mi NNW of Morena Village and about 1 mi WNW of intersection of Highway S-1 and Oak Dr.",942,32.69463,-116.50762,,,,WGS84,cch2,500243,FL,Decomposed granite & scattered boulders.,http://cch2.org/portal/collections/individual/index.php?occid=500243,"DG, SA",bottom right,4,Total,2,2,0,0,0,,,1.5
SD00010578,5/9/1937,1937,5,9,129,integrifolia,San Diego,Lyons Valley,707.24,32.71175,-116.75089,1609,,,WGS84,cch2,500062,FFL,,http://cch2.org/portal/collections/individual/index.php?occid=500062,"DG, SA","No whole plants, maybe not menziesii",NA,,,,,,,,,#DIV/0!
SD00010600,4/9/2005,2005,4,9,99,integrifolia,San Diego,"Corral Canyon: Cleveland National Forest; south of Los Pinos Mountain and northwest of Lake Morena, near the road for the OHV area",980,32.71417,-116.58694,,,,WGS84,cch2,500198,FFL,granitic substrates,http://cch2.org/portal/collections/individual/index.php?occid=500198,"DG, SA",Specimen kind of blurry. left,1,Total,6,10,4,10,5,,,2.942857143
SD00010600,4/9/2005,2005,4,9,99,integrifolia,San Diego,"Corral Canyon: Cleveland National Forest; south of Los Pinos Mountain and northwest of Lake Morena, near the road for the OHV area",980,32.71417,-116.58694,,,,WGS84,cch2,500198,FFL,granitic substrates,http://cch2.org/portal/collections/individual/index.php?occid=500198,"DG, SA",middle. Unsure if immature or mature fruit,2,Total,1,0,4,2,0,,,3
SD00010600,4/9/2005,2005,4,9,99,integrifolia,San Diego,"Corral Canyon: Cleveland National Forest; south of Los Pinos Mountain and northwest of Lake Morena, near the road for the OHV area",980,32.71417,-116.58694,,,,WGS84,cch2,500198,FFL,granitic substrates,http://cch2.org/portal/collections/individual/index.php?occid=500198,"DG, SA",right. Several structures hidden behind leaves not scored,3,Total,6,4,4,4,3,,,2.714285714
SD00010468,3/24/1935,1935,3,24,83,,San Diego,East of Jamul,441.67,32.71452,-116.83958,,,,WGS84,cch2,500144,FL,,http://cch2.org/portal/collections/individual/index.php?occid=500144,DG,"Old, slightly blurry. Top right, long roots assumed to be apart of the same plant. Could be underestimating buds, other structures…",1,Total,9,17,2,1,0,,,1.827586207
SD00010468,3/24/1935,1935,3,24,83,,San Diego,East of Jamul,441.67,32.71452,-116.83958,,,,WGS84,cch2,500144,FL,,http://cch2.org/portal/collections/individual/index.php?occid=500144,DG,bottom left,2,Total,10,9,0,0,0,,,1.473684211
SD00010519,3/20/2010,2010,3,20,79,integrifolia,San Diego,Rancho San Diego; N side of San Miguel Mountain; along Millar Ranch Road; 0.8 miles SE of intersection with Highway 94 (Campo Road); 45 yds W of Millar Ranch Road on rock bench in seasonal creek,203,32.72141,-116.93084,,,,WGS84,cch2,500338,FL,"Granitic, rock bench in creekbed",http://cch2.org/portal/collections/individual/index.php?occid=500338,DG,"Top left. Plants slightly blurry. Upper rightmost plant has additional root, did not score",1,Total,3,4,1,3,1,,,2.583333333
SD00010516,4/11/2010,2010,4,11,101,integrifolia,San Diego,"Cleveland National Forest near Cameron Fire Station, just north of 1-8 and Kitchen Creek Road. 300meters WNW of fire station",1005,32.722,-116.4687,,,,WGS84,cch2,500341,FFL,Gravelly sandy soil,http://cch2.org/portal/collections/individual/index.php?occid=500341,DG,"middle row, left",2,Total,4,2,1,1,0,,,1.875
SD00010516,4/11/2010,2010,4,11,101,integrifolia,San Diego,"Cleveland National Forest near Cameron Fire Station, just north of 1-8 and Kitchen Creek Road. 300meters WNW of fire station",1005,32.722,-116.4687,,,,WGS84,cch2,500341,FFL,Gravelly sandy soil,http://cch2.org/portal/collections/individual/index.php?occid=500341,DG,middle middle,3,Total,5,5,4,6,2,,,2.772727273
SD00010516,4/11/2010,2010,4,11,101,integrifolia,San Diego,"Cleveland National Forest near Cameron Fire Station, just north of 1-8 and Kitchen Creek Road. 300meters WNW of fire station",1005,32.722,-116.4687,,,,WGS84,cch2,500341,FFL,Gravelly sandy soil,http://cch2.org/portal/collections/individual/index.php?occid=500341,DG,lower left,4,Total,3,1,1,2,0,,,2.285714286
SD00010516,4/11/2010,2010,4,11,101,integrifolia,San Diego,"Cleveland National Forest near Cameron Fire Station, just north of 1-8 and Kitchen Creek Road. 300meters WNW of fire station",1005,32.722,-116.4687,,,,WGS84,cch2,500341,FFL,Gravelly sandy soil,http://cch2.org/portal/collections/individual/index.php?occid=500341,DG,lower middle,5,Total,0,1,1,0,0,,,2.5
SD00010516,4/11/2010,2010,4,11,101,integrifolia,San Diego,"Cleveland National Forest near Cameron Fire Station, just north of 1-8 and Kitchen Creek Road. 300meters WNW of fire station",1005,32.722,-116.4687,,,,WGS84,cch2,500341,FFL,Gravelly sandy soil,http://cch2.org/portal/collections/individual/index.php?occid=500341,DG,lower right,6,Total,2,2,1,1,0,,,2.166666667
SD00010619,4/24/2010,2010,4,24,114,integrifolia,San Diego,Rancho San Diego; US Fish & Wildlife Refuge; N side of San Miguel Mountain; W of Millar Ranch Road; 0.37 miles SSW of junction with Highway 94 (Campo Road),125,32.72604,-116.94038,,,,WGS84,cch2,500325,FFL,"Granitic, near sandy bike path",http://cch2.org/portal/collections/individual/index.php?occid=500325,"DG, SA","top left, many of these were clippings",1,Total,2,0,1,0,0,,,1.666666667
SD00010619,4/24/2010,2010,4,24,114,integrifolia,San Diego,Rancho San Diego; US Fish & Wildlife Refuge; N side of San Miguel Mountain; W of Millar Ranch Road; 0.37 miles SSW of junction with Highway 94 (Campo Road),125,32.72604,-116.94038,,,,WGS84,cch2,500325,FFL,"Granitic, near sandy bike path",http://cch2.org/portal/collections/individual/index.php?occid=500325,"DG, SA","top right, extends until it twits with another plant",2,Total,5,3,4,7,7,,,3.307692308
SD00010619,4/24/2010,2010,4,24,114,integrifolia,San Diego,Rancho San Diego; US Fish & Wildlife Refuge; N side of San Miguel Mountain; W of Millar Ranch Road; 0.37 miles SSW of junction with Highway 94 (Campo Road),125,32.72604,-116.94038,,,,WGS84,cch2,500325,FFL,"Granitic, near sandy bike path",http://cch2.org/portal/collections/individual/index.php?occid=500325,"DG, SA","bottom left that has a long, curved root",3,Total,1,2,1,4,4,,,3.666666667
SD00010619,4/24/2010,2010,4,24,114,integrifolia,San Diego,Rancho San Diego; US Fish & Wildlife Refuge; N side of San Miguel Mountain; W of Millar Ranch Road; 0.37 miles SSW of junction with Highway 94 (Campo Road),125,32.72604,-116.94038,,,,WGS84,cch2,500325,FFL,"Granitic, near sandy bike path",http://cch2.org/portal/collections/individual/index.php?occid=500325,"DG, SA",bottom right that has a straight root,4,Total,3,2,2,0,1,,,2.25
SD00010610,3/21/1938,1938,3,21,80,integrifolia,San Diego,near Cañon Road Pt. Loma,41.5,32.72802,-117.23979,1126,,,WGS84,cch2,500065,FL,,http://cch2.org/portal/collections/individual/index.php?occid=500065,DG,EXCLUDE! Blurry & messy,NA,,,,,,,,,#DIV/0!
SD00010625,5/6/2010,2010,5,6,126,integrifolia,San Diego,"Cleveland National Forest, Buckman Springs area; along Pacific Crest Trail, E of Interstate 8, about 1 mi NNW of junction with Kitchen Creek Road",975,32.7324,-116.4779,,,,WGS84,cch2,500267,FL,Decomposed granite sand & granitic boulders.,http://cch2.org/portal/collections/individual/index.php?occid=500267,"DG, SA",,1,Total,11,11,2,0,0,,,1.625
SD00010562,1884-01-23,1884,1,23,23,integrifolia,San Diego,San Diego,81.31,32.73409,-117.12945,9654,,,WGS84,cch2,500038,FL,,http://cch2.org/portal/collections/individual/index.php?occid=500038,"DG, SA",very small plants. top left,1,Total,0,1,0,0,0,,,2
SD00010562,1884-01-23,1884,1,23,23,integrifolia,San Diego,San Diego,81.31,32.73409,-117.12945,9654,,,WGS84,cch2,500038,FL,,http://cch2.org/portal/collections/individual/index.php?occid=500038,"DG, SA",top right,2,Total,0,0,1,0,0,,,3
SD00010562,1884-01-23,1884,1,23,23,integrifolia,San Diego,San Diego,81.31,32.73409,-117.12945,9654,,,WGS84,cch2,500038,FL,,http://cch2.org/portal/collections/individual/index.php?occid=500038,"DG, SA",bottom left. No visible structures,3,Total,0,0,0,0,0,,,#DIV/0!
SD00010562,1884-01-23,1884,1,23,23,integrifolia,San Diego,San Diego,81.31,32.73409,-117.12945,9654,,,WGS84,cch2,500038,FL,,http://cch2.org/portal/collections/individual/index.php?occid=500038,"DG, SA",bottom right,4,Total,1,0,0,0,0,,,1
SD00010653,3/25/2007,2007,3,25,84,integrifolia,San Diego,"Cleveland National Forest: Pine Creek Wilderness; north of Barrett Lake, southeast of Alpine; north of the Horsethief Canyon Trailhead on Lyons Valley Road, along a trail in the bottom of Horsethief Canyon; note that this area was partially burned in 2006",635,32.75472,-116.66222,,,,WGS84,cch2,500208,FFL,granitic substrates,http://cch2.org/portal/collections/individual/index.php?occid=500208,"DG,SA",Only scored top left,1,Total,4,2,2,2,0,,,2.2
SD00010549,4/16/1982,1982,4,16,106,integrifolia,San Diego,"Pine Valley, Corte Madera Ranch",1200,32.76409,-116.57253,1609,,,WGS84,cch2,500146,FL,,http://cch2.org/portal/collections/individual/index.php?occid=500146,"DG, SA",image was blurry; top left,1,Total,4,6,4,5,1,,,2.65
SD00010549,4/16/1982,1982,4,16,106,integrifolia,San Diego,"Pine Valley, Corte Madera Ranch",1200,32.76409,-116.57253,1609,,,WGS84,cch2,500146,FL,,http://cch2.org/portal/collections/individual/index.php?occid=500146,"DG, SA",top right,2,Total,4,4,2,2,0,,,2.166666667
SD00010549,4/16/1982,1982,4,16,106,integrifolia,San Diego,"Pine Valley, Corte Madera Ranch",1200,32.76409,-116.57253,1609,,,WGS84,cch2,500146,FL,,http://cch2.org/portal/collections/individual/index.php?occid=500146,"DG, SA",center,3,Total,8,7,2,3,0,,,2
SD00010549,4/16/1982,1982,4,16,106,integrifolia,San Diego,"Pine Valley, Corte Madera Ranch",1200,32.76409,-116.57253,1609,,,WGS84,cch2,500146,FL,,http://cch2.org/portal/collections/individual/index.php?occid=500146,"DG, SA",bottom left,4,Total,4,3,3,2,1,,,2.461538462
SD00010525,5/5/1994,1994,5,5,125,integrifolia,San Diego,"Corte Madera Ranch, west of Pine Valley. West of reservoir, along road edge in Long Valley, approx 1½ mi south of Bear Valley Rd.",1185,32.76818,-116.54245,,,,WGS84,cch2,500332,FFL,,http://cch2.org/portal/collections/individual/index.php?occid=500332,"DG,SA",,1,Total,11,11,2,0,0,,,1.625
SD00010511,2/1/2005,2005,2,1,32,integrifolia,San Diego,"Sycuan Peak Ecological Reserve (California Dept. of Fish & Game): southeast of Dehesa, southwest of Loveland Reservoir; on the lower north side of Sycuan Peak, just southwest of a wet spring area along Sloan Canyon Road",265,32.76889,-116.81278,,,,WGS84,cch2,500196,FL,granitic substrates,http://cch2.org/portal/collections/individual/index.php?occid=500196,"DG, SA",top left,1,Total,4,1,0,0,0,,,1.2
SD00010511,2/1/2005,2005,2,1,32,integrifolia,San Diego,"Sycuan Peak Ecological Reserve (California Dept. of Fish & Game): southeast of Dehesa, southwest of Loveland Reservoir; on the lower north side of Sycuan Peak, just southwest of a wet spring area along Sloan Canyon Road",265,32.76889,-116.81278,,,,WGS84,cch2,500196,FL,granitic substrates,http://cch2.org/portal/collections/individual/index.php?occid=500196,"DG, SA",top right,2,Total,2,1,0,0,0,,,1.333333333
SD00010511,2/1/2005,2005,2,1,32,integrifolia,San Diego,"Sycuan Peak Ecological Reserve (California Dept. of Fish & Game): southeast of Dehesa, southwest of Loveland Reservoir; on the lower north side of Sycuan Peak, just southwest of a wet spring area along Sloan Canyon Road",265,32.76889,-116.81278,,,,WGS84,cch2,500196,FL,granitic substrates,http://cch2.org/portal/collections/individual/index.php?occid=500196,"DG,SA",large plant in middle,3,Total,6,6,2,1,0,,,1.866666667
SD00010557,4/10/1938,1938,4,10,100,integrifolia,San Diego,Whispering Oaks near Sloane Ranch on Sweetwater River,295.17,32.77089,-116.7978,1609,,,WGS84,cch2,500066,FL,,http://cch2.org/portal/collections/individual/index.php?occid=500066,"DG,SA",EXCLUDE; too blurry,NA,,,,,,,,,#DIV/0!
SD00010530,4/20/1979,1979,4,20,110,integrifolia,San Diego,About 5 m east of stream in oak woodland in south end of Fred Canyon,1340,32.77323,-116.43462,402,,,WGS84,cch2,500147,FL,,http://cch2.org/portal/collections/individual/index.php?occid=500147,"DG, SA",,1,Total,6,7,4,2,0,,,2.105263158
SD00010530,4/20/1979,1979,4,20,110,integrifolia,San Diego,About 5 m east of stream in oak woodland in south end of Fred Canyon,1340,32.77323,-116.43462,402,,,WGS84,cch2,500147,FL,,http://cch2.org/portal/collections/individual/index.php?occid=500147,"DG, SA",top right,2,Total,1,3,1,1,0,,,2.333333333
SD00010530,4/20/1979,1979,4,20,110,integrifolia,San Diego,About 5 m east of stream in oak woodland in south end of Fred Canyon,1340,32.77323,-116.43462,402,,,WGS84,cch2,500147,FL,,http://cch2.org/portal/collections/individual/index.php?occid=500147,"DG,SA",,3,Total,0,2,2,1,0,,,2.8
SD00010530,4/20/1979,1979,4,20,110,integrifolia,San Diego,About 5 m east of stream in oak woodland in south end of Fred Canyon,1340,32.77323,-116.43462,402,,,WGS84,cch2,500147,FL,,http://cch2.org/portal/collections/individual/index.php?occid=500147,"DG,SA",,4,Total,2,4,1,1,0,,,2.125
SD00010566,5/26/1970,1970,5,26,146,integrifolia,San Diego,Pot-Hole Creek below Corte Madera Lake. Pine Valley,970,32.78736,-116.58513,1609,,,WGS84,cch2,500124,FFL,,http://cch2.org/portal/collections/individual/index.php?occid=500124,"DG,SA",Right one is a clipping; Plant 1 is top left,1,Total,0,1,3,0,4,,,3.875
SD00010566,5/26/1970,1970,5,26,146,integrifolia,San Diego,Pot-Hole Creek below Corte Madera Lake. Pine Valley,970,32.78736,-116.58513,1609,,,WGS84,cch2,500124,FFL,,http://cch2.org/portal/collections/individual/index.php?occid=500124,"DG,SA",Bottom left,2,Total,0,2,3,5,6,,,3.9375
SD00010597,4/21/2006,2006,4,21,111,integrifolia,San Diego,"Loveland Reservoir (land owned by the Sweetwater River Valley Authority): S of Alpine, S of Japatul Valley Road and E of its junction with Dehesa Rd.; extreme NE end of lake, S-side of valley on N-facing slope and along the south shore of the lake",415,32.79139,-116.75167,,,,WGS84,cch2,500201,FFL,mostly granitic substrates with some reddish clays,http://cch2.org/portal/collections/individual/index.php?occid=500201,SA,,1,Total,12,18,6,6,1,,,2.209302326
SD00010548,3/25/2004,2004,3,25,85,integrifolia,San Diego,"4 miles south of pine valley, bear valley rd. 1 mile east of corte madera rd.",1236,32.79583,-116.55,,,,WGS84,cch2,500190,FL,granite,http://cch2.org/portal/collections/individual/index.php?occid=500190,SA,EXCLUDE; blurry,NA,,,,,,,,,#DIV/0!
SD00010524,5/2/1994,1994,5,2,122,integrifolia,San Diego,"Meadow north of small reservoir, south-east of Corte Madera Valley. North-west of Pine Valley",1151,32.80635,-116.54912,,,,WGS84,cch2,500331,FFL,,http://cch2.org/portal/collections/individual/index.php?occid=500331,SA,,1,Total,9,10,5,11,9,,,3.022727273
SD00010607,4/23/1936,1936,4,23,114,integrifolia,San Diego,burn in Habison Canyon,243.86,32.81302,-116.83831,2414,,,WGS84,cch2,500057,FFL,,http://cch2.org/portal/collections/individual/index.php?occid=500057,SA,One of these is a clipping,1,Total,17,33,17,28,16,,,2.936936937
SD00010654,3/10/2005,2005,3,10,69,integrifolia,San Diego,"4 mi SE of Alpine. Lucky Light Ranch (inholding in Cleveland National Forest) off of Bell Bluff Truck Trail, ~1 mi E of Bell Bluff, south of Sweetwater River",894,32.814,-116.672,,,,WGS84,cch2,500197,FL,,http://cch2.org/portal/collections/individual/index.php?occid=500197,SA,Leftmost,1,Total,2,2,0,0,0,,,1.5
SD00010654,3/10/2005,2005,3,10,69,integrifolia,San Diego,"4 mi SE of Alpine. Lucky Light Ranch (inholding in Cleveland National Forest) off of Bell Bluff Truck Trail, ~1 mi E of Bell Bluff, south of Sweetwater River",894,32.814,-116.672,,,,WGS84,cch2,500197,FL,,http://cch2.org/portal/collections/individual/index.php?occid=500197,SA,middle,2,Total,0,1,0,0,0,,,2
SD00010654,3/10/2005,2005,3,10,69,integrifolia,San Diego,"4 mi SE of Alpine. Lucky Light Ranch (inholding in Cleveland National Forest) off of Bell Bluff Truck Trail, ~1 mi E of Bell Bluff, south of Sweetwater River",894,32.814,-116.672,,,,WGS84,cch2,500197,FL,,http://cch2.org/portal/collections/individual/index.php?occid=500197,SA,right,3,Total,1,2,0,1,0,,,2.25
SD00010591,3/30/2009,2009,3,30,89,integrifolia,San Diego,"Mission Trails Regional Park, .5 mi. southwest of trailhead at Big Rock Park on Mesa Road in Santee, about 1.0 mi W of Hwy 52.",162,32.8237,-117.0219,,,,WGS84,cch2,500285,FL,Red soil with occasional granitic outcrops,http://cch2.org/portal/collections/individual/index.php?occid=500285,SA,,1,Total,9,10,14,7,5,,,2.755555556
SD00010647,5/2/2006,2006,5,2,122,integrifolia,San Diego,"Descanso. Just N of I-8, ca. 1 1/3 mi E of its intersection with SR-79.",1098,32.8242,-116.6039,,,,WGS84,cch2,500215,FL,"decomposed granite, rock outcropings meadows",http://cch2.org/portal/collections/individual/index.php?occid=500215,SA,top,1,Total,8,21,13,6,0,,,2.354166667
SD00010647,5/2/2006,2006,5,2,122,integrifolia,San Diego,"Descanso. Just N of I-8, ca. 1 1/3 mi E of its intersection with SR-79.",1098,32.8242,-116.6039,,,,WGS84,cch2,500215,FL,"decomposed granite, rock outcropings meadows",http://cch2.org/portal/collections/individual/index.php?occid=500215,SA,bottom right,2,Total,4,7,11,0,0,,,2.318181818
SD00010602,1895-03-08,1895,3,8,67,integrifolia,San Diego,La Jolla,128.16,32.8332,-117.25881,3218,,,WGS84,cch2,500025,FL,,http://cch2.org/portal/collections/individual/index.php?occid=500025,SA,hard to separate them; top left,1,Total,1,1,0,0,0,,,1.5
SD00010602,1895-03-08,1895,3,8,67,integrifolia,San Diego,La Jolla,128.16,32.8332,-117.25881,3218,,,WGS84,cch2,500025,FL,,http://cch2.org/portal/collections/individual/index.php?occid=500025,SA,,2,Total,0,4,0,2,0,,,2.666666667
SD00010602,1895-03-08,1895,3,8,67,integrifolia,San Diego,La Jolla,128.16,32.8332,-117.25881,3218,,,WGS84,cch2,500025,FL,,http://cch2.org/portal/collections/individual/index.php?occid=500025,SA,,3,Total,0,4,1,0,0,,,2.2
SD00010602,1895-03-08,1895,3,8,67,integrifolia,San Diego,La Jolla,128.16,32.8332,-117.25881,3218,,,WGS84,cch2,500025,FL,,http://cch2.org/portal/collections/individual/index.php?occid=500025,SA,,4,Total,1,1,0,0,0,,,1.5
SD00010602,1895-03-08,1895,3,8,67,integrifolia,San Diego,La Jolla,128.16,32.8332,-117.25881,3218,,,WGS84,cch2,500025,FL,,http://cch2.org/portal/collections/individual/index.php?occid=500025,SA,bottom plant,5,Total,5,5,1,0,0,,,1.636363636
SD00010616,2/27/1935,1935,2,27,58,integrifolia,San Diego,North slope of Soledad Mt.,144.67,32.8442,-117.2525,644,,,WGS84,cch2,500045,FFL,,http://cch2.org/portal/collections/individual/index.php?occid=500045,SA,"Top row, second from the right",1,Total,0,2,1,1,1,,,3.2
SD00010616,2/27/1935,1935,2,27,58,integrifolia,San Diego,North slope of Soledad Mt.,144.67,32.8442,-117.2525,644,,,WGS84,cch2,500045,FFL,,http://cch2.org/portal/collections/individual/index.php?occid=500045,SA,top far right,2,Total,0,1,0,1,1,,,3.666666667
SD00010616,2/27/1935,1935,2,27,58,integrifolia,San Diego,North slope of Soledad Mt.,144.67,32.8442,-117.2525,644,,,WGS84,cch2,500045,FFL,,http://cch2.org/portal/collections/individual/index.php?occid=500045,SA,,3,Total,0,4,0,2,0,,,2.666666667
SD00010593,5/22/2004,2004,5,22,143,integrifolia,San Diego,"Laguna Mountains, Sunrise Highway, Kitchen Creek Truck Trail.",1562,32.8447,-116.4489,,,,WGS84,cch2,500179,FFL,Granitic with black topsoil.,http://cch2.org/portal/collections/individual/index.php?occid=500179,SA,,1,Total,2,4,3,3,5,,,3.294117647
SD00010593,5/22/2004,2004,5,22,143,integrifolia,San Diego,"Laguna Mountains, Sunrise Highway, Kitchen Creek Truck Trail.",1562,32.8447,-116.4489,,,,WGS84,cch2,500179,FFL,Granitic with black topsoil.,http://cch2.org/portal/collections/individual/index.php?occid=500179,SA,,2,Total,0,9,6,10,9,,,3.558823529
SD00010520,5/6/2011,2011,5,6,126,integrifolia,San Diego,Laguna Mountains; near Sunrise Highway about 1/4 miles S of junction with Kitchen Creek Road,1785,32.8447,-116.4486,,,,WGS84,cch2,500337,FL,Soil comosed of surface organic loam over decomposed granite base.,http://cch2.org/portal/collections/individual/index.php?occid=500337,SA,top left,1,Total,4,5,4,3,0,,,2.375
SD00010520,5/6/2011,2011,5,6,126,integrifolia,San Diego,Laguna Mountains; near Sunrise Highway about 1/4 miles S of junction with Kitchen Creek Road,1785,32.8447,-116.4486,,,,WGS84,cch2,500337,FL,Soil comosed of surface organic loam over decomposed granite base.,http://cch2.org/portal/collections/individual/index.php?occid=500337,SA,top right,2,Total,3,5,8,6,1,,,2.869565217
SD00010520,5/6/2011,2011,5,6,126,integrifolia,San Diego,Laguna Mountains; near Sunrise Highway about 1/4 miles S of junction with Kitchen Creek Road,1785,32.8447,-116.4486,,,,WGS84,cch2,500337,FL,Soil comosed of surface organic loam over decomposed granite base.,http://cch2.org/portal/collections/individual/index.php?occid=500337,SA,,3,Total,5,5,4,1,0,,,2.066666667
SD00010620,5/8/2009,2009,5,8,128,integrifolia,San Diego,"Sunrise Highway, Laguna Mountains, Crouch Valley, north side. 5.49km north east of junction of Sunrise Highway and I-8",1554,32.8536,-116.4803,,,,WGS84,cch2,500263,FFL,Open field,http://cch2.org/portal/collections/individual/index.php?occid=500263,DG,,1,Total,7,9,1,1,1,,,1.947368421
SD00010515,5/28/2015,2015,5,28,148,integrifolia,San Diego,Cleveland National Forest. Mount Laguna.,1831,32.85686,-116.42813,,,,WGS84,cch2,500327,FFL,,http://cch2.org/portal/collections/individual/index.php?occid=500327,SA,all of them were clippings,NA,,,,,,,,,#DIV/0!
SDSU06105,5/6/1990,1990,5,6,126,integrifolia,San Diego,"Found in the Laguna Mountains at 6000 feet, about 10 miles north of Interstate 8 on sunshine Highway, on raodside. Near by associates: Claytonia perfoliata, species of the families Brassicaceae Poaceae and Polemoniaceae, Quercus sp and Pinus sp.",1822.69,32.86077,-116.4217,806,,,WGS84,cch2,380510,,,http://cch2.org/portal/collections/individual/index.php?occid=380510,SA,top left,1,Total,1,2,1,2,0,,,2.666666667
SDSU06105,5/6/1990,1990,5,6,126,integrifolia,San Diego,"Found in the Laguna Mountains at 6000 feet, about 10 miles north of Interstate 8 on sunshine Highway, on raodside. Near by associates: Claytonia perfoliata, species of the families Brassicaceae Poaceae and Polemoniaceae, Quercus sp and Pinus sp.",1822.69,32.86077,-116.4217,806,,,WGS84,cch2,380510,,,http://cch2.org/portal/collections/individual/index.php?occid=380510,SA,top right,2,Total,2,3,1,1,0,,,2.142857143
SDSU06105,5/6/1990,1990,5,6,126,integrifolia,San Diego,"Found in the Laguna Mountains at 6000 feet, about 10 miles north of Interstate 8 on sunshine Highway, on raodside. Near by associates: Claytonia perfoliata, species of the families Brassicaceae Poaceae and Polemoniaceae, Quercus sp and Pinus sp.",1822.69,32.86077,-116.4217,806,,,WGS84,cch2,380510,,,http://cch2.org/portal/collections/individual/index.php?occid=380510,SA,bottom left,3,Total,0,3,1,1,0,,,2.6
SDSU06105,5/6/1990,1990,5,6,126,integrifolia,San Diego,"Found in the Laguna Mountains at 6000 feet, about 10 miles north of Interstate 8 on sunshine Highway, on raodside. Near by associates: Claytonia perfoliata, species of the families Brassicaceae Poaceae and Polemoniaceae, Quercus sp and Pinus sp.",1822.69,32.86077,-116.4217,806,,,WGS84,cch2,380510,,,http://cch2.org/portal/collections/individual/index.php?occid=380510,SA,bottom right,4,Total,1,8,0,3,0,,,2.416666667
SD00010651,2/25/2005,2005,2,25,56,integrifolia,San Diego,"Cleveland National Forest (Noble Canyon), Noble Canyon Trail (south of canyon), ca. 2½ mi from Noble Canyon Trailhead, accessed via Pine Valley, on Pine Creek Road.",1162,32.8627,-116.5106,,,,WGS84,cch2,500212,FL,"dark soil, decomposed granodiorite.",http://cch2.org/portal/collections/individual/index.php?occid=500212,SA,top left plant,1,Total,1,1,1,0,0,,,2
SD00010651,2/25/2005,2005,2,25,56,integrifolia,San Diego,"Cleveland National Forest (Noble Canyon), Noble Canyon Trail (south of canyon), ca. 2½ mi from Noble Canyon Trailhead, accessed via Pine Valley, on Pine Creek Road.",1162,32.8627,-116.5106,,,,WGS84,cch2,500212,FL,"dark soil, decomposed granodiorite.",http://cch2.org/portal/collections/individual/index.php?occid=500212,SA,plant immediately to the right of it,2,Total,0,1,0,0,0,,,2
SD00010651,2/25/2005,2005,2,25,56,integrifolia,San Diego,"Cleveland National Forest (Noble Canyon), Noble Canyon Trail (south of canyon), ca. 2½ mi from Noble Canyon Trailhead, accessed via Pine Valley, on Pine Creek Road.",1162,32.8627,-116.5106,,,,WGS84,cch2,500212,FL,"dark soil, decomposed granodiorite.",http://cch2.org/portal/collections/individual/index.php?occid=500212,SA,,3,Total,0,1,0,1,0,,,3
SD00010651,2/25/2005,2005,2,25,56,integrifolia,San Diego,"Cleveland National Forest (Noble Canyon), Noble Canyon Trail (south of canyon), ca. 2½ mi from Noble Canyon Trailhead, accessed via Pine Valley, on Pine Creek Road.",1162,32.8627,-116.5106,,,,WGS84,cch2,500212,FL,"dark soil, decomposed granodiorite.",http://cch2.org/portal/collections/individual/index.php?occid=500212,SA,top right plant,4,Total,1,1,0,1,0,,,2.333333333
SD00010651,2/25/2005,2005,2,25,56,integrifolia,San Diego,"Cleveland National Forest (Noble Canyon), Noble Canyon Trail (south of canyon), ca. 2½ mi from Noble Canyon Trailhead, accessed via Pine Valley, on Pine Creek Road.",1162,32.8627,-116.5106,,,,WGS84,cch2,500212,FL,"dark soil, decomposed granodiorite.",http://cch2.org/portal/collections/individual/index.php?occid=500212,SA,Bottom Left,5,Total,0,1,0,0,0,,,2
SD00010651,2/25/2005,2005,2,25,56,integrifolia,San Diego,"Cleveland National Forest (Noble Canyon), Noble Canyon Trail (south of canyon), ca. 2½ mi from Noble Canyon Trailhead, accessed via Pine Valley, on Pine Creek Road.",1162,32.8627,-116.5106,,,,WGS84,cch2,500212,FL,"dark soil, decomposed granodiorite.",http://cch2.org/portal/collections/individual/index.php?occid=500212,SA,bottom right,6,Total,0,1,0,0,0,,,2
SD00010657,6/12/2003,2003,6,12,163,integrifolia,San Diego,Mack Trust property on Hwy 79 in Descanso (pre-acquisition survey),329,32.86417,-116.59389,,,,WGS84,cch2,500194,FR,loamy alluvium,http://cch2.org/portal/collections/individual/index.php?occid=500194,,"Difficulty distinguishing buds, flowers, spent - exclude",NA,,,,,,,,,#DIV/0!
SDSU06141,3/14/1971,1971,3,14,73,menziesii,San Diego,"El Capitan Reservoir, south side of Chocolate Arm.",229,32.86654,-116.79655,2414,,,WGS84,cch2,2889635,,,http://cch2.org/portal/collections/individual/index.php?occid=2889635,SA,"EXCLUDE Looked like plants tangled up in each other, not one whole plant",NA,,,,,,,,,#DIV/0!
SD00010539,4/19/2002,2002,4,19,109,integrifolia,San Diego,Kelley/Rebman Ranch at 565 Anderson Truck Trail on northwest side of Viejas Mountain: approx. 2 miles north of Victoria Road in Alpine,818,32.87278,-116.7475,,,,WGS84,cch2,500174,FFL,granitic substrates,http://cch2.org/portal/collections/individual/index.php?occid=500174,SA,,1,Total,1,2,2,1,3,,,3.333333333
SD00010539,4/19/2002,2002,4,19,109,integrifolia,San Diego,Kelley/Rebman Ranch at 565 Anderson Truck Trail on northwest side of Viejas Mountain: approx. 2 miles north of Victoria Road in Alpine,818,32.87278,-116.7475,,,,WGS84,cch2,500174,FFL,granitic substrates,http://cch2.org/portal/collections/individual/index.php?occid=500174,SA,,2,Total,17,20,3,5,3,,,2.104166667
SD00010537,3/28/2004,2004,3,28,88,integrifolia,San Diego,"Descanso, ca. ½ mile north of Hulburd Grove. Drainage running down to Sweetwater river, north-facing slope.",1100,32.873,-116.6255,,,,WGS84,cch2,500178,FL,decomposed granite soil,http://cch2.org/portal/collections/individual/index.php?occid=500178,SA,top left plant,1,Total,2,6,1,0,0,,,1.888888889
SD00010537,3/28/2004,2004,3,28,88,integrifolia,San Diego,"Descanso, ca. ½ mile north of Hulburd Grove. Drainage running down to Sweetwater river, north-facing slope.",1100,32.873,-116.6255,,,,WGS84,cch2,500178,FL,decomposed granite soil,http://cch2.org/portal/collections/individual/index.php?occid=500178,SA,"second row, far right",2,Total,4,4,0,0,0,,,1.5
SD00010537,3/28/2004,2004,3,28,88,integrifolia,San Diego,"Descanso, ca. ½ mile north of Hulburd Grove. Drainage running down to Sweetwater river, north-facing slope.",1100,32.873,-116.6255,,,,WGS84,cch2,500178,FL,decomposed granite soil,http://cch2.org/portal/collections/individual/index.php?occid=500178,SA,,3,Total,2,1,0,0,0,,,1.333333333
SD00010537,3/28/2004,2004,3,28,88,integrifolia,San Diego,"Descanso, ca. ½ mile north of Hulburd Grove. Drainage running down to Sweetwater river, north-facing slope.",1100,32.873,-116.6255,,,,WGS84,cch2,500178,FL,decomposed granite soil,http://cch2.org/portal/collections/individual/index.php?occid=500178,SA,,4,Total,2,3,0,1,0,,,2
SD00010537,3/28/2004,2004,3,28,88,integrifolia,San Diego,"Descanso, ca. ½ mile north of Hulburd Grove. Drainage running down to Sweetwater river, north-facing slope.",1100,32.873,-116.6255,,,,WGS84,cch2,500178,FL,decomposed granite soil,http://cch2.org/portal/collections/individual/index.php?occid=500178,SA,,5,Total,1,2,2,0,0,,,2.2
SD00010537,3/28/2004,2004,3,28,88,integrifolia,San Diego,"Descanso, ca. ½ mile north of Hulburd Grove. Drainage running down to Sweetwater river, north-facing slope.",1100,32.873,-116.6255,,,,WGS84,cch2,500178,FL,decomposed granite soil,http://cch2.org/portal/collections/individual/index.php?occid=500178,SA,,6,Total,0,3,0,0,0,,,2
SD00010457,3/19/2004,2004,3,19,79,menziesii,San Diego,"El Capitan Reservoir, just east of dam, above main road.",305,32.87806,-116.80056,80,,,WGS84,cch2,500182,FL,"Sandy gravelly slopes; mesic to moderately xeric NW, NE, N aspect; slopes 30°-60°",http://cch2.org/portal/collections/individual/index.php?occid=500182,DG,"Weird plant, questionable flowers lower-mid. Curvature may be more indicative of age than pedicel length. Dark specimen. parts of one shoot hidde by label",1,Total,19,30,10,14,5,,,2.435897436
SD00010552,5/10/1938,1938,5,10,130,integrifolia,San Diego,Laguna Camp Ground,1703.7,32.88727,-116.44724,805,,,WGS84,cch2,500068,FL,,http://cch2.org/portal/collections/individual/index.php?occid=500068,SA,the two small ones on the far top right are clippings,1,Total,1,1,1,0,0,,,2
SD00010552,5/10/1938,1938,5,10,130,integrifolia,San Diego,Laguna Camp Ground,1703.7,32.88727,-116.44724,805,,,WGS84,cch2,500068,FL,,http://cch2.org/portal/collections/individual/index.php?occid=500068,SA,,2,Total,3,3,0,0,0,,,1.5
SD00010552,5/10/1938,1938,5,10,130,integrifolia,San Diego,Laguna Camp Ground,1703.7,32.88727,-116.44724,805,,,WGS84,cch2,500068,FL,,http://cch2.org/portal/collections/individual/index.php?occid=500068,SA,,3,Total,3,5,0,0,0,,,1.625
SD00010552,5/10/1938,1938,5,10,130,integrifolia,San Diego,Laguna Camp Ground,1703.7,32.88727,-116.44724,805,,,WGS84,cch2,500068,FL,,http://cch2.org/portal/collections/individual/index.php?occid=500068,SA,,4,Total,1,3,0,0,0,,,1.75
SD00010552,5/10/1938,1938,5,10,130,integrifolia,San Diego,Laguna Camp Ground,1703.7,32.88727,-116.44724,805,,,WGS84,cch2,500068,FL,,http://cch2.org/portal/collections/individual/index.php?occid=500068,SA,,5,Total,3,7,0,0,0,,,1.7
SD00010552,5/10/1938,1938,5,10,130,integrifolia,San Diego,Laguna Camp Ground,1703.7,32.88727,-116.44724,805,,,WGS84,cch2,500068,FL,,http://cch2.org/portal/collections/individual/index.php?occid=500068,SA,,6,Total,1,3,0,0,0,,,1.75
SD00010552,5/10/1938,1938,5,10,130,integrifolia,San Diego,Laguna Camp Ground,1703.7,32.88727,-116.44724,805,,,WGS84,cch2,500068,FL,,http://cch2.org/portal/collections/individual/index.php?occid=500068,SA,,7,Total,0,1,0,0,0,,,2
SD00010552,5/10/1938,1938,5,10,130,integrifolia,San Diego,Laguna Camp Ground,1703.7,32.88727,-116.44724,805,,,WGS84,cch2,500068,FL,,http://cch2.org/portal/collections/individual/index.php?occid=500068,SA,,8,Total,0,3,0,1,0,,,2.5
SD00010552,5/10/1938,1938,5,10,130,integrifolia,San Diego,Laguna Camp Ground,1703.7,32.88727,-116.44724,805,,,WGS84,cch2,500068,FL,,http://cch2.org/portal/collections/individual/index.php?occid=500068,SA,,9,Total,1,3,1,0,0,,,2
SD00010552,5/10/1938,1938,5,10,130,integrifolia,San Diego,Laguna Camp Ground,1703.7,32.88727,-116.44724,805,,,WGS84,cch2,500068,FL,,http://cch2.org/portal/collections/individual/index.php?occid=500068,SA,,10,Total,0,2,1,0,0,,,2.333333333
SD00010552,5/10/1938,1938,5,10,130,integrifolia,San Diego,Laguna Camp Ground,1703.7,32.88727,-116.44724,805,,,WGS84,cch2,500068,FL,,http://cch2.org/portal/collections/individual/index.php?occid=500068,SA,far bottom left,11,Total,1,3,0,0,0,,,1.75
SD00010552,5/10/1938,1938,5,10,130,integrifolia,San Diego,Laguna Camp Ground,1703.7,32.88727,-116.44724,805,,,WGS84,cch2,500068,FL,,http://cch2.org/portal/collections/individual/index.php?occid=500068,SA,far bottom right,12,Total,1,0,1,0,0,,,2
SD00010658,4/30/2004,2004,4,30,121,integrifolia,San Diego,At southern end of Cuyamaca Rancho State Park off Hwy 79 on the South Boundary Fire Road (entrance is directly across from the East Mesa Fire Road entrance).,329,32.88917,-116.57667,,,,WGS84,cch2,500193,FL,ashy granitic alluvium,http://cch2.org/portal/collections/individual/index.php?occid=500193,SA,Very busy,NA,,,,,,,,,#DIV/0!
SDSU13969,4/2/2002,2002,4,2,92,menziesii,San Diego,"Cuyamaca Mtn. State Park, Lower Descanso Creek Trail, ca. 1/2 mile from parking lot at Hwy 79 (at 3.1 mile marker), toward Oak Zanita Peak trail.",1241,32.89361,-116.5725,,,,,cch2,388286,,"Gravelly loam. Exposed, flat area. Open region adjacent to Quercus agrifolia var. oxyadenia woodland.",http://cch2.org/portal/collections/individual/index.php?occid=388286,SA,top left,1,Total,2,4,1,1,0,,,2.125
SDSU13969,4/2/2002,2002,4,2,92,menziesii,San Diego,"Cuyamaca Mtn. State Park, Lower Descanso Creek Trail, ca. 1/2 mile from parking lot at Hwy 79 (at 3.1 mile marker), toward Oak Zanita Peak trail.",1241,32.89361,-116.5725,,,,,cch2,388286,,"Gravelly loam. Exposed, flat area. Open region adjacent to Quercus agrifolia var. oxyadenia woodland.",http://cch2.org/portal/collections/individual/index.php?occid=388286,SA,top middle,2,Total,0,1,0,0,0,,,2
SDSU13969,4/2/2002,2002,4,2,92,menziesii,San Diego,"Cuyamaca Mtn. State Park, Lower Descanso Creek Trail, ca. 1/2 mile from parking lot at Hwy 79 (at 3.1 mile marker), toward Oak Zanita Peak trail.",1241,32.89361,-116.5725,,,,,cch2,388286,,"Gravelly loam. Exposed, flat area. Open region adjacent to Quercus agrifolia var. oxyadenia woodland.",http://cch2.org/portal/collections/individual/index.php?occid=388286,SA,top right,3,Total,1,4,0,1,0,,,2.166666667
SDSU13969,4/2/2002,2002,4,2,92,menziesii,San Diego,"Cuyamaca Mtn. State Park, Lower Descanso Creek Trail, ca. 1/2 mile from parking lot at Hwy 79 (at 3.1 mile marker), toward Oak Zanita Peak trail.",1241,32.89361,-116.5725,,,,,cch2,388286,,"Gravelly loam. Exposed, flat area. Open region adjacent to Quercus agrifolia var. oxyadenia woodland.",http://cch2.org/portal/collections/individual/index.php?occid=388286,SA,bottom left,4,Total,5,5,1,2,0,,,2
SDSU13969,4/2/2002,2002,4,2,92,menziesii,San Diego,"Cuyamaca Mtn. State Park, Lower Descanso Creek Trail, ca. 1/2 mile from parking lot at Hwy 79 (at 3.1 mile marker), toward Oak Zanita Peak trail.",1241,32.89361,-116.5725,,,,,cch2,388286,,"Gravelly loam. Exposed, flat area. Open region adjacent to Quercus agrifolia var. oxyadenia woodland.",http://cch2.org/portal/collections/individual/index.php?occid=388286,SA,large in the middle,5,Total,2,12,4,2,0,,,2.3
SDSU13969,4/2/2002,2002,4,2,92,menziesii,San Diego,"Cuyamaca Mtn. State Park, Lower Descanso Creek Trail, ca. 1/2 mile from parking lot at Hwy 79 (at 3.1 mile marker), toward Oak Zanita Peak trail.",1241,32.89361,-116.5725,,,,,cch2,388286,,"Gravelly loam. Exposed, flat area. Open region adjacent to Quercus agrifolia var. oxyadenia woodland.",http://cch2.org/portal/collections/individual/index.php?occid=388286,SA,bottom right,6,Total,2,4,4,0,0,,,2.2
SDSU06135,5/13/1967,1967,5,13,133,integrifolia,San Diego,along the trail NE of Guymon Lodge,1724.73,32.8941,-116.438,402,,,,cch2,380540,,,http://cch2.org/portal/collections/individual/index.php?occid=380540,SA,"Middle row, right one is a clipping",1,Total,3,5,1,3,0,,,2.333333333
SDSU06135,5/13/1967,1967,5,13,133,integrifolia,San Diego,along the trail NE of Guymon Lodge,1724.73,32.8941,-116.438,402,,,,cch2,380540,,,http://cch2.org/portal/collections/individual/index.php?occid=380540,SA,,2,Total,4,7,0,5,0,,,2.375
SDSU06135,5/13/1967,1967,5,13,133,integrifolia,San Diego,along the trail NE of Guymon Lodge,1724.73,32.8941,-116.438,402,,,,cch2,380540,,,http://cch2.org/portal/collections/individual/index.php?occid=380540,SA,,3,Total,0,1,0,0,0,,,2
SDSU06135,5/13/1967,1967,5,13,133,integrifolia,San Diego,along the trail NE of Guymon Lodge,1724.73,32.8941,-116.438,402,,,,cch2,380540,,,http://cch2.org/portal/collections/individual/index.php?occid=380540,SA,,4,Total,2,3,0,3,0,,,2.5
SDSU06135,5/13/1967,1967,5,13,133,integrifolia,San Diego,along the trail NE of Guymon Lodge,1724.73,32.8941,-116.438,402,,,,cch2,380540,,,http://cch2.org/portal/collections/individual/index.php?occid=380540,SA,,5,Total,1,2,0,0,0,,,1.666666667
SD00010563,5/19/1963,1963,5,19,139,integrifolia,San Diego,"in grassy spot under oaks, ca. 1 mile W of Monument Peak, Laguna Mountains",1800,32.8941,-116.43781,402,,,WGS84,cch2,500118,FL,,http://cch2.org/portal/collections/individual/index.php?occid=500118,SA,,1,Total,2,1,1,0,0,,,1.75
SD00010563,5/19/1963,1963,5,19,139,integrifolia,San Diego,"in grassy spot under oaks, ca. 1 mile W of Monument Peak, Laguna Mountains",1800,32.8941,-116.43781,402,,,WGS84,cch2,500118,FL,,http://cch2.org/portal/collections/individual/index.php?occid=500118,SA,,2,Total,4,8,3,4,1,,,2.5
SD00010563,5/19/1963,1963,5,19,139,integrifolia,San Diego,"in grassy spot under oaks, ca. 1 mile W of Monument Peak, Laguna Mountains",1800,32.8941,-116.43781,402,,,WGS84,cch2,500118,FL,,http://cch2.org/portal/collections/individual/index.php?occid=500118,SA,,3,Total,0,1,0,0,0,,,2
SD00010563,5/19/1963,1963,5,19,139,integrifolia,San Diego,"in grassy spot under oaks, ca. 1 mile W of Monument Peak, Laguna Mountains",1800,32.8941,-116.43781,402,,,WGS84,cch2,500118,FL,,http://cch2.org/portal/collections/individual/index.php?occid=500118,SA,,4,Total,1,1,0,0,0,,,1.5
SD00010563,5/19/1963,1963,5,19,139,integrifolia,San Diego,"in grassy spot under oaks, ca. 1 mile W of Monument Peak, Laguna Mountains",1800,32.8941,-116.43781,402,,,WGS84,cch2,500118,FL,,http://cch2.org/portal/collections/individual/index.php?occid=500118,SA,,5,Total,1,2,0,1,0,,,2.25
SD00010564,4/28/1971,1971,4,28,118,integrifolia,San Diego,"In leaf litter, Echo Dell",960,32.9,-116.65,402,,,WGS84,cch2,500126,FFL,,http://cch2.org/portal/collections/individual/index.php?occid=500126,SA,EXCLUDE: both very blurry and very crowded,NA,,,,,,,,,#DIV/0!
SD00010558,3/31/1971,1971,3,31,90,integrifolia,San Diego,"Shaded area along dirt road east of small pond south of locked gate, Echo Dell 4 miles north of Descanso",960,32.9,-116.65,402,,,WGS84,cch2,500127,FL,,http://cch2.org/portal/collections/individual/index.php?occid=500127,,EXCLUDE - very blurry,NA,,,,,,,,,#DIV/0!
SD00010590,4/4/2007,2007,4,4,94,integrifolia,San Diego,"Cleveland National Forest, Laguna Mountains, 1 mi SW of junction of Sunrise Hwy (S1) and Filaree Flat Rd S, N of Noble Canyon Creek",1577,32.90152,-116.47683,,,,WGS84,cch2,500252,FL,"Clay loam soil, gentle, S facing slope, partial shade",http://cch2.org/portal/collections/individual/index.php?occid=500252,SA,,1,Total,2,4,2,6,1,,,3
SD00010590,4/4/2007,2007,4,4,94,integrifolia,San Diego,"Cleveland National Forest, Laguna Mountains, 1 mi SW of junction of Sunrise Hwy (S1) and Filaree Flat Rd S, N of Noble Canyon Creek",1577,32.90152,-116.47683,,,,WGS84,cch2,500252,FL,"Clay loam soil, gentle, S facing slope, partial shade",http://cch2.org/portal/collections/individual/index.php?occid=500252,SA,,2,Total,1,4,0,3,0,,,2.625
SD00010590,4/4/2007,2007,4,4,94,integrifolia,San Diego,"Cleveland National Forest, Laguna Mountains, 1 mi SW of junction of Sunrise Hwy (S1) and Filaree Flat Rd S, N of Noble Canyon Creek",1577,32.90152,-116.47683,,,,WGS84,cch2,500252,FL,"Clay loam soil, gentle, S facing slope, partial shade",http://cch2.org/portal/collections/individual/index.php?occid=500252,SA,,3,Total,2,3,1,1,0,,,2.142857143
SD00010535,5/8/2004,2004,5,8,129,integrifolia,San Diego,"Square # 33: Noble Canyon Trail, 0.8 miles west of Sunrise Hwy trailhead; 100' east of Pine Creek Road junction",1661,32.90417,-116.4725,,,,WGS84,cch2,500180,FL,"granodiorite, brown, loamy soil; gentle slope, north facing",http://cch2.org/portal/collections/individual/index.php?occid=500180,SA,,1,Total,3,21,14,31,18,,,3.459770115
SD00010599,6/29/2005,2005,6,29,180,integrifolia,San Diego,"Laguna Mountains: Cleveland National Forest; vicinity of Penny Pines above Storm Canyon, E of Sunrise Highway and W of the Pacific Crest Trail, SW of Garnet Peak",1660,32.91444,-116.45778,,,,WGS84,cch2,500199,FFL,,http://cch2.org/portal/collections/individual/index.php?occid=500199,SA,EXCLUDE,NA,,,,,,,,,#DIV/0!
SD00010565,5/18/1960,1960,5,18,139,integrifolia,San Diego,Green Valley,1250,32.91667,-116.56667,402,,,WGS84,cch2,500107,FFL,,http://cch2.org/portal/collections/individual/index.php?occid=500107,SA,top,1,Total,0,2,1,1,17,,,4.571428571
SD00010565,5/18/1960,1960,5,18,139,integrifolia,San Diego,Green Valley,1250,32.91667,-116.56667,402,,,WGS84,cch2,500107,FFL,,http://cch2.org/portal/collections/individual/index.php?occid=500107,SA,middle,2,Total,1,2,0,1,0,,,2.25
SD00010459,4/22/1971,1971,4,22,112,,San Diego,"In forest leaf litter, Laguna Mountains",1590,32.91667,-116.46667,1609,,,WGS84,cch2,500129,FL,,http://cch2.org/portal/collections/individual/index.php?occid=500129,SA,First 5 are top row,1,Total,1,1,0,0,0,,,1.5
SD00010459,4/22/1971,1971,4,22,112,,San Diego,"In forest leaf litter, Laguna Mountains",1590,32.91667,-116.46667,1609,,,WGS84,cch2,500129,FL,,http://cch2.org/portal/collections/individual/index.php?occid=500129,SA,,2,Total,1,2,0,0,0,,,1.666666667
SD00010459,4/22/1971,1971,4,22,112,,San Diego,"In forest leaf litter, Laguna Mountains",1590,32.91667,-116.46667,1609,,,WGS84,cch2,500129,FL,,http://cch2.org/portal/collections/individual/index.php?occid=500129,SA,,3,Total,1,3,0,0,0,,,1.75
SD00010459,4/22/1971,1971,4,22,112,,San Diego,"In forest leaf litter, Laguna Mountains",1590,32.91667,-116.46667,1609,,,WGS84,cch2,500129,FL,,http://cch2.org/portal/collections/individual/index.php?occid=500129,SA,,4,Total,0,1,0,0,0,,,2
SD00010459,4/22/1971,1971,4,22,112,,San Diego,"In forest leaf litter, Laguna Mountains",1590,32.91667,-116.46667,1609,,,WGS84,cch2,500129,FL,,http://cch2.org/portal/collections/individual/index.php?occid=500129,SA,,5,Total,2,2,0,0,0,,,1.5
SD00010459,4/22/1971,1971,4,22,112,,San Diego,"In forest leaf litter, Laguna Mountains",1590,32.91667,-116.46667,1609,,,WGS84,cch2,500129,FL,,http://cch2.org/portal/collections/individual/index.php?occid=500129,SA,6 and 7 are in between rows 1 and 2,6,Total,2,1,0,0,0,,,1.333333333
SD00010459,4/22/1971,1971,4,22,112,,San Diego,"In forest leaf litter, Laguna Mountains",1590,32.91667,-116.46667,1609,,,WGS84,cch2,500129,FL,,http://cch2.org/portal/collections/individual/index.php?occid=500129,SA,,7,Total,2,1,0,0,0,,,1.333333333
SD00010459,4/22/1971,1971,4,22,112,,San Diego,"In forest leaf litter, Laguna Mountains",1590,32.91667,-116.46667,1609,,,WGS84,cch2,500129,FL,,http://cch2.org/portal/collections/individual/index.php?occid=500129,SA,Row 2,8,Total,1,1,0,0,0,,,1.5
SD00010459,4/22/1971,1971,4,22,112,,San Diego,"In forest leaf litter, Laguna Mountains",1590,32.91667,-116.46667,1609,,,WGS84,cch2,500129,FL,,http://cch2.org/portal/collections/individual/index.php?occid=500129,SA,,9,Total,0,1,0,0,0,,,2
SD00010459,4/22/1971,1971,4,22,112,,San Diego,"In forest leaf litter, Laguna Mountains",1590,32.91667,-116.46667,1609,,,WGS84,cch2,500129,FL,,http://cch2.org/portal/collections/individual/index.php?occid=500129,SA,,10,Total,1,1,1,0,0,,,2
SD00010459,4/22/1971,1971,4,22,112,,San Diego,"In forest leaf litter, Laguna Mountains",1590,32.91667,-116.46667,1609,,,WGS84,cch2,500129,FL,,http://cch2.org/portal/collections/individual/index.php?occid=500129,SA,,11,Total,1,0,0,0,0,,,1
SD00010459,4/22/1971,1971,4,22,112,,San Diego,"In forest leaf litter, Laguna Mountains",1590,32.91667,-116.46667,1609,,,WGS84,cch2,500129,FL,,http://cch2.org/portal/collections/individual/index.php?occid=500129,SA,,12,Total,1,2,0,0,0,,,1.666666667
SD00010459,4/22/1971,1971,4,22,112,,San Diego,"In forest leaf litter, Laguna Mountains",1590,32.91667,-116.46667,1609,,,WGS84,cch2,500129,FL,,http://cch2.org/portal/collections/individual/index.php?occid=500129,SA,,13,Total,0,1,0,0,0,,,2
SD00010459,4/22/1971,1971,4,22,112,,San Diego,"In forest leaf litter, Laguna Mountains",1590,32.91667,-116.46667,1609,,,WGS84,cch2,500129,FL,,http://cch2.org/portal/collections/individual/index.php?occid=500129,SA,,14,Total,1,1,0,0,0,,,1.5
SD00010459,4/22/1971,1971,4,22,112,,San Diego,"In forest leaf litter, Laguna Mountains",1590,32.91667,-116.46667,1609,,,WGS84,cch2,500129,FL,,http://cch2.org/portal/collections/individual/index.php?occid=500129,SA,Row 3,15,Total,2,1,0,0,0,,,1.333333333
SD00010459,4/22/1971,1971,4,22,112,,San Diego,"In forest leaf litter, Laguna Mountains",1590,32.91667,-116.46667,1609,,,WGS84,cch2,500129,FL,,http://cch2.org/portal/collections/individual/index.php?occid=500129,SA,,16,Total,1,2,0,0,0,,,1.666666667
SD00010459,4/22/1971,1971,4,22,112,,San Diego,"In forest leaf litter, Laguna Mountains",1590,32.91667,-116.46667,1609,,,WGS84,cch2,500129,FL,,http://cch2.org/portal/collections/individual/index.php?occid=500129,SA,,17,Total,0,1,0,0,0,,,2
SD00010459,4/22/1971,1971,4,22,112,,San Diego,"In forest leaf litter, Laguna Mountains",1590,32.91667,-116.46667,1609,,,WGS84,cch2,500129,FL,,http://cch2.org/portal/collections/individual/index.php?occid=500129,SA,,18,Total,0,1,0,0,0,,,2
SD00010459,4/22/1971,1971,4,22,112,,San Diego,"In forest leaf litter, Laguna Mountains",1590,32.91667,-116.46667,1609,,,WGS84,cch2,500129,FL,,http://cch2.org/portal/collections/individual/index.php?occid=500129,SA,,19,Total,2,1,0,1,0,,,2
SD00010459,4/22/1971,1971,4,22,112,,San Diego,"In forest leaf litter, Laguna Mountains",1590,32.91667,-116.46667,1609,,,WGS84,cch2,500129,FL,,http://cch2.org/portal/collections/individual/index.php?occid=500129,SA,,20,Total,2,1,0,0,0,,,1.333333333
SD00010459,4/22/1971,1971,4,22,112,,San Diego,"In forest leaf litter, Laguna Mountains",1590,32.91667,-116.46667,1609,,,WGS84,cch2,500129,FL,,http://cch2.org/portal/collections/individual/index.php?occid=500129,SA,,21,Total,2,1,0,0,0,,,1.333333333
SD00010459,4/22/1971,1971,4,22,112,,San Diego,"In forest leaf litter, Laguna Mountains",1590,32.91667,-116.46667,1609,,,WGS84,cch2,500129,FL,,http://cch2.org/portal/collections/individual/index.php?occid=500129,SA,,22,Total,2,1,0,0,0,,,1.333333333
SD00010459,4/22/1971,1971,4,22,112,,San Diego,"In forest leaf litter, Laguna Mountains",1590,32.91667,-116.46667,1609,,,WGS84,cch2,500129,FL,,http://cch2.org/portal/collections/individual/index.php?occid=500129,SA,,23,Total,0,1,0,0,0,,,2
SD00010459,4/22/1971,1971,4,22,112,,San Diego,"In forest leaf litter, Laguna Mountains",1590,32.91667,-116.46667,1609,,,WGS84,cch2,500129,FL,,http://cch2.org/portal/collections/individual/index.php?occid=500129,SA,,24,Total,2,1,0,0,0,,,1.333333333
SD00010459,4/22/1971,1971,4,22,112,,San Diego,"In forest leaf litter, Laguna Mountains",1590,32.91667,-116.46667,1609,,,WGS84,cch2,500129,FL,,http://cch2.org/portal/collections/individual/index.php?occid=500129,SA,,25,Total,0,1,0,0,0,,,2
SD00010652,4/29/2006,2006,4,29,119,integrifolia,San Diego,"City of Lakeside. Silverwood Wildlife Sanctuary. 13003 Wildcat Canyon Road. Observation area, ¼ mi ESE of the intersection of Wildcat Canyon Rd and Old Barona Rd.",460,32.918,-116.8808,,,,WGS84,cch2,500209,FL,Stream bed with loose soil,http://cch2.org/portal/collections/individual/index.php?occid=500209,SA,,1,Total,3,8,0,2,0,,,2.076923077
SD00010568,5/30/1936,1936,5,30,151,integrifolia,San Diego,"Laguna Mts., near Garnet",1735.75,32.92561,-116.45807,2011,,,WGS84,cch2,500061,FFL,,http://cch2.org/portal/collections/individual/index.php?occid=500061,SA,,1,Total,3,11,1,7,2,,,2.75
SD00010572,6/10/1937,1937,6,10,161,integrifolia,San Diego,"So. Fork of Featherstone Creek, Barona Valley",499.58,32.92704,-116.83838,1207,,,WGS84,cch2,500064,FFL,,Bottom one is a clipping,SA,,1,Total,3,5,1,8,8,,,3.52
SD00010532,4/8/2003,2003,4,8,98,integrifolia,San Diego,Laguna Mountains: Lucky 5 Ranch; southern portion of new acquisition by California State Parks: west side of Sunrise Hwy (S-1) between Cuyamaca Lake and Mount Laguna,1600,32.93194,-116.49333,,,,WGS84,cch2,500186,FFL,mostly schist and granite,,SA,,1,Total,11,19,5,14,0,,,2.448979592
SD00010532,4/8/2003,2003,4,8,98,integrifolia,San Diego,Laguna Mountains: Lucky 5 Ranch; southern portion of new acquisition by California State Parks: west side of Sunrise Hwy (S-1) between Cuyamaca Lake and Mount Laguna,1600,32.93194,-116.49333,,,,WGS84,cch2,500186,FFL,mostly schist and granite,,SA,,2,Total,3,7,0,6,1,,,2.705882353
SD00010532,4/8/2003,2003,4,8,98,integrifolia,San Diego,Laguna Mountains: Lucky 5 Ranch; southern portion of new acquisition by California State Parks: west side of Sunrise Hwy (S-1) between Cuyamaca Lake and Mount Laguna,1600,32.93194,-116.49333,,,,WGS84,cch2,500186,FFL,mostly schist and granite,,SA,,3,Total,1,2,0,2,0,,,2.6
SD00010532,4/8/2003,2003,4,8,98,integrifolia,San Diego,Laguna Mountains: Lucky 5 Ranch; southern portion of new acquisition by California State Parks: west side of Sunrise Hwy (S-1) between Cuyamaca Lake and Mount Laguna,1600,32.93194,-116.49333,,,,WGS84,cch2,500186,FFL,mostly schist and granite,,SA,,4,Total,4,4,1,3,1,,,2.461538462
SD00010532,4/8/2003,2003,4,8,98,integrifolia,San Diego,Laguna Mountains: Lucky 5 Ranch; southern portion of new acquisition by California State Parks: west side of Sunrise Hwy (S-1) between Cuyamaca Lake and Mount Laguna,1600,32.93194,-116.49333,,,,WGS84,cch2,500186,FFL,mostly schist and granite,,SA,,5,Total,4,9,1,3,1,,,2.333333333
SDSU06117,4/1/1938,1938,4,1,91,integrifolia,San Diego,Cuyamaca,1570.4,32.93455,-116.6042,9654,,,WGS84,cch2,380522,,,http://cch2.org/portal/collections/individual/index.php?occid=380522,SA,,1,Total,0,1,0,0,,,,2
SDSU06117,4/1/1938,1938,4,1,91,integrifolia,San Diego,Cuyamaca,1570.4,32.93455,-116.6042,9654,,,WGS84,cch2,380522,,,http://cch2.org/portal/collections/individual/index.php?occid=380522,SA,,2,Total,0,1,0,0,,,,2
SDSU06117,4/1/1938,1938,4,1,91,integrifolia,San Diego,Cuyamaca,1570.4,32.93455,-116.6042,9654,,,WGS84,cch2,380522,,,http://cch2.org/portal/collections/individual/index.php?occid=380522,SA,,3,Total,0,1,0,0,,,,2
SDSU06117,4/1/1938,1938,4,1,91,integrifolia,San Diego,Cuyamaca,1570.4,32.93455,-116.6042,9654,,,WGS84,cch2,380522,,,http://cch2.org/portal/collections/individual/index.php?occid=380522,SA,,4,Total,0,1,0,0,,,,2
SDSU06117,4/1/1938,1938,4,1,91,integrifolia,San Diego,Cuyamaca,1570.4,32.93455,-116.6042,9654,,,WGS84,cch2,380522,,,http://cch2.org/portal/collections/individual/index.php?occid=380522,SA,,5,Total,0,1,0,0,,,,2
SDSU06117,4/1/1938,1938,4,1,91,integrifolia,San Diego,Cuyamaca,1570.4,32.93455,-116.6042,9654,,,WGS84,cch2,380522,,,http://cch2.org/portal/collections/individual/index.php?occid=380522,SA,,6,Total,0,1,0,0,,,,2
SDSU06117,4/1/1938,1938,4,1,91,integrifolia,San Diego,Cuyamaca,1570.4,32.93455,-116.6042,9654,,,WGS84,cch2,380522,,,http://cch2.org/portal/collections/individual/index.php?occid=380522,SA,,7,Total,0,1,0,0,,,,2
SDSU06117,4/1/1938,1938,4,1,91,integrifolia,San Diego,Cuyamaca,1570.4,32.93455,-116.6042,9654,,,WGS84,cch2,380522,,,http://cch2.org/portal/collections/individual/index.php?occid=380522,SA,,8,Total,0,1,0,0,,,,2
SDSU06117,4/1/1938,1938,4,1,91,integrifolia,San Diego,Cuyamaca,1570.4,32.93455,-116.6042,9654,,,WGS84,cch2,380522,,,http://cch2.org/portal/collections/individual/index.php?occid=380522,SA,,9,Total,0,1,0,1,,,,3
SD00010606,5/27/1938,1938,5,27,147,integrifolia,San Diego,"Harper Ranch, Rattlesnake Valley",1435.6,32.94033,-116.51363,1207,,,WGS84,cch2,500071,FFL,,http://cch2.org/portal/collections/individual/index.php?occid=500071,SA,,1,Total,3,9,4,15,,,,3
SD00010606,5/27/1938,1938,5,27,147,integrifolia,San Diego,"Harper Ranch, Rattlesnake Valley",1435.6,32.94033,-116.51363,1207,,,WGS84,cch2,500071,FFL,,http://cch2.org/portal/collections/individual/index.php?occid=500071,SA,,2,Total,3,5,3,15,,,,3.153846154
SD00010589,3/19/2008,2008,3,19,79,integrifolia,San Diego,"East end of Los Penasquitos Canyon Preserve, 1 mi east of intersection I-15 and Poway Rd, S side of Los Penasquitos Canyon Creek",123,32.9416,-117.0873,,,,WGS84,cch2,500257,FL,,http://cch2.org/portal/collections/individual/index.php?occid=500257,SA,EXCLUDE: clipping,NA,,,,,,,,,#DIV/0!
SD00010550,5/18/2004,2004,5,18,139,integrifolia,San Diego,"Rancho Cuyamaca State Park, West Mesa.",1387,32.94222,-116.57278,,,,WGS84,cch2,500189,UNK,"Moderate, NE-facing slope. Scattered boulders.",http://cch2.org/portal/collections/individual/index.php?occid=500189,SA,,1,Total,15,29,25,45,,,,2.877192982
SDSU19900,5/24/2002,2002,5,24,144,integrifolia,San Diego,"Saddle, just northeast of Cuyamaca Peak.",1868,32.95028,-116.60639,,,,,cch2,394070,,Open meadow. Pteridium aquilinum + mixed herbs.,http://cch2.org/portal/collections/individual/index.php?occid=394070,SA,,1,Total,0,1,1,0,,,,2.5
SDSU19900,5/24/2002,2002,5,24,144,integrifolia,San Diego,"Saddle, just northeast of Cuyamaca Peak.",1868,32.95028,-116.60639,,,,,cch2,394070,,Open meadow. Pteridium aquilinum + mixed herbs.,http://cch2.org/portal/collections/individual/index.php?occid=394070,SA,,2,Total,3,6,1,7,,,,2.705882353
SD00010629,4/7/2010,2010,4,7,97,integrifolia,San Diego,"Cleveland National Forest: Northeast of El Cajon Mountain, west of the San Diego River and south of Barona Mesa; just west of El Cajon Mountain Truck Trail",670,32.95557,-116.79091,,,,WGS84,cch2,500250,FFL,granitic substrates,http://cch2.org/portal/collections/individual/index.php?occid=500250,SA,EXLCUDE: blurry,NA,,,,,,,,,#DIV/0!
SD00010604,4/27/1935,1935,4,27,117,integrifolia,San Diego,"Picnic Grounds, Cuyamaca Rancho State Park",1483.79,32.95935,-116.57969,241,,,WGS84,cch2,500052,FL,,http://cch2.org/portal/collections/individual/index.php?occid=500052,SA,,1,Total,3,8,1,7,,,,2.631578947
SD00010604,4/27/1935,1935,4,27,117,integrifolia,San Diego,"Picnic Grounds, Cuyamaca Rancho State Park",1483.79,32.95935,-116.57969,241,,,WGS84,cch2,500052,FL,,http://cch2.org/portal/collections/individual/index.php?occid=500052,SA,,2,Total,4,16,5,1,,,,2.115384615
SD00010450,3/25/2008,2008,3,25,85,menziesii,San Diego,"San Diego, Crest Canyon, ½ mile W of Interstate 5, 225 yds S of Race Track View Drive, northern section off main trail",33,32.96111,-117.25556,,,,WGS84,cch2,500265,FL,Detritus from Torrey Sandstone and fill from San Dieguito Lagoon,http://cch2.org/portal/collections/individual/index.php?occid=500265,SA,,1,Total,3,1,1,1,,,,2
SD00010450,3/25/2008,2008,3,25,85,menziesii,San Diego,"San Diego, Crest Canyon, ½ mile W of Interstate 5, 225 yds S of Race Track View Drive, northern section off main trail",33,32.96111,-117.25556,,,,WGS84,cch2,500265,FL,Detritus from Torrey Sandstone and fill from San Dieguito Lagoon,http://cch2.org/portal/collections/individual/index.php?occid=500265,SA,,2,Total,2,2,1,3,,,,2.625
SDSU19911,5/5/2012,2012,5,5,126,integrifolia,San Diego,"Cuyamaca State Park, San Diego. Flat open, grassy area near Azalea Glen hiking trail.",1490,32.96251,-116.58741,,,,,cch2,394081,In flower.,Montane. Open grass area with some pine trees.,http://cch2.org/portal/collections/individual/index.php?occid=394081,SA,,1,Total,3,5,1,9,0,,,2.888888889
SDSU19911,5/5/2012,2012,5,5,126,integrifolia,San Diego,"Cuyamaca State Park, San Diego. Flat open, grassy area near Azalea Glen hiking trail.",1490,32.96251,-116.58741,,,,,cch2,394081,In flower.,Montane. Open grass area with some pine trees.,http://cch2.org/portal/collections/individual/index.php?occid=394081,SA,,2,Total,2,8,1,3,0,,,2.357142857
SDSU19911,5/5/2012,2012,5,5,126,integrifolia,San Diego,"Cuyamaca State Park, San Diego. Flat open, grassy area near Azalea Glen hiking trail.",1490,32.96251,-116.58741,,,,,cch2,394081,In flower.,Montane. Open grass area with some pine trees.,http://cch2.org/portal/collections/individual/index.php?occid=394081,SA,,3,Total,8,14,4,19,2,,,2.85106383
SD00010650,3/6/2005,2005,3,6,65,integrifolia,San Diego,"Poway. A field at the end of Meadowbrook Lane, W of Meadowbrook Middle School, W of Pomerado Rd.",211,32.964,-117.0705,,,,WGS84,cch2,500211,FL,"Linda Vista Formation, red sandy soil, some clay.",http://cch2.org/portal/collections/individual/index.php?occid=500211,SA,"Twisted with another plat, I think I marked it correctly though; fourth plant had a lot of missing stems so I did not count it",1,Total,4,9,1,0,1,,,2
SD00010650,3/6/2005,2005,3,6,65,integrifolia,San Diego,"Poway. A field at the end of Meadowbrook Lane, W of Meadowbrook Middle School, W of Pomerado Rd.",211,32.964,-117.0705,,,,WGS84,cch2,500211,FL,"Linda Vista Formation, red sandy soil, some clay.",http://cch2.org/portal/collections/individual/index.php?occid=500211,SA,,2,Total,2,1,2,0,1,,,2.5
SD00010650,3/6/2005,2005,3,6,65,integrifolia,San Diego,"Poway. A field at the end of Meadowbrook Lane, W of Meadowbrook Middle School, W of Pomerado Rd.",211,32.964,-117.0705,,,,WGS84,cch2,500211,FL,"Linda Vista Formation, red sandy soil, some clay.",http://cch2.org/portal/collections/individual/index.php?occid=500211,SA,,3,Total,1,6,3,5,1,,,2.9375
SD00010598,4/27/2006,2006,4,27,117,integrifolia,San Diego,"Monte Vista Ranch (owned by The Nature Conservancy): S of Ramona, NW of San Vicente Reservoir; S of San Vicente Road along Chuckwagon Road onto the Ranch; just east of the electric lines in Longs Gulch",337,32.96528,-116.87167,,,,WGS84,cch2,500202,FFL,clay and mud soils with some granite outcrops,http://cch2.org/portal/collections/individual/index.php?occid=500202,SA,"top left is missing 2/3 stems, not counted; numbered left to right",1,Total,1,4,1,2,0,,,2.5
SD00010598,4/27/2006,2006,4,27,117,integrifolia,San Diego,"Monte Vista Ranch (owned by The Nature Conservancy): S of Ramona, NW of San Vicente Reservoir; S of San Vicente Road along Chuckwagon Road onto the Ranch; just east of the electric lines in Longs Gulch",337,32.96528,-116.87167,,,,WGS84,cch2,500202,FFL,clay and mud soils with some granite outcrops,http://cch2.org/portal/collections/individual/index.php?occid=500202,SA,bottom left,2,Total,3,5,1,9,2,,,3.1
SD00010598,4/27/2006,2006,4,27,117,integrifolia,San Diego,"Monte Vista Ranch (owned by The Nature Conservancy): S of Ramona, NW of San Vicente Reservoir; S of San Vicente Road along Chuckwagon Road onto the Ranch; just east of the electric lines in Longs Gulch",337,32.96528,-116.87167,,,,WGS84,cch2,500202,FFL,clay and mud soils with some granite outcrops,http://cch2.org/portal/collections/individual/index.php?occid=500202,SA,,3,Total,1,3,2,5,1,,,3.166666667
SD00010660,3/23/2004,2004,3,23,83,integrifolia,San Diego,"Los Caballos Horse Camp, Cuyamaca Rancho State Park",451,32.97222,-116.57167,,,,WGS84,cch2,500191,FL,Sandy loam,http://cch2.org/portal/collections/individual/index.php?occid=500191,SA,,1,Total,0,1,0,0,0,,,2
SD00010660,3/23/2004,2004,3,23,83,integrifolia,San Diego,"Los Caballos Horse Camp, Cuyamaca Rancho State Park",451,32.97222,-116.57167,,,,WGS84,cch2,500191,FL,Sandy loam,http://cch2.org/portal/collections/individual/index.php?occid=500191,SA,,2,Total,3,3,1,0,0,,,1.714285714
SD00010660,3/23/2004,2004,3,23,83,integrifolia,San Diego,"Los Caballos Horse Camp, Cuyamaca Rancho State Park",451,32.97222,-116.57167,,,,WGS84,cch2,500191,FL,Sandy loam,http://cch2.org/portal/collections/individual/index.php?occid=500191,SA,,3,Total,3,3,0,0,0,,,1.5
SD00010660,3/23/2004,2004,3,23,83,integrifolia,San Diego,"Los Caballos Horse Camp, Cuyamaca Rancho State Park",451,32.97222,-116.57167,,,,WGS84,cch2,500191,FL,Sandy loam,http://cch2.org/portal/collections/individual/index.php?occid=500191,SA,,4,Total,0,1,0,0,0,,,2
SD00010660,3/23/2004,2004,3,23,83,integrifolia,San Diego,"Los Caballos Horse Camp, Cuyamaca Rancho State Park",451,32.97222,-116.57167,,,,WGS84,cch2,500191,FL,Sandy loam,http://cch2.org/portal/collections/individual/index.php?occid=500191,SA,,5,Total,1,3,0,1,0,,,2.2
SDSU12547,4/21/1996,1996,4,21,112,menziesii,San Diego,"Southern portion of Lake Cuyamaca, immediately north of Stone wall Mine. Lake Cuyamaca Park and Recreational District.",1433,32.975,-116.55417,,,,,cch2,386895,,"Alpine meadow near open mountain forest. Associated species: Collinsia parviflora, Limnanhes gracilis spp. parishii, Pinus jefferyi, Salix lasiolepis, various exotic grasses.",http://cch2.org/portal/collections/individual/index.php?occid=386895,SA,,1,Total,5,6,1,1,0,,,1.846153846
SDSU12547,4/21/1996,1996,4,21,112,menziesii,San Diego,"Southern portion of Lake Cuyamaca, immediately north of Stone wall Mine. Lake Cuyamaca Park and Recreational District.",1433,32.975,-116.55417,,,,,cch2,386895,,"Alpine meadow near open mountain forest. Associated species: Collinsia parviflora, Limnanhes gracilis spp. parishii, Pinus jefferyi, Salix lasiolepis, various exotic grasses.",http://cch2.org/portal/collections/individual/index.php?occid=386895,SA,,2,Total,3,5,1,3,0,,,2.333333333
SD00010551,6/19/1969,1969,6,19,170,integrifolia,San Diego,"West slope of Middle Peak, Cuyamaca",1400,32.98333,-116.6,402,,,WGS84,cch2,500121,FL,,http://cch2.org/portal/collections/individual/index.php?occid=500121,SA,,1,Total,1,3,8,6,0,,,3.055555556
SD00010551,6/19/1969,1969,6,19,170,integrifolia,San Diego,"West slope of Middle Peak, Cuyamaca",1400,32.98333,-116.6,402,,,WGS84,cch2,500121,FL,,http://cch2.org/portal/collections/individual/index.php?occid=500121,SA,,2,Total,0,2,2,1,0,,,2.8
SD00010551,6/19/1969,1969,6,19,170,integrifolia,San Diego,"West slope of Middle Peak, Cuyamaca",1400,32.98333,-116.6,402,,,WGS84,cch2,500121,FL,,http://cch2.org/portal/collections/individual/index.php?occid=500121,SA,,3,Total,0,1,0,0,0,,,2
SD00010605,6/18/1967,1967,6,18,169,integrifolia,San Diego,"North Meadow, Middle Cuyamaca Peak",1524,32.98333,-116.60833,402,,,WGS84,cch2,500122,FFL,,http://cch2.org/portal/collections/individual/index.php?occid=500122,SA,,1,Total,19,23,13,37,13,,,3.019047619
SD00010630,4/12/2008,2008,4,12,103,integrifolia,San Diego,"Cleveland National Forest, W of Cuyamaca Mtns, about 1.25 mile west of intersection of Boulder Creek Road and Cedar Creek Road",750,32.987,-116.7093,,,,WGS84,cch2,500247,FL,granitic,http://cch2.org/portal/collections/individual/index.php?occid=500247,SA,,1,Total,9,10,0,3,0,,,1.863636364
SD00010630,4/12/2008,2008,4,12,103,integrifolia,San Diego,"Cleveland National Forest, W of Cuyamaca Mtns, about 1.25 mile west of intersection of Boulder Creek Road and Cedar Creek Road",750,32.987,-116.7093,,,,WGS84,cch2,500247,FL,granitic,http://cch2.org/portal/collections/individual/index.php?occid=500247,SA,,2,Total,7,7,1,3,0,,,2
SD00010643,4/7/2007,2007,4,7,97,integrifolia,San Diego,"Cleveland National Forest, Cuyamaca Mountains, 9 mi W of Middle Peak, SE of Sunshine Mountain, Kelly Creek area, W of Boulder Creek Road",884,32.9913,-116.6662,,,,WGS84,cch2,500222,FL,"Sandy loam, 5% N slope above creek bed",http://cch2.org/portal/collections/individual/index.php?occid=500222,SA,,1,Total,5,10,2,9,3,,,2.827586207
SD00010643,4/7/2007,2007,4,7,97,integrifolia,San Diego,"Cleveland National Forest, Cuyamaca Mountains, 9 mi W of Middle Peak, SE of Sunshine Mountain, Kelly Creek area, W of Boulder Creek Road",884,32.9913,-116.6662,,,,WGS84,cch2,500222,FL,"Sandy loam, 5% N slope above creek bed",http://cch2.org/portal/collections/individual/index.php?occid=500222,SA,,2,Total,4,4,0,2,0,,,2
SD00010643,4/7/2007,2007,4,7,97,integrifolia,San Diego,"Cleveland National Forest, Cuyamaca Mountains, 9 mi W of Middle Peak, SE of Sunshine Mountain, Kelly Creek area, W of Boulder Creek Road",884,32.9913,-116.6662,,,,WGS84,cch2,500222,FL,"Sandy loam, 5% N slope above creek bed",http://cch2.org/portal/collections/individual/index.php?occid=500222,SA,,3,Total,1,6,0,5,1,,,2.923076923
SD00010643,4/7/2007,2007,4,7,97,integrifolia,San Diego,"Cleveland National Forest, Cuyamaca Mountains, 9 mi W of Middle Peak, SE of Sunshine Mountain, Kelly Creek area, W of Boulder Creek Road",884,32.9913,-116.6662,,,,WGS84,cch2,500222,FL,"Sandy loam, 5% N slope above creek bed",http://cch2.org/portal/collections/individual/index.php?occid=500222,SA,,4,Total,4,8,0,3,0,,,2.133333333
SD00010553,5/18/1935,1935,5,18,138,integrifolia,San Diego,"Moist hillside, Cuyamaca Lake area",1407.68,32.99264,-116.56513,4827,,,WGS84,cch2,500089,FL,,http://cch2.org/portal/collections/individual/index.php?occid=500089,SA,Right one is a clipping,1,Total,7,9,2,4,0,,,2.136363636
SD00010569,5/5/1936,1936,5,5,126,integrifolia,San Diego,Meadow below Cuyamaca Lake,1342.17,32.99283,-116.59522,805,,,WGS84,cch2,500059,FFL,,http://cch2.org/portal/collections/individual/index.php?occid=500059,SA,top middle is a clipping,1,Total,2,0,2,1,0,,,2.4
SD00010569,5/5/1936,1936,5,5,126,integrifolia,San Diego,Meadow below Cuyamaca Lake,1342.17,32.99283,-116.59522,805,,,WGS84,cch2,500059,FFL,,http://cch2.org/portal/collections/individual/index.php?occid=500059,SA,,2,Total,0,5,0,4,2,,,3.272727273
SD00010569,5/5/1936,1936,5,5,126,integrifolia,San Diego,Meadow below Cuyamaca Lake,1342.17,32.99283,-116.59522,805,,,WGS84,cch2,500059,FFL,,http://cch2.org/portal/collections/individual/index.php?occid=500059,SA,,3,Total,1,1,1,12,5,,,3.95
SD00010531,3/15/2003,2003,3,15,74,integrifolia,San Diego,"Cuyamaca Lake, Lucky 5 Acquisition, Location 3 - Knoll with grassland on northeast side.",1441,32.995,-116.53667,,,,WGS84,cch2,500175,FL,Julian Schist,http://cch2.org/portal/collections/individual/index.php?occid=500175,SA,,1,Total,5,4,0,0,0,,,1.444444444
SD00010633,3/8/2008,2008,3,8,68,integrifolia,San Diego,"Poway, behind Pomerado Hospital on Pomerado Rd.",336,32.99836,-117.04968,,,,WGS84,cch2,500244,FL,"Decomposed granite, boulders, sand",http://cch2.org/portal/collections/individual/index.php?occid=500244,SA,"some are clippings, top right corner is a plant but too dark to score accurately; bottom plant has too many cut stems",1,Total,7,6,1,0,0,,,1.571428571
SD00010633,3/8/2008,2008,3,8,68,integrifolia,San Diego,"Poway, behind Pomerado Hospital on Pomerado Rd.",336,32.99836,-117.04968,,,,WGS84,cch2,500244,FL,"Decomposed granite, boulders, sand",http://cch2.org/portal/collections/individual/index.php?occid=500244,SA,,2,Total,7,8,1,0,0,,,1.625
SD00010469,3/27/1971,1971,3,27,86,menziesii,San Diego,"Shade of live oaks along San Vicente Rd. near junction with Wildcat Canyon Rd., western San Vicente Valley.",390,33,-116.83333,402,,,WGS84,cch2,500128,FL,,http://cch2.org/portal/collections/individual/index.php?occid=500128,SA,third one on row 1 is a clipping,1,Total,5,3,0,2,0,,,1.9
SD00010469,3/27/1971,1971,3,27,86,menziesii,San Diego,"Shade of live oaks along San Vicente Rd. near junction with Wildcat Canyon Rd., western San Vicente Valley.",390,33,-116.83333,402,,,WGS84,cch2,500128,FL,,http://cch2.org/portal/collections/individual/index.php?occid=500128,SA,,2,Total,2,3,1,4,0,,,2.7
SD00010469,3/27/1971,1971,3,27,86,menziesii,San Diego,"Shade of live oaks along San Vicente Rd. near junction with Wildcat Canyon Rd., western San Vicente Valley.",390,33,-116.83333,402,,,WGS84,cch2,500128,FL,,http://cch2.org/portal/collections/individual/index.php?occid=500128,SA,,3,Total,6,9,0,3,0,,,2
SD00010469,3/27/1971,1971,3,27,86,menziesii,San Diego,"Shade of live oaks along San Vicente Rd. near junction with Wildcat Canyon Rd., western San Vicente Valley.",390,33,-116.83333,402,,,WGS84,cch2,500128,FL,,http://cch2.org/portal/collections/individual/index.php?occid=500128,SA,,4,Total,4,6,1,5,0,,,2.4375
SD00010469,3/27/1971,1971,3,27,86,menziesii,San Diego,"Shade of live oaks along San Vicente Rd. near junction with Wildcat Canyon Rd., western San Vicente Valley.",390,33,-116.83333,402,,,WGS84,cch2,500128,FL,,http://cch2.org/portal/collections/individual/index.php?occid=500128,SA,,5,Total,3,3,0,0,0,,,1.5
SD00010469,3/27/1971,1971,3,27,86,menziesii,San Diego,"Shade of live oaks along San Vicente Rd. near junction with Wildcat Canyon Rd., western San Vicente Valley.",390,33,-116.83333,402,,,WGS84,cch2,500128,FL,,http://cch2.org/portal/collections/individual/index.php?occid=500128,SA,,6,Total,2,3,1,0,0,,,1.833333333
SD00010469,3/27/1971,1971,3,27,86,menziesii,San Diego,"Shade of live oaks along San Vicente Rd. near junction with Wildcat Canyon Rd., western San Vicente Valley.",390,33,-116.83333,402,,,WGS84,cch2,500128,FL,,http://cch2.org/portal/collections/individual/index.php?occid=500128,SA,,7,Total,1,2,0,2,0,,,2.6
SD00010469,3/27/1971,1971,3,27,86,menziesii,San Diego,"Shade of live oaks along San Vicente Rd. near junction with Wildcat Canyon Rd., western San Vicente Valley.",390,33,-116.83333,402,,,WGS84,cch2,500128,FL,,http://cch2.org/portal/collections/individual/index.php?occid=500128,SA,Part of the plant is covered by the ruler,8,Total,6,5,1,2,0,,,1.928571429
SD00010469,3/27/1971,1971,3,27,86,menziesii,San Diego,"Shade of live oaks along San Vicente Rd. near junction with Wildcat Canyon Rd., western San Vicente Valley.",390,33,-116.83333,402,,,WGS84,cch2,500128,FL,,http://cch2.org/portal/collections/individual/index.php?occid=500128,SA,,9,Total,2,2,0,1,0,,,2
SD00010469,3/27/1971,1971,3,27,86,menziesii,San Diego,"Shade of live oaks along San Vicente Rd. near junction with Wildcat Canyon Rd., western San Vicente Valley.",390,33,-116.83333,402,,,WGS84,cch2,500128,FL,,http://cch2.org/portal/collections/individual/index.php?occid=500128,SA,,10,Total,1,2,0,3,0,,,2.833333333
SD00010469,3/27/1971,1971,3,27,86,menziesii,San Diego,"Shade of live oaks along San Vicente Rd. near junction with Wildcat Canyon Rd., western San Vicente Valley.",390,33,-116.83333,402,,,WGS84,cch2,500128,FL,,http://cch2.org/portal/collections/individual/index.php?occid=500128,SA,,11,Total,1,2,0,0,0,,,1.666666667
SD00010528,3/31/1990,1990,3,31,90,integrifolia,San Diego,"San Elijo Lagoon Ecological Reserve; South of trail near junction with N. Rios Ave, Solana Beach. West of I-5, east of Hwy 101. South side of Reserve.",15,33.00366,-117.27198,,,,WGS84,cch2,500328,FFL,shaded n.-facing slope,http://cch2.org/portal/collections/individual/index.php?occid=500328,SA,Left plant is a clipping,1,Total,1,3,0,6,1,,,3.272727273
SD00010527,3/9/2008,2008,3,9,69,menziesii,San Diego,"San Elijo Lagoon Ecological Reserve; South side of trail approx ½ way between trailheads, Santa Carina and Santa Helena. Solana Beach.",6,33.00921,-117.24916,,,,WGS84,cch2,500329,FFL,Sandy north-facing slope,http://cch2.org/portal/collections/individual/index.php?occid=500329,SA,top left is missing a lot of stems,1,Total,2,6,1,4,0,,,2.538461538
SD00010527,3/9/2008,2008,3,9,69,menziesii,San Diego,"San Elijo Lagoon Ecological Reserve; South side of trail approx ½ way between trailheads, Santa Carina and Santa Helena. Solana Beach.",6,33.00921,-117.24916,,,,WGS84,cch2,500329,FFL,Sandy north-facing slope,http://cch2.org/portal/collections/individual/index.php?occid=500329,SA,big plant on the left,2,Total,9,20,7,5,1,,,2.261904762
SD00010527,3/9/2008,2008,3,9,69,menziesii,San Diego,"San Elijo Lagoon Ecological Reserve; South side of trail approx ½ way between trailheads, Santa Carina and Santa Helena. Solana Beach.",6,33.00921,-117.24916,,,,WGS84,cch2,500329,FFL,Sandy north-facing slope,http://cch2.org/portal/collections/individual/index.php?occid=500329,SA,plant on the right,3,Total,1,1,0,0,0,,,1.5
SD00010636,3/11/2008,2008,3,11,71,integrifolia,San Diego,City of Solana Beach. San Elijo Ecological Reserve. South East section. Santa Helena entrance. 180 meters west of trail intersection north of Santa Helena entrance. 840 meters west of west end of El Camino Real,2,33.0093,-117.249,,,,WGS84,cch2,500239,FL,"Lightly disturbed area on slight north facing slope next to trail, Chino silt loam",http://cch2.org/portal/collections/individual/index.php?occid=500239,SA,top left; highest one is a clipping,1,Total,3,2,1,4,0,,,2.6
SD00010636,3/11/2008,2008,3,11,71,integrifolia,San Diego,City of Solana Beach. San Elijo Ecological Reserve. South East section. Santa Helena entrance. 180 meters west of trail intersection north of Santa Helena entrance. 840 meters west of west end of El Camino Real,2,33.0093,-117.249,,,,WGS84,cch2,500239,FL,"Lightly disturbed area on slight north facing slope next to trail, Chino silt loam",http://cch2.org/portal/collections/individual/index.php?occid=500239,SA,,2,Total,1,2,1,2,0,,,2.666666667
SD00010636,3/11/2008,2008,3,11,71,integrifolia,San Diego,City of Solana Beach. San Elijo Ecological Reserve. South East section. Santa Helena entrance. 180 meters west of trail intersection north of Santa Helena entrance. 840 meters west of west end of El Camino Real,2,33.0093,-117.249,,,,WGS84,cch2,500239,FL,"Lightly disturbed area on slight north facing slope next to trail, Chino silt loam",http://cch2.org/portal/collections/individual/index.php?occid=500239,SA,,3,Total,3,1,0,0,0,,,1.25
SD00010636,3/11/2008,2008,3,11,71,integrifolia,San Diego,City of Solana Beach. San Elijo Ecological Reserve. South East section. Santa Helena entrance. 180 meters west of trail intersection north of Santa Helena entrance. 840 meters west of west end of El Camino Real,2,33.0093,-117.249,,,,WGS84,cch2,500239,FL,"Lightly disturbed area on slight north facing slope next to trail, Chino silt loam",http://cch2.org/portal/collections/individual/index.php?occid=500239,SA,,4,Total,1,5,2,2,0,,,2.5
SD00010636,3/11/2008,2008,3,11,71,integrifolia,San Diego,City of Solana Beach. San Elijo Ecological Reserve. South East section. Santa Helena entrance. 180 meters west of trail intersection north of Santa Helena entrance. 840 meters west of west end of El Camino Real,2,33.0093,-117.249,,,,WGS84,cch2,500239,FL,"Lightly disturbed area on slight north facing slope next to trail, Chino silt loam",http://cch2.org/portal/collections/individual/index.php?occid=500239,SA,,5,Total,4,7,1,3,0,,,2.2
SD00010626,4/2/2007,2007,4,2,92,integrifolia,San Diego,"Lake Poway, Poway; entered at intersection of Espola Rd and Lake Poway Roads; collection points on the Lake Poway loop trail.",289,33.01095,-117.01225,,,,WGS84,cch2,500233,FL,Granitic soils.,http://cch2.org/portal/collections/individual/index.php?occid=500233,SA,,1,Total,4,4,0,5,1,,,2.642857143
SD00010626,4/2/2007,2007,4,2,92,integrifolia,San Diego,"Lake Poway, Poway; entered at intersection of Espola Rd and Lake Poway Roads; collection points on the Lake Poway loop trail.",289,33.01095,-117.01225,,,,WGS84,cch2,500233,FL,Granitic soils.,http://cch2.org/portal/collections/individual/index.php?occid=500233,SA,,2,Total,2,0,0,2,0,,,2.5
SD00010640,5/13/2007,2007,5,13,133,integrifolia,San Diego,"Cleveland National Forest, Cuyamaca Mountains, 1 mi W of North Peak, S of Cosmit Indian Reservation, E of Engineers Road, near Grandview Road",1372,33.016,-116.612,,,,WGS84,cch2,500225,FL,clayey loam 15% W slope,http://cch2.org/portal/collections/individual/index.php?occid=500225,SA,,1,Total,9,50,10,19,11,,,2.727272727
SD00010623,3/7/2008,2008,3,7,67,integrifolia,San Diego,"Blue Sky Ecological Reserve, Poway. Ca. 0.25 mi SW of the Lake Ramona Dam and 1.5 mi NE of the intersection of Lake Poway Rd and Espola Rd.",339,33.02106,-117.0006,,,,WGS84,cch2,500255,FL,Granitic soils changing from streamside moist soils to dry hillsides.,http://cch2.org/portal/collections/individual/index.php?occid=500255,SA,,1,Total,19,7,0,0,0,,,1.269230769
SD00010644,4/28/2007,2007,4,28,118,integrifolia,San Diego,"Cleveland National Forest, west of Cuyamaca Mtns, about 5 miles south of intersection of Hwy 78 and Hwy 79, .25 mile north of Eagle Peak Road near road to Deadman Flat",1040,33.0274,-116.6713,,,,WGS84,cch2,500221,FFL,granitic: steep north-facing slope,http://cch2.org/portal/collections/individual/index.php?occid=500221,SA,top,1,Total,1,7,9,29,6,,,3.615384615
SD00010644,4/28/2007,2007,4,28,118,integrifolia,San Diego,"Cleveland National Forest, west of Cuyamaca Mtns, about 5 miles south of intersection of Hwy 78 and Hwy 79, .25 mile north of Eagle Peak Road near road to Deadman Flat",1040,33.0274,-116.6713,,,,WGS84,cch2,500221,FFL,granitic: steep north-facing slope,http://cch2.org/portal/collections/individual/index.php?occid=500221,SA,bottom,2,Total,0,5,6,11,3,,,3.48
SD00010631,4/4/2008,2008,4,4,95,integrifolia,San Diego,"Cleveland National Forest, W of Cuyamaca Mtns, about 0.5 miles east of Deadman Flat, about .25 miles north of Eagle Peak Road, about 2.75 milesby road SW of intersection with Boulder Creek Road",1240,33.0344,-116.6609,,,,WGS84,cch2,500248,FL,granitic: near crest of rocky knoll,http://cch2.org/portal/collections/individual/index.php?occid=500248,SA,top,1,Total,2,8,2,5,0,,,2.588235294
SD00010631,4/4/2008,2008,4,4,95,integrifolia,San Diego,"Cleveland National Forest, W of Cuyamaca Mtns, about 0.5 miles east of Deadman Flat, about .25 miles north of Eagle Peak Road, about 2.75 milesby road SW of intersection with Boulder Creek Road",1240,33.0344,-116.6609,,,,WGS84,cch2,500248,FL,granitic: near crest of rocky knoll,http://cch2.org/portal/collections/individual/index.php?occid=500248,SA,bottom left,2,Total,1,7,0,5,0,,,2.692307692
SD00010631,4/4/2008,2008,4,4,95,integrifolia,San Diego,"Cleveland National Forest, W of Cuyamaca Mtns, about 0.5 miles east of Deadman Flat, about .25 miles north of Eagle Peak Road, about 2.75 milesby road SW of intersection with Boulder Creek Road",1240,33.0344,-116.6609,,,,WGS84,cch2,500248,FL,granitic: near crest of rocky knoll,http://cch2.org/portal/collections/individual/index.php?occid=500248,SA,bottom right,3,Total,0,6,2,4,0,,,2.833333333
SD00010570,5/5/1936,1936,5,5,126,integrifolia,San Diego,Pine Hills,1340.51,33.04838,-116.63085,1609,,,WGS84,cch2,500060,FFL,,http://cch2.org/portal/collections/individual/index.php?occid=500060,SA,Middle plant is a clipping,1,Total,0,1,0,2,2,,,4
SD00010570,5/5/1936,1936,5,5,126,integrifolia,San Diego,Pine Hills,1340.51,33.04838,-116.63085,1609,,,WGS84,cch2,500060,FFL,,http://cch2.org/portal/collections/individual/index.php?occid=500060,SA,,2,Total,0,2,1,3,0,,,3.166666667
SD00010595,1/22/2005,2005,1,22,22,integrifolia,San Diego,"Lake Hodges, S of Escondido. SE section of lake, 0.5 mi SE of summit of Bernardo Mtn, 0.5 mi W of I-15. Very near high-water mark (lake recently filled).",105,33.0571,-117.0807,,,,WGS84,cch2,500205,FL,"Gentle, NW slope.",http://cch2.org/portal/collections/individual/index.php?occid=500205,SA,Furthest on the right is a clipping,1,Total,0,2,0,2,0,,,3
SD00010595,1/22/2005,2005,1,22,22,integrifolia,San Diego,"Lake Hodges, S of Escondido. SE section of lake, 0.5 mi SE of summit of Bernardo Mtn, 0.5 mi W of I-15. Very near high-water mark (lake recently filled).",105,33.0571,-117.0807,,,,WGS84,cch2,500205,FL,"Gentle, NW slope.",http://cch2.org/portal/collections/individual/index.php?occid=500205,SA,,2,Total,0,1,0,0,0,,,2
SD00010595,1/22/2005,2005,1,22,22,integrifolia,San Diego,"Lake Hodges, S of Escondido. SE section of lake, 0.5 mi SE of summit of Bernardo Mtn, 0.5 mi W of I-15. Very near high-water mark (lake recently filled).",105,33.0571,-117.0807,,,,WGS84,cch2,500205,FL,"Gentle, NW slope.",http://cch2.org/portal/collections/individual/index.php?occid=500205,SA,,3,Total,0,1,0,0,0,,,2
SD00010595,1/22/2005,2005,1,22,22,integrifolia,San Diego,"Lake Hodges, S of Escondido. SE section of lake, 0.5 mi SE of summit of Bernardo Mtn, 0.5 mi W of I-15. Very near high-water mark (lake recently filled).",105,33.0571,-117.0807,,,,WGS84,cch2,500205,FL,"Gentle, NW slope.",http://cch2.org/portal/collections/individual/index.php?occid=500205,SA,,4,Total,4,9,3,7,0,,,2.565217391
SD00010544,3/26/2013,2013,3,26,85,integrifolia,San Diego,Lake Hodges: south of Escondido; southeast of the intersection of Lake Drive and Beech Lane; along the north side of Lake southeast of the boat ramp; on a northeast-facing slope,130,33.06329,-117.1004,,,,WGS84,cch2,500287,FFL,,http://cch2.org/portal/collections/individual/index.php?occid=500287,SA,"bottom left; plant 2 had a clipping in it that was hard to differentiate, plant to the right of plant 1",1,Total,3,5,1,2,0,,,2.181818182
SD00010455,4/15/2007,2007,4,15,105,menziesii,San Diego,"Banner, 3 mi E of Julian, 0.2 mi. east of Banner Recreation Ranch, drainage south of State hwy. 78 south of remnant historic bridge and road.",845,33.06759,-116.54417,,,,WGS84,cch2,500241,FL,"above dry drainage, E-facing slope, sandy loam.",http://cch2.org/portal/collections/individual/index.php?occid=500241,SA,,1,Total,1,1,1,0,0,,,2
SD00010455,4/15/2007,2007,4,15,105,menziesii,San Diego,"Banner, 3 mi E of Julian, 0.2 mi. east of Banner Recreation Ranch, drainage south of State hwy. 78 south of remnant historic bridge and road.",845,33.06759,-116.54417,,,,WGS84,cch2,500241,FL,"above dry drainage, E-facing slope, sandy loam.",http://cch2.org/portal/collections/individual/index.php?occid=500241,SA,,2,Total,3,3,2,1,0,,,2.111111111
SD00010455,4/15/2007,2007,4,15,105,menziesii,San Diego,"Banner, 3 mi E of Julian, 0.2 mi. east of Banner Recreation Ranch, drainage south of State hwy. 78 south of remnant historic bridge and road.",845,33.06759,-116.54417,,,,WGS84,cch2,500241,FL,"above dry drainage, E-facing slope, sandy loam.",http://cch2.org/portal/collections/individual/index.php?occid=500241,SA,,3,Total,1,2,0,0,0,,,1.666666667
SD00010455,4/15/2007,2007,4,15,105,menziesii,San Diego,"Banner, 3 mi E of Julian, 0.2 mi. east of Banner Recreation Ranch, drainage south of State hwy. 78 south of remnant historic bridge and road.",845,33.06759,-116.54417,,,,WGS84,cch2,500241,FL,"above dry drainage, E-facing slope, sandy loam.",http://cch2.org/portal/collections/individual/index.php?occid=500241,SA,,4,Total,2,3,0,1,0,,,2
SD00010455,4/15/2007,2007,4,15,105,menziesii,San Diego,"Banner, 3 mi E of Julian, 0.2 mi. east of Banner Recreation Ranch, drainage south of State hwy. 78 south of remnant historic bridge and road.",845,33.06759,-116.54417,,,,WGS84,cch2,500241,FL,"above dry drainage, E-facing slope, sandy loam.",http://cch2.org/portal/collections/individual/index.php?occid=500241,SA,,5,Total,1,2,0,1,0,,,2.25
SD00010455,4/15/2007,2007,4,15,105,menziesii,San Diego,"Banner, 3 mi E of Julian, 0.2 mi. east of Banner Recreation Ranch, drainage south of State hwy. 78 south of remnant historic bridge and road.",845,33.06759,-116.54417,,,,WGS84,cch2,500241,FL,"above dry drainage, E-facing slope, sandy loam.",http://cch2.org/portal/collections/individual/index.php?occid=500241,SA,,6,Total,0,3,1,1,0,,,2.6
SDSU06111,4/24/1988,1988,4,24,115,integrifolia,San Diego,"Julian. Go 1/2 mile down Pine Hills Rd. off Hwy. 78. Turn left on private road and proceed for ca. 1/2 mile to small apple orchard on left. Proceed on foot in northerly direction ca. 100 yards; then east, crossing streambed and under barbed wire fence. Collection site is ca. 75 yards east of fence (Private property; permission required)",1205.99,33.06859,-116.61022,805,,,,cch2,380516,,"Growing under Arctostaphylos pungens in open, rocky, flat terrain. Nearby Associates: Erriogonum fasciclulatum and Lupinus.",http://cch2.org/portal/collections/individual/index.php?occid=380516,SA,,1,Total,2,10,0,6,0,,,2.555555556
SD00010601,4/19/1935,1935,4,19,109,integrifolia,San Diego,Near Banner,840.19,33.06883,-116.54613,1207,,,WGS84,cch2,500090,FFL,,http://cch2.org/portal/collections/individual/index.php?occid=500090,SA,Image too dark,NA,,,,,,,,,#DIV/0!
SD00010536,3/27/2004,2004,3,27,87,integrifolia,San Diego,"3225 Pine Hills Road, Julian, CA 92036",1290,33.07056,-116.60194,,,,WGS84,cch2,500185,UNK,Loamy soil and some exposed rocks -- volcanic type with some quartz veins. Some flat areas but also steep slopes.,http://cch2.org/portal/collections/individual/index.php?occid=500185,SA,,1,Total,0,3,0,0,0,,,2
SD00010536,3/27/2004,2004,3,27,87,integrifolia,San Diego,"3225 Pine Hills Road, Julian, CA 92036",1290,33.07056,-116.60194,,,,WGS84,cch2,500185,UNK,Loamy soil and some exposed rocks -- volcanic type with some quartz veins. Some flat areas but also steep slopes.,http://cch2.org/portal/collections/individual/index.php?occid=500185,SA,,2,Total,2,7,4,1,0,,,2.285714286
SD00010536,3/27/2004,2004,3,27,87,integrifolia,San Diego,"3225 Pine Hills Road, Julian, CA 92036",1290,33.07056,-116.60194,,,,WGS84,cch2,500185,UNK,Loamy soil and some exposed rocks -- volcanic type with some quartz veins. Some flat areas but also steep slopes.,http://cch2.org/portal/collections/individual/index.php?occid=500185,SA,top right,3,Total,0,2,1,0,0,,,2.333333333
SD00010536,3/27/2004,2004,3,27,87,integrifolia,San Diego,"3225 Pine Hills Road, Julian, CA 92036",1290,33.07056,-116.60194,,,,WGS84,cch2,500185,UNK,Loamy soil and some exposed rocks -- volcanic type with some quartz veins. Some flat areas but also steep slopes.,http://cch2.org/portal/collections/individual/index.php?occid=500185,SA,bottom right,4,Total,1,2,2,0,0,,,2.2
SD00010573,5/10/1938,1938,5,10,130,integrifolia,San Diego,Pine Hills Junction,1216.89,33.07822,-116.61748,402,,,WGS84,cch2,500069,FFL,,http://cch2.org/portal/collections/individual/index.php?occid=500069,SA,,1,Total,1,1,0,5,1,,,3.5
SD00010573,5/10/1938,1938,5,10,130,integrifolia,San Diego,Pine Hills Junction,1216.89,33.07822,-116.61748,402,,,WGS84,cch2,500069,FFL,,http://cch2.org/portal/collections/individual/index.php?occid=500069,SA,,2,Total,2,12,4,16,2,,,3.111111111
SD00010573,5/10/1938,1938,5,10,130,integrifolia,San Diego,Pine Hills Junction,1216.89,33.07822,-116.61748,402,,,WGS84,cch2,500069,FFL,,http://cch2.org/portal/collections/individual/index.php?occid=500069,SA,,3,Total,0,2,0,4,0,,,3.333333333
SD00010449,4/1/2010,2010,4,1,91,menziesii,San Diego,"San Felipe Valley Wildlife Area, California Fish & Game property. SW of San Felipe Valley, 1.6 miles ENE of Banner and 3.0 miles WSW of intersection of County Road S-2 and State hwy. 78. S-side of 78.",770,33.08049,-116.52357,,,,WGS84,cch2,500270,FFL,"W-facing, sandy slope below rocky hill.",http://cch2.org/portal/collections/individual/index.php?occid=500270,SA,left,1,Total,2,3,0,2,0,,,2.285714286
SD00010449,4/1/2010,2010,4,1,91,menziesii,San Diego,"San Felipe Valley Wildlife Area, California Fish & Game property. SW of San Felipe Valley, 1.6 miles ENE of Banner and 3.0 miles WSW of intersection of County Road S-2 and State hwy. 78. S-side of 78.",770,33.08049,-116.52357,,,,WGS84,cch2,500270,FFL,"W-facing, sandy slope below rocky hill.",http://cch2.org/portal/collections/individual/index.php?occid=500270,SA,second from left,2,Total,2,2,0,0,0,,,1.5
SD00010449,4/1/2010,2010,4,1,91,menziesii,San Diego,"San Felipe Valley Wildlife Area, California Fish & Game property. SW of San Felipe Valley, 1.6 miles ENE of Banner and 3.0 miles WSW of intersection of County Road S-2 and State hwy. 78. S-side of 78.",770,33.08049,-116.52357,,,,WGS84,cch2,500270,FFL,"W-facing, sandy slope below rocky hill.",http://cch2.org/portal/collections/individual/index.php?occid=500270,SA,furthest on the right,3,Total,2,3,0,0,0,,,1.6
SD00010465,4/17/1935,1935,4,17,107,,San Diego,2 miles east of Banner,771.65,33.08232,-116.51855,805,,,WGS84,cch2,500051,FFL,,http://cch2.org/portal/collections/individual/index.php?occid=500051,SA,small plant on left,1,Total,0,2,1,2,1,,,3.333333333
SD00010465,4/17/1935,1935,4,17,107,,San Diego,2 miles east of Banner,771.65,33.08232,-116.51855,805,,,WGS84,cch2,500051,FFL,,http://cch2.org/portal/collections/individual/index.php?occid=500051,SA,middle,2,Total,12,13,0,8,0,,,2.121212121
SD00010465,4/17/1935,1935,4,17,107,,San Diego,2 miles east of Banner,771.65,33.08232,-116.51855,805,,,WGS84,cch2,500051,FFL,,http://cch2.org/portal/collections/individual/index.php?occid=500051,SA,small plant on right,3,Total,0,0,1,6,2,,,4.111111111
SD00010615,2/27/1935,1935,2,27,58,integrifolia,San Diego,"Bluff on San Marcos Creek, near Green Valley School",52.5,33.0857,-117.2639,3218,,,WGS84,cch2,500046,FL,,http://cch2.org/portal/collections/individual/index.php?occid=500046,SA,,1,Total,4,4,1,0,0,,,1.666666667
SD00010615,2/27/1935,1935,2,27,58,integrifolia,San Diego,"Bluff on San Marcos Creek, near Green Valley School",52.5,33.0857,-117.2639,3218,,,WGS84,cch2,500046,FL,,http://cch2.org/portal/collections/individual/index.php?occid=500046,SA,,2,Total,3,7,3,0,0,,,2
SD00010615,2/27/1935,1935,2,27,58,integrifolia,San Diego,"Bluff on San Marcos Creek, near Green Valley School",52.5,33.0857,-117.2639,3218,,,WGS84,cch2,500046,FL,,http://cch2.org/portal/collections/individual/index.php?occid=500046,SA,,3,Total,9,12,3,2,0,,,1.923076923
SD00010615,2/27/1935,1935,2,27,58,integrifolia,San Diego,"Bluff on San Marcos Creek, near Green Valley School",52.5,33.0857,-117.2639,3218,,,WGS84,cch2,500046,FL,,http://cch2.org/portal/collections/individual/index.php?occid=500046,SA,,4,Total,2,5,3,0,0,,,2.1
SD00010642,5/11/2007,2007,5,11,131,integrifolia,San Diego,"Ramona, ca 3.5 mi NW of, NE of San Pasqual Valley Road, on Lower Isabel Creek Rd.",239,33.08972,-116.89472,,,,WGS84,cch2,500223,FL,"n facing roadcut 30*,sand, decomposing granite",http://cch2.org/portal/collections/individual/index.php?occid=500223,SA,"It seems like majority of the plant is there, but there are a lot of cut stems",1,Total,6,16,10,16,2,,,2.84
SD00010574,2/20/1935,1935,2,20,51,integrifolia,San Diego,"Springhill, near Ramona",711.77,33.09021,-116.79119,805,,,WGS84,cch2,500044,FL,,http://cch2.org/portal/collections/individual/index.php?occid=500044,SA,"Row 1, Plant 1",1,Total,1,1,0,0,0,,,1.5
SD00010574,2/20/1935,1935,2,20,51,integrifolia,San Diego,"Springhill, near Ramona",711.77,33.09021,-116.79119,805,,,WGS84,cch2,500044,FL,,http://cch2.org/portal/collections/individual/index.php?occid=500044,SA,"Row 1, Plant 4",2,Total,0,1,0,0,0,,,2
SD00010574,2/20/1935,1935,2,20,51,integrifolia,San Diego,"Springhill, near Ramona",711.77,33.09021,-116.79119,805,,,WGS84,cch2,500044,FL,,http://cch2.org/portal/collections/individual/index.php?occid=500044,SA,"Row 2, Plant 1",3,Total,1,2,0,0,0,,,1.666666667
SD00010574,2/20/1935,1935,2,20,51,integrifolia,San Diego,"Springhill, near Ramona",711.77,33.09021,-116.79119,805,,,WGS84,cch2,500044,FL,,http://cch2.org/portal/collections/individual/index.php?occid=500044,SA,"Row 2, Plant 2",4,Total,2,1,0,0,0,,,1.333333333
SD00010574,2/20/1935,1935,2,20,51,integrifolia,San Diego,"Springhill, near Ramona",711.77,33.09021,-116.79119,805,,,WGS84,cch2,500044,FL,,http://cch2.org/portal/collections/individual/index.php?occid=500044,SA,"Row 2, Plant 3",5,Total,1,1,0,0,0,,,1.5
SD00010574,2/20/1935,1935,2,20,51,integrifolia,San Diego,"Springhill, near Ramona",711.77,33.09021,-116.79119,805,,,WGS84,cch2,500044,FL,,http://cch2.org/portal/collections/individual/index.php?occid=500044,SA,"Row 2, Plant 4",6,Total,1,1,0,0,0,,,1.5
SD00010574,2/20/1935,1935,2,20,51,integrifolia,San Diego,"Springhill, near Ramona",711.77,33.09021,-116.79119,805,,,WGS84,cch2,500044,FL,,http://cch2.org/portal/collections/individual/index.php?occid=500044,SA,"Row 2, Plant 5",7,Total,1,1,0,0,0,,,1.5
SD00010574,2/20/1935,1935,2,20,51,integrifolia,San Diego,"Springhill, near Ramona",711.77,33.09021,-116.79119,805,,,WGS84,cch2,500044,FL,,http://cch2.org/portal/collections/individual/index.php?occid=500044,SA,"Row 2, Plant 6",8,Total,1,1,0,1,0,,,2.333333333
SD00010574,2/20/1935,1935,2,20,51,integrifolia,San Diego,"Springhill, near Ramona",711.77,33.09021,-116.79119,805,,,WGS84,cch2,500044,FL,,http://cch2.org/portal/collections/individual/index.php?occid=500044,SA,"Row 3, Plant 1",9,Total,0,1,0,0,0,,,2
SD00010574,2/20/1935,1935,2,20,51,integrifolia,San Diego,"Springhill, near Ramona",711.77,33.09021,-116.79119,805,,,WGS84,cch2,500044,FL,,http://cch2.org/portal/collections/individual/index.php?occid=500044,SA,"Row 3, Plant 2",10,Total,3,2,0,1,0,,,1.833333333
SD00010574,2/20/1935,1935,2,20,51,integrifolia,San Diego,"Springhill, near Ramona",711.77,33.09021,-116.79119,805,,,WGS84,cch2,500044,FL,,http://cch2.org/portal/collections/individual/index.php?occid=500044,SA,"Row 3, Plant 3",11,Total,2,3,0,0,0,,,1.6
SD00010574,2/20/1935,1935,2,20,51,integrifolia,San Diego,"Springhill, near Ramona",711.77,33.09021,-116.79119,805,,,WGS84,cch2,500044,FL,,http://cch2.org/portal/collections/individual/index.php?occid=500044,SA,"Row 3, Plant 4",12,Total,2,1,0,0,0,,,1.333333333
SD00010574,2/20/1935,1935,2,20,51,integrifolia,San Diego,"Springhill, near Ramona",711.77,33.09021,-116.79119,805,,,WGS84,cch2,500044,FL,,http://cch2.org/portal/collections/individual/index.php?occid=500044,SA,"Row 3, Plant 5",13,Total,2,1,0,0,0,,,1.333333333
SD00010574,2/20/1935,1935,2,20,51,integrifolia,San Diego,"Springhill, near Ramona",711.77,33.09021,-116.79119,805,,,WGS84,cch2,500044,FL,,http://cch2.org/portal/collections/individual/index.php?occid=500044,SA,"Row 4, Plant 1",14,Total,4,4,1,0,0,,,1.666666667
SD00010574,2/20/1935,1935,2,20,51,integrifolia,San Diego,"Springhill, near Ramona",711.77,33.09021,-116.79119,805,,,WGS84,cch2,500044,FL,,http://cch2.org/portal/collections/individual/index.php?occid=500044,SA,"Row 4, Plant2",15,Total,2,1,1,0,0,,,1.75
SD00010659,2/13/2005,2005,2,13,44,integrifolia,San Diego,0.5 mile SE of entrance to Inaja picnic area on Highway 78/79 between Santa Isabel and Wynola,1060,33.0971,-116.6592,,,,WGS84,cch2,500192,FL,"granitic: on steep, damp, west-facing slope near canyon rim",http://cch2.org/portal/collections/individual/index.php?occid=500192,SA,Top left,1,Total,1,1,0,0,0,,,1.5
SD00010659,2/13/2005,2005,2,13,44,integrifolia,San Diego,0.5 mile SE of entrance to Inaja picnic area on Highway 78/79 between Santa Isabel and Wynola,1060,33.0971,-116.6592,,,,WGS84,cch2,500192,FL,"granitic: on steep, damp, west-facing slope near canyon rim",http://cch2.org/portal/collections/individual/index.php?occid=500192,SA,top right,2,Total,1,2,0,0,0,,,1.666666667
SD00010659,2/13/2005,2005,2,13,44,integrifolia,San Diego,0.5 mile SE of entrance to Inaja picnic area on Highway 78/79 between Santa Isabel and Wynola,1060,33.0971,-116.6592,,,,WGS84,cch2,500192,FL,"granitic: on steep, damp, west-facing slope near canyon rim",http://cch2.org/portal/collections/individual/index.php?occid=500192,SA,Large plant in middle,3,Total,3,2,0,1,0,,,1.833333333
SD00010659,2/13/2005,2005,2,13,44,integrifolia,San Diego,0.5 mile SE of entrance to Inaja picnic area on Highway 78/79 between Santa Isabel and Wynola,1060,33.0971,-116.6592,,,,WGS84,cch2,500192,FL,"granitic: on steep, damp, west-facing slope near canyon rim",http://cch2.org/portal/collections/individual/index.php?occid=500192,SA,Plant to right of plant in middle,4,Total,0,1,0,0,0,,,2
SD00010659,2/13/2005,2005,2,13,44,integrifolia,San Diego,0.5 mile SE of entrance to Inaja picnic area on Highway 78/79 between Santa Isabel and Wynola,1060,33.0971,-116.6592,,,,WGS84,cch2,500192,FL,"granitic: on steep, damp, west-facing slope near canyon rim",http://cch2.org/portal/collections/individual/index.php?occid=500192,SA,"second row, far right",5,Total,1,1,0,0,0,,,1.5
SD00010659,2/13/2005,2005,2,13,44,integrifolia,San Diego,0.5 mile SE of entrance to Inaja picnic area on Highway 78/79 between Santa Isabel and Wynola,1060,33.0971,-116.6592,,,,WGS84,cch2,500192,FL,"granitic: on steep, damp, west-facing slope near canyon rim",http://cch2.org/portal/collections/individual/index.php?occid=500192,SA,bottom left,6,Total,0,1,0,0,0,,,2
SD00010659,2/13/2005,2005,2,13,44,integrifolia,San Diego,0.5 mile SE of entrance to Inaja picnic area on Highway 78/79 between Santa Isabel and Wynola,1060,33.0971,-116.6592,,,,WGS84,cch2,500192,FL,"granitic: on steep, damp, west-facing slope near canyon rim",http://cch2.org/portal/collections/individual/index.php?occid=500192,SA,bottom right,7,Total,0,1,0,0,0,,,2
SD00010533,7/5/2004,2004,7,5,187,integrifolia,San Diego,"in seasonal creek bed in oak woodland, .5 mile E of Inaja picnic area, ca 500 ft South of Hwy. 78/79",940,33.1022,-116.6607,,,,WGS84,cch2,500183,FFL,"sandy, granitic",http://cch2.org/portal/collections/individual/index.php?occid=500183,SA,Right one is a clipping,1,Total,1,1,0,2,0,,,2.75
SD00010518,4/29/2012,2012,4,29,120,integrifolia,San Diego,"Cleveland National Forest, Pamo Valley, Santa Ysabel Creek, along Forest route 12504 1/4 mile west of intersection with Pamo Valley Rd.",280,33.105,-116.86028,,,,WGS84,cch2,500339,FFL,"Granite boulders, D.G. soil, north facing moderate slope",http://cch2.org/portal/collections/individual/index.php?occid=500339,SA,Middle and far right are clippings,1,Total,1,2,0,1,0,,,2.25
SD00010645,3/1/2002,2002,3,1,60,integrifolia,San Diego,"San Diego Wild Animal Park, Conservation Area. In the northeast corner of the grounds near 'Condor Release Pens', approx. 1½ mi NW of the intersection of Rockwood Canyon and San Pasqual Valley Rd.",340,33.1061,-116.9814,,,,WGS84,cch2,500216,FL,Decomposed granite and granitic based soils.,http://cch2.org/portal/collections/individual/index.php?occid=500216,SA,bottom middle,1,Total,4,1,0,0,0,,,1.2
SD00010645,3/1/2002,2002,3,1,60,integrifolia,San Diego,"San Diego Wild Animal Park, Conservation Area. In the northeast corner of the grounds near 'Condor Release Pens', approx. 1½ mi NW of the intersection of Rockwood Canyon and San Pasqual Valley Rd.",340,33.1061,-116.9814,,,,WGS84,cch2,500216,FL,Decomposed granite and granitic based soils.,http://cch2.org/portal/collections/individual/index.php?occid=500216,SA,bottom right,2,Total,1,1,0,0,0,,,1.5
SD00010621,4/26/2009,2009,4,26,116,integrifolia,San Diego,North of Julian. Volcan Mountain Open Space Preserve. 583 meters north east of intersection of Farmer and Wynola Road.,1350,33.1071,-116.5978,,,,WGS84,cch2,500262,FL,Disturbed area along trail on west facing moderate slope,http://cch2.org/portal/collections/individual/index.php?occid=500262,SA,,1,Total,0,3,0,5,1,,,3.444444444
SD00010641,3/18/2007,2007,3,18,77,integrifolia,San Diego,"City of Escondido, 750 Feet South of Rockwood and Old Ranch Road intersection, 800 feet east of Rancho San Pasqual Union school, north-west facing, 5% slope",478,33.10972,-117.00722,,,,WGS84,cch2,500224,FL,granitic soil,http://cch2.org/portal/collections/individual/index.php?occid=500224,SA,,1,Total,3,1,0,0,0,,,1.25
SD00010641,3/18/2007,2007,3,18,77,integrifolia,San Diego,"City of Escondido, 750 Feet South of Rockwood and Old Ranch Road intersection, 800 feet east of Rancho San Pasqual Union school, north-west facing, 5% slope",478,33.10972,-117.00722,,,,WGS84,cch2,500224,FL,granitic soil,http://cch2.org/portal/collections/individual/index.php?occid=500224,SA,,2,Total,3,3,0,1,0,,,1.857142857
SD00010641,3/18/2007,2007,3,18,77,integrifolia,San Diego,"City of Escondido, 750 Feet South of Rockwood and Old Ranch Road intersection, 800 feet east of Rancho San Pasqual Union school, north-west facing, 5% slope",478,33.10972,-117.00722,,,,WGS84,cch2,500224,FL,granitic soil,http://cch2.org/portal/collections/individual/index.php?occid=500224,SA,,3,Total,1,3,0,1,0,,,2.2
SD00010641,3/18/2007,2007,3,18,77,integrifolia,San Diego,"City of Escondido, 750 Feet South of Rockwood and Old Ranch Road intersection, 800 feet east of Rancho San Pasqual Union school, north-west facing, 5% slope",478,33.10972,-117.00722,,,,WGS84,cch2,500224,FL,granitic soil,http://cch2.org/portal/collections/individual/index.php?occid=500224,SA,,4,Total,0,3,0,0,0,,,2
SD00010523,6/1/1993,1993,6,1,152,integrifolia,San Diego,"Volcan Mountains, north of Julian. Near road fork between Ferguson and Simmons Flats.",1606,33.1151,-116.58333,,,,WGS84,cch2,500333,FFL,,http://cch2.org/portal/collections/individual/index.php?occid=500333,SA,,1,Total,12,4,9,20,6,,,3.078431373
SD00010648,5/27/2005,2005,5,27,147,integrifolia,San Diego,"Volcan Mountains, San Felipe Valley Wildlife Area, approx. ½ mi E of Ferguson Flat. On steep slope far above outlet of Arkansas Cyn. East facing slope, 25-35 degrees.",1210,33.1233,-116.5725,,,,WGS84,cch2,500217,FFL,loose fine-grained loamy sand,http://cch2.org/portal/collections/individual/index.php?occid=500217,SA,far right is a clipping,1,Total,1,1,1,0,1,,,2.75
SD00010648,5/27/2005,2005,5,27,147,integrifolia,San Diego,"Volcan Mountains, San Felipe Valley Wildlife Area, approx. ½ mi E of Ferguson Flat. On steep slope far above outlet of Arkansas Cyn. East facing slope, 25-35 degrees.",1210,33.1233,-116.5725,,,,WGS84,cch2,500217,FFL,loose fine-grained loamy sand,http://cch2.org/portal/collections/individual/index.php?occid=500217,SA,,2,Total,0,0,0,3,4,,,4.571428571
SD00010513,3/15/2008,2008,3,15,75,integrifolia,San Diego,"City of Escondido, San Pasqual Valley, Rancho San Pasqual, 200 m north east of Orchard View and Old Ranch Road Intersection, 300 m north west of Ranchview Place and Rosewood Intersection, top of hill",217,33.12421,-117.0055,,,,WGS84,cch2,500348,FFL,"Decomposed Granite, slight slope, north facing.",http://cch2.org/portal/collections/individual/index.php?occid=500348,SA,,1,Total,11,16,8,12,0,,,2.446808511
SD00010513,3/15/2008,2008,3,15,75,integrifolia,San Diego,"City of Escondido, San Pasqual Valley, Rancho San Pasqual, 200 m north east of Orchard View and Old Ranch Road Intersection, 300 m north west of Ranchview Place and Rosewood Intersection, top of hill",217,33.12421,-117.0055,,,,WGS84,cch2,500348,FFL,"Decomposed Granite, slight slope, north facing.",http://cch2.org/portal/collections/individual/index.php?occid=500348,SA,,2,Total,4,6,3,10,0,,,2.826086957
SD00010513,3/15/2008,2008,3,15,75,integrifolia,San Diego,"City of Escondido, San Pasqual Valley, Rancho San Pasqual, 200 m north east of Orchard View and Old Ranch Road Intersection, 300 m north west of Ranchview Place and Rosewood Intersection, top of hill",217,33.12421,-117.0055,,,,WGS84,cch2,500348,FFL,"Decomposed Granite, slight slope, north facing.",http://cch2.org/portal/collections/individual/index.php?occid=500348,SA,,3,Total,5,4,3,5,0,,,2.470588235
SD00010433,4/18/2012,2012,4,18,109,menziesii,San Diego,"Arkansas Canyon, NE-flank of Volcan Mountain. San Felipe Valley Wildlife Area, California Fish & Game property. 5.7 air miles NW of intersection of State hwy. 78 and County Road S-2.",980,33.12596,-116.5638,,,,WGS84,cch2,500344,FFL,"Near end of access road. SE-facing slope of canyon, fine sandy soil and rocks.",http://cch2.org/portal/collections/individual/index.php?occid=500344,SA,,1,Total,1,2,2,6,1,,,3.333333333
SD00010433,4/18/2012,2012,4,18,109,menziesii,San Diego,"Arkansas Canyon, NE-flank of Volcan Mountain. San Felipe Valley Wildlife Area, California Fish & Game property. 5.7 air miles NW of intersection of State hwy. 78 and County Road S-2.",980,33.12596,-116.5638,,,,WGS84,cch2,500344,FFL,"Near end of access road. SE-facing slope of canyon, fine sandy soil and rocks.",http://cch2.org/portal/collections/individual/index.php?occid=500344,SA,,2,Total,3,2,1,1,2,,,2.666666667
SD00010433,4/18/2012,2012,4,18,109,menziesii,San Diego,"Arkansas Canyon, NE-flank of Volcan Mountain. San Felipe Valley Wildlife Area, California Fish & Game property. 5.7 air miles NW of intersection of State hwy. 78 and County Road S-2.",980,33.12596,-116.5638,,,,WGS84,cch2,500344,FFL,"Near end of access road. SE-facing slope of canyon, fine sandy soil and rocks.",http://cch2.org/portal/collections/individual/index.php?occid=500344,SA,,3,Total,2,4,2,3,2,,,2.923076923
SD00010514,2/28/1994,1994,2,28,59,integrifolia,San Diego,"San Felipe Valley, east of S-2, north of Sissors Crossing. Grid I-21.",764,33.12723,-116.51955,,,,WGS84,cch2,500351,FFL,,http://cch2.org/portal/collections/individual/index.php?occid=500351,SA,EXCLUDE: clipping,NA,,,,,,,,,#DIV/0!
SD00010522,5/25/1993,1993,5,25,145,integrifolia,San Diego,"Volcan Mountains, north of Julian. Near road, extension of Farmer (Volcan) Road, Rutherford Ranch.",1603,33.13311,-116.58407,,,,WGS84,cch2,500334,FFL,,http://cch2.org/portal/collections/individual/index.php?occid=500334,SA,,1,Total,2,4,8,10,8,,,3.5625
SD00010571,5/8/1935,1935,5,8,128,integrifolia,San Diego,5 mi. south of Mesa Grande on Black Cañon Road,612.52,33.13604,-116.79118,805,,,WGS84,cch2,500053,FFL,,http://cch2.org/portal/collections/individual/index.php?occid=500053,SA,Left is a clipping,1,Total,4,3,6,7,3,,,3.086956522
SD00010448,2/24/1997,1997,2,24,55,menziesii,San Diego,"San Felipe Valley, approx 5.0 air miles NW of intersection of State Hwy 78 and County Hwy S-2 within the San Felipe Valley Wildlife Area, California Dept. of Fish & Game. 200 feet E of S-2 at SW corner of property.",831,33.1403,-116.5297,,,,WGS84,cch2,500203,FL,NW-facing slope among rocks in course sandy loam.,http://cch2.org/portal/collections/individual/index.php?occid=500203,SA,top one and bottom left are clippings,1,Total,2,3,0,0,0,,,1.6
SD00010448,2/24/1997,1997,2,24,55,menziesii,San Diego,"San Felipe Valley, approx 5.0 air miles NW of intersection of State Hwy 78 and County Hwy S-2 within the San Felipe Valley Wildlife Area, California Dept. of Fish & Game. 200 feet E of S-2 at SW corner of property.",831,33.1403,-116.5297,,,,WGS84,cch2,500203,FL,NW-facing slope among rocks in course sandy loam.,http://cch2.org/portal/collections/individual/index.php?occid=500203,SA,,2,Total,2,1,0,2,0,,,2.4
SD00010448,2/24/1997,1997,2,24,55,menziesii,San Diego,"San Felipe Valley, approx 5.0 air miles NW of intersection of State Hwy 78 and County Hwy S-2 within the San Felipe Valley Wildlife Area, California Dept. of Fish & Game. 200 feet E of S-2 at SW corner of property.",831,33.1403,-116.5297,,,,WGS84,cch2,500203,FL,NW-facing slope among rocks in course sandy loam.,http://cch2.org/portal/collections/individual/index.php?occid=500203,SA,,3,Total,2,1,0,0,0,,,1.333333333
SD00010512,5/12/2009,2009,5,12,132,integrifolia,San Diego,Julian; Rutherford Ranch; Volcan Mtns.; 2.71 miles N of junction Farmer Rd. & Wynola Road; Hunter's Camp area; near Santa Ysabel Crk.,1549,33.14194,-116.6025,,,,WGS84,cch2,500349,FFL,Crouch coarse sandy loam.,http://cch2.org/portal/collections/individual/index.php?occid=500349,SA,,1,Total,2,4,1,8,3,,,3.333333333
SD00010446,3/15/2005,2005,3,15,74,menziesii,San Diego,"Ranchita, 1 mi S of junction of Montezuma Valley Rd (S22) and Wilson Rd, 7 mi NW of junction of HWY 78 and San Felipe Rd (S2)",1223,33.19458,-116.50812,,,,WGS84,cch2,500227,FL,"Full sun, gentle, SW facing slope, granitic, sandy soil",http://cch2.org/portal/collections/individual/index.php?occid=500227,SA,top right is a clipping,1,Total,2,2,0,1,0,,,2
SD00010446,3/15/2005,2005,3,15,74,menziesii,San Diego,"Ranchita, 1 mi S of junction of Montezuma Valley Rd (S22) and Wilson Rd, 7 mi NW of junction of HWY 78 and San Felipe Rd (S2)",1223,33.19458,-116.50812,,,,WGS84,cch2,500227,FL,"Full sun, gentle, SW facing slope, granitic, sandy soil",http://cch2.org/portal/collections/individual/index.php?occid=500227,SA,,2,Total,2,1,0,2,0,,,2.4
SD00010624,4/29/2009,2009,4,29,119,integrifolia,San Diego,"Mesa Grande, Nature Conservancy (Wheatly Property), 2 miles W of Morettis Junction (Pala Road & Hwy 79) E of Mesa Grande Road, 2.5 miles S of dam at Lake Henshaw",1079,33.19901,-116.75103,,,,WGS84,cch2,500268,FL,granitic substrates,http://cch2.org/portal/collections/individual/index.php?occid=500268,SA,EXCLUDE: all clippings and blurry,NA,,,,,,,,,#DIV/0!
SD00010517,4/16/2010,2010,4,16,106,integrifolia,San Diego,"Cleveland National Forest, west side of Mesa Grande Road, North slope of the ridge above the Patton lode mine along the fence line of private property east of National Forest land.",860,33.20222,-116.81806,,,,WGS84,cch2,500340,FFL,"fairly steep North slope with granite boulders, seeps.",http://cch2.org/portal/collections/individual/index.php?occid=500340,SA,top left,1,Total,0,2,0,0,0,,,2
SD00010517,4/16/2010,2010,4,16,106,integrifolia,San Diego,"Cleveland National Forest, west side of Mesa Grande Road, North slope of the ridge above the Patton lode mine along the fence line of private property east of National Forest land.",860,33.20222,-116.81806,,,,WGS84,cch2,500340,FFL,"fairly steep North slope with granite boulders, seeps.",http://cch2.org/portal/collections/individual/index.php?occid=500340,SA,top right,2,Total,3,10,3,9,9,,,3.323529412
SD00010517,4/16/2010,2010,4,16,106,integrifolia,San Diego,"Cleveland National Forest, west side of Mesa Grande Road, North slope of the ridge above the Patton lode mine along the fence line of private property east of National Forest land.",860,33.20222,-116.81806,,,,WGS84,cch2,500340,FFL,"fairly steep North slope with granite boulders, seeps.",http://cch2.org/portal/collections/individual/index.php?occid=500340,SA,"bottom, looks like a clipping but has a solid base that they are all coming from",3,Total,1,3,1,7,2,,,3.428571429
SD00010463,4/14/1936,1936,4,14,105,,San Diego,Montezuma Valley,1230.37,33.21113,-116.52236,4023,,,WGS84,cch2,500056,FL,,http://cch2.org/portal/collections/individual/index.php?occid=500056,SA,Furthest right is a clipping,1,Total,0,1,1,0,0,,,2.5
SD00010463,4/14/1936,1936,4,14,105,,San Diego,Montezuma Valley,1230.37,33.21113,-116.52236,4023,,,WGS84,cch2,500056,FL,,http://cch2.org/portal/collections/individual/index.php?occid=500056,SA,,2,Total,2,2,1,2,0,,,2.428571429
SD00010467,4/29/1941,1941,4,29,119,,San Diego,Fresh burn at Montezuma View Point,1255.36,33.21145,-116.5124,805,,,WGS84,cch2,500078,FFL,,http://cch2.org/portal/collections/individual/index.php?occid=500078,SA,EXCLUDE: all clippings,NA,,,,,,,,,#DIV/0!
SD00010435,4/11/2014,2014,4,11,101,menziesii,San Diego,"Anza-Borrego Desert State Park, Chimney Spring Drainage, 6.14 air miles SW of Borrego Springs and .75 air mile NW of intersection of Old Culp Valley Road and County Hwy. S-22.",1021,33.21246,-116.46545,,,,WGS84,cch2,500342,FFL,Boulders and sand.,http://cch2.org/portal/collections/individual/index.php?occid=500342,SA,,1,Total,7,16,4,20,3,,,2.92
SD00010431,4/4/2009,2009,4,4,94,menziesii,San Diego,Warner Springs; Northeast facing slope along Pacific Crest Trail; 0.38 mile SE of Barrel Spring trailhead off of Montezuma Rd.,1097,33.2131,-116.583,,,,WGS84,cch2,500346,FL,"rocky, decompsing granite",http://cch2.org/portal/collections/individual/index.php?occid=500346,SA,"Top right is a clipping, numbered left to right",1,Total,1,1,0,0,0,,,1.5
SD00010431,4/4/2009,2009,4,4,94,menziesii,San Diego,Warner Springs; Northeast facing slope along Pacific Crest Trail; 0.38 mile SE of Barrel Spring trailhead off of Montezuma Rd.,1097,33.2131,-116.583,,,,WGS84,cch2,500346,FL,"rocky, decompsing granite",http://cch2.org/portal/collections/individual/index.php?occid=500346,SA,,2,Total,0,1,0,0,0,,,2
SD00010431,4/4/2009,2009,4,4,94,menziesii,San Diego,Warner Springs; Northeast facing slope along Pacific Crest Trail; 0.38 mile SE of Barrel Spring trailhead off of Montezuma Rd.,1097,33.2131,-116.583,,,,WGS84,cch2,500346,FL,"rocky, decompsing granite",http://cch2.org/portal/collections/individual/index.php?occid=500346,SA,,3,Total,2,1,0,0,0,,,1.333333333
SD00010431,4/4/2009,2009,4,4,94,menziesii,San Diego,Warner Springs; Northeast facing slope along Pacific Crest Trail; 0.38 mile SE of Barrel Spring trailhead off of Montezuma Rd.,1097,33.2131,-116.583,,,,WGS84,cch2,500346,FL,"rocky, decompsing granite",http://cch2.org/portal/collections/individual/index.php?occid=500346,SA,,4,Total,1,1,0,0,0,,,1.5
SD00010443,5/1/2010,2010,5,1,121,menziesii,San Diego,"Valle de San Jose, NW-side of San Felipe Hills. Pacific Crest Trail trailhead S-side of County Road S-22 (Montezuma Valley Road)1.1 miles ESE of intersection of S-22 and S-2 near Barrel Spring.",1053,33.2163,-116.58797,,,,WGS84,cch2,500271,FFL,"in clearing, decomposed granite substrate.",http://cch2.org/portal/collections/individual/index.php?occid=500271,SA,"Counted left to right. Second from left is a clipping; third from left has 2/3 stems missing, not counted",1,Total,0,3,3,5,0,,,3.181818182
SD00010443,5/1/2010,2010,5,1,121,menziesii,San Diego,"Valle de San Jose, NW-side of San Felipe Hills. Pacific Crest Trail trailhead S-side of County Road S-22 (Montezuma Valley Road)1.1 miles ESE of intersection of S-22 and S-2 near Barrel Spring.",1053,33.2163,-116.58797,,,,WGS84,cch2,500271,FFL,"in clearing, decomposed granite substrate.",http://cch2.org/portal/collections/individual/index.php?occid=500271,SA,,2,Total,0,1,1,2,0,,,3.25
SD00010443,5/1/2010,2010,5,1,121,menziesii,San Diego,"Valle de San Jose, NW-side of San Felipe Hills. Pacific Crest Trail trailhead S-side of County Road S-22 (Montezuma Valley Road)1.1 miles ESE of intersection of S-22 and S-2 near Barrel Spring.",1053,33.2163,-116.58797,,,,WGS84,cch2,500271,FFL,"in clearing, decomposed granite substrate.",http://cch2.org/portal/collections/individual/index.php?occid=500271,SA,,3,Total,0,2,1,1,0,,,2.75
SD00010464,4/29/1941,1941,4,29,119,,San Diego,Near junction San Felipe & Montezuma roads,1009.14,33.22157,-116.60615,402,,,WGS84,cch2,500077,FFL,,http://cch2.org/portal/collections/individual/index.php?occid=500077,SA,,1,Total,4,2,1,5,2,,,2.928571429
SD00010464,4/29/1941,1941,4,29,119,,San Diego,Near junction San Felipe & Montezuma roads,1009.14,33.22157,-116.60615,402,,,WGS84,cch2,500077,FFL,,http://cch2.org/portal/collections/individual/index.php?occid=500077,SA,,2,Total,2,2,1,2,0,,,2.428571429
SD00010464,4/29/1941,1941,4,29,119,,San Diego,Near junction San Felipe & Montezuma roads,1009.14,33.22157,-116.60615,402,,,WGS84,cch2,500077,FFL,,http://cch2.org/portal/collections/individual/index.php?occid=500077,SA,,3,Total,1,3,0,1,1,,,2.666666667
SD00010432,3/23/2015,2015,3,23,82,menziesii,San Diego,Anza-Borrego Desert State Park; head of South Fork Hellhole Canyon; 6.16 air miles SW of Borrego Springs; 0.91 air mile NW of intersection of County Hwy. S-22 and Culp Valley Campground/Pena Spring Primitive Road.,1109,33.22449,-116.47383,,,,WGS84,cch2,500345,FL,"Boulders, rocks, gravel, and sand.",http://cch2.org/portal/collections/individual/index.php?occid=500345,SA,Middle bottom is a clipping,1,Total,3,2,2,1,0,,,2.125
SD00010432,3/23/2015,2015,3,23,82,menziesii,San Diego,Anza-Borrego Desert State Park; head of South Fork Hellhole Canyon; 6.16 air miles SW of Borrego Springs; 0.91 air mile NW of intersection of County Hwy. S-22 and Culp Valley Campground/Pena Spring Primitive Road.,1109,33.22449,-116.47383,,,,WGS84,cch2,500345,FL,"Boulders, rocks, gravel, and sand.",http://cch2.org/portal/collections/individual/index.php?occid=500345,SA,,2,Total,3,3,2,2,0,,,2.3
SD00010622,4/4/2009,2009,4,4,94,integrifolia,San Diego,"Cleveland National Forest, Temescal Valley, ¾ mi N of Esmeralda Mine, 3¾ mi SW of Lake Henshaw Dam, along Lusardi Canyon Truck Trail 1/4 mile S of the divide and bench mark 3041",849,33.22695,-116.82572,,,,WGS84,cch2,500261,FL,Granite boulders with decomposed granite and clay soil,http://cch2.org/portal/collections/individual/index.php?occid=500261,SA,Numbered left to right,1,Total,1,4,0,1,0,,,2.166666667
SD00010622,4/4/2009,2009,4,4,94,integrifolia,San Diego,"Cleveland National Forest, Temescal Valley, ¾ mi N of Esmeralda Mine, 3¾ mi SW of Lake Henshaw Dam, along Lusardi Canyon Truck Trail 1/4 mile S of the divide and bench mark 3041",849,33.22695,-116.82572,,,,WGS84,cch2,500261,FL,Granite boulders with decomposed granite and clay soil,http://cch2.org/portal/collections/individual/index.php?occid=500261,SA,,2,Total,2,3,1,0,0,,,1.833333333
SD00010622,4/4/2009,2009,4,4,94,integrifolia,San Diego,"Cleveland National Forest, Temescal Valley, ¾ mi N of Esmeralda Mine, 3¾ mi SW of Lake Henshaw Dam, along Lusardi Canyon Truck Trail 1/4 mile S of the divide and bench mark 3041",849,33.22695,-116.82572,,,,WGS84,cch2,500261,FL,Granite boulders with decomposed granite and clay soil,http://cch2.org/portal/collections/individual/index.php?occid=500261,SA,,3,Total,1,4,0,1,0,,,2.166666667
SD00010458,5/4/2006,2006,5,4,124,menziesii,San Diego,"Between Warner Springs and Ranchita on Vista Irrigation District land. South of S-2 (San Felipe Road), approx. 2½ mi SE of its junction with SR-79.",980,33.2299,-116.6437,,,,WGS84,cch2,500204,FFL,Granitic soils.,http://cch2.org/portal/collections/individual/index.php?occid=500204,SA,top left,1,Total,2,3,0,1,0,,,2
SD00010458,5/4/2006,2006,5,4,124,menziesii,San Diego,"Between Warner Springs and Ranchita on Vista Irrigation District land. South of S-2 (San Felipe Road), approx. 2½ mi SE of its junction with SR-79.",980,33.2299,-116.6437,,,,WGS84,cch2,500204,FFL,Granitic soils.,http://cch2.org/portal/collections/individual/index.php?occid=500204,SA,top right,2,Total,2,3,0,3,0,,,2.5
SD00010461,4/14/1920,1920,4,14,105,,San Diego,Warner Ranch,878.58,33.24254,-116.6653,2414,,,WGS84,cch2,500113,FL,,http://cch2.org/portal/collections/individual/index.php?occid=500113,SA,"Largest plant is the only whole plant, the rest are clippings",1,Total,6,6,1,5,2,,,2.55
SD00010561,3/13/1935,1935,3,13,72,integrifolia,San Diego,"Moosa Canyon, north of Escondido",144.46,33.25052,-117.12968,9654,,,WGS84,cch2,500047,FL,,http://cch2.org/portal/collections/individual/index.php?occid=500047,SA,EXCLUDE: image too blurry,NA,,,,,,,,,#DIV/0!
SDSU12385,4/25/1996,1996,4,25,116,integrifolia,San Diego,"Ca. 100 yards west of San Luis Rey River Picnic Area, 30 yards south of river, ca. 2 miles west of Lake Henshaw, Cleveland National Forest.",780,33.25528,-116.79667,,,,,cch2,386734,,"sandy loam soil. flat, partly shaded. small clearing in Quercus agrifolia woodland.",http://cch2.org/portal/collections/individual/index.php?occid=386734,SA,,1,Total,3,9,0,14,2,,,3.107142857
SDSU12385,4/25/1996,1996,4,25,116,integrifolia,San Diego,"Ca. 100 yards west of San Luis Rey River Picnic Area, 30 yards south of river, ca. 2 miles west of Lake Henshaw, Cleveland National Forest.",780,33.25528,-116.79667,,,,,cch2,386734,,"sandy loam soil. flat, partly shaded. small clearing in Quercus agrifolia woodland.",http://cch2.org/portal/collections/individual/index.php?occid=386734,SA,,2,Total,1,5,5,4,5,,,3.35
SD00010575,4/26/1938,1938,4,26,116,integrifolia,San Diego,Cedar Creek Bridge,723.56,33.27763,-116.85549,402,,,WGS84,cch2,500067,FFL,,http://cch2.org/portal/collections/individual/index.php?occid=500067,SA,,1,Total,2,6,6,5,1,,,2.85
SD00010575,4/26/1938,1938,4,26,116,integrifolia,San Diego,Cedar Creek Bridge,723.56,33.27763,-116.85549,402,,,WGS84,cch2,500067,FFL,,http://cch2.org/portal/collections/individual/index.php?occid=500067,SA,,2,Total,1,8,1,2,0,,,2.333333333
SD00010575,4/26/1938,1938,4,26,116,integrifolia,San Diego,Cedar Creek Bridge,723.56,33.27763,-116.85549,402,,,WGS84,cch2,500067,FFL,,http://cch2.org/portal/collections/individual/index.php?occid=500067,SA,,3,Total,5,6,3,7,3,,,2.875
SD00010575,4/26/1938,1938,4,26,116,integrifolia,San Diego,Cedar Creek Bridge,723.56,33.27763,-116.85549,402,,,WGS84,cch2,500067,FFL,,http://cch2.org/portal/collections/individual/index.php?occid=500067,SA,,4,Total,5,4,1,0,0,,,1.6
SD00010575,4/26/1938,1938,4,26,116,integrifolia,San Diego,Cedar Creek Bridge,723.56,33.27763,-116.85549,402,,,WGS84,cch2,500067,FFL,,http://cch2.org/portal/collections/individual/index.php?occid=500067,SA,,5,Total,1,10,2,5,1,,,2.736842105
SD00010575,4/26/1938,1938,4,26,116,integrifolia,San Diego,Cedar Creek Bridge,723.56,33.27763,-116.85549,402,,,WGS84,cch2,500067,FFL,,http://cch2.org/portal/collections/individual/index.php?occid=500067,SA,,6,Total,2,6,2,0,0,,,2
SD00010451,4/22/2009,2009,4,22,112,menziesii,San Diego,"Warner Springs Ranch, about ½ mi NE of Warner Springs, northeast of horse barn on hiking trail going northeast uphill.",969,33.2878,-116.6319,,,,WGS84,cch2,500266,FL,,http://cch2.org/portal/collections/individual/index.php?occid=500266,SA,,1,Total,2,4,0,0,0,,,1.666666667
SD00010451,4/22/2009,2009,4,22,112,menziesii,San Diego,"Warner Springs Ranch, about ½ mi NE of Warner Springs, northeast of horse barn on hiking trail going northeast uphill.",969,33.2878,-116.6319,,,,WGS84,cch2,500266,FL,,http://cch2.org/portal/collections/individual/index.php?occid=500266,SA,,2,Total,1,4,0,4,0,,,2.777777778
SD00010560,5/9/1939,1939,5,9,129,integrifolia,San Diego,1st year burn in Chaparral near Lilac,223.24,33.28781,-117.08392,1609,,,WGS84,cch2,500073,FFL,,http://cch2.org/portal/collections/individual/index.php?occid=500073,SA,EXCLUDE: blurry and crowded,NA,,,,,,,,,#DIV/0!
SD00010614,5/22/1940,1940,5,22,143,integrifolia,San Diego,Near Eagles' Nest Hot Springs Mt.,1376.63,33.28809,-116.59418,805,,,WGS84,cch2,500076,FFL,,http://cch2.org/portal/collections/individual/index.php?occid=500076,SA,top plant,1,Total,0,3,4,7,8,,,3.909090909
SD00010614,5/22/1940,1940,5,22,143,integrifolia,San Diego,Near Eagles' Nest Hot Springs Mt.,1376.63,33.28809,-116.59418,805,,,WGS84,cch2,500076,FFL,,http://cch2.org/portal/collections/individual/index.php?occid=500076,SA,left,2,Total,1,3,2,19,15,,,4.1
SD00010614,5/22/1940,1940,5,22,143,integrifolia,San Diego,Near Eagles' Nest Hot Springs Mt.,1376.63,33.28809,-116.59418,805,,,WGS84,cch2,500076,FFL,,http://cch2.org/portal/collections/individual/index.php?occid=500076,SA,right,3,Total,4,8,2,8,8,,,3.266666667
SD00010614,5/22/1940,1940,5,22,143,integrifolia,San Diego,Near Eagles' Nest Hot Springs Mt.,1376.63,33.28809,-116.59418,805,,,WGS84,cch2,500076,FFL,,http://cch2.org/portal/collections/individual/index.php?occid=500076,SA,bottom,4,Total,1,6,1,1,1,,,2.5
SD00010453,5/26/2010,2010,5,26,146,menziesii,San Diego,Eagles Nest: Fletcher Family Ranch; E of Warner Springs on the SW side of Hot Springs Mountain; at the end on Eagles Nest Road; along dirt road loop ENE of lake,1435,33.28965,-116.58698,,,,WGS84,cch2,500251,FFL,granitic substrates,http://cch2.org/portal/collections/individual/index.php?occid=500251,SA,EXCLUDE: all clippings,NA,,,,,,,,,#DIV/0!
SDSU15375,3/21/1998,1998,3,21,80,integrifolia,San Diego,UTM-Easting: 472886.41; UTM-Northing: 3685540. Training Area: JULIETT RANGE 403. LTETM PLOT: 85. LTETM Unknown code: F04.,121,33.31028,-117.29139,805,,,,cch2,389691,,Coastal sage scrub.,http://cch2.org/portal/collections/individual/index.php?occid=389691,SA,EXCLUDE: too busy,NA,,,,,,,,,#DIV/0!
SD00010434,4/4/2009,2009,4,4,94,menziesii,San Diego,Cleveland National Forest; Warner Springs; N facing shoulder of Lost Creek Road; vicinity of 2 miles NNE of junction Lost Creek Road and Highway 79,1094,33.3111,-116.6421,,,,WGS84,cch2,500343,FL,decompsing granite,http://cch2.org/portal/collections/individual/index.php?occid=500343,SA,Labeled left to right,1,Total,2,4,0,0,0,,,1.666666667
SD00010434,4/4/2009,2009,4,4,94,menziesii,San Diego,Cleveland National Forest; Warner Springs; N facing shoulder of Lost Creek Road; vicinity of 2 miles NNE of junction Lost Creek Road and Highway 79,1094,33.3111,-116.6421,,,,WGS84,cch2,500343,FL,decompsing granite,http://cch2.org/portal/collections/individual/index.php?occid=500343,SA,,2,Total,4,2,0,1,0,,,1.714285714
SD00010434,4/4/2009,2009,4,4,94,menziesii,San Diego,Cleveland National Forest; Warner Springs; N facing shoulder of Lost Creek Road; vicinity of 2 miles NNE of junction Lost Creek Road and Highway 79,1094,33.3111,-116.6421,,,,WGS84,cch2,500343,FL,decompsing granite,http://cch2.org/portal/collections/individual/index.php?occid=500343,SA,,3,Total,5,1,0,0,0,,,1.166666667
SD00010434,4/4/2009,2009,4,4,94,menziesii,San Diego,Cleveland National Forest; Warner Springs; N facing shoulder of Lost Creek Road; vicinity of 2 miles NNE of junction Lost Creek Road and Highway 79,1094,33.3111,-116.6421,,,,WGS84,cch2,500343,FL,decompsing granite,http://cch2.org/portal/collections/individual/index.php?occid=500343,SA,,4,Total,2,3,1,0,0,,,1.833333333
SD00010434,4/4/2009,2009,4,4,94,menziesii,San Diego,Cleveland National Forest; Warner Springs; N facing shoulder of Lost Creek Road; vicinity of 2 miles NNE of junction Lost Creek Road and Highway 79,1094,33.3111,-116.6421,,,,WGS84,cch2,500343,FL,decompsing granite,http://cch2.org/portal/collections/individual/index.php?occid=500343,SA,,5,Total,3,3,3,1,0,,,2.2
SD00010473,5/2/2004,2004,5,2,123,menziesii,San Diego,"Palomar Mountain Divide Truck Trail, South of Highway 79, nearest town is Oak Grove.",1376,33.3167,-116.7353,,,,WGS84,cch2,500177,FL,"Granitic, disturbed roadside.",http://cch2.org/portal/collections/individual/index.php?occid=500177,CPA,Plants labelled on image,1,Total,2,3,1,0,0,,,1.833333333
SD00010473,5/2/2004,2004,5,2,123,menziesii,San Diego,"Palomar Mountain Divide Truck Trail, South of Highway 79, nearest town is Oak Grove.",1376,33.3167,-116.7353,,,,WGS84,cch2,500177,FL,"Granitic, disturbed roadside.",http://cch2.org/portal/collections/individual/index.php?occid=500177,CPA,Plants labelled on image,2,Total,4,2,1,1,0,,,1.875
SD00010473,5/2/2004,2004,5,2,123,menziesii,San Diego,"Palomar Mountain Divide Truck Trail, South of Highway 79, nearest town is Oak Grove.",1376,33.3167,-116.7353,,,,WGS84,cch2,500177,FL,"Granitic, disturbed roadside.",http://cch2.org/portal/collections/individual/index.php?occid=500177,CPA,Plants labelled on image,3,Total,1,4,2,2,0,,,2.555555556
SD00010473,5/2/2004,2004,5,2,123,menziesii,San Diego,"Palomar Mountain Divide Truck Trail, South of Highway 79, nearest town is Oak Grove.",1376,33.3167,-116.7353,,,,WGS84,cch2,500177,FL,"Granitic, disturbed roadside.",http://cch2.org/portal/collections/individual/index.php?occid=500177,CPA,Plants labelled on image,4,Total,3,1,1,1,0,,,2
SD00010473,5/2/2004,2004,5,2,123,menziesii,San Diego,"Palomar Mountain Divide Truck Trail, South of Highway 79, nearest town is Oak Grove.",1376,33.3167,-116.7353,,,,WGS84,cch2,500177,FL,"Granitic, disturbed roadside.",http://cch2.org/portal/collections/individual/index.php?occid=500177,CPA,Plants labelled on image,5,Total,3,3,0,0,0,,,1.5
SD00010473,5/2/2004,2004,5,2,123,menziesii,San Diego,"Palomar Mountain Divide Truck Trail, South of Highway 79, nearest town is Oak Grove.",1376,33.3167,-116.7353,,,,WGS84,cch2,500177,FL,"Granitic, disturbed roadside.",http://cch2.org/portal/collections/individual/index.php?occid=500177,CPA,Plants labelled on image,6,Total,8,2,0,1,0,,,1.454545455
SD00010649,4/29/2006,2006,4,29,119,integrifolia,San Diego,"Palomar Mountain (Birch Hill area), Cleveland National Forest, Observation Pointe Development, 400 feet W of Conifer Rd, 1.5 miles N of its junction with S-7 (East Grade Road).",1693,33.3186,-116.8453,,,,WGS84,cch2,500210,FL,granitic,http://cch2.org/portal/collections/individual/index.php?occid=500210,CPA,"Low-res, very dense",1,Total,13,19,4,1,3,,,2.05
SD00010447,4/24/2005,2005,4,24,114,menziesii,San Diego,Aguanga Mountain; Palomar Mountain Divide Truck Trail; Maple Lode Mine; 2½ mi SW of Holcomb Village,1250,33.3205,-116.7428,,,,WGS84,cch2,500214,FFL,Granitic roadcut; North facing slope,http://cch2.org/portal/collections/individual/index.php?occid=500214,CPA,Left,1,Total,7,4,3,1,0,,,1.866666667
SD00010447,4/24/2005,2005,4,24,114,menziesii,San Diego,Aguanga Mountain; Palomar Mountain Divide Truck Trail; Maple Lode Mine; 2½ mi SW of Holcomb Village,1250,33.3205,-116.7428,,,,WGS84,cch2,500214,FFL,Granitic roadcut; North facing slope,http://cch2.org/portal/collections/individual/index.php?occid=500214,CPA,Right,2,Total,14,7,2,1,0,,,1.583333333
SD00010608,8/6/1938,1938,8,6,218,integrifolia,San Diego,"Chimney Creek, Palomar Mountain.",1555.89,33.32563,-116.89086,805,,,WGS84,cch2,500072,FFL,,http://cch2.org/portal/collections/individual/index.php?occid=500072,CPA,,1,Total,1,2,17,8,0,,,3.142857143
SD00010608,8/6/1938,1938,8,6,218,integrifolia,San Diego,"Chimney Creek, Palomar Mountain.",1555.89,33.32563,-116.89086,805,,,WGS84,cch2,500072,FFL,,http://cch2.org/portal/collections/individual/index.php?occid=500072,CPA,,2,Total,1,1,6,1,0,,,2.777777778
SD00010472,4/10/1969,1969,4,10,100,menziesii,San Diego,Palomar Mountain State Park. On open slope se workshop reservoir.,1630,33.33027,-116.89894,241,,,WGS84,cch2,500120,FL,,http://cch2.org/portal/collections/individual/index.php?occid=500120,CPA,"Low-res, dense",1,Total,3,0,0,0,0,,,1
SD00010472,4/10/1969,1969,4,10,100,menziesii,San Diego,Palomar Mountain State Park. On open slope se workshop reservoir.,1630,33.33027,-116.89894,241,,,WGS84,cch2,500120,FL,,http://cch2.org/portal/collections/individual/index.php?occid=500120,CPA,"Low-res, dense",2,Total,1,2,0,1,0,,,2.25
SD00010472,4/10/1969,1969,4,10,100,menziesii,San Diego,Palomar Mountain State Park. On open slope se workshop reservoir.,1630,33.33027,-116.89894,241,,,WGS84,cch2,500120,FL,,http://cch2.org/portal/collections/individual/index.php?occid=500120,CPA,"Low-res, dense",3,Total,1,1,0,0,0,,,1.5
SD00010472,4/10/1969,1969,4,10,100,menziesii,San Diego,Palomar Mountain State Park. On open slope se workshop reservoir.,1630,33.33027,-116.89894,241,,,WGS84,cch2,500120,FL,,http://cch2.org/portal/collections/individual/index.php?occid=500120,CPA,"Low-res, dense",4,Total,2,2,0,0,0,,,1.5
SD00010472,4/10/1969,1969,4,10,100,menziesii,San Diego,Palomar Mountain State Park. On open slope se workshop reservoir.,1630,33.33027,-116.89894,241,,,WGS84,cch2,500120,FL,,http://cch2.org/portal/collections/individual/index.php?occid=500120,CPA,"Low-res, dense",5,Total,1,1,0,0,0,,,1.5
SD00010472,4/10/1969,1969,4,10,100,menziesii,San Diego,Palomar Mountain State Park. On open slope se workshop reservoir.,1630,33.33027,-116.89894,241,,,WGS84,cch2,500120,FL,,http://cch2.org/portal/collections/individual/index.php?occid=500120,CPA,"Low-res, dense",6,Total,2,0,0,0,0,,,1
SD00010472,4/10/1969,1969,4,10,100,menziesii,San Diego,Palomar Mountain State Park. On open slope se workshop reservoir.,1630,33.33027,-116.89894,241,,,WGS84,cch2,500120,FL,,http://cch2.org/portal/collections/individual/index.php?occid=500120,CPA,"Low-res, dense",7,Total,2,1,0,0,0,,,1.333333333
SD00010472,4/10/1969,1969,4,10,100,menziesii,San Diego,Palomar Mountain State Park. On open slope se workshop reservoir.,1630,33.33027,-116.89894,241,,,WGS84,cch2,500120,FL,,http://cch2.org/portal/collections/individual/index.php?occid=500120,CPA,"Low-res, dense",8,Total,2,2,1,0,0,,,1.8
SD00010471,4/22/1991,1991,4,22,112,menziesii,San Diego,"NE side of Aguanga Mountain, mouth of Blue Canyon, 6.75 mi. NW of Warner Springs P.O. by way of Calif. Hwy. 79.",930,33.33144,-116.71249,241,,,WGS84,cch2,500160,FL,"Loamy, north-facing tributary",http://cch2.org/portal/collections/individual/index.php?occid=500160,CPA,Top left,1,Total,6,6,2,2,1,,,2.176470588
SD00010471,4/22/1991,1991,4,22,112,menziesii,San Diego,"NE side of Aguanga Mountain, mouth of Blue Canyon, 6.75 mi. NW of Warner Springs P.O. by way of Calif. Hwy. 79.",930,33.33144,-116.71249,241,,,WGS84,cch2,500160,FL,"Loamy, north-facing tributary",http://cch2.org/portal/collections/individual/index.php?occid=500160,CPA,,2,Total,4,3,1,0,0,,,1.625
SD00010471,4/22/1991,1991,4,22,112,menziesii,San Diego,"NE side of Aguanga Mountain, mouth of Blue Canyon, 6.75 mi. NW of Warner Springs P.O. by way of Calif. Hwy. 79.",930,33.33144,-116.71249,241,,,WGS84,cch2,500160,FL,"Loamy, north-facing tributary",http://cch2.org/portal/collections/individual/index.php?occid=500160,CPA,Bottom left,3,Total,12,5,0,0,0,,,1.294117647
SD00010471,4/22/1991,1991,4,22,112,menziesii,San Diego,"NE side of Aguanga Mountain, mouth of Blue Canyon, 6.75 mi. NW of Warner Springs P.O. by way of Calif. Hwy. 79.",930,33.33144,-116.71249,241,,,WGS84,cch2,500160,FL,"Loamy, north-facing tributary",http://cch2.org/portal/collections/individual/index.php?occid=500160,CPA,,4,Total,12,3,2,0,0,,,1.411764706
SD00010471,4/22/1991,1991,4,22,112,menziesii,San Diego,"NE side of Aguanga Mountain, mouth of Blue Canyon, 6.75 mi. NW of Warner Springs P.O. by way of Calif. Hwy. 79.",930,33.33144,-116.71249,241,,,WGS84,cch2,500160,FL,"Loamy, north-facing tributary",http://cch2.org/portal/collections/individual/index.php?occid=500160,CPA,Rightmost,5,Total,21,8,2,2,0,,,1.545454545
SD00010540,6/14/1945,1945,6,14,165,integrifolia,San Diego,Palomar.,1385.8,33.33502,-116.86051,,,,WGS84,cch2,500081,FFL,,http://cch2.org/portal/collections/individual/index.php?occid=500081,CPA,,1,Total,6,16,3,3,7,,,2.685714286
SD00010655,3/21/2002,2002,3,21,80,integrifolia,San Diego,Palomar State Park on west facing slope approximately 300 meters west of Boucher Hill.,1585,33.33556,-116.92194,,,,WGS84,cch2,500188,UNK,,http://cch2.org/portal/collections/individual/index.php?occid=500188,CPA,"Top row, left",1,Total,2,2,1,0,0,,,1.8
SD00010655,3/21/2002,2002,3,21,80,integrifolia,San Diego,Palomar State Park on west facing slope approximately 300 meters west of Boucher Hill.,1585,33.33556,-116.92194,,,,WGS84,cch2,500188,UNK,,http://cch2.org/portal/collections/individual/index.php?occid=500188,CPA,,2,Total,2,1,0,0,0,,,1.333333333
SD00010655,3/21/2002,2002,3,21,80,integrifolia,San Diego,Palomar State Park on west facing slope approximately 300 meters west of Boucher Hill.,1585,33.33556,-116.92194,,,,WGS84,cch2,500188,UNK,,http://cch2.org/portal/collections/individual/index.php?occid=500188,CPA,,3,Total,1,3,0,0,0,,,1.75
SD00010655,3/21/2002,2002,3,21,80,integrifolia,San Diego,Palomar State Park on west facing slope approximately 300 meters west of Boucher Hill.,1585,33.33556,-116.92194,,,,WGS84,cch2,500188,UNK,,http://cch2.org/portal/collections/individual/index.php?occid=500188,CPA,,4,Total,3,4,3,0,0,,,2
SD00010655,3/21/2002,2002,3,21,80,integrifolia,San Diego,Palomar State Park on west facing slope approximately 300 meters west of Boucher Hill.,1585,33.33556,-116.92194,,,,WGS84,cch2,500188,UNK,,http://cch2.org/portal/collections/individual/index.php?occid=500188,CPA,"Middle row, left",5,Total,3,1,2,0,0,,,1.833333333
SD00010655,3/21/2002,2002,3,21,80,integrifolia,San Diego,Palomar State Park on west facing slope approximately 300 meters west of Boucher Hill.,1585,33.33556,-116.92194,,,,WGS84,cch2,500188,UNK,,http://cch2.org/portal/collections/individual/index.php?occid=500188,CPA,,6,Total,1,2,1,0,0,,,2
SD00010655,3/21/2002,2002,3,21,80,integrifolia,San Diego,Palomar State Park on west facing slope approximately 300 meters west of Boucher Hill.,1585,33.33556,-116.92194,,,,WGS84,cch2,500188,UNK,,http://cch2.org/portal/collections/individual/index.php?occid=500188,CPA,,7,Total,2,2,1,1,0,,,2.166666667
SD00010655,3/21/2002,2002,3,21,80,integrifolia,San Diego,Palomar State Park on west facing slope approximately 300 meters west of Boucher Hill.,1585,33.33556,-116.92194,,,,WGS84,cch2,500188,UNK,,http://cch2.org/portal/collections/individual/index.php?occid=500188,CPA,Bottom-most,8,Total,1,1,1,0,0,,,2
SD00010456,4/22/2007,2007,4,22,112,menziesii,San Diego,"Warner Springs, Cleveland National Forest, Lost Valley Road 3.8 mi N of Warner Springs (Hwy 79), 3 mi S of Chihuahua Valley Road",1168,33.34201,-116.64702,,,,WGS84,cch2,500234,FFL,"Granitic, sandy, dry wash",http://cch2.org/portal/collections/individual/index.php?occid=500234,CPA,Plants labelled on image,1,Total,6,2,3,1,0,,,1.916666667
SD00010456,4/22/2007,2007,4,22,112,menziesii,San Diego,"Warner Springs, Cleveland National Forest, Lost Valley Road 3.8 mi N of Warner Springs (Hwy 79), 3 mi S of Chihuahua Valley Road",1168,33.34201,-116.64702,,,,WGS84,cch2,500234,FFL,"Granitic, sandy, dry wash",http://cch2.org/portal/collections/individual/index.php?occid=500234,CPA,Plants labelled on image,2,Total,8,3,4,0,0,,,1.733333333
SD00010456,4/22/2007,2007,4,22,112,menziesii,San Diego,"Warner Springs, Cleveland National Forest, Lost Valley Road 3.8 mi N of Warner Springs (Hwy 79), 3 mi S of Chihuahua Valley Road",1168,33.34201,-116.64702,,,,WGS84,cch2,500234,FFL,"Granitic, sandy, dry wash",http://cch2.org/portal/collections/individual/index.php?occid=500234,CPA,Plants labelled on image,3,Total,9,1,1,0,0,,,1.272727273
SD00010456,4/22/2007,2007,4,22,112,menziesii,San Diego,"Warner Springs, Cleveland National Forest, Lost Valley Road 3.8 mi N of Warner Springs (Hwy 79), 3 mi S of Chihuahua Valley Road",1168,33.34201,-116.64702,,,,WGS84,cch2,500234,FFL,"Granitic, sandy, dry wash",http://cch2.org/portal/collections/individual/index.php?occid=500234,CPA,"Plants 4 and 5 overlap slightly, but it is clear which structure belongs to which; plants labelled on image",4,Total,5,5,3,1,1,,,2.2
SD00010456,4/22/2007,2007,4,22,112,menziesii,San Diego,"Warner Springs, Cleveland National Forest, Lost Valley Road 3.8 mi N of Warner Springs (Hwy 79), 3 mi S of Chihuahua Valley Road",1168,33.34201,-116.64702,,,,WGS84,cch2,500234,FFL,"Granitic, sandy, dry wash",http://cch2.org/portal/collections/individual/index.php?occid=500234,CPA,"Plants 4 and 5 overlap slightly, but it is clear which structure belongs to which; plants labelled on image",5,Total,8,3,5,0,1,,,2
SD00010613,7/10/1935,1935,7,10,191,integrifolia,San Diego,Near Wyss Ranch on Palomar Mt.,1436.38,33.34371,-116.9104,,,,WGS84,cch2,500055,FFL,,http://cch2.org/portal/collections/individual/index.php?occid=500055,CPA,Poorly preserved,1,Total,0,5,10,7,8,,,3.6
SD00010583,6/18/2009,2009,6,18,169,integrifolia,San Diego,"Palomar Mountain State Park, Fry Creek campground, 2.7 mi. north of the summit of the south Palomar grade, E of Canfield Road",1528,33.3447,-116.868,,,,WGS84,cch2,500276,FL,Narrow ravine with numerous granitic outcrops.,http://cch2.org/portal/collections/individual/index.php?occid=500276,CPA,Bottom left (top right is a clipping),1,Total,4,5,6,2,3,,,2.75
SD00010444,5/1/2010,2010,5,1,121,menziesii,San Diego,"Aguanga Mountain, Cleveland National Forest, along Palomar Mountain Divide Truck Trail, near 5.5 air miles WNW of junction with Highway 79.",1629,33.34685,-116.79642,,,,WGS84,cch2,500273,FL,Granitic,http://cch2.org/portal/collections/individual/index.php?occid=500273,CPA,,1,Total,10,3,3,2,1,,,2
SD00010444,5/1/2010,2010,5,1,121,menziesii,San Diego,"Aguanga Mountain, Cleveland National Forest, along Palomar Mountain Divide Truck Trail, near 5.5 air miles WNW of junction with Highway 79.",1629,33.34685,-116.79642,,,,WGS84,cch2,500273,FL,Granitic,http://cch2.org/portal/collections/individual/index.php?occid=500273,CPA,,2,Total,3,12,5,3,3,,,2.653846154
SD00010637,6/2/2009,2009,6,2,153,integrifolia,San Diego,Palomar Mountains: Cleveland National Forest; northeast of Upper Doane Valley; northwest of Fry Creek Campground,1600,33.3472,-116.89388,,,,WGS84,cch2,500235,FFL,mostly granitic substrates,http://cch2.org/portal/collections/individual/index.php?occid=500235,CPA,,1,Total,0,1,1,0,0,,,2.5
SD00010637,6/2/2009,2009,6,2,153,integrifolia,San Diego,Palomar Mountains: Cleveland National Forest; northeast of Upper Doane Valley; northwest of Fry Creek Campground,1600,33.3472,-116.89388,,,,WGS84,cch2,500235,FFL,mostly granitic substrates,http://cch2.org/portal/collections/individual/index.php?occid=500235,CPA,,2,Total,0,0,0,1,1,,,4.5
SD00010637,6/2/2009,2009,6,2,153,integrifolia,San Diego,Palomar Mountains: Cleveland National Forest; northeast of Upper Doane Valley; northwest of Fry Creek Campground,1600,33.3472,-116.89388,,,,WGS84,cch2,500235,FFL,mostly granitic substrates,http://cch2.org/portal/collections/individual/index.php?occid=500235,CPA,,3,Total,0,1,4,2,0,,,3.142857143
SD00010637,6/2/2009,2009,6,2,153,integrifolia,San Diego,Palomar Mountains: Cleveland National Forest; northeast of Upper Doane Valley; northwest of Fry Creek Campground,1600,33.3472,-116.89388,,,,WGS84,cch2,500235,FFL,mostly granitic substrates,http://cch2.org/portal/collections/individual/index.php?occid=500235,CPA,,4,Total,2,4,3,2,1,,,2.666666667
SD00010587,4/8/1997,1997,4,8,98,integrifolia,San Diego,Wilderness Gardens Preserve; ca. 3.4 miles east of Pala south of Highway 76 along the San Luis Rey River.,162,33.35028,-117.03278,241,,,WGS84,cch2,500258,FL,Alluvial substrate with sandy loam soil in the river bottom and granitic and or gabbroic substrates with sandy or clay soils on the surrounding slopes.,http://cch2.org/portal/collections/individual/index.php?occid=500258,CPA,Medium size plant in middle of sheet; didn't score plants on the left because they overlap and are covered by the label; didn't score plant on right because it appears a clipping,1,Total,3,2,2,1,7,,,3.466666667
SD00010588,6/7/2008,2008,6,7,159,integrifolia,San Diego,"Warner Springs, northbound Pacific Crest Trail, 6 miles from Lost Valley Rd. trailhead, 200 yards east of trail, along west bank of dry tributary to Agua Caliente Creek",1473,33.35487,-116.60481,,,,WGS84,cch2,500256,FL,Granitic soil,http://cch2.org/portal/collections/individual/index.php?occid=500256,CPA,,1,Total,0,1,2,2,1,,,3.5
SD00010588,6/7/2008,2008,6,7,159,integrifolia,San Diego,"Warner Springs, northbound Pacific Crest Trail, 6 miles from Lost Valley Rd. trailhead, 200 yards east of trail, along west bank of dry tributary to Agua Caliente Creek",1473,33.35487,-116.60481,,,,WGS84,cch2,500256,FL,Granitic soil,http://cch2.org/portal/collections/individual/index.php?occid=500256,CPA,,2,Total,5,3,6,1,6,,,3
SD00010588,6/7/2008,2008,6,7,159,integrifolia,San Diego,"Warner Springs, northbound Pacific Crest Trail, 6 miles from Lost Valley Rd. trailhead, 200 yards east of trail, along west bank of dry tributary to Agua Caliente Creek",1473,33.35487,-116.60481,,,,WGS84,cch2,500256,FL,Granitic soil,http://cch2.org/portal/collections/individual/index.php?occid=500256,CPA,right-most plant likely a clipping (DG),3,Total,0,1,2,1,2,,,3.666666667
SD00010470,4/26/1985,1985,4,26,116,menziesii,San Diego,"oak woodland, Puerta la Cruz Road, Cleveland Nat. Forest.",1160,33.35759,-116.67206,241,,,WGS84,cch2,500149,FL,,http://cch2.org/portal/collections/individual/index.php?occid=500149,CPA,"Top row, leftmost. Next left 'plant' not whole",1,Total,0,1,0,0,0,,,2
SD00010470,4/26/1985,1985,4,26,116,menziesii,San Diego,"oak woodland, Puerta la Cruz Road, Cleveland Nat. Forest.",1160,33.35759,-116.67206,241,,,WGS84,cch2,500149,FL,,http://cch2.org/portal/collections/individual/index.php?occid=500149,CPA,,2,Total,1,3,1,0,0,,,2
SD00010470,4/26/1985,1985,4,26,116,menziesii,San Diego,"oak woodland, Puerta la Cruz Road, Cleveland Nat. Forest.",1160,33.35759,-116.67206,241,,,WGS84,cch2,500149,FL,,http://cch2.org/portal/collections/individual/index.php?occid=500149,CPA,,3,Total,0,2,0,0,0,,,2
SD00010470,4/26/1985,1985,4,26,116,menziesii,San Diego,"oak woodland, Puerta la Cruz Road, Cleveland Nat. Forest.",1160,33.35759,-116.67206,241,,,WGS84,cch2,500149,FL,,http://cch2.org/portal/collections/individual/index.php?occid=500149,CPA,,4,Total,0,1,0,1,0,,,3
SD00010470,4/26/1985,1985,4,26,116,menziesii,San Diego,"oak woodland, Puerta la Cruz Road, Cleveland Nat. Forest.",1160,33.35759,-116.67206,241,,,WGS84,cch2,500149,FL,,http://cch2.org/portal/collections/individual/index.php?occid=500149,CPA,,5,Total,0,1,0,0,0,,,2
SD00010470,4/26/1985,1985,4,26,116,menziesii,San Diego,"oak woodland, Puerta la Cruz Road, Cleveland Nat. Forest.",1160,33.35759,-116.67206,241,,,WGS84,cch2,500149,FL,,http://cch2.org/portal/collections/individual/index.php?occid=500149,CPA,"Top row, rightmost",6,Total,1,1,0,0,0,,,1.5
SD00010470,4/26/1985,1985,4,26,116,menziesii,San Diego,"oak woodland, Puerta la Cruz Road, Cleveland Nat. Forest.",1160,33.35759,-116.67206,241,,,WGS84,cch2,500149,FL,,http://cch2.org/portal/collections/individual/index.php?occid=500149,CPA,"Bottom row, leftmost",7,Total,1,2,2,0,0,,,2.2
SD00010470,4/26/1985,1985,4,26,116,menziesii,San Diego,"oak woodland, Puerta la Cruz Road, Cleveland Nat. Forest.",1160,33.35759,-116.67206,241,,,WGS84,cch2,500149,FL,,http://cch2.org/portal/collections/individual/index.php?occid=500149,CPA,,8,Total,2,2,2,0,1,,,2.428571429
SD00010470,4/26/1985,1985,4,26,116,menziesii,San Diego,"oak woodland, Puerta la Cruz Road, Cleveland Nat. Forest.",1160,33.35759,-116.67206,241,,,WGS84,cch2,500149,FL,,http://cch2.org/portal/collections/individual/index.php?occid=500149,CPA,,9,Total,1,1,0,1,0,,,2.333333333
SD00010470,4/26/1985,1985,4,26,116,menziesii,San Diego,"oak woodland, Puerta la Cruz Road, Cleveland Nat. Forest.",1160,33.35759,-116.67206,241,,,WGS84,cch2,500149,FL,,http://cch2.org/portal/collections/individual/index.php?occid=500149,CPA,,10,Total,2,1,1,0,0,,,1.75
SD00010470,4/26/1985,1985,4,26,116,menziesii,San Diego,"oak woodland, Puerta la Cruz Road, Cleveland Nat. Forest.",1160,33.35759,-116.67206,241,,,WGS84,cch2,500149,FL,,http://cch2.org/portal/collections/individual/index.php?occid=500149,CPA,"Bottom row, rightmost",11,Total,0,1,0,0,0,,,2
SD00010585,5/31/2010,2010,5,31,151,integrifolia,San Diego,Cleveland National Forest; Puerta La Cruz Road; 2 miles SE Mitchell Camp Road and Chihuahua Valley Road; 5.7 miles N of Warner Springs and Hwy 79,1168,33.36112,-116.67281,,,,WGS84,cch2,500274,FL,,http://cch2.org/portal/collections/individual/index.php?occid=500274,CPA,Bottom plant only; top plant appears to be three plants overlapping,1,Total,13,25,14,9,14,,,2.813333333
SD00010579,2/24/2015,2015,2,24,55,integrifolia,San Diego,Camp Pendleton: east-central portion of Base; India Training Area; north of Lake O'Neill; east of the Santa Margarita River; on a rocky slope just east of De Luz Road along the Fallbrook Weapons Station border,105,33.36227,-117.31402,,,,WGS84,cch2,500312,FL,,http://cch2.org/portal/collections/individual/index.php?occid=500312,CPA,Plants labelled on image,1,Total,3,1,0,0,0,,,1.25
SD00010579,2/24/2015,2015,2,24,55,integrifolia,San Diego,Camp Pendleton: east-central portion of Base; India Training Area; north of Lake O'Neill; east of the Santa Margarita River; on a rocky slope just east of De Luz Road along the Fallbrook Weapons Station border,105,33.36227,-117.31402,,,,WGS84,cch2,500312,FL,,http://cch2.org/portal/collections/individual/index.php?occid=500312,CPA,Plants labelled on image,2,Total,2,1,0,0,0,,,1.333333333
SD00010579,2/24/2015,2015,2,24,55,integrifolia,San Diego,Camp Pendleton: east-central portion of Base; India Training Area; north of Lake O'Neill; east of the Santa Margarita River; on a rocky slope just east of De Luz Road along the Fallbrook Weapons Station border,105,33.36227,-117.31402,,,,WGS84,cch2,500312,FL,,http://cch2.org/portal/collections/individual/index.php?occid=500312,CPA,Plants labelled on image,3,Total,4,0,2,1,0,,,2
SD00010579,2/24/2015,2015,2,24,55,integrifolia,San Diego,Camp Pendleton: east-central portion of Base; India Training Area; north of Lake O'Neill; east of the Santa Margarita River; on a rocky slope just east of De Luz Road along the Fallbrook Weapons Station border,105,33.36227,-117.31402,,,,WGS84,cch2,500312,FL,,http://cch2.org/portal/collections/individual/index.php?occid=500312,CPA,Plants labelled on image,4,Total,3,0,1,0,0,,,1.5
SD00010579,2/24/2015,2015,2,24,55,integrifolia,San Diego,Camp Pendleton: east-central portion of Base; India Training Area; north of Lake O'Neill; east of the Santa Margarita River; on a rocky slope just east of De Luz Road along the Fallbrook Weapons Station border,105,33.36227,-117.31402,,,,WGS84,cch2,500312,FL,,http://cch2.org/portal/collections/individual/index.php?occid=500312,CPA,Plants labelled on image,5,Total,3,2,0,0,0,,,1.4
SD00010579,2/24/2015,2015,2,24,55,integrifolia,San Diego,Camp Pendleton: east-central portion of Base; India Training Area; north of Lake O'Neill; east of the Santa Margarita River; on a rocky slope just east of De Luz Road along the Fallbrook Weapons Station border,105,33.36227,-117.31402,,,,WGS84,cch2,500312,FL,,http://cch2.org/portal/collections/individual/index.php?occid=500312,CPA,Plants labelled on image,6,Total,2,1,1,0,0,,,1.75
SD00010579,2/24/2015,2015,2,24,55,integrifolia,San Diego,Camp Pendleton: east-central portion of Base; India Training Area; north of Lake O'Neill; east of the Santa Margarita River; on a rocky slope just east of De Luz Road along the Fallbrook Weapons Station border,105,33.36227,-117.31402,,,,WGS84,cch2,500312,FL,,http://cch2.org/portal/collections/individual/index.php?occid=500312,CPA,Plants labelled on image,7,Total,4,1,0,0,0,,,1.2
SDSU06129,5/22/1944,1944,5,22,143,integrifolia,San Diego,Palomar,1869.91,33.36337,-116.83613,3218,,,WGS84,cch2,380534,,,http://cch2.org/portal/collections/individual/index.php?occid=380534,CPA,,1,Total,29,24,9,5,0,,,1.850746269
SD00010542,5/25/1925,1925,5,25,145,integrifolia,San Diego,Palomar Mountain.,1585,33.36337,-116.83613,3218,,,WGS84,cch2,500032,FFL,,http://cch2.org/portal/collections/individual/index.php?occid=500032,CPA,,1,Total,18,16,15,3,3,,,2.218181818
SD00010543,5/15/1937,1937,5,15,135,integrifolia,San Diego,Palomar.,1869.91,33.36337,-116.83613,,,,WGS84,cch2,500063,FFL,,http://cch2.org/portal/collections/individual/index.php?occid=500063,CPA,Top plant' bottom plant looks two be 2 overlapping,1,Total,4,5,8,5,1,,,2.739130435
SD00010584,5/8/2010,2010,5,8,128,integrifolia,San Diego,Cleveland National Forest; Puerta La Cruz Road; 1.75 miles SE Mitchell Camp Road and Chihuahua Valley Road; 6 miles N of Warner Springs and Hwy 79,1182,33.36474,-116.67411,,,,WGS84,cch2,500275,FL,,http://cch2.org/portal/collections/individual/index.php?occid=500275,CPA,"Small, top left",1,Total,3,3,3,2,2,,,2.769230769
SD00010584,5/8/2010,2010,5,8,128,integrifolia,San Diego,Cleveland National Forest; Puerta La Cruz Road; 1.75 miles SE Mitchell Camp Road and Chihuahua Valley Road; 6 miles N of Warner Springs and Hwy 79,1182,33.36474,-116.67411,,,,WGS84,cch2,500275,FL,,http://cch2.org/portal/collections/individual/index.php?occid=500275,CPA,Largest plant,2,Total,10,11,3,4,1,,,2.137931034
SD00010584,5/8/2010,2010,5,8,128,integrifolia,San Diego,Cleveland National Forest; Puerta La Cruz Road; 1.75 miles SE Mitchell Camp Road and Chihuahua Valley Road; 6 miles N of Warner Springs and Hwy 79,1182,33.36474,-116.67411,,,,WGS84,cch2,500275,FL,,http://cch2.org/portal/collections/individual/index.php?occid=500275,CPA,"Small, bottom left",3,Total,4,7,5,1,0,,,2.176470588
SD00010437,4/14/2010,2010,4,14,104,menziesii,San Diego,"Cleveland National Forest; Puerta La Cruz Road; 1.4 miles SE Mitchell Camp Road and Chihuahua Valley Road at small, dry riverbed that crosses the road.",1206,33.36631,-116.67929,,,,WGS84,cch2,500281,FL,,http://cch2.org/portal/collections/individual/index.php?occid=500281,CPA,"Top row, left",1,Total,7,5,2,0,0,,,1.642857143
SD00010437,4/14/2010,2010,4,14,104,menziesii,San Diego,"Cleveland National Forest; Puerta La Cruz Road; 1.4 miles SE Mitchell Camp Road and Chihuahua Valley Road at small, dry riverbed that crosses the road.",1206,33.36631,-116.67929,,,,WGS84,cch2,500281,FL,,http://cch2.org/portal/collections/individual/index.php?occid=500281,CPA,,2,Total,2,3,1,0,0,,,1.833333333
SD00010437,4/14/2010,2010,4,14,104,menziesii,San Diego,"Cleveland National Forest; Puerta La Cruz Road; 1.4 miles SE Mitchell Camp Road and Chihuahua Valley Road at small, dry riverbed that crosses the road.",1206,33.36631,-116.67929,,,,WGS84,cch2,500281,FL,,http://cch2.org/portal/collections/individual/index.php?occid=500281,CPA,,3,Total,1,3,2,0,0,,,2.166666667
SD00010437,4/14/2010,2010,4,14,104,menziesii,San Diego,"Cleveland National Forest; Puerta La Cruz Road; 1.4 miles SE Mitchell Camp Road and Chihuahua Valley Road at small, dry riverbed that crosses the road.",1206,33.36631,-116.67929,,,,WGS84,cch2,500281,FL,,http://cch2.org/portal/collections/individual/index.php?occid=500281,CPA,"Top row, right",4,Total,6,4,0,0,0,,,1.4
SD00010437,4/14/2010,2010,4,14,104,menziesii,San Diego,"Cleveland National Forest; Puerta La Cruz Road; 1.4 miles SE Mitchell Camp Road and Chihuahua Valley Road at small, dry riverbed that crosses the road.",1206,33.36631,-116.67929,,,,WGS84,cch2,500281,FL,,http://cch2.org/portal/collections/individual/index.php?occid=500281,CPA,Bottom left,5,Total,4,3,0,0,0,,,1.428571429
SD00010437,4/14/2010,2010,4,14,104,menziesii,San Diego,"Cleveland National Forest; Puerta La Cruz Road; 1.4 miles SE Mitchell Camp Road and Chihuahua Valley Road at small, dry riverbed that crosses the road.",1206,33.36631,-116.67929,,,,WGS84,cch2,500281,FL,,http://cch2.org/portal/collections/individual/index.php?occid=500281,CPA,Bottom middle,6,Total,4,4,0,1,0,,,1.777777778
SD00010454,5/3/2009,2009,5,3,123,menziesii,San Diego,"SW of Oak Grove, Rattlesnake Canyon, Cleveland National Forest, at bottom of canyon",961,33.36972,-116.78611,,,,WGS84,cch2,500245,FL,Granitic; rocky canyon with seasonal Rattlesnake Creek,http://cch2.org/portal/collections/individual/index.php?occid=500245,DC,Right Most; Middle excluded,1,Total,2,2,2,1,0,,,2.285714286
SD00010454,5/3/2009,2009,5,3,123,menziesii,San Diego,"SW of Oak Grove, Rattlesnake Canyon, Cleveland National Forest, at bottom of canyon",961,33.36972,-116.78611,,,,WGS84,cch2,500245,FL,Granitic; rocky canyon with seasonal Rattlesnake Creek,http://cch2.org/portal/collections/individual/index.php?occid=500245,DC,Left Most; Middle excluded,2,Total,2,1,0,0,0,,,1.333333333
SD00010441,5/8/2010,2010,5,8,128,menziesii,San Diego,Cleveland National Forest; Puerta La Cruz Road; about 1 mile SE Mitchell Camp Road and Chihuahua Valley Road; south-east of the junction with Puerta La Cruz Trail.,1326,33.3711,-116.68994,,,,WGS84,cch2,500277,FL,,http://cch2.org/portal/collections/individual/index.php?occid=500277,DC,Top Left; cotyledons,1,Total,1,1,0,0,0,,,1.5
SD00010441,5/8/2010,2010,5,8,128,menziesii,San Diego,Cleveland National Forest; Puerta La Cruz Road; about 1 mile SE Mitchell Camp Road and Chihuahua Valley Road; south-east of the junction with Puerta La Cruz Trail.,1326,33.3711,-116.68994,,,,WGS84,cch2,500277,FL,,http://cch2.org/portal/collections/individual/index.php?occid=500277,DC,Top second in from Left;  cotyledons,2,Total,1,1,1,1,0,,,2.5
SD00010441,5/8/2010,2010,5,8,128,menziesii,San Diego,Cleveland National Forest; Puerta La Cruz Road; about 1 mile SE Mitchell Camp Road and Chihuahua Valley Road; south-east of the junction with Puerta La Cruz Trail.,1326,33.3711,-116.68994,,,,WGS84,cch2,500277,FL,,http://cch2.org/portal/collections/individual/index.php?occid=500277,DC,Top most right; cotyledons,3,Total,0,2,2,0,0,,,2.5
SD00010445,5/8/2011,2011,5,8,128,menziesii,San Diego,"Chihuahua Valley Road, 1.1 mile E of intersection with Highway 79.",1048,33.37167,-116.72833,,,,WGS84,cch2,500284,FL,Granitic; roadcut in steeply sloping mountainside.,http://cch2.org/portal/collections/individual/index.php?occid=500284,"DC, DG",Bottom most; loose structures not scored,1,Total,3,19,20,13,14,,,3.231884058
SD00010452,4/6/2008,2008,4,6,97,menziesii,San Diego,"South of Oak Grove. 25249 Oak Grove Truck Trail, ca. 1 mile S of its intersection with Highway 79, east facing slope west of road.",915,33.3736,-116.784,,,,WGS84,cch2,500264,FL,Granitic,http://cch2.org/portal/collections/individual/index.php?occid=500264,"DC, DG",Top Left; cotyledons,1,Total,7,2,2,1,0,,,1.75
SD00010452,4/6/2008,2008,4,6,97,menziesii,San Diego,"South of Oak Grove. 25249 Oak Grove Truck Trail, ca. 1 mile S of its intersection with Highway 79, east facing slope west of road.",915,33.3736,-116.784,,,,WGS84,cch2,500264,FL,Granitic,http://cch2.org/portal/collections/individual/index.php?occid=500264,DC,Top Right,2,Total,4,2,1,1,0,,,1.875
SD00010452,4/6/2008,2008,4,6,97,menziesii,San Diego,"South of Oak Grove. 25249 Oak Grove Truck Trail, ca. 1 mile S of its intersection with Highway 79, east facing slope west of road.",915,33.3736,-116.784,,,,WGS84,cch2,500264,FL,Granitic,http://cch2.org/portal/collections/individual/index.php?occid=500264,DC,Most Center,3,Total,2,2,3,0,0,,,2.142857143
SD00010452,4/6/2008,2008,4,6,97,menziesii,San Diego,"South of Oak Grove. 25249 Oak Grove Truck Trail, ca. 1 mile S of its intersection with Highway 79, east facing slope west of road.",915,33.3736,-116.784,,,,WGS84,cch2,500264,FL,Granitic,http://cch2.org/portal/collections/individual/index.php?occid=500264,DC,Bottom Left,4,Total,7,0,1,0,0,,,1.25
SD00010452,4/6/2008,2008,4,6,97,menziesii,San Diego,"South of Oak Grove. 25249 Oak Grove Truck Trail, ca. 1 mile S of its intersection with Highway 79, east facing slope west of road.",915,33.3736,-116.784,,,,WGS84,cch2,500264,FL,Granitic,http://cch2.org/portal/collections/individual/index.php?occid=500264,"DC, DG",Bottom right,5,Total,7,2,2,0,0,,,1.545454545
SD00010438,4/14/2010,2010,4,14,104,menziesii,San Diego,"Cleveland National Forest; along Chihuahua Valley Road, 1.5 miles SW of junction with Mitchell Camp Road at large pullout area northwest of U-curve in the road.",1216,33.37634,-116.71033,,,,WGS84,cch2,500280,FL,,http://cch2.org/portal/collections/individual/index.php?occid=500280,DC,Second from left with defined root,1,Total,3,2,1,0,0,,,1.666666667
SD00010438,4/14/2010,2010,4,14,104,menziesii,San Diego,"Cleveland National Forest; along Chihuahua Valley Road, 1.5 miles SW of junction with Mitchell Camp Road at large pullout area northwest of U-curve in the road.",1216,33.37634,-116.71033,,,,WGS84,cch2,500280,FL,,http://cch2.org/portal/collections/individual/index.php?occid=500280,DC,Fourth from the right with clear cotyledons,2,Total,3,1,1,0,0,,,1.6
SD00010576,1878-04-01,1878,4,1,91,integrifolia,San Diego,Fallbrook,205.3,33.37642,-117.25115,4827,,,WGS84,cch2,500037,FL,,http://cch2.org/portal/collections/individual/index.php?occid=500037,DC,,1,Total,7,8,9,6,2,,,2.625
SD00010521,3/14/2017,2017,3,14,73,integrifolia,San Diego,"Fallbrook Naval Weapons Station: west of Fallbrook; North Magazine, north of Ammunition Road; northwestern part of station; on the northwestern slope of the highest peak on the station",245,33.38229,-117.28723,,,,WGS84,cch2,500335,FFL,,http://cch2.org/portal/collections/individual/index.php?occid=500335,"DC, DG","Top Left; blurry photograph, though structres mostly distinct",1,Total,1,1,1,0,0,,,2
SD00010521,3/14/2017,2017,3,14,73,integrifolia,San Diego,"Fallbrook Naval Weapons Station: west of Fallbrook; North Magazine, north of Ammunition Road; northwestern part of station; on the northwestern slope of the highest peak on the station",245,33.38229,-117.28723,,,,WGS84,cch2,500335,FFL,,http://cch2.org/portal/collections/individual/index.php?occid=500335,"DG, DC",Top Right; blurry photograph,2,Total,5,2,1,0,0,,,1.5
SD00010521,3/14/2017,2017,3,14,73,integrifolia,San Diego,"Fallbrook Naval Weapons Station: west of Fallbrook; North Magazine, north of Ammunition Road; northwestern part of station; on the northwestern slope of the highest peak on the station",245,33.38229,-117.28723,,,,WGS84,cch2,500335,FFL,,http://cch2.org/portal/collections/individual/index.php?occid=500335,DC,Bottom Left; blurry photograph,3,Total,6,4,4,0,0,,,1.857142857
SD00010521,3/14/2017,2017,3,14,73,integrifolia,San Diego,"Fallbrook Naval Weapons Station: west of Fallbrook; North Magazine, north of Ammunition Road; northwestern part of station; on the northwestern slope of the highest peak on the station",245,33.38229,-117.28723,,,,WGS84,cch2,500335,FFL,,http://cch2.org/portal/collections/individual/index.php?occid=500335,DC,blurry photograph,4,Total,7,5,3,2,0,,,2
SD00010490,3/6/1941,1941,3,6,65,,Los Angeles,Santa Catalina Island; Middle Ranch Canyon.,300,33.3842,-118.3842,,,,WGS84,cch2,500125,FL,,http://cch2.org/portal/collections/individual/index.php?occid=500125,DC,Large and centered left,1,Total,12,8,3,1,1,,,1.84
SD00010490,3/6/1941,1941,3,6,65,,Los Angeles,Santa Catalina Island; Middle Ranch Canyon.,300,33.3842,-118.3842,,,,WGS84,cch2,500125,FL,,http://cch2.org/portal/collections/individual/index.php?occid=500125,DC,Right with clear base,2,Total,2,3,1,0,0,,,1.833333333
SD00010490,3/6/1941,1941,3,6,65,,Los Angeles,Santa Catalina Island; Middle Ranch Canyon.,300,33.3842,-118.3842,,,,WGS84,cch2,500125,FL,,http://cch2.org/portal/collections/individual/index.php?occid=500125,DC,Bottom Right,3,Total,0,2,1,0,0,,,2.333333333
SD00010462,5/8/1935,1935,5,8,128,,San Diego,Chihuahua Valley,1283.56,33.38516,-116.67809,2011,,,WGS84,cch2,500054,FFL,,http://cch2.org/portal/collections/individual/index.php?occid=500054,DC,,1,Total,10,7,4,11,4,,,2.777777778
SD00010439,5/20/2010,2010,5,20,140,menziesii,San Diego,Northern San Diego County; along Old Mitchell Camp Road 0.17 mile N of junction with Chihuahua Valley Road,1269,33.38696,-116.68639,,,,WGS84,cch2,500279,FL,,http://cch2.org/portal/collections/individual/index.php?occid=500279,DC,Only one clear base; central,1,Total,16,6,0,1,0,,,1.391304348
SD00026562,3/2/2017,2017,3,2,61,integrifolia,San Diego,"Fallbrook Naval Weapons Station: west of Fallbrook; North Magazine, north of Ammunition Road; northern part of station River Road, on north-facing slopes",117,33.38966,-117.27513,,,,WGS84,cch2,3641150,FFL,mostly granitic substrates,http://cch2.org/portal/collections/individual/index.php?occid=3641150,DG,"Many non-whole and overlapping plants. Middle row, second to the left",1,Total,1,2,0,0,0,,,1.666666667
SD00026562,3/2/2017,2017,3,2,61,integrifolia,San Diego,"Fallbrook Naval Weapons Station: west of Fallbrook; North Magazine, north of Ammunition Road; northern part of station River Road, on north-facing slopes",117,33.38966,-117.27513,,,,WGS84,cch2,3641150,FFL,mostly granitic substrates,http://cch2.org/portal/collections/individual/index.php?occid=3641150,DG,"middle row, next plant to the right",2,Total,1,4,0,0,0,,,1.8
SD00026562,3/2/2017,2017,3,2,61,integrifolia,San Diego,"Fallbrook Naval Weapons Station: west of Fallbrook; North Magazine, north of Ammunition Road; northern part of station River Road, on north-facing slopes",117,33.38966,-117.27513,,,,WGS84,cch2,3641150,FFL,mostly granitic substrates,http://cch2.org/portal/collections/individual/index.php?occid=3641150,DG,"middle row, second to right",3,Total,3,2,0,0,0,,,1.4
SD00026562,3/2/2017,2017,3,2,61,integrifolia,San Diego,"Fallbrook Naval Weapons Station: west of Fallbrook; North Magazine, north of Ammunition Road; northern part of station River Road, on north-facing slopes",117,33.38966,-117.27513,,,,WGS84,cch2,3641150,FFL,mostly granitic substrates,http://cch2.org/portal/collections/individual/index.php?occid=3641150,DG,"middle row, right-most. Bottom plant has too much overlap, not scored",4,Total,0,2,2,0,0,,,2.5
SD00010628,7/8/2010,2010,7,8,189,integrifolia,San Diego,Cleveland National Forest: Cutca Valley on the lower northern slope of Palomar Mountain; along Cutca Valley Truck Trail,1060,33.39034,-116.91667,,,,WGS84,cch2,500249,FFL,mostly granitic substrates,http://cch2.org/portal/collections/individual/index.php?occid=500249,DG,EXCLUDE. All clippings,NA,,,,,,,,,#DIV/0!
SD00010617,4/16/1972,1972,4,16,107,integrifolia,San Diego,Cutca Valley,1050,33.39303,-116.91633,805,,,WGS84,cch2,500155,FL,,http://cch2.org/portal/collections/individual/index.php?occid=500155,DG,EXCLUDE. Very very blurry,NA,,,,,,,,,#DIV/0!
SD00010436,5/9/2011,2011,5,9,129,menziesii,San Diego,Chihuahua Valley; along Old Mitchell Camp Road; 0.70 mile N of Chihuahua Valley Road,1275,33.39447,-116.68579,,,,WGS84,cch2,500319,FL,,http://cch2.org/portal/collections/individual/index.php?occid=500319,DG,"top row, second to right with right",1,Total,0,0,3,0,0,,,3
SD00010436,5/9/2011,2011,5,9,129,menziesii,San Diego,Chihuahua Valley; along Old Mitchell Camp Road; 0.70 mile N of Chihuahua Valley Road,1275,33.39447,-116.68579,,,,WGS84,cch2,500319,FL,,http://cch2.org/portal/collections/individual/index.php?occid=500319,DG,"Bottom middle, large plant w root",2,Total,2,1,0,3,0,,,2.666666667
SD00010436,5/9/2011,2011,5,9,129,menziesii,San Diego,Chihuahua Valley; along Old Mitchell Camp Road; 0.70 mile N of Chihuahua Valley Road,1275,33.39447,-116.68579,,,,WGS84,cch2,500319,FL,,http://cch2.org/portal/collections/individual/index.php?occid=500319,DG,"next right plant, with root. couple structures missing",3,Total,0,1,0,1,0,,,3
SD00010609,3/30/1940,1940,3,30,90,integrifolia,San Diego,Hormiguero Ranch,534.42,33.39493,-117.0338,1609,,,WGS84,cch2,500074,FL,,http://cch2.org/portal/collections/individual/index.php?occid=500074,DG,top,1,Total,7,6,1,1,0,,,1.733333333
SD00010609,3/30/1940,1940,3,30,90,integrifolia,San Diego,Hormiguero Ranch,534.42,33.39493,-117.0338,1609,,,WGS84,cch2,500074,FL,,http://cch2.org/portal/collections/individual/index.php?occid=500074,DG,lower left,2,Total,1,1,1,1,0,,,2.5
SD00010609,3/30/1940,1940,3,30,90,integrifolia,San Diego,Hormiguero Ranch,534.42,33.39493,-117.0338,1609,,,WGS84,cch2,500074,FL,,http://cch2.org/portal/collections/individual/index.php?occid=500074,DG,lower/mid right,3,Total,1,1,0,0,0,,,1.5
SD00010440,6/1/2010,2010,6,1,152,menziesii,San Diego,"Chihuahua Valley, Adobe Springs, creekside, ca 1 mile NW of intersection Chihuahua Valley Road and Old Mitchell Camp Road, now under BLM management and slated to be part of the Beauty Mountain Wilderness Area.",1225,33.39556,-116.70111,,,,WGS84,cch2,500278,FL,Granitic,http://cch2.org/portal/collections/individual/index.php?occid=500278,DG,left,1,Total,3,14,5,1,0,,,2.173913043
SD00010440,6/1/2010,2010,6,1,152,menziesii,San Diego,"Chihuahua Valley, Adobe Springs, creekside, ca 1 mile NW of intersection Chihuahua Valley Road and Old Mitchell Camp Road, now under BLM management and slated to be part of the Beauty Mountain Wilderness Area.",1225,33.39556,-116.70111,,,,WGS84,cch2,500278,FL,Granitic,http://cch2.org/portal/collections/individual/index.php?occid=500278,DG,right. Non-nemophila plant tangled in,2,Total,5,5,2,5,0,,,2.411764706
SD00010632,3/18/2008,2008,3,18,78,integrifolia,San Diego,Northeast of Fallbrook. On the south side of the Santa Margarita River at the Willow Glen and North Stagecoach trailhead. Which is about 1.6 miles northwest (by air) of Red Mountain Lookout,139,33.41306,-117.21389,,,,WGS84,cch2,500246,FFL,,http://cch2.org/portal/collections/individual/index.php?occid=500246,DG,top. Specimens are very dense,1,Total,6,8,2,1,1,,,2.055555556
SD00010632,3/18/2008,2008,3,18,78,integrifolia,San Diego,Northeast of Fallbrook. On the south side of the Santa Margarita River at the Willow Glen and North Stagecoach trailhead. Which is about 1.6 miles northwest (by air) of Red Mountain Lookout,139,33.41306,-117.21389,,,,WGS84,cch2,500246,FFL,,http://cch2.org/portal/collections/individual/index.php?occid=500246,DG,middle left,2,Total,6,6,3,4,2,,,2.523809524
SD00010632,3/18/2008,2008,3,18,78,integrifolia,San Diego,Northeast of Fallbrook. On the south side of the Santa Margarita River at the Willow Glen and North Stagecoach trailhead. Which is about 1.6 miles northwest (by air) of Red Mountain Lookout,139,33.41306,-117.21389,,,,WGS84,cch2,500246,FFL,,http://cch2.org/portal/collections/individual/index.php?occid=500246,DG,middle right. difficult to determine if bottom row of plants are whole - not scored,3,Total,5,14,2,8,3,,,2.6875
SD00010559,4/18/1940,1940,4,18,109,integrifolia,San Diego,Herron Ranch near DeLuz,217.76,33.43751,-117.32043,,,,WGS84,cch2,500075,FL,,http://cch2.org/portal/collections/individual/index.php?occid=500075,DG,Horrific quality - multiple plants overlapping and blurry. Open flowers present.,NA,,,,,,,,,#DIV/0!
SD00010529,4/8/2014,2014,4,8,98,integrifolia,San Diego,"Camp Pendleton: northeast portion of Base; Training Area Echo, along a dirt road at the base of the highest ridge of the Santa Margarita Mountains, just northeast of Case Springs Road, west of Margarita Peak & southeast of Case Springs Lake",725,33.44083,-117.40063,,,,WGS84,cch2,500295,FFL,,http://cch2.org/portal/collections/individual/index.php?occid=500295,DG,"top row, middle plant underneath cutting, root visible. Open flower on overlapping plant not scored. Many cuttings on this sheet",1,Total,2,2,2,1,0,,,2.285714286
SD00010529,4/8/2014,2014,4,8,98,integrifolia,San Diego,"Camp Pendleton: northeast portion of Base; Training Area Echo, along a dirt road at the base of the highest ridge of the Santa Margarita Mountains, just northeast of Case Springs Road, west of Margarita Peak & southeast of Case Springs Lake",725,33.44083,-117.40063,,,,WGS84,cch2,500295,FFL,,http://cch2.org/portal/collections/individual/index.php?occid=500295,DG,overlapping with previous plant,2,Total,0,1,0,0,0,,,2
SD00010529,4/8/2014,2014,4,8,98,integrifolia,San Diego,"Camp Pendleton: northeast portion of Base; Training Area Echo, along a dirt road at the base of the highest ridge of the Santa Margarita Mountains, just northeast of Case Springs Road, west of Margarita Peak & southeast of Case Springs Lake",725,33.44083,-117.40063,,,,WGS84,cch2,500295,FFL,,http://cch2.org/portal/collections/individual/index.php?occid=500295,DG,top right. CARFEUL: Non-nemophila plant overlapping,3,Total,4,4,0,0,0,,,1.5
SD00010529,4/8/2014,2014,4,8,98,integrifolia,San Diego,"Camp Pendleton: northeast portion of Base; Training Area Echo, along a dirt road at the base of the highest ridge of the Santa Margarita Mountains, just northeast of Case Springs Road, west of Margarita Peak & southeast of Case Springs Lake",725,33.44083,-117.40063,,,,WGS84,cch2,500295,FFL,,http://cch2.org/portal/collections/individual/index.php?occid=500295,DG,"bottom middle, under overlapping plant. cotyledon present",4,Total,0,0,2,1,0,,,3.333333333
SD00010529,4/8/2014,2014,4,8,98,integrifolia,San Diego,"Camp Pendleton: northeast portion of Base; Training Area Echo, along a dirt road at the base of the highest ridge of the Santa Margarita Mountains, just northeast of Case Springs Road, west of Margarita Peak & southeast of Case Springs Lake",725,33.44083,-117.40063,,,,WGS84,cch2,500295,FFL,,http://cch2.org/portal/collections/individual/index.php?occid=500295,DG,"bottom middle, over previous plant; large root present",5,Total,1,1,0,1,2,,,3.4
SD00010546,5/4/1995,1995,5,4,124,integrifolia,Riverside,"Cleveland Nat'l Forest, Agua Tibia Wilderness Area. N slope of Agua Tibia Mtn., E of Dripping Springs Alcove Area, N of Woodchuck Trail.",610,33.45,-116.95,,,,WGS84,cch2,500163,FFL,Granitic substrate with a decomposed granitic soil; aspect NE; slope 55%.,http://cch2.org/portal/collections/individual/index.php?occid=500163,DG,top right. Small flowers. some structures missing,1,Total,4,4,5,2,3,,,2.777777778
SD00010546,5/4/1995,1995,5,4,124,integrifolia,Riverside,"Cleveland Nat'l Forest, Agua Tibia Wilderness Area. N slope of Agua Tibia Mtn., E of Dripping Springs Alcove Area, N of Woodchuck Trail.",610,33.45,-116.95,,,,WGS84,cch2,500163,FFL,Granitic substrate with a decomposed granitic soil; aspect NE; slope 55%.,http://cch2.org/portal/collections/individual/index.php?occid=500163,DG,left. Loose structures not scored,2,Total,6,6,4,4,2,,,2.545454545
SD00010567,3/16/1971,1971,3,16,75,integrifolia,San Diego,½ mile NW of Margarita Peak,800,33.45129,-117.39809,402,,,WGS84,cch2,500161,FL,"Shaded, grassy area",http://cch2.org/portal/collections/individual/index.php?occid=500161,DG,"blurry. Some plants have cotyledons, but most are detached/separate and not scoreable. upper left",1,Total,2,2,0,0,0,,,1.5
SD00010618,5/6/1992,1992,5,6,127,integrifolia,San Diego,"So. Santa Ana Mts, San Mateo Cyn Wilderness Area. S side of Miller Mt along 'Miller Canyon', the major drainage on the southern flank of the mountain, from Road 8S02 upstream to the area of contact between lower granitic and higher basaltic rocks.",640,33.49225,-117.38606,402,,,WGS84,cch2,500162,FFL,Granitic & basaltic rocks,http://cch2.org/portal/collections/individual/index.php?occid=500162,DG,upper right. blurry,1,Total,2,11,8,11,6,,,3.210526316
SD00010618,5/6/1992,1992,5,6,127,integrifolia,San Diego,"So. Santa Ana Mts, San Mateo Cyn Wilderness Area. S side of Miller Mt along 'Miller Canyon', the major drainage on the southern flank of the mountain, from Road 8S02 upstream to the area of contact between lower granitic and higher basaltic rocks.",640,33.49225,-117.38606,402,,,WGS84,cch2,500162,FFL,Granitic & basaltic rocks,http://cch2.org/portal/collections/individual/index.php?occid=500162,DG,lower,2,Total,6,17,16,21,16,,,3.315789474
SD00010503,1882-04-24,1882,4,24,114,,Riverside,Temecula,310.55,33.4956,-117.1493,,,,WGS84,cch2,500040,FL,,http://cch2.org/portal/collections/individual/index.php?occid=500040,DG,left. ,1,Total,1,3,2,2,0,,,2.625
SD00010503,1882-04-24,1882,4,24,114,,Riverside,Temecula,310.55,33.4956,-117.1493,,,,WGS84,cch2,500040,FL,,http://cch2.org/portal/collections/individual/index.php?occid=500040,DG,"right. Appears whole, one cot present",2,Total,0,2,1,3,0,,,3.166666667
SD00010475,3/19/2013,2013,3,19,78,,Riverside,"Perris-Aguanga Basin: Menifee Valley, Los Alamos Road at its crossing of Warm Springs Creek, and hill west of Jeanette Drive (Murrieta 7.5'Q)",390,33.59833,-117.14194,,,,WGS84,cch2,500313,FFL,,http://cch2.org/portal/collections/individual/index.php?occid=500313,DG,top left,1,Total,10,6,0,4,0,,,1.9
SD00010475,3/19/2013,2013,3,19,78,,Riverside,"Perris-Aguanga Basin: Menifee Valley, Los Alamos Road at its crossing of Warm Springs Creek, and hill west of Jeanette Drive (Murrieta 7.5'Q)",390,33.59833,-117.14194,,,,WGS84,cch2,500313,FFL,,http://cch2.org/portal/collections/individual/index.php?occid=500313,DG,bottom left,2,Total,5,1,1,1,0,,,1.75
SD00010475,3/19/2013,2013,3,19,78,,Riverside,"Perris-Aguanga Basin: Menifee Valley, Los Alamos Road at its crossing of Warm Springs Creek, and hill west of Jeanette Drive (Murrieta 7.5'Q)",390,33.59833,-117.14194,,,,WGS84,cch2,500313,FFL,,http://cch2.org/portal/collections/individual/index.php?occid=500313,DG,middle,3,Total,4,0,1,0,0,,,1.4
SD00010475,3/19/2013,2013,3,19,78,,Riverside,"Perris-Aguanga Basin: Menifee Valley, Los Alamos Road at its crossing of Warm Springs Creek, and hill west of Jeanette Drive (Murrieta 7.5'Q)",390,33.59833,-117.14194,,,,WGS84,cch2,500313,FFL,,http://cch2.org/portal/collections/individual/index.php?occid=500313,DG,bottom right,4,Total,5,4,1,0,0,,,1.6
RSA0059611,4/4/1917,1917,4,4,94,,Riverside County,Palm Canyon,762,33.6698,-116.5157,1000,,,WGS84,cch2,1125058,,under shrub.,http://cch2.org/portal/collections/individual/index.php?occid=1125058,DG,left most. missing a structure,1,Total,1,0,1,0,0,,,2
RSA0059611,4/4/1917,1917,4,4,94,,Riverside County,Palm Canyon,762,33.6698,-116.5157,1000,,,WGS84,cch2,1125058,,under shrub.,http://cch2.org/portal/collections/individual/index.php?occid=1125058,DG,upper middle,2,Total,4,2,0,3,0,,,2.222222222
SD00010510,4/12/2000,2000,4,12,103,,Riverside,"San Jacinto Mountains, Baldy Mountain area; Idyllwild [quad].",1616,33.68333,-116.71667,,,,WGS84,cch2,500213,FL,,http://cch2.org/portal/collections/individual/index.php?occid=500213,DG,top left,1,Total,1,1,0,0,0,,,1.5
SD00010510,4/12/2000,2000,4,12,103,,Riverside,"San Jacinto Mountains, Baldy Mountain area; Idyllwild [quad].",1616,33.68333,-116.71667,,,,WGS84,cch2,500213,FL,,http://cch2.org/portal/collections/individual/index.php?occid=500213,DG,top right,2,Total,3,0,1,0,0,,,1.5
SD00010510,4/12/2000,2000,4,12,103,,Riverside,"San Jacinto Mountains, Baldy Mountain area; Idyllwild [quad].",1616,33.68333,-116.71667,,,,WGS84,cch2,500213,FL,,http://cch2.org/portal/collections/individual/index.php?occid=500213,DG,"bottom middle. Tiny plant overlapping, no structures",3,Total,11,11,2,0,1,,,1.76
RSA0060576,4/28/1984,1984,4,28,119,menziesii,Riverside County,"Collected on North-facing slope adjacent ot and on the South side of Highway 74, 3.6 miles from Strawberry Creek going towards Mountain Center.",1219,33.6982,-116.7528,1000,,,WGS84,cch2,1127422,,,http://cch2.org/portal/collections/individual/index.php?occid=1127422,DG,top left. Very clear sheet,1,Total,8,2,0,1,1,,,1.75
RSA0060576,4/28/1984,1984,4,28,119,menziesii,Riverside County,"Collected on North-facing slope adjacent ot and on the South side of Highway 74, 3.6 miles from Strawberry Creek going towards Mountain Center.",1219,33.6982,-116.7528,1000,,,WGS84,cch2,1127422,,,http://cch2.org/portal/collections/individual/index.php?occid=1127422,DG,top right,2,Total,3,2,1,2,1,,,2.555555556
RSA0060576,4/28/1984,1984,4,28,119,menziesii,Riverside County,"Collected on North-facing slope adjacent ot and on the South side of Highway 74, 3.6 miles from Strawberry Creek going towards Mountain Center.",1219,33.6982,-116.7528,1000,,,WGS84,cch2,1127422,,,http://cch2.org/portal/collections/individual/index.php?occid=1127422,DG,bottom left,3,Total,1,1,0,3,2,,,3.571428571
SD00010477,4/2/2013,2013,4,2,92,,Riverside,"Peninsular Range: Temescal Canyon between Horsetheif Canyon Road and Hostettler Road, near I-15 Fwy, SE of Corona (Lee) Lake (Albrehill 7.5'Q)",377,33.73696,-117.42017,,,,WGS84,cch2,500308,FL,,http://cch2.org/portal/collections/individual/index.php?occid=500308,SA,,1,Total,2,8,1,3,1,,,2.533333333
SD00010477,4/2/2013,2013,4,2,92,,Riverside,"Peninsular Range: Temescal Canyon between Horsetheif Canyon Road and Hostettler Road, near I-15 Fwy, SE of Corona (Lee) Lake (Albrehill 7.5'Q)",377,33.73696,-117.42017,,,,WGS84,cch2,500308,FL,,http://cch2.org/portal/collections/individual/index.php?occid=500308,SA,,2,Total,2,0,0,0,0,,,1
SD00010672,4/30/1954,1954,4,30,120,integrifolia,San Bernardino,"Idlewild, San Jacinto River.",1676,33.7503,-116.7152,,,,WGS84,cch2,500135,FL,,http://cch2.org/portal/collections/individual/index.php?occid=500135,SA,,1,Total,4,5,0,5,1,,,2.6
SD00010672,4/30/1954,1954,4,30,120,integrifolia,San Bernardino,"Idlewild, San Jacinto River.",1676,33.7503,-116.7152,,,,WGS84,cch2,500135,FL,,http://cch2.org/portal/collections/individual/index.php?occid=500135,SA,,2,Total,0,1,1,2,0,,,3.25
SD00010672,4/30/1954,1954,4,30,120,integrifolia,San Bernardino,"Idlewild, San Jacinto River.",1676,33.7503,-116.7152,,,,WGS84,cch2,500135,FL,,http://cch2.org/portal/collections/individual/index.php?occid=500135,SA,,3,Total,2,4,1,4,0,,,2.636363636
SD00010672,4/30/1954,1954,4,30,120,integrifolia,San Bernardino,"Idlewild, San Jacinto River.",1676,33.7503,-116.7152,,,,WGS84,cch2,500135,FL,,http://cch2.org/portal/collections/individual/index.php?occid=500135,SA,,4,Total,1,2,0,2,0,,,2.6
SD00010672,4/30/1954,1954,4,30,120,integrifolia,San Bernardino,"Idlewild, San Jacinto River.",1676,33.7503,-116.7152,,,,WGS84,cch2,500135,FL,,http://cch2.org/portal/collections/individual/index.php?occid=500135,SA,,5,Total,1,2,1,1,0,,,2.4
SD00010672,4/30/1954,1954,4,30,120,integrifolia,San Bernardino,"Idlewild, San Jacinto River.",1676,33.7503,-116.7152,,,,WGS84,cch2,500135,FL,,http://cch2.org/portal/collections/individual/index.php?occid=500135,SA,,6,Total,4,5,2,10,1,,,2.954545455
SDSU18403,2/27/2008,2008,2,27,58,menziesii,Riverside,"El Sobrante Landfill preserve area, western Riverside County, east of Interstate 15 off Temescal Canyon Road. Ca. 5 kilometers east off freeway. Access through landfill entrance.",405,33.79494,-117.45103,,,,,cch2,392587,,"North-facing slope near edge of mesatop. Recently burned, formerly Riversidean sage scrub, now largely herbaceous community.",http://cch2.org/portal/collections/individual/index.php?occid=392587,DG,,1,Total,8,3,1,0,0,,,1.416666667
SDSU18390,2/21/2008,2008,2,21,52,menziesii,Riverside,"El Sobrante Landfill preserve area, western Riverside County, east of Interstate 15 off Temescal Canyon Road. Ca. 5 kilometers east off freeway. Access through landfill entrance.",418,33.79722,-117.46225,,,,,cch2,392574,,"In expansion phase on highly disturbed, west-facing slope of Riversidean sage scrub. Dominants include Eriogonum fasciculatum, Opuntia sp., Dichelostemma capitatum, Plagiobothrys sp., Eriodium spp.",http://cch2.org/portal/collections/individual/index.php?occid=392574,SA,"Top middle plant is 2 plants intertwined, I can't tell the difference between the two",1,Total,4,2,0,2,0,,,2
SDSU18390,2/21/2008,2008,2,21,52,menziesii,Riverside,"El Sobrante Landfill preserve area, western Riverside County, east of Interstate 15 off Temescal Canyon Road. Ca. 5 kilometers east off freeway. Access through landfill entrance.",418,33.79722,-117.46225,,,,,cch2,392574,,"In expansion phase on highly disturbed, west-facing slope of Riversidean sage scrub. Dominants include Eriogonum fasciculatum, Opuntia sp., Dichelostemma capitatum, Plagiobothrys sp., Eriodium spp.",http://cch2.org/portal/collections/individual/index.php?occid=392574,SA,,2,Total,2,2,0,0,0,,,1.5
SDSU18390,2/21/2008,2008,2,21,52,menziesii,Riverside,"El Sobrante Landfill preserve area, western Riverside County, east of Interstate 15 off Temescal Canyon Road. Ca. 5 kilometers east off freeway. Access through landfill entrance.",418,33.79722,-117.46225,,,,,cch2,392574,,"In expansion phase on highly disturbed, west-facing slope of Riversidean sage scrub. Dominants include Eriogonum fasciculatum, Opuntia sp., Dichelostemma capitatum, Plagiobothrys sp., Eriodium spp.",http://cch2.org/portal/collections/individual/index.php?occid=392574,SA,,3,Total,4,1,0,0,0,,,1.2
SDSU18390,2/21/2008,2008,2,21,52,menziesii,Riverside,"El Sobrante Landfill preserve area, western Riverside County, east of Interstate 15 off Temescal Canyon Road. Ca. 5 kilometers east off freeway. Access through landfill entrance.",418,33.79722,-117.46225,,,,,cch2,392574,,"In expansion phase on highly disturbed, west-facing slope of Riversidean sage scrub. Dominants include Eriogonum fasciculatum, Opuntia sp., Dichelostemma capitatum, Plagiobothrys sp., Eriodium spp.",http://cch2.org/portal/collections/individual/index.php?occid=392574,SA,,4,Total,4,1,0,0,0,,,1.2
SD00010505,5/10/1925,1925,5,10,130,,Riverside,"Banning-Idyllwild Road, San Jacinto Mountains.",1219,33.8748,-116.842,,,,WGS84,cch2,500033,FL,,http://cch2.org/portal/collections/individual/index.php?occid=500033,SA,Top row,1,Total,0,5,0,2,0,,,2.571428571
SD00010505,5/10/1925,1925,5,10,130,,Riverside,"Banning-Idyllwild Road, San Jacinto Mountains.",1219,33.8748,-116.842,,,,WGS84,cch2,500033,FL,,http://cch2.org/portal/collections/individual/index.php?occid=500033,SA,,2,Total,2,5,3,10,3,,,3.304347826
SD00010505,5/10/1925,1925,5,10,130,,Riverside,"Banning-Idyllwild Road, San Jacinto Mountains.",1219,33.8748,-116.842,,,,WGS84,cch2,500033,FL,,http://cch2.org/portal/collections/individual/index.php?occid=500033,SA,Bottom row,3,Total,1,6,1,2,1,,,2.636363636
SD00010505,5/10/1925,1925,5,10,130,,Riverside,"Banning-Idyllwild Road, San Jacinto Mountains.",1219,33.8748,-116.842,,,,WGS84,cch2,500033,FL,,http://cch2.org/portal/collections/individual/index.php?occid=500033,SA,,4,Total,1,2,0,2,0,,,2.6
SD00010505,5/10/1925,1925,5,10,130,,Riverside,"Banning-Idyllwild Road, San Jacinto Mountains.",1219,33.8748,-116.842,,,,WGS84,cch2,500033,FL,,http://cch2.org/portal/collections/individual/index.php?occid=500033,SA,,5,Total,5,5,1,3,1,,,2.333333333
SD00010505,5/10/1925,1925,5,10,130,,Riverside,"Banning-Idyllwild Road, San Jacinto Mountains.",1219,33.8748,-116.842,,,,WGS84,cch2,500033,FL,,http://cch2.org/portal/collections/individual/index.php?occid=500033,SA,,6,Total,1,6,4,6,2,,,3.105263158
OBI106017,4/12/1969,1969,4,12,102,,Riverside,"Box Springs mts, NW slope of hill, SE of UCR",366,33.96621,-117.31939,633,,,WGS84,cch2,196225,,"coastal sage scrub. Assoc Euphorbia, Encelia, Oenothera, Amsinckia, Phacelia, Eriogonum, Rubus",http://cch2.org/portal/collections/individual/index.php?occid=196225,SA,,1,Total,5,6,2,7,3,,,2.869565217
RSA0043164,5/21/2012,2012,5,21,142,,San Bernardino County,"Yucaipa Ridge; approximately 4 air miles northeast of the San Gorgonio Ranger station, or approximately 0.6 air mile northeast of Allen Peak.",1616,34.08484,-116.97716,,,,,cch2,1081945,,"A steep shady rocky north facing slope with Quercus chrysolepis, Pinus coulteri, Cercocarpus ledifolius, Galium aparine, Yucca whipplei, Osmorhiza brackypoda, Lomatium dissectum, Dryopteris, Eriophyllum confertiflorum, Galium angustifolium, Lithophragma affine, Gilia capitatum.",http://cch2.org/portal/collections/individual/index.php?occid=1081945,SA,"leftmost whole plant; large plant in the middle is a mix of different plants, did not score",1,Total,2,2,0,1,0,,,2
RSA0043164,5/21/2012,2012,5,21,142,,San Bernardino County,"Yucaipa Ridge; approximately 4 air miles northeast of the San Gorgonio Ranger station, or approximately 0.6 air mile northeast of Allen Peak.",1616,34.08484,-116.97716,,,,,cch2,1081945,,"A steep shady rocky north facing slope with Quercus chrysolepis, Pinus coulteri, Cercocarpus ledifolius, Galium aparine, Yucca whipplei, Osmorhiza brackypoda, Lomatium dissectum, Dryopteris, Eriophyllum confertiflorum, Galium angustifolium, Lithophragma affine, Gilia capitatum.",http://cch2.org/portal/collections/individual/index.php?occid=1081945,SA,right plant,2,Total,1,2,3,2,0,,,2.75
RSA0094763,3/31/2015,2015,3,31,90,,San Bernardino County,"Little San Bernardino Mountains; along dirt road in Water Canyon, 1.3 mi west of Pioneertown Rd, approx 5 mi. NW of Yucca Valley.",1148,34.1309667,-116.4915,,,,NAD83,cch2,1110758,,Geologic formation: alluvium; Parent rock: granite; Soil type: sand; banks of sandy wash.,http://cch2.org/portal/collections/individual/index.php?occid=1110758,SA,,1,Total,1,1,1,0,0,,,2
RSA0094763,3/31/2015,2015,3,31,90,,San Bernardino County,"Little San Bernardino Mountains; along dirt road in Water Canyon, 1.3 mi west of Pioneertown Rd, approx 5 mi. NW of Yucca Valley.",1148,34.1309667,-116.4915,,,,NAD83,cch2,1110758,,Geologic formation: alluvium; Parent rock: granite; Soil type: sand; banks of sandy wash.,http://cch2.org/portal/collections/individual/index.php?occid=1110758,SA,,2,Total,1,1,0,1,0,,,2.333333333
RSA0094763,3/31/2015,2015,3,31,90,,San Bernardino County,"Little San Bernardino Mountains; along dirt road in Water Canyon, 1.3 mi west of Pioneertown Rd, approx 5 mi. NW of Yucca Valley.",1148,34.1309667,-116.4915,,,,NAD83,cch2,1110758,,Geologic formation: alluvium; Parent rock: granite; Soil type: sand; banks of sandy wash.,http://cch2.org/portal/collections/individual/index.php?occid=1110758,SA,,3,Total,0,2,0,2,0,,,3
RSA0094763,3/31/2015,2015,3,31,90,,San Bernardino County,"Little San Bernardino Mountains; along dirt road in Water Canyon, 1.3 mi west of Pioneertown Rd, approx 5 mi. NW of Yucca Valley.",1148,34.1309667,-116.4915,,,,NAD83,cch2,1110758,,Geologic formation: alluvium; Parent rock: granite; Soil type: sand; banks of sandy wash.,http://cch2.org/portal/collections/individual/index.php?occid=1110758,SA,,4,Total,1,0,1,2,0,,,3
RSA0022321,4/23/2011,2011,4,23,113,,San Bernardino County,Sawtooth Mountains; collecting in rugged boulder piles about a mile south of Pioneertown and about 0.75 air mile east of Chaparrosa Spring.,1338,34.14308,-116.50302,,,,,cch2,1205796,,"Bouldery hills and canyons with burnt pinyons, junipers and joshua trees from the Sawtooth Complex fire of 2006 and with Yucca schidigera, Nolina parryi, Yucca whipplei, Ephedra californica, Eriophyllum confertiflorum, Ericameria linearifolia, Quercus cornelius-mulleri, Delphinium parishii, Bromus tectorum, Opuntia basilaris and an abundance of winter annuals.",http://cch2.org/portal/collections/individual/index.php?occid=1205796,SA,Some weird strings woven in but otherwise a whole plant,1,Total,6,7,5,19,0,,,3
RSA0003800,1882-02-25,1882,2,25,56,integrifolia,Los Angeles County,Pasadena.,249.86,34.152867,-118.121454,6700,,,WGS84,cch2,1202835,,,http://cch2.org/portal/collections/individual/index.php?occid=1202835,SA,,1,Total,8,3,0,1,0,,,1.5
RSA0003800,1882-02-25,1882,2,25,56,integrifolia,Los Angeles County,Pasadena.,249.86,34.152867,-118.121454,6700,,,WGS84,cch2,1202835,,,http://cch2.org/portal/collections/individual/index.php?occid=1202835,SA,,2,Total,2,4,0,0,0,,,1.666666667
SD00010662,4/1/2006,2006,4,1,91,integrifolia,San Bernardino,"Little San Bernardino Mountains; Pipes Canyon Preserve; Sorrel Horse Canyon, south of Pioneertown Road along wash and ridge to the south.",1220,34.16111,-116.51083,,,,WGS84,cch2,500272,FL,Decomposed granite and alluvial soils.,http://cch2.org/portal/collections/individual/index.php?occid=500272,SA,,1,Total,7,11,8,15,9,,,3.16
RSA0043195,7/2/2010,2010,7,2,183,,San Bernardino County,Upper Santa Ana River Watershed: Middle Control Road between Highway 38 and Santa Ana River.,1571,34.1619444,-116.9633333,,,,,cch2,962363,,"N-slpe with chaparral and dense Oak Woodland, some roadside seeps.",http://cch2.org/portal/collections/individual/index.php?occid=962363,SA,,1,Total,1,8,1,0,6,,,3.125
RSA0043193,5/6/2010,2010,5,6,126,,San Bernardino County,San Bernardino National Forest: the upper Santa Ana River watershed; along the Santa Ana River Trail approximately 0.25 air mile east of Mill Creek road.,1553,34.16404,-116.94995,,,,,cch2,1094910,,"A shady forest slope with Pinus jeffreyi, Abies concolor, Quercus kelloggii, Pinus coulteri, Pinus lambertiana, Ribes nevadense, Viola purpurea, Claytonia rubra, and Nemophilla spatulata.",http://cch2.org/portal/collections/individual/index.php?occid=1094910,SA,top left,1,Total,3,3,0,0,0,,,1.5
RSA0043193,5/6/2010,2010,5,6,126,,San Bernardino County,San Bernardino National Forest: the upper Santa Ana River watershed; along the Santa Ana River Trail approximately 0.25 air mile east of Mill Creek road.,1553,34.16404,-116.94995,,,,,cch2,1094910,,"A shady forest slope with Pinus jeffreyi, Abies concolor, Quercus kelloggii, Pinus coulteri, Pinus lambertiana, Ribes nevadense, Viola purpurea, Claytonia rubra, and Nemophilla spatulata.",http://cch2.org/portal/collections/individual/index.php?occid=1094910,SA,top right,2,Total,1,2,0,0,0,,,1.666666667
RSA0043193,5/6/2010,2010,5,6,126,,San Bernardino County,San Bernardino National Forest: the upper Santa Ana River watershed; along the Santa Ana River Trail approximately 0.25 air mile east of Mill Creek road.,1553,34.16404,-116.94995,,,,,cch2,1094910,,"A shady forest slope with Pinus jeffreyi, Abies concolor, Quercus kelloggii, Pinus coulteri, Pinus lambertiana, Ribes nevadense, Viola purpurea, Claytonia rubra, and Nemophilla spatulata.",http://cch2.org/portal/collections/individual/index.php?occid=1094910,SA,bottom left,3,Total,5,2,0,0,0,,,1.285714286
RSA0043193,5/6/2010,2010,5,6,126,,San Bernardino County,San Bernardino National Forest: the upper Santa Ana River watershed; along the Santa Ana River Trail approximately 0.25 air mile east of Mill Creek road.,1553,34.16404,-116.94995,,,,,cch2,1094910,,"A shady forest slope with Pinus jeffreyi, Abies concolor, Quercus kelloggii, Pinus coulteri, Pinus lambertiana, Ribes nevadense, Viola purpurea, Claytonia rubra, and Nemophilla spatulata.",http://cch2.org/portal/collections/individual/index.php?occid=1094910,SA,middle large plant,4,Total,4,3,1,0,0,,,1.625
RSA0043193,5/6/2010,2010,5,6,126,,San Bernardino County,San Bernardino National Forest: the upper Santa Ana River watershed; along the Santa Ana River Trail approximately 0.25 air mile east of Mill Creek road.,1553,34.16404,-116.94995,,,,,cch2,1094910,,"A shady forest slope with Pinus jeffreyi, Abies concolor, Quercus kelloggii, Pinus coulteri, Pinus lambertiana, Ribes nevadense, Viola purpurea, Claytonia rubra, and Nemophilla spatulata.",http://cch2.org/portal/collections/individual/index.php?occid=1094910,SA,bottom most plant,5,Total,5,2,0,0,0,,,1.285714286
RSA0036743,4/11/1998,1998,4,11,101,,San Bernardino County,Burns Pinon Ridge Reserve.,1250,34.17,-116.43,,,,,cch2,905376,,,http://cch2.org/portal/collections/individual/index.php?occid=905376,SA,,1,Total,2,2,1,1,0,,,2.166666667
RSA0036743,4/11/1998,1998,4,11,101,,San Bernardino County,Burns Pinon Ridge Reserve.,1250,34.17,-116.43,,,,,cch2,905376,,,http://cch2.org/portal/collections/individual/index.php?occid=905376,SA,,2,Total,1,1,2,3,1,,,3.25
SDSU22704,5/17/1983,1983,5,17,137,menziesii,San Bernardino,1.7 miles northwest of the end of Etiwanda Ave.; Day Canyon Gaging Station.,884,34.184673,-117.540695,,,,,cch2,3671751,,Dry shade,http://cch2.org/portal/collections/individual/index.php?occid=3671751,SA,,1,Total,7,7,3,4,1,,,2.318181818
SDSU22704,5/17/1983,1983,5,17,137,menziesii,San Bernardino,1.7 miles northwest of the end of Etiwanda Ave.; Day Canyon Gaging Station.,884,34.184673,-117.540695,,,,,cch2,3671751,,Dry shade,http://cch2.org/portal/collections/individual/index.php?occid=3671751,SA,,2,Total,1,6,0,2,0,,,2.333333333
SD00010673,5/7/1963,1963,5,7,127,integrifolia,San Bernardino,"Cedar Pines Park, San Bernardino Mountains.",1524,34.25,-117.3259,,,,WGS84,cch2,500123,FL,,http://cch2.org/portal/collections/individual/index.php?occid=500123,SA,top row,1,Total,1,4,0,0,0,,,1.8
SD00010673,5/7/1963,1963,5,7,127,integrifolia,San Bernardino,"Cedar Pines Park, San Bernardino Mountains.",1524,34.25,-117.3259,,,,WGS84,cch2,500123,FL,,http://cch2.org/portal/collections/individual/index.php?occid=500123,SA,,2,Total,3,1,0,0,0,,,1.25
SD00010673,5/7/1963,1963,5,7,127,integrifolia,San Bernardino,"Cedar Pines Park, San Bernardino Mountains.",1524,34.25,-117.3259,,,,WGS84,cch2,500123,FL,,http://cch2.org/portal/collections/individual/index.php?occid=500123,SA,,3,Total,3,1,0,0,0,,,1.25
SD00010673,5/7/1963,1963,5,7,127,integrifolia,San Bernardino,"Cedar Pines Park, San Bernardino Mountains.",1524,34.25,-117.3259,,,,WGS84,cch2,500123,FL,,http://cch2.org/portal/collections/individual/index.php?occid=500123,SA,,4,Total,1,3,0,1,0,,,2.2
SD00010673,5/7/1963,1963,5,7,127,integrifolia,San Bernardino,"Cedar Pines Park, San Bernardino Mountains.",1524,34.25,-117.3259,,,,WGS84,cch2,500123,FL,,http://cch2.org/portal/collections/individual/index.php?occid=500123,SA,middle row,5,Total,3,3,0,1,0,,,1.857142857
SD00010673,5/7/1963,1963,5,7,127,integrifolia,San Bernardino,"Cedar Pines Park, San Bernardino Mountains.",1524,34.25,-117.3259,,,,WGS84,cch2,500123,FL,,http://cch2.org/portal/collections/individual/index.php?occid=500123,SA,,6,Total,2,1,0,0,0,,,1.333333333
SD00010673,5/7/1963,1963,5,7,127,integrifolia,San Bernardino,"Cedar Pines Park, San Bernardino Mountains.",1524,34.25,-117.3259,,,,WGS84,cch2,500123,FL,,http://cch2.org/portal/collections/individual/index.php?occid=500123,SA,,7,Total,1,1,0,0,0,,,1.5
SD00010673,5/7/1963,1963,5,7,127,integrifolia,San Bernardino,"Cedar Pines Park, San Bernardino Mountains.",1524,34.25,-117.3259,,,,WGS84,cch2,500123,FL,,http://cch2.org/portal/collections/individual/index.php?occid=500123,SA,bottom row,8,Total,3,5,1,0,0,,,1.777777778
SD00010673,5/7/1963,1963,5,7,127,integrifolia,San Bernardino,"Cedar Pines Park, San Bernardino Mountains.",1524,34.25,-117.3259,,,,WGS84,cch2,500123,FL,,http://cch2.org/portal/collections/individual/index.php?occid=500123,SA,,9,Total,3,3,0,0,0,,,1.5
SDSU06088,5/1/1934,1934,5,1,121,menziesii,San Bernardino,"Dry shore, E side big bear Lake, San Bernardino Mts.",2056.62,34.264,-116.8662,2926,,,WGS84,cch2,380493,,,http://cch2.org/portal/collections/individual/index.php?occid=380493,SA,,1,Total,0,0,0,1,2,,,4.666666667
SDSU06088,5/1/1934,1934,5,1,121,menziesii,San Bernardino,"Dry shore, E side big bear Lake, San Bernardino Mts.",2056.62,34.264,-116.8662,2926,,,WGS84,cch2,380493,,,http://cch2.org/portal/collections/individual/index.php?occid=380493,SA,,2,Total,1,0,0,3,3,,,4
SDSU06137,4/1/1952,1952,4,1,92,menziesii,Los Angeles,Azusa Canyon. Angeles Natl. Forest near Coldstream Guard Station.,1036,34.291484,-117.840418,300,,,WGS84,cch2,380542,,Veg type: west. Drainage area: chaparrall. Soil: humus-loam.,http://cch2.org/portal/collections/individual/index.php?occid=380542,SA,,1,Total,0,2,0,0,0,,,2
SDSU06137,4/1/1952,1952,4,1,92,menziesii,Los Angeles,Azusa Canyon. Angeles Natl. Forest near Coldstream Guard Station.,1036,34.291484,-117.840418,300,,,WGS84,cch2,380542,,Veg type: west. Drainage area: chaparrall. Soil: humus-loam.,http://cch2.org/portal/collections/individual/index.php?occid=380542,SA,,2,Total,2,2,0,0,0,,,1.5
SD00010508,3/24/2008,2008,3,24,84,,San Bernardino,"San Bernardino Mountains: Wye Peak at Cajon Junction, northeast of 215/Highway 138 intersection.",1107,34.31417,-117.43861,,,,WGS84,cch2,500237,FL,Mountain top.,http://cch2.org/portal/collections/individual/index.php?occid=500237,SA,top,1,Total,4,6,0,0,0,,,1.6
SD00010508,3/24/2008,2008,3,24,84,,San Bernardino,"San Bernardino Mountains: Wye Peak at Cajon Junction, northeast of 215/Highway 138 intersection.",1107,34.31417,-117.43861,,,,WGS84,cch2,500237,FL,Mountain top.,http://cch2.org/portal/collections/individual/index.php?occid=500237,SA,left,2,Total,2,3,0,0,0,,,1.6
SD00010508,3/24/2008,2008,3,24,84,,San Bernardino,"San Bernardino Mountains: Wye Peak at Cajon Junction, northeast of 215/Highway 138 intersection.",1107,34.31417,-117.43861,,,,WGS84,cch2,500237,FL,Mountain top.,http://cch2.org/portal/collections/individual/index.php?occid=500237,SA,right,3,Total,5,5,0,2,0,,,1.916666667
SD00010508,3/24/2008,2008,3,24,84,,San Bernardino,"San Bernardino Mountains: Wye Peak at Cajon Junction, northeast of 215/Highway 138 intersection.",1107,34.31417,-117.43861,,,,WGS84,cch2,500237,FL,Mountain top.,http://cch2.org/portal/collections/individual/index.php?occid=500237,SA,bottom,4,Total,3,5,0,0,0,,,1.625
RSA0043194,4/25/1995,1995,4,25,115,,San Bernardino County,"East of hwy. I-15 and Cajon Pass, via hwy. 138, Elliott's Ranch area.",1067,34.325,-117.4227778,,,,,cch2,967280,,,http://cch2.org/portal/collections/individual/index.php?occid=967280,SA,,1,Total,4,7,0,0,0,,,1.636363636
RSA0043194,4/25/1995,1995,4,25,115,,San Bernardino County,"East of hwy. I-15 and Cajon Pass, via hwy. 138, Elliott's Ranch area.",1067,34.325,-117.4227778,,,,,cch2,967280,,,http://cch2.org/portal/collections/individual/index.php?occid=967280,SA,,2,Total,2,4,0,0,0,,,1.666666667
RSA0043194,4/25/1995,1995,4,25,115,,San Bernardino County,"East of hwy. I-15 and Cajon Pass, via hwy. 138, Elliott's Ranch area.",1067,34.325,-117.4227778,,,,,cch2,967280,,,http://cch2.org/portal/collections/individual/index.php?occid=967280,SA,,3,Total,5,10,1,3,1,,,2.25
RSA0043194,4/25/1995,1995,4,25,115,,San Bernardino County,"East of hwy. I-15 and Cajon Pass, via hwy. 138, Elliott's Ranch area.",1067,34.325,-117.4227778,,,,,cch2,967280,,,http://cch2.org/portal/collections/individual/index.php?occid=967280,SA,,4,Total,4,3,0,1,0,,,1.75
SD00010509,5/21/1995,1995,5,21,141,,San Bernardino,"Head of Grapevine Canyon on Grapevine Canyon Road, south of Apple Valley.",1738,34.37667,-117.05833,,,,WGS84,cch2,500219,FL,,http://cch2.org/portal/collections/individual/index.php?occid=500219,SA,,1,Total,6,10,3,5,23,,,3.617021277
SBBG172001,3/16/2019,2019,3,16,75,menziesii,Ventura,"upper Ojai Valley, Sulphur Mtn, Sulphur Mtn Rd on N facing slopes in vicinity of Mile Marker 13.50",668,34.41771,-119.16248,,,,,cch2,3753745,,silty loam; N-facing slope; part shade; oak woodland; 2nd year after Thomas fire,http://cch2.org/portal/collections/individual/index.php?occid=3753745,SA,,1,Total,2,1,0,0,0,,,1.333333333
SBBG172001,3/16/2019,2019,3,16,75,menziesii,Ventura,"upper Ojai Valley, Sulphur Mtn, Sulphur Mtn Rd on N facing slopes in vicinity of Mile Marker 13.50",668,34.41771,-119.16248,,,,,cch2,3753745,,silty loam; N-facing slope; part shade; oak woodland; 2nd year after Thomas fire,http://cch2.org/portal/collections/individual/index.php?occid=3753745,SA,,2,Total,0,2,0,2,0,,,3
SBBG172001,3/16/2019,2019,3,16,75,menziesii,Ventura,"upper Ojai Valley, Sulphur Mtn, Sulphur Mtn Rd on N facing slopes in vicinity of Mile Marker 13.50",668,34.41771,-119.16248,,,,,cch2,3753745,,silty loam; N-facing slope; part shade; oak woodland; 2nd year after Thomas fire,http://cch2.org/portal/collections/individual/index.php?occid=3753745,SA,,3,Total,0,1,0,2,0,,,3.333333333
RSA0065634,3/19/2015,2015,3,19,78,,Los Angeles County,"San Gabriel Mountains: Arrastre Canyon, south of Acton.",846,34.42758,-118.18402,,,,,cch2,1236301,,"Fire burned a few years ago, through low hills of Adenostoma fasciculatum. Riparian habitat along creek. Growing on slopes.",http://cch2.org/portal/collections/individual/index.php?occid=1236301,SA,bottom left is a clipping,1,Total,8,9,0,8,1,,,2.423076923
RSA0065634,3/19/2015,2015,3,19,78,,Los Angeles County,"San Gabriel Mountains: Arrastre Canyon, south of Acton.",846,34.42758,-118.18402,,,,,cch2,1236301,,"Fire burned a few years ago, through low hills of Adenostoma fasciculatum. Riparian habitat along creek. Growing on slopes.",http://cch2.org/portal/collections/individual/index.php?occid=1236301,SA,,2,Total,6,9,1,3,0,,,2.052631579
RSA0065634,3/19/2015,2015,3,19,78,,Los Angeles County,"San Gabriel Mountains: Arrastre Canyon, south of Acton.",846,34.42758,-118.18402,,,,,cch2,1236301,,"Fire burned a few years ago, through low hills of Adenostoma fasciculatum. Riparian habitat along creek. Growing on slopes.",http://cch2.org/portal/collections/individual/index.php?occid=1236301,SA,,3,Total,1,5,0,0,0,,,1.833333333
SBBG164526,4/17/1965,1965,4,17,107,menziesii,Santa Barbara,Santa Ynez Mtns: Los Padres National Forest; E fork of Cold Spring Cyn,396.32,34.465,-119.65,3,,,NAD83,cch2,93167,Flowers Present,along trail (Coyote Fire Sep 1964),http://cch2.org/portal/collections/individual/index.php?occid=93167,SA,Many of them were clippings; left one directly under stamp,1,Total,2,2,0,0,0,,,1.5
SBBG164526,4/17/1965,1965,4,17,107,menziesii,Santa Barbara,Santa Ynez Mtns: Los Padres National Forest; E fork of Cold Spring Cyn,396.32,34.465,-119.65,3,,,NAD83,cch2,93167,Flowers Present,along trail (Coyote Fire Sep 1964),http://cch2.org/portal/collections/individual/index.php?occid=93167,SA,"plant to the right of plant 1, root overlaps",2,Total,0,2,0,1,1,,,3.25
SBBG164526,4/17/1965,1965,4,17,107,menziesii,Santa Barbara,Santa Ynez Mtns: Los Padres National Forest; E fork of Cold Spring Cyn,396.32,34.465,-119.65,3,,,NAD83,cch2,93167,Flowers Present,along trail (Coyote Fire Sep 1964),http://cch2.org/portal/collections/individual/index.php?occid=93167,SA,right of plant 2,3,Total,1,1,0,0,0,,,1.5
SBBG164526,4/17/1965,1965,4,17,107,menziesii,Santa Barbara,Santa Ynez Mtns: Los Padres National Forest; E fork of Cold Spring Cyn,396.32,34.465,-119.65,3,,,NAD83,cch2,93167,Flowers Present,along trail (Coyote Fire Sep 1964),http://cch2.org/portal/collections/individual/index.php?occid=93167,SA,right of plant 3,4,Total,0,2,0,0,0,,,2
SD00010476,4/4/2014,2014,4,4,94,menziesii,Los Angeles,"Western Mojave Desert, approx 3.3 km northeast of Valyermo along Bob's Gap Road approx. 1.6 km southeast of the aqueduct.",1126,34.46542,-117.82326,,,,WGS84,cch2,500314,FL,,http://cch2.org/portal/collections/individual/index.php?occid=500314,SA,Second,1,Total,3,1,0,1,0,,,1.8
SD00010476,4/4/2014,2014,4,4,94,menziesii,Los Angeles,"Western Mojave Desert, approx 3.3 km northeast of Valyermo along Bob's Gap Road approx. 1.6 km southeast of the aqueduct.",1126,34.46542,-117.82326,,,,WGS84,cch2,500314,FL,,http://cch2.org/portal/collections/individual/index.php?occid=500314,SA,third,2,Total,0,1,0,0,0,,,2
SBBG164525,3/25/1928,1928,3,25,85,menziesii,Santa Barbara,Santa Ynez Mtns: Gaviota Pass,123.53,34.4895,-120.225,500,,,WGS84,cch2,70368,Flowers Present,,http://cch2.org/portal/collections/individual/index.php?occid=70368,SA,EXCLUDE: clippings,NA,,,,,,,,,#DIV/0!
OBI106060,3/22/1965,1965,3,22,81,,Santa Barbara,"Blue Cyn, N slope, Santa Ynez Mts",541.92,34.4916,-119.5865,50,,,NAD83,cch2,196210,,,http://cch2.org/portal/collections/individual/index.php?occid=196210,SA,,1,Total,1,2,0,0,0,,,1.666666667
OBI106060,3/22/1965,1965,3,22,81,,Santa Barbara,"Blue Cyn, N slope, Santa Ynez Mts",541.92,34.4916,-119.5865,50,,,NAD83,cch2,196210,,,http://cch2.org/portal/collections/individual/index.php?occid=196210,SA,,2,Total,3,9,0,3,0,,,2.2
OBI106060,3/22/1965,1965,3,22,81,,Santa Barbara,"Blue Cyn, N slope, Santa Ynez Mts",541.92,34.4916,-119.5865,50,,,NAD83,cch2,196210,,,http://cch2.org/portal/collections/individual/index.php?occid=196210,SA,,3,Total,0,8,0,4,0,,,2.666666667
RSA0049807,3/28/2014,2014,3,28,87,,San Bernardino County,"Granite Mountains; to the east of Apple Valley, approximately 3.5 air miles northwest of Rabbit Dry Lake, and about 1 air mile south of Amaral Spring.",1225,34.50565,-117.06247,,,,,cch2,1117617,,Collecting in a rugged granitic bouldery area with small spring.,http://cch2.org/portal/collections/individual/index.php?occid=1117617,SA,"second plant in top row is missing many stems, was not counted",1,Total,1,1,1,0,0,,,2
RSA0049807,3/28/2014,2014,3,28,87,,San Bernardino County,"Granite Mountains; to the east of Apple Valley, approximately 3.5 air miles northwest of Rabbit Dry Lake, and about 1 air mile south of Amaral Spring.",1225,34.50565,-117.06247,,,,,cch2,1117617,,Collecting in a rugged granitic bouldery area with small spring.,http://cch2.org/portal/collections/individual/index.php?occid=1117617,SA,,2,Total,3,2,1,1,1,,,2.375
RSA0049807,3/28/2014,2014,3,28,87,,San Bernardino County,"Granite Mountains; to the east of Apple Valley, approximately 3.5 air miles northwest of Rabbit Dry Lake, and about 1 air mile south of Amaral Spring.",1225,34.50565,-117.06247,,,,,cch2,1117617,,Collecting in a rugged granitic bouldery area with small spring.,http://cch2.org/portal/collections/individual/index.php?occid=1117617,SA,,3,Total,1,1,0,1,0,,,2.333333333
RSA0049807,3/28/2014,2014,3,28,87,,San Bernardino County,"Granite Mountains; to the east of Apple Valley, approximately 3.5 air miles northwest of Rabbit Dry Lake, and about 1 air mile south of Amaral Spring.",1225,34.50565,-117.06247,,,,,cch2,1117617,,Collecting in a rugged granitic bouldery area with small spring.,http://cch2.org/portal/collections/individual/index.php?occid=1117617,SA,,4,Total,0,0,0,0,2,,,5
SBBG164529,4/5/2003,2003,4,5,95,menziesii,Ventura,"Los Padres National Forest; N border of Sespe Condor Sanctuary, vicinity of Ant Camp on Agua Blanca Crk",884,34.5767,-118.8861,500,,,NAD83,cch2,149846,Flowers Present,silty loam; partial shade; southern oak woodland,http://cch2.org/portal/collections/individual/index.php?occid=149846,SA,,1,Total,3,6,2,0,0,,,1.909090909
SBBG164529,4/5/2003,2003,4,5,95,menziesii,Ventura,"Los Padres National Forest; N border of Sespe Condor Sanctuary, vicinity of Ant Camp on Agua Blanca Crk",884,34.5767,-118.8861,500,,,NAD83,cch2,149846,Flowers Present,silty loam; partial shade; southern oak woodland,http://cch2.org/portal/collections/individual/index.php?occid=149846,SA,,2,Total,2,14,1,4,1,,,2.454545455
SBBG164529,4/5/2003,2003,4,5,95,menziesii,Ventura,"Los Padres National Forest; N border of Sespe Condor Sanctuary, vicinity of Ant Camp on Agua Blanca Crk",884,34.5767,-118.8861,500,,,NAD83,cch2,149846,Flowers Present,silty loam; partial shade; southern oak woodland,http://cch2.org/portal/collections/individual/index.php?occid=149846,SA,,3,Total,3,7,0,2,0,,,2.083333333
SBBG164529,4/5/2003,2003,4,5,95,menziesii,Ventura,"Los Padres National Forest; N border of Sespe Condor Sanctuary, vicinity of Ant Camp on Agua Blanca Crk",884,34.5767,-118.8861,500,,,NAD83,cch2,149846,Flowers Present,silty loam; partial shade; southern oak woodland,http://cch2.org/portal/collections/individual/index.php?occid=149846,SA,,4,Total,0,3,1,0,0,,,2.25
SBBG164529,4/5/2003,2003,4,5,95,menziesii,Ventura,"Los Padres National Forest; N border of Sespe Condor Sanctuary, vicinity of Ant Camp on Agua Blanca Crk",884,34.5767,-118.8861,500,,,NAD83,cch2,149846,Flowers Present,silty loam; partial shade; southern oak woodland,http://cch2.org/portal/collections/individual/index.php?occid=149846,SA,,5,Total,0,4,1,0,0,,,2.2
SBBG164529,4/5/2003,2003,4,5,95,menziesii,Ventura,"Los Padres National Forest; N border of Sespe Condor Sanctuary, vicinity of Ant Camp on Agua Blanca Crk",884,34.5767,-118.8861,500,,,NAD83,cch2,149846,Flowers Present,silty loam; partial shade; southern oak woodland,http://cch2.org/portal/collections/individual/index.php?occid=149846,SA,,6,Total,2,4,0,1,0,,,2
SBBG164500,3/29/1929,1929,3,29,88,menziesii,Santa Barbara,Santa Ynez Valley: Buellton to Lompoc,150.94,34.664,-120.333,12,,,NAD83,cch2,130538,Flowers Present,field,http://cch2.org/portal/collections/individual/index.php?occid=130538,SA,,1,Total,1,4,0,0,0,,,1.8
SD00010482,3/21/1997,1997,3,21,80,menziesii,Los Angeles,"Portal Ridge, upper Broad Canyon, ca. 1.0 mile east of VABM King and 1.2 mile east of the junction of Forest Service Roads 7N07 and 7N07A, along the ridgeline diving Bleich Canyon and Broad Canyon.",1195,34.70639,-118.48083,,,,WGS84,cch2,500260,FL,Decomposed granite substrate.,http://cch2.org/portal/collections/individual/index.php?occid=500260,SA,,1,Total,2,4,0,1,0,,,2
SD00010482,3/21/1997,1997,3,21,80,menziesii,Los Angeles,"Portal Ridge, upper Broad Canyon, ca. 1.0 mile east of VABM King and 1.2 mile east of the junction of Forest Service Roads 7N07 and 7N07A, along the ridgeline diving Bleich Canyon and Broad Canyon.",1195,34.70639,-118.48083,,,,WGS84,cch2,500260,FL,Decomposed granite substrate.,http://cch2.org/portal/collections/individual/index.php?occid=500260,SA,,2,Total,3,2,0,0,0,,,1.4
SD00010482,3/21/1997,1997,3,21,80,menziesii,Los Angeles,"Portal Ridge, upper Broad Canyon, ca. 1.0 mile east of VABM King and 1.2 mile east of the junction of Forest Service Roads 7N07 and 7N07A, along the ridgeline diving Bleich Canyon and Broad Canyon.",1195,34.70639,-118.48083,,,,WGS84,cch2,500260,FL,Decomposed granite substrate.,http://cch2.org/portal/collections/individual/index.php?occid=500260,SA,,3,Total,5,2,1,3,0,,,2.181818182
SBBG164522,4/4/1928,1928,4,4,95,menziesii,Santa Barbara,Solomon Hills: Foxen Cyn,339.29,34.778,-120.155,3,,,NAD83,cch2,44681,Flowers Present,bank,http://cch2.org/portal/collections/individual/index.php?occid=44681,SA,,1,Total,0,2,1,6,4,,,3.923076923
OBI106031,3/16/1995,1995,3,16,75,menziesii,Santa Barbara,"Vandenberg AFB. NE part of base, along NW side of Calif hwy 1, 0.7-1.6 mi NE of intersection with San Antonio Rd W",114.97,34.7795,-120.4273,1500,,,NAD83,cch2,196232,,"Hills and valley on ancient consolidated sand dunes. Mosaic of coastal scrub, coastal live oak woodland, chaparral, and grassland; Very loc in grassy opening",http://cch2.org/portal/collections/individual/index.php?occid=196232,SA,,1,Total,21,33,9,21,7,,,2.56043956
SD00010661,3/30/2013,2013,3,30,89,integrifolia,San Bernardino,"HAD83; Granite Mountains; Mohave National Preserve, 0.8 mile north of Gate into UC reserve campground near mouth of Cottoonwood Basin.",1160,34.83282,-115.64653,,,,WGS84,cch2,500316,FL,,http://cch2.org/portal/collections/individual/index.php?occid=500316,SA,"Blurry, could still score",1,Total,0,2,0,1,0,,,2.666666667
SD00010661,3/30/2013,2013,3,30,89,integrifolia,San Bernardino,"HAD83; Granite Mountains; Mohave National Preserve, 0.8 mile north of Gate into UC reserve campground near mouth of Cottoonwood Basin.",1160,34.83282,-115.64653,,,,WGS84,cch2,500316,FL,,http://cch2.org/portal/collections/individual/index.php?occid=500316,SA,,2,Total,1,2,0,0,0,,,1.666666667
SD00010661,3/30/2013,2013,3,30,89,integrifolia,San Bernardino,"HAD83; Granite Mountains; Mohave National Preserve, 0.8 mile north of Gate into UC reserve campground near mouth of Cottoonwood Basin.",1160,34.83282,-115.64653,,,,WGS84,cch2,500316,FL,,http://cch2.org/portal/collections/individual/index.php?occid=500316,SA,,3,Total,1,1,0,0,0,,,1.5
OBI106048,4/5/1997,1997,4,5,95,,Kern,Bitter Crk Natl Wildlife Refuge. Near Cerro Noroeste Rd where rd to Red lake intersects,1840.31,34.861591,-119.213581,14747,,,WGS84,cch2,196217,,In grassland ; Loc common,http://cch2.org/portal/collections/individual/index.php?occid=196217,SA,,1,Total,2,2,0,2,0,,,2.333333333
OBI106048,4/5/1997,1997,4,5,95,,Kern,Bitter Crk Natl Wildlife Refuge. Near Cerro Noroeste Rd where rd to Red lake intersects,1840.31,34.861591,-119.213581,14747,,,WGS84,cch2,196217,,In grassland ; Loc common,http://cch2.org/portal/collections/individual/index.php?occid=196217,SA,,2,Total,0,4,2,2,0,,,2.75
OBI106048,4/5/1997,1997,4,5,95,,Kern,Bitter Crk Natl Wildlife Refuge. Near Cerro Noroeste Rd where rd to Red lake intersects,1840.31,34.861591,-119.213581,14747,,,WGS84,cch2,196217,,In grassland ; Loc common,http://cch2.org/portal/collections/individual/index.php?occid=196217,SA,,3,Total,0,1,0,4,0,,,3.6
OBI106048,4/5/1997,1997,4,5,95,,Kern,Bitter Crk Natl Wildlife Refuge. Near Cerro Noroeste Rd where rd to Red lake intersects,1840.31,34.861591,-119.213581,14747,,,WGS84,cch2,196217,,In grassland ; Loc common,http://cch2.org/portal/collections/individual/index.php?occid=196217,SA,,4,Total,0,1,3,0,0,,,2.75
OBI106048,4/5/1997,1997,4,5,95,,Kern,Bitter Crk Natl Wildlife Refuge. Near Cerro Noroeste Rd where rd to Red lake intersects,1840.31,34.861591,-119.213581,14747,,,WGS84,cch2,196217,,In grassland ; Loc common,http://cch2.org/portal/collections/individual/index.php?occid=196217,SA,,5,Total,0,1,1,1,0,,,3
SD00026955,4/10/2010,2010,4,10,100,menziesii,Ventura,"Los Padres National Forest. San Emigdio Mtns, Cerro Noroeste road, Vicinity of Valle Vista Campground, W Flank of Mt Abel.",1469,34.87801,-119.34137,,,,WGS84,cch2,3641148,FL,Clay loam; N-facing road cut; part shade.,http://cch2.org/portal/collections/individual/index.php?occid=3641148,SA,,1,Total,3,2,0,0,0,,,1.4
SD00026955,4/10/2010,2010,4,10,100,menziesii,Ventura,"Los Padres National Forest. San Emigdio Mtns, Cerro Noroeste road, Vicinity of Valle Vista Campground, W Flank of Mt Abel.",1469,34.87801,-119.34137,,,,WGS84,cch2,3641148,FL,Clay loam; N-facing road cut; part shade.,http://cch2.org/portal/collections/individual/index.php?occid=3641148,SA,,2,Total,2,2,1,0,0,,,1.8
SD00026955,4/10/2010,2010,4,10,100,menziesii,Ventura,"Los Padres National Forest. San Emigdio Mtns, Cerro Noroeste road, Vicinity of Valle Vista Campground, W Flank of Mt Abel.",1469,34.87801,-119.34137,,,,WGS84,cch2,3641148,FL,Clay loam; N-facing road cut; part shade.,http://cch2.org/portal/collections/individual/index.php?occid=3641148,SA,,3,Total,3,2,0,0,0,,,1.4
SD00026955,4/10/2010,2010,4,10,100,menziesii,Ventura,"Los Padres National Forest. San Emigdio Mtns, Cerro Noroeste road, Vicinity of Valle Vista Campground, W Flank of Mt Abel.",1469,34.87801,-119.34137,,,,WGS84,cch2,3641148,FL,Clay loam; N-facing road cut; part shade.,http://cch2.org/portal/collections/individual/index.php?occid=3641148,SA,,4,Total,1,1,1,1,0,,,2.5
SD00026955,4/10/2010,2010,4,10,100,menziesii,Ventura,"Los Padres National Forest. San Emigdio Mtns, Cerro Noroeste road, Vicinity of Valle Vista Campground, W Flank of Mt Abel.",1469,34.87801,-119.34137,,,,WGS84,cch2,3641148,FL,Clay loam; N-facing road cut; part shade.,http://cch2.org/portal/collections/individual/index.php?occid=3641148,SA,,5,Total,0,2,1,2,0,,,3
SD00026955,4/10/2010,2010,4,10,100,menziesii,Ventura,"Los Padres National Forest. San Emigdio Mtns, Cerro Noroeste road, Vicinity of Valle Vista Campground, W Flank of Mt Abel.",1469,34.87801,-119.34137,,,,WGS84,cch2,3641148,FL,Clay loam; N-facing road cut; part shade.,http://cch2.org/portal/collections/individual/index.php?occid=3641148,SA,,6,Total,1,3,1,1,0,,,2.333333333
RSA0077591,4/24/2011,2011,4,24,114,,Kern County,Bitter Creek National Wildlife Refuge; about 5.2 air miles SE of the junction of Hwy 33 and Hudson Ranch Road (formerly Cerro Noroeste Rd.); SW side of Hudson Ranch Road.,1372,34.9021,-119.3897,,,,,cch2,1191656,,"Moderate NE facing slope wither herbaceous vegetation dominated by Poa secunda, Bromus diandrus, Balsamorhiza deltoidea, Elymus elymoides, Plectritis ciliosa.",http://cch2.org/portal/collections/individual/index.php?occid=1191656,SA,,1,Total,0,1,0,1,0,,,3
RSA0077591,4/24/2011,2011,4,24,114,,Kern County,Bitter Creek National Wildlife Refuge; about 5.2 air miles SE of the junction of Hwy 33 and Hudson Ranch Road (formerly Cerro Noroeste Rd.); SW side of Hudson Ranch Road.,1372,34.9021,-119.3897,,,,,cch2,1191656,,"Moderate NE facing slope wither herbaceous vegetation dominated by Poa secunda, Bromus diandrus, Balsamorhiza deltoidea, Elymus elymoides, Plectritis ciliosa.",http://cch2.org/portal/collections/individual/index.php?occid=1191656,SA,,2,Total,0,1,0,1,0,,,3
RSA0093736,4/14/2010,2010,4,14,104,,Kern County,"Tehachapi Mountains. Canyon del Gato Montes, above confluence with Canyon del Agua Escondida.",1442,34.91,-118.63167,,,,,cch2,1224670,,Canyon bottom at toe of N-facing slope; partial shade at edge of oak clump.,http://cch2.org/portal/collections/individual/index.php?occid=1224670,SA,,1,Total,2,5,0,5,0,,,2.666666667
RSA0093736,4/14/2010,2010,4,14,104,,Kern County,"Tehachapi Mountains. Canyon del Gato Montes, above confluence with Canyon del Agua Escondida.",1442,34.91,-118.63167,,,,,cch2,1224670,,Canyon bottom at toe of N-facing slope; partial shade at edge of oak clump.,http://cch2.org/portal/collections/individual/index.php?occid=1224670,SA,,2,Total,3,7,0,3,0,,,2.230769231
RSA0093736,4/14/2010,2010,4,14,104,,Kern County,"Tehachapi Mountains. Canyon del Gato Montes, above confluence with Canyon del Agua Escondida.",1442,34.91,-118.63167,,,,,cch2,1224670,,Canyon bottom at toe of N-facing slope; partial shade at edge of oak clump.,http://cch2.org/portal/collections/individual/index.php?occid=1224670,SA,,3,Total,0,1,0,2,0,,,3.333333333
SBBG164527,4/3/1964,1964,4,3,94,menziesii,Santa Barbara,Colson Cyn,335,34.942,-120.1995,5,,,NAD83,cch2,52573,Flowers Present,woodland; shaded N slope,http://cch2.org/portal/collections/individual/index.php?occid=52573,DG,top left,1,Total,2,1,0,0,0,,,1.333333333
SBBG164527,4/3/1964,1964,4,3,94,menziesii,Santa Barbara,Colson Cyn,335,34.942,-120.1995,5,,,NAD83,cch2,52573,Flowers Present,woodland; shaded N slope,http://cch2.org/portal/collections/individual/index.php?occid=52573,DG,top middle,2,Total,1,2,1,0,0,,,2
SBBG164527,4/3/1964,1964,4,3,94,menziesii,Santa Barbara,Colson Cyn,335,34.942,-120.1995,5,,,NAD83,cch2,52573,Flowers Present,woodland; shaded N slope,http://cch2.org/portal/collections/individual/index.php?occid=52573,DG,"top right, intertwined but on left",3,Total,2,1,0,0,0,,,1.333333333
SBBG164527,4/3/1964,1964,4,3,94,menziesii,Santa Barbara,Colson Cyn,335,34.942,-120.1995,5,,,NAD83,cch2,52573,Flowers Present,woodland; shaded N slope,http://cch2.org/portal/collections/individual/index.php?occid=52573,DG,right intertwined,4,Total,0,1,0,1,0,,,3
SBBG164527,4/3/1964,1964,4,3,94,menziesii,Santa Barbara,Colson Cyn,335,34.942,-120.1995,5,,,NAD83,cch2,52573,Flowers Present,woodland; shaded N slope,http://cch2.org/portal/collections/individual/index.php?occid=52573,DG,bottom left,5,Total,2,1,1,0,0,,,1.75
SBBG164527,4/3/1964,1964,4,3,94,menziesii,Santa Barbara,Colson Cyn,335,34.942,-120.1995,5,,,NAD83,cch2,52573,Flowers Present,woodland; shaded N slope,http://cch2.org/portal/collections/individual/index.php?occid=52573,DG,bottom middle,6,Total,1,1,0,0,0,,,1.5
SBBG164527,4/3/1964,1964,4,3,94,menziesii,Santa Barbara,Colson Cyn,335,34.942,-120.1995,5,,,NAD83,cch2,52573,Flowers Present,woodland; shaded N slope,http://cch2.org/portal/collections/individual/index.php?occid=52573,DG,bottom right,7,Total,2,1,1,0,0,,,1.75
SBBG164505,3/18/1950,1950,3,18,77,menziesii,Kern,"Soda Lake Rd to Carrizo Plain, ca. 0.8 mi off Hwy 399 near SLO County line",826.04,34.971165,-119.455567,500,,,WGS84,cch2,112404,Flowers Present,,http://cch2.org/portal/collections/individual/index.php?occid=112404,DG,"top left, going right",1,Total,1,1,0,0,0,,,1.5
SBBG164505,3/18/1950,1950,3,18,77,menziesii,Kern,"Soda Lake Rd to Carrizo Plain, ca. 0.8 mi off Hwy 399 near SLO County line",826.04,34.971165,-119.455567,500,,,WGS84,cch2,112404,Flowers Present,,http://cch2.org/portal/collections/individual/index.php?occid=112404,DG,,2,Total,2,2,0,0,0,,,1.5
SBBG164505,3/18/1950,1950,3,18,77,menziesii,Kern,"Soda Lake Rd to Carrizo Plain, ca. 0.8 mi off Hwy 399 near SLO County line",826.04,34.971165,-119.455567,500,,,WGS84,cch2,112404,Flowers Present,,http://cch2.org/portal/collections/individual/index.php?occid=112404,DG,,3,Total,2,1,0,0,0,,,1.333333333
SBBG164505,3/18/1950,1950,3,18,77,menziesii,Kern,"Soda Lake Rd to Carrizo Plain, ca. 0.8 mi off Hwy 399 near SLO County line",826.04,34.971165,-119.455567,500,,,WGS84,cch2,112404,Flowers Present,,http://cch2.org/portal/collections/individual/index.php?occid=112404,DG,"upper-middle, larger plant",4,Total,4,2,0,1,0,,,1.714285714
SBBG164505,3/18/1950,1950,3,18,77,menziesii,Kern,"Soda Lake Rd to Carrizo Plain, ca. 0.8 mi off Hwy 399 near SLO County line",826.04,34.971165,-119.455567,500,,,WGS84,cch2,112404,Flowers Present,,http://cch2.org/portal/collections/individual/index.php?occid=112404,DG,right of previous,5,Total,4,0,0,0,0,,,1
SBBG164505,3/18/1950,1950,3,18,77,menziesii,Kern,"Soda Lake Rd to Carrizo Plain, ca. 0.8 mi off Hwy 399 near SLO County line",826.04,34.971165,-119.455567,500,,,WGS84,cch2,112404,Flowers Present,,http://cch2.org/portal/collections/individual/index.php?occid=112404,DG,upper-mid right,6,Total,2,3,0,0,0,,,1.6
SBBG164505,3/18/1950,1950,3,18,77,menziesii,Kern,"Soda Lake Rd to Carrizo Plain, ca. 0.8 mi off Hwy 399 near SLO County line",826.04,34.971165,-119.455567,500,,,WGS84,cch2,112404,Flowers Present,,http://cch2.org/portal/collections/individual/index.php?occid=112404,DG,mid left,7,Total,1,1,0,0,0,,,1.5
SBBG164505,3/18/1950,1950,3,18,77,menziesii,Kern,"Soda Lake Rd to Carrizo Plain, ca. 0.8 mi off Hwy 399 near SLO County line",826.04,34.971165,-119.455567,500,,,WGS84,cch2,112404,Flowers Present,,http://cch2.org/portal/collections/individual/index.php?occid=112404,DG,part of plant missing?,8,Total,0,1,1,0,0,,,2.5
SBBG164505,3/18/1950,1950,3,18,77,menziesii,Kern,"Soda Lake Rd to Carrizo Plain, ca. 0.8 mi off Hwy 399 near SLO County line",826.04,34.971165,-119.455567,500,,,WGS84,cch2,112404,Flowers Present,,http://cch2.org/portal/collections/individual/index.php?occid=112404,DG,leftmost second-to-lowest row,9,Total,2,0,0,0,0,,,1
SBBG164505,3/18/1950,1950,3,18,77,menziesii,Kern,"Soda Lake Rd to Carrizo Plain, ca. 0.8 mi off Hwy 399 near SLO County line",826.04,34.971165,-119.455567,500,,,WGS84,cch2,112404,Flowers Present,,http://cch2.org/portal/collections/individual/index.php?occid=112404,DG,,10,Total,1,1,0,0,0,,,1.5
SBBG164505,3/18/1950,1950,3,18,77,menziesii,Kern,"Soda Lake Rd to Carrizo Plain, ca. 0.8 mi off Hwy 399 near SLO County line",826.04,34.971165,-119.455567,500,,,WGS84,cch2,112404,Flowers Present,,http://cch2.org/portal/collections/individual/index.php?occid=112404,DG,,11,Total,2,1,0,0,0,,,1.333333333
SBBG164505,3/18/1950,1950,3,18,77,menziesii,Kern,"Soda Lake Rd to Carrizo Plain, ca. 0.8 mi off Hwy 399 near SLO County line",826.04,34.971165,-119.455567,500,,,WGS84,cch2,112404,Flowers Present,,http://cch2.org/portal/collections/individual/index.php?occid=112404,DG,,12,Total,3,2,0,1,0,,,1.833333333
SBBG164505,3/18/1950,1950,3,18,77,menziesii,Kern,"Soda Lake Rd to Carrizo Plain, ca. 0.8 mi off Hwy 399 near SLO County line",826.04,34.971165,-119.455567,500,,,WGS84,cch2,112404,Flowers Present,,http://cch2.org/portal/collections/individual/index.php?occid=112404,DG,,13,Total,1,1,0,0,0,,,1.5
SBBG164505,3/18/1950,1950,3,18,77,menziesii,Kern,"Soda Lake Rd to Carrizo Plain, ca. 0.8 mi off Hwy 399 near SLO County line",826.04,34.971165,-119.455567,500,,,WGS84,cch2,112404,Flowers Present,,http://cch2.org/portal/collections/individual/index.php?occid=112404,DG,,14,Total,3,1,0,0,0,,,1.25
SBBG164505,3/18/1950,1950,3,18,77,menziesii,Kern,"Soda Lake Rd to Carrizo Plain, ca. 0.8 mi off Hwy 399 near SLO County line",826.04,34.971165,-119.455567,500,,,WGS84,cch2,112404,Flowers Present,,http://cch2.org/portal/collections/individual/index.php?occid=112404,DG,bottom left,15,Total,1,1,0,0,0,,,1.5
SBBG164505,3/18/1950,1950,3,18,77,menziesii,Kern,"Soda Lake Rd to Carrizo Plain, ca. 0.8 mi off Hwy 399 near SLO County line",826.04,34.971165,-119.455567,500,,,WGS84,cch2,112404,Flowers Present,,http://cch2.org/portal/collections/individual/index.php?occid=112404,DG,root partly under envelope but still visible,16,Total,0,1,0,0,0,,,2
SBBG164515,2/17/1974,1974,2,17,48,menziesii,San Luis Obispo,"Grand View Mesa, Nipomo",97.21,35.01,-120.48,1000,,,NAD27,cch2,70425,Flowers Present,"sandy soil, open fields",http://cch2.org/portal/collections/individual/index.php?occid=70425,SA,,1,Total,0,1,0,0,0,,,2
SBBG164515,2/17/1974,1974,2,17,48,menziesii,San Luis Obispo,"Grand View Mesa, Nipomo",97.21,35.01,-120.48,1000,,,NAD27,cch2,70425,Flowers Present,"sandy soil, open fields",http://cch2.org/portal/collections/individual/index.php?occid=70425,SA,,2,Total,0,1,0,1,0,,,3
SBBG164515,2/17/1974,1974,2,17,48,menziesii,San Luis Obispo,"Grand View Mesa, Nipomo",97.21,35.01,-120.48,1000,,,NAD27,cch2,70425,Flowers Present,"sandy soil, open fields",http://cch2.org/portal/collections/individual/index.php?occid=70425,SA,,3,Total,1,2,1,0,0,,,2
SBBG164515,2/17/1974,1974,2,17,48,menziesii,San Luis Obispo,"Grand View Mesa, Nipomo",97.21,35.01,-120.48,1000,,,NAD27,cch2,70425,Flowers Present,"sandy soil, open fields",http://cch2.org/portal/collections/individual/index.php?occid=70425,SA,,4,Total,1,1,0,1,1,,,3
OBI106023,5/22/1998,1998,5,22,142,menziesii,San Luis Obispo,Caliente Range. Along Caliente Ridge Rd. between wildlife guzzler (35°03.432' N x 119°46.937' W) and Caliente Peak.,1554,35.045615,-119.7714,1000,,,WGS84,cch2,196200,,Juniper-desert scrub oak woodland.; Occasional.,http://cch2.org/portal/collections/individual/index.php?occid=196200,SA,,1,Total,2,10,2,8,14,,,3.611111111
OBI106035,4/6/1956,1956,4,6,97,,San Luis Obispo,Los Berros Cyn approx 4 mi N of Nipomo,194.99,35.09084,-120.46303,3290,,,WGS84,cch2,196226,,,http://cch2.org/portal/collections/individual/index.php?occid=196226,SA,,1,Total,5,18,3,11,6,,,2.88372093
OBI106026,4/4/1982,1982,4,4,94,,San Luis Obispo,"Huasna Rd, 1/2 mi NW of where the Huasna River crosses the rd",251.94,35.12639,-120.4025,500,,,,cch2,196215,,Oak woodland with grassy understory. Soil of Santa Margarita formation type; Scattered in grasslands,http://cch2.org/portal/collections/individual/index.php?occid=196215,SA,top left,1,Total,0,1,0,4,4,,,4.222222222
OBI106026,4/4/1982,1982,4,4,94,,San Luis Obispo,"Huasna Rd, 1/2 mi NW of where the Huasna River crosses the rd",251.94,35.12639,-120.4025,500,,,,cch2,196215,,Oak woodland with grassy understory. Soil of Santa Margarita formation type; Scattered in grasslands,http://cch2.org/portal/collections/individual/index.php?occid=196215,SA,top right,2,Total,0,4,1,2,3,,,3.4
OBI106026,4/4/1982,1982,4,4,94,,San Luis Obispo,"Huasna Rd, 1/2 mi NW of where the Huasna River crosses the rd",251.94,35.12639,-120.4025,500,,,,cch2,196215,,Oak woodland with grassy understory. Soil of Santa Margarita formation type; Scattered in grasslands,http://cch2.org/portal/collections/individual/index.php?occid=196215,SA,bottom left,3,Total,0,1,0,3,2,,,4
OBI106026,4/4/1982,1982,4,4,94,,San Luis Obispo,"Huasna Rd, 1/2 mi NW of where the Huasna River crosses the rd",251.94,35.12639,-120.4025,500,,,,cch2,196215,,Oak woodland with grassy understory. Soil of Santa Margarita formation type; Scattered in grasslands,http://cch2.org/portal/collections/individual/index.php?occid=196215,SA,bottom right,4,Total,2,1,1,2,2,,,3.125
SD00010494,3/23/1935,1935,3,23,82,,Kern,South of Arvin,121.68,35.17997,-118.83301,,,,WGS84,cch2,500085,FL,,http://cch2.org/portal/collections/individual/index.php?occid=500085,SA,,1,Total,4,5,4,7,2,,,2.909090909
SBBG164507,4/30/1967,1967,4,30,120,menziesii,Kern,near Tehachapi Loop monument on old Tehachapi Hwy,970.64,35.195066,-118.534846,200,,,WGS84,cch2,42672,Flowers Present,slope,http://cch2.org/portal/collections/individual/index.php?occid=42672,SA,top,1,Total,1,3,1,0,0,,,2
SBBG164507,4/30/1967,1967,4,30,120,menziesii,Kern,near Tehachapi Loop monument on old Tehachapi Hwy,970.64,35.195066,-118.534846,200,,,WGS84,cch2,42672,Flowers Present,slope,http://cch2.org/portal/collections/individual/index.php?occid=42672,SA,left,2,Total,2,3,1,2,0,,,2.375
SBBG164507,4/30/1967,1967,4,30,120,menziesii,Kern,near Tehachapi Loop monument on old Tehachapi Hwy,970.64,35.195066,-118.534846,200,,,WGS84,cch2,42672,Flowers Present,slope,http://cch2.org/portal/collections/individual/index.php?occid=42672,SA,right,3,Total,4,4,1,3,0,,,2.25
OBI106019,4/4/1979,1979,4,4,94,,San Luis Obispo,Indian Knob Tar Sands,248.2,35.197821,-120.66211,800,,,WGS84,cch2,196209,,"Near the ecotone between southern coastal grassland and coastal live oak woodland. With Platystemon californicum, lupinus nanus, Ranunculus californica; Relatively abundant",http://cch2.org/portal/collections/individual/index.php?occid=196209,SA,top left,1,Total,3,3,1,4,1,,,2.75
OBI106019,4/4/1979,1979,4,4,94,,San Luis Obispo,Indian Knob Tar Sands,248.2,35.197821,-120.66211,800,,,WGS84,cch2,196209,,"Near the ecotone between southern coastal grassland and coastal live oak woodland. With Platystemon californicum, lupinus nanus, Ranunculus californica; Relatively abundant",http://cch2.org/portal/collections/individual/index.php?occid=196209,SA,top right,2,Total,0,1,1,1,0,,,3
OBI106019,4/4/1979,1979,4,4,94,,San Luis Obispo,Indian Knob Tar Sands,248.2,35.197821,-120.66211,800,,,WGS84,cch2,196209,,"Near the ecotone between southern coastal grassland and coastal live oak woodland. With Platystemon californicum, lupinus nanus, Ranunculus californica; Relatively abundant",http://cch2.org/portal/collections/individual/index.php?occid=196209,SA,bottom left,3,Total,2,2,1,2,0,,,2.428571429
OBI106038,5/6/1967,1967,5,6,126,,San Luis Obispo,Avenales Wildlife refuge,498.56,35.2055285,-120.1912599,18747,,,WGS84,cch2,196189,,Grassland,http://cch2.org/portal/collections/individual/index.php?occid=196189,SA,,1,Total,4,13,4,6,4,,,2.774193548
OBI106033,4/6/1968,1968,4,6,97,,San Luis Obispo,On hill on W side of Carrizo Plain due W of Soda lake's southern end,601.53,35.206217,-119.881875,3623,,,WGS84,cch2,196218,,In rocky soil on N facing slope,http://cch2.org/portal/collections/individual/index.php?occid=196218,SA,,1,Total,10,15,1,10,4,,,2.575
OBI106028,2/29/1964,1964,2,29,60,,San Luis Obispo,"Routzahn Park Rd, approx 11 mi from SLO",245.85,35.207788,-120.470393,3873,,,WGS84,cch2,196220,,,http://cch2.org/portal/collections/individual/index.php?occid=196220,SA,,1,Total,6,4,0,1,0,,,1.636363636
OBI106055,4/3/1966,1966,4,3,93,,San Luis Obispo,Lopez Cyn near the 15th or 16 crk crossing,337.88,35.279519,-120.540786,3205,,,WGS84,cch2,196219,,In grassy clearing near the roadside with maple and oak trees beyond the grassy clearing,http://cch2.org/portal/collections/individual/index.php?occid=196219,SA,,1,Total,3,3,0,0,0,,,1.5
OBI106055,4/3/1966,1966,4,3,93,,San Luis Obispo,Lopez Cyn near the 15th or 16 crk crossing,337.88,35.279519,-120.540786,3205,,,WGS84,cch2,196219,,In grassy clearing near the roadside with maple and oak trees beyond the grassy clearing,http://cch2.org/portal/collections/individual/index.php?occid=196219,SA,left to right,2,Total,2,1,0,0,0,,,1.333333333
OBI106055,4/3/1966,1966,4,3,93,,San Luis Obispo,Lopez Cyn near the 15th or 16 crk crossing,337.88,35.279519,-120.540786,3205,,,WGS84,cch2,196219,,In grassy clearing near the roadside with maple and oak trees beyond the grassy clearing,http://cch2.org/portal/collections/individual/index.php?occid=196219,SA,,3,Total,0,2,0,0,0,,,2
OBI106055,4/3/1966,1966,4,3,93,,San Luis Obispo,Lopez Cyn near the 15th or 16 crk crossing,337.88,35.279519,-120.540786,3205,,,WGS84,cch2,196219,,In grassy clearing near the roadside with maple and oak trees beyond the grassy clearing,http://cch2.org/portal/collections/individual/index.php?occid=196219,SA,,4,Total,0,1,0,0,0,,,2
OBI106055,4/3/1966,1966,4,3,93,,San Luis Obispo,Lopez Cyn near the 15th or 16 crk crossing,337.88,35.279519,-120.540786,3205,,,WGS84,cch2,196219,,In grassy clearing near the roadside with maple and oak trees beyond the grassy clearing,http://cch2.org/portal/collections/individual/index.php?occid=196219,SA,,5,Total,0,2,1,0,0,,,2.333333333
SBBG164516,4/8/1979,1979,4,8,98,menziesii,San Luis Obispo,2 mi S of California Valley along Soda Lake Rd,579,35.2993,-119.9771,500,,,NAD83,cch2,127641,Flowers Present,"alkaline soil, field & roadside",http://cch2.org/portal/collections/individual/index.php?occid=127641,SA,,1,Total,10,10,0,5,0,,,2
SBBG164516,4/8/1979,1979,4,8,98,menziesii,San Luis Obispo,2 mi S of California Valley along Soda Lake Rd,579,35.2993,-119.9771,500,,,NAD83,cch2,127641,Flowers Present,"alkaline soil, field & roadside",http://cch2.org/portal/collections/individual/index.php?occid=127641,SA,,2,Total,9,16,1,4,2,,,2.1875
SD00010478,3/25/2008,2008,3,25,85,,San Luis Obispo,North of Carrizo Plain National Monument. Along Soda Lake Road between College and Belmont Streets.,591,35.30722,-119.98611,,,,WGS84,cch2,500306,FL,,http://cch2.org/portal/collections/individual/index.php?occid=500306,SA,,1,Total,3,2,0,1,1,,,2.285714286
SD00010478,3/25/2008,2008,3,25,85,,San Luis Obispo,North of Carrizo Plain National Monument. Along Soda Lake Road between College and Belmont Streets.,591,35.30722,-119.98611,,,,WGS84,cch2,500306,FL,,http://cch2.org/portal/collections/individual/index.php?occid=500306,SA,,2,Total,2,3,0,0,0,,,1.6
SBBG164509,4/12/1991,1991,4,12,102,menziesii,San Luis Obispo,"Los Padres National Forest; East Cuesta Ridge, 2 mi up East Cuesta Ridge Rd from La Cuesta Summit",610,35.339,-120.617,1000,,,NAD27,cch2,156099,Flowers Present,"rocky soil, meadow; 4 deg SE-facing slope",http://cch2.org/portal/collections/individual/index.php?occid=156099,SA,2 plants tangled together; top left,1,Total,4,3,0,0,0,,,1.428571429
SBBG164509,4/12/1991,1991,4,12,102,menziesii,San Luis Obispo,"Los Padres National Forest; East Cuesta Ridge, 2 mi up East Cuesta Ridge Rd from La Cuesta Summit",610,35.339,-120.617,1000,,,NAD27,cch2,156099,Flowers Present,"rocky soil, meadow; 4 deg SE-facing slope",http://cch2.org/portal/collections/individual/index.php?occid=156099,SA,top right,2,Total,3,3,1,0,0,,,1.714285714
SBBG164509,4/12/1991,1991,4,12,102,menziesii,San Luis Obispo,"Los Padres National Forest; East Cuesta Ridge, 2 mi up East Cuesta Ridge Rd from La Cuesta Summit",610,35.339,-120.617,1000,,,NAD27,cch2,156099,Flowers Present,"rocky soil, meadow; 4 deg SE-facing slope",http://cch2.org/portal/collections/individual/index.php?occid=156099,SA,bottom right,3,Total,3,2,0,1,0,,,1.833333333
OBI106022,3/1/1978,1978,3,1,60,,San Luis Obispo,"Carrizo Plain, 1 mi S of the jctn of hwy 58 and Sim soda lake san diego cr rd",612.1,35.351177,-120.005123,596,,,WGS84,cch2,196190,,"Valley grassland, with lots of filaree and distichlis; Common in grassy fields",http://cch2.org/portal/collections/individual/index.php?occid=196190,SA,,1,Total,2,3,0,0,0,,,1.6
OBI106022,3/1/1978,1978,3,1,60,,San Luis Obispo,"Carrizo Plain, 1 mi S of the jctn of hwy 58 and Sim soda lake san diego cr rd",612.1,35.351177,-120.005123,596,,,WGS84,cch2,196190,,"Valley grassland, with lots of filaree and distichlis; Common in grassy fields",http://cch2.org/portal/collections/individual/index.php?occid=196190,SA,,2,Total,3,1,0,0,0,,,1.25
OBI106022,3/1/1978,1978,3,1,60,,San Luis Obispo,"Carrizo Plain, 1 mi S of the jctn of hwy 58 and Sim soda lake san diego cr rd",612.1,35.351177,-120.005123,596,,,WGS84,cch2,196190,,"Valley grassland, with lots of filaree and distichlis; Common in grassy fields",http://cch2.org/portal/collections/individual/index.php?occid=196190,SA,,3,Total,2,1,0,0,0,,,1.333333333
OBI106022,3/1/1978,1978,3,1,60,,San Luis Obispo,"Carrizo Plain, 1 mi S of the jctn of hwy 58 and Sim soda lake san diego cr rd",612.1,35.351177,-120.005123,596,,,WGS84,cch2,196190,,"Valley grassland, with lots of filaree and distichlis; Common in grassy fields",http://cch2.org/portal/collections/individual/index.php?occid=196190,SA,,4,Total,0,3,0,0,0,,,2
OBI106049,4/8/1952,1952,4,8,99,,San Luis Obispo,La Panza District,573.71,35.379759,-120.285566,3000,,,WGS84,cch2,196222,,"On open hillside, in coarse sandy soil containing clay",http://cch2.org/portal/collections/individual/index.php?occid=196222,SA,,1,Total,5,8,5,10,6,,,3.117647059
OBI106024,5/6/1986,1986,5,6,126,,San Luis Obispo,Santa Margarita Ranch. Estadio field in E part of the ranch where a large stand of blue oaks occur on slopes of decomposed limestone,307.48,35.402195,-120.612946,2094,,,WGS84,cch2,196213,,Occ common in open areas,http://cch2.org/portal/collections/individual/index.php?occid=196213,SA,EXCLUDE: all clippings,NA,,,,,,,,,#DIV/0!
SBBG164508,4/30/1968,1968,4,30,121,menziesii,Kern,Rankin Ranch logging rd up Breckenridge Mtn,1859,35.418,-118.579,1000,,,NAD27,cch2,37998,Flowers Present,,http://cch2.org/portal/collections/individual/index.php?occid=37998,SA,,1,Total,3,2,2,0,0,,,1.857142857
SBBG164508,4/30/1968,1968,4,30,121,menziesii,Kern,Rankin Ranch logging rd up Breckenridge Mtn,1859,35.418,-118.579,1000,,,NAD27,cch2,37998,Flowers Present,,http://cch2.org/portal/collections/individual/index.php?occid=37998,SA,,2,Total,1,1,1,0,0,,,2
SBBG164508,4/30/1968,1968,4,30,121,menziesii,Kern,Rankin Ranch logging rd up Breckenridge Mtn,1859,35.418,-118.579,1000,,,NAD27,cch2,37998,Flowers Present,,http://cch2.org/portal/collections/individual/index.php?occid=37998,SA,,3,Total,3,2,0,0,0,,,1.4
SBBG164508,4/30/1968,1968,4,30,121,menziesii,Kern,Rankin Ranch logging rd up Breckenridge Mtn,1859,35.418,-118.579,1000,,,NAD27,cch2,37998,Flowers Present,,http://cch2.org/portal/collections/individual/index.php?occid=37998,SA,,4,Total,3,4,1,0,0,,,1.75
SBBG164508,4/30/1968,1968,4,30,121,menziesii,Kern,Rankin Ranch logging rd up Breckenridge Mtn,1859,35.418,-118.579,1000,,,NAD27,cch2,37998,Flowers Present,,http://cch2.org/portal/collections/individual/index.php?occid=37998,SA,,5,Total,4,3,3,0,0,,,1.9
SBBG164508,4/30/1968,1968,4,30,121,menziesii,Kern,Rankin Ranch logging rd up Breckenridge Mtn,1859,35.418,-118.579,1000,,,NAD27,cch2,37998,Flowers Present,,http://cch2.org/portal/collections/individual/index.php?occid=37998,SA,,6,Total,1,2,0,0,0,,,1.666666667
SBBG164508,4/30/1968,1968,4,30,121,menziesii,Kern,Rankin Ranch logging rd up Breckenridge Mtn,1859,35.418,-118.579,1000,,,NAD27,cch2,37998,Flowers Present,,http://cch2.org/portal/collections/individual/index.php?occid=37998,SA,,7,Total,0,2,3,0,0,,,2.6
SBBG164508,4/30/1968,1968,4,30,121,menziesii,Kern,Rankin Ranch logging rd up Breckenridge Mtn,1859,35.418,-118.579,1000,,,NAD27,cch2,37998,Flowers Present,,http://cch2.org/portal/collections/individual/index.php?occid=37998,SA,,8,Total,3,4,2,0,1,,,2.2
OBI106039,3/9/1971,1971,3,9,68,,San Luis Obispo,3 mi NE of Santa Margarita,274,35.418043,-120.568649,1486,,,WGS84,cch2,196203,,"Foothill oak woodland, soil, sandy",http://cch2.org/portal/collections/individual/index.php?occid=196203,SA,,1,Total,1,3,0,0,0,,,1.75
OBI106039,3/9/1971,1971,3,9,68,,San Luis Obispo,3 mi NE of Santa Margarita,274,35.418043,-120.568649,1486,,,WGS84,cch2,196203,,"Foothill oak woodland, soil, sandy",http://cch2.org/portal/collections/individual/index.php?occid=196203,SA,,2,Total,0,3,1,1,0,,,2.6
OBI106039,3/9/1971,1971,3,9,68,,San Luis Obispo,3 mi NE of Santa Margarita,274,35.418043,-120.568649,1486,,,WGS84,cch2,196203,,"Foothill oak woodland, soil, sandy",http://cch2.org/portal/collections/individual/index.php?occid=196203,SA,,3,Total,0,1,1,0,1,,,3.333333333
OBI106039,3/9/1971,1971,3,9,68,,San Luis Obispo,3 mi NE of Santa Margarita,274,35.418043,-120.568649,1486,,,WGS84,cch2,196203,,"Foothill oak woodland, soil, sandy",http://cch2.org/portal/collections/individual/index.php?occid=196203,SA,,4,Total,1,2,0,3,0,,,2.833333333
OBI106039,3/9/1971,1971,3,9,68,,San Luis Obispo,3 mi NE of Santa Margarita,274,35.418043,-120.568649,1486,,,WGS84,cch2,196203,,"Foothill oak woodland, soil, sandy",http://cch2.org/portal/collections/individual/index.php?occid=196203,SA,,5,Total,0,5,0,0,0,,,2
OBI106039,3/9/1971,1971,3,9,68,,San Luis Obispo,3 mi NE of Santa Margarita,274,35.418043,-120.568649,1486,,,WGS84,cch2,196203,,"Foothill oak woodland, soil, sandy",http://cch2.org/portal/collections/individual/index.php?occid=196203,SA,,6,Total,1,1,1,1,0,,,2.5
OBI106032,4/16/1978,1978,4,16,106,,San Luis Obispo,Off hwy 58 near hwy 127 turnoff,329.18,35.383499,-120.629695,1852,DG,Refined this one (from an error distance of 37000+). Point at intersection of hwy 58 and 127 (now 101) with error radius up to Santa Margarita,WGS84,cch2,196228,,"In pasture, oak woodland",http://cch2.org/portal/collections/individual/index.php?occid=196228,DG,"overlapping in middle, did not score - right most plant",1,Total,0,2,1,0,1,,,3
OBI106061,3/31/1985,1985,3,31,90,,San Luis Obispo,Along hwy 58 ca 100 m E of jctn with Huerhuero Rd,434.58,35.438108,-120.493918,148,,,WGS84,cch2,196197,,"Woodland dom by Quercus turbinella, Q. douglasii, and Juniperus californica. Grassy understory; Loc abundant",http://cch2.org/portal/collections/individual/index.php?occid=196197,SA,Bottom right not counter,1,Total,0,4,1,4,2,,,3.363636364
OBI106061,3/31/1985,1985,3,31,90,,San Luis Obispo,Along hwy 58 ca 100 m E of jctn with Huerhuero Rd,434.58,35.438108,-120.493918,148,,,WGS84,cch2,196197,,"Woodland dom by Quercus turbinella, Q. douglasii, and Juniperus californica. Grassy understory; Loc abundant",http://cch2.org/portal/collections/individual/index.php?occid=196197,SA,,2,Total,0,2,0,1,0,,,2.666666667
OBI106061,3/31/1985,1985,3,31,90,,San Luis Obispo,Along hwy 58 ca 100 m E of jctn with Huerhuero Rd,434.58,35.438108,-120.493918,148,,,WGS84,cch2,196197,,"Woodland dom by Quercus turbinella, Q. douglasii, and Juniperus californica. Grassy understory; Loc abundant",http://cch2.org/portal/collections/individual/index.php?occid=196197,SA,,3,Total,3,5,0,3,0,,,2.272727273
OBI106061,3/31/1985,1985,3,31,90,,San Luis Obispo,Along hwy 58 ca 100 m E of jctn with Huerhuero Rd,434.58,35.438108,-120.493918,148,,,WGS84,cch2,196197,,"Woodland dom by Quercus turbinella, Q. douglasii, and Juniperus californica. Grassy understory; Loc abundant",http://cch2.org/portal/collections/individual/index.php?occid=196197,SA,,4,Total,2,3,0,2,0,,,2.285714286
OBI106025,4/24/1981,1981,4,24,114,,San Luis Obispo,Jctn of Shell Crk Rd and Calif hwy 58 S of Shandon,421.28,35.45983,-120.33394,305,,,WGS84,cch2,196196,,Foothill woodland area with riparian zone and open grassy fields. No surface flow in the stream. Grassland areas lightly grazed; Abundant in grassy fields,http://cch2.org/portal/collections/individual/index.php?occid=196196,SA,top middle,1,Total,2,3,0,1,2,,,2.75
OBI106025,4/24/1981,1981,4,24,114,,San Luis Obispo,Jctn of Shell Crk Rd and Calif hwy 58 S of Shandon,421.28,35.45983,-120.33394,305,,,WGS84,cch2,196196,,Foothill woodland area with riparian zone and open grassy fields. No surface flow in the stream. Grassland areas lightly grazed; Abundant in grassy fields,http://cch2.org/portal/collections/individual/index.php?occid=196196,SA,bottom,2,Total,3,8,10,4,2,,,2.777777778
OBI106063,4/15/1995,1995,4,15,105,,San Luis Obispo,"Shell Crk, ca 1/2 mi N of jctn with Calif rte 58",450,35.46411,-120.33005,221,,,WGS84,cch2,196198,,"Foothill woodland and chaparral, scrub, and grassland areas; Loc common in flat areas",http://cch2.org/portal/collections/individual/index.php?occid=196198,SA,"left to right, starting with small left one in the corner",1,Total,0,0,0,1,1,,,4.5
OBI106063,4/15/1995,1995,4,15,105,,San Luis Obispo,"Shell Crk, ca 1/2 mi N of jctn with Calif rte 58",450,35.46411,-120.33005,221,,,WGS84,cch2,196198,,"Foothill woodland and chaparral, scrub, and grassland areas; Loc common in flat areas",http://cch2.org/portal/collections/individual/index.php?occid=196198,SA,,2,Total,0,5,5,3,0,,,2.846153846
OBI106063,4/15/1995,1995,4,15,105,,San Luis Obispo,"Shell Crk, ca 1/2 mi N of jctn with Calif rte 58",450,35.46411,-120.33005,221,,,WGS84,cch2,196198,,"Foothill woodland and chaparral, scrub, and grassland areas; Loc common in flat areas",http://cch2.org/portal/collections/individual/index.php?occid=196198,SA,,3,Total,0,3,1,5,0,,,3.222222222
OBI106063,4/15/1995,1995,4,15,105,,San Luis Obispo,"Shell Crk, ca 1/2 mi N of jctn with Calif rte 58",450,35.46411,-120.33005,221,,,WGS84,cch2,196198,,"Foothill woodland and chaparral, scrub, and grassland areas; Loc common in flat areas",http://cch2.org/portal/collections/individual/index.php?occid=196198,SA,,4,Total,0,3,0,7,2,,,3.666666667
OBI106037,3/23/1952,1952,3,23,83,,San Luis Obispo,"Shell Crk. 3 mi E 12 mi S, Shandon",409.58,35.481179,-120.321879,2256,DG,Refined error distance (lat/long the same) - halfway to Wilson Corner,WGS84,cch2,196202,,"Light sandy soil, cyn floor",http://cch2.org/portal/collections/individual/index.php?occid=196202,SA,,1,Total,4,5,0,1,0,,,1.8
OBI106037,3/23/1952,1952,3,23,83,,San Luis Obispo,"Shell Crk. 3 mi E 12 mi S, Shandon",409.58,35.481179,-120.321879,2256,DG,Refined error distance (lat/long the same) - halfway to Wilson Corner,WGS84,cch2,196202,,"Light sandy soil, cyn floor",http://cch2.org/portal/collections/individual/index.php?occid=196202,SA,,2,Total,1,6,0,0,2,,,2.555555556
OBI106053,4/8/1971,1971,4,8,98,,San Luis Obispo,Near top of hill in area of sedimentary deposits. 6 mi N of Cayucos,518,35.543942,-120.896932,800,,,WGS84,cch2,196204,,,http://cch2.org/portal/collections/individual/index.php?occid=196204,SA,,1,Total,6,15,19,3,2,,,2.555555556
RSA0073853,3/7/2015,2015,3,7,66,,Kern County,"Horse Canyon. West side of canyon, near the mouth of the canyon. Near primitive campsite.",1203,35.54837,-118.04398,,,,,cch2,1003738,,Base of ridge.,http://cch2.org/portal/collections/individual/index.php?occid=1003738,SA,bottom right plant had no structures to score,1,Total,1,1,0,0,0,,,1.5
RSA0073853,3/7/2015,2015,3,7,66,,Kern County,"Horse Canyon. West side of canyon, near the mouth of the canyon. Near primitive campsite.",1203,35.54837,-118.04398,,,,,cch2,1003738,,Base of ridge.,http://cch2.org/portal/collections/individual/index.php?occid=1003738,SA,,2,Total,1,1,0,0,0,,,1.5
RSA0073853,3/7/2015,2015,3,7,66,,Kern County,"Horse Canyon. West side of canyon, near the mouth of the canyon. Near primitive campsite.",1203,35.54837,-118.04398,,,,,cch2,1003738,,Base of ridge.,http://cch2.org/portal/collections/individual/index.php?occid=1003738,SA,,3,Total,1,1,0,0,0,,,1.5
RSA0073853,3/7/2015,2015,3,7,66,,Kern County,"Horse Canyon. West side of canyon, near the mouth of the canyon. Near primitive campsite.",1203,35.54837,-118.04398,,,,,cch2,1003738,,Base of ridge.,http://cch2.org/portal/collections/individual/index.php?occid=1003738,SA,,4,Total,1,0,1,0,0,,,2
RSA0073853,3/7/2015,2015,3,7,66,,Kern County,"Horse Canyon. West side of canyon, near the mouth of the canyon. Near primitive campsite.",1203,35.54837,-118.04398,,,,,cch2,1003738,,Base of ridge.,http://cch2.org/portal/collections/individual/index.php?occid=1003738,SA,,5,Total,2,1,1,1,2,,,3
OBI106056,3/19/1978,1978,3,19,78,,Kern,"Along State hwy 178 in Kern River Cyn area, 8 mi W of jctn with Bodfish Rd",701,35.570441,-118.568642,4315,,,WGS84,cch2,196194,,Hillside with scattered Pinus sabiniana and Quercus wislizenii. Common shrubs include Eriogonum fasciculatum and Chrysothamnus nauseosus. Many ephemerals; Loc abundant in open sites,http://cch2.org/portal/collections/individual/index.php?occid=196194,SA,,1,Total,4,3,0,0,0,,,1.428571429
OBI106056,3/19/1978,1978,3,19,78,,Kern,"Along State hwy 178 in Kern River Cyn area, 8 mi W of jctn with Bodfish Rd",701,35.570441,-118.568642,4315,,,WGS84,cch2,196194,,Hillside with scattered Pinus sabiniana and Quercus wislizenii. Common shrubs include Eriogonum fasciculatum and Chrysothamnus nauseosus. Many ephemerals; Loc abundant in open sites,http://cch2.org/portal/collections/individual/index.php?occid=196194,SA,,2,Total,5,4,0,0,0,,,1.444444444
OBI106056,3/19/1978,1978,3,19,78,,Kern,"Along State hwy 178 in Kern River Cyn area, 8 mi W of jctn with Bodfish Rd",701,35.570441,-118.568642,4315,,,WGS84,cch2,196194,,Hillside with scattered Pinus sabiniana and Quercus wislizenii. Common shrubs include Eriogonum fasciculatum and Chrysothamnus nauseosus. Many ephemerals; Loc abundant in open sites,http://cch2.org/portal/collections/individual/index.php?occid=196194,SA,,3,Total,1,3,0,0,0,,,1.75
OBI106056,3/19/1978,1978,3,19,78,,Kern,"Along State hwy 178 in Kern River Cyn area, 8 mi W of jctn with Bodfish Rd",701,35.570441,-118.568642,4315,,,WGS84,cch2,196194,,Hillside with scattered Pinus sabiniana and Quercus wislizenii. Common shrubs include Eriogonum fasciculatum and Chrysothamnus nauseosus. Many ephemerals; Loc abundant in open sites,http://cch2.org/portal/collections/individual/index.php?occid=196194,SA,,4,Total,2,1,0,0,0,,,1.333333333
OBI106056,3/19/1978,1978,3,19,78,,Kern,"Along State hwy 178 in Kern River Cyn area, 8 mi W of jctn with Bodfish Rd",701,35.570441,-118.568642,4315,,,WGS84,cch2,196194,,Hillside with scattered Pinus sabiniana and Quercus wislizenii. Common shrubs include Eriogonum fasciculatum and Chrysothamnus nauseosus. Many ephemerals; Loc abundant in open sites,http://cch2.org/portal/collections/individual/index.php?occid=196194,SA,,5,Total,0,1,0,0,0,,,2
OBI106056,3/19/1978,1978,3,19,78,,Kern,"Along State hwy 178 in Kern River Cyn area, 8 mi W of jctn with Bodfish Rd",701,35.570441,-118.568642,4315,,,WGS84,cch2,196194,,Hillside with scattered Pinus sabiniana and Quercus wislizenii. Common shrubs include Eriogonum fasciculatum and Chrysothamnus nauseosus. Many ephemerals; Loc abundant in open sites,http://cch2.org/portal/collections/individual/index.php?occid=196194,SA,"lower left, small plant and upside down",6,Total,0,1,0,0,0,,,2
RSA0073849,3/21/2015,2015,3,21,80,,Kern County,"Near Rocky Point, small canyon south of Cane Canyon. East of Kelso Valley Road. South of old mining road.",1028,35.57886,-118.23388,,,,,cch2,902970,,Desert scrubland. Junipers and Yucca brevifolia.,http://cch2.org/portal/collections/individual/index.php?occid=902970,SA,"far left is plant 1, has 3 plants in it but two are very woven together so it was counted as 1.",1,Total,1,1,0,0,0,,,1.5
RSA0073849,3/21/2015,2015,3,21,80,,Kern County,"Near Rocky Point, small canyon south of Cane Canyon. East of Kelso Valley Road. South of old mining road.",1028,35.57886,-118.23388,,,,,cch2,902970,,Desert scrubland. Junipers and Yucca brevifolia.,http://cch2.org/portal/collections/individual/index.php?occid=902970,SA,,2,Total,2,3,6,0,0,,,2.363636364
RSA0073849,3/21/2015,2015,3,21,80,,Kern County,"Near Rocky Point, small canyon south of Cane Canyon. East of Kelso Valley Road. South of old mining road.",1028,35.57886,-118.23388,,,,,cch2,902970,,Desert scrubland. Junipers and Yucca brevifolia.,http://cch2.org/portal/collections/individual/index.php?occid=902970,SA,,3,Total,3,2,0,0,0,,,1.4
RSA0073849,3/21/2015,2015,3,21,80,,Kern County,"Near Rocky Point, small canyon south of Cane Canyon. East of Kelso Valley Road. South of old mining road.",1028,35.57886,-118.23388,,,,,cch2,902970,,Desert scrubland. Junipers and Yucca brevifolia.,http://cch2.org/portal/collections/individual/index.php?occid=902970,SA,,4,Total,3,1,0,0,0,,,1.25
SBBG164517,4/7/1962,1962,4,7,97,menziesii,San Luis Obispo,"Goldtree Hills, 0.5 mi SW of Grant Lake",602,35.5935,-120.152,1000,,,NAD27,cch2,111939,Flowers Present,gravelly-adobe; steep N slope,http://cch2.org/portal/collections/individual/index.php?occid=111939,SA,,1,Total,4,7,0,2,0,,,2
SBBG164517,4/7/1962,1962,4,7,97,menziesii,San Luis Obispo,"Goldtree Hills, 0.5 mi SW of Grant Lake",602,35.5935,-120.152,1000,,,NAD27,cch2,111939,Flowers Present,gravelly-adobe; steep N slope,http://cch2.org/portal/collections/individual/index.php?occid=111939,SA,,2,Total,0,1,0,0,0,,,2
SBBG164517,4/7/1962,1962,4,7,97,menziesii,San Luis Obispo,"Goldtree Hills, 0.5 mi SW of Grant Lake",602,35.5935,-120.152,1000,,,NAD27,cch2,111939,Flowers Present,gravelly-adobe; steep N slope,http://cch2.org/portal/collections/individual/index.php?occid=111939,SA,,3,Total,0,1,1,1,0,,,3
RSA0067586,4/26/2014,2014,4,26,116,,Kern County,Scodie Canyon. At the end of the U.S. Fish and Wildlife Ecological Reserve.,1222,35.64018,-118.18436,,,,,cch2,1038115,,On bank of wash.,http://cch2.org/portal/collections/individual/index.php?occid=1038115,SA,,1,Total,4,1,2,1,3,,,2.818181818
RSA0067586,4/26/2014,2014,4,26,116,,Kern County,Scodie Canyon. At the end of the U.S. Fish and Wildlife Ecological Reserve.,1222,35.64018,-118.18436,,,,,cch2,1038115,,On bank of wash.,http://cch2.org/portal/collections/individual/index.php?occid=1038115,SA,,2,Total,3,0,0,2,1,,,2.666666667
OBI106051,4/1/1962,1962,4,1,91,,San Luis Obispo,About 4 mi E of Cholame,635.85,35.724109,-120.225261,3565,,,WGS84,cch2,196224,,"In low hills on poor rocky soil. Abunant rainfall this year the first good year in many years. Fields covered with blues, oranges and yellows",http://cch2.org/portal/collections/individual/index.php?occid=196224,SA,,1,Total,2,1,2,0,0,,,2
OBI106051,4/1/1962,1962,4,1,91,,San Luis Obispo,About 4 mi E of Cholame,635.85,35.724109,-120.225261,3565,,,WGS84,cch2,196224,,"In low hills on poor rocky soil. Abunant rainfall this year the first good year in many years. Fields covered with blues, oranges and yellows",http://cch2.org/portal/collections/individual/index.php?occid=196224,SA,,2,Total,1,1,0,2,0,,,2.75
OBI106051,4/1/1962,1962,4,1,91,,San Luis Obispo,About 4 mi E of Cholame,635.85,35.724109,-120.225261,3565,,,WGS84,cch2,196224,,"In low hills on poor rocky soil. Abunant rainfall this year the first good year in many years. Fields covered with blues, oranges and yellows",http://cch2.org/portal/collections/individual/index.php?occid=196224,SA,,3,Total,0,2,0,1,1,,,3.25
OBI106062,2/2/1988,1988,2,2,33,,Tulare,"Pixley natl Wildlife Refuge, San Joaquin Valley. SESW sec 23",61,35.918675,-119.374004,4689,,,WGS84,cch2,196214,,Wildlife habitat exclosure. No livestock grazing. Dense grassland veg with mostly course textured soil; Rare except small patch in SE part of exclosure,http://cch2.org/portal/collections/individual/index.php?occid=196214,SA,,1,Total,0,1,0,0,0,,,2
SBBG164498,4/22/2017,2017,4,22,112,menziesii,Monterey,"[Tassajara Rd, near Chews Ridge Rd]",1475,36.3125,-121.5725,200,,,WGS84,cch2,132327,,"sparse forest, one year post burn; S-facing 5-10 deg slope",http://cch2.org/portal/collections/individual/index.php?occid=132327,SA,,1,Total,0,7,0,0,0,,,2
SBBG164498,4/22/2017,2017,4,22,112,menziesii,Monterey,"[Tassajara Rd, near Chews Ridge Rd]",1475,36.3125,-121.5725,200,,,WGS84,cch2,132327,,"sparse forest, one year post burn; S-facing 5-10 deg slope",http://cch2.org/portal/collections/individual/index.php?occid=132327,SA,,2,Total,0,2,0,1,0,,,2.666666667
SBBG164498,4/22/2017,2017,4,22,112,menziesii,Monterey,"[Tassajara Rd, near Chews Ridge Rd]",1475,36.3125,-121.5725,200,,,WGS84,cch2,132327,,"sparse forest, one year post burn; S-facing 5-10 deg slope",http://cch2.org/portal/collections/individual/index.php?occid=132327,SA,,3,Total,0,2,2,1,0,,,2.8
SBBG164498,4/22/2017,2017,4,22,112,menziesii,Monterey,"[Tassajara Rd, near Chews Ridge Rd]",1475,36.3125,-121.5725,200,,,WGS84,cch2,132327,,"sparse forest, one year post burn; S-facing 5-10 deg slope",http://cch2.org/portal/collections/individual/index.php?occid=132327,SA,,4,Total,2,3,1,0,0,,,1.833333333
OBI106020,4/30/1933,1933,4,30,120,,Monterey,"Santa Lucia mts, 6 mi from Carmel; N base of Santa Lucia Mts; 5 mi from ocean",30,36.527035,-121.835454,9491,,,WGS84,cch2,196206,,Ravine in Carmel Valley,http://cch2.org/portal/collections/individual/index.php?occid=196206,SA,,1,Total,1,1,0,2,1,,,3.2
OBI106020,4/30/1933,1933,4,30,120,,Monterey,"Santa Lucia mts, 6 mi from Carmel; N base of Santa Lucia Mts; 5 mi from ocean",30,36.527035,-121.835454,9491,,,WGS84,cch2,196206,,Ravine in Carmel Valley,http://cch2.org/portal/collections/individual/index.php?occid=196206,SA,,2,Total,0,2,1,3,0,,,3.166666667
OBI106020,4/30/1933,1933,4,30,120,,Monterey,"Santa Lucia mts, 6 mi from Carmel; N base of Santa Lucia Mts; 5 mi from ocean",30,36.527035,-121.835454,9491,,,WGS84,cch2,196206,,Ravine in Carmel Valley,http://cch2.org/portal/collections/individual/index.php?occid=196206,SA,,3,Total,1,3,1,1,2,,,3
OBI106020,4/30/1933,1933,4,30,120,,Monterey,"Santa Lucia mts, 6 mi from Carmel; N base of Santa Lucia Mts; 5 mi from ocean",30,36.527035,-121.835454,9491,,,WGS84,cch2,196206,,Ravine in Carmel Valley,http://cch2.org/portal/collections/individual/index.php?occid=196206,SA,,4,Total,1,2,0,1,0,,,2.25
SBBG164512,4/5/2017,2017,4,5,95,menziesii,San Benito,"[W of Cedar Flat, Griswold Hills]",715,36.5567,-120.8108,200,,,WGS84,cch2,58338,Flowers Present,open meadows; N-facing 30-40 deg slope,http://cch2.org/portal/collections/individual/index.php?occid=58338,SA,,1,Total,1,1,0,3,0,,,3
SBBG164512,4/5/2017,2017,4,5,95,menziesii,San Benito,"[W of Cedar Flat, Griswold Hills]",715,36.5567,-120.8108,200,,,WGS84,cch2,58338,Flowers Present,open meadows; N-facing 30-40 deg slope,http://cch2.org/portal/collections/individual/index.php?occid=58338,SA,,2,Total,1,3,0,3,0,,,2.714285714
SBBG164512,4/5/2017,2017,4,5,95,menziesii,San Benito,"[W of Cedar Flat, Griswold Hills]",715,36.5567,-120.8108,200,,,WGS84,cch2,58338,Flowers Present,open meadows; N-facing 30-40 deg slope,http://cch2.org/portal/collections/individual/index.php?occid=58338,SA,,3,Total,1,5,6,3,1,,,2.875
SBBG164512,4/5/2017,2017,4,5,95,menziesii,San Benito,"[W of Cedar Flat, Griswold Hills]",715,36.5567,-120.8108,200,,,WGS84,cch2,58338,Flowers Present,open meadows; N-facing 30-40 deg slope,http://cch2.org/portal/collections/individual/index.php?occid=58338,SA,,4,Total,3,4,2,4,0,,,2.538461538
SBBG164512,4/5/2017,2017,4,5,95,menziesii,San Benito,"[W of Cedar Flat, Griswold Hills]",715,36.5567,-120.8108,200,,,WGS84,cch2,58338,Flowers Present,open meadows; N-facing 30-40 deg slope,http://cch2.org/portal/collections/individual/index.php?occid=58338,SA,,5,Total,2,5,1,3,1,,,2.666666667
SBBG164512,4/5/2017,2017,4,5,95,menziesii,San Benito,"[W of Cedar Flat, Griswold Hills]",715,36.5567,-120.8108,200,,,WGS84,cch2,58338,Flowers Present,open meadows; N-facing 30-40 deg slope,http://cch2.org/portal/collections/individual/index.php?occid=58338,SA,,6,Total,0,3,4,4,0,,,3.090909091
OBI106059,3/20/1965,1965,3,20,79,,Fresno,"Along the Fresno side of Millerton Lake (above the lake 300 ft), W slope of hill",213,36.997662,-119.703272,3589,,,WGS84,cch2,196227,,Sandy loam. Assoc Amsinckia intermedia; Very abundant,http://cch2.org/portal/collections/individual/index.php?occid=196227,SA,,1,Total,1,4,0,1,0,,,2.166666667
OBI106059,3/20/1965,1965,3,20,79,,Fresno,"Along the Fresno side of Millerton Lake (above the lake 300 ft), W slope of hill",213,36.997662,-119.703272,3589,,,WGS84,cch2,196227,,Sandy loam. Assoc Amsinckia intermedia; Very abundant,http://cch2.org/portal/collections/individual/index.php?occid=196227,SA,,2,Total,3,5,0,0,0,,,1.625
OBI106059,3/20/1965,1965,3,20,79,,Fresno,"Along the Fresno side of Millerton Lake (above the lake 300 ft), W slope of hill",213,36.997662,-119.703272,3589,,,WGS84,cch2,196227,,Sandy loam. Assoc Amsinckia intermedia; Very abundant,http://cch2.org/portal/collections/individual/index.php?occid=196227,SA,,3,Total,1,4,1,1,0,,,2.285714286
OBI161451,4/16/2019,2019,4,16,106,,Santa Cruz,Swanton Pacific Ranch,32.27,37.08748,-122.249,,,,,cch2,3620970,,"Roadside, full sun, W facing, old land slide area.",http://cch2.org/portal/collections/individual/index.php?occid=3620970,SA,,1,Total,1,2,1,2,0,,,2.666666667
SBBG164510,3/10/1945,1945,3,10,69,menziesii,Madera,Bass Lake,1052,37.324,-119.558,7,,,NAD83,cch2,113691,Flowers Present,,http://cch2.org/portal/collections/individual/index.php?occid=113691,SA,,1,Total,1,8,5,3,0,,,2.588235294
SBBG164510,3/10/1945,1945,3,10,69,menziesii,Madera,Bass Lake,1052,37.324,-119.558,7,,,NAD83,cch2,113691,Flowers Present,,http://cch2.org/portal/collections/individual/index.php?occid=113691,SA,,2,Total,5,6,5,6,1,,,2.652173913
SD00010500,4/19/1933,1933,4,19,109,,San Mateo,Above Emerald Lake,144.57,37.4634,-122.2613,,,,WGS84,cch2,500088,FL,,http://cch2.org/portal/collections/individual/index.php?occid=500088,SA,,1,Total,2,4,2,9,2,,,3.263157895
SDSU06100,6/19/1929,1929,6,19,170,menziesii,Mariposa,Camp Wawona,1219,37.547577,-119.678451,800,,,WGS84,cch2,380505,,,http://cch2.org/portal/collections/individual/index.php?occid=380505,SA,EXCLUDE: all clippings,NA,,,,,,,,,#DIV/0!
SD00010499,3/1/1932,1932,3,1,61,,Mariposa,Yosemite National Park; in valley.,1207.2,37.72644,-119.61164,,,,WGS84,cch2,500087,FL,,http://cch2.org/portal/collections/individual/index.php?occid=500087,DG,top left,1,Total,5,4,0,0,0,,,1.444444444
SD00010499,3/1/1932,1932,3,1,61,,Mariposa,Yosemite National Park; in valley.,1207.2,37.72644,-119.61164,,,,WGS84,cch2,500087,FL,,http://cch2.org/portal/collections/individual/index.php?occid=500087,DG,top right,2,Total,0,2,0,1,0,,,2.666666667
OBI106034,4/23/1939,1939,4,23,113,atomaria,Marin,Nicasio,45,38.061745,-122.69831,818,,,NAD27,cch2,196211,,open wet fields,http://cch2.org/portal/collections/individual/index.php?occid=196211,DG,only large middle plant appears whole,1,Total,4,8,3,3,2,,,2.55
SD00010480,3/22/2012,2012,3,22,82,menziesii,Amador,"Northern Sierra Nevada Mountains Foothills: Bell Road, 0.2 mile east of its junction with CA-49 (Fiddletown 7.5'Q)",270,38.54139,-120.84472,,,,WGS84,cch2,500301,FL,,http://cch2.org/portal/collections/individual/index.php?occid=500301,DG,left,1,Total,3,1,0,0,0,,,1.25
SD00010480,3/22/2012,2012,3,22,82,menziesii,Amador,"Northern Sierra Nevada Mountains Foothills: Bell Road, 0.2 mile east of its junction with CA-49 (Fiddletown 7.5'Q)",270,38.54139,-120.84472,,,,WGS84,cch2,500301,FL,,http://cch2.org/portal/collections/individual/index.php?occid=500301,DG,right,2,Total,4,1,0,0,0,,,1.2
SD00010474,3/26/2013,2013,3,26,85,menziesii,Amador,"Northern Sierra Nevada Foothills: Along CA-49, 1.5 miles south of its junction with Sand Ridge Road, between Plymouth and El Dorado (Fiddletown 7.5'Q)",262,38.56861,-120.84611,,,,WGS84,cch2,500323,FL,,http://cch2.org/portal/collections/individual/index.php?occid=500323,DG,top right. some flowers hidden/eaten. non-Nemophila plant present,1,Total,6,6,1,2,1,,,2.125
SD00010474,3/26/2013,2013,3,26,85,menziesii,Amador,"Northern Sierra Nevada Foothills: Along CA-49, 1.5 miles south of its junction with Sand Ridge Road, between Plymouth and El Dorado (Fiddletown 7.5'Q)",262,38.56861,-120.84611,,,,WGS84,cch2,500323,FL,,http://cch2.org/portal/collections/individual/index.php?occid=500323,DG,bottom left,2,Total,6,4,2,1,0,,,1.846153846
SD00010481,4/4/2009,2009,4,4,94,menziesii,El Dorado,"Northern Sierra Nevada Mountains Foothills: Happy Valley Road, 0.8 mile west of its junction with Happy Valley Cut-off (Camino 7.5')",607,38.65556,-120.67528,,,,WGS84,cch2,500298,FFL,,http://cch2.org/portal/collections/individual/index.php?occid=500298,DG,,1,Total,11,4,2,3,0,,,1.85
OBI106046,6/19/1937,1937,6,19,170,,Humboldt,"North Coast Range, 3 mi W of Little Van Duzen River at summit of grade-Dinsmore to Bridgeville",762,40.483215,-123.740232,4627,,,WGS84,cch2,196192,,"Arid transition-Quercus garryana and grassland. Moist open slopes, rocky clay, sun semishade; Abundant",http://cch2.org/portal/collections/individual/index.php?occid=196192,DG,"mid left, has roots. Color faded",1,Total,2,4,2,3,0,,,2.545454545
OBI106046,6/19/1937,1937,6,19,170,,Humboldt,"North Coast Range, 3 mi W of Little Van Duzen River at summit of grade-Dinsmore to Bridgeville",762,40.483215,-123.740232,4627,,,WGS84,cch2,196192,,"Arid transition-Quercus garryana and grassland. Moist open slopes, rocky clay, sun semishade; Abundant",http://cch2.org/portal/collections/individual/index.php?occid=196192,DG,top right,2,Total,5,9,9,5,9,,,3.108108108
OBI106046,6/19/1937,1937,6,19,170,,Humboldt,"North Coast Range, 3 mi W of Little Van Duzen River at summit of grade-Dinsmore to Bridgeville",762,40.483215,-123.740232,4627,,,WGS84,cch2,196192,,"Arid transition-Quercus garryana and grassland. Moist open slopes, rocky clay, sun semishade; Abundant",http://cch2.org/portal/collections/individual/index.php?occid=196192,DG,bottom left,3,Total,4,7,3,4,1,,,2.526315789
OBI106046,6/19/1937,1937,6,19,170,,Humboldt,"North Coast Range, 3 mi W of Little Van Duzen River at summit of grade-Dinsmore to Bridgeville",762,40.483215,-123.740232,4627,,,WGS84,cch2,196192,,"Arid transition-Quercus garryana and grassland. Moist open slopes, rocky clay, sun semishade; Abundant",http://cch2.org/portal/collections/individual/index.php?occid=196192,DG,bottom middle,4,Total,3,1,1,1,1,,,2.428571429
OBI106043,4/20/1998,1998,4,20,110,menziesii,San Luis Obispo,"North of Nacimiento Lake, .3 miles south from Interlake Road on Bee Rock Road.",311.01,35.783508,-120.939384,268,DC,,WGS84,cch2,196199,,Foothill woodland with open grassy sites; occasional,http://cch2.org/portal/collections/individual/index.php?occid=196199,DG,"top, overlapping plant on the right. the plant on the left is missing most of its structures so I did not score it",1,Total,3,1,4,0,0,,,2.125
OBI106043,4/20/1998,1998,4,20,110,menziesii,San Luis Obispo,"North of Nacimiento Lake, .3 miles south from Interlake Road on Bee Rock Road.",311.01,35.783508,-120.939384,268,DC,,WGS84,cch2,196199,,Foothill woodland with open grassy sites; occasional,http://cch2.org/portal/collections/individual/index.php?occid=196199,DG,bottom. several structures missing but still scored,2,Total,5,4,5,3,3,,,2.75
OBI106036,6/1/1968,1968,6,1,153,,Mendocino,Pt. Arena light house,15,38.954733,-123.740625,534,DC,,WGS84,cch2,196212,,Coastal fields,http://cch2.org/portal/collections/individual/index.php?occid=196212,SA,,1,Total,3,5,2,3,2,,,2.733333333
OBI106036,6/1/1968,1968,6,1,153,,Mendocino,Pt. Arena light house,15,38.954733,-123.740625,534,DC,,WGS84,cch2,196212,,Coastal fields,http://cch2.org/portal/collections/individual/index.php?occid=196212,SA,,2,Total,4,10,2,6,4,,,2.846153846
OBI106042,3/3/2002,2002,3,3,62,menziesii,San Luis Obispo,1/2 mi from Little Falls crk trailhead off Upper Lopez cyn Rd,240,35.24552,-120.486856,825,DC,,WGS84,cch2,196229,,Coastal scrub. On grassy hillside; rocky soil; Common,http://cch2.org/portal/collections/individual/index.php?occid=196229,SA,top right,1,Total,2,3,1,1,0,,,2.142857143
OBI106042,3/3/2002,2002,3,3,62,menziesii,San Luis Obispo,1/2 mi from Little Falls crk trailhead off Upper Lopez cyn Rd,240,35.24552,-120.486856,825,DC,,WGS84,cch2,196229,,Coastal scrub. On grassy hillside; rocky soil; Common,http://cch2.org/portal/collections/individual/index.php?occid=196229,SA,bottom left,2,Total,3,4,0,1,0,,,1.875
OBI106044,4/9/1957,1957,4,9,99,menziesii,Santa Barbara,"Along el Camino Cielo, about 0.75 mi e of San Marcos Pass, Santa Ynez mts",727.93,34.511257,-119.809641,239,DC,,WGS84,cch2,196230,,In woodland,http://cch2.org/portal/collections/individual/index.php?occid=196230,SA,top left,1,Total,0,1,0,0,0,,,2
OBI106044,4/9/1957,1957,4,9,99,menziesii,Santa Barbara,"Along el Camino Cielo, about 0.75 mi e of San Marcos Pass, Santa Ynez mts",727.93,34.511257,-119.809641,239,DC,,WGS84,cch2,196230,,In woodland,http://cch2.org/portal/collections/individual/index.php?occid=196230,SA,second in top row from the left,2,Total,1,1,1,0,0,,,2
OBI106044,4/9/1957,1957,4,9,99,menziesii,Santa Barbara,"Along el Camino Cielo, about 0.75 mi e of San Marcos Pass, Santa Ynez mts",727.93,34.511257,-119.809641,239,DC,,WGS84,cch2,196230,,In woodland,http://cch2.org/portal/collections/individual/index.php?occid=196230,SA,bottom right,3,Total,0,2,1,0,0,,,2.333333333
OBI106041,4/5/1994,1994,4,5,95,,San Luis Obispo,"Pine Mt Region. from slope along Ridge Rd between Ridge meadows, Tobacco Crk drainage",914,35.684032,-121.071099,411,DG,Identified road along ridge near Tobacco Creek drainage -DG. Multiple locations; unable to narrow (DC),WGS84,cch2,196231,,"Assoc Pteridium aquilinum, Ranunculus californicus, Claytonia perfoliata. sandstone soil, full sun; Isolated pockets, widely scattered",http://cch2.org/portal/collections/individual/index.php?occid=196231,SA,,1,Total,2,3,2,1,1,,,2.555555556
OBI106041,4/5/1994,1994,4,5,95,,San Luis Obispo,"Pine Mt Region. from slope along Ridge Rd between Ridge meadows, Tobacco Crk drainage",914,35.684032,-121.071099,411,DG,Identified road along ridge near Tobacco Creek drainage -DG. Multiple locations; unable to narrow (DC),WGS84,cch2,196231,,"Assoc Pteridium aquilinum, Ranunculus californicus, Claytonia perfoliata. sandstone soil, full sun; Isolated pockets, widely scattered",http://cch2.org/portal/collections/individual/index.php?occid=196231,SA,,2,Total,2,1,2,2,1,,,2.875
OBI106041,4/5/1994,1994,4,5,95,,San Luis Obispo,"Pine Mt Region. from slope along Ridge Rd between Ridge meadows, Tobacco Crk drainage",914,35.684032,-121.071099,411,DG,Identified road along ridge near Tobacco Creek drainage -DG. Multiple locations; unable to narrow (DC),WGS84,cch2,196231,,"Assoc Pteridium aquilinum, Ranunculus californicus, Claytonia perfoliata. sandstone soil, full sun; Isolated pockets, widely scattered",http://cch2.org/portal/collections/individual/index.php?occid=196231,SA,,3,Total,1,2,1,2,0,,,2.666666667
OBI106041,4/5/1994,1994,4,5,95,,San Luis Obispo,"Pine Mt Region. from slope along Ridge Rd between Ridge meadows, Tobacco Crk drainage",914,35.684032,-121.071099,411,DG,Identified road along ridge near Tobacco Creek drainage -DG. Multiple locations; unable to narrow (DC),WGS84,cch2,196231,,"Assoc Pteridium aquilinum, Ranunculus californicus, Claytonia perfoliata. sandstone soil, full sun; Isolated pockets, widely scattered",http://cch2.org/portal/collections/individual/index.php?occid=196231,SA,,4,Total,1,3,2,4,1,,,3.090909091
OBI106041,4/5/1994,1994,4,5,95,,San Luis Obispo,"Pine Mt Region. from slope along Ridge Rd between Ridge meadows, Tobacco Crk drainage",914,35.684032,-121.071099,411,DG,Identified road along ridge near Tobacco Creek drainage -DG. Multiple locations; unable to narrow (DC),WGS84,cch2,196231,,"Assoc Pteridium aquilinum, Ranunculus californicus, Claytonia perfoliata. sandstone soil, full sun; Isolated pockets, widely scattered",http://cch2.org/portal/collections/individual/index.php?occid=196231,SA,,5,Total,1,0,2,1,0,,,2.75
OBI106041,4/5/1994,1994,4,5,95,,San Luis Obispo,"Pine Mt Region. from slope along Ridge Rd between Ridge meadows, Tobacco Crk drainage",914,35.684032,-121.071099,411,DG,Identified road along ridge near Tobacco Creek drainage -DG. Multiple locations; unable to narrow (DC),WGS84,cch2,196231,,"Assoc Pteridium aquilinum, Ranunculus californicus, Claytonia perfoliata. sandstone soil, full sun; Isolated pockets, widely scattered",http://cch2.org/portal/collections/individual/index.php?occid=196231,SA,"small one, structure wasn't attached but it was very well seen it was from that plant",6,Total,0,0,1,0,0,,,3
OBI106047,4/24/1967,1967,4,24,114,,San Luis Obispo,North-facing rocky slope near entrance to Routzahn park in Arroyo Grande canyon.,122,35.206933,-120.462596,605,DC,,WGS84,cch2,213871,,,http://cch2.org/portal/collections/individual/index.php?occid=213871,SA,second one in top left column,1,Total,0,1,1,1,0,,,3
OBI106047,4/24/1967,1967,4,24,114,,San Luis Obispo,North-facing rocky slope near entrance to Routzahn park in Arroyo Grande canyon.,122,35.206933,-120.462596,605,DC,,WGS84,cch2,213871,,,http://cch2.org/portal/collections/individual/index.php?occid=213871,SA,tall plant on far right,2,Total,1,1,1,1,0,,,2.5
SDSU06123,5/8/1951,1951,5,8,128,integrifolia,San Diego,Cuyamaca State Park,1423.87,32.945439,-116.5751,5705,DG,Locality updated from label,WGS84,cch2,380528,,,http://cch2.org/portal/collections/individual/index.php?occid=380528,SA,,1,Total,2,2,4,0,0,,,2.25
SDSU06123,5/8/1951,1951,5,8,128,integrifolia,San Diego,Cuyamaca State Park,1423.87,32.945439,-116.5751,5705,DG,Locality updated from label,WGS84,cch2,380528,,,http://cch2.org/portal/collections/individual/index.php?occid=380528,SA,,2,Total,1,1,1,1,0,,,2.5
SDSU06130,5/1/1971,1971,5,1,121,menziesii,Kern,"About 3 miles north of Paris-Lorraine, Kern County. Foothill Woodland community neighboring plants; Pinus sabiniana, Gila tricolor, Ganunculus occidentalis.",1250,35.348352,-118.436203,2319,DC,Refined error via halfway point to Lorraine (DG),WGS84,cch2,380535,,Growing on a grassy hillside along the Bealville to Bodfish Rd.,http://cch2.org/portal/collections/individual/index.php?occid=380535,SA,top right,1,Total,0,4,2,5,3,,,3.5
SDSU06130,5/1/1971,1971,5,1,121,menziesii,Kern,"About 3 miles north of Paris-Lorraine, Kern County. Foothill Woodland community neighboring plants; Pinus sabiniana, Gila tricolor, Ganunculus occidentalis.",1250,35.348352,-118.436203,2319,DC,Refined error via halfway point to Lorraine (DG),WGS84,cch2,380535,,Growing on a grassy hillside along the Bealville to Bodfish Rd.,http://cch2.org/portal/collections/individual/index.php?occid=380535,SA,bottom left,2,Total,4,6,4,2,8,,,3.166666667
SDSU06143,4/19/1987,1987,4,19,109,menziesii,Mendocino,Light gaps under canopy and edgge of coastal Redwood foreston southeastern leg of path surrounding Lake Leonard,335,39.26763,-123.365059,515,DC,,WGS84,cch2,380547,,,http://cch2.org/portal/collections/individual/index.php?occid=380547,SA,,1,Total,8,10,9,4,2,,,2.454545455
SDSU06143,4/19/1987,1987,4,19,109,menziesii,Mendocino,Light gaps under canopy and edgge of coastal Redwood foreston southeastern leg of path surrounding Lake Leonard,335,39.26763,-123.365059,515,DC,,WGS84,cch2,380547,,,http://cch2.org/portal/collections/individual/index.php?occid=380547,SA,,2,Total,4,4,1,4,0,,,2.384615385
SDSU06149,4/25/1951,1951,4,25,115,menziesii,Mariposa,Wawona rd near Wowona hotel,1219,37.535357,-119.65564,295,CPA,,WGS84,cch2,380553,,Grassy slope.,http://cch2.org/portal/collections/individual/index.php?occid=380553,SA,,1,Total,0,2,1,2,0,,,3
SDSU06149,4/25/1951,1951,4,25,115,menziesii,Mariposa,Wawona rd near Wowona hotel,1219,37.535357,-119.65564,295,CPA,,WGS84,cch2,380553,,Grassy slope.,http://cch2.org/portal/collections/individual/index.php?occid=380553,SA,,2,Total,0,1,0,2,1,,,3.75
SDSU06149,4/25/1951,1951,4,25,115,menziesii,Mariposa,Wawona rd near Wowona hotel,1219,37.535357,-119.65564,295,CPA,,WGS84,cch2,380553,,Grassy slope.,http://cch2.org/portal/collections/individual/index.php?occid=380553,SA,,3,Total,2,1,0,1,0,,,2
SDSU06149,4/25/1951,1951,4,25,115,menziesii,Mariposa,Wawona rd near Wowona hotel,1219,37.535357,-119.65564,295,CPA,,WGS84,cch2,380553,,Grassy slope.,http://cch2.org/portal/collections/individual/index.php?occid=380553,SA,,4,Total,2,3,0,1,0,,,2
SDSU06149,4/25/1951,1951,4,25,115,menziesii,Mariposa,Wawona rd near Wowona hotel,1219,37.535357,-119.65564,295,CPA,,WGS84,cch2,380553,,Grassy slope.,http://cch2.org/portal/collections/individual/index.php?occid=380553,SA,,5,Total,2,4,3,4,0,,,2.692307692
SD00010502,3/7/1931,1931,3,7,66,,Los Angeles,"Other collections same day made at Oakwilde campground, Los Angeles County",572.44,34.245608,-118.185232,285,CPA,"Found the campground and canyon, but the locality info is kinda wishy-washy anyway (""other collections made same day"")",WGS84,cch2,500083,FL,in canyon,http://cch2.org/portal/collections/individual/index.php?occid=500083,SA,"two plants placed together, but only 1 has structures",1,Total,0,1,0,0,0,,,2
SD00010486,5/19/1933,1933,5,19,139,,Madera,West slope of Sierra Nevada; 1.0 mile from Bass Lake on road to Coarse Gold.,1097,37.305525,-119.581872,712,CPA,,WGS84,cch2,500097,FL,,http://cch2.org/portal/collections/individual/index.php?occid=500097,SA,"plant in the middle of the page towards the top has two plants woven together, did not score that one. Counted everything from left to right",1,Total,2,4,2,0,0,,,2
SD00010486,5/19/1933,1933,5,19,139,,Madera,West slope of Sierra Nevada; 1.0 mile from Bass Lake on road to Coarse Gold.,1097,37.305525,-119.581872,712,CPA,,WGS84,cch2,500097,FL,,http://cch2.org/portal/collections/individual/index.php?occid=500097,SA,,2,Total,3,4,2,0,0,,,1.888888889
SD00010486,5/19/1933,1933,5,19,139,,Madera,West slope of Sierra Nevada; 1.0 mile from Bass Lake on road to Coarse Gold.,1097,37.305525,-119.581872,712,CPA,,WGS84,cch2,500097,FL,,http://cch2.org/portal/collections/individual/index.php?occid=500097,SA,,3,Total,0,3,1,0,0,,,2.25
SD00010486,5/19/1933,1933,5,19,139,,Madera,West slope of Sierra Nevada; 1.0 mile from Bass Lake on road to Coarse Gold.,1097,37.305525,-119.581872,712,CPA,,WGS84,cch2,500097,FL,,http://cch2.org/portal/collections/individual/index.php?occid=500097,SA,,4,Total,2,2,2,3,0,,,2.666666667
SD00010486,5/19/1933,1933,5,19,139,,Madera,West slope of Sierra Nevada; 1.0 mile from Bass Lake on road to Coarse Gold.,1097,37.305525,-119.581872,712,CPA,,WGS84,cch2,500097,FL,,http://cch2.org/portal/collections/individual/index.php?occid=500097,SA,small plant in between 3 and 4,5,Total,1,1,0,0,0,,,1.5
SD00010495,5/8/1948,1948,5,8,129,,Kern,"Kern River Canyon, 21.3 miles west of Isabella.",398.86,35.481715,-118.747738,1766,"CPA, DG",Update: provided point is ~21.3 mi W the town of Lake Isabella. Updated point and refined error (DG). Measured along Kern River,WGS84,cch2,500103,FL,,http://cch2.org/portal/collections/individual/index.php?occid=500103,SA,top left,1,Total,2,2,1,1,0,,,2.166666667
SD00010495,5/8/1948,1948,5,8,129,,Kern,"Kern River Canyon, 21.3 miles west of Isabella.",398.86,35.481715,-118.747738,1766,"CPA, DG",Update: provided point is ~21.3 mi W the town of Lake Isabella. Updated point and refined error (DG). Measured along Kern River,WGS84,cch2,500103,FL,,http://cch2.org/portal/collections/individual/index.php?occid=500103,SA,top right,2,Total,3,4,1,3,3,,,2.928571429
SD00010495,5/8/1948,1948,5,8,129,,Kern,"Kern River Canyon, 21.3 miles west of Isabella.",398.86,35.481715,-118.747738,1766,"CPA, DG",Update: provided point is ~21.3 mi W the town of Lake Isabella. Updated point and refined error (DG). Measured along Kern River,WGS84,cch2,500103,FL,,http://cch2.org/portal/collections/individual/index.php?occid=500103,SA,large plant in middle,3,Total,2,5,2,1,1,,,2.454545455
SD00010489,3/16/1953,1953,3,16,75,,Los Angeles,"San Jose-Puente Hills, south of Pomona, on the Brea Canyon Road.",244,33.977592,-117.860195,1394,CPA,,WGS84,cch2,500109,FL,Chino loam,http://cch2.org/portal/collections/individual/index.php?occid=500109,SA,"EXCLUDE: multiple plants overlapping, cannot differentiate",NA,,,,,,,,,#DIV/0!
SD00010507,5/17/1963,1963,5,17,137,,Santa Barbara,13.2 miles north of Lompoc on Highway 1.,183,34.788006,-120.46133,1543,CPA,refined error (DG),WGS84,cch2,500112,FL,,http://cch2.org/portal/collections/individual/index.php?occid=500112,SA,top left,1,Total,0,0,0,0,1,,,5
SD00010507,5/17/1963,1963,5,17,137,,Santa Barbara,13.2 miles north of Lompoc on Highway 1.,183,34.788006,-120.46133,1543,CPA,refined error (DG),WGS84,cch2,500112,FL,,http://cch2.org/portal/collections/individual/index.php?occid=500112,SA,large plant in middle,2,Total,0,1,2,8,6,,,4.117647059
SD00010429,5/1/1972,1972,5,1,122,atomaria,Sonoma,Duncan Point.,24.99,38.394367,-123.094966,212,CPA,,WGS84,cch2,500133,FFL,,http://cch2.org/portal/collections/individual/index.php?occid=500133,SA,,1,Total,0,2,2,1,2,,,3.428571429
SD00010429,5/1/1972,1972,5,1,122,atomaria,Sonoma,Duncan Point.,24.99,38.394367,-123.094966,212,CPA,,WGS84,cch2,500133,FFL,,http://cch2.org/portal/collections/individual/index.php?occid=500133,SA,,2,Total,4,5,5,5,8,,,3.296296296
SD00010429,5/1/1972,1972,5,1,122,atomaria,Sonoma,Duncan Point.,24.99,38.394367,-123.094966,212,CPA,,WGS84,cch2,500133,FFL,,http://cch2.org/portal/collections/individual/index.php?occid=500133,SA,,3,Total,2,4,5,3,2,,,2.9375
SD00010488,5/18/1980,1980,5,18,139,,Los Angeles,"South fork Big Rock Creek, ca. 0.5 mile north of South Fork Campground on Forest Road 4N11A.",1372,34.40107,-117.823205,610,CPA,,WGS84,cch2,500138,FL,"Pockets of fine moist sand in wash, full sun.",http://cch2.org/portal/collections/individual/index.php?occid=500138,SA,"largest plant on sheet, everything else is a clipping",1,Total,12,0,0,4,5,,,2.523809524
SD00010491,4/1/1915,1915,4,1,91,,Los Angeles,Claremont,451.61,34.126238,-117.714285,5480,CPA,,WGS84,cch2,500145,FL,,http://cch2.org/portal/collections/individual/index.php?occid=500145,SA,,1,Total,1,3,1,4,0,,,2.888888889
SD00010492,4/7/1978,1978,4,7,97,,Los Angeles,West side of Sierra Highway just north of Pearblossom Highway.,914,34.523085,-118.101999,391,CPA,,WGS84,cch2,500152,FL,,http://cch2.org/portal/collections/individual/index.php?occid=500152,SA,,1,Total,2,1,0,0,0,,,1.333333333
SD00010492,4/7/1978,1978,4,7,97,,Los Angeles,West side of Sierra Highway just north of Pearblossom Highway.,914,34.523085,-118.101999,391,CPA,,WGS84,cch2,500152,FL,,http://cch2.org/portal/collections/individual/index.php?occid=500152,SA,,2,Total,1,3,0,3,0,,,2.714285714
SD00010492,4/7/1978,1978,4,7,97,,Los Angeles,West side of Sierra Highway just north of Pearblossom Highway.,914,34.523085,-118.101999,391,CPA,,WGS84,cch2,500152,FL,,http://cch2.org/portal/collections/individual/index.php?occid=500152,SA,,3,Total,0,3,1,1,0,,,2.6
SD00010492,4/7/1978,1978,4,7,97,,Los Angeles,West side of Sierra Highway just north of Pearblossom Highway.,914,34.523085,-118.101999,391,CPA,,WGS84,cch2,500152,FL,,http://cch2.org/portal/collections/individual/index.php?occid=500152,SA,,4,Total,1,3,0,1,0,,,2.2
SD00010492,4/7/1978,1978,4,7,97,,Los Angeles,West side of Sierra Highway just north of Pearblossom Highway.,914,34.523085,-118.101999,391,CPA,,WGS84,cch2,500152,FL,,http://cch2.org/portal/collections/individual/index.php?occid=500152,SA,,5,Total,0,1,0,0,0,,,2
SD00010492,4/7/1978,1978,4,7,97,,Los Angeles,West side of Sierra Highway just north of Pearblossom Highway.,914,34.523085,-118.101999,391,CPA,,WGS84,cch2,500152,FL,,http://cch2.org/portal/collections/individual/index.php?occid=500152,SA,,6,Total,1,3,0,0,0,,,1.75
SD00010497,5/17/1951,1951,5,17,137,,Contra Costa,Open hillside west of Orinda.,364.15,37.87582,-122.211475,2351,DG,Update: found midpoint b/w Orinda and Berkley area (DG). Too vague.,WGS84,cch2,500166,FL,,http://cch2.org/portal/collections/individual/index.php?occid=500166,SA,,1,Total,1,2,2,0,0,,,2.2
SD00010497,5/17/1951,1951,5,17,137,,Contra Costa,Open hillside west of Orinda.,364.15,37.87582,-122.211475,2351,DG,Update: found midpoint b/w Orinda and Berkley area (DG). Too vague.,WGS84,cch2,500166,FL,,http://cch2.org/portal/collections/individual/index.php?occid=500166,SA,,2,Total,3,8,4,2,0,,,2.294117647
SD00010663,5/15/1967,1967,5,15,135,integrifolia,Los Angeles,"San Gabriel Mountains, east side Elsmere Canyon near mouth.",457,34.358178,-118.501154,1918,CPA,,WGS84,cch2,500259,FL,,http://cch2.org/portal/collections/individual/index.php?occid=500259,DG,no whole plants. Open flowers present,NA,,,,,,,,,#DIV/0!
RSA0010691,4/11/1976,1976,4,11,102,,Tulare County,2 miles east of Mt. Lumreau,793,36.164949,-118.738174,2694,CPA,,WGS84,cch2,638053,,Chaparral. Sandy loam.,http://cch2.org/portal/collections/individual/index.php?occid=638053,DG,left,1,Total,1,1,0,1,2,,,3.4
RSA0010691,4/11/1976,1976,4,11,102,,Tulare County,2 miles east of Mt. Lumreau,793,36.164949,-118.738174,2694,CPA,,WGS84,cch2,638053,,Chaparral. Sandy loam.,http://cch2.org/portal/collections/individual/index.php?occid=638053,DG,right; assumed to be whole based on base where two stems meet,2,Total,3,3,1,1,0,,,2
RSA0036056,3/3/1935,1935,3,3,62,,Orange County,San Juan Canyon.,762,33.555958,-117.5507,3258,CPA,,WGS84,cch2,639517,,Shaded hillside.,http://cch2.org/portal/collections/individual/index.php?occid=639517,DG,not whole; open flowers present,NA,,,,,,,,,#DIV/0!
RSA0037197,5/12/1991,1991,5,12,132,,Riverside County,"Area of High Country Ranches. From Tamatea Road approx. 100 ft. to dry stream bed, walking northeasterly direction.",1280,33.510876,-116.598225,671,CPA,,WGS84,cch2,661691,,"Open area all around. Sandy soil. Dry stream bed. Lined with Red Shank, Manzanita, Sagebrush scrub.",http://cch2.org/portal/collections/individual/index.php?occid=661691,DG,"Two very overlapping plants, open flowers present.",NA,,,,,,,,,#DIV/0!
RSA0028793,5/20/1944,1944,5,20,141,,Riverside County,"Palms to Pines Highway [Hwy. 74], San Jacinto Mountains.",1372,33.678387,-116.682548,14439,CPA,"Update: Will include, just under 15 km error (DG). Very broad",WGS84,cch2,677043,,"Along moist stream bank, in shade. [not applicable to all specimens this site]",http://cch2.org/portal/collections/individual/index.php?occid=677043,DG,,1,Total,1,6,1,9,3,,,3.35
RSA0070947,5/28/1973,1973,5,28,148,,Los Angeles County,"Angeles National Forest, San Gabriel Mts.: Trail Canyon.",610,34.312514,-118.25474,953,CPA,,WGS84,cch2,712818,,Common on moist slopes and flats among rocks.,http://cch2.org/portal/collections/individual/index.php?occid=712818,DG,big n branchy,1,Total,12,7,0,2,0,,,1.619047619
RSA0070947,5/28/1973,1973,5,28,148,,Los Angeles County,"Angeles National Forest, San Gabriel Mts.: Trail Canyon.",610,34.312514,-118.25474,953,CPA,,WGS84,cch2,712818,,Common on moist slopes and flats among rocks.,http://cch2.org/portal/collections/individual/index.php?occid=712818,DG,bottom left,2,Total,3,1,0,0,0,,,1.25
RSA0028725,4/9/1933,1933,4,9,99,,Santa Cruz County,Ano Nuevo Pines,14.11,37.139524,-122.336258,3822,CPA,,WGS84,cch2,751360,,,http://cch2.org/portal/collections/individual/index.php?occid=751360,SA,,1,Total,0,9,0,6,0,,,2.8
RSA0028725,4/9/1933,1933,4,9,99,,Santa Cruz County,Ano Nuevo Pines,14.11,37.139524,-122.336258,3822,CPA,,WGS84,cch2,751360,,,http://cch2.org/portal/collections/individual/index.php?occid=751360,SA,,2,Total,1,2,0,2,0,,,2.6
RSA0057838,5/14/1976,1976,5,14,135,,San Bernardino County,"San Antonio Canyon. Two miles south of Mt. Baldy Village, one quarter mile off Mt. Baldy Road on the dirt road.",1158,34.212052,-117.672432,543,CPA,,WGS84,cch2,840117,,"Southern Oak Woodland -- Quercus agrifolia. Occurred under Quercus agrifolia in sandy soil on a steep, west-facing slope.",http://cch2.org/portal/collections/individual/index.php?occid=840117,SA,,1,Total,1,2,2,0,0,,,2.2
RSA0057838,5/14/1976,1976,5,14,135,,San Bernardino County,"San Antonio Canyon. Two miles south of Mt. Baldy Village, one quarter mile off Mt. Baldy Road on the dirt road.",1158,34.212052,-117.672432,543,CPA,,WGS84,cch2,840117,,"Southern Oak Woodland -- Quercus agrifolia. Occurred under Quercus agrifolia in sandy soil on a steep, west-facing slope.",http://cch2.org/portal/collections/individual/index.php?occid=840117,SA,,2,Total,5,10,2,2,2,,,2.333333333
RSA0035444,5/15/1982,1982,5,15,135,menziesii,San Diego County,"CA Hwy S6, 4 mi. N of Palomar Mtn.",1524,33.355159,-116.869034,1680,CPA,,WGS84,cch2,953555,,,http://cch2.org/portal/collections/individual/index.php?occid=953555,SA,,1,Total,8,13,3,4,3,,,2.387096774
RSA0035444,5/15/1982,1982,5,15,135,menziesii,San Diego County,"CA Hwy S6, 4 mi. N of Palomar Mtn.",1524,33.355159,-116.869034,1680,CPA,,WGS84,cch2,953555,,,http://cch2.org/portal/collections/individual/index.php?occid=953555,SA,,2,Total,3,8,2,5,0,,,2.5
RSA0035444,5/15/1982,1982,5,15,135,menziesii,San Diego County,"CA Hwy S6, 4 mi. N of Palomar Mtn.",1524,33.355159,-116.869034,1680,CPA,,WGS84,cch2,953555,,,http://cch2.org/portal/collections/individual/index.php?occid=953555,SA,,3,Total,3,10,4,3,1,,,2.476190476
RSA0043192,3/1/1931,1931,3,1,60,,Los Angeles County,Oak Wilde.,557.52,34.245601,-118.184354,566,CPA,,WGS84,cch2,990724,,Canyon.,http://cch2.org/portal/collections/individual/index.php?occid=990724,SA,,1,Total,1,4,0,0,0,,,1.8
RSA0070948,4/29/1994,1994,4,29,119,,Los Angeles County,"Northern slope of the San Gabriel Mountains, Angeles National Forest: side draw on southeastern side of Mt. Emma, Santiago Canyon drainage.",1159,34.457369,-118.046373,3144,CPA,,WGS84,cch2,1009213,,"Vegetation a mix of Pinus monophylla-Juniperus osteosperma woodland and Adenostoma fasciculatum-Arctostaphylos glandulosa chaparral, mostly on granitic substrate. Local on open gravelly on mesic slopes.",http://cch2.org/portal/collections/individual/index.php?occid=1009213,SA,middle plant that's upside down,1,Total,1,2,3,5,4,,,3.6
RSA0070948,4/29/1994,1994,4,29,119,,Los Angeles County,"Northern slope of the San Gabriel Mountains, Angeles National Forest: side draw on southeastern side of Mt. Emma, Santiago Canyon drainage.",1159,34.457369,-118.046373,3144,CPA,,WGS84,cch2,1009213,,"Vegetation a mix of Pinus monophylla-Juniperus osteosperma woodland and Adenostoma fasciculatum-Arctostaphylos glandulosa chaparral, mostly on granitic substrate. Local on open gravelly on mesic slopes.",http://cch2.org/portal/collections/individual/index.php?occid=1009213,SA,bottom left plant,2,Total,0,2,1,3,3,,,3.777777778
RSA0059738,5/5/1945,1945,5,5,125,,Riverside County,San Gorgonio Mountains above Banning.,914,34.07244,-116.904562,11248,CPA,"Very broad, assumed ""above"" as North and ""San Gorgonio Mountains"" as San Gorgonio Mountain",WGS84,cch2,1021903,,Roadside.,http://cch2.org/portal/collections/individual/index.php?occid=1021903,SA,second from left in top row not counted; middle bottom had no structures,1,Total,1,0,0,0,0,,,1
RSA0059738,5/5/1945,1945,5,5,125,,Riverside County,San Gorgonio Mountains above Banning.,914,34.07244,-116.904562,11248,CPA,"Very broad, assumed ""above"" as North and ""San Gorgonio Mountains"" as San Gorgonio Mountain",WGS84,cch2,1021903,,Roadside.,http://cch2.org/portal/collections/individual/index.php?occid=1021903,SA,,2,Total,1,1,0,2,0,,,2.75
RSA0059738,5/5/1945,1945,5,5,125,,Riverside County,San Gorgonio Mountains above Banning.,914,34.07244,-116.904562,11248,CPA,"Very broad, assumed ""above"" as North and ""San Gorgonio Mountains"" as San Gorgonio Mountain",WGS84,cch2,1021903,,Roadside.,http://cch2.org/portal/collections/individual/index.php?occid=1021903,SA,,3,Total,2,4,0,0,0,,,1.666666667
RSA0059738,5/5/1945,1945,5,5,125,,Riverside County,San Gorgonio Mountains above Banning.,914,34.07244,-116.904562,11248,CPA,"Very broad, assumed ""above"" as North and ""San Gorgonio Mountains"" as San Gorgonio Mountain",WGS84,cch2,1021903,,Roadside.,http://cch2.org/portal/collections/individual/index.php?occid=1021903,SA,,4,Total,3,3,1,0,0,,,1.714285714
RSA0059738,5/5/1945,1945,5,5,125,,Riverside County,San Gorgonio Mountains above Banning.,914,34.07244,-116.904562,11248,CPA,"Very broad, assumed ""above"" as North and ""San Gorgonio Mountains"" as San Gorgonio Mountain",WGS84,cch2,1021903,,Roadside.,http://cch2.org/portal/collections/individual/index.php?occid=1021903,SA,,5,Total,0,1,1,1,0,,,3
RSA0043165,4/19/1933,1933,4,19,109,,Los Angeles County,Palos Verdes Hills.,370.88,33.750951,-118.347921,3102,CPA,,WGS84,cch2,1037233,,"Grassy hillside, north slope",http://cch2.org/portal/collections/individual/index.php?occid=1037233,SA,EXCLUDE: not a full plant,NA,,,,,,,,,#DIV/0!
RSA0046820,5/22/1994,1994,5,22,142,,Los Angeles County,USFS trail 7W12 Baldy Tr.,1500,34.262022,-117.654071,3391,CPA,,WGS84,cch2,1184076,,Chaparral. Facing SW. Shaded watershed.,http://cch2.org/portal/collections/individual/index.php?occid=1184076,SA,"Plant in bottom left is missing a lot of stems, not counted",1,Total,5,1,6,2,0,,,2.357142857
RSA0046820,5/22/1994,1994,5,22,142,,Los Angeles County,USFS trail 7W12 Baldy Tr.,1500,34.262022,-117.654071,3391,CPA,,WGS84,cch2,1184076,,Chaparral. Facing SW. Shaded watershed.,http://cch2.org/portal/collections/individual/index.php?occid=1184076,SA,,2,Total,0,1,2,1,0,,,3
RSA0046820,5/22/1994,1994,5,22,142,,Los Angeles County,USFS trail 7W12 Baldy Tr.,1500,34.262022,-117.654071,3391,CPA,,WGS84,cch2,1184076,,Chaparral. Facing SW. Shaded watershed.,http://cch2.org/portal/collections/individual/index.php?occid=1184076,SA,,3,Total,2,12,7,2,0,,,2.391304348
RSA0056306,4/4/1970,1970,4,4,94,,Santa Barbara County,San Marcos Pass.,678,34.511661,-119.824585,6081,CPA,,WGS84,cch2,1193429,,,http://cch2.org/portal/collections/individual/index.php?occid=1193429,SA,,1,Total,3,6,1,4,1,,,2.6
RSA0056306,4/4/1970,1970,4,4,94,,Santa Barbara County,San Marcos Pass.,678,34.511661,-119.824585,6081,CPA,,WGS84,cch2,1193429,,,http://cch2.org/portal/collections/individual/index.php?occid=1193429,SA,,2,Total,0,1,0,1,0,,,3
RSA0056306,4/4/1970,1970,4,4,94,,Santa Barbara County,San Marcos Pass.,678,34.511661,-119.824585,6081,CPA,,WGS84,cch2,1193429,,,http://cch2.org/portal/collections/individual/index.php?occid=1193429,SA,,3,Total,2,4,0,0,0,,,1.666666667
RSA0056306,4/4/1970,1970,4,4,94,,Santa Barbara County,San Marcos Pass.,678,34.511661,-119.824585,6081,CPA,,WGS84,cch2,1193429,,,http://cch2.org/portal/collections/individual/index.php?occid=1193429,SA,,4,Total,3,2,2,0,0,,,1.857142857
RSA0051320,3/28/1932,1932,3,28,88,,Orange County,2 miles NW of H.B.,3.75,33.75915,-118.06455,4295,CPA,"Assumed ""HB"" = Huntington Beach",WGS84,cch2,1203074,,On hillside.,http://cch2.org/portal/collections/individual/index.php?occid=1203074,SA,EXLCUDE: no full plants,NA,,,,,,,,,#DIV/0!
RSA0028724,4/1/1933,1933,4,1,91,,Lake County,Mt. St. Helena.,1319.11,38.669182,-122.63278,2083,CPA,,WGS84,cch2,1218006,,,http://cch2.org/portal/collections/individual/index.php?occid=1218006,SA,,1,Total,3,2,1,1,0,,,2
RSA0028724,4/1/1933,1933,4,1,91,,Lake County,Mt. St. Helena.,1319.11,38.669182,-122.63278,2083,CPA,,WGS84,cch2,1218006,,,http://cch2.org/portal/collections/individual/index.php?occid=1218006,SA,,2,Total,0,3,0,0,0,,,2
RSA0028724,4/1/1933,1933,4,1,91,,Lake County,Mt. St. Helena.,1319.11,38.669182,-122.63278,2083,CPA,,WGS84,cch2,1218006,,,http://cch2.org/portal/collections/individual/index.php?occid=1218006,SA,,3,Total,1,3,1,1,0,,,2.333333333
RSA0028724,4/1/1933,1933,4,1,91,,Lake County,Mt. St. Helena.,1319.11,38.669182,-122.63278,2083,CPA,,WGS84,cch2,1218006,,,http://cch2.org/portal/collections/individual/index.php?occid=1218006,SA,bottom left,4,Total,1,3,2,1,0,,,2.428571429
RSA0028724,4/1/1933,1933,4,1,91,,Lake County,Mt. St. Helena.,1319.11,38.669182,-122.63278,2083,CPA,,WGS84,cch2,1218006,,,http://cch2.org/portal/collections/individual/index.php?occid=1218006,SA,bottom middle; two plants in one but only one of them had structures,5,Total,0,2,0,0,0,,,2
RSA0028724,4/1/1933,1933,4,1,91,,Lake County,Mt. St. Helena.,1319.11,38.669182,-122.63278,2083,CPA,,WGS84,cch2,1218006,,,http://cch2.org/portal/collections/individual/index.php?occid=1218006,SA,bottom right,6,Total,0,7,2,0,0,,,2.222222222
