specimen_number,date_new,year,month,day,DOY,sub_sp,county,locality,elev_m,lat,long,error_dist_m,georef_by,georef_notes,datum,source,id,repro,habitat,references,scored_by,notes,plant,Total,buds_1,flowers_2,spent_3,immature_4,mature_5,open_flr_present,frt_present,plant_PI
UCR0077177,5/21/1951,1951,5,21,141,integrifolia,San Diego,Cuyamaca,1416.8,32.97722,-116.57917,,,,,cch2,1462122,,,http://cch2.org/portal/collections/individual/index.php?occid=1462122,DG,No whole plants (all clippings). Has open flowers,NA,,,,,,,y,y,#DIV/0!
UCR0077176,4/5/2004,2004,4,5,96,,San Diego,"Pine Hills area, between Magee Flat and Deadman Flat along Eagle Peak Road",1154.73,33.03111,-116.66056,,,,,cch2,1570996,,"Relatively gently rolling terrain of meadow-like openings surrounded by woodland of Quercus agrifolia and Quercus engelmannii, with scattered Arctostaphylos glauca and Salvia apiana; adjacent rockier slopes previously dominated by chaparral of Adenostoma fasciculatum, Arctostaphylos glauca, etc., but entire area burned in October 2003 fire.",http://cch2.org/portal/collections/individual/index.php?occid=1570996,DG,"Bottom plant, scored by tracing branches. Some breaks, but all appear to connect to the same whole specimen. Other loose structures not scored. Top mess has multiple plants, breaks; not scored.",1,Total,6,5,4,3,5,,,2.826086957
UCR0018152,5/21/1974,1974,5,21,141,integrifolia,San Diego,3 miles east of Julian,1082,33.08889,-116.57917,,,,,cch2,3752992,,"Dry, grassy slope.",http://cch2.org/portal/collections/individual/index.php?occid=3752992,DG,,1,Total,1,1,0,0,1,,,2.666666667
UCR0018152,5/21/1974,1974,5,21,141,integrifolia,San Diego,3 miles east of Julian,1082,33.08889,-116.57917,,,,,cch2,3752992,,"Dry, grassy slope.",http://cch2.org/portal/collections/individual/index.php?occid=3752992,DG,Looks like cotyledons are present. Seeds (appearing viable) on sheet!,2,Total,0,4,1,2,3,,,3.4
UCR0077178,4/27/2004,2004,4,27,118,,San Diego,"Warner Springs area, rolling terrain near the Pacific Crest Trail, south of Hwy 79 and west of the Warner Springs Resort",898,33.27083,-116.64167,,,,,cch2,1568044,,"Grassland dominated by exotic taxa, including Bromus spp., Avena barbata, and Erodium cicutarium, along with natives such as Stipa spp., Aristida, Poa secunda, Opuntia phaeacantha, Eriogonum elongatum, and Gutierrezia sarrothrae.",http://cch2.org/portal/collections/individual/index.php?occid=1568044,DG,"Open flowers present, no whole plants",NA,,,,,,,y,y,#DIV/0!
UCR0077171,2/24/2015,2015,2,24,55,,San Diego,"Camp Pendleton, central portion of Base, India Training Area, north of Basilone Road and east of Roblar Road, along a trail in a canyon bottom. Square: D5",140,33.35719,-117.35039,,,,,cch2,1681907,,"Oak woodland with Quercus agrifolia, Malosma laurina, Toxicodendron diversilobum, Salvia apiana, Artemisia californica, Baccharis salicifolia, Platanus racemosa.",http://cch2.org/portal/collections/individual/index.php?occid=1681907,DG,,1,Total,0,1,1,0,1,,,3.333333333
UCR0077171,2/24/2015,2015,2,24,55,,San Diego,"Camp Pendleton, central portion of Base, India Training Area, north of Basilone Road and east of Roblar Road, along a trail in a canyon bottom. Square: D5",140,33.35719,-117.35039,,,,,cch2,1681907,,"Oak woodland with Quercus agrifolia, Malosma laurina, Toxicodendron diversilobum, Salvia apiana, Artemisia californica, Baccharis salicifolia, Platanus racemosa.",http://cch2.org/portal/collections/individual/index.php?occid=1681907,DG,,2,Total,2,2,2,1,0,,,2.285714286
UCR0077171,2/24/2015,2015,2,24,55,,San Diego,"Camp Pendleton, central portion of Base, India Training Area, north of Basilone Road and east of Roblar Road, along a trail in a canyon bottom. Square: D5",140,33.35719,-117.35039,,,,,cch2,1681907,,"Oak woodland with Quercus agrifolia, Malosma laurina, Toxicodendron diversilobum, Salvia apiana, Artemisia californica, Baccharis salicifolia, Platanus racemosa.",http://cch2.org/portal/collections/individual/index.php?occid=1681907,DG,,3,Total,2,2,1,3,1,,,2.888888889
UCR0077171,2/24/2015,2015,2,24,55,,San Diego,"Camp Pendleton, central portion of Base, India Training Area, north of Basilone Road and east of Roblar Road, along a trail in a canyon bottom. Square: D5",140,33.35719,-117.35039,,,,,cch2,1681907,,"Oak woodland with Quercus agrifolia, Malosma laurina, Toxicodendron diversilobum, Salvia apiana, Artemisia californica, Baccharis salicifolia, Platanus racemosa.",http://cch2.org/portal/collections/individual/index.php?occid=1681907,DG,,4,Total,0,3,0,0,0,,,2
UCR0077171,2/24/2015,2015,2,24,55,,San Diego,"Camp Pendleton, central portion of Base, India Training Area, north of Basilone Road and east of Roblar Road, along a trail in a canyon bottom. Square: D5",140,33.35719,-117.35039,,,,,cch2,1681907,,"Oak woodland with Quercus agrifolia, Malosma laurina, Toxicodendron diversilobum, Salvia apiana, Artemisia californica, Baccharis salicifolia, Platanus racemosa.",http://cch2.org/portal/collections/individual/index.php?occid=1681907,DG,,5,Total,0,1,0,1,0,,,3
UCR0077171,2/24/2015,2015,2,24,55,,San Diego,"Camp Pendleton, central portion of Base, India Training Area, north of Basilone Road and east of Roblar Road, along a trail in a canyon bottom. Square: D5",140,33.35719,-117.35039,,,,,cch2,1681907,,"Oak woodland with Quercus agrifolia, Malosma laurina, Toxicodendron diversilobum, Salvia apiana, Artemisia californica, Baccharis salicifolia, Platanus racemosa.",http://cch2.org/portal/collections/individual/index.php?occid=1681907,DG,,6,Total,2,2,1,1,0,,,2.166666667
UCR0077171,2/24/2015,2015,2,24,55,,San Diego,"Camp Pendleton, central portion of Base, India Training Area, north of Basilone Road and east of Roblar Road, along a trail in a canyon bottom. Square: D5",140,33.35719,-117.35039,,,,,cch2,1681907,,"Oak woodland with Quercus agrifolia, Malosma laurina, Toxicodendron diversilobum, Salvia apiana, Artemisia californica, Baccharis salicifolia, Platanus racemosa.",http://cch2.org/portal/collections/individual/index.php?occid=1681907,DG,likely underestimating buds,7,Total,2,9,2,5,3,,,2.904761905
UCR0077171,2/24/2015,2015,2,24,55,,San Diego,"Camp Pendleton, central portion of Base, India Training Area, north of Basilone Road and east of Roblar Road, along a trail in a canyon bottom. Square: D5",140,33.35719,-117.35039,,,,,cch2,1681907,,"Oak woodland with Quercus agrifolia, Malosma laurina, Toxicodendron diversilobum, Salvia apiana, Artemisia californica, Baccharis salicifolia, Platanus racemosa.",http://cch2.org/portal/collections/individual/index.php?occid=1681907,DG,,8,Total,1,2,1,0,0,,,2
UCR0077173,5/4/2004,2004,5,4,125,integrifolia,San Diego,"hills north of Warner Springs, north Indian Flats Campground of Cleveland National Forest along Road 9S05",899,33.35981,-116.67292,,,,,cch2,1618597,,"Gentle valley with stream running over shallow granite bedrock slabs. Woodland of Quercus agrifolia and open meadows of Muhlengergia rigens in drainage bottom; slopes with scrub of Adenostoma sparsifolium, Adenostoma fasciculatum, Ceanothus greggii perplexans, Yucca whipplei, Rhamnus ilicifolia, and Arctostaphylos glauca. Understory includes Lonicera subspicata, Eriogonum fasciculatum, Eriogonum wrightii membranaceum, and Garrya flavescens. Stream with scattered Salix lasiolepis and Fraxinus velutina.",http://cch2.org/portal/collections/individual/index.php?occid=1618597,CF,left,1,Total,3,7,3,10,8,,,3.419354839
UCR0077173,5/4/2004,2004,5,4,125,integrifolia,San Diego,"hills north of Warner Springs, north Indian Flats Campground of Cleveland National Forest along Road 9S05",899,33.35981,-116.67292,,,,,cch2,1618597,,"Gentle valley with stream running over shallow granite bedrock slabs. Woodland of Quercus agrifolia and open meadows of Muhlengergia rigens in drainage bottom; slopes with scrub of Adenostoma sparsifolium, Adenostoma fasciculatum, Ceanothus greggii perplexans, Yucca whipplei, Rhamnus ilicifolia, and Arctostaphylos glauca. Understory includes Lonicera subspicata, Eriogonum fasciculatum, Eriogonum wrightii membranaceum, and Garrya flavescens. Stream with scattered Salix lasiolepis and Fraxinus velutina.",http://cch2.org/portal/collections/individual/index.php?occid=1618597,CF,right,2,Total,0,2,0,3,10,,,4.4
UCR0077103,2/17/1997,1997,2,17,48,menziesii,Riverside,"NW Palomar Mountains: burned areas in the Temecula community of Redhawk, south of the intersection of Redhawk Parkway and Tehachapi Pass Road",396,33.46667,-117.06667,,,,,cch2,1557317,,"Burned chaparral with Bromus madritensis ssp. rubens, Anagallis arvensis, Erodium botrys, Sidalcea malvaeflora, Sanicula bipinnatifida, etc. Metasedimentary substrate with a sandy loam soil; N-NE aspect; 70% slope.",http://cch2.org/portal/collections/individual/index.php?occid=1557317,CF,right plant has no roots,1,Total,7,2,0,1,0,,,1.5
UCR0077104,3/13/1997,1997,3,13,72,menziesii,Riverside,"Agua Tibia Mtns: Redhawk Housing Development, north of the Pechanga Indian Reservation in the hills south of the intersection of Marge Place and Tehachapi Pass (S of Redhawk Parkway)",378,33.46806,-117.075,,,,,cch2,1557955,,"Burned in the Temecula fire of May, 1996. Areas of coastal sage scrub and chaparral, with unburned pockets consisting of Eriogonum fasciculatum, Salvia apiana, Lotus scoparius, Artemisia californica, Ceanothus crassifolius. Arkose substrate with a sandy soil; aspects S, E, N; slope 0-120%.",http://cch2.org/portal/collections/individual/index.php?occid=1557955,"CF, DG, WW",,1,Total,22,20,8,17,9,,,2.618421053
UCR0077083,4/25/1967,1967,4,25,115,,Riverside,"Pauba Ranch [SE of Temecula in Pauba Valley, off Hwy 79]",381,33.48333,-117.05,,,,,cch2,1447225,,"Dry, sandy washes with coastal sage scrub.",http://cch2.org/portal/collections/individual/index.php?occid=1447225,CF,,1,Total,14,7,3,3,3,,,2.133333333
UCR0077072,2/10/2005,2005,2,10,41,,Riverside,"E of Temecula, Rancho California, SE of intersection of Mesa Verdugo and Calle Vista, N of Pauba Valley and south of Buck Mesa",393,33.51103,-117.06725,,,,,cch2,1586180,,"Eriogonum fasciculatum dominant, where not cleared. Large lot housing on all surrounding tracts.",http://cch2.org/portal/collections/individual/index.php?occid=1586180,DG,From training set,1,Total,15,13,7,3,4,,,2.238095238
UCR0077091,4/6/2001,2001,4,6,96,,Riverside,"Temecula, Long Canyon area west of Del Rey Rd., hills on both sides of gas pipeline route",366,33.52528,-117.12389,,,,,cch2,1486397,,Rolling hills with coastal sage scrub and grassland.,http://cch2.org/portal/collections/individual/index.php?occid=1486397,CF,,1,Total,7,5,1,1,1,,,1.933333333
UCR0077091,4/6/2001,2001,4,6,96,,Riverside,"Temecula, Long Canyon area west of Del Rey Rd., hills on both sides of gas pipeline route",366,33.52528,-117.12389,,,,,cch2,1486397,,Rolling hills with coastal sage scrub and grassland.,http://cch2.org/portal/collections/individual/index.php?occid=1486397,CF,top right,2,Total,5,3,1,1,1,,,2.090909091
UCR0077091,4/6/2001,2001,4,6,96,,Riverside,"Temecula, Long Canyon area west of Del Rey Rd., hills on both sides of gas pipeline route",366,33.52528,-117.12389,,,,,cch2,1486397,,Rolling hills with coastal sage scrub and grassland.,http://cch2.org/portal/collections/individual/index.php?occid=1486397,CF,,3,Total,3,3,0,1,0,,,1.857142857
UCR0077213,3/27/2003,2003,3,27,86,,Orange,Canyon bottom and W-facing slopes above Canada Gobernadora,91,33.53333,-117.58333,,,,,cch2,1597208,,"Coastal sage scrub and weedy grasslands on slopes, Salix scrub along stream channel and cultivated barley on valley floor.",http://cch2.org/portal/collections/individual/index.php?occid=1597208,CF,no whole plants,NA,,,,,,,y,y,#DIV/0!
UCR0077102,3/26/2003,2003,3,26,85,menziesii,Riverside,"Wilson Valley Mitigation Bank (Center for Natural Lands Management), NE of Wilson Valley Road and west of Wilson Creek",854,33.53417,-116.8675,,,,,cch2,1554125,,"Open sage scrub and non-native grassland with granitic outcrops dotting the area. Amazing year for wildflowers, this only one species of many.",http://cch2.org/portal/collections/individual/index.php?occid=1554125,CF,not convoluted but take care in separating the two bc there is some overlap,1,Total,7,4,2,0,0,,,1.615384615
UCR0077102,3/26/2003,2003,3,26,85,menziesii,Riverside,"Wilson Valley Mitigation Bank (Center for Natural Lands Management), NE of Wilson Valley Road and west of Wilson Creek",854,33.53417,-116.8675,,,,,cch2,1554125,,"Open sage scrub and non-native grassland with granitic outcrops dotting the area. Amazing year for wildflowers, this only one species of many.",http://cch2.org/portal/collections/individual/index.php?occid=1554125,CF,   ,2,Total,12,13,10,3,2,,,2.25
UCR0077081,5/9/1970,1970,5,9,129,,Riverside,"State Hwy 74 [Palms to Pines Hwy], 1 mile west of Santa Rosa Mountain Road",1220,33.56833,-116.5275,,,,,cch2,1447227,,,http://cch2.org/portal/collections/individual/index.php?occid=1447227,CF,,1,Total,0,2,0,7,1,,,3.7
UCR0077081,5/9/1970,1970,5,9,129,,Riverside,"State Hwy 74 [Palms to Pines Hwy], 1 mile west of Santa Rosa Mountain Road",1220,33.56833,-116.5275,,,,,cch2,1447227,,,http://cch2.org/portal/collections/individual/index.php?occid=1447227,CF,,2,Total,0,2,0,4,2,,,3.75
UCR0077082,4/17/1980,1980,4,17,108,,Riverside,Pine Meadow in upper Garner Valley,1433,33.57944,-116.59583,,,,,cch2,1447224,,"At edge of meadow dominated by Artemisia tridentata, Poa secunda, Sitanion, etc., and bordered by chaparral.",http://cch2.org/portal/collections/individual/index.php?occid=1447224,CF,,1,Total,4,8,0,3,1,,,2.3125
UCR0077082,4/17/1980,1980,4,17,108,,Riverside,Pine Meadow in upper Garner Valley,1433,33.57944,-116.59583,,,,,cch2,1447224,,"At edge of meadow dominated by Artemisia tridentata, Poa secunda, Sitanion, etc., and bordered by chaparral.",http://cch2.org/portal/collections/individual/index.php?occid=1447224,CF,,2,Total,3,5,0,3,0,,,2.272727273
UCR0077082,4/17/1980,1980,4,17,108,,Riverside,Pine Meadow in upper Garner Valley,1433,33.57944,-116.59583,,,,,cch2,1447224,,"At edge of meadow dominated by Artemisia tridentata, Poa secunda, Sitanion, etc., and bordered by chaparral.",http://cch2.org/portal/collections/individual/index.php?occid=1447224,CF,,3,Total,0,2,0,1,1,,,3.25
UCR0077082,4/17/1980,1980,4,17,108,,Riverside,Pine Meadow in upper Garner Valley,1433,33.57944,-116.59583,,,,,cch2,1447224,,"At edge of meadow dominated by Artemisia tridentata, Poa secunda, Sitanion, etc., and bordered by chaparral.",http://cch2.org/portal/collections/individual/index.php?occid=1447224,CF,,4,Total,2,2,2,1,0,,,2.285714286
UCR0077082,4/17/1980,1980,4,17,108,,Riverside,Pine Meadow in upper Garner Valley,1433,33.57944,-116.59583,,,,,cch2,1447224,,"At edge of meadow dominated by Artemisia tridentata, Poa secunda, Sitanion, etc., and bordered by chaparral.",http://cch2.org/portal/collections/individual/index.php?occid=1447224,CF,,5,Total,3,2,1,1,0,,,2
UCR0077094,3/15/1997,1997,3,15,74,,Riverside,Lake Skinner area: hill (1864) east of Skinner Lake at NW end of Tucalota Hills,488,33.59,-117.02333,,,,,cch2,1467104,,Rocky gabbro and granite hill dominated by coastal sage scrub with much Salvia mellifera.,http://cch2.org/portal/collections/individual/index.php?occid=1467104,CF,,1,Total,5,3,0,1,0,,,1.666666667
UCR0077094,3/15/1997,1997,3,15,74,,Riverside,Lake Skinner area: hill (1864) east of Skinner Lake at NW end of Tucalota Hills,488,33.59,-117.02333,,,,,cch2,1467104,,Rocky gabbro and granite hill dominated by coastal sage scrub with much Salvia mellifera.,http://cch2.org/portal/collections/individual/index.php?occid=1467104,CF,,2,Total,15,12,2,1,1,,,1.741935484
UCR0077069,4/7/2003,2003,4,7,97,,Riverside,"powerline trail west of Juan Diego Flats toward Reed Valley, NW of Cahuilla Mountain",1037,33.59278,-116.82611,,,,,cch2,1581640,,"Chaparral dominated by Adenostoma sparsifolium, A. fasciculatum and Arctostaphylos glauca, with lesser amounts of Prunus ilicifolia, Rhamnus ilicifolia and Eriogonum fasciculatum, plus few small groves of Quercus agrifolia.",http://cch2.org/portal/collections/individual/index.php?occid=1581640,CF,"only counted left most plant, others are clippings or missing ",1,Total,3,8,2,2,0,,,2.2
UCR0077049,3/22/2013,2013,3,22,81,integrifolia,Riverside,"southern end of Menifee Valley, between Hwy 215 and Winchester Rd (Hwy 79), south of Los Alamos Rd, rocky slopes flanking Warm Springs Creek",396,33.59806,-117.14194,,,,,cch2,1659237,,"Disturbed coastal sage scrub in rural residential area, with Artemisia californica, Eriogonum fasciculatum foliolosum, Acourtia microcephala, weedy grasses and annuals.",http://cch2.org/portal/collections/individual/index.php?occid=1659237,CF,,1,Total,11,7,2,4,0,,,1.958333333
UCR0077049,3/22/2013,2013,3,22,81,integrifolia,Riverside,"southern end of Menifee Valley, between Hwy 215 and Winchester Rd (Hwy 79), south of Los Alamos Rd, rocky slopes flanking Warm Springs Creek",396,33.59806,-117.14194,,,,,cch2,1659237,,"Disturbed coastal sage scrub in rural residential area, with Artemisia californica, Eriogonum fasciculatum foliolosum, Acourtia microcephala, weedy grasses and annuals.",http://cch2.org/portal/collections/individual/index.php?occid=1659237,CF,,2,Total,12,6,7,2,2,,,2.172413793
UCR0077097,3/15/1997,1997,3,15,74,menziesii,Riverside,Grassland at base of Bachelor Mtn. and adjoining chapararal.,488,33.6,-117.045,,,,,cch2,1478810,,"Mild, grassy slope.",http://cch2.org/portal/collections/individual/index.php?occid=1478810,CF,,1,Total,4,4,1,4,1,,,2.571428571
UCR0077097,3/15/1997,1997,3,15,74,menziesii,Riverside,Grassland at base of Bachelor Mtn. and adjoining chapararal.,488,33.6,-117.045,,,,,cch2,1478810,,"Mild, grassy slope.",http://cch2.org/portal/collections/individual/index.php?occid=1478810,CF,,2,Total,8,2,2,1,0,,,1.692307692
UCR0077068,4/13/2000,2000,4,13,104,,Riverside,"Southwestern Riverside County Multispecies Reserve, c. 3 mi NE of Skinner Reservoir",457,33.6,-117.01667,,,,,cch2,1592979,,Coastal sage scrub.,http://cch2.org/portal/collections/individual/index.php?occid=1592979,CF,,1,Total,2,3,4,1,0,,,2.4
UCR0077068,4/13/2000,2000,4,13,104,,Riverside,"Southwestern Riverside County Multispecies Reserve, c. 3 mi NE of Skinner Reservoir",457,33.6,-117.01667,,,,,cch2,1592979,,Coastal sage scrub.,http://cch2.org/portal/collections/individual/index.php?occid=1592979,CF,,2,Total,5,8,3,3,0,,,2.210526316
UCR0077068,4/13/2000,2000,4,13,104,,Riverside,"Southwestern Riverside County Multispecies Reserve, c. 3 mi NE of Skinner Reservoir",457,33.6,-117.01667,,,,,cch2,1592979,,Coastal sage scrub.,http://cch2.org/portal/collections/individual/index.php?occid=1592979,CF,,3,Total,1,1,0,0,0,,,1.5
UCR0077068,4/13/2000,2000,4,13,104,,Riverside,"Southwestern Riverside County Multispecies Reserve, c. 3 mi NE of Skinner Reservoir",457,33.6,-117.01667,,,,,cch2,1592979,,Coastal sage scrub.,http://cch2.org/portal/collections/individual/index.php?occid=1592979,CF,,4,Total,1,4,1,0,0,,,2
UCR0077068,4/13/2000,2000,4,13,104,,Riverside,"Southwestern Riverside County Multispecies Reserve, c. 3 mi NE of Skinner Reservoir",457,33.6,-117.01667,,,,,cch2,1592979,,Coastal sage scrub.,http://cch2.org/portal/collections/individual/index.php?occid=1592979,CF,,5,Total,1,0,0,0,0,,,1
UCR0077068,4/13/2000,2000,4,13,104,,Riverside,"Southwestern Riverside County Multispecies Reserve, c. 3 mi NE of Skinner Reservoir",457,33.6,-117.01667,,,,,cch2,1592979,,Coastal sage scrub.,http://cch2.org/portal/collections/individual/index.php?occid=1592979,CF,,6,Total,2,1,0,1,0,,,2
UCR0077068,4/13/2000,2000,4,13,104,,Riverside,"Southwestern Riverside County Multispecies Reserve, c. 3 mi NE of Skinner Reservoir",457,33.6,-117.01667,,,,,cch2,1592979,,Coastal sage scrub.,http://cch2.org/portal/collections/individual/index.php?occid=1592979,CF,,7,Total,3,1,1,0,0,,,1.6
UCR0077099,4/5/1989,1989,4,5,95,,Riverside,"Shipley Multi-species Reserve, blue-line stream on the southeastern flank of Bachelor Mtn.",470,33.60833,-117.04167,,,,,cch2,1495930,,"Coast live oak riparian forest w/ Quercus agrifolia, Claytonia perfoliata, Urtica dioica holosericea, Solidago californica, Elymus condensatus Verbena lasiostachys, Eleocharis palustris.",http://cch2.org/portal/collections/individual/index.php?occid=1495930,"CF,WW, DG","Re-scored (DG), very difficult sheet. Loose branches v likely belong to same plant. devin can you look pls: dense and blurry",1,Total,5,6,2,5,1,,,2.526315789
UCR0077071,4/18/2001,2001,4,18,108,,Riverside,Bautista Canyon near Tripp Flats Rd.,1143,33.60833,-116.74167,,,,,cch2,1584432,,Mixed chaparral with Adenostoma sparsiflora and Artemisia tridentata dominant.,http://cch2.org/portal/collections/individual/index.php?occid=1584432,CF,,1,Total,10,8,1,3,0,,,1.863636364
UCR0077071,4/18/2001,2001,4,18,108,,Riverside,Bautista Canyon near Tripp Flats Rd.,1143,33.60833,-116.74167,,,,,cch2,1584432,,Mixed chaparral with Adenostoma sparsiflora and Artemisia tridentata dominant.,http://cch2.org/portal/collections/individual/index.php?occid=1584432,CF,,2,Total,13,7,1,4,2,,,2.074074074
UCR0077079,3/31/1996,1996,3,31,91,,Riverside,"Bundy Canyon, SE of Lake Elsinore; c. 1 road mile (± 0.2 mi) east of Bundy Canyon Road exit from Hwy I-15. About 40 ft. south of road along mapped intermittent blueline stream",439,33.625,-117.25,,,,,cch2,1476988,,"Quercus agrifolia riparian woodland, with Salix laevigata, Platanus racemosa along stream; adjacent N- and W-facing slopes covered by mixed chaparral and coastal sage scrub species.",http://cch2.org/portal/collections/individual/index.php?occid=1476988,CF,,1,Total,0,0,0,0,0,,,#DIV/0!
UCR0077079,3/31/1996,1996,3,31,91,,Riverside,"Bundy Canyon, SE of Lake Elsinore; c. 1 road mile (± 0.2 mi) east of Bundy Canyon Road exit from Hwy I-15. About 40 ft. south of road along mapped intermittent blueline stream",439,33.625,-117.25,,,,,cch2,1476988,,"Quercus agrifolia riparian woodland, with Salix laevigata, Platanus racemosa along stream; adjacent N- and W-facing slopes covered by mixed chaparral and coastal sage scrub species.",http://cch2.org/portal/collections/individual/index.php?occid=1476988,CF,,2,Total,2,1,0,1,0,,,2
UCR0077079,3/31/1996,1996,3,31,91,,Riverside,"Bundy Canyon, SE of Lake Elsinore; c. 1 road mile (± 0.2 mi) east of Bundy Canyon Road exit from Hwy I-15. About 40 ft. south of road along mapped intermittent blueline stream",439,33.625,-117.25,,,,,cch2,1476988,,"Quercus agrifolia riparian woodland, with Salix laevigata, Platanus racemosa along stream; adjacent N- and W-facing slopes covered by mixed chaparral and coastal sage scrub species.",http://cch2.org/portal/collections/individual/index.php?occid=1476988,CF,,3,Total,0,1,0,0,0,,,2
UCR0077079,3/31/1996,1996,3,31,91,,Riverside,"Bundy Canyon, SE of Lake Elsinore; c. 1 road mile (± 0.2 mi) east of Bundy Canyon Road exit from Hwy I-15. About 40 ft. south of road along mapped intermittent blueline stream",439,33.625,-117.25,,,,,cch2,1476988,,"Quercus agrifolia riparian woodland, with Salix laevigata, Platanus racemosa along stream; adjacent N- and W-facing slopes covered by mixed chaparral and coastal sage scrub species.",http://cch2.org/portal/collections/individual/index.php?occid=1476988,CF,,4,Total,2,2,0,0,0,,,1.5
UCR0077079,3/31/1996,1996,3,31,91,,Riverside,"Bundy Canyon, SE of Lake Elsinore; c. 1 road mile (± 0.2 mi) east of Bundy Canyon Road exit from Hwy I-15. About 40 ft. south of road along mapped intermittent blueline stream",439,33.625,-117.25,,,,,cch2,1476988,,"Quercus agrifolia riparian woodland, with Salix laevigata, Platanus racemosa along stream; adjacent N- and W-facing slopes covered by mixed chaparral and coastal sage scrub species.",http://cch2.org/portal/collections/individual/index.php?occid=1476988,CF,,5,Total,3,1,0,0,0,,,1.25
UCR0077079,3/31/1996,1996,3,31,91,,Riverside,"Bundy Canyon, SE of Lake Elsinore; c. 1 road mile (± 0.2 mi) east of Bundy Canyon Road exit from Hwy I-15. About 40 ft. south of road along mapped intermittent blueline stream",439,33.625,-117.25,,,,,cch2,1476988,,"Quercus agrifolia riparian woodland, with Salix laevigata, Platanus racemosa along stream; adjacent N- and W-facing slopes covered by mixed chaparral and coastal sage scrub species.",http://cch2.org/portal/collections/individual/index.php?occid=1476988,CF,,6,Total,0,1,0,0,0,,,2
UCR0077079,3/31/1996,1996,3,31,91,,Riverside,"Bundy Canyon, SE of Lake Elsinore; c. 1 road mile (± 0.2 mi) east of Bundy Canyon Road exit from Hwy I-15. About 40 ft. south of road along mapped intermittent blueline stream",439,33.625,-117.25,,,,,cch2,1476988,,"Quercus agrifolia riparian woodland, with Salix laevigata, Platanus racemosa along stream; adjacent N- and W-facing slopes covered by mixed chaparral and coastal sage scrub species.",http://cch2.org/portal/collections/individual/index.php?occid=1476988,CF,,7,Total,0,2,0,0,0,,,2
UCR0077079,3/31/1996,1996,3,31,91,,Riverside,"Bundy Canyon, SE of Lake Elsinore; c. 1 road mile (± 0.2 mi) east of Bundy Canyon Road exit from Hwy I-15. About 40 ft. south of road along mapped intermittent blueline stream",439,33.625,-117.25,,,,,cch2,1476988,,"Quercus agrifolia riparian woodland, with Salix laevigata, Platanus racemosa along stream; adjacent N- and W-facing slopes covered by mixed chaparral and coastal sage scrub species.",http://cch2.org/portal/collections/individual/index.php?occid=1476988,CF,,8,Total,0,1,0,1,0,,,3
UCR0077079,3/31/1996,1996,3,31,91,,Riverside,"Bundy Canyon, SE of Lake Elsinore; c. 1 road mile (± 0.2 mi) east of Bundy Canyon Road exit from Hwy I-15. About 40 ft. south of road along mapped intermittent blueline stream",439,33.625,-117.25,,,,,cch2,1476988,,"Quercus agrifolia riparian woodland, with Salix laevigata, Platanus racemosa along stream; adjacent N- and W-facing slopes covered by mixed chaparral and coastal sage scrub species.",http://cch2.org/portal/collections/individual/index.php?occid=1476988,CF,,9,Total,0,1,0,1,0,,,3
UCR0077079,3/31/1996,1996,3,31,91,,Riverside,"Bundy Canyon, SE of Lake Elsinore; c. 1 road mile (± 0.2 mi) east of Bundy Canyon Road exit from Hwy I-15. About 40 ft. south of road along mapped intermittent blueline stream",439,33.625,-117.25,,,,,cch2,1476988,,"Quercus agrifolia riparian woodland, with Salix laevigata, Platanus racemosa along stream; adjacent N- and W-facing slopes covered by mixed chaparral and coastal sage scrub species.",http://cch2.org/portal/collections/individual/index.php?occid=1476988,CF,,10,Total,1,1,0,0,0,,,1.5
UCR0077048,4/9/2014,2014,4,9,99,,Riverside,"Menifee, c. 4 mi southeast of Canyon Lake, northeast corner of Bundy Canyon Road and Sunset Avenue",534,33.64194,-117.2225,,,,,cch2,1668839,,"Flat terrain; non-native grassland with remnant patches of coastal sage scrub including Rhamnus crocea, Rhus aromatica, Eriogonum fasciculatum foliolosum, Adenostoma fasciculatum, Sambucus nigra. Grassland of Avena barbata is disked annually and supports scattered native and weedy annuals.",http://cch2.org/portal/collections/individual/index.php?occid=1668839,CF,,1,Total,8,5,3,2,1,,,2.105263158
UCR0077048,4/9/2014,2014,4,9,99,,Riverside,"Menifee, c. 4 mi southeast of Canyon Lake, northeast corner of Bundy Canyon Road and Sunset Avenue",534,33.64194,-117.2225,,,,,cch2,1668839,,"Flat terrain; non-native grassland with remnant patches of coastal sage scrub including Rhamnus crocea, Rhus aromatica, Eriogonum fasciculatum foliolosum, Adenostoma fasciculatum, Sambucus nigra. Grassland of Avena barbata is disked annually and supports scattered native and weedy annuals.",http://cch2.org/portal/collections/individual/index.php?occid=1668839,CF,,2,Total,7,3,0,0,2,,,1.916666667
UCR0077048,4/9/2014,2014,4,9,99,,Riverside,"Menifee, c. 4 mi southeast of Canyon Lake, northeast corner of Bundy Canyon Road and Sunset Avenue",534,33.64194,-117.2225,,,,,cch2,1668839,,"Flat terrain; non-native grassland with remnant patches of coastal sage scrub including Rhamnus crocea, Rhus aromatica, Eriogonum fasciculatum foliolosum, Adenostoma fasciculatum, Sambucus nigra. Grassland of Avena barbata is disked annually and supports scattered native and weedy annuals.",http://cch2.org/portal/collections/individual/index.php?occid=1668839,CF,,3,Total,8,9,6,2,4,,,2.482758621
UCR0077048,4/9/2014,2014,4,9,99,,Riverside,"Menifee, c. 4 mi southeast of Canyon Lake, northeast corner of Bundy Canyon Road and Sunset Avenue",534,33.64194,-117.2225,,,,,cch2,1668839,,"Flat terrain; non-native grassland with remnant patches of coastal sage scrub including Rhamnus crocea, Rhus aromatica, Eriogonum fasciculatum foliolosum, Adenostoma fasciculatum, Sambucus nigra. Grassland of Avena barbata is disked annually and supports scattered native and weedy annuals.",http://cch2.org/portal/collections/individual/index.php?occid=1668839,CF,,4,Total,8,7,4,3,4,,,2.538461538
UCR0077055,5/10/2010,2010,5,10,130,integrifolia,Riverside,"San Bernardino National Forest, Garner Valley, c. 1.1 air mi southeast of junction of FS Road 6S13 and FS Road 6S04",1349,33.64497,-116.65589,,,,,cch2,1654005,,"Fairly open forest with some chaparral, with Pinus jeffreyi, Adenostoma fasciculatum, Dichelostemma capitatum Nemophila menziesii var. integrifolia, Bromus tectorum, Sphaeralcea ambigua, Lupinus concinnus, Lasthenia californica, Mimulus bigelovii, Anisocoma acaulis, Linanthus lemmonii.",http://cch2.org/portal/collections/individual/index.php?occid=1654005,CF,only top right is scored,1,Total,9,4,3,8,0,,,2.416666667
UCR0077100,5/20/2001,2001,5,20,140,,Riverside,"Apple Canyon Rd, 1.5 mi NE of CA-74",1463,33.68833,-116.66333,,,,,cch2,1509727,,Adenostoma and Arctostaphylos chaparral.,http://cch2.org/portal/collections/individual/index.php?occid=1509727,CF,,1,Total,2,2,3,0,0,,,2.142857143
UCR0077100,5/20/2001,2001,5,20,140,,Riverside,"Apple Canyon Rd, 1.5 mi NE of CA-74",1463,33.68833,-116.66333,,,,,cch2,1509727,,Adenostoma and Arctostaphylos chaparral.,http://cch2.org/portal/collections/individual/index.php?occid=1509727,CF,,2,Total,1,1,0,0,0,,,1.5
UCR0079815,5/20/2001,2001,5,20,140,,Riverside,0.3 mile NW of Keen Camp Summit along CA-74,1494,33.69056,-116.70806,,,,,cch2,1509716,,Yellow pine forest.,http://cch2.org/portal/collections/individual/index.php?occid=1509716,CF,,1,Total,1,3,2,2,5,,,3.538461538
UCR0079815,5/20/2001,2001,5,20,140,,Riverside,0.3 mile NW of Keen Camp Summit along CA-74,1494,33.69056,-116.70806,,,,,cch2,1509716,,Yellow pine forest.,http://cch2.org/portal/collections/individual/index.php?occid=1509716,CF,,2,Total,1,0,2,0,0,,,2.333333333
UCR0079815,5/20/2001,2001,5,20,140,,Riverside,0.3 mile NW of Keen Camp Summit along CA-74,1494,33.69056,-116.70806,,,,,cch2,1509716,,Yellow pine forest.,http://cch2.org/portal/collections/individual/index.php?occid=1509716,CF,,3,Total,2,3,1,3,1,,,2.8
UCR0077092,3/11/1998,1998,3,11,70,,Riverside,"North Domenigoni Hills, north of Diamond Valley, near old mine site above San Jacinto Valley, south of end of Warren Rd.",610,33.69167,-117.03333,,,,,cch2,1484037,,Coastal sage scrub on dark metamorphic or volcanic rocks on N and W facing slopes.,http://cch2.org/portal/collections/individual/index.php?occid=1484037,CF,some overlapping,1,Total,5,4,4,1,0,,,2.071428571
UCR0077092,3/11/1998,1998,3,11,70,,Riverside,"North Domenigoni Hills, north of Diamond Valley, near old mine site above San Jacinto Valley, south of end of Warren Rd.",610,33.69167,-117.03333,,,,,cch2,1484037,,Coastal sage scrub on dark metamorphic or volcanic rocks on N and W facing slopes.,http://cch2.org/portal/collections/individual/index.php?occid=1484037,CF,some overlapping,2,Total,11,9,0,4,1,,,2
UCR0077095,5/3/2001,2001,5,3,123,,Riverside,"Hemet, SE corner of State Street at Gibbel, 1712 ft. hill at east end of Diamond Valley",494,33.7,-116.96667,,,,,cch2,1486350,,"Bouldery granitic hill, decomposed granite soil, with coastal sage scrub, and chaparral elements on N slopes; Eriogonum fasciculatum and Artemisia californica dominant.",http://cch2.org/portal/collections/individual/index.php?occid=1486350,CF,can't pinpoint where the main base/root is,NA,,,,,,,y,y,#DIV/0!
UCR0077064,6/24/2008,2008,6,24,176,,Riverside,"May Valley c. 1.25 mi SW of Fleming Ranch, slope below May Valley Rd. toward meadow on nameless tributary NW of Hurkey Crk., north of Bonita Vista Rd.",1555,33.71168,-116.69023,,,,,cch2,1612777,,Moist shaded draw above a meadow; surrounded by dry pine-oak forest.,http://cch2.org/portal/collections/individual/index.php?occid=1612777,CF,,1,Total,1,6,4,3,20,,,4.029411765
UCR0077078,3/12/1993,1993,3,12,71,,Riverside,near Winchester,466,33.71667,-117.10417,,,,,cch2,1476990,,"Steep, rocky slopes. with Encelia farinosa dominated coastal sage scrub.",http://cch2.org/portal/collections/individual/index.php?occid=1476990,CF,,1,Total,2,2,0,4,0,,,2.75
UCR0077078,3/12/1993,1993,3,12,71,,Riverside,near Winchester,466,33.71667,-117.10417,,,,,cch2,1476990,,"Steep, rocky slopes. with Encelia farinosa dominated coastal sage scrub.",http://cch2.org/portal/collections/individual/index.php?occid=1476990,CF,,2,Total,6,2,4,0,1,,,2.076923077
UCR0077078,3/12/1993,1993,3,12,71,,Riverside,near Winchester,466,33.71667,-117.10417,,,,,cch2,1476990,,"Steep, rocky slopes. with Encelia farinosa dominated coastal sage scrub.",http://cch2.org/portal/collections/individual/index.php?occid=1476990,CF,,3,Total,4,1,0,1,0,,,1.666666667
UCR0077078,3/12/1993,1993,3,12,71,,Riverside,near Winchester,466,33.71667,-117.10417,,,,,cch2,1476990,,"Steep, rocky slopes. with Encelia farinosa dominated coastal sage scrub.",http://cch2.org/portal/collections/individual/index.php?occid=1476990,CF,,4,Total,3,3,1,1,0,,,2
UCR0077044,6/5/2013,2013,6,5,156,,Riverside,"Strawberry Creek below Strawberry Valley, c. 2.25 air mi southwest of Idyllwild",1540,33.72958,-116.74578,,,,,cch2,1681139,,"A small creek with forested banks, with Salix, Quercus kelloggii, Calocedrus decurrens, Pinus jeffreyi, Arctostaphyllos pringlei var. drupacea, Rosa californica, Erysimum capitatum, Menta, Eriophyllum confertiflorum, Claytonia, Equisetum, etc.",http://cch2.org/portal/collections/individual/index.php?occid=1681139,CF,most left (others are either clippings of are missing half of the structures),1,Total,0,0,0,0,3,,,5
UCR0077044,6/5/2013,2013,6,5,156,,Riverside,"Strawberry Creek below Strawberry Valley, c. 2.25 air mi southwest of Idyllwild",1540,33.72958,-116.74578,,,,,cch2,1681139,,"A small creek with forested banks, with Salix, Quercus kelloggii, Calocedrus decurrens, Pinus jeffreyi, Arctostaphyllos pringlei var. drupacea, Rosa californica, Erysimum capitatum, Menta, Eriophyllum confertiflorum, Claytonia, Equisetum, etc.",http://cch2.org/portal/collections/individual/index.php?occid=1681139,CF,third from left,2,Total,1,2,1,5,2,,,3.454545455
UCR0077044,6/5/2013,2013,6,5,156,,Riverside,"Strawberry Creek below Strawberry Valley, c. 2.25 air mi southwest of Idyllwild",1540,33.72958,-116.74578,,,,,cch2,1681139,,"A small creek with forested banks, with Salix, Quercus kelloggii, Calocedrus decurrens, Pinus jeffreyi, Arctostaphyllos pringlei var. drupacea, Rosa californica, Erysimum capitatum, Menta, Eriophyllum confertiflorum, Claytonia, Equisetum, etc.",http://cch2.org/portal/collections/individual/index.php?occid=1681139,CF,third from right,3,Total,0,0,3,0,6,,,4.333333333
UCR0077044,6/5/2013,2013,6,5,156,,Riverside,"Strawberry Creek below Strawberry Valley, c. 2.25 air mi southwest of Idyllwild",1540,33.72958,-116.74578,,,,,cch2,1681139,,"A small creek with forested banks, with Salix, Quercus kelloggii, Calocedrus decurrens, Pinus jeffreyi, Arctostaphyllos pringlei var. drupacea, Rosa californica, Erysimum capitatum, Menta, Eriophyllum confertiflorum, Claytonia, Equisetum, etc.",http://cch2.org/portal/collections/individual/index.php?occid=1681139,CF,second from right,4,Total,0,0,0,1,1,,,4.5
UCR0077062,3/31/2010,2010,3,31,90,,Riverside,"Temescal Canyon at Alberhill, c. 1/2 mi. west of Lake St. on north side of I-15, near Temescal Canyon Rd. undercrossing, at north edge of Concordia Ranch Rd.",363,33.73444,-117.41083,,,,,cch2,1630107,,"Loam with much horse manure on disturbed grassy flats with some shrub recovery; moderately steep rocky hillside with coastal sage scrub; assoc. with Artemisia calif., Eriogonum fasc., Dichelostemma, Microseris lindleyi, Daucus pusillus, Bromus, Avena, etc.",http://cch2.org/portal/collections/individual/index.php?occid=1630107,CF,plants are all overlapping,NA,,,,,,,y,y,#DIV/0!
UCR0077058,3/29/2011,2011,3,29,88,,Riverside,"hills between Sun City and Perris, low hilltop along powerline corridor c. 1/2 mile west of Goetz Rd., west of Alabaster Loop, above the San Jacinto River upstream of Railroad Canyon Lake",451,33.73644,-117.23564,,,,,cch2,1642592,,Rocky loam soil with coastal sage scrub dominated by Eriogonum fasciculatum.,http://cch2.org/portal/collections/individual/index.php?occid=1642592,CF,left,1,Total,4,7,1,1,2,,,2.333333333
UCR0077058,3/29/2011,2011,3,29,88,,Riverside,"hills between Sun City and Perris, low hilltop along powerline corridor c. 1/2 mile west of Goetz Rd., west of Alabaster Loop, above the San Jacinto River upstream of Railroad Canyon Lake",451,33.73644,-117.23564,,,,,cch2,1642592,,Rocky loam soil with coastal sage scrub dominated by Eriogonum fasciculatum.,http://cch2.org/portal/collections/individual/index.php?occid=1642592,CF,top right,2,Total,11,13,0,2,2,,,1.964285714
UCR0070268,5/1/1968,1968,5,1,122,integrifolia,Riverside,at Chimney Flats on the old control road to Idyllwild,1463,33.73722,-116.77194,,,,,cch2,1447226,,Chaparral.,http://cch2.org/portal/collections/individual/index.php?occid=1447226,CF,left to right,1,Total,9,6,0,4,0,,,1.947368421
UCR0070268,5/1/1968,1968,5,1,122,integrifolia,Riverside,at Chimney Flats on the old control road to Idyllwild,1463,33.73722,-116.77194,,,,,cch2,1447226,,Chaparral.,http://cch2.org/portal/collections/individual/index.php?occid=1447226,CF,,2,Total,7,5,1,0,1,,,1.785714286
UCR0070268,5/1/1968,1968,5,1,122,integrifolia,Riverside,at Chimney Flats on the old control road to Idyllwild,1463,33.73722,-116.77194,,,,,cch2,1447226,,Chaparral.,http://cch2.org/portal/collections/individual/index.php?occid=1447226,CF,,3,Total,5,5,0,2,0,,,1.916666667
UCR0077057,4/19/2011,2011,4,19,109,,Riverside,"Alberhill, unpaved extension of Lake Street, 1.5 km NNE of the intersection of Lake Street and Hwy 15",463,33.73889,-117.38889,,,,,cch2,1642294,,"Steep hill and roadcut, sparse coastal sage scrub dominated by weedy grasses with Avena barbata, Lotus scoparius brevialatus, Eriogonum fasciculatum foliolosum, Mirabilis laevis. Clay loam soil with granite boulders.",http://cch2.org/portal/collections/individual/index.php?occid=1642294,CF,no full plants,NA,,,,,,,y,y,#DIV/0!
UCR0077077,2/9/1997,1997,2,9,40,,Riverside,"Elsinore Basin; Temescal Valley: SW of Hwy I-15 between Indian Truck Trail and Lake Street exits, c. 0.5 mi east of Glen Eden",370,33.74167,-117.44167,,,,,cch2,1476989,,"Predominant vegetation is coastal sage scrub dominated by Artemisia californica and Salvia mellifera, grading into Adenostoma chaparral. Quercus agrifolia forest in canyon bottoms.",http://cch2.org/portal/collections/individual/index.php?occid=1476989,CF,no full plants,NA,,,,,,,y,n,#DIV/0!
UCR0077061,4/7/2010,2010,4,7,97,,Riverside,"southeastern Gavilan Hills north of Alberhill, ridge west of dirt extension of Lake St., 0.9 mi. north (358°) of intersection of I-15 and Lake St.",488,33.74306,-117.39417,,,,,cch2,1630197,,"Ridge top and N-facing 35 ° slope, decomposed granite soil; coastal sage scrub with Salvia apiana, Mirabilis laevis, Artemisia californica, Eriogonum fasciculatum poli., Festuca microstachys, Bromus rubens, B. hordeaceus, etc.",http://cch2.org/portal/collections/individual/index.php?occid=1630197,CF,plant stemming from higher root,1,Total,3,4,1,3,5,,,3.1875
UCR0077061,4/7/2010,2010,4,7,97,,Riverside,"southeastern Gavilan Hills north of Alberhill, ridge west of dirt extension of Lake St., 0.9 mi. north (358°) of intersection of I-15 and Lake St.",488,33.74306,-117.39417,,,,,cch2,1630197,,"Ridge top and N-facing 35 ° slope, decomposed granite soil; coastal sage scrub with Salvia apiana, Mirabilis laevis, Artemisia californica, Eriogonum fasciculatum poli., Festuca microstachys, Bromus rubens, B. hordeaceus, etc.",http://cch2.org/portal/collections/individual/index.php?occid=1630197,CF,plant stemming from lower root,2,Total,3,2,2,2,0,,,2.333333333
UCR0077074,2/24/1988,1988,2,24,55,,Riverside,"Temescal Canyon, about 0.25 mi west of intersection of Hwy I-15 and Indian Truck Trail",381,33.75083,-117.45611,,,,,cch2,1462113,,"Chaparral on N-facing slope and flats, patches of oaks in canyon bottom, with grassy openings. Some areas developed as citrus groves. Most specimens collected in vicinity of a S-facing hillside with clay soil. Associated with: Eriogonum fasciculatum, Quercus agrifolia, Q. dumosa, Baccharis glutinosa and Artemisia californica.",http://cch2.org/portal/collections/individual/index.php?occid=1462113,CF,,1,Total,3,2,0,1,0,,,1.833333333
UCR0077074,2/24/1988,1988,2,24,55,,Riverside,"Temescal Canyon, about 0.25 mi west of intersection of Hwy I-15 and Indian Truck Trail",381,33.75083,-117.45611,,,,,cch2,1462113,,"Chaparral on N-facing slope and flats, patches of oaks in canyon bottom, with grassy openings. Some areas developed as citrus groves. Most specimens collected in vicinity of a S-facing hillside with clay soil. Associated with: Eriogonum fasciculatum, Quercus agrifolia, Q. dumosa, Baccharis glutinosa and Artemisia californica.",http://cch2.org/portal/collections/individual/index.php?occid=1462113,CF,,2,Total,2,2,0,2,1,,,2.714285714
UCR0077105,4/9/2004,2004,4,9,100,menziesii,Riverside,"Tres Cerritos, c. 3 miles WNW of Hemet, east of the Lakeview Mtns., in central valley among the three peaks",488,33.76111,-117.02694,,,,,cch2,1560136,,Coastal sage scrub on granite hills.,http://cch2.org/portal/collections/individual/index.php?occid=1560136,CF,no whole plants,NA,,,,,,,y,y,#DIV/0!
UCR0077046,4/8/2014,2014,4,8,98,,Riverside,"Temescal Canyon, along Temescal Canyon Rd. c. 0.35 km NW of El Hermano Rd., c. 0.95 km SE of I-15 crossing",315,33.76111,-117.4625,,,,,cch2,1667801,,"Sandy mouth of wash and open sandy flats on valley bottom, coarse decomposed granite; annual grassland and sparse scrub with scattered trees, assoc. with Bromus rubens, B. diandrus, Brassica geniculata, Hemizonia kelloggii, Erodium cicutarium, Artemisia dracunculus, A. californica, Quercus agrifolia (prob. planted), Platanus racemosa, Sambucus nigra, Elymus condensatus, etc.",http://cch2.org/portal/collections/individual/index.php?occid=1667801,CF,clippings tangled with plant,NA,,,,,,,y,y,#DIV/0!
UCR0077056,4/6/2011,2011,4,6,96,,Riverside,"Temescal Canyon, along Temescal Canyon Rd. 1.5 mi. NE (73°) of Glen Ivy Hot Springs, 0-0.4 mi. NE of I-15 crossing",311,33.76306,-117.46639,,,,,cch2,1646462,,"Canyon bottom, sandy wash benches and slopes.",http://cch2.org/portal/collections/individual/index.php?occid=1646462,CF,,1,Total,5,1,2,3,1,,,2.5
UCR0077060,4/5/2004,2004,4,5,96,,Riverside,"Foothills, north of Valle Vista. Indian Creek Watershed",518,33.76667,-116.86667,,,,,cch2,1631642,,"Riparian woodlands along stream, shrublands on surrounding uplands; much of habitat converted to annual grasslands.",http://cch2.org/portal/collections/individual/index.php?occid=1631642,CF,counted left to right by which roots appeared first,1,Total,1,2,0,2,0,,,2.6
UCR0077060,4/5/2004,2004,4,5,96,,Riverside,"Foothills, north of Valle Vista. Indian Creek Watershed",518,33.76667,-116.86667,,,,,cch2,1631642,,"Riparian woodlands along stream, shrublands on surrounding uplands; much of habitat converted to annual grasslands.",http://cch2.org/portal/collections/individual/index.php?occid=1631642,CF,,2,Total,4,2,0,3,0,,,2.222222222
UCR0077060,4/5/2004,2004,4,5,96,,Riverside,"Foothills, north of Valle Vista. Indian Creek Watershed",518,33.76667,-116.86667,,,,,cch2,1631642,,"Riparian woodlands along stream, shrublands on surrounding uplands; much of habitat converted to annual grasslands.",http://cch2.org/portal/collections/individual/index.php?occid=1631642,CF,,3,Total,0,1,1,0,0,,,2.5
UCR0077060,4/5/2004,2004,4,5,96,,Riverside,"Foothills, north of Valle Vista. Indian Creek Watershed",518,33.76667,-116.86667,,,,,cch2,1631642,,"Riparian woodlands along stream, shrublands on surrounding uplands; much of habitat converted to annual grasslands.",http://cch2.org/portal/collections/individual/index.php?occid=1631642,CF,,4,Total,0,2,0,2,0,,,3
UCR0077060,4/5/2004,2004,4,5,96,,Riverside,"Foothills, north of Valle Vista. Indian Creek Watershed",518,33.76667,-116.86667,,,,,cch2,1631642,,"Riparian woodlands along stream, shrublands on surrounding uplands; much of habitat converted to annual grasslands.",http://cch2.org/portal/collections/individual/index.php?occid=1631642,CF,,5,Total,1,3,0,1,0,,,2.2
UCR0077060,4/5/2004,2004,4,5,96,,Riverside,"Foothills, north of Valle Vista. Indian Creek Watershed",518,33.76667,-116.86667,,,,,cch2,1631642,,"Riparian woodlands along stream, shrublands on surrounding uplands; much of habitat converted to annual grasslands.",http://cch2.org/portal/collections/individual/index.php?occid=1631642,CF,,6,Total,2,1,1,0,0,,,1.75
UCR0077060,4/5/2004,2004,4,5,96,,Riverside,"Foothills, north of Valle Vista. Indian Creek Watershed",518,33.76667,-116.86667,,,,,cch2,1631642,,"Riparian woodlands along stream, shrublands on surrounding uplands; much of habitat converted to annual grasslands.",http://cch2.org/portal/collections/individual/index.php?occid=1631642,CF,,7,Total,2,1,0,0,0,,,1.333333333
UCR0077060,4/5/2004,2004,4,5,96,,Riverside,"Foothills, north of Valle Vista. Indian Creek Watershed",518,33.76667,-116.86667,,,,,cch2,1631642,,"Riparian woodlands along stream, shrublands on surrounding uplands; much of habitat converted to annual grasslands.",http://cch2.org/portal/collections/individual/index.php?occid=1631642,CF,,8,Total,1,1,0,0,0,,,1.5
UCR0077060,4/5/2004,2004,4,5,96,,Riverside,"Foothills, north of Valle Vista. Indian Creek Watershed",518,33.76667,-116.86667,,,,,cch2,1631642,,"Riparian woodlands along stream, shrublands on surrounding uplands; much of habitat converted to annual grasslands.",http://cch2.org/portal/collections/individual/index.php?occid=1631642,CF,,9,Total,1,2,0,0,0,,,1.666666667
UCR0077076,4/5/1995,1995,4,5,95,,Riverside,Lakeview Mountains; SW of Juniper Flat Road,579,33.8,-117.1,,,,,cch2,1476991,,"Vegetation mostly chaparral, dominated by Adenostoma fasciculatum. Rhus ovata, Quercus berberidifolia occur on N facing sites. Annual grasses common, sometimes dense, away from shrub canopy.",http://cch2.org/portal/collections/individual/index.php?occid=1476991,CF,,1,Total,7,2,0,0,0,,,1.222222222
UCR0077076,4/5/1995,1995,4,5,95,,Riverside,Lakeview Mountains; SW of Juniper Flat Road,579,33.8,-117.1,,,,,cch2,1476991,,"Vegetation mostly chaparral, dominated by Adenostoma fasciculatum. Rhus ovata, Quercus berberidifolia occur on N facing sites. Annual grasses common, sometimes dense, away from shrub canopy.",http://cch2.org/portal/collections/individual/index.php?occid=1476991,CF,random structures excluded as I couldn't see where they attached to the plant,2,Total,7,1,0,0,0,,,1.125
UCR0077076,4/5/1995,1995,4,5,95,,Riverside,Lakeview Mountains; SW of Juniper Flat Road,579,33.8,-117.1,,,,,cch2,1476991,,"Vegetation mostly chaparral, dominated by Adenostoma fasciculatum. Rhus ovata, Quercus berberidifolia occur on N facing sites. Annual grasses common, sometimes dense, away from shrub canopy.",http://cch2.org/portal/collections/individual/index.php?occid=1476991,CF,"horizontal plant, right most structure excluded as it is covered by stem of another structure and has ambiguous pedicel",3,Total,4,3,1,2,2,,,2.583333333
UCR0077076,4/5/1995,1995,4,5,95,,Riverside,Lakeview Mountains; SW of Juniper Flat Road,579,33.8,-117.1,,,,,cch2,1476991,,"Vegetation mostly chaparral, dominated by Adenostoma fasciculatum. Rhus ovata, Quercus berberidifolia occur on N facing sites. Annual grasses common, sometimes dense, away from shrub canopy.",http://cch2.org/portal/collections/individual/index.php?occid=1476991,CF,,4,Total,9,4,2,2,0,,,1.823529412
UCR0077098,5/8/1980,1980,5,8,129,,Riverside,"Harford Springs County Park, NW corner of the Gavilan plateau",625,33.80361,-117.355,,,,,cch2,1447228,,Chamise chaparral-Coastal sage scrub-Juniper savanna mosaic,http://cch2.org/portal/collections/individual/index.php?occid=1447228,CF,top right structure excluded as most of structure is gone,1,Total,1,1,1,12,9,,,4.125
UCR0077098,5/8/1980,1980,5,8,129,,Riverside,"Harford Springs County Park, NW corner of the Gavilan plateau",625,33.80361,-117.355,,,,,cch2,1447228,,Chamise chaparral-Coastal sage scrub-Juniper savanna mosaic,http://cch2.org/portal/collections/individual/index.php?occid=1447228,CF,,2,Total,3,0,13,3,8,,,3.481481481
UCR0077059,4/4/2003,2003,4,4,94,menziesii,Riverside,"UC Riverside Motte Rimrock Reserve, off Sage Road",536,33.80822,-117.26033,,,,,cch2,1638293,,"Slopes and gullies in wetter areas of coastal sage scrub, with Phacelia, Eucrypta, Emmenanthe.",http://cch2.org/portal/collections/individual/index.php?occid=1638293,CF,right section assumed to have broken off from right main stem of plant,1,Total,5,3,0,2,0,,,1.9
UCR0077090,3/23/1997,1997,3,23,82,,Riverside,"Lakeview Mtns, c. 1 air mile SSW of Mt. Rudolph, along powerline road 0.3 mi. east of Contour (Juniper Flats) Rd.",610,33.80944,-117.08583,,,,,cch2,1478504,,"Coastal sage scrub/chaparral, w/ Adenostoma fascic., Eriogonum fascic. foliolosum, Artemisia calif., Salvia mellif., S. apiana, etc.",http://cch2.org/portal/collections/individual/index.php?occid=1478504,CF,3 overlapping plants - cannot score,NA,,,,,,,y,y,#DIV/0!
UCR0077089,4/21/1973,1973,4,21,111,,Riverside,"Cajalco Road, 3 miles west of Mockingbird Canyon Road, south of Lake Mathews",244,33.825,-117.41667,,,,,cch2,1447220,,"Rolling hills, with sandy-gravelly soil. Dominant spp. Eriogonum fasciculatum, Artemisia.",http://cch2.org/portal/collections/individual/index.php?occid=1447220,CF,,1,Total,28,19,10,13,4,,,2.27027027
UCR0077088,5/17/1964,1964,5,17,138,integrifolia,Riverside,c. 1 mile from junction of Hurley Flats Rd and Idyllwild-Banning Rd,1372,33.84528,-116.8175,,,,,cch2,1447221,,"Chaparral woodland. Dry hillside. Sunny, exposed ridge, decomposed granite. Associated with Quercus, Prunus ilicifolia, Cryptantha, Bromus, Adenostoma.",http://cch2.org/portal/collections/individual/index.php?occid=1447221,CF,,1,Total,9,3,0,1,0,,,1.461538462
UCR0077088,5/17/1964,1964,5,17,138,integrifolia,Riverside,c. 1 mile from junction of Hurley Flats Rd and Idyllwild-Banning Rd,1372,33.84528,-116.8175,,,,,cch2,1447221,,"Chaparral woodland. Dry hillside. Sunny, exposed ridge, decomposed granite. Associated with Quercus, Prunus ilicifolia, Cryptantha, Bromus, Adenostoma.",http://cch2.org/portal/collections/individual/index.php?occid=1447221,CF,,2,Total,4,3,1,0,0,,,1.625
UCR0077087,3/3/1985,1985,3,3,62,,Riverside,"Oasis de los Osos Preserve of the Nature Conservancy, off Snow Creek Canyon at the north foot of San Jacinto Mountain, l mile west of Snow Creek Village",489,33.89167,-116.69167,,,,,cch2,1462112,,"Rocky slopes and canyon bottom, with Encelia farinosa, Artemisia californica, Malacothamnus fasciculatus, Eriodictyon crassifolium, Salix exigua, Sarcostemma cynanchoides, etc.",http://cch2.org/portal/collections/individual/index.php?occid=1462112,CF,left plant not considered whole,1,Total,9,1,0,0,0,,,1.1
UCR0077070,3/15/2002,2002,3,15,74,,Riverside,"Brown Creek drainage just above the confluence with Twin Pines Creek, near the old Cabazon-Idyllwild Rd.",915,33.89778,-116.79361,,,,,cch2,1583530,,"Chaparral w/ Adenostoma fasc., Salvia api., Eriogonum fasc. Arctostaphylos, Ceanothus greg., etc. on dry slopes.",http://cch2.org/portal/collections/individual/index.php?occid=1583530,CF,,1,Total,1,1,0,0,0,,,1.5
UCR0077070,3/15/2002,2002,3,15,74,,Riverside,"Brown Creek drainage just above the confluence with Twin Pines Creek, near the old Cabazon-Idyllwild Rd.",915,33.89778,-116.79361,,,,,cch2,1583530,,"Chaparral w/ Adenostoma fasc., Salvia api., Eriogonum fasc. Arctostaphylos, Ceanothus greg., etc. on dry slopes.",http://cch2.org/portal/collections/individual/index.php?occid=1583530,CF,,2,Total,0,2,0,0,0,,,2
UCR0077070,3/15/2002,2002,3,15,74,,Riverside,"Brown Creek drainage just above the confluence with Twin Pines Creek, near the old Cabazon-Idyllwild Rd.",915,33.89778,-116.79361,,,,,cch2,1583530,,"Chaparral w/ Adenostoma fasc., Salvia api., Eriogonum fasc. Arctostaphylos, Ceanothus greg., etc. on dry slopes.",http://cch2.org/portal/collections/individual/index.php?occid=1583530,CF,,3,Total,2,1,0,0,0,,,1.333333333
UCR0077070,3/15/2002,2002,3,15,74,,Riverside,"Brown Creek drainage just above the confluence with Twin Pines Creek, near the old Cabazon-Idyllwild Rd.",915,33.89778,-116.79361,,,,,cch2,1583530,,"Chaparral w/ Adenostoma fasc., Salvia api., Eriogonum fasc. Arctostaphylos, Ceanothus greg., etc. on dry slopes.",http://cch2.org/portal/collections/individual/index.php?occid=1583530,CF,,4,Total,2,1,0,0,0,,,1.333333333
UCR0077045,3/25/2015,2015,3,25,84,,Riverside,"Woodcrest area of Riverside, wet canyon 0.25 km ENE of Evening Star Rd., 0.25 km north of Ridge Canyon Dr., above Woodcrest Dam",372,33.8983,-117.36452,,,,,cch2,1677995,,"N-facing, bouldery, granitic hillsides with coastal sage scrub dominated by Artemisia californica.",http://cch2.org/portal/collections/individual/index.php?occid=1677995,CF,,1,Total,6,3,0,3,1,,,2.230769231
UCR0077045,3/25/2015,2015,3,25,84,,Riverside,"Woodcrest area of Riverside, wet canyon 0.25 km ENE of Evening Star Rd., 0.25 km north of Ridge Canyon Dr., above Woodcrest Dam",372,33.8983,-117.36452,,,,,cch2,1677995,,"N-facing, bouldery, granitic hillsides with coastal sage scrub dominated by Artemisia californica.",http://cch2.org/portal/collections/individual/index.php?occid=1677995,CF,,2,Total,6,2,1,2,0,,,1.909090909
UCR0077084,3/29/1995,1995,3,29,88,,Riverside,"San Gorgonio Pass; alluvial fan at the mouth of Snow Creek, between Hwy 111 and Snow Creek Village",335,33.9,-116.66667,,,,,cch2,1476986,,Alluvial fan; creosote bush scrub on rocky alluvium and windblown sand deposits.,http://cch2.org/portal/collections/individual/index.php?occid=1476986,CF,,1,Total,4,5,2,1,0,,,2
UCR0077080,3/30/1995,1995,3,30,89,,Riverside,Moreno Valley; hills c. 0.7 air mi directly south of 60 Fwy and west of bend in Moreno Beach Drive. Topo Q. shows Moreno BM 2067 at top of hill,579,33.93222,-117.18028,,,,,cch2,1476987,,"Coastal sage scrub dominated by Artemisia californica., Eriogonum fasciculatum, with Scrophularia californica among rocks; N-facing slope w/ high cover of Keckiella antirrhinoides and Toxicodendron diversilobum.",http://cch2.org/portal/collections/individual/index.php?occid=1476987,CF,,1,Total,1,1,1,0,1,,,2.75
UCR0077080,3/30/1995,1995,3,30,89,,Riverside,Moreno Valley; hills c. 0.7 air mi directly south of 60 Fwy and west of bend in Moreno Beach Drive. Topo Q. shows Moreno BM 2067 at top of hill,579,33.93222,-117.18028,,,,,cch2,1476987,,"Coastal sage scrub dominated by Artemisia californica., Eriogonum fasciculatum, with Scrophularia californica among rocks; N-facing slope w/ high cover of Keckiella antirrhinoides and Toxicodendron diversilobum.",http://cch2.org/portal/collections/individual/index.php?occid=1476987,CF,,2,Total,3,1,2,1,2,,,2.777777778
UCR0077080,3/30/1995,1995,3,30,89,,Riverside,Moreno Valley; hills c. 0.7 air mi directly south of 60 Fwy and west of bend in Moreno Beach Drive. Topo Q. shows Moreno BM 2067 at top of hill,579,33.93222,-117.18028,,,,,cch2,1476987,,"Coastal sage scrub dominated by Artemisia californica., Eriogonum fasciculatum, with Scrophularia californica among rocks; N-facing slope w/ high cover of Keckiella antirrhinoides and Toxicodendron diversilobum.",http://cch2.org/portal/collections/individual/index.php?occid=1476987,CF,plant to the right of this excluded as it is missing half the main stems,3,Total,2,0,1,0,0,,,1.666666667
UCR0077080,3/30/1995,1995,3,30,89,,Riverside,Moreno Valley; hills c. 0.7 air mi directly south of 60 Fwy and west of bend in Moreno Beach Drive. Topo Q. shows Moreno BM 2067 at top of hill,579,33.93222,-117.18028,,,,,cch2,1476987,,"Coastal sage scrub dominated by Artemisia californica., Eriogonum fasciculatum, with Scrophularia californica among rocks; N-facing slope w/ high cover of Keckiella antirrhinoides and Toxicodendron diversilobum.",http://cch2.org/portal/collections/individual/index.php?occid=1476987,CF,,4,Total,2,2,1,0,0,,,1.8
UCR0077080,3/30/1995,1995,3,30,89,,Riverside,Moreno Valley; hills c. 0.7 air mi directly south of 60 Fwy and west of bend in Moreno Beach Drive. Topo Q. shows Moreno BM 2067 at top of hill,579,33.93222,-117.18028,,,,,cch2,1476987,,"Coastal sage scrub dominated by Artemisia californica., Eriogonum fasciculatum, with Scrophularia californica among rocks; N-facing slope w/ high cover of Keckiella antirrhinoides and Toxicodendron diversilobum.",http://cch2.org/portal/collections/individual/index.php?occid=1476987,CF,,5,Total,2,1,0,1,0,,,2
UCR0077080,3/30/1995,1995,3,30,89,,Riverside,Moreno Valley; hills c. 0.7 air mi directly south of 60 Fwy and west of bend in Moreno Beach Drive. Topo Q. shows Moreno BM 2067 at top of hill,579,33.93222,-117.18028,,,,,cch2,1476987,,"Coastal sage scrub dominated by Artemisia californica., Eriogonum fasciculatum, with Scrophularia californica among rocks; N-facing slope w/ high cover of Keckiella antirrhinoides and Toxicodendron diversilobum.",http://cch2.org/portal/collections/individual/index.php?occid=1476987,CF,,6,Total,1,2,0,1,1,,,2.8
UCR0077080,3/30/1995,1995,3,30,89,,Riverside,Moreno Valley; hills c. 0.7 air mi directly south of 60 Fwy and west of bend in Moreno Beach Drive. Topo Q. shows Moreno BM 2067 at top of hill,579,33.93222,-117.18028,,,,,cch2,1476987,,"Coastal sage scrub dominated by Artemisia californica., Eriogonum fasciculatum, with Scrophularia californica among rocks; N-facing slope w/ high cover of Keckiella antirrhinoides and Toxicodendron diversilobum.",http://cch2.org/portal/collections/individual/index.php?occid=1476987,CF,,7,Total,4,3,0,2,0,,,2
UCR0077096,3/8/1997,1997,3,8,67,,Riverside,"Box Springs Mtns, S-facing slopes near highest peak, right around radio towers.",915,33.96,-117.28333,,,,,cch2,1478440,,"Granitic boulders on N slope, within 200 ft. of summit. With Rhamnus ilicifolia, Ceanothus crassifolius, Adenostoma fasciculatum, etc.",http://cch2.org/portal/collections/individual/index.php?occid=1478440,CF,,1,Total,6,3,0,0,0,,,1.333333333
UCR0077101,6/9/1998,1998,6,9,160,,Riverside,"Morongo Indian Reservation, Lion Canyon, c. 3.5 miles NNW of Cabazon",854,33.9625,-116.75194,,,,,cch2,1549113,,"Coastal sage scrub and associated wash. Associates include Eriogunum fasciculatum, Encelia, and Artemisia californica.",http://cch2.org/portal/collections/individual/index.php?occid=1549113,CF,center plant,1,Total,1,2,2,3,0,,,2.875
UCR0077107,4/5/1976,1976,4,5,96,,Riverside,"Riverside, University of California campus, 1/8 mi. south of Perimeter Road [South Campus Drive]",274,33.96667,-117.325,,,,,cch2,1447229,,"Coastal sage scrub, with Artemisia californica, Eriogonum fasciculatum, Salvia apiana and S. mellifera dominant.",http://cch2.org/portal/collections/individual/index.php?occid=1447229,CF,,1,Total,13,3,0,3,0,,,1.631578947
UCR0077093,3/1/1997,1997,3,1,60,,Riverside,"Box Springs Mtns.: Coyote Hill (Bench Mark Versity, 1386 ft.) and ridge S and SE of the UCR Botanic Garden",427,33.96667,-117.32222,,,,,cch2,1466476,,"Coastal sage scrub, largely converted to annual grassland; much of the area burned in late spring 1996. Native annuals recovered in good numbers and weedy grasses noticably depressed.",http://cch2.org/portal/collections/individual/index.php?occid=1466476,CF,top left,1,Total,2,1,0,0,0,,,1.333333333
UCR0077093,3/1/1997,1997,3,1,60,,Riverside,"Box Springs Mtns.: Coyote Hill (Bench Mark Versity, 1386 ft.) and ridge S and SE of the UCR Botanic Garden",427,33.96667,-117.32222,,,,,cch2,1466476,,"Coastal sage scrub, largely converted to annual grassland; much of the area burned in late spring 1996. Native annuals recovered in good numbers and weedy grasses noticably depressed.",http://cch2.org/portal/collections/individual/index.php?occid=1466476,CF,plant that extends farthest up ,2,Total,3,1,0,0,0,,,1.25
UCR0077093,3/1/1997,1997,3,1,60,,Riverside,"Box Springs Mtns.: Coyote Hill (Bench Mark Versity, 1386 ft.) and ridge S and SE of the UCR Botanic Garden",427,33.96667,-117.32222,,,,,cch2,1466476,,"Coastal sage scrub, largely converted to annual grassland; much of the area burned in late spring 1996. Native annuals recovered in good numbers and weedy grasses noticably depressed.",http://cch2.org/portal/collections/individual/index.php?occid=1466476,CF,bottom left,3,Total,2,1,1,0,0,,,1.75
UCR0077093,3/1/1997,1997,3,1,60,,Riverside,"Box Springs Mtns.: Coyote Hill (Bench Mark Versity, 1386 ft.) and ridge S and SE of the UCR Botanic Garden",427,33.96667,-117.32222,,,,,cch2,1466476,,"Coastal sage scrub, largely converted to annual grassland; much of the area burned in late spring 1996. Native annuals recovered in good numbers and weedy grasses noticably depressed.",http://cch2.org/portal/collections/individual/index.php?occid=1466476,CF,root overlaps with bottom left plant,4,Total,1,1,0,0,0,,,1.5
UCR0077093,3/1/1997,1997,3,1,60,,Riverside,"Box Springs Mtns.: Coyote Hill (Bench Mark Versity, 1386 ft.) and ridge S and SE of the UCR Botanic Garden",427,33.96667,-117.32222,,,,,cch2,1466476,,"Coastal sage scrub, largely converted to annual grassland; much of the area burned in late spring 1996. Native annuals recovered in good numbers and weedy grasses noticably depressed.",http://cch2.org/portal/collections/individual/index.php?occid=1466476,CF,middle bottom,5,Total,3,0,0,0,0,,,1
UCR0077093,3/1/1997,1997,3,1,60,,Riverside,"Box Springs Mtns.: Coyote Hill (Bench Mark Versity, 1386 ft.) and ridge S and SE of the UCR Botanic Garden",427,33.96667,-117.32222,,,,,cch2,1466476,,"Coastal sage scrub, largely converted to annual grassland; much of the area burned in late spring 1996. Native annuals recovered in good numbers and weedy grasses noticably depressed.",http://cch2.org/portal/collections/individual/index.php?occid=1466476,CF,green stem facing right,6,Total,0,0,0,1,0,,,4
UCR0077093,3/1/1997,1997,3,1,60,,Riverside,"Box Springs Mtns.: Coyote Hill (Bench Mark Versity, 1386 ft.) and ridge S and SE of the UCR Botanic Garden",427,33.96667,-117.32222,,,,,cch2,1466476,,"Coastal sage scrub, largely converted to annual grassland; much of the area burned in late spring 1996. Native annuals recovered in good numbers and weedy grasses noticably depressed.",http://cch2.org/portal/collections/individual/index.php?occid=1466476,CF,,7,Total,1,1,0,1,0,,,2.333333333
UCR0077161,4/21/1994,1994,4,21,111,,Riverside,"Millard Canyon, near stream crossing of Forest Service Road 2S05, c. 4 miles south of Bear Wallow Spring",917,33.96667,-116.8,,,,,cch2,1477001,,Open sandy soil between shrubs in alluvial scrub dominated by Lepidospartum squamatum.,http://cch2.org/portal/collections/individual/index.php?occid=1477001,CF,,1,Total,16,19,16,6,15,,,2.791666667
UCR0077063,3/27/2004,2004,3,27,87,,Riverside,Riverside; UCR Botanical Garden,424,33.96667,-117.31944,,,,,cch2,1624857,,Native coastal sage scrub south of the garden fence.,http://cch2.org/portal/collections/individual/index.php?occid=1624857,CF,"only center is plant, others are clippings",1,Total,4,1,0,2,1,,,2.375
UCR0077067,4/30/1998,1998,4,30,120,,Riverside,"Morongo Indian Reservation, side canyon east of Hathaway Canyon, tree stand F-06",915,33.97222,-116.86056,,,,,cch2,1597546,,"Riparian woodland with Platanus racemosa, Fraxinus, Quercus wislizenii, Baccharis salicifolia, etc. Gravelly stream beds with clay-loam soil.",http://cch2.org/portal/collections/individual/index.php?occid=1597546,CF,,1,Total,0,3,2,11,9,,,4.04
UCR0077067,4/30/1998,1998,4,30,120,,Riverside,"Morongo Indian Reservation, side canyon east of Hathaway Canyon, tree stand F-06",915,33.97222,-116.86056,,,,,cch2,1597546,,"Riparian woodland with Platanus racemosa, Fraxinus, Quercus wislizenii, Baccharis salicifolia, etc. Gravelly stream beds with clay-loam soil.",http://cch2.org/portal/collections/individual/index.php?occid=1597546,CF,,2,Total,6,2,11,10,7,,,3.277777778
UCR0077067,4/30/1998,1998,4,30,120,,Riverside,"Morongo Indian Reservation, side canyon east of Hathaway Canyon, tree stand F-06",915,33.97222,-116.86056,,,,,cch2,1597546,,"Riparian woodland with Platanus racemosa, Fraxinus, Quercus wislizenii, Baccharis salicifolia, etc. Gravelly stream beds with clay-loam soil.",http://cch2.org/portal/collections/individual/index.php?occid=1597546,CF,,3,Total,11,3,5,16,5,,,3.025
UCR0077075,4/7/1994,1994,4,7,97,,Riverside,Big Springs Canyon and north on the crest to Two Trees Canyon (S side),752.09,33.975,-117.29167,,,,,cch2,1476992,,"Associated with Bromus spp., Salvia mellifera, S. apiana, Phacelia minor, Amsinckia menziesii, Erodium cicutarium, etc.",http://cch2.org/portal/collections/individual/index.php?occid=1476992,CF,no whole plant,NA,,,,,,,y,y,#DIV/0!
UCR0077086,4/25/1976,1976,4,25,116,,Riverside,"Idyllwild - Banning Road, c. 1 mi from junction with Hurley Flats Road.",1372,33.98333,-116.8,,,,,cch2,1447223,,Chaparral.,http://cch2.org/portal/collections/individual/index.php?occid=1447223,CF,,1,Total,14,7,2,0,1,,,1.625
UCR0077086,4/25/1976,1976,4,25,116,,Riverside,"Idyllwild - Banning Road, c. 1 mi from junction with Hurley Flats Road.",1372,33.98333,-116.8,,,,,cch2,1447223,,Chaparral.,http://cch2.org/portal/collections/individual/index.php?occid=1447223,CF,,2,Total,20,10,6,4,3,,,2.069767442
UCR0077085,4/24/1996,1996,4,24,115,,Riverside,"Morongo Indian Reservation, along dirt road in Hathaway Canyon, near Burro Flats",915,33.98333,-116.85833,,,,,cch2,1476985,,Rocky loam in chaparral belt with grassy openings and oak and sycamore woodlands.,http://cch2.org/portal/collections/individual/index.php?occid=1476985,CF,,1,Total,3,3,1,2,0,,,2.222222222
UCR0077085,4/24/1996,1996,4,24,115,,Riverside,"Morongo Indian Reservation, along dirt road in Hathaway Canyon, near Burro Flats",915,33.98333,-116.85833,,,,,cch2,1476985,,Rocky loam in chaparral belt with grassy openings and oak and sycamore woodlands.,http://cch2.org/portal/collections/individual/index.php?occid=1476985,CF,plant is under overlapping plant: one on top not considered plant,2,Total,2,3,0,0,2,,,2.571428571
UCR0077085,4/24/1996,1996,4,24,115,,Riverside,"Morongo Indian Reservation, along dirt road in Hathaway Canyon, near Burro Flats",915,33.98333,-116.85833,,,,,cch2,1476985,,Rocky loam in chaparral belt with grassy openings and oak and sycamore woodlands.,http://cch2.org/portal/collections/individual/index.php?occid=1476985,CF,top right scored as open flower due to petal length,3,Total,2,2,1,0,0,,,1.8
UCR0077085,4/24/1996,1996,4,24,115,,Riverside,"Morongo Indian Reservation, along dirt road in Hathaway Canyon, near Burro Flats",915,33.98333,-116.85833,,,,,cch2,1476985,,Rocky loam in chaparral belt with grassy openings and oak and sycamore woodlands.,http://cch2.org/portal/collections/individual/index.php?occid=1476985,CF,,4,Total,7,2,1,0,0,,,1.4
UCR0077085,4/24/1996,1996,4,24,115,,Riverside,"Morongo Indian Reservation, along dirt road in Hathaway Canyon, near Burro Flats",915,33.98333,-116.85833,,,,,cch2,1476985,,Rocky loam in chaparral belt with grassy openings and oak and sycamore woodlands.,http://cch2.org/portal/collections/individual/index.php?occid=1476985,CF,,5,Total,2,2,1,1,0,,,2.166666667
UCR0077065,5/14/1998,1998,5,14,134,,Riverside,"Morongo Indian Reservation, flat area cut by small wash, south and west of dirt road to Kitching Peak near junction with East Branch Millard Canyon, tree stand M-04",1128,33.98528,-116.78056,,,,,cch2,1598399,,"Stream bench with Fraxinus dipetala, Quercus wislizenii, Eriogonum fasciculatum, Adenostoma fasciculatum, Juglans, etc.",http://cch2.org/portal/collections/individual/index.php?occid=1598399,CF,,1,Total,1,1,3,2,2,,,3.333333333
UCR0077053,5/21/1998,1998,5,21,141,,Riverside,"Morongo Indian Reservation, Hathaway Creek Canyon, NW of Cabazon",976,33.98592,-116.86969,,,,,cch2,1658740,,"Riparian woodland along stream in deep canyon; with Quercus chrysolepis, Alnus rhombifolia, Salix laevigata, Toxicodendron diversilobum. Woodland stand H03.",http://cch2.org/portal/collections/individual/index.php?occid=1658740,CF,,1,Total,5,7,5,7,2,,,2.769230769
UCR0077053,5/21/1998,1998,5,21,141,,Riverside,"Morongo Indian Reservation, Hathaway Creek Canyon, NW of Cabazon",976,33.98592,-116.86969,,,,,cch2,1658740,,"Riparian woodland along stream in deep canyon; with Quercus chrysolepis, Alnus rhombifolia, Salix laevigata, Toxicodendron diversilobum. Woodland stand H03.",http://cch2.org/portal/collections/individual/index.php?occid=1658740,CF,,2,Total,3,1,3,4,3,,,3.214285714
UCR0077051,5/29/1994,1994,5,29,149,integrifolia,Riverside,"East Branch Millard Canyon, along Forest Service Road 4S45",1200,33.98639,-116.78333,,,,,cch2,1487087,,"Rocky canyon bottom in chaparral, with Adenostoma, Quercus wislizenii, Fraxinus dipetala, etc.",http://cch2.org/portal/collections/individual/index.php?occid=1487087,CF,CRAZY: almost entirely mature fruits,1,Total,6,3,5,26,116,,,4.557692308
UCR0077054,4/9/1998,1998,4,9,99,,Riverside,"Morongo Indian Reservation, Wood Canyon, east of upper Potrero Canyon",1305,33.99253,-116.82772,,,,,cch2,1658723,,Woodland stand MOR W5.,http://cch2.org/portal/collections/individual/index.php?occid=1658723,CF,,1,Total,2,4,0,4,0,,,2.6
UCR0077054,4/9/1998,1998,4,9,99,,Riverside,"Morongo Indian Reservation, Wood Canyon, east of upper Potrero Canyon",1305,33.99253,-116.82772,,,,,cch2,1658723,,Woodland stand MOR W5.,http://cch2.org/portal/collections/individual/index.php?occid=1658723,CF,,2,Total,11,11,0,8,0,,,2.166666667
UCR0077066,4/23/1998,1998,4,23,113,,Riverside,"Morongo Indian Reservation, seep in Wood Canyon, tree stand W-07",1220,33.99722,-116.83,,,,,cch2,1597758,,"With Baccharis salicifolia, Hydrocotyle, Rorippa nasturtium-aquaticum, Quercus wislizenii, Platanus racemosa, Ranunculus cymbalaria, Rhamnus, etc.",http://cch2.org/portal/collections/individual/index.php?occid=1597758,CF,,1,Total,8,8,1,11,2,,,2.7
UCR0077159,5/5/1968,1968,5,5,126,,San Bernardino,"Wildwood Canyon, east end, Camp Wiwoca",1098,34.01167,-116.985,,,,,cch2,1447233,,"Southern oak woodland, in sandy loam soil.",http://cch2.org/portal/collections/individual/index.php?occid=1447233,CF,,1,Total,19,42,21,21,6,,,2.568807339
UCR0077138,4/4/1998,1998,4,4,94,,San Bernardino,"City of Grand Terrace, east of corner of Van Buren St. and Observation Dr.",396,34.02056,-117.30389,,,,,cch2,1494698,,"Dry granitic pediment and lower W facing slopes in CSS. Associated with Eriogonum fasciculatum, Artemesia californica, and Heterotheca grandiflora.",http://cch2.org/portal/collections/individual/index.php?occid=1494698,CF,,1,Total,15,16,2,10,2,,,2.288888889
UCR0077073,5/27/2004,2004,5,27,148,,Riverside,"head of Banning (San Gorgonio River) Canyon close to the San Bernardino Co. line, 1 mi SE of Oak Glen Conservation Camp",1341,34.02375,-116.89231,,,,,cch2,1585711,,"Chaparral on slopes, canyon bottom with washes and open woodland of Platanus and Quercus.",http://cch2.org/portal/collections/individual/index.php?occid=1585711,CF,,1,Total,4,9,1,19,7,,,3.4
UCR0077150,4/7/1993,1993,4,7,97,,San Bernardino,"E side Water Cyn, trib of Wildwood Cyn from N; SW foot Pisgah Pk",979,34.025,-116.98333,,,,,cch2,1462115,,,http://cch2.org/portal/collections/individual/index.php?occid=1462115,CF,,1,Total,2,3,0,0,0,,,1.6
UCR0077150,4/7/1993,1993,4,7,97,,San Bernardino,"E side Water Cyn, trib of Wildwood Cyn from N; SW foot Pisgah Pk",979,34.025,-116.98333,,,,,cch2,1462115,,,http://cch2.org/portal/collections/individual/index.php?occid=1462115,CF,,2,Total,8,4,0,0,0,,,1.333333333
UCR0077150,4/7/1993,1993,4,7,97,,San Bernardino,"E side Water Cyn, trib of Wildwood Cyn from N; SW foot Pisgah Pk",979,34.025,-116.98333,,,,,cch2,1462115,,,http://cch2.org/portal/collections/individual/index.php?occid=1462115,CF,,3,Total,9,7,0,0,0,,,1.4375
UCR0077151,4/8/1992,1992,4,8,99,integrifolia,San Bernardino,"east of Yucaipa, Water Canyon, a tributary of Wildwood Canyon from the north. E-facing hillside below the stables (old Hunt Ranch), west of Water Canyon Rd",1009,34.025,-116.99167,,,,,cch2,1462116,,"Chaparral on hillside, cleared pasture (annual grassland) on alluvium.",http://cch2.org/portal/collections/individual/index.php?occid=1462116,CF,middle most left,1,Total,1,3,0,1,0,,,2.2
UCR0077151,4/8/1992,1992,4,8,99,integrifolia,San Bernardino,"east of Yucaipa, Water Canyon, a tributary of Wildwood Canyon from the north. E-facing hillside below the stables (old Hunt Ranch), west of Water Canyon Rd",1009,34.025,-116.99167,,,,,cch2,1462116,,"Chaparral on hillside, cleared pasture (annual grassland) on alluvium.",http://cch2.org/portal/collections/individual/index.php?occid=1462116,CF,top right of plant 1: petals at the top,2,Total,0,2,0,1,0,,,2.666666667
UCR0077151,4/8/1992,1992,4,8,99,integrifolia,San Bernardino,"east of Yucaipa, Water Canyon, a tributary of Wildwood Canyon from the north. E-facing hillside below the stables (old Hunt Ranch), west of Water Canyon Rd",1009,34.025,-116.99167,,,,,cch2,1462116,,"Chaparral on hillside, cleared pasture (annual grassland) on alluvium.",http://cch2.org/portal/collections/individual/index.php?occid=1462116,CF,single yellowish flower sticking up,3,Total,2,1,0,0,0,,,1.333333333
UCR0077151,4/8/1992,1992,4,8,99,integrifolia,San Bernardino,"east of Yucaipa, Water Canyon, a tributary of Wildwood Canyon from the north. E-facing hillside below the stables (old Hunt Ranch), west of Water Canyon Rd",1009,34.025,-116.99167,,,,,cch2,1462116,,"Chaparral on hillside, cleared pasture (annual grassland) on alluvium.",http://cch2.org/portal/collections/individual/index.php?occid=1462116,CF,highest reaching,4,Total,1,1,1,0,0,,,2
UCR0077151,4/8/1992,1992,4,8,99,integrifolia,San Bernardino,"east of Yucaipa, Water Canyon, a tributary of Wildwood Canyon from the north. E-facing hillside below the stables (old Hunt Ranch), west of Water Canyon Rd",1009,34.025,-116.99167,,,,,cch2,1462116,,"Chaparral on hillside, cleared pasture (annual grassland) on alluvium.",http://cch2.org/portal/collections/individual/index.php?occid=1462116,CF,right below plant 4; a little overlap,5,Total,1,1,0,0,0,,,1.5
UCR0077151,4/8/1992,1992,4,8,99,integrifolia,San Bernardino,"east of Yucaipa, Water Canyon, a tributary of Wildwood Canyon from the north. E-facing hillside below the stables (old Hunt Ranch), west of Water Canyon Rd",1009,34.025,-116.99167,,,,,cch2,1462116,,"Chaparral on hillside, cleared pasture (annual grassland) on alluvium.",http://cch2.org/portal/collections/individual/index.php?occid=1462116,CF,most right of first row,6,Total,1,0,0,0,0,,,1
UCR0077151,4/8/1992,1992,4,8,99,integrifolia,San Bernardino,"east of Yucaipa, Water Canyon, a tributary of Wildwood Canyon from the north. E-facing hillside below the stables (old Hunt Ranch), west of Water Canyon Rd",1009,34.025,-116.99167,,,,,cch2,1462116,,"Chaparral on hillside, cleared pasture (annual grassland) on alluvium.",http://cch2.org/portal/collections/individual/index.php?occid=1462116,CF,below plant 2; C shaped plant with one cotyledon persisting,7,Total,1,2,0,0,0,,,1.666666667
UCR0077151,4/8/1992,1992,4,8,99,integrifolia,San Bernardino,"east of Yucaipa, Water Canyon, a tributary of Wildwood Canyon from the north. E-facing hillside below the stables (old Hunt Ranch), west of Water Canyon Rd",1009,34.025,-116.99167,,,,,cch2,1462116,,"Chaparral on hillside, cleared pasture (annual grassland) on alluvium.",http://cch2.org/portal/collections/individual/index.php?occid=1462116,CF,root structure next to plant 7,8,Total,0,2,0,0,0,,,2
UCR0077151,4/8/1992,1992,4,8,99,integrifolia,San Bernardino,"east of Yucaipa, Water Canyon, a tributary of Wildwood Canyon from the north. E-facing hillside below the stables (old Hunt Ranch), west of Water Canyon Rd",1009,34.025,-116.99167,,,,,cch2,1462116,,"Chaparral on hillside, cleared pasture (annual grassland) on alluvium.",http://cch2.org/portal/collections/individual/index.php?occid=1462116,CF,horizontal plant,9,Total,1,1,0,0,0,,,1.5
UCR0077151,4/8/1992,1992,4,8,99,integrifolia,San Bernardino,"east of Yucaipa, Water Canyon, a tributary of Wildwood Canyon from the north. E-facing hillside below the stables (old Hunt Ranch), west of Water Canyon Rd",1009,34.025,-116.99167,,,,,cch2,1462116,,"Chaparral on hillside, cleared pasture (annual grassland) on alluvium.",http://cch2.org/portal/collections/individual/index.php?occid=1462116,CF,"next to plant 9, root at top",10,Total,1,1,0,0,0,,,1.5
UCR0077151,4/8/1992,1992,4,8,99,integrifolia,San Bernardino,"east of Yucaipa, Water Canyon, a tributary of Wildwood Canyon from the north. E-facing hillside below the stables (old Hunt Ranch), west of Water Canyon Rd",1009,34.025,-116.99167,,,,,cch2,1462116,,"Chaparral on hillside, cleared pasture (annual grassland) on alluvium.",http://cch2.org/portal/collections/individual/index.php?occid=1462116,CF,"next to plant 10, root at bottom",11,Total,2,1,0,0,0,,,1.333333333
UCR0077151,4/8/1992,1992,4,8,99,integrifolia,San Bernardino,"east of Yucaipa, Water Canyon, a tributary of Wildwood Canyon from the north. E-facing hillside below the stables (old Hunt Ranch), west of Water Canyon Rd",1009,34.025,-116.99167,,,,,cch2,1462116,,"Chaparral on hillside, cleared pasture (annual grassland) on alluvium.",http://cch2.org/portal/collections/individual/index.php?occid=1462116,CF,"next to plant 11, root at bottom",12,Total,0,2,0,1,0,,,2.666666667
UCR0077151,4/8/1992,1992,4,8,99,integrifolia,San Bernardino,"east of Yucaipa, Water Canyon, a tributary of Wildwood Canyon from the north. E-facing hillside below the stables (old Hunt Ranch), west of Water Canyon Rd",1009,34.025,-116.99167,,,,,cch2,1462116,,"Chaparral on hillside, cleared pasture (annual grassland) on alluvium.",http://cch2.org/portal/collections/individual/index.php?occid=1462116,CF,second to right in middle row,13,Total,3,0,1,0,0,,,1.5
UCR0077151,4/8/1992,1992,4,8,99,integrifolia,San Bernardino,"east of Yucaipa, Water Canyon, a tributary of Wildwood Canyon from the north. E-facing hillside below the stables (old Hunt Ranch), west of Water Canyon Rd",1009,34.025,-116.99167,,,,,cch2,1462116,,"Chaparral on hillside, cleared pasture (annual grassland) on alluvium.",http://cch2.org/portal/collections/individual/index.php?occid=1462116,CF,"bottom left, two cotyledons visible",14,Total,2,1,0,0,0,,,1.333333333
UCR0077151,4/8/1992,1992,4,8,99,integrifolia,San Bernardino,"east of Yucaipa, Water Canyon, a tributary of Wildwood Canyon from the north. E-facing hillside below the stables (old Hunt Ranch), west of Water Canyon Rd",1009,34.025,-116.99167,,,,,cch2,1462116,,"Chaparral on hillside, cleared pasture (annual grassland) on alluvium.",http://cch2.org/portal/collections/individual/index.php?occid=1462116,CF,most bottom,15,Total,1,0,0,0,0,,,1
UCR0077151,4/8/1992,1992,4,8,99,integrifolia,San Bernardino,"east of Yucaipa, Water Canyon, a tributary of Wildwood Canyon from the north. E-facing hillside below the stables (old Hunt Ranch), west of Water Canyon Rd",1009,34.025,-116.99167,,,,,cch2,1462116,,"Chaparral on hillside, cleared pasture (annual grassland) on alluvium.",http://cch2.org/portal/collections/individual/index.php?occid=1462116,CF,"above plant 15, left root structure",16,Total,1,0,0,0,0,,,1
UCR0077151,4/8/1992,1992,4,8,99,integrifolia,San Bernardino,"east of Yucaipa, Water Canyon, a tributary of Wildwood Canyon from the north. E-facing hillside below the stables (old Hunt Ranch), west of Water Canyon Rd",1009,34.025,-116.99167,,,,,cch2,1462116,,"Chaparral on hillside, cleared pasture (annual grassland) on alluvium.",http://cch2.org/portal/collections/individual/index.php?occid=1462116,CF,"above plant 15, top right root structure",17,Total,1,0,0,0,0,,,1
UCR0077151,4/8/1992,1992,4,8,99,integrifolia,San Bernardino,"east of Yucaipa, Water Canyon, a tributary of Wildwood Canyon from the north. E-facing hillside below the stables (old Hunt Ranch), west of Water Canyon Rd",1009,34.025,-116.99167,,,,,cch2,1462116,,"Chaparral on hillside, cleared pasture (annual grassland) on alluvium.",http://cch2.org/portal/collections/individual/index.php?occid=1462116,CF,bottom right,18,Total,1,0,0,0,0,,,1
UCR0077141,4/4/1998,1998,4,4,94,,San Bernardino,"Colton: c. 0.3 km north of Little Highgrove (pk 1478), c. 0.8 km west of the corner of Barton Rd. and La Cadena Dr.",412,34.032,-117.342,,,,,cch2,1494676,,"Dry granitic slopes with coastal sage scrub; associated with Encelia farinosa, Guttierezia californica, Solanum xanti, Salvia apiana, Salvia mellifera, and Lessingia filaginifolia.",http://cch2.org/portal/collections/individual/index.php?occid=1494676,JN,plant is missing several stems and connections can't be determined with certainty,NA,Total,,,,,,y,y,#DIV/0!
UCR0077106,5/2/1974,1974,5,2,122,integrifolia,Riverside,Banning Canyon,1524,34.03333,-116.86056,,,,,cch2,1447222,,Roadside in chaparral.,http://cch2.org/portal/collections/individual/index.php?occid=1447222,CF,,1,Total,15,19,3,11,6,,,2.518518519
UCR0077106,5/2/1974,1974,5,2,122,integrifolia,Riverside,Banning Canyon,1524,34.03333,-116.86056,,,,,cch2,1447222,,Roadside in chaparral.,http://cch2.org/portal/collections/individual/index.php?occid=1447222,CF,,2,Total,10,18,3,9,6,,,2.630434783
UCR0077168,5/7/1999,1999,5,7,127,integrifolia,San Bernardino,0.25 to 0.75 miles NE of the Riverside Ave. crossing,244,34.03333,-117.38333,,,,,cch2,1481033,,"Sandy mesas just up out of the active river channel. Associated with Gilia capitata, Cryptantha muricata, Cryptantha micrantha, Cryptantha intermedia, Eriogonum thurberi, and Pectocarya linearis.",http://cch2.org/portal/collections/individual/index.php?occid=1481033,CF,,1,Total,1,3,4,5,10,,,3.869565217
UCR0077142,2/28/1998,1998,2,28,59,,San Bernardino,"Wilders Canyon Pass, Fontana city limits, c. 0.5 miles SE of corner of Citrus Ave. and Poplar Ave.",427,34.03556,-117.4575,,,,,cch2,3137227,,"Gently sloping meadow with sandy soil on mountain pass; very moist in places. Associated with Encelia farinosa, Lessingia filaginifolia, Helianthus annuus, Gutierrezia californica, Phacelia minor, and Calochortus plummerae.",http://cch2.org/portal/collections/individual/index.php?occid=3137227,CF,plant is really dark so some structures not scored due to uncertainty; only middle plant counted as other two don't have clear roots or persisting cotyledons,1,Total,6,1,0,0,0,,,1.142857143
UCR0077157,4/15/1995,1995,4,15,105,,San Bernardino,"Fontana, east slopes of the Jurupa Hills, south of Jurupa Hills Regional Park, west of Sierra Ave, NE of Mt. Jurupa",366,34.03917,-117.44028,,,,,cch2,1476999,,Coastal sage scrub and patches of chaparral on steep granitic slopes.,http://cch2.org/portal/collections/individual/index.php?occid=1476999,CF,,1,Total,19,22,11,20,13,,,2.835294118
UCR0077144,2/25/1997,1997,2,25,56,menziesii,San Bernardino,"Jurupa Hills: Mary Vagl Museum and Nature Center, Cypress St., Fontana",401.77,34.04167,-117.45,,,,,cch2,1476993,,"Dry N-facing hillside with large boulders and rock outcrops, along seasonal stream. Assoc. with Amsinckia intermedia, Eucrypta chrysanthemifolia, Rhamnus crocea, Ceanothus crassifolius, Crassula connata, introduced weeds.",http://cch2.org/portal/collections/individual/index.php?occid=1476993,CF,,1,Total,5,5,0,1,0,,,1.727272727
UCR0077139,4/30/2001,2001,4,30,120,,San Bernardino,"Redlands, east side of Sand Canyon Road, near Crafton Hills College",633,34.04444,-117.115,,,,,cch2,1503943,,"Disturbed rocky clay, southfacing slopes, full sun. Very degraded chaparral, indications of clearing and pasture use; numerous exotic grasses with remnants of native vegetation. Generally with Bromus spp., Eriogonum fasciculatum, Artemisia californica, Phacelia, Bloomeria.",http://cch2.org/portal/collections/individual/index.php?occid=1503943,CF,no clear root; clippings,NA,,,,,,,y,y,#DIV/0!
UCR0077137,4/28/1975,1975,4,28,118,integrifolia,San Bernardino,"near Black Rock Spring, Joshua Tree National Monument",1341,34.05667,-116.395,,,,,cch2,1462120,,"Assoc. with Juniperus, Quercus, Pinus, Eriogonum fasciculatum, and Haplopappus linearifolius.",http://cch2.org/portal/collections/individual/index.php?occid=1462120,CF,second from left with lighter root,1,Total,1,1,0,0,0,,,1.5
UCR0077137,4/28/1975,1975,4,28,118,integrifolia,San Bernardino,"near Black Rock Spring, Joshua Tree National Monument",1341,34.05667,-116.395,,,,,cch2,1462120,,"Assoc. with Juniperus, Quercus, Pinus, Eriogonum fasciculatum, and Haplopappus linearifolius.",http://cch2.org/portal/collections/individual/index.php?occid=1462120,CF,fourth from bottom left,2,Total,1,3,1,0,0,,,2
UCR0077137,4/28/1975,1975,4,28,118,integrifolia,San Bernardino,"near Black Rock Spring, Joshua Tree National Monument",1341,34.05667,-116.395,,,,,cch2,1462120,,"Assoc. with Juniperus, Quercus, Pinus, Eriogonum fasciculatum, and Haplopappus linearifolius.",http://cch2.org/portal/collections/individual/index.php?occid=1462120,CF,top right of plant 2,3,Total,0,1,0,0,0,,,2
UCR0077169,5/11/1996,1996,5,11,132,,San Bernardino,"San Bernardino Nat. Forest, Audubon Societys Bearpaw Ranch Sanctuary, below Forest Falls. Just off Calif. Hwy 38 turnoff to Forest Falls, south of Mill Creek, in vicinity of University Creek",1341,34.09167,-116.95833,,,,,cch2,1465881,,"Pine/oak chaparral; soil sandy/gravelly decomposed granite. Assoc. with Pinus, Quercus, Fraxinus, Acer macrophyllum, etc.",http://cch2.org/portal/collections/individual/index.php?occid=1465881,CF,top left (there are plants/clippings on this sheet that are a different species),1,Total,0,1,0,0,0,,,2
UCR0077169,5/11/1996,1996,5,11,132,,San Bernardino,"San Bernardino Nat. Forest, Audubon Societys Bearpaw Ranch Sanctuary, below Forest Falls. Just off Calif. Hwy 38 turnoff to Forest Falls, south of Mill Creek, in vicinity of University Creek",1341,34.09167,-116.95833,,,,,cch2,1465881,,"Pine/oak chaparral; soil sandy/gravelly decomposed granite. Assoc. with Pinus, Quercus, Fraxinus, Acer macrophyllum, etc.",http://cch2.org/portal/collections/individual/index.php?occid=1465881,CF,,2,Total,0,1,1,1,0,,,3
UCR0077169,5/11/1996,1996,5,11,132,,San Bernardino,"San Bernardino Nat. Forest, Audubon Societys Bearpaw Ranch Sanctuary, below Forest Falls. Just off Calif. Hwy 38 turnoff to Forest Falls, south of Mill Creek, in vicinity of University Creek",1341,34.09167,-116.95833,,,,,cch2,1465881,,"Pine/oak chaparral; soil sandy/gravelly decomposed granite. Assoc. with Pinus, Quercus, Fraxinus, Acer macrophyllum, etc.",http://cch2.org/portal/collections/individual/index.php?occid=1465881,CF,,3,Total,1,1,0,1,0,,,2.333333333
UCR0077169,5/11/1996,1996,5,11,132,,San Bernardino,"San Bernardino Nat. Forest, Audubon Societys Bearpaw Ranch Sanctuary, below Forest Falls. Just off Calif. Hwy 38 turnoff to Forest Falls, south of Mill Creek, in vicinity of University Creek",1341,34.09167,-116.95833,,,,,cch2,1465881,,"Pine/oak chaparral; soil sandy/gravelly decomposed granite. Assoc. with Pinus, Quercus, Fraxinus, Acer macrophyllum, etc.",http://cch2.org/portal/collections/individual/index.php?occid=1465881,CF,small curved plant at top right,4,Total,0,0,0,2,0,,,4
UCR0077169,5/11/1996,1996,5,11,132,,San Bernardino,"San Bernardino Nat. Forest, Audubon Societys Bearpaw Ranch Sanctuary, below Forest Falls. Just off Calif. Hwy 38 turnoff to Forest Falls, south of Mill Creek, in vicinity of University Creek",1341,34.09167,-116.95833,,,,,cch2,1465881,,"Pine/oak chaparral; soil sandy/gravelly decomposed granite. Assoc. with Pinus, Quercus, Fraxinus, Acer macrophyllum, etc.",http://cch2.org/portal/collections/individual/index.php?occid=1465881,CF,,5,Total,1,3,1,3,0,,,2.75
UCR0077169,5/11/1996,1996,5,11,132,,San Bernardino,"San Bernardino Nat. Forest, Audubon Societys Bearpaw Ranch Sanctuary, below Forest Falls. Just off Calif. Hwy 38 turnoff to Forest Falls, south of Mill Creek, in vicinity of University Creek",1341,34.09167,-116.95833,,,,,cch2,1465881,,"Pine/oak chaparral; soil sandy/gravelly decomposed granite. Assoc. with Pinus, Quercus, Fraxinus, Acer macrophyllum, etc.",http://cch2.org/portal/collections/individual/index.php?occid=1465881,CF,,6,Total,1,2,1,2,0,,,2.666666667
UCR0077169,5/11/1996,1996,5,11,132,,San Bernardino,"San Bernardino Nat. Forest, Audubon Societys Bearpaw Ranch Sanctuary, below Forest Falls. Just off Calif. Hwy 38 turnoff to Forest Falls, south of Mill Creek, in vicinity of University Creek",1341,34.09167,-116.95833,,,,,cch2,1465881,,"Pine/oak chaparral; soil sandy/gravelly decomposed granite. Assoc. with Pinus, Quercus, Fraxinus, Acer macrophyllum, etc.",http://cch2.org/portal/collections/individual/index.php?occid=1465881,CF,,7,Total,0,4,1,4,0,,,3
UCR0077169,5/11/1996,1996,5,11,132,,San Bernardino,"San Bernardino Nat. Forest, Audubon Societys Bearpaw Ranch Sanctuary, below Forest Falls. Just off Calif. Hwy 38 turnoff to Forest Falls, south of Mill Creek, in vicinity of University Creek",1341,34.09167,-116.95833,,,,,cch2,1465881,,"Pine/oak chaparral; soil sandy/gravelly decomposed granite. Assoc. with Pinus, Quercus, Fraxinus, Acer macrophyllum, etc.",http://cch2.org/portal/collections/individual/index.php?occid=1465881,CF,,8,Total,0,1,0,4,0,,,3.6
UCR0077148,5/20/1971,1971,5,20,140,integrifolia,San Bernardino,hillside above Mill Creek near Thurman Flats,1037,34.10167,-117.01083,,,,,cch2,1447231,,,http://cch2.org/portal/collections/individual/index.php?occid=1447231,WW,double checked - JN,1,Total,23,30,22,30,16,,,2.884297521
UCR0077134,4/9/2004,2004,4,9,100,integrifolia,San Bernardino,"UC Burns Pinyon Ridge Reserve, c. 1.5 mi east of Pioneertown, NW portion near camping area",1256,34.14722,-116.45694,,,,,cch2,1567120,,"Pinyon-juniper woodland with Yucca brevifolia, Pinus monophylla, Juniperus californica, Quercus turbinella, etc.",http://cch2.org/portal/collections/individual/index.php?occid=1567120,WW,skipped overlapping plants; leaves dont look like nemophila,1,Total,0,0,1,3,1,,,4
UCR0077134,4/9/2004,2004,4,9,100,integrifolia,San Bernardino,"UC Burns Pinyon Ridge Reserve, c. 1.5 mi east of Pioneertown, NW portion near camping area",1256,34.14722,-116.45694,,,,,cch2,1567120,,"Pinyon-juniper woodland with Yucca brevifolia, Pinus monophylla, Juniperus californica, Quercus turbinella, etc.",http://cch2.org/portal/collections/individual/index.php?occid=1567120,WW,,2,Total,2,0,1,1,0,,,2.25
UCR0077140,4/5/2003,2003,4,5,95,,San Bernardino,"UC Burns Pinyon Ridge Reserve, off Skyline Ranch Rd. c. 2 miles (air) ESE of Pioneertown, 1.5 mi. (air) NW of Yucca Valley, between front gate and reserve headquarters at old Burns home",1250,34.14917,-116.45583,,,,,cch2,1537376,,"Flats and bouldery granitic hills, decomposed granite soil; pinyon-juniper woodland with Juniperus, Pinus monophylla, Quercus cornelius-mulleri, Eriogonum fasciculatum, Yucca schidigera, etc.",http://cch2.org/portal/collections/individual/index.php?occid=1537376,WW,,1,Total,1,1,0,1,0,,,2.333333333
UCR0077140,4/5/2003,2003,4,5,95,,San Bernardino,"UC Burns Pinyon Ridge Reserve, off Skyline Ranch Rd. c. 2 miles (air) ESE of Pioneertown, 1.5 mi. (air) NW of Yucca Valley, between front gate and reserve headquarters at old Burns home",1250,34.14917,-116.45583,,,,,cch2,1537376,,"Flats and bouldery granitic hills, decomposed granite soil; pinyon-juniper woodland with Juniperus, Pinus monophylla, Quercus cornelius-mulleri, Eriogonum fasciculatum, Yucca schidigera, etc.",http://cch2.org/portal/collections/individual/index.php?occid=1537376,WW,middle plant,2,Total,2,2,0,2,1,,,2.714285714
UCR0077140,4/5/2003,2003,4,5,95,,San Bernardino,"UC Burns Pinyon Ridge Reserve, off Skyline Ranch Rd. c. 2 miles (air) ESE of Pioneertown, 1.5 mi. (air) NW of Yucca Valley, between front gate and reserve headquarters at old Burns home",1250,34.14917,-116.45583,,,,,cch2,1537376,,"Flats and bouldery granitic hills, decomposed granite soil; pinyon-juniper woodland with Juniperus, Pinus monophylla, Quercus cornelius-mulleri, Eriogonum fasciculatum, Yucca schidigera, etc.",http://cch2.org/portal/collections/individual/index.php?occid=1537376,WW,right most plant,3,Total,2,3,0,2,0,,,2.285714286
UCR0077140,4/5/2003,2003,4,5,95,,San Bernardino,"UC Burns Pinyon Ridge Reserve, off Skyline Ranch Rd. c. 2 miles (air) ESE of Pioneertown, 1.5 mi. (air) NW of Yucca Valley, between front gate and reserve headquarters at old Burns home",1250,34.14917,-116.45583,,,,,cch2,1537376,,"Flats and bouldery granitic hills, decomposed granite soil; pinyon-juniper woodland with Juniperus, Pinus monophylla, Quercus cornelius-mulleri, Eriogonum fasciculatum, Yucca schidigera, etc.",http://cch2.org/portal/collections/individual/index.php?occid=1537376,WW,bottom left,4,Total,5,1,1,2,1,,,2.3
UCR0077026,5/20/1989,1989,5,20,140,integrifolia,Los Angeles,"Glendora Wilderness Park, Water Pipe Canyon [=Pavil Cyn] a tributary of Big Dalton Canyon",442,34.16389,-117.81639,,,,,cch2,1598556,,Vegetation a mixture of oak woodland and chaparral.,http://cch2.org/portal/collections/individual/index.php?occid=1598556,WW,no whole plant,NA,,,,,,,y,y,#DIV/0!
UCR0077008,3/26/2011,2011,3,26,85,menziesii,Los Angeles,"San Dimas Experimental Forest, West Fork San Dimas Canyon, 0.1 to 0.6 mile upstream from confluence with San Dimas Cyn.",476,34.16861,-117.77222,,,,,cch2,1687882,,"Canyon bottom riparian woodland surrounded by chaparral & coastal sage scrub, last burned 9 years ago, many cultivated plants persisting, dominants incl. Quercus chr., Q. agrifolia, Baccharis salicif., Ceanothus oli., Salix las., Alnus, & Platanus, also w/ Scutellaria tub., Lithophragma het., Plantago lan., Vanegasia, Ageratina, Nerium, Aspidotus ca., Pentagramma tri., etc.",http://cch2.org/portal/collections/individual/index.php?occid=1687882,WW,skipped overlapping plants,1,Total,5,3,5,3,4,,,2.9
UCR0077013,3/22/2011,2011,3,22,81,menziesii,Los Angeles,"mouth of Keril Canyon, tributary from east of Big Dalton Cyn., just below Big Dalton Cyn. Dam",509,34.16889,-117.80861,,,,,cch2,1686300,,"Cyn. bottom & surrounding slopes; chaparral & coastal sage scrub, surrounding slight riparian on bottom; dominants include Ceanothus cras., Adenostoma fasc., Artemisia calif., Acmispon glaber, Lonicera subspi., with Phacelia minor, Cryptantha muric., Muhlenbergia micros., Ceanothus oligan., Rhus arom., Nemophila men., Peonia cal., Delphinium parr., Ribes malv., Acer macr., etc.",http://cch2.org/portal/collections/individual/index.php?occid=1686300,WW,,1,Total,1,2,0,1,0,,,2.25
UCR0077017,4/11/2008,2008,4,11,102,,Los Angeles,"San Dimas Experimental Forest, Lewis Paul Canyon, above waterfall at junction of Big Dalton Cyn. Rd.",549,34.17028,-117.81278,,,,,cch2,1622506,,"Canyon bottom with riparian forest surrounded by coastal sage scrub, chaparral and oak woodland, with Ceanothus oliganthus, Salix lasiolepis, Baccharis salicifolia, Rubus californicus, Ageratina adenophora, Ribes, Quercus durata, Nicotiana glauca, etc.",http://cch2.org/portal/collections/individual/index.php?occid=1622506,WW,,1,Total,2,1,0,0,0,,,1.333333333
UCR0077017,4/11/2008,2008,4,11,102,,Los Angeles,"San Dimas Experimental Forest, Lewis Paul Canyon, above waterfall at junction of Big Dalton Cyn. Rd.",549,34.17028,-117.81278,,,,,cch2,1622506,,"Canyon bottom with riparian forest surrounded by coastal sage scrub, chaparral and oak woodland, with Ceanothus oliganthus, Salix lasiolepis, Baccharis salicifolia, Rubus californicus, Ageratina adenophora, Ribes, Quercus durata, Nicotiana glauca, etc.",http://cch2.org/portal/collections/individual/index.php?occid=1622506,WW,,2,Total,0,1,0,0,0,,,2
UCR0077017,4/11/2008,2008,4,11,102,,Los Angeles,"San Dimas Experimental Forest, Lewis Paul Canyon, above waterfall at junction of Big Dalton Cyn. Rd.",549,34.17028,-117.81278,,,,,cch2,1622506,,"Canyon bottom with riparian forest surrounded by coastal sage scrub, chaparral and oak woodland, with Ceanothus oliganthus, Salix lasiolepis, Baccharis salicifolia, Rubus californicus, Ageratina adenophora, Ribes, Quercus durata, Nicotiana glauca, etc.",http://cch2.org/portal/collections/individual/index.php?occid=1622506,WW,,3,Total,2,2,1,0,0,,,1.8
UCR0077017,4/11/2008,2008,4,11,102,,Los Angeles,"San Dimas Experimental Forest, Lewis Paul Canyon, above waterfall at junction of Big Dalton Cyn. Rd.",549,34.17028,-117.81278,,,,,cch2,1622506,,"Canyon bottom with riparian forest surrounded by coastal sage scrub, chaparral and oak woodland, with Ceanothus oliganthus, Salix lasiolepis, Baccharis salicifolia, Rubus californicus, Ageratina adenophora, Ribes, Quercus durata, Nicotiana glauca, etc.",http://cch2.org/portal/collections/individual/index.php?occid=1622506,WW,wrapped around plant 3; appears whole,4,Total,0,0,0,0,0,,,#DIV/0!
UCR0077017,4/11/2008,2008,4,11,102,,Los Angeles,"San Dimas Experimental Forest, Lewis Paul Canyon, above waterfall at junction of Big Dalton Cyn. Rd.",549,34.17028,-117.81278,,,,,cch2,1622506,,"Canyon bottom with riparian forest surrounded by coastal sage scrub, chaparral and oak woodland, with Ceanothus oliganthus, Salix lasiolepis, Baccharis salicifolia, Rubus californicus, Ageratina adenophora, Ribes, Quercus durata, Nicotiana glauca, etc.",http://cch2.org/portal/collections/individual/index.php?occid=1622506,WW,,5,Total,2,2,1,0,0,,,1.8
UCR0077017,4/11/2008,2008,4,11,102,,Los Angeles,"San Dimas Experimental Forest, Lewis Paul Canyon, above waterfall at junction of Big Dalton Cyn. Rd.",549,34.17028,-117.81278,,,,,cch2,1622506,,"Canyon bottom with riparian forest surrounded by coastal sage scrub, chaparral and oak woodland, with Ceanothus oliganthus, Salix lasiolepis, Baccharis salicifolia, Rubus californicus, Ageratina adenophora, Ribes, Quercus durata, Nicotiana glauca, etc.",http://cch2.org/portal/collections/individual/index.php?occid=1622506,WW,,6,Total,0,2,1,0,0,,,2.333333333
UCR0077017,4/11/2008,2008,4,11,102,,Los Angeles,"San Dimas Experimental Forest, Lewis Paul Canyon, above waterfall at junction of Big Dalton Cyn. Rd.",549,34.17028,-117.81278,,,,,cch2,1622506,,"Canyon bottom with riparian forest surrounded by coastal sage scrub, chaparral and oak woodland, with Ceanothus oliganthus, Salix lasiolepis, Baccharis salicifolia, Rubus californicus, Ageratina adenophora, Ribes, Quercus durata, Nicotiana glauca, etc.",http://cch2.org/portal/collections/individual/index.php?occid=1622506,WW,,7,Total,4,3,0,1,0,,,1.75
UCR0077133,4/4/1998,1998,4,4,94,,San Bernardino,"Stoddard Canyon off San Antonio Canyon, north of Upland",747,34.175,-117.67222,,,,,cch2,1569463,,"Chaparral and coastal sage scrub; with Eriodictyon trichocalyx, Artemisia californica, etc.",http://cch2.org/portal/collections/individual/index.php?occid=1569463,WW,,1,Total,1,3,3,1,0,,,2.5
UCR0077133,4/4/1998,1998,4,4,94,,San Bernardino,"Stoddard Canyon off San Antonio Canyon, north of Upland",747,34.175,-117.67222,,,,,cch2,1569463,,"Chaparral and coastal sage scrub; with Eriodictyon trichocalyx, Artemisia californica, etc.",http://cch2.org/portal/collections/individual/index.php?occid=1569463,WW,,2,Total,1,3,2,5,1,,,3.166666667
UCR0077133,4/4/1998,1998,4,4,94,,San Bernardino,"Stoddard Canyon off San Antonio Canyon, north of Upland",747,34.175,-117.67222,,,,,cch2,1569463,,"Chaparral and coastal sage scrub; with Eriodictyon trichocalyx, Artemisia californica, etc.",http://cch2.org/portal/collections/individual/index.php?occid=1569463,WW,,3,Total,2,3,0,5,0,,,2.8
UCR0077146,4/20/1994,1994,4,20,110,,San Bernardino,Foothills; mouth of Day Canyon at N end of Etiwanda Ave. Oak Summit project,610,34.17611,-117.53694,,,,,cch2,1476994,,,http://cch2.org/portal/collections/individual/index.php?occid=1476994,WW,clipping,NA,,,,,,,y,y,#DIV/0!
UCR0077108,4/26/1998,1998,4,26,116,,San Bernardino,"1.9 mi. south on dirt road from Glen Helen Parkway South, east side of Lytle Creek Wash",549,34.18278,-117.40861,,,,,cch2,1658662,,"Alluvial slopes; scrub dominated by Artemisia californica, with Lessingia filaginifolia, Ceanothus crassifolius, Gutierrezia californica, Navarretia, Filago gallica, F. californica, Stylocline gnaphaloides, Conyza, Centaurea melitensis, Rafinesquia californica, Tetradymia comosa, Lasthenia gracilis, etc. Site subsequently developed and vegetation destroyed.",http://cch2.org/portal/collections/individual/index.php?occid=1658662,WW,all clippings,NA,,,,,,,y,y,#DIV/0!
UCR0077166,3/17/1988,1988,3,17,77,,San Bernardino,"[Yucca Valley] along Hwy 247, c. 2.25 mi NW of El Cortez Road",1128,34.18611,-116.43167,,,,,cch2,1462121,,"Volcanic soils with annual grassland on the W side of road, with Erodium cicutarium, Bromus rubens, and Sidalcea. Joshua tree woodland on granitic soils on E side of road, with Yucca brevifolia, Coleogyne ramosissima, and many flowering annuals in sandy openings",http://cch2.org/portal/collections/individual/index.php?occid=1462121,WW,,1,Total,6,1,4,0,0,,,1.818181818
UCR0077166,3/17/1988,1988,3,17,77,,San Bernardino,"[Yucca Valley] along Hwy 247, c. 2.25 mi NW of El Cortez Road",1128,34.18611,-116.43167,,,,,cch2,1462121,,"Volcanic soils with annual grassland on the W side of road, with Erodium cicutarium, Bromus rubens, and Sidalcea. Joshua tree woodland on granitic soils on E side of road, with Yucca brevifolia, Coleogyne ramosissima, and many flowering annuals in sandy openings",http://cch2.org/portal/collections/individual/index.php?occid=1462121,WW,,2,Total,4,1,1,0,0,,,1.5
UCR0077166,3/17/1988,1988,3,17,77,,San Bernardino,"[Yucca Valley] along Hwy 247, c. 2.25 mi NW of El Cortez Road",1128,34.18611,-116.43167,,,,,cch2,1462121,,"Volcanic soils with annual grassland on the W side of road, with Erodium cicutarium, Bromus rubens, and Sidalcea. Joshua tree woodland on granitic soils on E side of road, with Yucca brevifolia, Coleogyne ramosissima, and many flowering annuals in sandy openings",http://cch2.org/portal/collections/individual/index.php?occid=1462121,WW,,3,Total,1,2,0,0,0,,,1.666666667
UCR0077166,3/17/1988,1988,3,17,77,,San Bernardino,"[Yucca Valley] along Hwy 247, c. 2.25 mi NW of El Cortez Road",1128,34.18611,-116.43167,,,,,cch2,1462121,,"Volcanic soils with annual grassland on the W side of road, with Erodium cicutarium, Bromus rubens, and Sidalcea. Joshua tree woodland on granitic soils on E side of road, with Yucca brevifolia, Coleogyne ramosissima, and many flowering annuals in sandy openings",http://cch2.org/portal/collections/individual/index.php?occid=1462121,WW,fruit determined by pedicel thickness,4,Total,3,2,4,1,0,,,2.3
UCR0077166,3/17/1988,1988,3,17,77,,San Bernardino,"[Yucca Valley] along Hwy 247, c. 2.25 mi NW of El Cortez Road",1128,34.18611,-116.43167,,,,,cch2,1462121,,"Volcanic soils with annual grassland on the W side of road, with Erodium cicutarium, Bromus rubens, and Sidalcea. Joshua tree woodland on granitic soils on E side of road, with Yucca brevifolia, Coleogyne ramosissima, and many flowering annuals in sandy openings",http://cch2.org/portal/collections/individual/index.php?occid=1462121,WW,,5,Total,3,3,1,0,0,,,1.714285714
UCR0077166,3/17/1988,1988,3,17,77,,San Bernardino,"[Yucca Valley] along Hwy 247, c. 2.25 mi NW of El Cortez Road",1128,34.18611,-116.43167,,,,,cch2,1462121,,"Volcanic soils with annual grassland on the W side of road, with Erodium cicutarium, Bromus rubens, and Sidalcea. Joshua tree woodland on granitic soils on E side of road, with Yucca brevifolia, Coleogyne ramosissima, and many flowering annuals in sandy openings",http://cch2.org/portal/collections/individual/index.php?occid=1462121,WW,,6,Total,1,0,1,0,0,,,2
UCR0077166,3/17/1988,1988,3,17,77,,San Bernardino,"[Yucca Valley] along Hwy 247, c. 2.25 mi NW of El Cortez Road",1128,34.18611,-116.43167,,,,,cch2,1462121,,"Volcanic soils with annual grassland on the W side of road, with Erodium cicutarium, Bromus rubens, and Sidalcea. Joshua tree woodland on granitic soils on E side of road, with Yucca brevifolia, Coleogyne ramosissima, and many flowering annuals in sandy openings",http://cch2.org/portal/collections/individual/index.php?occid=1462121,WW,,7,Total,3,0,0,0,0,,,1
UCR0077166,3/17/1988,1988,3,17,77,,San Bernardino,"[Yucca Valley] along Hwy 247, c. 2.25 mi NW of El Cortez Road",1128,34.18611,-116.43167,,,,,cch2,1462121,,"Volcanic soils with annual grassland on the W side of road, with Erodium cicutarium, Bromus rubens, and Sidalcea. Joshua tree woodland on granitic soils on E side of road, with Yucca brevifolia, Coleogyne ramosissima, and many flowering annuals in sandy openings",http://cch2.org/portal/collections/individual/index.php?occid=1462121,WW,,8,Total,3,2,0,0,0,,,1.4
UCR0077166,3/17/1988,1988,3,17,77,,San Bernardino,"[Yucca Valley] along Hwy 247, c. 2.25 mi NW of El Cortez Road",1128,34.18611,-116.43167,,,,,cch2,1462121,,"Volcanic soils with annual grassland on the W side of road, with Erodium cicutarium, Bromus rubens, and Sidalcea. Joshua tree woodland on granitic soils on E side of road, with Yucca brevifolia, Coleogyne ramosissima, and many flowering annuals in sandy openings",http://cch2.org/portal/collections/individual/index.php?occid=1462121,WW,,9,Total,2,2,1,3,0,,,2.625
UCR0077024,4/26/1998,1998,4,26,116,integrifolia,Los Angeles,"Browns Flat, San Dimas Experimental Forest",1317,34.18778,-117.72111,,,,,cch2,1601564,,"Grassy flat surrounded by chaparral and coastal sage scrub; assoc. with Bromus tectorum, Poa secunda, Festuca myuros, Delphinium patens, etc.",http://cch2.org/portal/collections/individual/index.php?occid=1601564,WW,intergrafolia parish? five spotted flowers present,1,Total,1,2,2,3,3,,,3.454545455
UCR0077024,4/26/1998,1998,4,26,116,integrifolia,Los Angeles,"Browns Flat, San Dimas Experimental Forest",1317,34.18778,-117.72111,,,,,cch2,1601564,,"Grassy flat surrounded by chaparral and coastal sage scrub; assoc. with Bromus tectorum, Poa secunda, Festuca myuros, Delphinium patens, etc.",http://cch2.org/portal/collections/individual/index.php?occid=1601564,WW,,2,Total,1,2,0,1,0,,,2.25
UCR0077024,4/26/1998,1998,4,26,116,integrifolia,Los Angeles,"Browns Flat, San Dimas Experimental Forest",1317,34.18778,-117.72111,,,,,cch2,1601564,,"Grassy flat surrounded by chaparral and coastal sage scrub; assoc. with Bromus tectorum, Poa secunda, Festuca myuros, Delphinium patens, etc.",http://cch2.org/portal/collections/individual/index.php?occid=1601564,WW,super blurry,3,Total,2,3,0,4,1,,,2.9
UCR0077024,4/26/1998,1998,4,26,116,integrifolia,Los Angeles,"Browns Flat, San Dimas Experimental Forest",1317,34.18778,-117.72111,,,,,cch2,1601564,,"Grassy flat surrounded by chaparral and coastal sage scrub; assoc. with Bromus tectorum, Poa secunda, Festuca myuros, Delphinium patens, etc.",http://cch2.org/portal/collections/individual/index.php?occid=1601564,WW,,4,Total,2,0,2,2,0,,,2.666666667
UCR0077024,4/26/1998,1998,4,26,116,integrifolia,Los Angeles,"Browns Flat, San Dimas Experimental Forest",1317,34.18778,-117.72111,,,,,cch2,1601564,,"Grassy flat surrounded by chaparral and coastal sage scrub; assoc. with Bromus tectorum, Poa secunda, Festuca myuros, Delphinium patens, etc.",http://cch2.org/portal/collections/individual/index.php?occid=1601564,WW,,5,Total,2,3,3,2,0,,,2.5
UCR0077024,4/26/1998,1998,4,26,116,integrifolia,Los Angeles,"Browns Flat, San Dimas Experimental Forest",1317,34.18778,-117.72111,,,,,cch2,1601564,,"Grassy flat surrounded by chaparral and coastal sage scrub; assoc. with Bromus tectorum, Poa secunda, Festuca myuros, Delphinium patens, etc.",http://cch2.org/portal/collections/individual/index.php?occid=1601564,WW,,6,Total,0,2,1,1,0,,,2.75
UCR0077024,4/26/1998,1998,4,26,116,integrifolia,Los Angeles,"Browns Flat, San Dimas Experimental Forest",1317,34.18778,-117.72111,,,,,cch2,1601564,,"Grassy flat surrounded by chaparral and coastal sage scrub; assoc. with Bromus tectorum, Poa secunda, Festuca myuros, Delphinium patens, etc.",http://cch2.org/portal/collections/individual/index.php?occid=1601564,WW,,7,Total,0,3,2,2,2,,,3.333333333
UCR0077024,4/26/1998,1998,4,26,116,integrifolia,Los Angeles,"Browns Flat, San Dimas Experimental Forest",1317,34.18778,-117.72111,,,,,cch2,1601564,,"Grassy flat surrounded by chaparral and coastal sage scrub; assoc. with Bromus tectorum, Poa secunda, Festuca myuros, Delphinium patens, etc.",http://cch2.org/portal/collections/individual/index.php?occid=1601564,WW,,8,Total,4,3,3,3,0,,,2.384615385
UCR0077119,4/22/1995,1995,4,22,112,,San Bernardino,"near Cucamonga, Day Canyon, 0.6 miles NW of gauging station at mouth of canyon",976,34.19222,-117.5425,,,,,cch2,1600887,,"Canyon bottom at base of E-facing slope; rocky granitic gravel; chaparral and coastal sage scrub, in c. 45 acre burn of 1993.",http://cch2.org/portal/collections/individual/index.php?occid=1600887,WW,,1,Total,5,8,3,1,0,,,2
UCR0077119,4/22/1995,1995,4,22,112,,San Bernardino,"near Cucamonga, Day Canyon, 0.6 miles NW of gauging station at mouth of canyon",976,34.19222,-117.5425,,,,,cch2,1600887,,"Canyon bottom at base of E-facing slope; rocky granitic gravel; chaparral and coastal sage scrub, in c. 45 acre burn of 1993.",http://cch2.org/portal/collections/individual/index.php?occid=1600887,WW,,2,Total,1,4,4,1,0,,,2.5
UCR0077119,4/22/1995,1995,4,22,112,,San Bernardino,"near Cucamonga, Day Canyon, 0.6 miles NW of gauging station at mouth of canyon",976,34.19222,-117.5425,,,,,cch2,1600887,,"Canyon bottom at base of E-facing slope; rocky granitic gravel; chaparral and coastal sage scrub, in c. 45 acre burn of 1993.",http://cch2.org/portal/collections/individual/index.php?occid=1600887,WW,,3,Total,1,1,1,0,0,,,2
UCR0105227,5/30/1998,1998,5,30,150,,Los Angeles,"San Dimas Experimental Forest, Fern Canyon",890,34.19333,-117.73028,,,,,cch2,1608646,,Canyon bottom; riparian vegetation surrounded by chaparral.,http://cch2.org/portal/collections/individual/index.php?occid=1608646,WW,clipping overlaps full plant,NA,,,,,,,y,y,#DIV/0!
UCR0077019,6/25/1999,1999,6,25,176,,Los Angeles,"Fern Canyon, c. 1.75 mi. east of confluence with upper East Fork San Dimas Canyon",1171,34.19583,-117.71667,,,,,cch2,1612662,,"Riparian vegetation surrounded by chaparral with Umbellularia, etc.",http://cch2.org/portal/collections/individual/index.php?occid=1612662,WW,,1,Total,0,7,14,14,3,,,3.342105263
UCR0077145,5/27/1976,1976,5,27,148,integrifolia,San Bernardino,"San Sevaine Cow Camp, [west of] Lytle Creek Canyon",1433,34.20222,-117.48611,,,,,cch2,1447230,,"Transition between chaparral and southern oak woodland, with Adenostoma, Ceanothus and Quercus.",http://cch2.org/portal/collections/individual/index.php?occid=1447230,WW,,1,Total,0,1,0,1,1,,,3.666666667
UCR0077145,5/27/1976,1976,5,27,148,integrifolia,San Bernardino,"San Sevaine Cow Camp, [west of] Lytle Creek Canyon",1433,34.20222,-117.48611,,,,,cch2,1447230,,"Transition between chaparral and southern oak woodland, with Adenostoma, Ceanothus and Quercus.",http://cch2.org/portal/collections/individual/index.php?occid=1447230,WW,,2,Total,1,2,11,3,7,,,3.541666667
UCR0077117,4/15/1995,1995,4,15,105,menziesii,San Bernardino,"Glen Helen Regional Park, c. 600 m south of Blockbuster Pavilion parking area, between motorcycle racetrack and north parking area",610,34.20361,-117.39444,,,,,cch2,1599966,,"East-west running canyon bottom; chaparral and coastal sage scrub with Adenostoma fasciculatum, Artemisia douglasiana, Toxicodendron, etc.",http://cch2.org/portal/collections/individual/index.php?occid=1599966,WW,,1,Total,3,1,1,0,0,,,1.6
UCR0077117,4/15/1995,1995,4,15,105,menziesii,San Bernardino,"Glen Helen Regional Park, c. 600 m south of Blockbuster Pavilion parking area, between motorcycle racetrack and north parking area",610,34.20361,-117.39444,,,,,cch2,1599966,,"East-west running canyon bottom; chaparral and coastal sage scrub with Adenostoma fasciculatum, Artemisia douglasiana, Toxicodendron, etc.",http://cch2.org/portal/collections/individual/index.php?occid=1599966,WW,,2,Total,5,2,1,0,0,,,1.5
UCR0077147,5/9/1968,1968,5,9,130,integrifolia,San Bernardino,[Glen Helen Regional Park] NW end of Muscupiabe,622,34.20389,-117.40667,,,,,cch2,1488007,,"Shade to sun at edge of chaparral, NW slope of decomposed granite.",http://cch2.org/portal/collections/individual/index.php?occid=1488007,WW,,1,Total,11,31,18,26,15,,,3.02970297
UCR0105226,4/28/2011,2011,4,28,118,integrifolia,Los Angeles,"north of Glendora, ridge with old firebreak south of Persinger Cyn., from Glendora Mt. Road 0.7 mi. west to San Gabriel Cyn. Dam",878,34.205,-117.83583,,,,,cch2,1686994,,"Ridgetop in 2009 burn; chaparral, coastal sage scr., dominants incl. Lupinus ex., Acmispon gl., Bromus di., Erodium c., Festuca my., N & S-facing slopes w/ Heteromeles, Cercocarpus, Adenostoma & Quercus du., Scrophularia, Ribes, Fraxinus, Prunus il., Eschscholzia, Melica, etc.",http://cch2.org/portal/collections/individual/index.php?occid=1686994,WW,,1,Total,7,5,5,3,1,,,2.333333333
UCR0105226,4/28/2011,2011,4,28,118,integrifolia,Los Angeles,"north of Glendora, ridge with old firebreak south of Persinger Cyn., from Glendora Mt. Road 0.7 mi. west to San Gabriel Cyn. Dam",878,34.205,-117.83583,,,,,cch2,1686994,,"Ridgetop in 2009 burn; chaparral, coastal sage scr., dominants incl. Lupinus ex., Acmispon gl., Bromus di., Erodium c., Festuca my., N & S-facing slopes w/ Heteromeles, Cercocarpus, Adenostoma & Quercus du., Scrophularia, Ribes, Fraxinus, Prunus il., Eschscholzia, Melica, etc.",http://cch2.org/portal/collections/individual/index.php?occid=1686994,WW,,2,Total,8,10,10,5,2,,,2.514285714
UCR0105226,4/28/2011,2011,4,28,118,integrifolia,Los Angeles,"north of Glendora, ridge with old firebreak south of Persinger Cyn., from Glendora Mt. Road 0.7 mi. west to San Gabriel Cyn. Dam",878,34.205,-117.83583,,,,,cch2,1686994,,"Ridgetop in 2009 burn; chaparral, coastal sage scr., dominants incl. Lupinus ex., Acmispon gl., Bromus di., Erodium c., Festuca my., N & S-facing slopes w/ Heteromeles, Cercocarpus, Adenostoma & Quercus du., Scrophularia, Ribes, Fraxinus, Prunus il., Eschscholzia, Melica, etc.",http://cch2.org/portal/collections/individual/index.php?occid=1686994,WW,,3,Total,2,2,5,6,1,,,3.125
UCR0105226,4/28/2011,2011,4,28,118,integrifolia,Los Angeles,"north of Glendora, ridge with old firebreak south of Persinger Cyn., from Glendora Mt. Road 0.7 mi. west to San Gabriel Cyn. Dam",878,34.205,-117.83583,,,,,cch2,1686994,,"Ridgetop in 2009 burn; chaparral, coastal sage scr., dominants incl. Lupinus ex., Acmispon gl., Bromus di., Erodium c., Festuca my., N & S-facing slopes w/ Heteromeles, Cercocarpus, Adenostoma & Quercus du., Scrophularia, Ribes, Fraxinus, Prunus il., Eschscholzia, Melica, etc.",http://cch2.org/portal/collections/individual/index.php?occid=1686994,WW,on top of plant 1; numbered weird bc i caught this one late,4,Total,3,2,1,1,0,,,2
UCR0077124,4/1/1995,1995,4,1,91,,San Bernardino,"flats immediately south of Spring Hill, west of FS Rd 2N04 (Barrett-Stoddard Truck Rd.), north of Stoddard Peak",1220,34.20722,-117.66528,,,,,cch2,1600701,,"Grassy area with Avena barbata and Festuca myuros, old disturbance in coastal sage scrub.",http://cch2.org/portal/collections/individual/index.php?occid=1600701,WW,,1,Total,0,3,4,2,2,,,3.272727273
UCR0077124,4/1/1995,1995,4,1,91,,San Bernardino,"flats immediately south of Spring Hill, west of FS Rd 2N04 (Barrett-Stoddard Truck Rd.), north of Stoddard Peak",1220,34.20722,-117.66528,,,,,cch2,1600701,,"Grassy area with Avena barbata and Festuca myuros, old disturbance in coastal sage scrub.",http://cch2.org/portal/collections/individual/index.php?occid=1600701,WW,,2,Total,4,5,5,0,0,,,2.071428571
UCR0077124,4/1/1995,1995,4,1,91,,San Bernardino,"flats immediately south of Spring Hill, west of FS Rd 2N04 (Barrett-Stoddard Truck Rd.), north of Stoddard Peak",1220,34.20722,-117.66528,,,,,cch2,1600701,,"Grassy area with Avena barbata and Festuca myuros, old disturbance in coastal sage scrub.",http://cch2.org/portal/collections/individual/index.php?occid=1600701,WW,on top of plant 2,3,Total,1,1,0,0,0,,,1.5
UCR0077124,4/1/1995,1995,4,1,91,,San Bernardino,"flats immediately south of Spring Hill, west of FS Rd 2N04 (Barrett-Stoddard Truck Rd.), north of Stoddard Peak",1220,34.20722,-117.66528,,,,,cch2,1600701,,"Grassy area with Avena barbata and Festuca myuros, old disturbance in coastal sage scrub.",http://cch2.org/portal/collections/individual/index.php?occid=1600701,WW,,4,Total,1,3,0,0,1,,,2.4
UCR0077115,4/5/1994,1994,4,5,95,menziesii,San Bernardino,1.1 mi west of Glen Helen Road on FS Road 3N31/Applewhite Road,707,34.20833,-117.41583,,,,,cch2,1477003,,"Chaparral on burned slopes, with Adenostoma fasciculatum, Quercus dumosa, Arctostaphylos.",http://cch2.org/portal/collections/individual/index.php?occid=1477003,WW,ugly and overlapping,NA,,,,,,,y,y,#DIV/0!
UCR0077028,4/30/2000,2000,4,30,121,,Los Angeles,"Millard Canyon, campground 2 mi N of Altadena, up the stream immediately after Millard campground.",518,34.21611,-118.14639,,,,,cch2,1592339,,,http://cch2.org/portal/collections/individual/index.php?occid=1592339,JN,far left plant,1,Total,2,2,0,0,0,,,1.5
UCR0077028,4/30/2000,2000,4,30,121,,Los Angeles,"Millard Canyon, campground 2 mi N of Altadena, up the stream immediately after Millard campground.",518,34.21611,-118.14639,,,,,cch2,1592339,,,http://cch2.org/portal/collections/individual/index.php?occid=1592339,JN,directly under the barcode,2,Total,0,2,0,1,0,,,2.666666667
UCR0077028,4/30/2000,2000,4,30,121,,Los Angeles,"Millard Canyon, campground 2 mi N of Altadena, up the stream immediately after Millard campground.",518,34.21611,-118.14639,,,,,cch2,1592339,,,http://cch2.org/portal/collections/individual/index.php?occid=1592339,JN,middle top row,3,Total,4,2,0,1,0,,,1.714285714
UCR0077028,4/30/2000,2000,4,30,121,,Los Angeles,"Millard Canyon, campground 2 mi N of Altadena, up the stream immediately after Millard campground.",518,34.21611,-118.14639,,,,,cch2,1592339,,,http://cch2.org/portal/collections/individual/index.php?occid=1592339,JN,larger plant on the right,4,Total,3,8,3,5,0,,,2.526315789
UCR0077028,4/30/2000,2000,4,30,121,,Los Angeles,"Millard Canyon, campground 2 mi N of Altadena, up the stream immediately after Millard campground.",518,34.21611,-118.14639,,,,,cch2,1592339,,,http://cch2.org/portal/collections/individual/index.php?occid=1592339,JN,bottom most plant,5,Total,1,2,1,1,0,,,2.4
UCR0077029,4/22/2000,2000,4,22,113,,Los Angeles,"Millard Canyon, 2 mi N of Altadena. First trail on the right immediately before Millard Campground",549,34.21611,-118.14639,,,,,cch2,1592402,,Chaparral and riparian areas.,http://cch2.org/portal/collections/individual/index.php?occid=1592402,JN,far left in middle of the page,1,Total,1,3,0,1,0,,,2.2
UCR0077029,4/22/2000,2000,4,22,113,,Los Angeles,"Millard Canyon, 2 mi N of Altadena. First trail on the right immediately before Millard Campground",549,34.21611,-118.14639,,,,,cch2,1592402,,Chaparral and riparian areas.,http://cch2.org/portal/collections/individual/index.php?occid=1592402,JN,larger plant on left near barcode,2,Total,2,2,1,0,0,,,1.8
UCR0077029,4/22/2000,2000,4,22,113,,Los Angeles,"Millard Canyon, 2 mi N of Altadena. First trail on the right immediately before Millard Campground",549,34.21611,-118.14639,,,,,cch2,1592402,,Chaparral and riparian areas.,http://cch2.org/portal/collections/individual/index.php?occid=1592402,JN,top right plant,3,Total,2,1,0,0,0,,,1.333333333
UCR0077029,4/22/2000,2000,4,22,113,,Los Angeles,"Millard Canyon, 2 mi N of Altadena. First trail on the right immediately before Millard Campground",549,34.21611,-118.14639,,,,,cch2,1592402,,Chaparral and riparian areas.,http://cch2.org/portal/collections/individual/index.php?occid=1592402,JN,plant dead center on the page,4,Total,3,3,0,0,0,,,1.5
UCR0077029,4/22/2000,2000,4,22,113,,Los Angeles,"Millard Canyon, 2 mi N of Altadena. First trail on the right immediately before Millard Campground",549,34.21611,-118.14639,,,,,cch2,1592402,,Chaparral and riparian areas.,http://cch2.org/portal/collections/individual/index.php?occid=1592402,JN,"far right, centered vertically on page",5,Total,2,1,0,0,0,,,1.333333333
UCR0077029,4/22/2000,2000,4,22,113,,Los Angeles,"Millard Canyon, 2 mi N of Altadena. First trail on the right immediately before Millard Campground",549,34.21611,-118.14639,,,,,cch2,1592402,,Chaparral and riparian areas.,http://cch2.org/portal/collections/individual/index.php?occid=1592402,JN,far right near bottom half of page,6,Total,0,1,0,0,0,,,2
UCR0077029,4/22/2000,2000,4,22,113,,Los Angeles,"Millard Canyon, 2 mi N of Altadena. First trail on the right immediately before Millard Campground",549,34.21611,-118.14639,,,,,cch2,1592402,,Chaparral and riparian areas.,http://cch2.org/portal/collections/individual/index.php?occid=1592402,JN,bottom most left side,7,Total,2,1,0,0,0,,,1.333333333
UCR0077029,4/22/2000,2000,4,22,113,,Los Angeles,"Millard Canyon, 2 mi N of Altadena. First trail on the right immediately before Millard Campground",549,34.21611,-118.14639,,,,,cch2,1592402,,Chaparral and riparian areas.,http://cch2.org/portal/collections/individual/index.php?occid=1592402,JN,bottom right,8,Total,2,2,1,2,0,,,2.428571429
UCR0077149,5/21/1970,1970,5,21,141,integrifolia,San Bernardino,"Lytle Creek Road, 2.8 mi. north of Devore Road, Cajon Pass area",884,34.2175,-117.46139,,,,,cch2,1447232,,,http://cch2.org/portal/collections/individual/index.php?occid=1447232,JN,"plant cut off from image, can't see entire plant",NA,,,,,,,y,y,#DIV/0!
UCR0077131,5/1/1985,1985,5,1,121,integrifolia,San Bernardino,"c. 12 air mi NW of San Bernardino in lower Lytle Creek Wash, c. 2-4 mi north of Interstate 15",732,34.22222,-117.46611,,,,,cch2,1574113,,"Openings and terraces in lower chaparral, with Adenostoma, Salvia, Ceanothus, Rhamnus, Eriodictyon, etc.",http://cch2.org/portal/collections/individual/index.php?occid=1574113,WW,,1,Total,5,7,3,11,4,,,3.066666667
UCR0077131,5/1/1985,1985,5,1,121,integrifolia,San Bernardino,"c. 12 air mi NW of San Bernardino in lower Lytle Creek Wash, c. 2-4 mi north of Interstate 15",732,34.22222,-117.46611,,,,,cch2,1574113,,"Openings and terraces in lower chaparral, with Adenostoma, Salvia, Ceanothus, Rhamnus, Eriodictyon, etc.",http://cch2.org/portal/collections/individual/index.php?occid=1574113,WW,,2,Total,4,5,4,6,4,,,3.043478261
UCR0077131,5/1/1985,1985,5,1,121,integrifolia,San Bernardino,"c. 12 air mi NW of San Bernardino in lower Lytle Creek Wash, c. 2-4 mi north of Interstate 15",732,34.22222,-117.46611,,,,,cch2,1574113,,"Openings and terraces in lower chaparral, with Adenostoma, Salvia, Ceanothus, Rhamnus, Eriodictyon, etc.",http://cch2.org/portal/collections/individual/index.php?occid=1574113,WW,,3,Total,2,2,1,2,1,,,2.75
UCR0077131,5/1/1985,1985,5,1,121,integrifolia,San Bernardino,"c. 12 air mi NW of San Bernardino in lower Lytle Creek Wash, c. 2-4 mi north of Interstate 15",732,34.22222,-117.46611,,,,,cch2,1574113,,"Openings and terraces in lower chaparral, with Adenostoma, Salvia, Ceanothus, Rhamnus, Eriodictyon, etc.",http://cch2.org/portal/collections/individual/index.php?occid=1574113,WW,,4,Total,3,6,2,6,2,,,2.894736842
UCR0077031,5/30/1973,1973,5,30,150,integrifolia,Los Angeles,"c. 1 mi west from Baldy Village, 1/2 mi southwest of Cow Canyon Saddle on [Sunset Ridge Fire Road], Sunset Peak",1463,34.22333,-117.67972,,,,,cch2,1447218,,"Chaparral community, dominant plants: Quercus sp., Ceanothus sp.",http://cch2.org/portal/collections/individual/index.php?occid=1447218,WW,used thickness of pedicel to determine,1,Total,1,5,7,8,0,,,3.047619048
UCR0077160,4/27/1968,1968,4,27,118,,San Bernardino,"Lytle Creek, c. 0.5 mile SE of Ranger Station",915,34.23278,-117.47333,,,,,cch2,1447234,,,http://cch2.org/portal/collections/individual/index.php?occid=1447234,WW,all clippings,NA,,,,,,,y,y,#DIV/0!
UCR0077165,4/22/1973,1973,4,22,112,,San Bernardino,"opposite 24680 Lake Drive, east shore of Lake Gregory",1829,34.24333,-117.26333,,,,,cch2,1447235,,Yellow pine forest.,http://cch2.org/portal/collections/individual/index.php?occid=1447235,WW,,1,Total,2,3,1,0,0,,,1.833333333
UCR0077165,4/22/1973,1973,4,22,112,,San Bernardino,"opposite 24680 Lake Drive, east shore of Lake Gregory",1829,34.24333,-117.26333,,,,,cch2,1447235,,Yellow pine forest.,http://cch2.org/portal/collections/individual/index.php?occid=1447235,WW,,2,Total,2,2,0,1,0,,,2
UCR0077165,4/22/1973,1973,4,22,112,,San Bernardino,"opposite 24680 Lake Drive, east shore of Lake Gregory",1829,34.24333,-117.26333,,,,,cch2,1447235,,Yellow pine forest.,http://cch2.org/portal/collections/individual/index.php?occid=1447235,WW,,3,Total,3,1,0,0,0,,,1.25
UCR0077154,6/6/1994,1994,6,6,157,,San Bernardino,"Waters Road near Fernwood Drive, Seeley Creek drainage between Valley of Enchantment and Cedarpines Park",1525,34.24778,-117.31778,,,,,cch2,1476997,,"Yellow pine forest with Pinus, Quercus, Calocedrus, and Abies.",http://cch2.org/portal/collections/individual/index.php?occid=1476997,JN,upper right corner,1,Total,3,4,2,14,2,,,3.32
UCR0077154,6/6/1994,1994,6,6,157,,San Bernardino,"Waters Road near Fernwood Drive, Seeley Creek drainage between Valley of Enchantment and Cedarpines Park",1525,34.24778,-117.31778,,,,,cch2,1476997,,"Yellow pine forest with Pinus, Quercus, Calocedrus, and Abies.",http://cch2.org/portal/collections/individual/index.php?occid=1476997,JN,bottom right corner,2,Total,0,0,0,0,1,,,5
UCR0077126,4/3/1995,1995,4,3,93,,San Bernardino,"Lower Lytle Creek Divide, 0.7 mi. NE of junction of Applewhite Rd. and FS Rd. 3N31",1037,34.25694,-117.47583,,,,,cch2,1599930,,"SE-facing slope; burned summer 1994. Chaparral and coastal sage scrub, with Adenostoma fasciculatum (resprouting), Claytonia, Calandrinia, Collinsia, Phacelia minor, etc.",http://cch2.org/portal/collections/individual/index.php?occid=1599930,JN,plant order from left to right; far left plant in middle of page,1,Total,0,1,0,0,0,,,2
UCR0077126,4/3/1995,1995,4,3,93,,San Bernardino,"Lower Lytle Creek Divide, 0.7 mi. NE of junction of Applewhite Rd. and FS Rd. 3N31",1037,34.25694,-117.47583,,,,,cch2,1599930,,"SE-facing slope; burned summer 1994. Chaparral and coastal sage scrub, with Adenostoma fasciculatum (resprouting), Claytonia, Calandrinia, Collinsia, Phacelia minor, etc.",http://cch2.org/portal/collections/individual/index.php?occid=1599930,JN,second from left,2,Total,1,1,0,0,0,,,1.5
UCR0077126,4/3/1995,1995,4,3,93,,San Bernardino,"Lower Lytle Creek Divide, 0.7 mi. NE of junction of Applewhite Rd. and FS Rd. 3N31",1037,34.25694,-117.47583,,,,,cch2,1599930,,"SE-facing slope; burned summer 1994. Chaparral and coastal sage scrub, with Adenostoma fasciculatum (resprouting), Claytonia, Calandrinia, Collinsia, Phacelia minor, etc.",http://cch2.org/portal/collections/individual/index.php?occid=1599930,JN,third from left under very top plant on left side,3,Total,0,1,0,0,0,,,2
UCR0077126,4/3/1995,1995,4,3,93,,San Bernardino,"Lower Lytle Creek Divide, 0.7 mi. NE of junction of Applewhite Rd. and FS Rd. 3N31",1037,34.25694,-117.47583,,,,,cch2,1599930,,"SE-facing slope; burned summer 1994. Chaparral and coastal sage scrub, with Adenostoma fasciculatum (resprouting), Claytonia, Calandrinia, Collinsia, Phacelia minor, etc.",http://cch2.org/portal/collections/individual/index.php?occid=1599930,JN,top plant to the left of barcode,4,Total,2,3,0,1,0,,,2
UCR0077126,4/3/1995,1995,4,3,93,,San Bernardino,"Lower Lytle Creek Divide, 0.7 mi. NE of junction of Applewhite Rd. and FS Rd. 3N31",1037,34.25694,-117.47583,,,,,cch2,1599930,,"SE-facing slope; burned summer 1994. Chaparral and coastal sage scrub, with Adenostoma fasciculatum (resprouting), Claytonia, Calandrinia, Collinsia, Phacelia minor, etc.",http://cch2.org/portal/collections/individual/index.php?occid=1599930,JN,larger bulkier plant on bottom left,5,Total,4,6,0,1,0,,,1.818181818
UCR0077126,4/3/1995,1995,4,3,93,,San Bernardino,"Lower Lytle Creek Divide, 0.7 mi. NE of junction of Applewhite Rd. and FS Rd. 3N31",1037,34.25694,-117.47583,,,,,cch2,1599930,,"SE-facing slope; burned summer 1994. Chaparral and coastal sage scrub, with Adenostoma fasciculatum (resprouting), Claytonia, Calandrinia, Collinsia, Phacelia minor, etc.",http://cch2.org/portal/collections/individual/index.php?occid=1599930,JN,middle top to the right of plant 4,6,Total,1,0,0,0,0,,,1
UCR0077126,4/3/1995,1995,4,3,93,,San Bernardino,"Lower Lytle Creek Divide, 0.7 mi. NE of junction of Applewhite Rd. and FS Rd. 3N31",1037,34.25694,-117.47583,,,,,cch2,1599930,,"SE-facing slope; burned summer 1994. Chaparral and coastal sage scrub, with Adenostoma fasciculatum (resprouting), Claytonia, Calandrinia, Collinsia, Phacelia minor, etc.",http://cch2.org/portal/collections/individual/index.php?occid=1599930,JN,middle top overlapping plant 6 (right plant),7,Total,1,1,0,0,0,,,1.5
UCR0077126,4/3/1995,1995,4,3,93,,San Bernardino,"Lower Lytle Creek Divide, 0.7 mi. NE of junction of Applewhite Rd. and FS Rd. 3N31",1037,34.25694,-117.47583,,,,,cch2,1599930,,"SE-facing slope; burned summer 1994. Chaparral and coastal sage scrub, with Adenostoma fasciculatum (resprouting), Claytonia, Calandrinia, Collinsia, Phacelia minor, etc.",http://cch2.org/portal/collections/individual/index.php?occid=1599930,JN,bottom middle plant overlapping with detached brown flower,8,Total,0,1,0,0,0,,,2
UCR0077126,4/3/1995,1995,4,3,93,,San Bernardino,"Lower Lytle Creek Divide, 0.7 mi. NE of junction of Applewhite Rd. and FS Rd. 3N31",1037,34.25694,-117.47583,,,,,cch2,1599930,,"SE-facing slope; burned summer 1994. Chaparral and coastal sage scrub, with Adenostoma fasciculatum (resprouting), Claytonia, Calandrinia, Collinsia, Phacelia minor, etc.",http://cch2.org/portal/collections/individual/index.php?occid=1599930,JN,bottom plant with several flower on top,9,Total,3,3,0,1,0,,,1.857142857
UCR0077126,4/3/1995,1995,4,3,93,,San Bernardino,"Lower Lytle Creek Divide, 0.7 mi. NE of junction of Applewhite Rd. and FS Rd. 3N31",1037,34.25694,-117.47583,,,,,cch2,1599930,,"SE-facing slope; burned summer 1994. Chaparral and coastal sage scrub, with Adenostoma fasciculatum (resprouting), Claytonia, Calandrinia, Collinsia, Phacelia minor, etc.",http://cch2.org/portal/collections/individual/index.php?occid=1599930,JN,top plant with cotyledon,10,Total,0,2,0,1,0,,,2.666666667
UCR0077126,4/3/1995,1995,4,3,93,,San Bernardino,"Lower Lytle Creek Divide, 0.7 mi. NE of junction of Applewhite Rd. and FS Rd. 3N31",1037,34.25694,-117.47583,,,,,cch2,1599930,,"SE-facing slope; burned summer 1994. Chaparral and coastal sage scrub, with Adenostoma fasciculatum (resprouting), Claytonia, Calandrinia, Collinsia, Phacelia minor, etc.",http://cch2.org/portal/collections/individual/index.php?occid=1599930,JN,plant directly under plant to the right of barcode on the top,11,Total,0,1,0,0,0,,,2
UCR0077126,4/3/1995,1995,4,3,93,,San Bernardino,"Lower Lytle Creek Divide, 0.7 mi. NE of junction of Applewhite Rd. and FS Rd. 3N31",1037,34.25694,-117.47583,,,,,cch2,1599930,,"SE-facing slope; burned summer 1994. Chaparral and coastal sage scrub, with Adenostoma fasciculatum (resprouting), Claytonia, Calandrinia, Collinsia, Phacelia minor, etc.",http://cch2.org/portal/collections/individual/index.php?occid=1599930,JN,plant directly to the right of small plant with no structures on the bottom,12,Total,1,1,0,0,0,,,1.5
UCR0077126,4/3/1995,1995,4,3,93,,San Bernardino,"Lower Lytle Creek Divide, 0.7 mi. NE of junction of Applewhite Rd. and FS Rd. 3N31",1037,34.25694,-117.47583,,,,,cch2,1599930,,"SE-facing slope; burned summer 1994. Chaparral and coastal sage scrub, with Adenostoma fasciculatum (resprouting), Claytonia, Calandrinia, Collinsia, Phacelia minor, etc.",http://cch2.org/portal/collections/individual/index.php?occid=1599930,JN,"""s""-shaped plant in the middle",13,Total,1,3,0,0,0,,,1.75
UCR0077126,4/3/1995,1995,4,3,93,,San Bernardino,"Lower Lytle Creek Divide, 0.7 mi. NE of junction of Applewhite Rd. and FS Rd. 3N31",1037,34.25694,-117.47583,,,,,cch2,1599930,,"SE-facing slope; burned summer 1994. Chaparral and coastal sage scrub, with Adenostoma fasciculatum (resprouting), Claytonia, Calandrinia, Collinsia, Phacelia minor, etc.",http://cch2.org/portal/collections/individual/index.php?occid=1599930,JN,top plant directly under folded paper,14,Total,2,1,0,0,0,,,1.333333333
UCR0077126,4/3/1995,1995,4,3,93,,San Bernardino,"Lower Lytle Creek Divide, 0.7 mi. NE of junction of Applewhite Rd. and FS Rd. 3N31",1037,34.25694,-117.47583,,,,,cch2,1599930,,"SE-facing slope; burned summer 1994. Chaparral and coastal sage scrub, with Adenostoma fasciculatum (resprouting), Claytonia, Calandrinia, Collinsia, Phacelia minor, etc.",http://cch2.org/portal/collections/individual/index.php?occid=1599930,JN,plant directly under plant 14,15,Total,2,1,0,0,0,,,1.333333333
UCR0077126,4/3/1995,1995,4,3,93,,San Bernardino,"Lower Lytle Creek Divide, 0.7 mi. NE of junction of Applewhite Rd. and FS Rd. 3N31",1037,34.25694,-117.47583,,,,,cch2,1599930,,"SE-facing slope; burned summer 1994. Chaparral and coastal sage scrub, with Adenostoma fasciculatum (resprouting), Claytonia, Calandrinia, Collinsia, Phacelia minor, etc.",http://cch2.org/portal/collections/individual/index.php?occid=1599930,JN,"top right plant, looks like backwards L",16,Total,1,1,0,0,0,,,1.5
UCR0077126,4/3/1995,1995,4,3,93,,San Bernardino,"Lower Lytle Creek Divide, 0.7 mi. NE of junction of Applewhite Rd. and FS Rd. 3N31",1037,34.25694,-117.47583,,,,,cch2,1599930,,"SE-facing slope; burned summer 1994. Chaparral and coastal sage scrub, with Adenostoma fasciculatum (resprouting), Claytonia, Calandrinia, Collinsia, Phacelia minor, etc.",http://cch2.org/portal/collections/individual/index.php?occid=1599930,JN,top right in the middle,17,Total,1,0,0,0,0,,,1
UCR0077126,4/3/1995,1995,4,3,93,,San Bernardino,"Lower Lytle Creek Divide, 0.7 mi. NE of junction of Applewhite Rd. and FS Rd. 3N31",1037,34.25694,-117.47583,,,,,cch2,1599930,,"SE-facing slope; burned summer 1994. Chaparral and coastal sage scrub, with Adenostoma fasciculatum (resprouting), Claytonia, Calandrinia, Collinsia, Phacelia minor, etc.",http://cch2.org/portal/collections/individual/index.php?occid=1599930,JN,bottom right in the middle,18,Total,1,0,0,0,0,,,1
UCR0077116,4/8/1994,1994,4,8,98,menziesii,San Bernardino,"junction of Lone Pine Canyon & Cajon Canyon, c. 100 m west of Cajon Wash",823,34.26917,-117.4625,,,,,cch2,1477002,,"Riparian w/ Fraxinus, Alnus rhombifolia, Populus fremontii, Toxicodendron diversilobum, etc.",http://cch2.org/portal/collections/individual/index.php?occid=1477002,JN,,1,Total,7,4,2,0,0,,,1.615384615
UCR0077130,5/20/2000,2000,5,20,141,,San Bernardino,Miller Canyon next to East fork of West fork Mojave River. east of Silverwood lake.,1098,34.27056,-117.29139,,,,,cch2,1592416,,Montane forest.,http://cch2.org/portal/collections/individual/index.php?occid=1592416,JN,,1,Total,9,7,6,7,4,,,2.696969697
UCR0077128,5/3/2005,2005,5,3,123,,San Bernardino,"Miller Canyon below Hwy 138, SE of Silverwood Lake, East Fork of West Fork of the Mojave River",1098,34.27194,-117.29417,,,,,cch2,1595970,,,http://cch2.org/portal/collections/individual/index.php?occid=1595970,"JN, DG",Only whole plant on the right scored. Lots of immature fruit,1,Total,1,2,7,11,5,,,3.653846154
UCR0077164,6/20/1965,1965,6,20,171,integrifolia,San Bernardino,Cedar Springs Campground on road to Crestline,1524,34.28278,-117.33139,,,,,cch2,1462119,,Riparian vegetation on sandy N-facing slope.,http://cch2.org/portal/collections/individual/index.php?occid=1462119,"JN, DG","bottom left. **Undeveloped, old buds, OR aborted fruits at lower nodes not scored",1,Total,8,7,7,11,9,,,3.142857143
UCR0077164,6/20/1965,1965,6,20,171,integrifolia,San Bernardino,Cedar Springs Campground on road to Crestline,1524,34.28278,-117.33139,,,,,cch2,1462119,,Riparian vegetation on sandy N-facing slope.,http://cch2.org/portal/collections/individual/index.php?occid=1462119,"JN, DG",upper right,2,Total,4,7,5,5,3,,,2.833333333
UCR0077016,6/18/2010,2010,6,18,169,integrifolia,Los Angeles,"upper Big Tujunga Canyon, 1.2 km north of State Hwy 2 (Angeles Crest Hwy) 0.4 km west of Upper Big Tujunga Canyon Road",1220,34.28419,-118.04531,,,,,cch2,1656367,,"Small tributary creek in previously burned Pinus coulteri forest, with Drymocallis glandulosa reflexa, Delphinium patens, Nemophila menziesii integrifolia, Juncus macrophyllus, Arabis eschscholtziana, Galium porrigens, Horkelia rydbergii, Galium porrigens, Scutellaria siphocampyloides; sandy alluvial soil.",http://cch2.org/portal/collections/individual/index.php?occid=1656367,JN,,1,Total,13,18,8,19,12,,,2.985714286
UCR0077153,5/5/1996,1996,5,5,126,,San Bernardino,Cleghorn Road c. 0.25 mi SE of Cleghorn Pass,1341,34.28444,-117.40389,,,,,cch2,1476995,,NW-facing roadcut in oak chaparral.,http://cch2.org/portal/collections/individual/index.php?occid=1476995,JN,far left plant,1,Total,3,4,1,3,1,,,2.583333333
UCR0077153,5/5/1996,1996,5,5,126,,San Bernardino,Cleghorn Road c. 0.25 mi SE of Cleghorn Pass,1341,34.28444,-117.40389,,,,,cch2,1476995,,NW-facing roadcut in oak chaparral.,http://cch2.org/portal/collections/individual/index.php?occid=1476995,JN,"middle left plant, root present at bottom of plant",2,Total,11,3,6,4,0,,,2.125
UCR0077153,5/5/1996,1996,5,5,126,,San Bernardino,Cleghorn Road c. 0.25 mi SE of Cleghorn Pass,1341,34.28444,-117.40389,,,,,cch2,1476995,,NW-facing roadcut in oak chaparral.,http://cch2.org/portal/collections/individual/index.php?occid=1476995,JN,last two plants are not whole and aren't scored (the far right is missing a branch and is not complete),3,Total,3,2,1,3,0,,,2.444444444
UCR0077125,6/21/1995,1995,6,21,172,integrifolia,San Bernardino,"side canyon on W side of Cajon Wash, 0.5 mi. SW of Cajon, 2.1 mi south of jct. of 3N49 and 3N53; 2.9 mi SE of Lone Pine Road and Hwy 138 at Road 3N53; W side of far W railroad",890,34.29083,-117.46028,,,,,cch2,1599719,,"Marsh area in canyon bottom with chaparral, riparian, coastal sage scrub and southern oak woodland, with Adenostoma fasciculatum, Toxicodendron diversilobum, Salvia mellifera, Rhamnus ilicifolia.",http://cch2.org/portal/collections/individual/index.php?occid=1599719,JN,no whole plants,NA,,,,,,,y,y,#DIV/0!
UCR0077009,6/6/2011,2011,6,6,157,integrifolia,Los Angeles,"Charlton Flats (= Pine Flats), 13.8 miles east of jct. of Angeles Crest and Angeles Forest highways",1616,34.29667,-118.01278,,,,,cch2,1687083,,"Station Fire burn of 2009, picnic area in shallow cyn. with gentle surrounding slopes; transition zone, dominants incl. Pinus pon., P. jeff., Calocedrus, Quercus chr., Erysimum cap., Eriodictyon par., also w/ Vicia, Allophyllum, Phacelia, Boechera, Leptosiphon, Cryptantha, Trifolium, Saltugilia, Acmispon, Agoseris, Leptosiphon, Nemophila, Plagiobothrys, Tauschia, etc.",http://cch2.org/portal/collections/individual/index.php?occid=1687083,JN,one structure covered by leaf at bottom of plant not scored,1,Total,3,2,1,0,0,,,1.666666667
UCR0077009,6/6/2011,2011,6,6,157,integrifolia,Los Angeles,"Charlton Flats (= Pine Flats), 13.8 miles east of jct. of Angeles Crest and Angeles Forest highways",1616,34.29667,-118.01278,,,,,cch2,1687083,,"Station Fire burn of 2009, picnic area in shallow cyn. with gentle surrounding slopes; transition zone, dominants incl. Pinus pon., P. jeff., Calocedrus, Quercus chr., Erysimum cap., Eriodictyon par., also w/ Vicia, Allophyllum, Phacelia, Boechera, Leptosiphon, Cryptantha, Trifolium, Saltugilia, Acmispon, Agoseris, Leptosiphon, Nemophila, Plagiobothrys, Tauschia, etc.",http://cch2.org/portal/collections/individual/index.php?occid=1687083,JN,overlapping (incomplete) plant on bottom,2,Total,8,5,2,1,0,,,1.75
UCR0077122,4/29/1995,1995,4,29,119,,San Bernardino,"west of Cajon Wash and south of Hwy 138, c. 1 mile SSW of Cajon Junction, off FS road 3N49",945,34.29972,-117.48028,,,,,cch2,1600369,,"Shallow canyon draining toward Cajon Wash, with coastal sage scrub, chaparral and riparian woodland; with Fraxinus velutina, Salix, etc.",http://cch2.org/portal/collections/individual/index.php?occid=1600369,JN,from training set,1,Total,13,5,2,1,0,,,1.571428571
UCR0077162,6/20/1993,1993,6,20,171,,San Bernardino,"Near USFS Rock Camp fire station, c. 2 air miles NNW of Lake Arrowhead North Bay",1524,34.3,-117.21667,,,,,cch2,1462117,,"Woodland, beneath canopy of Quercus kelloggii and Pinus jeffreyi. Understory dominated by weedy annual grasses (Bromus, Festuca), Castilleja (Orthocarpus) lasiorhynca, Mimulus pilosus, [Plectritis, Heterocodon], etc.",http://cch2.org/portal/collections/individual/index.php?occid=1462117,"JN, DG",,1,Total,1,4,7,22,22,,,4.071428571
UCR0077118,5/23/1998,1998,5,23,143,,San Bernardino,"Ralston Peak, on southern ridge",1335,34.30139,-117.49583,,,,,cch2,1608910,,"Chaparral and coastal sage scrub with Adenostoma fasciculatum, Ceanoithus crassifolius, C. integerrimus, Bromus tectorum, etc.",http://cch2.org/portal/collections/individual/index.php?occid=1608910,JN,lots of immature fruits on this plant,1,Total,3,4,22,79,29,,,3.927007299
UCR0077109,5/8/2012,2012,5,8,129,,San Bernardino,"Cajon Pass area, Cleghorn Road (dirt), 2 miles airline east (92°) of Cajon Junction",1198,34.31102,-117.43883,,,,,cch2,1652132,,"Gentle mountain slope of decomposed granite; open chaparral with Adenostoma fasciculatum, Eriodictyon trichoclayx.",http://cch2.org/portal/collections/individual/index.php?occid=1652132,JN,no evidence of whole plants found,NA,,,,,,,y,y,#DIV/0!
UCR0077033,3/27/1965,1965,3,27,86,,Los Angeles,"road from Devils Canyon Wild Area to Azusa, 8-12 mi north of where the road crosses the west fork of the San Gabriel River",762,34.31222,-117.84139,,,,,cch2,1447219,,,http://cch2.org/portal/collections/individual/index.php?occid=1447219,JN,"bottom row, third from left double check the buds at the top of the plant",1,Total,17,3,3,6,5,,,2.382352941
UCR0077143,5/28/1995,1995,5,28,148,integrifolia,San Bernardino,"Upper Lytle Creek Ridge above Lone Pine Canyon, 1.4 mi. south of Lone Pine Rd. on 3N31, at first switchback, c. 50-1500 m north of road",1695,34.31472,-117.57917,,,,,cch2,1495662,,Chaparral with Fremontodendron & Ceanothus leucodermis.,http://cch2.org/portal/collections/individual/index.php?occid=1495662,JN,top left plant,1,Total,0,1,0,5,3,,,4.111111111
UCR0077143,5/28/1995,1995,5,28,148,integrifolia,San Bernardino,"Upper Lytle Creek Ridge above Lone Pine Canyon, 1.4 mi. south of Lone Pine Rd. on 3N31, at first switchback, c. 50-1500 m north of road",1695,34.31472,-117.57917,,,,,cch2,1495662,,Chaparral with Fremontodendron & Ceanothus leucodermis.,http://cch2.org/portal/collections/individual/index.php?occid=1495662,JN,right plant,2,Total,7,1,2,0,1,,,1.818181818
UCR0077143,5/28/1995,1995,5,28,148,integrifolia,San Bernardino,"Upper Lytle Creek Ridge above Lone Pine Canyon, 1.4 mi. south of Lone Pine Rd. on 3N31, at first switchback, c. 50-1500 m north of road",1695,34.31472,-117.57917,,,,,cch2,1495662,,Chaparral with Fremontodendron & Ceanothus leucodermis.,http://cch2.org/portal/collections/individual/index.php?occid=1495662,JN,bottom left plant,3,Total,1,2,1,1,0,,,2.4
UCR0077152,4/22/1995,1995,4,22,112,,San Bernardino,"upper Horsethief Canyon along the Pacific Crest Trail, below crossing of Forest Service road to Cleghorn Ridge",1150,34.31917,-117.42278,,,,,cch2,1476996,,"Canyon slopes & alluvial flats w/ chaparral of Prunus ilicifolia, Adenostoma fasciculatum, Quercus wislizenii, Ceanothus greggii. Decomposed granite soil.",http://cch2.org/portal/collections/individual/index.php?occid=1476996,JN,,1,Total,2,1,0,0,0,,,1.333333333
UCR0077152,4/22/1995,1995,4,22,112,,San Bernardino,"upper Horsethief Canyon along the Pacific Crest Trail, below crossing of Forest Service road to Cleghorn Ridge",1150,34.31917,-117.42278,,,,,cch2,1476996,,"Canyon slopes & alluvial flats w/ chaparral of Prunus ilicifolia, Adenostoma fasciculatum, Quercus wislizenii, Ceanothus greggii. Decomposed granite soil.",http://cch2.org/portal/collections/individual/index.php?occid=1476996,JN,,2,Total,6,3,0,1,0,,,1.6
UCR0077034,5/17/1974,1974,5,17,137,,Los Angeles,"8.9 mi east of Big Tujunga Canyon Road, on dirt road 300 yards north of Monte Cristo Ranger Station",976,34.32861,-118.12167,,,,,cch2,1462111,,,http://cch2.org/portal/collections/individual/index.php?occid=1462111,JN,left plant,1,Total,2,1,1,5,3,,,3.5
UCR0077034,5/17/1974,1974,5,17,137,,Los Angeles,"8.9 mi east of Big Tujunga Canyon Road, on dirt road 300 yards north of Monte Cristo Ranger Station",976,34.32861,-118.12167,,,,,cch2,1462111,,,http://cch2.org/portal/collections/individual/index.php?occid=1462111,JN,middle plant (with curved root),2,Total,6,8,0,2,1,,,2.058823529
UCR0077034,5/17/1974,1974,5,17,137,,Los Angeles,"8.9 mi east of Big Tujunga Canyon Road, on dirt road 300 yards north of Monte Cristo Ranger Station",976,34.32861,-118.12167,,,,,cch2,1462111,,,http://cch2.org/portal/collections/individual/index.php?occid=1462111,JN,right plant,3,Total,1,0,0,2,1,,,3.5
UCR0077035,5/9/1995,1995,5,9,129,,Los Angeles,"just west of San Gabriel Mtns: Sunshine Canyon (name not shown on topo): west of San Fernando Road and Hwy I-5 Fwy, just SW of interchange with State Route 14. Sunshine Canyon Landfill property, site proposed for landfill expansion",457,34.33333,-118.51667,,,,,cch2,1476983,,"Major habitat types include Quercus agrifolia forest, Artemisia-dominated coastal sage scrub, & annual grassland.",http://cch2.org/portal/collections/individual/index.php?occid=1476983,JN,"left plant is two clippings, not whole. Right plant missing significant segments.",NA,,,,,,,y,y,#DIV/0!
UCR0077163,4/12/1988,1988,4,12,103,,San Bernardino,"Las Flores Ranch area, c. 2 mi. north of intersection of Grass Valley Creek and Hwy 173, c. 2.5 mi. east of the California Aqueduct",976,34.34639,-117.27639,,,,,cch2,1462118,,"Rocky washes and adjacent slopes and ridgelines. California juniper (Juniperus californica) woodland, with Ceanothus greggii, Eriogonum fasciculatum, Haplopappus linearifolius, H. cooperi, and Salvia dorrii.",http://cch2.org/portal/collections/individual/index.php?occid=1462118,JN,"leftmost plant at the top, excluded overlapping clipping",1,Total,2,4,0,4,0,,,2.6
UCR0077163,4/12/1988,1988,4,12,103,,San Bernardino,"Las Flores Ranch area, c. 2 mi. north of intersection of Grass Valley Creek and Hwy 173, c. 2.5 mi. east of the California Aqueduct",976,34.34639,-117.27639,,,,,cch2,1462118,,"Rocky washes and adjacent slopes and ridgelines. California juniper (Juniperus californica) woodland, with Ceanothus greggii, Eriogonum fasciculatum, Haplopappus linearifolius, H. cooperi, and Salvia dorrii.",,JN,"upper plant to the left of barcode, root structures present. Two clippings above the barcode ignored.",2,Total,2,1,0,0,0,,,1.333333333
UCR0077163,4/12/1988,1988,4,12,103,,San Bernardino,"Las Flores Ranch area, c. 2 mi. north of intersection of Grass Valley Creek and Hwy 173, c. 2.5 mi. east of the California Aqueduct",976,34.34639,-117.27639,,,,,cch2,1462118,,"Rocky washes and adjacent slopes and ridgelines. California juniper (Juniperus californica) woodland, with Ceanothus greggii, Eriogonum fasciculatum, Haplopappus linearifolius, H. cooperi, and Salvia dorrii.",http://cch2.org/portal/collections/individual/index.php?occid=1462118,JN,"upper plant, second from right. Rightmost upper plant excluded, some detached structures and not many are left from that plant.",3,Total,2,2,1,2,0,,,2.428571429
UCR0077163,4/12/1988,1988,4,12,103,,San Bernardino,"Las Flores Ranch area, c. 2 mi. north of intersection of Grass Valley Creek and Hwy 173, c. 2.5 mi. east of the California Aqueduct",976,34.34639,-117.27639,,,,,cch2,1462118,,"Rocky washes and adjacent slopes and ridgelines. California juniper (Juniperus californica) woodland, with Ceanothus greggii, Eriogonum fasciculatum, Haplopappus linearifolius, H. cooperi, and Salvia dorrii.",http://cch2.org/portal/collections/individual/index.php?occid=1462118,JN,bottom left plant,4,Total,2,2,2,1,0,,,2.285714286
UCR0077163,4/12/1988,1988,4,12,103,,San Bernardino,"Las Flores Ranch area, c. 2 mi. north of intersection of Grass Valley Creek and Hwy 173, c. 2.5 mi. east of the California Aqueduct",976,34.34639,-117.27639,,,,,cch2,1462118,,"Rocky washes and adjacent slopes and ridgelines. California juniper (Juniperus californica) woodland, with Ceanothus greggii, Eriogonum fasciculatum, Haplopappus linearifolius, H. cooperi, and Salvia dorrii.",http://cch2.org/portal/collections/individual/index.php?occid=1462118,JN,second from left on bottom,5,Total,1,1,0,0,0,,,1.5
UCR0077163,4/12/1988,1988,4,12,103,,San Bernardino,"Las Flores Ranch area, c. 2 mi. north of intersection of Grass Valley Creek and Hwy 173, c. 2.5 mi. east of the California Aqueduct",976,34.34639,-117.27639,,,,,cch2,1462118,,"Rocky washes and adjacent slopes and ridgelines. California juniper (Juniperus californica) woodland, with Ceanothus greggii, Eriogonum fasciculatum, Haplopappus linearifolius, H. cooperi, and Salvia dorrii.",http://cch2.org/portal/collections/individual/index.php?occid=1462118,JN,"bottom row, third from left. buds at top left were excluded because the image was too blurry, not enough clear evidence",6,Total,0,1,2,1,0,,,3
UCR0077163,4/12/1988,1988,4,12,103,,San Bernardino,"Las Flores Ranch area, c. 2 mi. north of intersection of Grass Valley Creek and Hwy 173, c. 2.5 mi. east of the California Aqueduct",976,34.34639,-117.27639,,,,,cch2,1462118,,"Rocky washes and adjacent slopes and ridgelines. California juniper (Juniperus californica) woodland, with Ceanothus greggii, Eriogonum fasciculatum, Haplopappus linearifolius, H. cooperi, and Salvia dorrii.",http://cch2.org/portal/collections/individual/index.php?occid=1462118,JN,"third from right on bottom row, overlapping plant with root on left side",7,Total,1,1,2,1,1,,,3
UCR0077163,4/12/1988,1988,4,12,103,,San Bernardino,"Las Flores Ranch area, c. 2 mi. north of intersection of Grass Valley Creek and Hwy 173, c. 2.5 mi. east of the California Aqueduct",976,34.34639,-117.27639,,,,,cch2,1462118,,"Rocky washes and adjacent slopes and ridgelines. California juniper (Juniperus californica) woodland, with Ceanothus greggii, Eriogonum fasciculatum, Haplopappus linearifolius, H. cooperi, and Salvia dorrii.",http://cch2.org/portal/collections/individual/index.php?occid=1462118,JN,"third from right on bottom row, overlapping plant with root on right side",8,Total,1,1,1,1,1,,,3
UCR0077163,4/12/1988,1988,4,12,103,,San Bernardino,"Las Flores Ranch area, c. 2 mi. north of intersection of Grass Valley Creek and Hwy 173, c. 2.5 mi. east of the California Aqueduct",976,34.34639,-117.27639,,,,,cch2,1462118,,"Rocky washes and adjacent slopes and ridgelines. California juniper (Juniperus californica) woodland, with Ceanothus greggii, Eriogonum fasciculatum, Haplopappus linearifolius, H. cooperi, and Salvia dorrii.",http://cch2.org/portal/collections/individual/index.php?occid=1462118,JN,"second from right on bottom row, non-nemophila species overlapping near top left",9,Total,4,1,0,0,0,,,1.2
UCR0077163,4/12/1988,1988,4,12,103,,San Bernardino,"Las Flores Ranch area, c. 2 mi. north of intersection of Grass Valley Creek and Hwy 173, c. 2.5 mi. east of the California Aqueduct",976,34.34639,-117.27639,,,,,cch2,1462118,,"Rocky washes and adjacent slopes and ridgelines. California juniper (Juniperus californica) woodland, with Ceanothus greggii, Eriogonum fasciculatum, Haplopappus linearifolius, H. cooperi, and Salvia dorrii.",http://cch2.org/portal/collections/individual/index.php?occid=1462118,JN,bottom rightmost plant,10,Total,1,1,1,0,0,,,2
UCR0077218,3/22/1958,1958,3,22,81,,Ventura,Hwy 399 [=SR33] near Casitas Dam,61,34.35278,-119.30528,,,,,cch2,1555717,,,http://cch2.org/portal/collections/individual/index.php?occid=1555717,JN,bottom left plant,1,Total,2,3,2,3,0,,,2.6
UCR0077218,3/22/1958,1958,3,22,81,,Ventura,Hwy 399 [=SR33] near Casitas Dam,61,34.35278,-119.30528,,,,,cch2,1555717,,,http://cch2.org/portal/collections/individual/index.php?occid=1555717,JN,"top right plant, other middle plants are not whole plants",2,Total,1,3,6,1,0,,,2.636363636
UCR0077217,5/13/2003,2003,5,13,133,integrifolia,Ventura,"Newhall Ranch, Salt Creek",457,34.37111,-118.68778,,,,,cch2,1541579,,,http://cch2.org/portal/collections/individual/index.php?occid=1541579,JN,"this plant is the one with the roots at the middle bottom of the page, severe overlapping but traced the shoots back to this plant",1,Total,3,5,4,3,4,,,3
UCR0077217,5/13/2003,2003,5,13,133,integrifolia,Ventura,"Newhall Ranch, Salt Creek",457,34.37111,-118.68778,,,,,cch2,1541579,,,http://cch2.org/portal/collections/individual/index.php?occid=1541579,JN,plant with roots on bottom right,2,Total,1,2,3,3,1,,,3.1
UCR0077167,5/12/1998,1998,5,12,132,,San Bernardino,"Baldy Mesa, Lugo-Vincent Powerline (S Cal. Edison), c. 1 mi. west of I-15 and north of Cajon Summit",1250,34.37472,-117.45,,,,,cch2,1480773,,Canyon in hills; semidesert chaparral with Quercus john-tuckeri dominant and Adenostoma fasciculatum common.,http://cch2.org/portal/collections/individual/index.php?occid=1480773,JN,left plant is excluded: major stem is missing. Right plant has overlapping fragment that was ignored.,1,Total,1,0,2,6,5,,,4
UCR0077037,5/18/1967,1967,5,18,138,integrifolia,Los Angeles,Placerita Canyon,518,34.37861,-118.45833,,,,,cch2,1488006,,,http://cch2.org/portal/collections/individual/index.php?occid=1488006,DG,"Crazy long monster plants, 2 whole, lots of loose stems. Very blurry sheet, not worth scoring. Open flowers present",NA,,,,,,,y,y,#DIV/0!
UCR0077127,3/25/1995,1995,3,25,84,,San Bernardino,"Piñon Hills area at Sheep Creek, 0.9 mi. south of Hwy 138 at Scrub Oak Rd.",1378,34.40639,-117.60583,,,,,cch2,1599897,,"Broad canyon bottom; pinyon juniper woodland with Juniperus californica, Yucca brevifolia, Y. whipplei cespitosa, Purshia glandulosa, Opuntia echinocarpa, Ephedra nevadensis, Salvia dorrii, Eriodictyon trichocalyx, Eriogonum fasciculatum polifolium, Prunus fasciculatus, Artemisia tridentata, etc.",http://cch2.org/portal/collections/individual/index.php?occid=1599897,JN,"top left plant not whole. First plant is topmost right, durectly under barcode. Cotyledons present",1,Total,2,0,0,0,0,,,1
UCR0077127,3/25/1995,1995,3,25,84,,San Bernardino,"Piñon Hills area at Sheep Creek, 0.9 mi. south of Hwy 138 at Scrub Oak Rd.",1378,34.40639,-117.60583,,,,,cch2,1599897,,"Broad canyon bottom; pinyon juniper woodland with Juniperus californica, Yucca brevifolia, Y. whipplei cespitosa, Purshia glandulosa, Opuntia echinocarpa, Ephedra nevadensis, Salvia dorrii, Eriodictyon trichocalyx, Eriogonum fasciculatum polifolium, Prunus fasciculatus, Artemisia tridentata, etc.",http://cch2.org/portal/collections/individual/index.php?occid=1599897,JN,leftmost plant in middle (vertically),2,Total,1,1,0,0,0,,,1.5
UCR0077127,3/25/1995,1995,3,25,84,,San Bernardino,"Piñon Hills area at Sheep Creek, 0.9 mi. south of Hwy 138 at Scrub Oak Rd.",1378,34.40639,-117.60583,,,,,cch2,1599897,,"Broad canyon bottom; pinyon juniper woodland with Juniperus californica, Yucca brevifolia, Y. whipplei cespitosa, Purshia glandulosa, Opuntia echinocarpa, Ephedra nevadensis, Salvia dorrii, Eriodictyon trichocalyx, Eriogonum fasciculatum polifolium, Prunus fasciculatus, Artemisia tridentata, etc.",http://cch2.org/portal/collections/individual/index.php?occid=1599897,JN,"middle plant, largest",3,Total,8,0,0,0,0,,,1
UCR0077127,3/25/1995,1995,3,25,84,,San Bernardino,"Piñon Hills area at Sheep Creek, 0.9 mi. south of Hwy 138 at Scrub Oak Rd.",1378,34.40639,-117.60583,,,,,cch2,1599897,,"Broad canyon bottom; pinyon juniper woodland with Juniperus californica, Yucca brevifolia, Y. whipplei cespitosa, Purshia glandulosa, Opuntia echinocarpa, Ephedra nevadensis, Salvia dorrii, Eriodictyon trichocalyx, Eriogonum fasciculatum polifolium, Prunus fasciculatus, Artemisia tridentata, etc.",http://cch2.org/portal/collections/individual/index.php?occid=1599897,JN,left top plant,4,Total,2,1,0,0,0,,,1.333333333
UCR0077127,3/25/1995,1995,3,25,84,,San Bernardino,"Piñon Hills area at Sheep Creek, 0.9 mi. south of Hwy 138 at Scrub Oak Rd.",1378,34.40639,-117.60583,,,,,cch2,1599897,,"Broad canyon bottom; pinyon juniper woodland with Juniperus californica, Yucca brevifolia, Y. whipplei cespitosa, Purshia glandulosa, Opuntia echinocarpa, Ephedra nevadensis, Salvia dorrii, Eriodictyon trichocalyx, Eriogonum fasciculatum polifolium, Prunus fasciculatus, Artemisia tridentata, etc.",http://cch2.org/portal/collections/individual/index.php?occid=1599897,JN,"right bottom plant, cotyledons and roots present",5,Total,1,1,0,0,0,,,1.5
UCR0077127,3/25/1995,1995,3,25,84,,San Bernardino,"Piñon Hills area at Sheep Creek, 0.9 mi. south of Hwy 138 at Scrub Oak Rd.",1378,34.40639,-117.60583,,,,,cch2,1599897,,"Broad canyon bottom; pinyon juniper woodland with Juniperus californica, Yucca brevifolia, Y. whipplei cespitosa, Purshia glandulosa, Opuntia echinocarpa, Ephedra nevadensis, Salvia dorrii, Eriodictyon trichocalyx, Eriogonum fasciculatum polifolium, Prunus fasciculatus, Artemisia tridentata, etc.",http://cch2.org/portal/collections/individual/index.php?occid=1599897,JN,"middle bottom plant, rightmost bottom plant not whole",6,Total,3,0,0,0,0,,,1
UCR0077010,5/12/2011,2011,5,12,132,,Los Angeles,along Cabin Canyon Creek near the confluence with Aliso Canyon,1195,34.41806,-118.09389,,,,,cch2,1686420,,"Station Fire burn of 2009, canyon bottom and base of east-facing slope; coarse, granular, granitic soil; resprouting chaparral and riparian vegetation, dominants incl. Datisca glomerata, Salix, Artemisia douglasiana, with Castilleja foliolosa, Eriodictyon crassifolium, Carex alma, Rubus ursinus, etc.",http://cch2.org/portal/collections/individual/index.php?occid=1686420,JN,Left plant appears whole (root structure) but is missing several stems. Right plant is not whole.,NA,,,,,,,y,y,#DIV/0!
UCR0077036,5/2/1967,1967,5,2,122,,Los Angeles,"Liebre Mtns, north side of northwesternmost end of foothills (of San Gabriel Mtns) between Bouquet Junction and Bonelli Ranch",366,34.42111,-118.53167,,,,,cch2,1476984,,Steep north slope.,http://cch2.org/portal/collections/individual/index.php?occid=1476984,DG,"Exclude: Very blurry, buds and flowers not distinctive, immature vs mature not distinctive",NA,,,,,,,n,y,#DIV/0!
UCR0077158,5/6/1995,1995,5,6,126,,San Bernardino,"North slope Baldy Mesa area; large wash just north of Manzanita Wash, off Baldy Mesa Road",1134,34.42167,-117.45139,,,,,cch2,1477000,,"Oak woodland/chaparral with Quercus, Artemisia tridentata, Ceanothus, etc.",http://cch2.org/portal/collections/individual/index.php?occid=1477000,"DG, JN","bottom left. Lose structures appear to match breaks from main plant: v similar in appearance (stems, leaves, structures), scored as same plant",1,Total,14,11,3,4,6,,,2.394736842
UCR0077158,5/6/1995,1995,5,6,126,,San Bernardino,"North slope Baldy Mesa area; large wash just north of Manzanita Wash, off Baldy Mesa Road",1134,34.42167,-117.45139,,,,,cch2,1477000,,"Oak woodland/chaparral with Quercus, Artemisia tridentata, Ceanothus, etc.",http://cch2.org/portal/collections/individual/index.php?occid=1477000,"DG, JN",top left; large plant. Some spent flowers near distal ends have relatively short pedicels,2,Total,6,8,10,8,12,,,3.272727273
UCR0077158,5/6/1995,1995,5,6,126,,San Bernardino,"North slope Baldy Mesa area; large wash just north of Manzanita Wash, off Baldy Mesa Road",1134,34.42167,-117.45139,,,,,cch2,1477000,,"Oak woodland/chaparral with Quercus, Artemisia tridentata, Ceanothus, etc.",http://cch2.org/portal/collections/individual/index.php?occid=1477000,"DG, JN","smaller plant in upper left, slender",3,Total,2,3,0,1,1,,,2.428571429
UCR0077025,4/14/1998,1998,4,14,104,,Los Angeles,"100 m east of mouth of Mescal Canyon, in Mescal Heights area, 50 m east of 237th St. East",1512,34.42333,-117.71444,,,,,cch2,1601557,,Flood plain; pinyon-juniper woodland with Pinus monophylla.,http://cch2.org/portal/collections/individual/index.php?occid=1601557,JN,"two overlapping plants on the left, the smaller rooted plant is excluded because lower stem is missing and two of the four structures present are obscured by leaves. The plant with the larger root was scored.",1,Total,6,1,0,1,0,,,1.5
UCR0077025,4/14/1998,1998,4,14,104,,Los Angeles,"100 m east of mouth of Mescal Canyon, in Mescal Heights area, 50 m east of 237th St. East",1512,34.42333,-117.71444,,,,,cch2,1601557,,Flood plain; pinyon-juniper woodland with Pinus monophylla.,http://cch2.org/portal/collections/individual/index.php?occid=1601557,JN,middle plant,2,Total,5,2,1,0,0,,,1.5
UCR0077025,4/14/1998,1998,4,14,104,,Los Angeles,"100 m east of mouth of Mescal Canyon, in Mescal Heights area, 50 m east of 237th St. East",1512,34.42333,-117.71444,,,,,cch2,1601557,,Flood plain; pinyon-juniper woodland with Pinus monophylla.,http://cch2.org/portal/collections/individual/index.php?occid=1601557,JN,right plant,3,Total,3,0,0,0,0,,,1
UCR0077023,5/16/1998,1998,5,16,136,,Los Angeles,"near Pinon Hills, Mescal Highlands, 0.9 mile west of 237th St. East at Panorama Way, 2.3 mi. S of Ft. Tejon Rd.",1402,34.43333,-117.71667,,,,,cch2,1608420,,Pinyon-juniper woodland with Pinus monophylla dominant.,http://cch2.org/portal/collections/individual/index.php?occid=1608420,JN,"leftmost plant, right plant is not whole",1,Total,3,3,0,4,5,,,3.333333333
UCR0077021,4/18/2001,2001,4,18,108,,Los Angeles,"Valyermo area, Bobs Gap, east of Bobs Gap Road at base of ridge",1223,34.45167,-117.81139,,,,,cch2,1609654,,"Sandy granitic soil in flat sandy area; Joshua tree woodland with Tetradymia, Chrysothamnus nauseosus, Prunus, Eriodictyon trichocalyx, Yucca brevifolia, Purshia glandulosa, Artemisia tridentata, Lycium cooperi, etc.",http://cch2.org/portal/collections/individual/index.php?occid=1609654,JN,"left plant, buds seem to have long pedicels on this plant.",1,Total,5,0,0,0,0,,,1
UCR0077021,4/18/2001,2001,4,18,108,,Los Angeles,"Valyermo area, Bobs Gap, east of Bobs Gap Road at base of ridge",1223,34.45167,-117.81139,,,,,cch2,1609654,,"Sandy granitic soil in flat sandy area; Joshua tree woodland with Tetradymia, Chrysothamnus nauseosus, Prunus, Eriodictyon trichocalyx, Yucca brevifolia, Purshia glandulosa, Artemisia tridentata, Lycium cooperi, etc.",http://cch2.org/portal/collections/individual/index.php?occid=1609654,JN,middle plant,2,Total,3,1,0,0,0,,,1.25
UCR0077021,4/18/2001,2001,4,18,108,,Los Angeles,"Valyermo area, Bobs Gap, east of Bobs Gap Road at base of ridge",1223,34.45167,-117.81139,,,,,cch2,1609654,,"Sandy granitic soil in flat sandy area; Joshua tree woodland with Tetradymia, Chrysothamnus nauseosus, Prunus, Eriodictyon trichocalyx, Yucca brevifolia, Purshia glandulosa, Artemisia tridentata, Lycium cooperi, etc.",http://cch2.org/portal/collections/individual/index.php?occid=1609654,JN,"right plant, very blurry",3,Total,1,1,0,0,0,,,1.5
UCR0077030,5/1/2003,2003,5,1,121,menziesii,Los Angeles,"Newhall Ranch, Castaic Mesas. c. 1 mi SW of Castaic Lagoon at the W edge of a mesa, north of Charlie Canyon",366,34.4925,-118.6025,,,,,cch2,1541573,,,http://cch2.org/portal/collections/individual/index.php?occid=1541573,JN,good base on plant,1,Total,5,6,2,7,9,,,3.310344828
UCR0077192,3/19/1967,1967,3,19,78,,Santa Barbara,"Lake Cachuma County Park. Lake shore, south of boat ramp",229,34.57806,-119.95667,,,,,cch2,1447239,,Shady embankments under Quercus. Growing with Viola pedunculata T.& G. and grasses.,http://cch2.org/portal/collections/individual/index.php?occid=1447239,JN,"top plant, bottom right plant excluded, appears to be a clipping",1,Total,1,2,0,0,0,,,1.666666667
UCR0077192,3/19/1967,1967,3,19,78,,Santa Barbara,"Lake Cachuma County Park. Lake shore, south of boat ramp",229,34.57806,-119.95667,,,,,cch2,1447239,,Shady embankments under Quercus. Growing with Viola pedunculata T.& G. and grasses.,http://cch2.org/portal/collections/individual/index.php?occid=1447239,JN,"bottom left plant, root structures present",2,Total,3,2,3,0,0,,,2
UCR0077111,4/9/2011,2011,4,9,99,,San Bernardino,"southeast end of Marble Mountains, 4.0 mi north northeast of Chambliss at US Hwy 66, in rugged canyon at end of 4WD dirt road at historic mine site",496,34.59158,-115.50897,,,,,cch2,1643513,,"Very steep limestone canyon walls, with Pleurocoronis pluriseta, Salvia funerea, Peucephyllum schottii, Gilia scopulorum, Cheilanthes parryi.",http://cch2.org/portal/collections/individual/index.php?occid=1643513,JN,top left whole plant,1,Total,3,3,1,1,0,,,2
UCR0077111,4/9/2011,2011,4,9,99,,San Bernardino,"southeast end of Marble Mountains, 4.0 mi north northeast of Chambliss at US Hwy 66, in rugged canyon at end of 4WD dirt road at historic mine site",496,34.59158,-115.50897,,,,,cch2,1643513,,"Very steep limestone canyon walls, with Pleurocoronis pluriseta, Salvia funerea, Peucephyllum schottii, Gilia scopulorum, Cheilanthes parryi.",http://cch2.org/portal/collections/individual/index.php?occid=1643513,JN,"farthest left plant excluded, not whole. bottom middle plant, farthest left root",2,Total,0,1,0,1,0,,,3
UCR0077111,4/9/2011,2011,4,9,99,,San Bernardino,"southeast end of Marble Mountains, 4.0 mi north northeast of Chambliss at US Hwy 66, in rugged canyon at end of 4WD dirt road at historic mine site",496,34.59158,-115.50897,,,,,cch2,1643513,,"Very steep limestone canyon walls, with Pleurocoronis pluriseta, Salvia funerea, Peucephyllum schottii, Gilia scopulorum, Cheilanthes parryi.",http://cch2.org/portal/collections/individual/index.php?occid=1643513,JN,"bottom middle plant, farthest right root",3,Total,0,1,0,0,1,,,3.5
UCR0077111,4/9/2011,2011,4,9,99,,San Bernardino,"southeast end of Marble Mountains, 4.0 mi north northeast of Chambliss at US Hwy 66, in rugged canyon at end of 4WD dirt road at historic mine site",496,34.59158,-115.50897,,,,,cch2,1643513,,"Very steep limestone canyon walls, with Pleurocoronis pluriseta, Salvia funerea, Peucephyllum schottii, Gilia scopulorum, Cheilanthes parryi.",http://cch2.org/portal/collections/individual/index.php?occid=1643513,JN,plant with roots on the bottom right,4,Total,1,2,0,3,0,,,2.833333333
UCR0105265,4/10/2008,2008,4,10,101,,Los Angeles,"hills south of Hwy 138, c. 1 mile south of Neenach School, slopes N & E of VABM Pine",915,34.76667,-118.60833,,,,,cch2,1611827,,"Rolling hills with annual grassland dominated by wildflowers, grasses, Erodium, etc.",http://cch2.org/portal/collections/individual/index.php?occid=1611827,JN,very top plant on the left,1,Total,0,4,2,4,0,,,3
UCR0105265,4/10/2008,2008,4,10,101,,Los Angeles,"hills south of Hwy 138, c. 1 mile south of Neenach School, slopes N & E of VABM Pine",915,34.76667,-118.60833,,,,,cch2,1611827,,"Rolling hills with annual grassland dominated by wildflowers, grasses, Erodium, etc.",http://cch2.org/portal/collections/individual/index.php?occid=1611827,JN,"top plant on the middle, to left of barcode",2,Total,1,2,3,3,0,,,2.888888889
UCR0105265,4/10/2008,2008,4,10,101,,Los Angeles,"hills south of Hwy 138, c. 1 mile south of Neenach School, slopes N & E of VABM Pine",915,34.76667,-118.60833,,,,,cch2,1611827,,"Rolling hills with annual grassland dominated by wildflowers, grasses, Erodium, etc.",http://cch2.org/portal/collections/individual/index.php?occid=1611827,JN,top plant on the right side. to right of barcode,3,Total,0,2,2,0,1,,,3
UCR0105265,4/10/2008,2008,4,10,101,,Los Angeles,"hills south of Hwy 138, c. 1 mile south of Neenach School, slopes N & E of VABM Pine",915,34.76667,-118.60833,,,,,cch2,1611827,,"Rolling hills with annual grassland dominated by wildflowers, grasses, Erodium, etc.",http://cch2.org/portal/collections/individual/index.php?occid=1611827,JN,"left middle plant, directly below white square in top left",4,Total,2,3,3,4,1,,,2.923076923
UCR0105265,4/10/2008,2008,4,10,101,,Los Angeles,"hills south of Hwy 138, c. 1 mile south of Neenach School, slopes N & E of VABM Pine",915,34.76667,-118.60833,,,,,cch2,1611827,,"Rolling hills with annual grassland dominated by wildflowers, grasses, Erodium, etc.",http://cch2.org/portal/collections/individual/index.php?occid=1611827,JN,"upper left plant, directly to right of white square in top left",5,Total,1,2,3,2,2,,,3.2
UCR0105265,4/10/2008,2008,4,10,101,,Los Angeles,"hills south of Hwy 138, c. 1 mile south of Neenach School, slopes N & E of VABM Pine",915,34.76667,-118.60833,,,,,cch2,1611827,,"Rolling hills with annual grassland dominated by wildflowers, grasses, Erodium, etc.",http://cch2.org/portal/collections/individual/index.php?occid=1611827,JN,"immediately right of plant 5, middle row",6,Total,1,2,3,2,2,,,3.2
UCR0105265,4/10/2008,2008,4,10,101,,Los Angeles,"hills south of Hwy 138, c. 1 mile south of Neenach School, slopes N & E of VABM Pine",915,34.76667,-118.60833,,,,,cch2,1611827,,"Rolling hills with annual grassland dominated by wildflowers, grasses, Erodium, etc.",http://cch2.org/portal/collections/individual/index.php?occid=1611827,JN,"far middle right, overlapping with plant 3",7,Total,1,2,0,1,1,,,2.8
UCR0105265,4/10/2008,2008,4,10,101,,Los Angeles,"hills south of Hwy 138, c. 1 mile south of Neenach School, slopes N & E of VABM Pine",915,34.76667,-118.60833,,,,,cch2,1611827,,"Rolling hills with annual grassland dominated by wildflowers, grasses, Erodium, etc.",http://cch2.org/portal/collections/individual/index.php?occid=1611827,JN,small plant to the left of plant 7,8,Total,0,2,1,2,1,,,3.333333333
UCR0105265,4/10/2008,2008,4,10,101,,Los Angeles,"hills south of Hwy 138, c. 1 mile south of Neenach School, slopes N & E of VABM Pine",915,34.76667,-118.60833,,,,,cch2,1611827,,"Rolling hills with annual grassland dominated by wildflowers, grasses, Erodium, etc.",http://cch2.org/portal/collections/individual/index.php?occid=1611827,JN,plant on bottom left,9,Total,0,0,0,3,0,,,4
UCR0105265,4/10/2008,2008,4,10,101,,Los Angeles,"hills south of Hwy 138, c. 1 mile south of Neenach School, slopes N & E of VABM Pine",915,34.76667,-118.60833,,,,,cch2,1611827,,"Rolling hills with annual grassland dominated by wildflowers, grasses, Erodium, etc.",http://cch2.org/portal/collections/individual/index.php?occid=1611827,JN,bottom left,10,Total,3,3,2,4,1,,,2.769230769
UCR0105265,4/10/2008,2008,4,10,101,,Los Angeles,"hills south of Hwy 138, c. 1 mile south of Neenach School, slopes N & E of VABM Pine",915,34.76667,-118.60833,,,,,cch2,1611827,,"Rolling hills with annual grassland dominated by wildflowers, grasses, Erodium, etc.",http://cch2.org/portal/collections/individual/index.php?occid=1611827,JN,bottom left middle,11,Total,1,1,0,0,1,,,2.666666667
UCR0105265,4/10/2008,2008,4,10,101,,Los Angeles,"hills south of Hwy 138, c. 1 mile south of Neenach School, slopes N & E of VABM Pine",915,34.76667,-118.60833,,,,,cch2,1611827,,"Rolling hills with annual grassland dominated by wildflowers, grasses, Erodium, etc.",http://cch2.org/portal/collections/individual/index.php?occid=1611827,JN,bottom right middle,12,Total,1,3,1,0,0,,,2
UCR0105265,4/10/2008,2008,4,10,101,,Los Angeles,"hills south of Hwy 138, c. 1 mile south of Neenach School, slopes N & E of VABM Pine",915,34.76667,-118.60833,,,,,cch2,1611827,,"Rolling hills with annual grassland dominated by wildflowers, grasses, Erodium, etc.",http://cch2.org/portal/collections/individual/index.php?occid=1611827,JN,bottom right,13,Total,0,1,2,1,0,,,3
UCR0105263,4/25/2006,2006,4,25,115,,Los Angeles,"1/2 mi. NW of La Liebre Ranch on the south side of Hwy 138, west of the mouth of Tentrock Canyon",960,34.77028,-118.67833,,,,,cch2,1606204,,"Steep hills, rocky ridge with shallow gravelly loam over bedrock; dense oak scrub with Quercus john-tuckeri and Juniperus californica.",http://cch2.org/portal/collections/individual/index.php?occid=1606204,JN,plant on the far left,1,Total,4,3,0,3,0,,,2.2
UCR0105263,4/25/2006,2006,4,25,115,,Los Angeles,"1/2 mi. NW of La Liebre Ranch on the south side of Hwy 138, west of the mouth of Tentrock Canyon",960,34.77028,-118.67833,,,,,cch2,1606204,,"Steep hills, rocky ridge with shallow gravelly loam over bedrock; dense oak scrub with Quercus john-tuckeri and Juniperus californica.",http://cch2.org/portal/collections/individual/index.php?occid=1606204,JN,top plant,2,Total,6,3,3,2,1,,,2.266666667
UCR0105263,4/25/2006,2006,4,25,115,,Los Angeles,"1/2 mi. NW of La Liebre Ranch on the south side of Hwy 138, west of the mouth of Tentrock Canyon",960,34.77028,-118.67833,,,,,cch2,1606204,,"Steep hills, rocky ridge with shallow gravelly loam over bedrock; dense oak scrub with Quercus john-tuckeri and Juniperus californica.",http://cch2.org/portal/collections/individual/index.php?occid=1606204,JN,bottom left (excluded fragment on far left),3,Total,1,2,0,2,1,,,3
UCR0105263,4/25/2006,2006,4,25,115,,Los Angeles,"1/2 mi. NW of La Liebre Ranch on the south side of Hwy 138, west of the mouth of Tentrock Canyon",960,34.77028,-118.67833,,,,,cch2,1606204,,"Steep hills, rocky ridge with shallow gravelly loam over bedrock; dense oak scrub with Quercus john-tuckeri and Juniperus californica.",http://cch2.org/portal/collections/individual/index.php?occid=1606204,JN,"bottom middle plant, far right plant is not whole",4,Total,3,1,0,2,1,,,2.571428571
UCR0105264,4/11/2008,2008,4,11,102,,Los Angeles,"hills south of Hwy 138, c. 1 mile SW of Neenach School, NW of VABM Pine",970,34.77222,-118.61667,,,,,cch2,1611252,,Open N-facing grassy slopes.,http://cch2.org/portal/collections/individual/index.php?occid=1611252,JN,top right corner,1,Total,1,1,1,2,0,,,2.8
UCR0105264,4/11/2008,2008,4,11,102,,Los Angeles,"hills south of Hwy 138, c. 1 mile SW of Neenach School, NW of VABM Pine",970,34.77222,-118.61667,,,,,cch2,1611252,,Open N-facing grassy slopes.,http://cch2.org/portal/collections/individual/index.php?occid=1611252,JN,"top left plant, plant to the right directly under barcode not whol",2,Total,0,2,1,2,1,,,3.333333333
UCR0105264,4/11/2008,2008,4,11,102,,Los Angeles,"hills south of Hwy 138, c. 1 mile SW of Neenach School, NW of VABM Pine",970,34.77222,-118.61667,,,,,cch2,1611252,,Open N-facing grassy slopes.,http://cch2.org/portal/collections/individual/index.php?occid=1611252,JN,small plant on the right side middle (only one structure),3,Total,0,0,0,1,0,,,4
UCR0105264,4/11/2008,2008,4,11,102,,Los Angeles,"hills south of Hwy 138, c. 1 mile SW of Neenach School, NW of VABM Pine",970,34.77222,-118.61667,,,,,cch2,1611252,,Open N-facing grassy slopes.,http://cch2.org/portal/collections/individual/index.php?occid=1611252,JN,middle left plant with flower extending towards color palette,4,Total,0,2,0,1,1,,,3.25
UCR0105264,4/11/2008,2008,4,11,102,,Los Angeles,"hills south of Hwy 138, c. 1 mile SW of Neenach School, NW of VABM Pine",970,34.77222,-118.61667,,,,,cch2,1611252,,Open N-facing grassy slopes.,http://cch2.org/portal/collections/individual/index.php?occid=1611252,JN,middle plant (left plant on overlapping plant),5,Total,1,0,0,0,1,,,3
UCR0105264,4/11/2008,2008,4,11,102,,Los Angeles,"hills south of Hwy 138, c. 1 mile SW of Neenach School, NW of VABM Pine",970,34.77222,-118.61667,,,,,cch2,1611252,,Open N-facing grassy slopes.,http://cch2.org/portal/collections/individual/index.php?occid=1611252,JN,middle plant (right plant on overlapping plant),6,Total,2,3,1,0,1,,,2.285714286
UCR0105264,4/11/2008,2008,4,11,102,,Los Angeles,"hills south of Hwy 138, c. 1 mile SW of Neenach School, NW of VABM Pine",970,34.77222,-118.61667,,,,,cch2,1611252,,Open N-facing grassy slopes.,http://cch2.org/portal/collections/individual/index.php?occid=1611252,JN,far right middle level plant,7,Total,3,3,1,3,0,,,2.4
UCR0105264,4/11/2008,2008,4,11,102,,Los Angeles,"hills south of Hwy 138, c. 1 mile SW of Neenach School, NW of VABM Pine",970,34.77222,-118.61667,,,,,cch2,1611252,,Open N-facing grassy slopes.,http://cch2.org/portal/collections/individual/index.php?occid=1611252,JN,bottom row left plant,8,Total,0,0,0,1,1,,,4.5
UCR0105264,4/11/2008,2008,4,11,102,,Los Angeles,"hills south of Hwy 138, c. 1 mile SW of Neenach School, NW of VABM Pine",970,34.77222,-118.61667,,,,,cch2,1611252,,Open N-facing grassy slopes.,http://cch2.org/portal/collections/individual/index.php?occid=1611252,JN,bottom row mid left plant,9,Total,1,1,0,0,0,,,1.5
UCR0105264,4/11/2008,2008,4,11,102,,Los Angeles,"hills south of Hwy 138, c. 1 mile SW of Neenach School, NW of VABM Pine",970,34.77222,-118.61667,,,,,cch2,1611252,,Open N-facing grassy slopes.,http://cch2.org/portal/collections/individual/index.php?occid=1611252,JN,bottom row mid right plant,10,Total,1,1,0,2,0,,,2.75
UCR0105264,4/11/2008,2008,4,11,102,,Los Angeles,"hills south of Hwy 138, c. 1 mile SW of Neenach School, NW of VABM Pine",970,34.77222,-118.61667,,,,,cch2,1611252,,Open N-facing grassy slopes.,http://cch2.org/portal/collections/individual/index.php?occid=1611252,JN,bottom row right,11,Total,0,0,1,1,0,,,3.5
UCR0105244,4/20/2010,2010,4,20,110,integrifolia,San Bernardino,"eastern end of Granite Mountains, UC Granite Mountains Desert Research Center, upper Granite Cove in Granite Cove Spring area",1322,34.78444,-115.65972,,,,,cch2,1634688,,"Sandy colluvium derived from granite, on canyon bottom with boulders and Baccharis sergiloides, Muhlenbergia rigida, Salix exigua, Acacia greggii.",http://cch2.org/portal/collections/individual/index.php?occid=1634688,JN,,NA,,,,,,,y,y,#DIV/0!
UCR0077038,4/21/1996,1996,4,21,112,,Los Angeles,"Antelope Valley. north side of State Hwy 138 (= Ave. D), c. 2 mi. west of Country Store, at town of Neenach (c. 30 mi. west of Hwy I-14).",915,34.78567,-118.63333,,,,,cch2,1465836,,"Small gravel wash running N/NE in previously plowed agricultural fields. Many exotic & native annuals & perennials, but only a few shrubs. Assoc. w/ Eschscholzia californica, Lupinus excubitus, Bromus rubens, etc.",http://cch2.org/portal/collections/individual/index.php?occid=1465836,JN,swelling and curving of pedicel used as determination for immature fruits,1,Total,1,2,4,10,1,,,3.444444444
UCR0105262,3/22/2006,2006,3,22,81,,Los Angeles,"south side of Oso Canyon, 1/2 mile above the National Cement Plant Rd., 1.2 mi. north of Quail Lake",1006,34.78889,-118.7375,,,,,cch2,1606323,,"Rolling hills cut by canyons, loam soil; annual grassland dominated by Bromus spp.",http://cch2.org/portal/collections/individual/index.php?occid=1606323,JN,There is a clipping at the very top of the plant (excluded). This is the left plant on the top row with the interesting base.,1,Total,2,1,0,2,0,,,2.4
UCR0105262,3/22/2006,2006,3,22,81,,Los Angeles,"south side of Oso Canyon, 1/2 mile above the National Cement Plant Rd., 1.2 mi. north of Quail Lake",1006,34.78889,-118.7375,,,,,cch2,1606323,,"Rolling hills cut by canyons, loam soil; annual grassland dominated by Bromus spp.",http://cch2.org/portal/collections/individual/index.php?occid=1606323,JN,Middle plant taking up most of the middle of the page.,2,Total,1,1,0,2,1,,,3.2
UCR0105262,3/22/2006,2006,3,22,81,,Los Angeles,"south side of Oso Canyon, 1/2 mile above the National Cement Plant Rd., 1.2 mi. north of Quail Lake",1006,34.78889,-118.7375,,,,,cch2,1606323,,"Rolling hills cut by canyons, loam soil; annual grassland dominated by Bromus spp.",http://cch2.org/portal/collections/individual/index.php?occid=1606323,JN,Plant second from right on top,3,Total,1,1,0,0,0,,,1.5
UCR0105262,3/22/2006,2006,3,22,81,,Los Angeles,"south side of Oso Canyon, 1/2 mile above the National Cement Plant Rd., 1.2 mi. north of Quail Lake",1006,34.78889,-118.7375,,,,,cch2,1606323,,"Rolling hills cut by canyons, loam soil; annual grassland dominated by Bromus spp.",http://cch2.org/portal/collections/individual/index.php?occid=1606323,JN,Plant rightmost on top,4,Total,2,2,0,1,0,,,2
UCR0105262,3/22/2006,2006,3,22,81,,Los Angeles,"south side of Oso Canyon, 1/2 mile above the National Cement Plant Rd., 1.2 mi. north of Quail Lake",1006,34.78889,-118.7375,,,,,cch2,1606323,,"Rolling hills cut by canyons, loam soil; annual grassland dominated by Bromus spp.",http://cch2.org/portal/collections/individual/index.php?occid=1606323,JN,"bottom row, leftmost",5,Total,1,1,0,0,0,,,1.5
UCR0105262,3/22/2006,2006,3,22,81,,Los Angeles,"south side of Oso Canyon, 1/2 mile above the National Cement Plant Rd., 1.2 mi. north of Quail Lake",1006,34.78889,-118.7375,,,,,cch2,1606323,,"Rolling hills cut by canyons, loam soil; annual grassland dominated by Bromus spp.",http://cch2.org/portal/collections/individual/index.php?occid=1606323,JN,"bottom row, second from left",6,Total,0,1,0,1,0,,,3
UCR0105262,3/22/2006,2006,3,22,81,,Los Angeles,"south side of Oso Canyon, 1/2 mile above the National Cement Plant Rd., 1.2 mi. north of Quail Lake",1006,34.78889,-118.7375,,,,,cch2,1606323,,"Rolling hills cut by canyons, loam soil; annual grassland dominated by Bromus spp.",http://cch2.org/portal/collections/individual/index.php?occid=1606323,JN,"bottom row, third from left with only one flower and no other structures",7,Total,0,1,0,0,0,,,2
UCR0105262,3/22/2006,2006,3,22,81,,Los Angeles,"south side of Oso Canyon, 1/2 mile above the National Cement Plant Rd., 1.2 mi. north of Quail Lake",1006,34.78889,-118.7375,,,,,cch2,1606323,,"Rolling hills cut by canyons, loam soil; annual grassland dominated by Bromus spp.",http://cch2.org/portal/collections/individual/index.php?occid=1606323,JN,second from right on bottom row only has one flower and no other structures,8,Total,0,1,0,0,0,,,2
UCR0105262,3/22/2006,2006,3,22,81,,Los Angeles,"south side of Oso Canyon, 1/2 mile above the National Cement Plant Rd., 1.2 mi. north of Quail Lake",1006,34.78889,-118.7375,,,,,cch2,1606323,,"Rolling hills cut by canyons, loam soil; annual grassland dominated by Bromus spp.",http://cch2.org/portal/collections/individual/index.php?occid=1606323,JN,bottom right,9,Total,2,1,0,0,0,,,1.333333333
UCR0077007,4/14/2008,2008,4,14,105,,Los Angeles,"southeastern foothills, 1.6 mi N of Lancaster Rd/Hwy 138, 1.5 mi S of L.A./Kern Co. border, 1.2 mi E of the CA Aqueduct and 2.14 mi W of 300th St W",948,34.7955,-118.69864,,,,,cch2,1699640,,"Lower NW-facing 1-5° slope, above NE-tending drainage, with grasses, abundant annuals, and scattered low shrubs; Collinsia bartsiifolia, Monolopia lanceolata, Amsinckia tessellata, Lomatium utriculatum, Lepidum nitidum, Trifolium albopurpureum, Microseris sylvatica, Juncus balticus, Stipa pulchra, Lessingia filaginifolia.",http://cch2.org/portal/collections/individual/index.php?occid=1699640,JN,top left,1,Total,1,1,2,1,1,,,3
UCR0077007,4/14/2008,2008,4,14,105,,Los Angeles,"southeastern foothills, 1.6 mi N of Lancaster Rd/Hwy 138, 1.5 mi S of L.A./Kern Co. border, 1.2 mi E of the CA Aqueduct and 2.14 mi W of 300th St W",948,34.7955,-118.69864,,,,,cch2,1699640,,"Lower NW-facing 1-5° slope, above NE-tending drainage, with grasses, abundant annuals, and scattered low shrubs; Collinsia bartsiifolia, Monolopia lanceolata, Amsinckia tessellata, Lomatium utriculatum, Lepidum nitidum, Trifolium albopurpureum, Microseris sylvatica, Juncus balticus, Stipa pulchra, Lessingia filaginifolia.",http://cch2.org/portal/collections/individual/index.php?occid=1699640,JN,top right,2,Total,7,4,0,2,0,,,1.769230769
UCR0077007,4/14/2008,2008,4,14,105,,Los Angeles,"southeastern foothills, 1.6 mi N of Lancaster Rd/Hwy 138, 1.5 mi S of L.A./Kern Co. border, 1.2 mi E of the CA Aqueduct and 2.14 mi W of 300th St W",948,34.7955,-118.69864,,,,,cch2,1699640,,"Lower NW-facing 1-5° slope, above NE-tending drainage, with grasses, abundant annuals, and scattered low shrubs; Collinsia bartsiifolia, Monolopia lanceolata, Amsinckia tessellata, Lomatium utriculatum, Lepidum nitidum, Trifolium albopurpureum, Microseris sylvatica, Juncus balticus, Stipa pulchra, Lessingia filaginifolia.",http://cch2.org/portal/collections/individual/index.php?occid=1699640,JN,bottom left (bottom right not whole),3,Total,1,6,2,2,3,,,3
UCR0105266,4/18/2006,2006,4,18,108,,Los Angeles,"Oso Canyon, c. 2 miles due north of the west end of Quail Lake",1037,34.79944,-118.75833,,,,,cch2,1606605,,Grassy hillsides in oak woodland.,http://cch2.org/portal/collections/individual/index.php?occid=1606605,JN,plants scored in order from left to right. leftmost plant,1,Total,0,1,1,0,0,,,2.5
UCR0105266,4/18/2006,2006,4,18,108,,Los Angeles,"Oso Canyon, c. 2 miles due north of the west end of Quail Lake",1037,34.79944,-118.75833,,,,,cch2,1606605,,Grassy hillsides in oak woodland.,http://cch2.org/portal/collections/individual/index.php?occid=1606605,JN,second from left,2,Total,0,1,0,1,1,,,3.666666667
UCR0105266,4/18/2006,2006,4,18,108,,Los Angeles,"Oso Canyon, c. 2 miles due north of the west end of Quail Lake",1037,34.79944,-118.75833,,,,,cch2,1606605,,Grassy hillsides in oak woodland.,http://cch2.org/portal/collections/individual/index.php?occid=1606605,JN,second from right,3,Total,1,1,0,0,0,,,1.5
UCR0105266,4/18/2006,2006,4,18,108,,Los Angeles,"Oso Canyon, c. 2 miles due north of the west end of Quail Lake",1037,34.79944,-118.75833,,,,,cch2,1606605,,Grassy hillsides in oak woodland.,http://cch2.org/portal/collections/individual/index.php?occid=1606605,JN,rightmost,4,Total,1,1,1,0,0,,,2
UCR0077015,4/28/2009,2009,4,28,118,menziesii,Los Angeles,"Tejon Ranch, SE of Lebec, ridge overlooking Interstate 5, about 1.3 miles ENE of Gorman; site PO1086",1371,34.8,-118.83014,,,,,cch2,1676202,,Ridge top with extensive grasslands and flower fields.,http://cch2.org/portal/collections/individual/index.php?occid=1676202,JN,bottom left plant (far left is not whole),1,Total,0,2,1,3,3,,,3.777777778
UCR0077015,4/28/2009,2009,4,28,118,menziesii,Los Angeles,"Tejon Ranch, SE of Lebec, ridge overlooking Interstate 5, about 1.3 miles ENE of Gorman; site PO1086",1371,34.8,-118.83014,,,,,cch2,1676202,,Ridge top with extensive grasslands and flower fields.,http://cch2.org/portal/collections/individual/index.php?occid=1676202,JN,far right on bottom,2,Total,0,0,0,0,1,,,5
UCR0105267,4/19/2007,2007,4,19,109,,Los Angeles,hills north of Oso Canyon and south of the National Cement Plant,1006,34.80417,-118.74917,,,,,cch2,1603706,,"Grassland on loamy hills with groves of junipers, sometimes dense, on steep or rocky slopes.",http://cch2.org/portal/collections/individual/index.php?occid=1603706,WW,top left,1,Total,0,2,0,3,0,,,3.2
UCR0105267,4/19/2007,2007,4,19,109,,Los Angeles,hills north of Oso Canyon and south of the National Cement Plant,1006,34.80417,-118.74917,,,,,cch2,1603706,,"Grassland on loamy hills with groves of junipers, sometimes dense, on steep or rocky slopes.",http://cch2.org/portal/collections/individual/index.php?occid=1603706,WW,some overlap,2,Total,1,5,4,5,2,,,3.117647059
UCR0105267,4/19/2007,2007,4,19,109,,Los Angeles,hills north of Oso Canyon and south of the National Cement Plant,1006,34.80417,-118.74917,,,,,cch2,1603706,,"Grassland on loamy hills with groves of junipers, sometimes dense, on steep or rocky slopes.",http://cch2.org/portal/collections/individual/index.php?occid=1603706,WW,fruits determined by pedicel thickness,3,Total,0,3,2,3,1,,,3.222222222
UCR0105267,4/19/2007,2007,4,19,109,,Los Angeles,hills north of Oso Canyon and south of the National Cement Plant,1006,34.80417,-118.74917,,,,,cch2,1603706,,"Grassland on loamy hills with groves of junipers, sometimes dense, on steep or rocky slopes.",http://cch2.org/portal/collections/individual/index.php?occid=1603706,WW,bottom left,4,Total,1,2,0,0,0,,,1.666666667
UCR0105267,4/19/2007,2007,4,19,109,,Los Angeles,hills north of Oso Canyon and south of the National Cement Plant,1006,34.80417,-118.74917,,,,,cch2,1603706,,"Grassland on loamy hills with groves of junipers, sometimes dense, on steep or rocky slopes.",http://cch2.org/portal/collections/individual/index.php?occid=1603706,WW,,5,Total,2,0,5,4,0,,,3
UCR0105259,4/20/2010,2010,4,20,110,,Los Angeles,"Crane Canyon, 1.0 mi. SE (144°) of Castac Lake, 1.7 mi. NE (43°) of Gorman, just S of Kern Co. line",1141,34.81389,-118.83194,,,,,cch2,1632057,,Rounded hills and large gravelly wash; decomposed granite soil; oak woodland (sparse) and grassland with many annuals.,http://cch2.org/portal/collections/individual/index.php?occid=1632057,WW,,1,Total,0,1,0,2,0,,,3.333333333
UCR0105259,4/20/2010,2010,4,20,110,,Los Angeles,"Crane Canyon, 1.0 mi. SE (144°) of Castac Lake, 1.7 mi. NE (43°) of Gorman, just S of Kern Co. line",1141,34.81389,-118.83194,,,,,cch2,1632057,,Rounded hills and large gravelly wash; decomposed granite soil; oak woodland (sparse) and grassland with many annuals.,http://cch2.org/portal/collections/individual/index.php?occid=1632057,WW,,2,Total,0,0,1,2,0,,,3.666666667
UCR0105259,4/20/2010,2010,4,20,110,,Los Angeles,"Crane Canyon, 1.0 mi. SE (144°) of Castac Lake, 1.7 mi. NE (43°) of Gorman, just S of Kern Co. line",1141,34.81389,-118.83194,,,,,cch2,1632057,,Rounded hills and large gravelly wash; decomposed granite soil; oak woodland (sparse) and grassland with many annuals.,http://cch2.org/portal/collections/individual/index.php?occid=1632057,WW,,3,Total,0,0,0,3,0,,,4
UCR0105259,4/20/2010,2010,4,20,110,,Los Angeles,"Crane Canyon, 1.0 mi. SE (144°) of Castac Lake, 1.7 mi. NE (43°) of Gorman, just S of Kern Co. line",1141,34.81389,-118.83194,,,,,cch2,1632057,,Rounded hills and large gravelly wash; decomposed granite soil; oak woodland (sparse) and grassland with many annuals.,http://cch2.org/portal/collections/individual/index.php?occid=1632057,WW,can't see through sepals; immature determined by roundness and pedicel curvature,4,Total,0,2,2,1,0,,,2.8
UCR0105259,4/20/2010,2010,4,20,110,,Los Angeles,"Crane Canyon, 1.0 mi. SE (144°) of Castac Lake, 1.7 mi. NE (43°) of Gorman, just S of Kern Co. line",1141,34.81389,-118.83194,,,,,cch2,1632057,,Rounded hills and large gravelly wash; decomposed granite soil; oak woodland (sparse) and grassland with many annuals.,http://cch2.org/portal/collections/individual/index.php?occid=1632057,WW,,5,Total,0,1,1,1,1,,,3.5
UCR0105259,4/20/2010,2010,4,20,110,,Los Angeles,"Crane Canyon, 1.0 mi. SE (144°) of Castac Lake, 1.7 mi. NE (43°) of Gorman, just S of Kern Co. line",1141,34.81389,-118.83194,,,,,cch2,1632057,,Rounded hills and large gravelly wash; decomposed granite soil; oak woodland (sparse) and grassland with many annuals.,http://cch2.org/portal/collections/individual/index.php?occid=1632057,WW,,6,Total,0,0,1,2,1,,,4
UCR0105259,4/20/2010,2010,4,20,110,,Los Angeles,"Crane Canyon, 1.0 mi. SE (144°) of Castac Lake, 1.7 mi. NE (43°) of Gorman, just S of Kern Co. line",1141,34.81389,-118.83194,,,,,cch2,1632057,,Rounded hills and large gravelly wash; decomposed granite soil; oak woodland (sparse) and grassland with many annuals.,http://cch2.org/portal/collections/individual/index.php?occid=1632057,WW,,7,Total,0,2,0,1,0,,,2.666666667
UCR0105259,4/20/2010,2010,4,20,110,,Los Angeles,"Crane Canyon, 1.0 mi. SE (144°) of Castac Lake, 1.7 mi. NE (43°) of Gorman, just S of Kern Co. line",1141,34.81389,-118.83194,,,,,cch2,1632057,,Rounded hills and large gravelly wash; decomposed granite soil; oak woodland (sparse) and grassland with many annuals.,http://cch2.org/portal/collections/individual/index.php?occid=1632057,WW,,8,Total,2,1,1,0,0,,,1.75
UCR0105259,4/20/2010,2010,4,20,110,,Los Angeles,"Crane Canyon, 1.0 mi. SE (144°) of Castac Lake, 1.7 mi. NE (43°) of Gorman, just S of Kern Co. line",1141,34.81389,-118.83194,,,,,cch2,1632057,,Rounded hills and large gravelly wash; decomposed granite soil; oak woodland (sparse) and grassland with many annuals.,http://cch2.org/portal/collections/individual/index.php?occid=1632057,WW,,9,Total,0,0,1,0,0,,,3
UCR0105259,4/20/2010,2010,4,20,110,,Los Angeles,"Crane Canyon, 1.0 mi. SE (144°) of Castac Lake, 1.7 mi. NE (43°) of Gorman, just S of Kern Co. line",1141,34.81389,-118.83194,,,,,cch2,1632057,,Rounded hills and large gravelly wash; decomposed granite soil; oak woodland (sparse) and grassland with many annuals.,http://cch2.org/portal/collections/individual/index.php?occid=1632057,WW,,10,Total,0,0,0,1,1,,,4.5
UCR0105259,4/20/2010,2010,4,20,110,,Los Angeles,"Crane Canyon, 1.0 mi. SE (144°) of Castac Lake, 1.7 mi. NE (43°) of Gorman, just S of Kern Co. line",1141,34.81389,-118.83194,,,,,cch2,1632057,,Rounded hills and large gravelly wash; decomposed granite soil; oak woodland (sparse) and grassland with many annuals.,http://cch2.org/portal/collections/individual/index.php?occid=1632057,WW,,11,Total,0,1,2,1,0,,,3
UCR0105260,4/25/2007,2007,4,25,115,,Los Angeles,"Oso Canyon, 0.5 mi. SE of Kern Co. line, on Oso Canyon Rd.",1128,34.81417,-118.78472,,,,,cch2,1604922,,"Grassland and sandy wash with Quercus lobata at edge, and shaded north-facing slope with Quercus chrysolepis and Q. wislizeni.",http://cch2.org/portal/collections/individual/index.php?occid=1604922,WW,,1,Total,0,5,11,0,2,,,2.944444444
UCR0077110,4/21/2005,2005,4,21,111,integrifolia,San Bernardino,"Granite Mountains; Cottonwood Basin, UC Granite Mountains Desert Research Center",1348,34.8192,-115.64787,,,,,cch2,1650892,,"Hillside with Ambrosia dumosa, Yucca schidigera, Coleogyne ramosissima, Lycium andersonii, Acamptopappus sphaerocephala, Cylindropuntia acanthocarpa.",http://cch2.org/portal/collections/individual/index.php?occid=1650892,WW,all clippings; full plant overlapped and bad color,NA,,,,,,,y,y,#DIV/0!
UCR0076995,5/11/2007,2007,5,11,131,,Kern,"hills c. 3/4 mile east of Castac Lake, east of the pipeline road and west of Dry Field Canyon",1280,34.84194,-118.81889,,,,,cch2,1602734,,Open grassy meadow surrounded by oak woodland.,http://cch2.org/portal/collections/individual/index.php?occid=1602734,WW,,1,Total,10,8,5,0,0,,,1.782608696
UCR0076998,3/30/2010,2010,3,30,89,,Kern,"hills between Big Sycamore and Little Sycamore canyons, north of reservoir on Calif. Aqueduct",998,34.84278,-118.69528,,,,,cch2,1630104,,Rounded hills with soil of decomposed granite and pockets of clay; annual grassland.,http://cch2.org/portal/collections/individual/index.php?occid=1630104,WW,,1,Total,2,1,1,0,0,,,1.75
UCR0076998,3/30/2010,2010,3,30,89,,Kern,"hills between Big Sycamore and Little Sycamore canyons, north of reservoir on Calif. Aqueduct",998,34.84278,-118.69528,,,,,cch2,1630104,,Rounded hills with soil of decomposed granite and pockets of clay; annual grassland.,http://cch2.org/portal/collections/individual/index.php?occid=1630104,WW,,2,Total,0,1,0,1,0,,,3
UCR0076998,3/30/2010,2010,3,30,89,,Kern,"hills between Big Sycamore and Little Sycamore canyons, north of reservoir on Calif. Aqueduct",998,34.84278,-118.69528,,,,,cch2,1630104,,Rounded hills with soil of decomposed granite and pockets of clay; annual grassland.,http://cch2.org/portal/collections/individual/index.php?occid=1630104,WW,,3,Total,5,4,4,5,2,,,2.75
UCR0076998,3/30/2010,2010,3,30,89,,Kern,"hills between Big Sycamore and Little Sycamore canyons, north of reservoir on Calif. Aqueduct",998,34.84278,-118.69528,,,,,cch2,1630104,,Rounded hills with soil of decomposed granite and pockets of clay; annual grassland.,http://cch2.org/portal/collections/individual/index.php?occid=1630104,WW,,4,Total,3,2,1,1,0,,,2
UCR0076998,3/30/2010,2010,3,30,89,,Kern,"hills between Big Sycamore and Little Sycamore canyons, north of reservoir on Calif. Aqueduct",998,34.84278,-118.69528,,,,,cch2,1630104,,Rounded hills with soil of decomposed granite and pockets of clay; annual grassland.,http://cch2.org/portal/collections/individual/index.php?occid=1630104,WW,,5,Total,1,1,1,0,0,,,2
UCR0076996,4/6/2010,2010,4,6,96,,Kern,"Little Sycamore Canyon, 0.65 km NE (33°) of VABM Cow on rounded ridge between east and west forks of canyon",1009,34.84622,-118.70036,,,,,cch2,1632120,,"Rolling hills with open oak woodland and grassland with Stipa pulchra, Nemophila menziesii, Thysanocarpus curvipes, Plagiobothrys nothofulvus, annual grasses, Phlox gracilis, etc.",http://cch2.org/portal/collections/individual/index.php?occid=1632120,WW,,1,Total,1,2,0,2,0,,,2.6
UCR0076996,4/6/2010,2010,4,6,96,,Kern,"Little Sycamore Canyon, 0.65 km NE (33°) of VABM Cow on rounded ridge between east and west forks of canyon",1009,34.84622,-118.70036,,,,,cch2,1632120,,"Rolling hills with open oak woodland and grassland with Stipa pulchra, Nemophila menziesii, Thysanocarpus curvipes, Plagiobothrys nothofulvus, annual grasses, Phlox gracilis, etc.",http://cch2.org/portal/collections/individual/index.php?occid=1632120,WW,,2,Total,1,2,0,2,0,,,2.6
UCR0076996,4/6/2010,2010,4,6,96,,Kern,"Little Sycamore Canyon, 0.65 km NE (33°) of VABM Cow on rounded ridge between east and west forks of canyon",1009,34.84622,-118.70036,,,,,cch2,1632120,,"Rolling hills with open oak woodland and grassland with Stipa pulchra, Nemophila menziesii, Thysanocarpus curvipes, Plagiobothrys nothofulvus, annual grasses, Phlox gracilis, etc.",http://cch2.org/portal/collections/individual/index.php?occid=1632120,WW,,3,Total,0,1,1,0,0,,,2.5
UCR0076996,4/6/2010,2010,4,6,96,,Kern,"Little Sycamore Canyon, 0.65 km NE (33°) of VABM Cow on rounded ridge between east and west forks of canyon",1009,34.84622,-118.70036,,,,,cch2,1632120,,"Rolling hills with open oak woodland and grassland with Stipa pulchra, Nemophila menziesii, Thysanocarpus curvipes, Plagiobothrys nothofulvus, annual grasses, Phlox gracilis, etc.",http://cch2.org/portal/collections/individual/index.php?occid=1632120,WW,,4,Total,0,1,0,0,0,,,2
UCR0076996,4/6/2010,2010,4,6,96,,Kern,"Little Sycamore Canyon, 0.65 km NE (33°) of VABM Cow on rounded ridge between east and west forks of canyon",1009,34.84622,-118.70036,,,,,cch2,1632120,,"Rolling hills with open oak woodland and grassland with Stipa pulchra, Nemophila menziesii, Thysanocarpus curvipes, Plagiobothrys nothofulvus, annual grasses, Phlox gracilis, etc.",http://cch2.org/portal/collections/individual/index.php?occid=1632120,WW,,5,Total,1,1,0,0,0,,,1.5
UCR0076996,4/6/2010,2010,4,6,96,,Kern,"Little Sycamore Canyon, 0.65 km NE (33°) of VABM Cow on rounded ridge between east and west forks of canyon",1009,34.84622,-118.70036,,,,,cch2,1632120,,"Rolling hills with open oak woodland and grassland with Stipa pulchra, Nemophila menziesii, Thysanocarpus curvipes, Plagiobothrys nothofulvus, annual grasses, Phlox gracilis, etc.",http://cch2.org/portal/collections/individual/index.php?occid=1632120,WW,,6,Total,0,2,2,3,0,,,3.142857143
UCR0076996,4/6/2010,2010,4,6,96,,Kern,"Little Sycamore Canyon, 0.65 km NE (33°) of VABM Cow on rounded ridge between east and west forks of canyon",1009,34.84622,-118.70036,,,,,cch2,1632120,,"Rolling hills with open oak woodland and grassland with Stipa pulchra, Nemophila menziesii, Thysanocarpus curvipes, Plagiobothrys nothofulvus, annual grasses, Phlox gracilis, etc.",http://cch2.org/portal/collections/individual/index.php?occid=1632120,WW,,7,Total,0,1,1,0,0,,,2.5
UCR0076996,4/6/2010,2010,4,6,96,,Kern,"Little Sycamore Canyon, 0.65 km NE (33°) of VABM Cow on rounded ridge between east and west forks of canyon",1009,34.84622,-118.70036,,,,,cch2,1632120,,"Rolling hills with open oak woodland and grassland with Stipa pulchra, Nemophila menziesii, Thysanocarpus curvipes, Plagiobothrys nothofulvus, annual grasses, Phlox gracilis, etc.",http://cch2.org/portal/collections/individual/index.php?occid=1632120,WW,,8,Total,1,1,1,0,0,,,2
UCR0076996,4/6/2010,2010,4,6,96,,Kern,"Little Sycamore Canyon, 0.65 km NE (33°) of VABM Cow on rounded ridge between east and west forks of canyon",1009,34.84622,-118.70036,,,,,cch2,1632120,,"Rolling hills with open oak woodland and grassland with Stipa pulchra, Nemophila menziesii, Thysanocarpus curvipes, Plagiobothrys nothofulvus, annual grasses, Phlox gracilis, etc.",http://cch2.org/portal/collections/individual/index.php?occid=1632120,WW,,9,Total,2,1,0,0,0,,,1.333333333
UCR0076996,4/6/2010,2010,4,6,96,,Kern,"Little Sycamore Canyon, 0.65 km NE (33°) of VABM Cow on rounded ridge between east and west forks of canyon",1009,34.84622,-118.70036,,,,,cch2,1632120,,"Rolling hills with open oak woodland and grassland with Stipa pulchra, Nemophila menziesii, Thysanocarpus curvipes, Plagiobothrys nothofulvus, annual grasses, Phlox gracilis, etc.",http://cch2.org/portal/collections/individual/index.php?occid=1632120,WW,,10,Total,1,1,0,1,0,,,2.333333333
UCR0076993,4/23/2009,2009,4,23,113,menziesii,Kern,"Tejon Ranch, Los Alamos Creek, c. 5 miles NNE of Quail Lake",1012,34.84767,-118.72403,,,,,cch2,1671329,,"Canyon slopes and shaded creek, assoc. with Quercus lobata, Fraxinus velutina, Salix lasiolepis, Juniperus californica.",http://cch2.org/portal/collections/individual/index.php?occid=1671329,WW,skipped overlapping plants,1,Total,0,0,5,2,1,,,3.5
UCR0076993,4/23/2009,2009,4,23,113,menziesii,Kern,"Tejon Ranch, Los Alamos Creek, c. 5 miles NNE of Quail Lake",1012,34.84767,-118.72403,,,,,cch2,1671329,,"Canyon slopes and shaded creek, assoc. with Quercus lobata, Fraxinus velutina, Salix lasiolepis, Juniperus californica.",http://cch2.org/portal/collections/individual/index.php?occid=1671329,WW,,2,Total,1,2,11,2,2,,,3.111111111
UCR0076993,4/23/2009,2009,4,23,113,menziesii,Kern,"Tejon Ranch, Los Alamos Creek, c. 5 miles NNE of Quail Lake",1012,34.84767,-118.72403,,,,,cch2,1671329,,"Canyon slopes and shaded creek, assoc. with Quercus lobata, Fraxinus velutina, Salix lasiolepis, Juniperus californica.",http://cch2.org/portal/collections/individual/index.php?occid=1671329,WW,,3,Total,0,0,2,0,0,,,3
UCR0076993,4/23/2009,2009,4,23,113,menziesii,Kern,"Tejon Ranch, Los Alamos Creek, c. 5 miles NNE of Quail Lake",1012,34.84767,-118.72403,,,,,cch2,1671329,,"Canyon slopes and shaded creek, assoc. with Quercus lobata, Fraxinus velutina, Salix lasiolepis, Juniperus californica.",http://cch2.org/portal/collections/individual/index.php?occid=1671329,WW,,4,Total,1,0,6,4,1,,,3.333333333
UCR0076993,4/23/2009,2009,4,23,113,menziesii,Kern,"Tejon Ranch, Los Alamos Creek, c. 5 miles NNE of Quail Lake",1012,34.84767,-118.72403,,,,,cch2,1671329,,"Canyon slopes and shaded creek, assoc. with Quercus lobata, Fraxinus velutina, Salix lasiolepis, Juniperus californica.",http://cch2.org/portal/collections/individual/index.php?occid=1671329,WW,,5,Total,1,1,2,6,3,,,3.692307692
UCR0105261,4/27/2007,2007,4,27,117,,Los Angeles,"Bronco Canyon, c. 0.5 mi above confluence with Pescado Creek",1067,34.8675,-118.67594,,,,,cch2,1605852,,"Steep, NE-facing grassy slope, clay loam soil.",http://cch2.org/portal/collections/individual/index.php?occid=1605852,WW,far left,1,Total,0,1,1,0,2,,,3.75
UCR0105261,4/27/2007,2007,4,27,117,,Los Angeles,"Bronco Canyon, c. 0.5 mi above confluence with Pescado Creek",1067,34.8675,-118.67594,,,,,cch2,1605852,,"Steep, NE-facing grassy slope, clay loam soil.",http://cch2.org/portal/collections/individual/index.php?occid=1605852,WW,,2,Total,1,1,0,0,2,,,3.25
UCR0105261,4/27/2007,2007,4,27,117,,Los Angeles,"Bronco Canyon, c. 0.5 mi above confluence with Pescado Creek",1067,34.8675,-118.67594,,,,,cch2,1605852,,"Steep, NE-facing grassy slope, clay loam soil.",http://cch2.org/portal/collections/individual/index.php?occid=1605852,WW,bottom plant,3,Total,2,2,1,2,2,,,3
UCR0105292,5/7/2005,2005,5,7,127,menziesii,Kern,Ft. Tejon State Park,1067,34.8725,-118.89639,,,,,cch2,3143333,,,http://cch2.org/portal/collections/individual/index.php?occid=3143333,WW,,1,Total,0,3,4,11,10,,,4
UCR0076989,5/13/1998,1998,5,13,133,,Kern,"San Emigdio Ranch, Tecuya Ridge at end of Digier Road",1433,34.88231,-118.94681,,,,,cch2,1701855,,Grassland & oak woodland with Quercus lobata.,http://cch2.org/portal/collections/individual/index.php?occid=1701855,WW,ambiguous structures weird placement on plant,1,Total,4,4,4,3,2,,,2.705882353
UCR0076989,5/13/1998,1998,5,13,133,,Kern,"San Emigdio Ranch, Tecuya Ridge at end of Digier Road",1433,34.88231,-118.94681,,,,,cch2,1701855,,Grassland & oak woodland with Quercus lobata.,http://cch2.org/portal/collections/individual/index.php?occid=1701855,WW,,2,Total,2,2,2,1,0,,,2.285714286
UCR0076999,4/26/2010,2010,4,26,116,,Kern,"mouth of Canyon de la Lecheria, north of the end of 290th St. West, head of Pescado Creek",1259,34.88731,-118.65233,,,,,cch2,1633083,,"Grassy N-facing slope at edge of oak scrub of 10-15 ft. tall Q. john-tuckeri, on decomposed granite soil.",http://cch2.org/portal/collections/individual/index.php?occid=1633083,WW,skipped overlapping plants,1,Total,1,2,3,7,1,,,3.357142857
UCR0076999,4/26/2010,2010,4,26,116,,Kern,"mouth of Canyon de la Lecheria, north of the end of 290th St. West, head of Pescado Creek",1259,34.88731,-118.65233,,,,,cch2,1633083,,"Grassy N-facing slope at edge of oak scrub of 10-15 ft. tall Q. john-tuckeri, on decomposed granite soil.",http://cch2.org/portal/collections/individual/index.php?occid=1633083,WW,immature determined by roundness because can't see fruit shape through sepals,2,Total,1,3,2,7,0,,,3.153846154
UCR0076999,4/26/2010,2010,4,26,116,,Kern,"mouth of Canyon de la Lecheria, north of the end of 290th St. West, head of Pescado Creek",1259,34.88731,-118.65233,,,,,cch2,1633083,,"Grassy N-facing slope at edge of oak scrub of 10-15 ft. tall Q. john-tuckeri, on decomposed granite soil.",http://cch2.org/portal/collections/individual/index.php?occid=1633083,WW,immature determined by pedicel length and curvature because can't see fruit shape through sepals,3,Total,1,3,5,4,0,,,2.923076923
UCR0076999,4/26/2010,2010,4,26,116,,Kern,"mouth of Canyon de la Lecheria, north of the end of 290th St. West, head of Pescado Creek",1259,34.88731,-118.65233,,,,,cch2,1633083,,"Grassy N-facing slope at edge of oak scrub of 10-15 ft. tall Q. john-tuckeri, on decomposed granite soil.",http://cch2.org/portal/collections/individual/index.php?occid=1633083,WW,immature determined by pedicel length and curvature because can't see fruit shape through sepals,4,Total,0,0,3,2,1,,,3.666666667
UCR0076988,4/11/2005,2005,4,11,101,,Kern,"San Emigdio Ranch, Tecuya Ridge",1500,34.88889,-118.95139,,,,,cch2,1701807,,Blue oak grassland.,http://cch2.org/portal/collections/individual/index.php?occid=1701807,WW,far right,1,Total,3,4,0,3,0,,,2.3
UCR0076988,4/11/2005,2005,4,11,101,,Kern,"San Emigdio Ranch, Tecuya Ridge",1500,34.88889,-118.95139,,,,,cch2,1701807,,Blue oak grassland.,http://cch2.org/portal/collections/individual/index.php?occid=1701807,WW,middle,2,Total,1,2,0,3,2,,,3.375
UCR0076988,4/11/2005,2005,4,11,101,,Kern,"San Emigdio Ranch, Tecuya Ridge",1500,34.88889,-118.95139,,,,,cch2,1701807,,Blue oak grassland.,http://cch2.org/portal/collections/individual/index.php?occid=1701807,WW,,3,Total,3,2,0,4,0,,,2.555555556
UCR0076992,4/20/2009,2009,4,20,110,,Kern,"Tejon Ranch, Bronco Canyon (upper), about 4.5 miles N of the Tehachapi Afterbay",1340,34.88981,-118.69111,,,,,cch2,1684421,,"SW-facing slope with scattered rock outcrops, with mixed Quercus woodland, Ceanothus cuneatus, and Chrysothamnus nauseosus.",http://cch2.org/portal/collections/individual/index.php?occid=1684421,"WW, CF",,1,Total,1,0,5,0,1,,,3
UCR0076992,4/20/2009,2009,4,20,110,,Kern,"Tejon Ranch, Bronco Canyon (upper), about 4.5 miles N of the Tehachapi Afterbay",1340,34.88981,-118.69111,,,,,cch2,1684421,,"SW-facing slope with scattered rock outcrops, with mixed Quercus woodland, Ceanothus cuneatus, and Chrysothamnus nauseosus.",http://cch2.org/portal/collections/individual/index.php?occid=1684421,"WW, CF",,2,Total,4,1,4,2,1,,,2.583333333
UCR0076992,4/20/2009,2009,4,20,110,,Kern,"Tejon Ranch, Bronco Canyon (upper), about 4.5 miles N of the Tehachapi Afterbay",1340,34.88981,-118.69111,,,,,cch2,1684421,,"SW-facing slope with scattered rock outcrops, with mixed Quercus woodland, Ceanothus cuneatus, and Chrysothamnus nauseosus.",http://cch2.org/portal/collections/individual/index.php?occid=1684421,"WW, CF",,3,Total,0,0,1,2,0,,,3.666666667
UCR0076992,4/20/2009,2009,4,20,110,,Kern,"Tejon Ranch, Bronco Canyon (upper), about 4.5 miles N of the Tehachapi Afterbay",1340,34.88981,-118.69111,,,,,cch2,1684421,,"SW-facing slope with scattered rock outcrops, with mixed Quercus woodland, Ceanothus cuneatus, and Chrysothamnus nauseosus.",http://cch2.org/portal/collections/individual/index.php?occid=1684421,"WW, CF",,4,Total,2,3,7,2,2,,,2.9375
UCR0077002,3/7/1997,1997,3,7,66,,Kern,"San Emigdio Ranch, 4 km NE of Eagle Rest Peak (near bench mark 4070), along a dirt road 6.5 km north of Antimony Peak",1220,34.9355,-119.11933,,,,,cch2,1466516,,Blue oak woodland on rocky volcanic ridge and adjacent clay flats and gentle slopes.,http://cch2.org/portal/collections/individual/index.php?occid=1466516,WW,,1,Total,2,2,3,1,0,,,2.375
UCR0077002,3/7/1997,1997,3,7,66,,Kern,"San Emigdio Ranch, 4 km NE of Eagle Rest Peak (near bench mark 4070), along a dirt road 6.5 km north of Antimony Peak",1220,34.9355,-119.11933,,,,,cch2,1466516,,Blue oak woodland on rocky volcanic ridge and adjacent clay flats and gentle slopes.,http://cch2.org/portal/collections/individual/index.php?occid=1466516,WW,,2,Total,3,1,0,2,0,,,2.166666667
UCR0077002,3/7/1997,1997,3,7,66,,Kern,"San Emigdio Ranch, 4 km NE of Eagle Rest Peak (near bench mark 4070), along a dirt road 6.5 km north of Antimony Peak",1220,34.9355,-119.11933,,,,,cch2,1466516,,Blue oak woodland on rocky volcanic ridge and adjacent clay flats and gentle slopes.,http://cch2.org/portal/collections/individual/index.php?occid=1466516,WW,,3,Total,1,1,0,0,0,,,1.5
UCR0077002,3/7/1997,1997,3,7,66,,Kern,"San Emigdio Ranch, 4 km NE of Eagle Rest Peak (near bench mark 4070), along a dirt road 6.5 km north of Antimony Peak",1220,34.9355,-119.11933,,,,,cch2,1466516,,Blue oak woodland on rocky volcanic ridge and adjacent clay flats and gentle slopes.,http://cch2.org/portal/collections/individual/index.php?occid=1466516,WW,,4,Total,2,3,0,3,1,,,2.777777778
UCR0077002,3/7/1997,1997,3,7,66,,Kern,"San Emigdio Ranch, 4 km NE of Eagle Rest Peak (near bench mark 4070), along a dirt road 6.5 km north of Antimony Peak",1220,34.9355,-119.11933,,,,,cch2,1466516,,Blue oak woodland on rocky volcanic ridge and adjacent clay flats and gentle slopes.,http://cch2.org/portal/collections/individual/index.php?occid=1466516,WW,,5,Total,3,3,0,3,0,,,2.333333333
UCR0077006,4/22/1998,1998,4,22,112,,Kern,Oak Creek Pass on the Tehachapi to Willow Springs Road,1341,35.06056,-118.38806,,,,,cch2,1549436,,,http://cch2.org/portal/collections/individual/index.php?occid=1549436,WW,,1,Total,2,3,0,4,0,,,2.666666667
UCR0077006,4/22/1998,1998,4,22,112,,Kern,Oak Creek Pass on the Tehachapi to Willow Springs Road,1341,35.06056,-118.38806,,,,,cch2,1549436,,,http://cch2.org/portal/collections/individual/index.php?occid=1549436,WW,,2,Total,2,2,4,4,1,,,3
UCR0077006,4/22/1998,1998,4,22,112,,Kern,Oak Creek Pass on the Tehachapi to Willow Springs Road,1341,35.06056,-118.38806,,,,,cch2,1549436,,,http://cch2.org/portal/collections/individual/index.php?occid=1549436,WW,,3,Total,7,2,4,1,1,,,2.133333333
UCR0077006,4/22/1998,1998,4,22,112,,Kern,Oak Creek Pass on the Tehachapi to Willow Springs Road,1341,35.06056,-118.38806,,,,,cch2,1549436,,,http://cch2.org/portal/collections/individual/index.php?occid=1549436,WW,,4,Total,5,4,2,1,0,,,1.916666667
UCR0077005,4/26/2001,2001,4,26,116,menziesii,Kern,"Tehachapi to Willow Springs Rd., 2.2 miles south of Highline Rd.",1372,35.08617,-118.394,,,,,cch2,1509631,,Grassy slope and adjacent dry stream bed.,http://cch2.org/portal/collections/individual/index.php?occid=1509631,WW,blurry,1,Total,0,2,0,3,0,,,3.2
UCR0077005,4/26/2001,2001,4,26,116,menziesii,Kern,"Tehachapi to Willow Springs Rd., 2.2 miles south of Highline Rd.",1372,35.08617,-118.394,,,,,cch2,1509631,,Grassy slope and adjacent dry stream bed.,http://cch2.org/portal/collections/individual/index.php?occid=1509631,WW,,2,Total,3,3,1,0,0,,,1.714285714
UCR0077005,4/26/2001,2001,4,26,116,menziesii,Kern,"Tehachapi to Willow Springs Rd., 2.2 miles south of Highline Rd.",1372,35.08617,-118.394,,,,,cch2,1509631,,Grassy slope and adjacent dry stream bed.,http://cch2.org/portal/collections/individual/index.php?occid=1509631,WW,,3,Total,0,2,0,1,0,,,2.666666667
UCR0077005,4/26/2001,2001,4,26,116,menziesii,Kern,"Tehachapi to Willow Springs Rd., 2.2 miles south of Highline Rd.",1372,35.08617,-118.394,,,,,cch2,1509631,,Grassy slope and adjacent dry stream bed.,http://cch2.org/portal/collections/individual/index.php?occid=1509631,WW,,4,Total,1,1,1,0,0,,,2
UCR0077005,4/26/2001,2001,4,26,116,menziesii,Kern,"Tehachapi to Willow Springs Rd., 2.2 miles south of Highline Rd.",1372,35.08617,-118.394,,,,,cch2,1509631,,Grassy slope and adjacent dry stream bed.,http://cch2.org/portal/collections/individual/index.php?occid=1509631,WW,,5,Total,1,2,1,1,0,,,2.4
UCR0077005,4/26/2001,2001,4,26,116,menziesii,Kern,"Tehachapi to Willow Springs Rd., 2.2 miles south of Highline Rd.",1372,35.08617,-118.394,,,,,cch2,1509631,,Grassy slope and adjacent dry stream bed.,http://cch2.org/portal/collections/individual/index.php?occid=1509631,WW,,6,Total,4,0,1,0,0,,,1.4
UCR0077005,4/26/2001,2001,4,26,116,menziesii,Kern,"Tehachapi to Willow Springs Rd., 2.2 miles south of Highline Rd.",1372,35.08617,-118.394,,,,,cch2,1509631,,Grassy slope and adjacent dry stream bed.,http://cch2.org/portal/collections/individual/index.php?occid=1509631,WW,,7,Total,1,4,0,0,0,,,1.8
UCR0077005,4/26/2001,2001,4,26,116,menziesii,Kern,"Tehachapi to Willow Springs Rd., 2.2 miles south of Highline Rd.",1372,35.08617,-118.394,,,,,cch2,1509631,,Grassy slope and adjacent dry stream bed.,http://cch2.org/portal/collections/individual/index.php?occid=1509631,WW,,8,Total,3,2,1,0,0,,,1.666666667
UCR0077005,4/26/2001,2001,4,26,116,menziesii,Kern,"Tehachapi to Willow Springs Rd., 2.2 miles south of Highline Rd.",1372,35.08617,-118.394,,,,,cch2,1509631,,Grassy slope and adjacent dry stream bed.,http://cch2.org/portal/collections/individual/index.php?occid=1509631,WW,,9,Total,3,3,0,0,0,,,1.5
UCR0077194,4/15/2002,2002,4,15,105,menziesii,Santa Barbara,"Sierra Madre Mountains, Miranda Pine Road, 1.0 mile southeast of CA Hwy 166",549,35.09694,-120.07833,,,,,cch2,1510938,,"Oak woodland; east-facing, steep slope.",http://cch2.org/portal/collections/individual/index.php?occid=1510938,WW,,1,Total,1,1,3,0,0,,,2.4
UCR0077194,4/15/2002,2002,4,15,105,menziesii,Santa Barbara,"Sierra Madre Mountains, Miranda Pine Road, 1.0 mile southeast of CA Hwy 166",549,35.09694,-120.07833,,,,,cch2,1510938,,"Oak woodland; east-facing, steep slope.",http://cch2.org/portal/collections/individual/index.php?occid=1510938,WW,,2,Total,0,3,1,1,0,,,2.6
UCR0077191,4/16/2005,2005,4,16,106,integrifolia,Santa Barbara,"Sierra Madre Mountains, 1.1 mi south of Calif. Hwy 166 on Miranda Pines Road",526,35.1,-120.07833,,,,,cch2,1578113,,Oak woodland with grassy openings and steep roadside banks.,http://cch2.org/portal/collections/individual/index.php?occid=1578113,WW,,1,Total,1,2,5,3,2,,,3.230769231
UCR0077191,4/16/2005,2005,4,16,106,integrifolia,Santa Barbara,"Sierra Madre Mountains, 1.1 mi south of Calif. Hwy 166 on Miranda Pines Road",526,35.1,-120.07833,,,,,cch2,1578113,,Oak woodland with grassy openings and steep roadside banks.,http://cch2.org/portal/collections/individual/index.php?occid=1578113,WW,,2,Total,0,1,1,1,1,,,3.5
UCR0076990,4/20/2016,2016,4,20,111,,Kern,"Cummings Valley, along W side of W Valley Blvd. (Rt. 202). between Bear Vally Road and Administration Drive",1187,35.12489,-118.57481,,,,,cch2,1686850,,"Minor sandy-bottomed drainage with Salix exigua, the surrounding area with Ericameria nauseosa scrub.",http://cch2.org/portal/collections/individual/index.php?occid=1686850,WW,,1,Total,11,9,5,0,0,,,1.76
UCR0076991,4/14/2016,2016,4,14,105,,Kern,"Cummings Valley, N side of W Valley Blvd. near west intersection with Bertram Circle",1300,35.13411,-118.55461,,,,,cch2,1686855,,Slopes and canyons with blue oak woodland and grassland dominated by Avena and exotic bromes.,http://cch2.org/portal/collections/individual/index.php?occid=1686855,WW,,1,Total,6,6,2,1,0,,,1.866666667
UCR0077188,3/8/1997,1997,3,8,67,,San Luis Obispo,"Carrizo Plain; 30.1 mi. NW of Calif. Hwy 166 on Soda Lake Rd., at San Diego Creek Rd near edge of Soda Lake",610,35.14667,-119.77167,,,,,cch2,1466626,,Alkaline flat in sagebrush scrub.,http://cch2.org/portal/collections/individual/index.php?occid=1466626,WW,,1,Total,1,1,2,2,0,,,2.833333333
UCR0077188,3/8/1997,1997,3,8,67,,San Luis Obispo,"Carrizo Plain; 30.1 mi. NW of Calif. Hwy 166 on Soda Lake Rd., at San Diego Creek Rd near edge of Soda Lake",610,35.14667,-119.77167,,,,,cch2,1466626,,Alkaline flat in sagebrush scrub.,http://cch2.org/portal/collections/individual/index.php?occid=1466626,WW,,2,Total,2,1,0,1,0,,,2
UCR0077188,3/8/1997,1997,3,8,67,,San Luis Obispo,"Carrizo Plain; 30.1 mi. NW of Calif. Hwy 166 on Soda Lake Rd., at San Diego Creek Rd near edge of Soda Lake",610,35.14667,-119.77167,,,,,cch2,1466626,,Alkaline flat in sagebrush scrub.,http://cch2.org/portal/collections/individual/index.php?occid=1466626,WW,,3,Total,2,1,2,1,0,,,2.333333333
UCR0077188,3/8/1997,1997,3,8,67,,San Luis Obispo,"Carrizo Plain; 30.1 mi. NW of Calif. Hwy 166 on Soda Lake Rd., at San Diego Creek Rd near edge of Soda Lake",610,35.14667,-119.77167,,,,,cch2,1466626,,Alkaline flat in sagebrush scrub.,http://cch2.org/portal/collections/individual/index.php?occid=1466626,WW,,4,Total,0,1,0,0,0,,,2
UCR0077000,4/28/1973,1973,4,28,118,,Kern,"Tehachapi Loop, near Keene",915,35.2,-118.54111,,,,,cch2,1561245,,,http://cch2.org/portal/collections/individual/index.php?occid=1561245,WW,,1,Total,3,6,2,4,0,,,2.466666667
UCR0077000,4/28/1973,1973,4,28,118,,Kern,"Tehachapi Loop, near Keene",915,35.2,-118.54111,,,,,cch2,1561245,,,http://cch2.org/portal/collections/individual/index.php?occid=1561245,WW,,2,Total,2,5,1,2,0,,,2.3
UCR0077187,3/1/2005,2005,3,1,60,menziesii,San Luis Obispo,Santa Lucia Range NE of Lopez Lake; 4.8 mi. N of Hi Mountain Road along Upper Lopez Lake Road. Vicinity of Wittenberg and Huffs Hole Creeks,232,35.215,-120.44333,,,,,cch2,1581063,,"Chaparral with shaded, rocky banks, open grassy areas, and riparian zones.",http://cch2.org/portal/collections/individual/index.php?occid=1581063,WW,,1,Total,2,2,0,1,0,,,2
UCR0077187,3/1/2005,2005,3,1,60,menziesii,San Luis Obispo,Santa Lucia Range NE of Lopez Lake; 4.8 mi. N of Hi Mountain Road along Upper Lopez Lake Road. Vicinity of Wittenberg and Huffs Hole Creeks,232,35.215,-120.44333,,,,,cch2,1581063,,"Chaparral with shaded, rocky banks, open grassy areas, and riparian zones.",http://cch2.org/portal/collections/individual/index.php?occid=1581063,WW,,2,Total,1,2,0,2,0,,,2.6
UCR0077187,3/1/2005,2005,3,1,60,menziesii,San Luis Obispo,Santa Lucia Range NE of Lopez Lake; 4.8 mi. N of Hi Mountain Road along Upper Lopez Lake Road. Vicinity of Wittenberg and Huffs Hole Creeks,232,35.215,-120.44333,,,,,cch2,1581063,,"Chaparral with shaded, rocky banks, open grassy areas, and riparian zones.",http://cch2.org/portal/collections/individual/index.php?occid=1581063,WW,,3,Total,1,1,2,0,0,,,2.25
UCR0077190,3/10/1983,1983,3,10,69,,San Luis Obispo,1.8 mi. south of American Canyon Campground,506,35.26389,-120.28417,,,,,cch2,1447237,,,http://cch2.org/portal/collections/individual/index.php?occid=1447237,WW,,1,Total,5,3,3,1,2,,,2.428571429
UCR0077190,3/10/1983,1983,3,10,69,,San Luis Obispo,1.8 mi. south of American Canyon Campground,506,35.26389,-120.28417,,,,,cch2,1447237,,,http://cch2.org/portal/collections/individual/index.php?occid=1447237,WW,,2,Total,4,4,3,0,0,,,1.909090909
UCR0077186,3/30/2005,2005,3,30,89,menziesii,San Luis Obispo,"Pozo Road, 0.9 mi east of Hi Mountain Road, north side of Garcia Mountains",460,35.305,-120.36833,,,,,cch2,1583932,,"Grazing land, mostly open, but with scattered oaks.",http://cch2.org/portal/collections/individual/index.php?occid=1583932,WW,,1,Total,0,1,0,0,0,,,2
UCR0077186,3/30/2005,2005,3,30,89,menziesii,San Luis Obispo,"Pozo Road, 0.9 mi east of Hi Mountain Road, north side of Garcia Mountains",460,35.305,-120.36833,,,,,cch2,1583932,,"Grazing land, mostly open, but with scattered oaks.",http://cch2.org/portal/collections/individual/index.php?occid=1583932,WW,,2,Total,0,1,1,2,0,,,3.25
UCR0077186,3/30/2005,2005,3,30,89,menziesii,San Luis Obispo,"Pozo Road, 0.9 mi east of Hi Mountain Road, north side of Garcia Mountains",460,35.305,-120.36833,,,,,cch2,1583932,,"Grazing land, mostly open, but with scattered oaks.",http://cch2.org/portal/collections/individual/index.php?occid=1583932,WW,,3,Total,1,2,0,2,0,,,2.6
UCR0077186,3/30/2005,2005,3,30,89,menziesii,San Luis Obispo,"Pozo Road, 0.9 mi east of Hi Mountain Road, north side of Garcia Mountains",460,35.305,-120.36833,,,,,cch2,1583932,,"Grazing land, mostly open, but with scattered oaks.",http://cch2.org/portal/collections/individual/index.php?occid=1583932,WW,,4,Total,1,1,1,0,0,,,2
UCR0077186,3/30/2005,2005,3,30,89,menziesii,San Luis Obispo,"Pozo Road, 0.9 mi east of Hi Mountain Road, north side of Garcia Mountains",460,35.305,-120.36833,,,,,cch2,1583932,,"Grazing land, mostly open, but with scattered oaks.",http://cch2.org/portal/collections/individual/index.php?occid=1583932,WW,,5,Total,0,1,1,0,0,,,2.5
UCR0077189,3/8/1997,1997,3,8,67,,San Luis Obispo,c. 6 mi. west of Soda Lake Rd along Calif. Hwy 58,549,35.38,-120.10667,,,,,cch2,1466624,,Beginning of hills & chaparral,http://cch2.org/portal/collections/individual/index.php?occid=1466624,WW,,1,Total,2,2,0,3,0,,,2.571428571
UCR0077189,3/8/1997,1997,3,8,67,,San Luis Obispo,c. 6 mi. west of Soda Lake Rd along Calif. Hwy 58,549,35.38,-120.10667,,,,,cch2,1466624,,Beginning of hills & chaparral,http://cch2.org/portal/collections/individual/index.php?occid=1466624,WW,,2,Total,1,1,1,1,0,,,2.5
UCR0077189,3/8/1997,1997,3,8,67,,San Luis Obispo,c. 6 mi. west of Soda Lake Rd along Calif. Hwy 58,549,35.38,-120.10667,,,,,cch2,1466624,,Beginning of hills & chaparral,http://cch2.org/portal/collections/individual/index.php?occid=1466624,WW,,3,Total,1,0,1,2,0,,,3
UCR0077001,4/12/1958,1958,4,12,102,,Kern,"Lake Isabella, Calif. Hwy 178, 2 miles west of Weldon",799,35.6575,-118.33028,,,,,cch2,1555662,,,http://cch2.org/portal/collections/individual/index.php?occid=1555662,WW,,1,Total,7,4,1,1,3,,,2.3125
UCR0077001,4/12/1958,1958,4,12,102,,Kern,"Lake Isabella, Calif. Hwy 178, 2 miles west of Weldon",799,35.6575,-118.33028,,,,,cch2,1555662,,,http://cch2.org/portal/collections/individual/index.php?occid=1555662,WW,,2,Total,8,4,3,1,1,,,2
UCR0077003,6/27/1982,1982,6,27,178,integrifolia,Kern,"Alta Sierra, 8 miles north of Lake Isabella off Hwy 155, Greenhorn Mtns, Sequoia National Forest",1768,35.72917,-118.54944,,,,,cch2,1477006,,White fir / incense cedar phase of yellow pine forest. East exposure.,http://cch2.org/portal/collections/individual/index.php?occid=1477006,WW,,1,Total,0,0,1,1,1,,,4
UCR0077003,6/27/1982,1982,6,27,178,integrifolia,Kern,"Alta Sierra, 8 miles north of Lake Isabella off Hwy 155, Greenhorn Mtns, Sequoia National Forest",1768,35.72917,-118.54944,,,,,cch2,1477006,,White fir / incense cedar phase of yellow pine forest. East exposure.,http://cch2.org/portal/collections/individual/index.php?occid=1477006,WW,structure hidden behind leaf determined by length and shadow looks like bulb,2,Total,1,0,3,5,9,,,4.166666667
UCR0077040,3/30/1973,1973,3,30,89,menziesii,Monterey,Jolon Road cutoff,305,35.96917,-121.18361,,,,,cch2,1546296,,"With Lamarckia aurea, Lasthenia, Claytonia perfoliata, Schismus.",http://cch2.org/portal/collections/individual/index.php?occid=1546296,WW,,1,Total,1,3,1,6,2,,,3.384615385
UCR0077042,4/24/2000,2000,4,24,115,menziesii,Monterey,8.4 miles S of King City along G-14,381,36.06333,-121.185,,,,,cch2,1544469,,Oak woodland.,http://cch2.org/portal/collections/individual/index.php?occid=1544469,WW,overlapping plants skipped ,1,Total,2,3,5,3,1,,,2.857142857
UCR0077042,4/24/2000,2000,4,24,115,menziesii,Monterey,8.4 miles S of King City along G-14,381,36.06333,-121.185,,,,,cch2,1544469,,Oak woodland.,http://cch2.org/portal/collections/individual/index.php?occid=1544469,WW,immature fruits really light,2,Total,3,2,8,6,0,,,2.894736842
UCR0077039,5/8/1989,1989,5,8,128,,Monterey,Los Padres National Forest: Arroyo Seco Rd. between Arroyo Seco Campground and G16,274.02,36.23181,-121.48528,,,,,cch2,1477007,,Roadside.,http://cch2.org/portal/collections/individual/index.php?occid=1477007,WW,some spent flowers have shorter pedicels than flowers but are hollow. stage determined by placement on stem (lower=older),1,Total,6,7,6,1,1,,,2.238095238
UCR0077039,5/8/1989,1989,5,8,128,,Monterey,Los Padres National Forest: Arroyo Seco Rd. between Arroyo Seco Campground and G16,274.02,36.23181,-121.48528,,,,,cch2,1477007,,Roadside.,http://cch2.org/portal/collections/individual/index.php?occid=1477007,WW,,2,Total,6,10,8,3,1,,,2.392857143
UCR0077041,2/28/1993,1993,2,28,59,,Monterey,"Garrapata State Park, off State Hwy 1 (=Pacific Coast Hwy), north of lighthouse at Point Sur and south of Carmel Highlands",300,36.42417,-121.88833,,,,,cch2,1467367,,"Riparian redwood forest along creek channel, coastal sage scrub on steep hillsides and type-converted annual grassland on ridgetops.",http://cch2.org/portal/collections/individual/index.php?occid=1467367,WW,,1,Total,2,2,0,0,0,,,1.5
UCR0077041,2/28/1993,1993,2,28,59,,Monterey,"Garrapata State Park, off State Hwy 1 (=Pacific Coast Hwy), north of lighthouse at Point Sur and south of Carmel Highlands",300,36.42417,-121.88833,,,,,cch2,1467367,,"Riparian redwood forest along creek channel, coastal sage scrub on steep hillsides and type-converted annual grassland on ridgetops.",http://cch2.org/portal/collections/individual/index.php?occid=1467367,WW,,2,Total,0,1,0,0,0,,,2
UCR0077041,2/28/1993,1993,2,28,59,,Monterey,"Garrapata State Park, off State Hwy 1 (=Pacific Coast Hwy), north of lighthouse at Point Sur and south of Carmel Highlands",300,36.42417,-121.88833,,,,,cch2,1467367,,"Riparian redwood forest along creek channel, coastal sage scrub on steep hillsides and type-converted annual grassland on ridgetops.",http://cch2.org/portal/collections/individual/index.php?occid=1467367,WW,,3,Total,4,1,0,0,0,,,1.2
UCR0077041,2/28/1993,1993,2,28,59,,Monterey,"Garrapata State Park, off State Hwy 1 (=Pacific Coast Hwy), north of lighthouse at Point Sur and south of Carmel Highlands",300,36.42417,-121.88833,,,,,cch2,1467367,,"Riparian redwood forest along creek channel, coastal sage scrub on steep hillsides and type-converted annual grassland on ridgetops.",http://cch2.org/portal/collections/individual/index.php?occid=1467367,WW,middle big plant,4,Total,8,2,0,0,0,,,1.2
UCR0077041,2/28/1993,1993,2,28,59,,Monterey,"Garrapata State Park, off State Hwy 1 (=Pacific Coast Hwy), north of lighthouse at Point Sur and south of Carmel Highlands",300,36.42417,-121.88833,,,,,cch2,1467367,,"Riparian redwood forest along creek channel, coastal sage scrub on steep hillsides and type-converted annual grassland on ridgetops.",http://cch2.org/portal/collections/individual/index.php?occid=1467367,WW,,5,Total,0,1,0,0,0,,,2
UCR0077041,2/28/1993,1993,2,28,59,,Monterey,"Garrapata State Park, off State Hwy 1 (=Pacific Coast Hwy), north of lighthouse at Point Sur and south of Carmel Highlands",300,36.42417,-121.88833,,,,,cch2,1467367,,"Riparian redwood forest along creek channel, coastal sage scrub on steep hillsides and type-converted annual grassland on ridgetops.",http://cch2.org/portal/collections/individual/index.php?occid=1467367,WW,,6,Total,1,1,0,0,0,,,1.5
UCR0077041,2/28/1993,1993,2,28,59,,Monterey,"Garrapata State Park, off State Hwy 1 (=Pacific Coast Hwy), north of lighthouse at Point Sur and south of Carmel Highlands",300,36.42417,-121.88833,,,,,cch2,1467367,,"Riparian redwood forest along creek channel, coastal sage scrub on steep hillsides and type-converted annual grassland on ridgetops.",http://cch2.org/portal/collections/individual/index.php?occid=1467367,WW,,7,Total,1,1,0,0,0,,,1.5
UCR0077043,2/27/1948,1948,2,27,58,atomaria,Monterey,"Carmel Highlands, above Yankee Point",213,36.49028,-121.93056,,,,,cch2,1549557,,"Decomposed granite formation. Open sunny slopes, among grass and low, scrubby Eriogonum parvifolium.",http://cch2.org/portal/collections/individual/index.php?occid=1549557,WW,,1,Total,8,9,4,5,1,,,2.333333333
UCR0077043,2/27/1948,1948,2,27,58,atomaria,Monterey,"Carmel Highlands, above Yankee Point",213,36.49028,-121.93056,,,,,cch2,1549557,,"Decomposed granite formation. Open sunny slopes, among grass and low, scrubby Eriogonum parvifolium.",http://cch2.org/portal/collections/individual/index.php?occid=1549557,WW,,2,Total,3,4,1,2,0,,,2.2
UCR0077205,3/27/1967,1967,3,27,86,,Fresno,"Watts Valley Rd., 4 miles north of junction with Trimmer Springs [=Maxson] Rd",412,36.96722,-119.35361,,,,,cch2,1447242,,Foothill woodland.,http://cch2.org/portal/collections/individual/index.php?occid=1447242,WW,,1,Total,3,1,0,0,0,,,1.25
UCR0077205,3/27/1967,1967,3,27,86,,Fresno,"Watts Valley Rd., 4 miles north of junction with Trimmer Springs [=Maxson] Rd",412,36.96722,-119.35361,,,,,cch2,1447242,,Foothill woodland.,http://cch2.org/portal/collections/individual/index.php?occid=1447242,WW,,2,Total,1,1,0,0,0,,,1.5
UCR0077205,3/27/1967,1967,3,27,86,,Fresno,"Watts Valley Rd., 4 miles north of junction with Trimmer Springs [=Maxson] Rd",412,36.96722,-119.35361,,,,,cch2,1447242,,Foothill woodland.,http://cch2.org/portal/collections/individual/index.php?occid=1447242,WW,,3,Total,1,1,0,0,0,,,1.5
UCR0077205,3/27/1967,1967,3,27,86,,Fresno,"Watts Valley Rd., 4 miles north of junction with Trimmer Springs [=Maxson] Rd",412,36.96722,-119.35361,,,,,cch2,1447242,,Foothill woodland.,http://cch2.org/portal/collections/individual/index.php?occid=1447242,WW,,4,Total,4,1,0,0,0,,,1.2
UCR0077205,3/27/1967,1967,3,27,86,,Fresno,"Watts Valley Rd., 4 miles north of junction with Trimmer Springs [=Maxson] Rd",412,36.96722,-119.35361,,,,,cch2,1447242,,Foothill woodland.,http://cch2.org/portal/collections/individual/index.php?occid=1447242,WW,,5,Total,1,1,0,0,0,,,1.5
UCR0077205,3/27/1967,1967,3,27,86,,Fresno,"Watts Valley Rd., 4 miles north of junction with Trimmer Springs [=Maxson] Rd",412,36.96722,-119.35361,,,,,cch2,1447242,,Foothill woodland.,http://cch2.org/portal/collections/individual/index.php?occid=1447242,WW,,6,Total,2,1,0,0,0,,,1.333333333
UCR0077205,3/27/1967,1967,3,27,86,,Fresno,"Watts Valley Rd., 4 miles north of junction with Trimmer Springs [=Maxson] Rd",412,36.96722,-119.35361,,,,,cch2,1447242,,Foothill woodland.,http://cch2.org/portal/collections/individual/index.php?occid=1447242,WW,,7,Total,1,1,0,0,0,,,1.5
UCR0077208,4/23/2002,2002,4,23,113,menziesii,Madera,"Bass Lake Road, 2.2 miles southeast of the junction with CA Hwy 41",976,37.33889,-119.58639,,,,,cch2,1511053,,Pine forest near the south end of Bass Lake.,http://cch2.org/portal/collections/individual/index.php?occid=1511053,WW,all clippings,NA,,,,,,,y,y,#DIV/0!
UCR0077201,3/18/2008,2008,3,18,78,menziesii,Calaveras,"Jesus Maria Road, 2.4 miles southeast of its junction with CA-26; beside Jesus Maria Creek",305,38.28639,-120.66,,,,,cch2,1615620,,Cottonwood creekside area adjacent to oak woodland.,http://cch2.org/portal/collections/individual/index.php?occid=1615620,WW,,1,Total,0,1,0,0,0,,,2
UCR0077201,3/18/2008,2008,3,18,78,menziesii,Calaveras,"Jesus Maria Road, 2.4 miles southeast of its junction with CA-26; beside Jesus Maria Creek",305,38.28639,-120.66,,,,,cch2,1615620,,Cottonwood creekside area adjacent to oak woodland.,http://cch2.org/portal/collections/individual/index.php?occid=1615620,WW,,2,Total,1,1,0,2,0,,,2.75
UCR0077201,3/18/2008,2008,3,18,78,menziesii,Calaveras,"Jesus Maria Road, 2.4 miles southeast of its junction with CA-26; beside Jesus Maria Creek",305,38.28639,-120.66,,,,,cch2,1615620,,Cottonwood creekside area adjacent to oak woodland.,http://cch2.org/portal/collections/individual/index.php?occid=1615620,WW,,3,Total,4,1,0,1,0,,,1.666666667
UCR0077201,3/18/2008,2008,3,18,78,menziesii,Calaveras,"Jesus Maria Road, 2.4 miles southeast of its junction with CA-26; beside Jesus Maria Creek",305,38.28639,-120.66,,,,,cch2,1615620,,Cottonwood creekside area adjacent to oak woodland.,http://cch2.org/portal/collections/individual/index.php?occid=1615620,WW,,4,Total,1,1,0,0,0,,,1.5
UCR0077201,3/18/2008,2008,3,18,78,menziesii,Calaveras,"Jesus Maria Road, 2.4 miles southeast of its junction with CA-26; beside Jesus Maria Creek",305,38.28639,-120.66,,,,,cch2,1615620,,Cottonwood creekside area adjacent to oak woodland.,http://cch2.org/portal/collections/individual/index.php?occid=1615620,WW,,5,Total,1,1,0,0,0,,,1.5
UCR0077201,3/18/2008,2008,3,18,78,menziesii,Calaveras,"Jesus Maria Road, 2.4 miles southeast of its junction with CA-26; beside Jesus Maria Creek",305,38.28639,-120.66,,,,,cch2,1615620,,Cottonwood creekside area adjacent to oak woodland.,http://cch2.org/portal/collections/individual/index.php?occid=1615620,WW,,6,Total,4,1,0,0,0,,,1.2
UCR0077200,4/7/2006,2006,4,7,97,menziesii,Amador,"E of Sacramento, SW of Shenandoah Valley; along Calif. Hwy 49, c. 4.5 mi north of Plymouth",341,38.50778,-120.84861,,,,,cch2,1593356,,Oak woodland.,http://cch2.org/portal/collections/individual/index.php?occid=1593356,"JN, DG","4 plants can be scored; 5th root present but unable to identify plant; hard to decide btwn spent and fruit (immature scored as having darker, swolen receptical, thicker pedicels; not much curving). First plant top left, small",1,Total,1,1,0,0,0,,,1.5
UCR0077200,4/7/2006,2006,4,7,97,menziesii,Amador,"E of Sacramento, SW of Shenandoah Valley; along Calif. Hwy 49, c. 4.5 mi north of Plymouth",341,38.50778,-120.84861,,,,,cch2,1593356,,Oak woodland.,http://cch2.org/portal/collections/individual/index.php?occid=1593356,"JN, DG","top right, medium-sized",2,Total,3,2,1,1,0,,,2
UCR0077200,4/7/2006,2006,4,7,97,menziesii,Amador,"E of Sacramento, SW of Shenandoah Valley; along Calif. Hwy 49, c. 4.5 mi north of Plymouth",341,38.50778,-120.84861,,,,,cch2,1593356,,Oak woodland.,http://cch2.org/portal/collections/individual/index.php?occid=1593356,"JN, DG","bottom left, large, overlapping",3,Total,7,2,5,0,0,,,1.857142857
UCR0077200,4/7/2006,2006,4,7,97,menziesii,Amador,"E of Sacramento, SW of Shenandoah Valley; along Calif. Hwy 49, c. 4.5 mi north of Plymouth",341,38.50778,-120.84861,,,,,cch2,1593356,,Oak woodland.,http://cch2.org/portal/collections/individual/index.php?occid=1593356,"JN, DG","right, large plant (immature scored as having darker, swolen receptical, thicker pedicels; not much curving); shoot on lower right not obviously connected to plant, ommitted",4,Total,2,1,5,5,0,,,3
UCR0077199,4/23/2007,2007,4,23,113,menziesii,Amador,along Bell Road beside Plymouth Creek just east of Calif. Hwy 49 in the vicinity of Enterprise,302,38.54028,-120.84083,,,,,cch2,1604749,,Chaparral with oaks.,http://cch2.org/portal/collections/individual/index.php?occid=1604749,WW,,1,Total,1,3,0,1,0,,,2.2
UCR0077199,4/23/2007,2007,4,23,113,menziesii,Amador,along Bell Road beside Plymouth Creek just east of Calif. Hwy 49 in the vicinity of Enterprise,302,38.54028,-120.84083,,,,,cch2,1604749,,Chaparral with oaks.,http://cch2.org/portal/collections/individual/index.php?occid=1604749,WW,,2,Total,0,1,1,0,0,,,2.5
UCR0077199,4/23/2007,2007,4,23,113,menziesii,Amador,along Bell Road beside Plymouth Creek just east of Calif. Hwy 49 in the vicinity of Enterprise,302,38.54028,-120.84083,,,,,cch2,1604749,,Chaparral with oaks.,http://cch2.org/portal/collections/individual/index.php?occid=1604749,WW,,3,Total,0,1,0,0,0,,,2
UCR0077199,4/23/2007,2007,4,23,113,menziesii,Amador,along Bell Road beside Plymouth Creek just east of Calif. Hwy 49 in the vicinity of Enterprise,302,38.54028,-120.84083,,,,,cch2,1604749,,Chaparral with oaks.,http://cch2.org/portal/collections/individual/index.php?occid=1604749,WW,,4,Total,2,1,1,1,0,,,2.2
UCR0077196,5/22/2010,2010,5,22,142,menziesii,El Dorado,"Perry Creek Road, 0.1 mile south of its junction with Slug Gulch Road, 0.4 mi. northeast of Fairplay",677,38.59528,-120.65361,,,,,cch2,1635471,,Oak area with farm openings and much chaparral.,http://cch2.org/portal/collections/individual/index.php?occid=1635471,WW,,1,Total,15,9,13,8,12,,,2.877192982
UCR0077204,4/20/2006,2006,4,20,110,menziesii,El Dorado,"Between N and Middle forks of Cosumnes River; Junction of Sand Ridge Road and Cutaway Lane, 2.1 mi SW of Somerset",665,38.63194,-120.72222,,,,,cch2,1592486,,Oak woodland and small meadow beside flowing creek.,http://cch2.org/portal/collections/individual/index.php?occid=1592486,WW,,1,Total,9,9,1,0,0,,,1.578947368
UCR0077215,4/1/2015,2015,4,1,91,menziesii,Sonoma,"Stewarts Point-Skaggs Springs Rd, 16.7 miles west of intersection with Rockpile Rd, Wolf Creek drainage",294,38.67225,-123.18592,,,,,cch2,1681815,,"Steep northwest-facing slope, roadcut with eroding shale and brown clay; Quercus garryana woodland, grassland understory, w/ Toxicodendron diversilobum, Ranunculus occidentalis, Lathyrus vestitus, etc.",http://cch2.org/portal/collections/individual/index.php?occid=1681815,WW,,1,Total,13,11,5,8,2,,,2.358974359
UCR0077212,4/13/2013,2013,4,13,103,menziesii,Nevada,"Magnolia Road, 3.0 miles east of its junction with CA-49",495,39.04944,-121.04611,,,,,cch2,1667330,,Low hills with grassy slopes and many oaks.,http://cch2.org/portal/collections/individual/index.php?occid=1667330,WW,,1,Total,15,9,2,1,0,,,1.592592593
UCR0077207,3/30/1997,1997,3,30,89,menziesii,Lake,"Blue Oak Campground, Indian Valley Reservoir. 2.5 mi past intersection of access road and Walker Ridge Road",274,39.07,-122.50861,,,,,cch2,1557903,,,http://cch2.org/portal/collections/individual/index.php?occid=1557903,WW,,1,Total,2,3,0,2,0,,,2.285714286
UCR0077207,3/30/1997,1997,3,30,89,menziesii,Lake,"Blue Oak Campground, Indian Valley Reservoir. 2.5 mi past intersection of access road and Walker Ridge Road",274,39.07,-122.50861,,,,,cch2,1557903,,,http://cch2.org/portal/collections/individual/index.php?occid=1557903,WW,,2,Total,2,2,0,1,0,,,2
UCR0077216,3/8/1997,1997,3,8,67,,Trinity,"Southfork Rd., 12 mi south of Hwy 299",252,40.78878,-123.5585,,,,,cch2,1557500,,"Rocky, grassy S-facing slope, beneath Cercocarpus betuloides.",http://cch2.org/portal/collections/individual/index.php?occid=1557500,WW,top right,1,Total,6,4,2,2,1,,,2.2
UCR0077216,3/8/1997,1997,3,8,67,,Trinity,"Southfork Rd., 12 mi south of Hwy 299",252,40.78878,-123.5585,,,,,cch2,1557500,,"Rocky, grassy S-facing slope, beneath Cercocarpus betuloides.",http://cch2.org/portal/collections/individual/index.php?occid=1557500,WW,middle left,2,Total,7,8,2,3,0,,,2.05
UCR0077216,3/8/1997,1997,3,8,67,,Trinity,"Southfork Rd., 12 mi south of Hwy 299",252,40.78878,-123.5585,,,,,cch2,1557500,,"Rocky, grassy S-facing slope, beneath Cercocarpus betuloides.",http://cch2.org/portal/collections/individual/index.php?occid=1557500,WW,bottom ,3,Total,7,2,3,1,2,,,2.266666667
